article_id,title,link,creator,pubdate,category,description,source,country,article_type,scrape_timestamp
d2c79169d84d14dec5e1703fa8cb9a8c,Why Iran is attacking Gulf energy infrastructure,https://english.khabarhub.com/2026/20/540106/,Khabarhub,2026-03-20T04:45:48Z,Red Sea shipping,"Iran targeted energy facilities across the Middle East on March 18, including the world’s largest liquefied natural gas hub in Qatar, in retaliation for Israeli strikes on an Iranian gas field hours earlier. Iran has gone on to attack other energy facilities …",Khabarhub.com,Unknown,News,2026-03-22T06:55:53.881699Z
2db7431094a37d3ce5856935da1eacb9,Netanyahu Envisions Post‑War Energy Routes Through Israel to Bypass Hormuz as Iran Chokes Global Oil Flows,https://www.breitbart.com/politics/2026/03/19/netanyahu-envisions-post%e2%80%91war-energy-routes-through-israel-to-bypass-hormuz-as-iran-chokes-global-oil-flows/,Joshua Klein,2026-03-20T01:47:18Z,Red Sea shipping,"Israeli Prime Minister Benjamin Netanyahu said Thursday the war with Iran could pave the way for new oil and gas routes across the Arabian Peninsula to Israel’s Mediterranean ports, allowing global energy flows to bypass Iranian threats in the Strait of Hormu…",Breitbart News,Global,News,2026-03-22T06:55:53.881789Z
8a6bf8edb92a9b7abcfaf82bc1dc44d8,Israeli and Iranian strikes on oil and gas facilities rattle global markets,https://www.pbs.org/newshour/show/israeli-and-iranian-strikes-on-oil-and-gas-facilities-rattle-global-markets,"Geoff Bennett, Dan Sagalyn",2026-03-19T22:45:19Z,Red Sea shipping,"To discuss the number of petroleum facilities that have been stuck, and how the countries in the Persian Gulf view the war in Iran, Geoff Bennett spoke with Susan Ziadeh. She served as U.S. ambassador to Qatar during the Obama administration and is now a seni…",PBS,Global,Analysis/Opinion,2026-03-22T06:55:53.881831Z
95011c5f6254fb008934c3584a9b0567,Saudi FM warns patience ‘not unlimited’ as Kingdom reserves right to act against Iran,https://freerepublic.com/focus/f-news/4371348/posts,Arab News,2026-03-19T21:28:39Z,Red Sea shipping,"RIYADH: Saudi Arabia’s Foreign Minister Prince Faisal bin Farhan warned Thursday that the Kingdom’s restraint in the face of escalating Iranian attacks “is not unlimited,” signaling that military action remains on the table — as Arab and Islamic states issued…",Freerepublic.com,Unknown,News,2026-03-22T06:55:53.881882Z
afc479ecc4f94b1f6bd093099465c1fc,Canada joins allies saying they are ready to help end Iran's blockade of Strait of Hormuz,https://www.cbc.ca/news/world/canada-joint-statement-strait-hormuz-9.7135150,,2026-03-19T19:59:14Z,Red Sea shipping,Canada has signed on to a joint statement by the leaders of seven countries calling on Iran to immediately cease all attempts to block the Strait of Hormuz to commercial shipping and expressing a readiness to contribute to efforts to reopen the strait.,CBC News,Unknown,News,2026-03-22T06:55:53.881970Z
e1c65753234d028a0c619aed518f6b80,"War is like a love affair, says EU’s Kallas. It’s hard to get out of.",https://www.politico.eu/article/kaja-kallas-eu-summit-warns-middle-east-war-iran/,Gabriel Gavin,2026-03-19T18:09:02Z,Red Sea shipping,The bloc's top diplomat expressed concerns over a potentially complicated arrangement in the Strait of Hormuz.,POLITICO.eu,Unknown,News,2026-03-22T06:55:53.882086Z
66983c3b70592adc75d848f79a53752b,Why Iran is attacking Gulf energy infrastructure,https://theconversation.com/why-iran-is-attacking-gulf-energy-infrastructure-278815,"Matthew Powell, Teaching Fellow in Strategic and Air Power Studies, University of Portsmouth",2026-03-19T16:27:22Z,Red Sea shipping,Iran’s attacks on Gulf energy infrastructure are part of a broader strategy the regime in Tehran has employed to try and ensure its survival.,The Conversation Africa,Unknown,News,2026-03-22T06:55:53.882159Z
c49b69698f08e753b630b8b4546d398d,"EU leaders balk at joining Middle East fight, grapple with high energy prices",https://www.pbs.org/newshour/world/eu-leaders-balk-at-joining-middle-east-fight-grapple-with-high-energy-prices,"Sam McNeil, Associated Press, Lorne Cook, Associated Press",2026-03-19T15:56:29Z,Red Sea shipping,European leaders doubled down Thursday on refusing to join the United States and Israel military campaigns in the Middle East as they met in Brussels to grapple with rising oil and gas prices caused by the war.,PBS,USA,Market Report,2026-03-22T06:55:53.882177Z
30624d578b5b37cc10d6cbd741828a5a,Get Ready for a Weaker but Nastier Iran,http://foreignpolicy.com/2026/03/19/iran-war-trump-gulf-israel-islamic-republic/,Thomas Juneau,2026-03-19T13:39:20Z,Red Sea shipping,What the war’s most likely outcome means for the United States and the Middle East.,Foreign Policy,USA,News,2026-03-22T06:55:53.882278Z
bfd239c47441c7f2aedd255f518ee5cb,"Europe tells Trump to get lost on Iran, again",https://fortune.com/2026/03/19/europe-wont-help-trump-alliance-iran/,"Sam McNeil, Lorne Cook, The Associated Press",2026-03-19T13:30:25Z,Red Sea shipping,"European leaders have been deeply critical of the Iranian government, but none have offered immediate help to the U.S.",Fortune,Unknown,News,2026-03-22T06:55:53.882308Z
8f03a1953a4dce8589e916c46a84299e,12 Arab and Islamic countries unite to condemn 'heinous' Iranian attacks,https://www.foxnews.com/world/12-arab-islamic-countries-unite-condemn-heinous-iranian-attacks,,2026-03-19T12:31:12Z,Red Sea shipping,"A coalition of 12 Arab and Islamic countries denounces Iran’s attacks on civilian infrastructure, urges restraint, and warns of risks to regional security.",Fox News,Unknown,News,2026-03-22T06:55:53.882353Z
a858b0a0ff93e592ae20fd6e736e7e2f,IRAN HITS MULTIPLE GULF REFINERIES,https://apnews.com/article/iran-iraq-us-israel-trump-march-19-2026-52e94398f2432b3aba9b02b51fbe5000,ap news,2026-03-19T11:00:12Z,Red Sea shipping,Iran is intensifying its attacks on its Gulf Arab neighbors’ energy infrastructure as it hits back following an Israeli attack on its main natural gas field. Thursday strikes set Qatari liquefied natural gas facilities and two Kuwaiti oil refineries ablaze an…,Associated Press,Unknown,News,2026-03-22T06:55:53.882400Z
c7bffa416693ffd5d6df2eb114f6440e,Gulf states have tolerated Iranian strikes so far — but their 'defensive' stance won't last forever,https://www.cnbc.com/2026/03/19/gulf-states-iran-attacks-retaliation-strikes-energy-oil-gas-water-strait-of-hormuz.html,Holly Ellyatt,2026-03-19T10:17:14Z,Red Sea shipping,"Iran's Gulf neighbors have said attacks on energy infrastructure won't ""go unanswered,"" but, so far, they have not hit back at Iran. That stance could change soon.",CNBC,Unknown,News,2026-03-22T06:55:53.882441Z
0daff2bba46325ff191a21f6b3a6e028,India’s oilmeal exports to China surge over 20-fold amid competitive pricing,https://www.thehindubusinessline.com/economy/agri-business/indias-oilmeal-exports-to-china-surge-over-20-fold-amid-competitive-pricing/article70761272.ece,PTI,2026-03-19T10:06:21Z,Red Sea shipping,"India’s oilmeal exports to China surge 20-fold due to competitive pricing, but geopolitical tensions and lifted tariffs on Canadian rapeseed may challenge future shipments.",BusinessLine,China,News,2026-03-22T06:55:53.882461Z
2192e767bc763f5c12a8e77d3c768979,India's oilmeal export to China jumps 20-fold to 7.79 lakh tons in 11 months of FY26: SEA,https://economictimes.indiatimes.com/news/economy/foreign-trade/indias-oilmeal-export-to-china-jumps-20-fold-to-7-79-lakh-tons-in-11-months-of-fy26-sea/articleshow/129675439.cms,PTI,2026-03-19T09:08:22Z,Red Sea shipping,"India's oilmeal exports to China saw a massive jump this fiscal year. Competitive prices and trade policies favored Indian products. However, this advantage is now challenged. Meanwhile, overall oilmeal exports have declined. Geopolitical conflicts are disrup…",The Times of India,China,Market Report,2026-03-22T06:55:53.882477Z
d20da02900822d68b9cd4162684687aa,Iran war: Gas fields become the battlefield. What happens now?,https://economictimes.indiatimes.com/industry/energy/oil-gas/iran-war-gas-fields-become-the-battlefield-what-happens-now/articleshow/129675290.cms,ET Online,2026-03-19T09:07:02Z,Red Sea shipping,The Iran war has entered a dangerous new phase. Energy infrastructure is now a direct target. Attacks on gas fields and refineries are disrupting global supply chains. Brent crude prices have surged. European gas prices have spiked. India faces significant en…,The Times of India,India,Market Report,2026-03-22T06:55:53.882500Z
61a7210da9f7b13af0373ea536fc1fb4,"Iran war leaves deep, costly scar on Mideast energy",https://economictimes.indiatimes.com/news/international/world-news/iran-war-leaves-deep-costly-scar-on-mideast-energy-strait-of-hormuz-middle-east-crude-oil-fujairah-port-gas-red-sea-yanbu/articleshow/129674722.cms,Reuters,2026-03-19T08:47:09Z,Red Sea shipping,"The Iran war has disrupted regional stability and energy markets, with Iran blocking the Strait of Hormuz and targeting infrastructure. This has led to higher oil prices and underscored global economic vulnerability to Middle East disruptions. The conflict is…",The Times of India,Global,Market Report,2026-03-22T06:55:53.882604Z
6a0282ebfe75277579e8117c25555365,EU leaders meet to discuss Iran today - will they leave Trump even more isolated?,https://www.thejournal.ie/european-council-iran-6988514-Mar2026/,Valerie Flynn,2026-03-19T06:44:37Z,Red Sea shipping,Soaring energy prices will be high on the agenda.,TheJournal.ie,Unknown,Market Report,2026-03-22T06:55:53.882629Z
eebe14612e9ff486ee49a07e3d310d4b,European Union summit will focus on Iran war and a loan to Ukraine blocked by Hungary,https://www.clickondetroit.com/news/world/2026/03/19/european-union-summit-will-focus-on-iran-war-and-a-loan-to-ukraine-blocked-by-hungary/,Sam Mcneil And Lorne Cook,2026-03-19T05:44:00Z,Red Sea shipping,European leaders have demanded the reopening of the Strait of Hormuz and a moratorium on strikes on water and energy infrastructure in the Middle East as they met in Brussels to grapple with rising energy prices caused by the war.,WDIV ClickOnDetroit,Ukraine,Market Report,2026-03-22T06:55:53.882743Z
a6566adf6abbf285b7aff8bfba1f390f,"What is South Pars, the Israeli target that escalated the war with Iran?",https://www.abc.net.au/news/2026-03-19/what-is-south-pars-iran-israel-war-gas/106471892,Cason Ho,2026-03-19T02:06:38Z,Red Sea shipping,"The Israeli bombing of Iranian facilities in the South Pars gas field and Iran's retaliation targeting energy infrastructure across the Persian Gulf, mark a significant point of escalation in the US-Israeli war with Iran.",ABC News (AU),Unknown,News,2026-03-22T06:55:53.882942Z
3ae00de3104dd252df56f750d1c627de,Both sides in Iran war step up attacks on energy facilities as oil prices surge,https://www.thehindubusinessline.com/news/world/both-sides-in-iran-war-step-up-attacks-on-energy-facilities-as-oil-prices-surge/article70759712.ece,AP- PTI,2026-03-18T23:03:06Z,Red Sea shipping,"Israel kills Iran intelligence chief, strikes gas field as war escalates. Oil surges above $108 amid attacks on Gulf energy sites and Strait of Hormuz tensions.",BusinessLine,Unknown,Market Report,2026-03-22T06:55:53.882976Z
afcdc8a7bb77cdecab01649298019843,Major Escalation: Iran Vows To Strike Energy Infrastructure After South Pars Attack,https://www.shtfplan.com/war/major-escalation-iran-vows-to-strike-energy-infrastructure-after-south-pars-attack,Mac Slavo,2026-03-18T22:30:19Z,Red Sea shipping,Iran says upstream oil and gas assets are under attack for first time since war began.,Shtfplan.com,Unknown,News,2026-03-22T06:55:53.883058Z
1ab45b2befa4d7a7b9c5baaae9c0c705,Both sides in Iran war ratchet up attacks as oil prices surge,https://www.pbs.org/newshour/world/both-sides-in-iran-war-ratchet-up-attacks-as-oil-prices-surge,"Jon Gambrell, Associated Press, Samy Magdy, Associated Press, Jamey Keaten, Associated Press",2026-03-18T19:44:34Z,Red Sea shipping,"Israel kept up its campaign of targeting Iran's leaders on Wednesday, killing the country's intelligence minister, and an Iranian offshore natural gas field was struck in a sign of the war's mounting pressure – from both sides -- on the region's economic life…",PBS,Unknown,Market Report,2026-03-22T06:55:53.883126Z
12b81fe314df61404e70829cdf39a28f,US aircraft carrier moves away from Iran war for repairs after fire,https://www.cnn.com/2026/03/18/politics/us-ford-carrier-fire-iran-war,Haley Britzky,2026-03-18T19:36:46Z,Red Sea shipping,"The USS Gerald R. Ford aircraft carrier is moving away from operations tied to the Iran war and sailing to the US Navy’s base in Crete for repairs after a fire broke out in the ship’s laundry area last week, a US official said.",CNN,Unknown,News,2026-03-22T06:55:53.883171Z
4f681c746df3edc14d8a6c3c8dd5d4fd,Why does Finland want to get involved in Iran?,https://www.rt.com/news/635442-stubb-finland-iran-ukraine/,RT,2026-03-18T18:21:23Z,Red Sea shipping,"Finnish President Alexander Stubb has said he is willing to support the US war on Iran, if Donald Trump increases aid to Ukraine Read Full Article at RT.com",RT,Ukraine,News,2026-03-22T06:55:53.883193Z
25979eaae3dcd11aa2029602839734f0,The Next Biggest Risk for Oil Markets,https://oilprice.com/Energy/Energy-General/The-Next-Biggest-Risk-for-Oil-Markets.html,RFE/RL staff,2026-03-18T14:00:00Z,Red Sea shipping,"Iran's effective closure of the Strait of Hormuz in response to a massive US-Israel bombing campaign has wreaked havoc on world energy markets and sent oil prices soaring. Things could get even worse, experts say, if passage through the Bab al-Mandab Strait -…",OilPrice.com,Unknown,Market Report,2026-03-22T06:55:53.883343Z
1e6e087fb326227a161e02bfca282e04,Building Bridges in Yemen: A Gulf Opportunity to Stabilize the South,https://www.fairobserver.com/world-news/middle-east-news/building-bridges-in-yemen-a-gulf-opportunity-to-stabilize-the-south/,Abdul Galil Shaif,2026-03-18T13:49:37Z,Red Sea shipping,"The Middle East is undergoing profound geopolitical transformations driven by shifts in global power balances, evolving alliances and intensifying conflicts. While analyst often focuses on the impact of such changes on major regional players, these developmen…",Fair Observer,Global,News,2026-03-22T06:55:53.883391Z
c8e60abe3114ea573941bf92ada0616b,WFP projects food insecurity could reach record levels as a result of Middle East escalation,https://www.globalsecurity.org/military/library/news/2026/03/mil-260317-wfp01.htm,John Pike,2026-03-18T10:50:01Z,Red Sea shipping,The United Nations World Food Programme (WFP) is warning today that the total number of people around the world facing acute levels of hunger could reach record numbers in 2026 if the escalation in the Middle East continues to destabilize the world's economy.,Globalsecurity.org,Unknown,News,2026-03-22T06:55:53.883469Z
cd643d5fea033613fa79e6bc1e092f99,What to know about allies' responses to U.S. demand for Hormuz escorts?,https://www.globalsecurity.org/military/library/news/2026/03/mil-260318-pdo05.htm,John Pike,2026-03-18T10:47:24Z,Red Sea shipping,"U.S. President Donald Trump has repeatedly called on allies to deploy warships to the Strait of Hormuz, a vital shipping lane through which roughly one-fifth of the world's oil flows, as global oil prices spike amid the U.S.-Israeli conflict with Iran.",Globalsecurity.org,Global,Market Report,2026-03-22T06:55:53.883504Z
d7fc3fa30348804cfd89590d30f4ab72,Will Trump Be Able to Stop His Own War?,http://nymag.com/intelligencer/article/will-donald-trump-be-able-to-end-his-iran-war.html,Jonah Shepp,2026-03-18T09:00:04Z,Red Sea shipping,"Almost nothing President Trump has said or done so far suggests he knows what he’s doing in his war with Iran, and he’s about to learn a hard lesson about how difficult they are to end.",New York Magazine,Unknown,News,2026-03-22T06:55:53.883631Z
79efac62fbf09388bb545e6bc4c2f7ff,Hormuz Reopening Looks Unlikely Without a Truce in Iran War,https://financialpost.com/pmn/business-pmn/hormuz-reopening-looks-unlikely-without-a-truce-in-iran-war,Bloomberg News,2026-03-18T08:50:00Z,Red Sea shipping,US President Donald Trump is desperate to reopen the Strait of Hormuz to ease a growing global energy crisis. He won’t achieve that easily without a ceasefire in the war on Iran.,Financial Post,Global,News,2026-03-22T06:55:53.883708Z
46909d3d5a19acae6c3df7188fe6c3a7,Iran Moves Its Own Oil Through Hormuz as It Chokes Other Traffic,https://financialpost.com/pmn/business-pmn/iran-moves-its-own-oil-through-hormuz-as-it-chokes-other-traffic,Bloomberg News,2026-03-18T08:44:50Z,Red Sea shipping,"Iran has been moving its crude through the Strait of Hormuz at rates broadly comparable to transit before the war began, making the most of its control of the vital waterway as other exporters falter.",Financial Post,Unknown,Market Report,2026-03-22T06:55:53.883738Z
94199e5a968a130e61af76cccb3f9e8b,A total of 160 Greek seafarers are in the Middle East,https://en.protothema.gr/2026/03/18/a-total-of-160-greek-seafarers-are-in-the-middle-east/,admin,2026-03-18T08:08:11Z,Red Sea shipping,"The Greek government is closely monitoring the safety of seafarers as attacks on energy facilities in the region increase
The post A total of 160 Greek seafarers are in the Middle East appeared first on ProtoThema English.",Protothema.gr,Greece,News,2026-03-22T06:55:53.883772Z
42c0df634dd2803a438d3c3a3f15fc62,"Why US Navy, the world's most powerful, can't secure a narrow 21-mile gap of Strait of Hormuz: A video explains",https://economictimes.indiatimes.com/news/defence/why-us-navy-the-worlds-most-powerful-cant-secure-a-narrow-21-mile-gap-of-strait-of-hormuz-a-video-explains/articleshow/129647449.cms,ET Online,2026-03-18T05:12:30Z,Red Sea shipping,"Iran is disrupting shipping in the Strait of Hormuz. US President Donald Trump seeks allied help to reopen the vital waterway. Analysts warn this could take months. Iran uses drones, missiles, and mines. Geography favors Iran's defensive tactics. Mass drone p…",The Times of India,Unknown,News,2026-03-22T06:55:53.883825Z
ae605e893cae25c977a4864f6e9e10e7,Hormuz Reopening Looks Unlikely Without a Ceasefire in Iran War,https://www.insurancejournal.com/news/international/2026/03/18/862291.htm,Admin,2026-03-18T05:02:15Z,Red Sea shipping,US President Donald Trump is desperate to reopen the Strait of Hormuz to ease a growing global energy crisis. He won’t achieve that easily without a ceasefire in the war on Iran. Iran’s sporadic attacks on vessels and the threat …,Insurance Journal,Global,News,2026-03-22T06:55:53.883870Z
5e04f9f772a02ca15ef4ffec47c3046e,U.S. Wants to Mass Produce the Drone Design It Stole From Iran,https://gizmodo.com/u-s-wants-to-mass-produce-the-drone-design-it-stole-from-iran-2000734799,Matt Novak,2026-03-17T23:13:19Z,Red Sea shipping,It's all about cost.,Gizmodo.com,Unknown,News,2026-03-22T06:55:53.883912Z
7da209ba7304b1d8896403e0c36da23d,Waiting for Coachella Tickets? What to Know About Ticket Delivery Timelines For Festivals (and Other Concerts),https://www.spinmagazine.com/2026/03/waiting-for-coachella-tickets-what-to-know-about-ticket-delivery-timelines-for-festivals-and-other-concerts/,John D. Luerssen,2026-03-17T17:11:36Z,Red Sea shipping,"You’ve planned all year for your journey to Coachella this April, but you’re in a panic. Your credit card’s been charged for the tickets, and you’re excited to catch The Strokes, Sabrina Carpenter, Karol G, Justin Bieber or any one of the dozens of other acts…",Spinmagazine.com,Unknown,News,2026-03-22T06:55:53.884004Z
595344ff9a569e837ed355648b62da2e,Nobody Wants To Clean Up Trump's Mess In The Strait Of Hormuz,https://www.huffpost.com/entry/countries-helping-strait-hormuz-trump_n_69b96866e4b09852c282ae18,HuffPost,2026-03-17T17:10:20Z,Red Sea shipping,A no-alition of the willing.,HuffPost,Unknown,News,2026-03-22T06:55:53.884028Z
078ecc9115d0cffc20fd70f5980b1957,EU rejects Trump's calls for deployments to reopen Strait of Hormuz,https://www.cbsnews.com/news/iran-war-trump-strait-of-hormuz-european-union-rejects-call-to-send-ships/,"Tucker  Reals, Haley  Ott",2026-03-17T15:28:31Z,Red Sea shipping,"Despite Trump's repeated calls, the EU foreign policy chief says ""nobody is ready to put their people in harm's way in the Strait of Hormuz.""",CBS News,Unknown,News,2026-03-22T06:55:53.884057Z
7a78198ffad4df2279b91a516c76c558,"The Strait of Hormuz, the Drones, and the Debate: How a Middle East Conflict Could Reshape Global Security",https://www.globalresearch.ca/middle-east-conflict-reshape-global-security/5918993,Prof. Ruel F. Pepa,2026-03-17T15:24:25Z,Red Sea shipping,"A widely circulated commentary argued that U.S. President Donald Trump had underestimated Iran’s capacity to retaliate in a conflict.
The post The Strait of Hormuz, the Drones, and the Debate: How a Middle East Conflict Could Reshape Global Security appeared …",Globalresearch.ca,Global,Analysis/Opinion,2026-03-22T06:55:53.884096Z
d06fe68515d4d6443598ab7ef63e8d8d,"Energy War Escalates, but Tehran Quietly Courts Neighbors",https://oilprice.com/Energy/Crude-Oil/Energy-War-Escalates-but-Tehran-Quietly-Courts-Neighbors.html,Tom Kool,2026-03-17T15:00:00Z,Red Sea shipping,"Oil markets are increasingly pricing in a potential long-term disruption as the situation in the Strait of Hormuz chokes exports, overwhelms limited bypass capacity, and exposes Gulf supply routes to escalating attacks. Crude Awakening: When $200 Oil Starts t…",OilPrice.com,Unknown,Market Report,2026-03-22T06:55:53.884142Z
80891f36c53bce6382874a65e2d76470,"Iran blames US, Israel for Hormuz tensions as crisis risks energy supplies",https://www.aljazeera.com/news/2026/3/17/iran-blames-us-israel-for-hormuz-tensions-as-crisis-risks-energy-supplies,Al Jazeera Staff,2026-03-17T13:03:47Z,Red Sea shipping,Iran's Araghchi calls for global condemnation of ‘military aggression’ that disrupted transit through Strait of Hormuz.,Al Jazeera English,Global,News,2026-03-22T06:55:53.884180Z
0263d43ce05b5abaeae06d5a0658f127,"Minister Sa'ar: US had $10 million prize on Larijani's head, we did it for free",https://www.israelnationalnews.com/news/424099,Israel National News,2026-03-17T12:56:40Z,Red Sea shipping,"Sa'ar says Israeli strike killed Larijani, Basij commander; accuses Iran of global terror, repression, and attacks on civilians",Israelnationalnews.com,Global,News,2026-03-22T06:55:53.884212Z
f31393a8e23ae3449da791fd238ab0eb,The Last Great Weed Smuggler,http://www.rollingstone.com/culture/culture-features/harvey-prager-weed-smuggler-1235518138/,Kate Storey,2026-03-17T12:00:00Z,Red Sea shipping,"Before the cartels took over, Harvey Prager built a life on millions of dollars of drug money. One prosecutor called Prager “the last of the great amateurs.” This is his story",Rolling Stone,Unknown,News,2026-03-22T06:55:53.884249Z
aea018d24233ee24bd54395c7b131603,Top E.U. Diplomat on Middle East Conflict: 'This Is Not Europe's War',https://www.breitbart.com/europe/2026/03/17/top-e-u-diplomat-on-middle-east-war-this-is-not-europes-war/,Christian K. Caruzo,2026-03-17T11:54:13Z,Red Sea shipping,"The European Union’s top diplomat, Kaja Kallas, said during a Monday press conference the ongoing war in Iran is ""not Europe's war,"" but noted Europe's interests are ""directly at stake"" as the conflict widens.
The post Top E.U. Diplomat on Middle East Conflic…",Breitbart News,Unknown,News,2026-03-22T06:55:53.884326Z
530ab337bcd184af1be85403fe501e77,Mitsotakis Says Europe Won’t Join Military Efforts Near Iran,https://financialpost.com/pmn/business-pmn/mitsotakis-says-europe-wont-join-military-efforts-near-iran,Bloomberg News,2026-03-17T11:44:05Z,Red Sea shipping,"Prime Minister Kyriakos Mitsotakis said Greece and Europe will not participate in any military operations near Iran, after US President Donald Trump demanded that allies send vessels to help restart shipping through the Strait of Hormuz.",Financial Post,Greece,News,2026-03-22T06:55:53.884365Z
aa91b13492f5372c708992e9cee4be9c,Israel Says It Has Killed Top Iranian Security Official Ali Larijani,https://www.huffpost.com/entry/iran-war-israel-killings_n_69b920ebe4b07119c0bd7736,HuffPost,2026-03-17T09:58:21Z,Red Sea shipping,"The Israeli military also announced it killed Gholam Reza Soleimani, the head of the Revolutionary Guard’s all-volunteer Basij force.",HuffPost,Unknown,News,2026-03-22T06:55:53.884468Z
c6325ddf0659ba49c443b9f53fc58dfe,"‘We’ve knocked out everything’: Trump rejects Iran ceasefire (PHOTOS, VIDEOS)",https://www.rt.com/news/635696-iran-war-live-updates-march-21/,RT,2026-03-21T06:39:39Z,Strait of Hormuz,US President Donald Trump said he was considering “winding down” military operations against Iran but ruled out a ceasefire Read Full Article at RT.com,RT,Unknown,News,2026-03-22T06:55:54.467175Z
8429727da1dfc9de4f21cbb1e289d28d,US pauses sanctions on some of Iran’s oil as gas prices surge,https://www.politico.eu/article/us-pauses-sanctions-on-some-of-irans-oil-as-gas-prices-surge/,Aaron Pellish,2026-03-21T06:35:43Z,Strait of Hormuz,"Washington will allow the sale of Iranian shipments already in transit, U.S. Treasury Secretary Scott Bessent said.",POLITICO.eu,Unknown,Market Report,2026-03-22T06:55:54.467219Z
