article_id,title,link,creator,pubdate,category,description,source,country,article_type,scrape_timestamp
b028f45980f7f79a689c81ba5e9f4b19,Pauline Hanson faces her biggest test yet today - so can she prove she's a real contender for power? PETER VAN ONSELEN,https://www.dailymail.com/news/article-15905743/Pauline-Hanson-press-club-one-nation-surge.html,Peter van Onselen,2026-06-16T22:45:36Z,coal demand,"For three decades, Hanson has survived on the outside of politics but, for the first time, she will speak at the ultimate Canberra insiders club.",Dailymail.com,Unknown,News,2026-06-20T19:39:51.015659Z
a79a72334408831178907c119f8183d0,Taiwan’s Energy Crisis Shows the Cost of Import Dependence,https://oilprice.com/Energy/Energy-General/Taiwans-Energy-Crisis-Shows-the-Cost-of-Import-Dependence.html,Charles Kennedy,2026-06-16T22:00:00Z,coal demand,"The issue of energy dependence and its consequences has, in recent months, become a major topic of discussion. The Hormuz crisis has brought energy security to the political agenda with a vengeance amid fuel price caps, rationing, and warnings of severe short…",OilPrice.com,Unknown,News,2026-06-20T19:39:51.015708Z
3182cfccfc9a43c2128088ca82619c49,Nvidia's Jensen Huang says society needs 'new social norms' in the age of AI,https://japantoday.com/category/tech/ap-exclusive-nvidia%27s-jensen-huang-says-society-needs-%27new-social-norms%27-in-the-age-of-ai,,2026-06-16T21:44:20Z,coal demand,Nvidia CEO Jensen Huang — whose work helped enable artificial intelligence — stressed in an Associated Press interview Tuesday that society has no choice but to change in the advent of AI. Huang has been optimistic about the technology’s potential to rapidly …,Japan Today,Unknown,Analysis/Opinion,2026-06-20T19:39:51.015748Z
73eb7248f0281320a3c8cc06a3425d41,AP Exclusive: Nvidia’s Jensen Huang says society needs ‘new social norms’ in the age of AI,http://www.winnipegfreepress.com/arts-and-life/life/sci-tech/2026/06/16/ap-exclusive-nvidias-jensen-huang-says-society-needs-new-social-norms-in-the-age-of-ai,Josh Boak,2026-06-16T21:15:42Z,coal demand,"SHERMAN, Texas (AP) — Nvidia CEO Jensen Huang — whose work helped propel artificial intelligence — stressed in an Associated Press interview Tuesday that society needs to change with the advent of AI, arguing that a fuller embrace of the technology would impr…",Winnipeg Free Press,Unknown,Analysis/Opinion,2026-06-20T19:39:51.015793Z
35f1d35288492c57017d4dd351303d48,Nvidia CEO Jensen Huang: Society must adapt to artificial intelligence,https://wirehub.medianewsgroup.com/2026/06/16/ap-exclusive-nvidias-jensen-huang-says-society-needs-new-social-norms-in-the-age-of-ai/,Associated Press,2026-06-16T20:23:00Z,coal demand,Nvidia CEO Jensen Huang: Society must adapt to artificial intelligencebostonherald.com,Medianewsgroup.com,Unknown,News,2026-06-20T19:39:51.015823Z
b2dab56aafd7201e44f2c438bcf2d020,Nvidia's Huang says society needs 'new social norms' in age of AI,https://apnews.com/article/nvidea-huang-artificial-intelligence-8334abcbc6ed8d3d7889b640ec6fa05b,Josh Boak,2026-06-16T20:13:03Z,coal demand,Nvidia CEO Jensen Huang — whose work helped enable artificial intelligence — is stressing in an Associated Press interview that society has no choice but to change in the advent of AI. Huang has been optimistic about the technology’s potential to rapidly chan…,Associated Press,Unknown,Analysis/Opinion,2026-06-20T19:39:51.015862Z
73e71827035eef7a3db2857641e7c49c,The Real Competition Behind the U.S Coal Revival,https://wattsupwiththat.com/2026/06/16/the-real-competition-behind-the-u-s-coal-revival/,Guest Blogger,2026-06-16T17:00:00Z,coal demand,"The question is not whether coal remains part of the energy system. It is how the U.S. builds the reliable, affordable and secure energy system needed to support AI, strengthen industry and compete in an increasingly energy-intensive world.
The post The Real …",Wattsupwiththat.com,Unknown,News,2026-06-20T19:39:51.015954Z
d052aa846f3812113732e4e66358f693,Binance says it considers EU license compliant amid reports of potential rejection,https://cointelegraph.com/news/binance-response-mica-european-union-license,Turner Wright,2026-06-16T16:24:39Z,coal demand,"Without specifically calling out a report on Binance’s EU license, the crypto exchange warned that any rejection forcing it to delay activities in the region could “weaken liquidity” and present other potential risks.",Cointelegraph,Unknown,Market Report,2026-06-20T19:39:51.015998Z
4901bceb58ea86e44c96cadfc29819d5,Chinese Refining in May at Lowest Level in Nearly 4 Years,https://www.rigzone.com/news/wire/chinese_refining_in_may_at_lowest_level_in_nearly_4_years-16-jun-2026-183933-article/,Bloomberg News,2026-06-16T16:18:14Z,coal demand,"The question for the market, now that a deal has been reached to reopen Hormuz, is whether Chinese demand for fuels like gasoline will normalize, or whether the rapid transport electrification has permanently dented consumption.",Rigzone,China,Market Report,2026-06-20T19:39:51.016008Z
6eb18bd41513d3c62eb7ec783939a9f8,Why Low Energy Nuclear Reactions Will Set Humanity Free – And Why It Matters In YOUR Life,https://www.activistpost.com/why-low-energy-nuclear-reactions-will-set-humanity-free-and-why-it-matters-in-your-life/,Editor,2026-06-16T16:05:00Z,coal demand,"A Technology That Could Change Everything After years of following low energy nuclear reactions (LENR), I have watched the conversation shift from mockery to serious investment. LENR is arguably the most important development for human freedom I have ever wit…",Activistpost.com,Unknown,News,2026-06-20T19:39:51.016058Z
4fc366e5b46e0ee6215d3c996575950f,Hormuz Reopens as Traders Price Out the War Premium,https://oilprice.com/Energy/Energy-General/Hormuz-Reopens-as-Traders-Price-Out-the-War-Premium.html,Tom Kool,2026-06-16T16:05:00Z,coal demand,"The U.S.-Iran agreement to reopen Hormuz and lift the maritime blockade has pushed oil below $80, though risks remain if tensions in Lebanon escalate. China Slams the Brakes on Crude Refining - China’s crude throughput has plunged by a hefty 9.1% year-over-ye…",OilPrice.com,China,News,2026-06-20T19:39:51.016079Z
9dd73b8769c3d775705f54693c7eab8f,How Is Ameren's Stock Performance Compared to Other Utilities Stocks?,https://www.barchart.com/story/news/2497233/how-is-ameren-s-stock-performance-compared-to-other-utilities-stocks,Sohini Mondal,2026-06-16T15:38:53Z,coal demand,"While Ameren has lagged behind its peers over the past year, Wall Street analysts remain moderately optimistic about the stock’s prospects.",Barchart.com,Unknown,News,2026-06-20T19:39:51.016117Z
021cbfa9e29c798bd04c9db3bd25c0c5,Hollywood’s Mass Exodus: Why Film and TV Production Is Fleeing L.A. and What Can Be Done About It,https://variety.com/2026/tv/features/hollywoods-exodus-film-tv-production-los-angeles-1236780390/,William Earl,2026-06-16T15:00:00Z,coal demand,"“Baywatch” was a staple of low-budget, first-run syndication in the 1990s, as natural to Los Angeles as David Hasselhoff’s chest hair and as defining of the city in that era as the O.J. trial and the Sunset Strip. By the time it ended its run in 1999, it had …",Variety,Unknown,News,2026-06-20T19:39:51.016167Z
e9dcfa749b3b9b51d60b30e9ac695eb6,"Global fossil fuel use must HALVE by 2035 to avoid catastrophic climate damage, scientists claim",https://www.dailymail.com/sciencetech/article-15903673/fossil-fuel-HALVE-2035-catastrophic-climate.html,Shivali Best,2026-06-16T14:08:19Z,coal demand,"The report, by Climate Analytics, looked at the measures that need to be taken to keep global warming below 1.5°C by the end of the century.",Dailymail.com,Global,Market Report,2026-06-20T19:39:51.016202Z
7ba1fe0ec46d239f1986c01ab85a59c0,How to sustain solar energy growth sans curtailments,https://www.thehindubusinessline.com/opinion/how-to-sustain-solar-energy-growth-sans-curtailments/article71109633.ece,Alok  Kumar,2026-06-16T13:56:10Z,coal demand,Steps need to taken in advance for increasing the demand for electricity particularly in solar hours,BusinessLine,Unknown,News,2026-06-20T19:39:51.016231Z
fb08e462e5aa7666cb8aa77747a71477,GIC Re offer for sale subscribed 3.72 times on day 1; govt to offer additional 3% stake,https://www.livemint.com/companies/news/gic-re-offer-for-sale-subscribed-3-72-times-on-day-1-govt-to-offer-another-3-11781614436658.html,Dhirendra Kumar,2026-06-16T13:46:20Z,coal demand,"The expanded 5% divestment could raise up to  ₹3,075 crore for the Centre as the bidding shifts to retail investors and employees on Wednesday.",Livemint,Unknown,News,2026-06-20T19:39:51.016270Z
135b3e945771fc5d763797d72c2fe5dd,"CleanChoice Energy Continues to Make Renewable Energy More Accessible, Expands Into Maine, New Hampshire and Rhode Island",https://www.globenewswire.com/news-release/2026/06/16/3312694/0/en/CleanChoice-Energy-Continues-to-Make-Renewable-Energy-More-Accessible-Expands-Into-Maine-New-Hampshire-and-Rhode-Island.html,CleanChoice Energy,2026-06-16T13:01:00Z,coal demand,"CleanChoice Energy Expands Into Maine, New Hampshire and Rhode Island...",GlobeNewswire,Unknown,News,2026-06-20T19:39:51.016302Z
e69e8dc7eb229aa6bf45816507ab707b,"A New Coal Plant in the U.S.? Once Unthinkable, Now a Strong Maybe",https://www.powermag.com/a-new-coal-plant-in-the-u-s-once-unthinkable-now-a-strong-maybe/,Aaron Larson,2026-06-16T11:59:37Z,coal demand,"A $350 million Department of Energy (DOE) coal-revival program has put $18.5 million toward the TerraSpark Energy Campus, a 1.6-GW greenfield project in West...",POWER magazine,Unknown,News,2026-06-20T19:39:51.016334Z
2822e8b55764049fdcb55677485d8b91,'Google will pay for 100% of the power it uses': Google pledges $1.5 billion to expanding Alabama data center and paying for its energy cost,https://www.techradar.com/pro/google-will-pay-for-100-percent-of-the-power-it-uses-google-pledges-usd1-5-billion-to-expanding-alabama-data-center-and-paying-for-its-energy-cost,Mike Moore,2026-06-16T11:05:00Z,coal demand,Google plans major expansion of Alabama data center campus - which could be backed up with nuclear power.,TechRadar,Unknown,News,2026-06-20T19:39:51.016368Z
d18d31715f9dd1e93996c8d707806c86,"In May 2008, months before the global financial crisis tore through commodity markets, Nathan Tinkler cashed out $422 million — one of the best-timed bets in Australian history",https://spacedaily.com/j-in-may-2008-months-before-the-global-financial-crisis-tore-through-commodity-markets-nathan-tinkler-cashed-out-422-million-one-of-the-best-timed-bets-in-australian-history/,Space Daily Editorial Team,2026-06-16T10:59:16Z,coal demand,"Nathan Tinkler bought a Queensland coal tenement for $1 million in 2006 against his Newcastle house, then sold it to Macarthur Coal for $422 million in May 2008 — weeks before the global financial crisis wiped 60 per cent off thermal coal prices. What he did …",Space Daily,Australia,Market Report,2026-06-20T19:39:51.016404Z
1ce5f2e25023888404d1c571eec63993,India seeking Siberian rare earth samples – Reuters,https://www.rt.com/india/641662-india-rare-earth-siberia/,RT,2026-06-16T10:32:33Z,coal demand,India is exploring rare earth supplies from Russia’s Tomtor deposit in Siberia as it seeks to reduce dependence on China and secure critical minerals for future demand,RT,China,News,2026-06-20T19:39:51.016424Z
2eb4317f8945c8c33937c429594119a1,"Sensex today | Stock Market Highlights: Sensex gains 544 pts, Nifty settles at 23,989 on US-Iran peace deal",https://www.thehindubusinessline.com/markets/sensex-nifty50-today-stock-market-highlights-16-june-2026/article71104678.ece,"Team BL, KS Badri Narayanan",2026-06-16T10:24:35Z,coal demand,"Sensex, Nifty, Share Prices Highlights: Indian shares closed higher on Tuesday, advancing for a ​third straight session, as a preliminary U.S.-Iran peace deal ‌cooled oil prices and improved risk appetite.",BusinessLine,India,Market Report,2026-06-20T19:39:51.016444Z
dfa62fa5c51e7d97a7d4c3d37628c7ba,"Bitcoin doesn't need Ethereum-style yield, says Strategy's Michael Saylor",https://cointelegraph.com/news/strategy-saylor-bitcoin-credit-alternative-crypto-yield,Helen Partz,2026-06-16T10:11:18Z,coal demand,"Michael Saylor says Bitcoin does not need staking or inflation, outlining a five-layer “Digital Asset Stack” that generates returns through credit and equity products built around BTC.",Cointelegraph,Unknown,Market Report,2026-06-20T19:39:51.016485Z
3777a68bfc63905bce586f234c72eba0,REE Corp. chair Nguyen Thi Mai Thanh spent 40 years navigating Vietnam’s economy. Here’s what she thinks comes next,https://fortune.com/2026/06/16/ree-corporation-founder-nguyen-thi-mai-thanh-vietnam-southeast-asia-500/,Nicholas Gordon,2026-06-16T10:00:00Z,coal demand,"Nguyen Thi Mai Thanh spent the Vietnam War working as a medic. She's since been at the forefront of Vietnam's transformation, including leading the first company to privatize and publicly list.",Fortune,Unknown,News,2026-06-20T19:39:51.016533Z
f8bb9536f5b26bc9246bf874f5bf1498,"Iran war is a 'wake-up call' for Southeast Asia's energy sector, report says",https://economictimes.indiatimes.com/news/international/world-news/iran-war-is-a-wake-up-call-for-southeast-asias-energy-sector-report-says/articleshow/131766929.cms,AP,2026-06-16T09:43:23Z,coal demand,A war in Iran has highlighted significant energy risks for Southeast Asia. The region faces a potential tripling of its energy import bill by 2035 if it does not quickly diversify energy sources. The International Energy Agency report urges immediate reforms …,The Times of India,Global,Market Report,2026-06-20T19:39:51.016578Z
465c54eaa0d8d357ac97f20c7f27ccab,Global commodity prices likely to remain elevated amid easing West Asia tensions; India's WPI seen at 7-8% in FY27: Report,https://economictimes.indiatimes.com/news/economy/indicators/global-commodity-prices-likely-to-remain-elevated-amid-easing-west-asia-tensions-indias-wpi-seen-at-7-8-in-fy27-report/articleshow/131766564.cms,ANI,2026-06-16T09:23:49Z,coal demand,"Global commodity prices will stay high in coming months. Geopolitical tensions in West Asia and bad weather affecting crops are the main reasons. Supply chains will take time to recover even after conflicts end. This will impact energy, metals, fertilizers, a…",The Times of India,India,Market Report,2026-06-20T19:39:51.016601Z
4ae76b73329390bcfbb010b61e3bb8ac,"Millionaires on the Move: Winners, Losers, and the Global Competition for Wealth in 2026",https://www.prnewswire.com/news-releases/millionaires-on-the-move-winners-losers-and-the-global-competition-for-wealth-in-2026-302799093.html,,2026-06-16T08:00:00Z,coal demand,"LONDON, June 16, 2026 /PRNewswire/ -- Singapore, Italy, Switzerland, Greece, Hong Kong, and New Zealand are emerging as some of the most attractive destinations for internationally mobile wealth in 2026 , while the United Kingdom, Germany, France, Norway, and…",PRNewswire,Singapore,News,2026-06-20T19:39:51.016636Z
cd4e547b121d0695f9384c70e483fd31,"Iran war is a 'wake-up call' for Southeast Asia's energy sector, report says",https://abcnews.com/International/wireStory/iran-war-wake-call-southeast-asias-energy-sector-133912533,ANTON L. DELGADO Associated Press,2026-06-16T07:41:56Z,coal demand,The International Energy Agency says Southeast Asia’s power sector is too open to risks from its dependence on imports of oil and gas from a limited number of suppliers,Abcnews.com,Global,Market Report,2026-06-20T19:39:51.016678Z
5e80ac0a4e40167c60394482109c40a2,'It's Come To This': Gas Shortages Hit Russia As Ukraine Hits Refineries,https://www.rferl.org/a/russia-gasoline-fuel-crisis-refinery-attacks-ukraine/33784529.html,"RFE/RL's Russian Service, Current Time, Steve Gutterman",2026-06-19T14:19:30Z,grain exports,"Pulling up at a gas station with no fuel for sale, a Russian woman is aghast: “What’s going on in this country?” What’s going on is that in the fifth year of the full-scale invasion, Ukraine is fighting back with strikes on oil refineries, part of a bid to br…",Radio Free Europe/ Radio Liberty,Russia,News,2026-06-20T19:39:51.263886Z
0fa398f0ddbad3b2996dc45db1b7626e,"Facing African hurdles, Indian rice exports value down 10% in FY26",https://www.thehindubusinessline.com/economy/agri-business/facing-african-hurdles-indian-rice-exports-value-down-10-in-fy26/article71122372.ece,Subramani Ra Mancombu,2026-06-19T13:38:47Z,grain exports,"Indian rice exports value declines 10% in FY26 due to African market challenges, despite a 6.5% volume increase.",BusinessLine,India,Market Report,2026-06-20T19:39:51.263909Z
4e2681e86cece36e5717e48d7ad94490,'It's Come To This': Gas Shortages Hit Russia As Ukraine Hits Refineries,https://www.globalsecurity.org/wmd/library/news/ukraine/2026/06/ukraine-260619-rferl02.htm,John Pike,2026-06-19T12:00:00Z,grain exports,"In southeastern Russia, Daniil's motorboat rental business is in trouble. Restrictions on fuel sales mean his fleet in the Rostov and Krasnodar regions is idle, he said in a social media post: ""At every gas station, they tell me to f*** off.""",Globalsecurity.org,Russia,News,2026-06-20T19:39:51.263937Z
acf421a22330894c8942ae659a58b84e,Ample world inventories may soften El Nino food supply shock,https://economictimes.indiatimes.com/news/economy/agriculture/ample-world-inventories-may-soften-el-nino-food-supply-shock/articleshow/131846461.cms,Reuters,2026-06-19T04:11:35Z,grain exports,"A potential super El Niño is expected to disrupt global weather patterns and threaten agricultural output in the coming months, but large existing food inventories and strong harvests in key producing regions may soften the impact.",The Times of India,Global,News,2026-06-20T19:39:51.263980Z
28922184f2910054ce1883553ded0827,"Roto Riteup: June 18, 2026",https://fantasy.fangraphs.com/roto-riteup-june-18-2026/,Vlad Sedler,2026-06-18T07:11:08Z,grain exports,"Roto Riteup time, let's rock!
Source",Fangraphs.com,Unknown,News,2026-06-20T19:39:51.264006Z
aabb61e3d6956fc8793039f1048fbfe8,Farm Equipment Market worth $181.67 billion by 2033 | MarketsandMarkets™,https://www.prnewswire.com/news-releases/farm-equipment-market-worth-181-67-billion-by-2033--marketsandmarkets-302803016.html,,2026-06-17T11:12:00Z,grain exports,"DELRAY BEACH, Fla., June 17, 2026 /PRNewswire/ -- According to MarketsandMarkets™, the Farm Equipment Market is projected to grow from USD 133.48 billion in 2026 to USD 181.67 billion by 2033, at a CAGR of 4.5%. Browse 231 market data Tables and 370 Figures s…",PRNewswire,Unknown,Market Report,2026-06-20T19:39:51.264105Z
5fb3f24ef2162733131a86f5138fba1f,Cutting Data Pipeline Costs and Data Freshness Issues With Netflix Maestro and Apache Iceberg: A Practical Tutorial,https://dzone.com/articles/netflix-maestro-apache-iceberg,Intiaz Shaik,2026-06-16T16:00:01Z,grain exports,"Analytics pipelines tend to scale in both cost and the age of their data sources: costs increase with data volume growth, while data freshness decreases due to longer batch jobs. The common approach, scaling out the cluster, addresses the symptom rather than …",Dzone.com,Unknown,News,2026-06-20T19:39:51.264159Z
557cba9ad817f13b2efc9724d7141954,India's rice stocks climb to record high; wheat inventories at five-year peak,https://economictimes.indiatimes.com/news/economy/agriculture/indias-rice-stocks-surge-to-all-time-high-as-wheat-inventories-reach-5-year-peak/articleshow/131771952.cms,Reuters,2026-06-16T12:19:27Z,grain exports,"India's government warehouses hold record rice stocks, up 15% from last year. Wheat inventories are at a five-year peak. These abundant reserves will support increased rice exports. Higher wheat stocks will help manage prices by allowing open market sales. Re…",The Times of India,India,Market Report,2026-06-20T19:39:51.264180Z
6dd3b43e620158f475b73bc00b6614a0,Țoiu holds talks with egyptian counterpart: Romania sees real opportunities to deepen cooperation,https://www.mediafax.ro/english/toiu-holds-talks-with-egyptian-counterpart-romania-sees-real-opportunities-to-deepen-cooperation-23756402,Alexandra-Valentina Dumitru,2026-06-16T11:24:51Z,grain exports,"Acting Minister of Foreign Affairs Oana Țoiu met with her Egyptian counterpart, Badr Abdelatty, and they discussed expanding economic cooperation, increasing Romanian grain exports, and the project for a free economic zone dedicated to Romanian companies.",Mediafax.ro,Egypt,News,2026-06-20T19:39:51.264225Z
e31765d31bed20ce191feea701d1d5d5,Excerpt from “The Geopolitics of Resource Wars”,https://energyskeptic.com/2026/excerpt-from-the-geopolitics-of-resource-wars/,energyskeptic,2026-06-16T08:58:30Z,grain exports,"Preface.  This is an excerpt from Philippe Le Billon’s (editor) anthology “The Geopolitics of Resource Wars.”  The coming energy crisis and climate change are likely to trigger resource wars as nations  sink into starvation and poverty. Indeed, this is alread…",Energyskeptic.com,Unknown,News,2026-06-20T19:39:51.264272Z
875726d43aee05dc5bcedb959c710f3e,"India’s Record Crops Reject Food, Warming Alarmism",https://wattsupwiththat.com/2026/06/15/indias-record-crops-reject-food-warming-alarmism/,Guest Blogger,2026-06-15T17:00:00Z,grain exports,"Ours is an agricultural golden age. The air is richer in the compound that gives plants life. The weather is more conducive to growing food than it has been in centuries. The fabricated doomsday scenarios of the climate industrial complex are ludicrous.
The p…",Wattsupwiththat.com,India,News,2026-06-20T19:39:51.264298Z
5b3fcc13d31b915e5789ac423b789e29,Michael Hudson: Debts That Cannot Be Paid Won’t Be,https://www.nakedcapitalism.com/2026/06/michael-hudson-debts-that-cannot-be-paid-wont-be.html,Yves Smith,2026-06-13T08:25:55Z,grain exports,"R. C. J. Cranstoun spoke with Michael Hudson on debt, rentierism, and the geopolitical rift around sanctions, energy, and the dollar system",Nakedcapitalism.com,Unknown,News,2026-06-20T19:39:51.264396Z
218ed637faabc4ea366fb34b566dd659,India must improve oilseed yields to reduce imports: SEA chief,https://www.thehindubusinessline.com/economy/agri-business/india-must-improve-oilseed-yields-to-reduce-imports-sea-chief/article71112539.ece,BL Mangaluru Bureau,2026-06-17T08:16:55Z,soybean exports,"It should tap the potential of cottonseed oil, ricebran oil, and other alternatives, if it aims to reduce imports in the coming years, says Sanjeev Asthana",BusinessLine,India,News,2026-06-20T19:39:51.791772Z
c5bbfd0865ab64f6ca89b7926aa00ac7,Soaring US beef prices likely to rise further thanks to trade tensions and disease outbreaks,https://theconversation.com/soaring-us-beef-prices-likely-to-rise-further-thanks-to-trade-tensions-and-disease-outbreaks-284813,"Andrew Muhammad, Professor of Agricultural Economics and Blasingame Chair of Excellence, University of Tennessee, Charles Martinez, Assistant Professor of Agricultural and Resource Economics",2026-06-16T18:54:14Z,soybean exports,"The tightly integrated North American beef market, under pressure from drought and the spread of the screwworm, could get further roiled by trade uncertainty.",The Conversation Africa,USA,Market Report,2026-06-20T19:39:51.791791Z
693a8eb2469c18f1d862de9b19e4f81c,Soybeans Fading off Early Weakness with Midday Gains,https://www.barchart.com/story/news/2498933/soybeans-fading-off-early-weakness-with-midday-gains,Austin Schroeder,2026-06-16T17:08:25Z,soybean exports,Soybeans are holding on to the day session opening gains after overnight weakness. Trade shot higher at the 8:30 am CDT open with midday gains of 8 to 11 cen...,Barchart.com,Unknown,News,2026-06-20T19:39:51.791825Z
f632fcf32dbaaaf35741108ce298ce2d,India’s soyabean imports may touch a record 9 lakh tonnes for oil year 2025-26,https://www.thehindubusinessline.com/economy/agri-business/indias-soyabean-imports-may-touch-a-record-9-lakh-tonnes-for-oil-year-2025-26/article71104843.ece,Vishwanath Kulkarni,2026-06-15T13:15:06Z,soybean exports,"India's soyabean imports could reach a record 9 lakh tonnes in 2025-26 due to domestic supply shortfalls, estimates show.",BusinessLine,India,News,2026-06-20T19:39:51.791866Z
8d1513031fe65e05542e66948c7c388f,"India’s agri export promotion shifting to value added products, niche markets",https://www.thehindubusinessline.com/economy/agri-business/indias-agri-export-promotion-shifting-to-value-added-products-niche-markets/article71118168.ece,BL New Delhi Bureau,2026-06-18T15:28:03Z,wheat exports,"India's agri exports are diversifying, focusing on value-added products and niche markets for global competitiveness.",BusinessLine,India,Market Report,2026-06-20T19:39:52.036327Z
093b05c3ab135e6d28d1525b9d11c204,Wheat Posting Mixed Action at Midday,https://www.barchart.com/story/news/2477017/wheat-posting-mixed-action-at-midday,Austin Schroeder,2026-06-15T17:20:37Z,wheat exports,The wheat complex is trading with mixed action on Monday. Chicago SRW contracts are up 2 to 3 cents so far on the day. KC HRW futures are showing steady to p...,Barchart.com,Unknown,Market Report,2026-06-20T19:39:52.036457Z
f42c5696517af7e2180575abdcc796dc,India’s fertiliser subsidy model is broken; direct income support is the only way forward: Ashok Gulati,https://economictimes.indiatimes.com/news/economy/agriculture/indias-fertiliser-subsidy-model-is-broken-direct-income-support-is-the-only-way-forward-ashok-gulati/articleshow/131734749.cms,Ashish Pandey,2026-06-15T05:55:20Z,wheat exports,"India’s fertiliser subsidy regime is facing scrutiny; rising global fertiliser and energy prices and rising fiscal pressures expose its inefficiencies, says Ashok Gulati.",The Times of India,India,Market Report,2026-06-20T19:39:52.036511Z
