article_id,title,link,creator,pubdate,category,description,source,country,article_type,scrape_timestamp
fb0dd1998734a03afde159850a6ca34d,Pure Cycle Q2 Earnings Call Highlights,https://www.marketbeat.com/instant-alerts/pure-cycle-q2-earnings-call-highlights-2026-04-09/?utm_source=yahoofinance&amp;utm_medium=yahoofinance,MarketBeat,2026-04-09T14:05:03Z,charter rates,"Pure Cycle (NASDAQ:PCYO) executives pointed to strong first-half results and accelerated development activity at the company’s Sky Ranch community, aided by ...",MarketBeat,Unknown,News,2026-04-16T07:51:27.430440Z
6974bb6850f29ed25edf743b9ae406b4,US shuts down Iran's maritime trade despite optimism for more talks,https://www.channelnewsasia.com/world/strait-hormuz-iran-war-maritime-trade-6057596,,2026-04-15T06:26:37Z,maritime transport,"""I think a deal is preferable because then they can rebuild,"" says US President Donald Trump.",CNA,Unknown,News,2026-04-16T07:51:28.276509Z
4da4ede80234b18270f5fe374bce68a0,Navios Maritime Partners receives two new tankers,https://www.naftemporiki.gr/english/2098186/navios-maritime-partners-receives-two-new-tankers/,Γιάννα Βαρδαλαχάκη,2026-04-15T06:09:42Z,maritime transport,"Navios Maritime Partners, led by Angeliki Frangou, has taken delivery of two new tankers.
According to a company announcement, the newly built tanker “Nave Equator” has been delivered, while its…
Navios Maritime Partners receives two new tankers - Η ΝΑΥΤΕΜΠΟΡ…",Naftemporiki.gr,Unknown,News,2026-04-16T07:51:28.276757Z
0ebc459c0887a9a6ccbd2ad0fdb6512e,China Accelerates Central Asian Energy Corridors as Hormuz Disruption Continues,https://www.naturalnews.com/2026-04-15-china-accelerates-central-asian-energy-corridors.html,Douglas Harrington,2026-04-15T06:00:00Z,maritime transport,"Introduction Ongoing military operations in the Strait of Hormuz have disrupted a critical chokepoint for global energy transit, forcing major economies to urgently diversify supply routes. According to reports, the strait carries roughly one-fifth of the wor…",Naturalnews.com,China,Market Report,2026-04-16T07:51:28.276776Z
fc5d5caab0d0240a1efa7676af4b1aca,"IMF Report Warns of Global Economic Slowdown, Inflationary Risks Following Regional Conflict",https://www.naturalnews.com/2026-04-15-imf-report-warns-global-economic-slowdown-inflation.html,Sterling Ashworth,2026-04-15T06:00:00Z,maritime transport,"IMF Forecast Revises Global Growth Downward Amid Regional Conflict The International Monetary Fund (IMF) has revised its global economic growth forecast downward, citing a regional military conflict as a primary contributing factor to instability. Its latest …",Naturalnews.com,Global,Analysis/Opinion,2026-04-16T07:51:28.276822Z
485d26afb9ceb152ce17e7459466e299,Net Zero Emissions: 27 shipping companies call for a review of the NZF Framework,https://www.naftemporiki.gr/english/2098176/net-zero-emissions-27-shipping-companies-call-for-a-review-of-the-nzf-framework/,Αλεξία Σωτηρίου,2026-04-15T05:16:53Z,maritime transport,"The maritime community is once again turning its attention to the Net-Zero Framework, which is set to be reviewed in October.
Although the war in Iran has captured global attention—particularly…
Net Zero Emissions: 27 shipping companies call for a review of t…",Naftemporiki.gr,Global,Analysis/Opinion,2026-04-16T07:51:28.276888Z
314b973661898cfea4a1778d753836ce,US shuts down Iran’s maritime trade despite optimism for more talks,https://www.thehindubusinessline.com/news/world/us-shuts-down-irans-maritime-trade-despite-optimism-for-more-talks/article70863863.ece,Reuters,2026-04-15T05:02:26Z,maritime transport,"More vessels are being turned back under the US blockade on Iranian ports, including a US-sanctioned and Chinese-owned tanker Rich Starry that was making its way back to the Strait of Hormuz after exiting the Persian Gulf",BusinessLine,China,News,2026-04-16T07:51:28.276912Z
b03d357e645600cfc5a6ce9c92fef1eb,Modi’s Silence: How India Submits to Washington Taking Everything,https://original.antiwar.com/pieter-j-friedrich/2026/04/14/modis-silence-how-india-submits-to-washington-taking-everything/,Pieter J. Friedrich,2026-04-15T00:00:40Z,maritime transport,"In early March, a U.S. submarine torpedoed an Iranian warship in the Indian Ocean. The ship, a frigate called the IRIS Dena, had been docked at an Indian port just days earlier – an invited guest at India’s flagship multinational naval exercise. It had partic…",Antiwar.com,India,News,2026-04-16T07:51:28.276941Z
3d4add229b9f09e0cd6320c33ae5efc2,Europe’s Electrification Dream Is Hitting a Wall,https://oilprice.com/Energy/Energy-General/Europes-Electrification-Dream-Is-Hitting-a-Wall.html,Gisele Widdershoven,2026-04-14T22:00:00Z,maritime transport,"The message given by Ursula von der Leyen to electrify the European economy is strategically coherent, politically appealing, and, on the surface, even unavoidable. It will be the real deal to decarbonize industry and power transport, reduce dependence on imp…",OilPrice.com,Unknown,News,2026-04-16T07:51:28.276991Z
7c0f6583d97800d9af2c7490d6eaabe3,Biofuels could bolster fuel security but we export what we need to make them,https://www.abc.net.au/news/2026-04-15/biofuels-potential-to-bolster-australias-fuel-security/106511646,Daniel Ziffer,2026-04-14T19:03:58Z,maritime transport,Australia controls less than 20 per cent of our liquid fuel supply and relies on imports for the other 80-plus per cent we need to keep the nation moving. But proponents of biofuels argue that it does not need to be this way.,ABC News (AU),Australia,News,2026-04-16T07:51:28.277018Z
676c02069021c6d98a27e1abb9be27a0,Why is Trump making the global energy crisis worse?,https://www.rt.com/news/638398-us-naval-blockade-iran/,RT,2026-04-14T14:57:04Z,maritime transport,"The US has announced a naval blockade of Iran after inconclusive peace talks, further disrupting global energy trade Read Full Article at RT.com",RT,Global,News,2026-04-16T07:51:28.277051Z
5bb9fae66120b99c29d4bef2c520d9b1,"New weakening China trade and US inflation data means Iran economic contagion is spreading, in unique setup for Bitcoin",https://cryptoslate.com/bitcoin-eyes-bullish-setup-as-new-china-trade-and-us-inflation-data-means-irans-economic-contagion-shock-is-already-spreading/,Liam 'Akiba' Wright,2026-04-14T14:10:49Z,maritime transport,"Iran conflict is already disrupting the hidden plumbing of global trade The market spent the first phase of the Iran conflict watching crude. That was the visible layer. The more consequential shift is happening deeper in the system, where shipping, gas, fert…",CryptoSlate,China,Market Report,2026-04-16T07:51:28.277096Z
86956939ba5adcbabc567a047f3d413f,Bloomberg: Tehran considers temporary halt of transport through Hormuz to support peace talks,https://en.protothema.gr/2026/04/14/bloomberg-tehran-considers-temporary-halt-of-transport-through-hormuz-to-support-peace-talks/,admin,2026-04-14T12:49:30Z,maritime transport,"Iran attempts to avoid escalation with the US amid Trump's naval blockade - Oil prices fall after reports of possible de-escalation
The post Bloomberg: Tehran considers temporary halt of transport through Hormuz to support peace talks appeared first on ProtoT…",Protothema.gr,Unknown,Market Report,2026-04-16T07:51:28.277140Z
48a752dda3f86a65b430151c5cf2a1ab,"How much will US Hormuz blockade hurt Iran, and does Tehran have an escape?",https://www.aljazeera.com/news/2026/4/14/how-much-will-us-hormuz-blockade-hurt-iran-and-does-tehran-have-an-escape,Priyanka Shankar,2026-04-14T12:31:34Z,maritime transport,Iran earned $5bn in oil exports in past month while it shut the strait for most other ships. That revenue is at risk.,Al Jazeera English,Unknown,News,2026-04-16T07:51:28.277172Z
f2fe4221ddf33a350d106004a26fbd39,HoroscoWhy the Strait of Hormuz matters so much in the Iran warpe for Today,https://thechronicle.com.gh/horoscowhy-the-strait-of-hormuz-matters-so-much-in-the-iran-warpe-for-today/,admin,2026-04-14T08:00:48Z,maritime transport,"Iran and the US have agreed to a ceasefire on the condition that “safe passage” through the Strait of Hormuz is guaranteed. Tehran had effectively blocked the waterway, one of the world’s busiest oil shipping channels, since the US and Israel attacked the cou…",Thechronicle.com.gh,Unknown,News,2026-04-16T07:51:28.277221Z
2df2b97a573b8af3461758cf3c4f312b,Canadian Coast Guard tests Arctic surveillance drone as air force delivery stalls,https://www.cbc.ca/news/politics/drones-arctic-coast-guard-rcaf-technology-surveillance-9.7162269,,2026-04-14T08:00:00Z,maritime transport,"The Canadian Coast Guard will deploy its new Hermes 900 Starliner drone for Arctic test flights this summer after a federal restructuring shifted surveillance assets to Department of National Defence. With MQ-9B SkyGuardian drones delayed until 2028, civilian…",CBC News,Unknown,News,2026-04-16T07:51:28.277271Z
1df0341d0ddfe756bf33d0bfc7ddda38,"US Navy starts Hormuz blockade: This 9,000-tonne destroyers with Tomahawk has been deployed to stop the sea traffic, check features",https://economictimes.indiatimes.com/news/defence/us-navy-starts-hormuz-blockade-this-9000-tonne-destroyers-with-tomahawk-has-been-deployed-to-stop-the-sea-traffic-check-features/articleshow/130251179.cms,ET Online,2026-04-14T05:13:12Z,maritime transport,"Arleigh Burke-class destroyers, the backbone of the US Navy, are highly versatile warships central to maritime deployments. With advanced Aegis combat systems and missile defense capabilities, these destroyers are crucial for controlling sea lanes and project…",The Times of India,Unknown,News,2026-04-16T07:51:28.277324Z
2c329030c89e4e2a1d2d68b53584dd97,Autonomous wing-in-ground effect aircraft has US military in its sights,https://newatlas.com/military/regent-autonomous-wing-in-ground-effect-aircraft-us-military/,David Szondy,2026-04-14T05:04:35Z,maritime transport,"Regional Electric Ground Effect Nautical Transport (REGENT) has completed the maiden flight of Squire, an autonomous variant of the company's Wing-in-Ground Effect Seaglider aircraft that's being pitched to the US military for logistical duty.Continue Reading…",New Atlas,Unknown,News,2026-04-16T07:51:28.277371Z
3f9260eaa7be11c6da5e28283775c142,"US military kills 2 suspected cartel operatives in latest Eastern Pacific lethal strike, SOUTHCOM says",https://www.foxnews.com/us/us-military-kills-2-suspected-cartel-operatives-latest-eastern-pacific-lethal-strike-southcom-says,,2026-04-14T01:13:32Z,maritime transport,The U.S. military killed two men believed to be cartel operatives in the Eastern Pacific as part of broader efforts to disrupt narcotics trafficking.,Fox News,Unknown,News,2026-04-16T07:51:28.277405Z
9b60db2759b29e1fd6969f982ac20392,60 years of waiting ends as Bayelsa communities celebrate road inauguration,https://www.vanguardngr.com/2026/04/60-years-of-waiting-ends-as-bayelsa-communities-celebrate-road-inauguration/,Emmanuel Okogba,2026-04-14T00:47:34Z,maritime transport,"By Samuel Oyadongha OPOROMA—For six decades, the people of Southern Ijaw Local Government Area,  Bayelsa State’s largest council and one of Nigeria’s biggest waited in vain. Last Friday, their patience finally paid off. President Bola Tinubu personally inaugu…",Vanguard,Unknown,News,2026-04-16T07:51:28.277456Z
83dceb6c9ae15f6a4c060bba56b0aa50,Multicriteria site suitability for solar-powered green hydrogen production plants along the Northwestern coast of Egypt,https://www.nature.com/articles/s41598-026-44081-8,"Abdel-hameed M. El-Aassar, Kamilia H. Hagagg, Rasha A. Hussien",2026-04-14T00:00:00Z,maritime transport,"An integrated geospatial, hydrogeochemical framework for identifying environmentally suitable locations for solar-powered green hydrogen production along Egypt’s northwestern Mediterranean coast is applied. The methodology combines environmental stable isotop…",Nature.com,Egypt,News,2026-04-16T07:51:28.277499Z
950761e902bcd19dc1b90f585179eff5,Global Food Shortages Will Hit In 6 To 9 Months As Little Will Go Through The Strait Of Hormuz Now,https://www.shtfplan.com/headline-news/global-food-shortages-will-hit-in-6-to-9-months-as-little-will-go-through-the-strait-of-hormuz-now,Michael Snyder,2026-04-13T22:30:57Z,maritime transport,"Where do we go from here? Peace talks with Iran have totally failed, and there appears to be no hope that the gaps between the demands that the U.S. is making and the demands that Iran is making can be bridged. There are several key issues that both sides are…",Shtfplan.com,Global,News,2026-04-16T07:51:28.277548Z
a2907bdb92d927839b65bba404c30a07,"Will US naval blockade on Iranian ports successful in ending already-fragile ceasefire? Global oil, Strait of Hormuz, Donald Trump, Iran tensions explained",https://economictimes.indiatimes.com/news/international/us/will-us-naval-blockade-on-iranian-ports-successful-in-ending-already-fragile-ceasefire-global-oil-strait-of-hormuz-donald-trump-iran-tensions-explained/articleshow/130242289.cms,Gandharv Walia,2026-04-13T16:44:30Z,maritime transport,Will US naval blockade on Iranian ports successful in ending already-fragile ceasefire? The United States has launched a naval blockade targeting ships linked to Iranian ports after failed talks. Warships are near the Gulf of Oman and the Strait of Hormuz. Ir…,The Times of India,USA,News,2026-04-16T07:51:28.277580Z
5a11d83852e4116a1683537a11f8e2e7,Ukraine Targets Russian Merchant Fleet With NATO Intel Support - Presidential Aide,https://sputnikglobe.com/20260413/ukraine-targets-russian-merchant-fleet-with-nato-intel-support---presidential-aide-1123981137.html,Sputnik International,2026-04-13T12:32:18Z,maritime transport,"MOSCOW (Sputnik) - The Ukrainian special services are targeting the Russian merchant fleet with coordination and intelligence support of NATO, Russian presidential aide and chairman of the Russian Marine Board Nikolai Patrushev said on Monday.",Sputnikglobe.com,Russia,News,2026-04-16T07:51:28.277710Z
e7529c3e2f380b01c6b2b9d4c95a95f3,"PH, Australia, US hold 16th joint drill in WPS",https://www.globalsecurity.org/military/library/news/2026/04/mil-260413-pna02.htm,John Pike,2026-04-13T12:00:00Z,maritime transport,"Philippine, Australian and U.S. air and naval forces conducted the 16th multilateral maritime cooperative activity (MMCA) in the West Philippine Sea (WPS) from April 9 to 12, the Armed Forces of the Philippines (AFP) said on Monday.",Globalsecurity.org,Australia,News,2026-04-16T07:51:28.277763Z
061834c0b172df61e5aca792fe06c330,Ukraine Targets Russian Merchant Fleet With NATO Intel Support - Presidential Aide,https://www.globalsecurity.org/wmd/library/news/ukraine/2026/04/ukraine-260413-sputnik01.htm,John Pike,2026-04-13T12:00:00Z,maritime transport,"The Ukrainian special services are targeting the Russian merchant fleet with coordination and intelligence support of NATO, Russian presidential aide and chairman of the Russian Marine Board Nikolai Patrushev said on Monday.",Globalsecurity.org,Russia,News,2026-04-16T07:51:28.277786Z
8d6755ffbbdd9aaac4e502a871b2064b,India’s March retail inflation quickens to 3.4% as US war on Iran disrupts global trade flows,https://economictimes.indiatimes.com/news/economy/indicators/india-march-retail-inflation-3-40-percent-cpi-us-iran-middle-east-war-global-trade-flows-disruption/articleshow/130233288.cms,ET Online,2026-04-13T10:35:10Z,maritime transport,"In March, India's retail inflation ticked up to 3.4%, influenced by escalating tensions in the Middle East that are affecting global oil supplies. However, this increase remains comfortably within the target range set by the Reserve Bank of India. While the R…",The Times of India,India,News,2026-04-16T07:51:28.277817Z
16df87385b49bce251aaf3598998e7b5,"Why are US stock market futures down today, and will Dow Jones, S&P 500 and Nasdaq stay in red or turn green again? Wall Street futures, US stocks to watch out for, analysts insights, market outlook and what should investors do now",https://economictimes.indiatimes.com/news/international/us/why-are-us-stock-market-futures-down-today-and-will-dow-jones-sp-500-and-nasdaq-stay-in-red-or-turn-green-again-wall-street-futures-us-stocks-to-watch-out-for-analysts-insights-market-outlook-and-what-should-investors-do-now/articleshow/130233180.cms,Gandharv Walia,2026-04-13T10:16:51Z,maritime transport,"Why are US stock market futures down today, and will Dow Jones, S&P 500 and Nasdaq stay in red or turn green again? Wall Street futures fell after failed talks between the United States and Iran. Oil prices crossed $100 again. Inflation fears rose. Investors …",The Times of India,USA,Analysis/Opinion,2026-04-16T07:51:28.277840Z
df4a5de1aee7d438b0859dbe5a8c7f83,"‘Strong economic returns’ from Maritime and Coastguard Agency seafarer training support, finds independent report",https://www.gov.uk/government/news/strong-economic-returns-from-maritime-and-coastguard-agency-seafarer-training-support-finds-independent-report,Maritime and Coastguard Agency,2026-04-13T09:30:04Z,maritime transport,Eight-year review shows skills-funding contributed over £500m to UK economy,Www.gov.uk,Unknown,Analysis/Opinion,2026-04-16T07:51:28.277922Z
963a3222da37e6d17732d56ac3165621,Why planes are getting 'lost' due to GPS spoofing and jamming,https://www.rte.ie/brainstorm/2026/0413/1567940-aviation-satellite-systems-jamming-spoofing-interference-disruption/,Viktoriia Ivannikova,2026-04-13T06:04:27Z,maritime transport,Disruptions caused by deliberate interference with satellite systems can create safety risks for aircraft flying in or near conflict zones,RTE,Unknown,News,2026-04-16T07:51:28.277961Z
fc0b283d59c65f6559989739cf0a426a,Why did U.S. block Iran port shipping? #politics,https://alltoc.com/politics/why-did-u-s-block-iran-port-shipping,AllToc,2026-04-13T06:02:24Z,maritime transport,U.S. Navy blockade after failed Iran talks The United States moved toward a blockade of Iranian ports after peace negotiations between the U.S. and Iran ended without an agreement. Multiple reports describe the decision as a direct response to the breakdown o…,Alltoc.com,USA,Market Report,2026-04-16T07:51:28.277992Z
27cfeff1771de8fce09e4d59fd44c166,Aktsiaselts Infortar own share acquisition transactions,https://www.globenewswire.com/news-release/2026/04/13/3272189/0/en/Aktsiaselts-Infortar-own-share-acquisition-transactions.html,AS Infortar,2026-04-13T05:00:00Z,maritime transport,Aktsiaselts Infortar acquired its own shares on the Nasdaq Tallinn Stock Exchange during the period of 6 April – 10 April 2026 as follows:  DateAggregated...,GlobeNewswire,Unknown,News,2026-04-16T07:51:28.278032Z
5c5c880be4c2ad9735e65aea77dd9188,Global Food Shortages Will Hit The World Like A Freight Train In 6 To 9 Months Because Virtually Nothing Will Get Through The Strait Of Hormuz Now,http://theeconomiccollapseblog.com/global-food-shortages-will-hit-the-world-like-a-freight-train-in-6-to-9-months-because-virtually-nothing-will-get-through-the-strait-of-hormuz-now/,Michael,2026-04-12T19:40:09Z,maritime transport,"Where do we go from here? Peace talks with Iran have totally failed, and there appears to be no hope that the gaps between the demands that the U.S. is making and the demands that Iran is making can be bridged. There are several key issues that both sides are…",Theeconomiccollapseblog.com,Global,News,2026-04-16T07:51:28.278113Z
439db79f228f38ca590c7a06a5492f05,How the US will clear Iran’s mines in the Strait of Hormuz,https://nypost.com/2026/04/12/world-news/how-the-us-will-clear-irans-mines-in-the-strait-of-hormuz/,Ronny Reyes,2026-04-12T16:17:58Z,maritime transport,"As peace talks between America and Iran fell apart over the weekend, President Trump has called for the US military to take control of the Strait of Hormuz and clear the water of Tehran's mines.",New York Post,USA,News,2026-04-16T07:51:28.278137Z
e749ca506e5a4b09f72370d744f9b51b,Japan Military to Exit Antarctica,https://newsonjapan.com/article/148890.php,,2026-04-12T04:14:22Z,maritime transport,"The Japan Maritime Self-Defense Force will withdraw from Antarctic research vessel operations after nearly six decades, with private-sector entities expected to take over following the retirement of the icebreaker Shirase in fiscal 2034. (News On Japan)",Newsonjapan.com,Japan,News,2026-04-16T07:51:28.278219Z
37baa7484c3506ad2646c7d0e7605bbe,"Trump downplays talks for ceasefire deal with Iran, claiming military victory. ‘It doesn’t matter. From the standpoint of America, we win’",https://fortune.com/2026/04/11/trump-iran-war-ceasefire-talks-deal-military-victory-jd-vance/,The Associated Press,2026-04-11T23:15:50Z,maritime transport,"“Let’s see what happens – maybe they make a deal maybe they don’t,” the president said.",Fortune,USA,News,2026-04-16T07:51:28.278245Z
c1e5dba20277d060ea6b1bd506911dd1,How Iran’s Dark Fleet Is Quietly Keeping Oil Markets Afloat,https://oilprice.com/Energy/Crude-Oil/How-Irans-Dark-Fleet-Is-Quietly-Keeping-Oil-Markets-Afloat.html,Cyril Widdershoven,2026-04-11T23:00:00Z,maritime transport,"It almost looks like an eternal story or an Australian boomerang approach, but the global oil market is once again being misread, very badly. Headlines speak of disruption, paralysis, and the near closure of the Strait of Hormuz. International tanker trackers…",OilPrice.com,Australia,Market Report,2026-04-16T07:51:28.278263Z
6b97ab766e2ea8d69876ef85ad3f6f68,US warships pass Hormuz amid mine-clearing ops,https://economictimes.indiatimes.com/news/defence/us-warships-pass-hormuz-amid-mine-clearing-ops/articleshow/130196692.cms,AFP,2026-04-11T17:30:19Z,maritime transport,US Navy warships have entered the Strait of Hormuz. This marks the start of an operation to clear mines laid by Iran. The strategic waterway is vital for global oil transport. President Donald Trump stated the US is clearing the strait. This action aims to en…,The Times of India,Global,News,2026-04-16T07:51:28.278311Z
74338c5a53ee1d972e513edf13564b05,"Australia Fuel Crisis 2026: Petrol Prices High, Stations Run Dry – Latest Updates After Iran Ceasefire",https://www.ibtimes.com.au/australia-fuel-crisis-2026-petrol-prices-high-stations-run-dry-latest-updates-after-iran-1866154,Tony Jackson,2026-04-11T06:19:01Z,maritime transport,"SYDNEY — Australia is navigating a persistent fuel crunch triggered by the U.S.-Israel conflict with Iran and the resulting disruptions to global oil shipments, even as a fragile ceasefire in the Middle East has begun easing some international price pressures.",Ibtimes.com.au,Australia,Market Report,2026-04-16T07:51:28.278331Z
7a80a802108788bf663f5f46ec804b3d,"Global Energy Shortages and Rationing Likely to Continue Beyond Current Conflict, Analysts Warn",https://www.naturalnews.com/2026-04-11-global-energy-shortages-rationing-continue-beyond-current-conflict.html,Garrison Vance,2026-04-11T06:00:00Z,maritime transport,"Introduction Independent analysts and international agencies are warning that widespread energy shortages and rationing measures are now structurally embedded in global markets, irrespective of any near-term resolution to the ongoing U.S.-Israel conflict with…",Naturalnews.com,Global,Market Report,2026-04-16T07:51:28.278380Z
938fb636a6de450be321d9a503b6b21b,‘Nigeria’s export surge signals maritime sector growth’,https://punchng.com/nigerias-export-surge-signals-maritime-sector-growth/,Punch Newspapers,2026-04-11T00:06:15Z,maritime transport,"Discover how Nigeria’s export surge is signaling major growth in its maritime sector, driven by strategic reforms and significant investments in port effic

Read More: https://punchng.com/nigerias-export-surge-signals-maritime-sector-growth/",The Punch,Unknown,News,2026-04-16T07:51:28.278428Z
9ceae2027092f4d86b89ad1b49468c90,Doubling Of Heavy Oil Costs Hits Tea Production,https://newsonjapan.com/article/148874.php,,2026-04-10T22:00:51Z,maritime transport,"Heavy oil prices have doubled over the past six months, placing mounting pressure on Japan’s green tea producers and transport sectors as Prime Minister Sanae Takaichi announced on April 10th that the government will release an additional 20 days’ worth of na…",Newsonjapan.com,Japan,Market Report,2026-04-16T07:51:28.278456Z
7e769f9177bf87974f97efc9eee0bff6,No retreat at Hormuz — Iran must not control the world’s energy lifeline,https://www.foxnews.com/opinion/retreat-hormuz-iran-must-control-worlds-energy-lifeline,,2026-04-10T21:31:47Z,maritime transport,"A comprehensive sanctions regime including China is needed to deter Iran from weaponizing the Strait of Hormuz, a vital global trade artery.",Fox News,China,News,2026-04-16T07:51:28.278472Z
2f2cf18e8b93f798770785a5f4768327,Japan to withdraw MSDF from Antarctic mission amid growing security demands,https://japantoday.com/category/national/japan-to-withdraw-msdf-from-antarctic-mission-amid-growing-security-demands,,2026-04-10T20:50:48Z,maritime transport,"Japan plans to withdraw the Maritime Self-Defense Force from operating its Antarctic research vessel in the early 2030s, transferring responsibility for transporting personnel and supplies to a state-backed marine research agency, as growing security demands …",Japan Today,Japan,News,2026-04-16T07:51:28.278508Z
