article_id,title,link,creator,pubdate,category,description,source,country,article_type,scrape_timestamp
ba88316b5c8d0bff04369087c61d9c23,Breitbart Business Digest: Retail Sales Slump Points to Cooling Inflation,https://www.breitbart.com/economy/2026/02/10/breitbart-business-digest-retail-sales-slump-points-to-cooling-inflation/,John Carney,2026-02-11T00:07:28Z,coal demand,"A Silver Lining in a Soot-Soaked Retail Sales Report Analysts had visions of sugar plums dancing in their heads for December retail sales. Instead, they got a lump of coal. The Census Bureau said Tuesday that retail sales were flat
The post Breitbart Business…",Breitbart News,Unknown,Market Report,2026-02-14T06:50:05.941443Z
5014501edda2409f1846cd975a68db25,Getting the Fracts Straight,https://www.hoover.org/just-fracts/getting-fracts-straight-0/video,"February 11, 2026",2026-02-11T00:00:00Z,coal demand,"Published: January 20, 2016

All forms of energy production have their risks, but scientific research suggests that hydraulic fracturing’s risks of water use, water contamination, or induced seismic activity from improper fluid disposal are rare, overblown,…",Hoover.org,Unknown,News,2026-02-14T06:50:05.941487Z
3b7c2c6ab0b41ee9f93dc183692a29d9,Can the clean-energy revolution save us from climate catastrophe?,https://www.nature.com/immersive/d41586-026-00332-2/index.html,Jeff Tollefson,2026-02-11T00:00:00Z,coal demand,Seven charts show the remarkable growth in renewable power and the challenges to ending the fossil-fuel age.,Nature.com,Unknown,News,2026-02-14T06:50:05.941516Z
16a3c36144ba00d182181998319abeb8,Carbon emission inequality of urban and rural households in China from 2000 to 2020,https://www.nature.com/articles/s41598-026-39422-6,"Ting Zhou, Xiao Zhou, Qiang Wang",2026-02-11T00:00:00Z,coal demand,Scientific Reports - Carbon emission inequality of urban and rural households in China from 2000 to 2020,Nature.com,China,Market Report,2026-02-14T06:50:05.941527Z
1332b1324b3d642bc2c429f77696b14c,Importing gas locks NZ into fossil fuels for longer – just as clean energy surges,https://theconversation.com/importing-gas-locks-nz-into-fossil-fuels-for-longer-just-as-clean-energy-surges-275548,"Jen Purdie, Senior Research Fellow, Centre for Sustainability, University of Otago",2026-02-10T23:18:26Z,coal demand,"Even as the US steps back from Paris and New Zealand flirts with imported gas, the global energy transition is gathering speed.",The Conversation Africa,Global,News,2026-02-14T06:50:05.941563Z
6e1a7fed5bb22e5548368a638a1dde8b,"For Many Incarcerated Women, the State Is Their Abuser",https://msmagazine.com/2026/02/10/incarcerated-women-gender-based-violence/,Kwaneta Harris,2026-02-10T23:07:40Z,coal demand,"Let me tell you what it's like to live in state-sanctioned, gender-based violence. 
In prison, we wake up when male guards tell us to. We wear what they tell us to wear. We eat what they give us, when they decide to give it. We go where they permit, speak whe…",Ms. Magazine,Unknown,News,2026-02-14T06:50:05.941610Z
3d0fc2f2d276364e4222f18eae61413e,US’s largest public utility says it now doesn’t want to close two coal-fired plants,https://www.bostonherald.com/2026/02/10/federal-utility-coal/,Associated Press,2026-02-10T20:28:12Z,coal demand,The new plan would still include introducing natural gas-fired plants at two locations.,Boston Herald,Unknown,News,2026-02-14T06:50:05.941644Z
4914c9b370a8671e1d3bbd1ca0765f46,US's largest public utility says it now doesn't want to close two coal-fired plants,https://abcnews.com/US/wireStory/uss-largest-public-utility-now-close-coal-fired-130038752,JONATHAN MATTISE Associated Press,2026-02-10T19:58:31Z,coal demand,The nation’s largest public utility says it now would prefer to keep operating two coal-fired power plants it had planned to shutter,Abcnews.com,Unknown,News,2026-02-14T06:50:05.941678Z
704e6d43f3333dc9231f643678f1df92,"Trash And Wood Accounted For Major ‘Renewable Energy’ Share During Winter Storm, Reports Show",https://dailycaller.com/2026/02/10/trash-wood-renewable-energy-new-england-winter-storm-fern-oil/,Audrey Streb,2026-02-10T19:43:19Z,coal demand,"Fossil fuels powered much of America during Winter Storm Fern, and in New England, a large share of the renewables came from burning trash.",The Daily Caller,USA,Market Report,2026-02-14T06:50:05.941699Z
cf96b35125ead3850ca972efe2fc2120,China's Data Center Boom: A View from Zhangjiakou (2025),https://sinocities.substack.com/p/chinas-data-center-boom-a-view-from,Andrew Stokols,2026-02-10T19:19:56Z,coal demand,"After a quick 40 min high speed rail trip from Beijing North Station, I step off the platform in the sleepy station of Donghuayuan Bei in Hebei’s Zhangjiakou.",Substack.com,China,Analysis/Opinion,2026-02-14T06:50:05.941709Z
b3622d308d82b3773284ec421b928275,How much are the cheapest tickets to see George Strait on his 2026 tour?,https://nypost.com/2026/02/10/ticket-sales/george-strait-tour-2026-where-to-buy-tickets-best-prices/,Matt Levy,2026-02-10T19:08:24Z,coal demand,"The King of Country will hold court Austin, TX's Moody Center in April and May.",New York Post,Unknown,News,2026-02-14T06:50:05.941737Z
692f51ab5992f5aadc59b267bc0c95ae,Utilities in the Southeast may be overestimating the AI boom,https://grist.org/energy/utilities-in-the-southeast-may-be-overestimating-the-ai-boom/,Emily Jones,2026-02-10T18:26:35Z,coal demand,"This coverage is made possible through a partnership between Grist and WABE, Atlanta’s NPR station. As more and more data centers crop up throughout Georgia and the Southeast, a recent study finds they may need less energy than the industry and utilities have…",Grist,Unknown,News,2026-02-14T06:50:05.941817Z
96ab914a119c789998dd1ea71b47b39a,Tennessee Valley Authority goes back on commitment to retire dirty coal plants,https://www.commondreams.org/newswire/tennessee-valley-authority-goes-back-on-commitment-to-retire-dirty-coal-plants,Newswire Editor,2026-02-10T18:09:35Z,coal demand,"In an extremely disappointing reversal, the Tennessee Valley Authority announced it is planning to keep its Kingston and Cumberland coal plants operating for the foreseeable future, blowing by its upcoming deadlines to close the polluting facilities. The nati…",Common Dreams,Unknown,News,2026-02-14T06:50:05.941878Z
6c54587b07adbaaaef47f97c6c3cf272,Climate Change and Energy:  World Leaders in Turmoil,https://wattsupwiththat.com/2026/02/10/climate-change-and-energy-world-leaders-in-turmoil/,Guest Blogger,2026-02-10T18:00:00Z,coal demand,"“There is no evidence that UN COP meetings and more than $10 trillion spent on renewables over the last 30 years have affected the climate. The average atmospheric carbon dioxide concentration, which is blamed for global warming, has been rising over the last…",Wattsupwiththat.com,Global,News,2026-02-14T06:50:05.941927Z
10c816cc4f403ad4b50f7166ba9e9236,"Americans are shocked by utility bills as high as $1,000: They’re paying the price for aging grids, fuel-price whiplash and extreme weather",https://fortune.com/2026/02/10/american-electric-bills-skyrocketing-extreme-weather-data-centers-inflation/,Ashley Lutz,2026-02-10T17:35:26Z,coal demand,"Many Americans are sharing monthly bills of over $1,000, cutting into their grocery budgets.",Fortune,USA,Market Report,2026-02-14T06:50:05.941949Z
35530d6a5d79b37457707363e367b18e,India’s Coal Use Could Double by 2050,https://oilprice.com/Latest-Energy-News/World-News/Indias-Coal-Use-Could-Double-by-2050.html,Charles Kennedy,2026-02-10T16:30:00Z,coal demand,"India’s coal demand could more than double by 2050 from current levels under current policies, a new report by NITI Aayog, the policy think tank of the Indian government, showed on Tuesday. Under the Current Policy Scenario (CPS), coal demand in India is fore…",OilPrice.com,India,Market Report,2026-02-14T06:50:05.941972Z
8e12a7fce6405f2515a2c7caf4565fbb,"EPA set to finalize illegal dirty air plan to hike fuel costs 76c/gal, despite outcry",http://electrek.co/2026/02/10/epa-set-to-finalize-illegal-dirty-air-plan-to-hike-fuel-costs-76c-gal-despite-outcry/,Jameson Dow,2026-02-10T16:10:50Z,coal demand,"In July, the US Environmental Protection Agency proposed a plan to delete its scientific finding recognizing that greenhouse gases are harmful to human health, with the goal of making cars less efficient, deadlier and more costly. Public comments widely oppos…",Electrek,Unknown,Analysis/Opinion,2026-02-14T06:50:05.942010Z
c5216597e228772f5a0da8d183366445,"Global Electricity Demand from Data Centres Set to Surge with AI Expansion: Projected Consumption to Reach 1,300 TWh by 2035",https://www.globenewswire.com/news-release/2026/02/10/3235527/0/en/Global-Electricity-Demand-from-Data-Centres-Set-to-Surge-with-AI-Expansion-Projected-Consumption-to-Reach-1-300-TWh-by-2035.html,Precedence Research,2026-02-10T15:30:00Z,coal demand,"According to data published by Precedence Research, global electricity demand from data centres is expected to grow from 460 TWh in 2024 to 1,300 TWh by 2035, driven by the rise of AI and high-performance computing. Renewable energy sources like wind and sola…",GlobeNewswire,Global,News,2026-02-14T06:50:05.942060Z
7b86d605f2bb8ac18df3346c663bdd7e,Old EV batteries could meet most of China's energy storage needs,https://www.newscientist.com/article/2515069-old-ev-batteries-could-meet-most-of-chinas-energy-storage-needs/,Alec Luhn,2026-02-10T15:00:43Z,coal demand,"Electric vehicle batteries are typically retired once they reach about 80 per cent of their original capacity, but they could be repurposed in electricity grids to balance out slumps in renewable generation",New Scientist,China,News,2026-02-14T06:50:05.942076Z
cade93362651e1c5ac9217129fbbd8e1,"Muted volumes, realisation miss weigh on Shree Cement in Q3 FY26",https://www.business-standard.com/markets/news/muted-volumes-realisation-miss-weighs-on-shree-cement-126021001616_1.html,Devangshu Datta,2026-02-10T14:57:02Z,coal demand,"Muted volumes and a miss on realisations weighed on Shree Cement's operating performance in Q3 FY26, even as lower depreciation helped lift net profit year-on-year",Business Standard,Unknown,News,2026-02-14T06:50:05.942160Z
38d98ca4daf192632be986a3c26d2584,India's net zero roadmap sees coal demand peaking by 2050 before steep fall,https://www.business-standard.com/industry/news/india-net-zero-roadmap-sees-coal-demand-peaking-by-2050-126021001612_1.html,Subhomoy Bhattacharjee,2026-02-10T14:55:55Z,coal demand,"Niti Aayog's Net Zero reports project coal demand rising till 2047 even as India scales up clean energy, electrifies industry and transport, and targets net zero emissions by 2070",Business Standard,India,Market Report,2026-02-14T06:50:05.942177Z
603c81d3fb54bae67784e33709c167dc,"AI and Data Centres Surge in Global Electricity Consumption Projected to Reach 1,300 TWh by 2035, AI to Save USD 110 Billion in Power Plant Operations",https://www.globenewswire.com/news-release/2026/02/10/3235450/0/en/AI-and-Data-Centres-Surge-in-Global-Electricity-Consumption-Projected-to-Reach-1-300-TWh-by-2035-AI-to-Save-USD-110-Billion-in-Power-Plant-Operations.html,Precedence Research,2026-02-10T14:30:00Z,coal demand,"According to data published by Precedence Research, the growing investment in data centres, driven by artificial intelligence (AI), has already led to data centres consuming around 1% of global electricity. As AI adoption continues to rise, data centre electr…",GlobeNewswire,Global,News,2026-02-14T06:50:05.942229Z
15081e2c7917095ef1aa60f33c4054ee,AI in China and the United States,https://www.oreilly.com/radar/ai-in-china-and-the-united-states/#BlogPosting,Mike Loukides,2026-02-10T12:41:26Z,coal demand,"At a private dinner a few months ago, Jensen Huang apparently said what I’ve been thinking for some time. The US is significantly behind China in AI development. Here are some of the reasons. Huang starts with the ratio of AI developers in China (he estimates…",Oreilly.com,China,News,2026-02-14T06:50:05.942248Z
03ae795502fe0618663f19d50c8cb3ec,"Silver ETF inflows jump 139% month-on-month in January to Rs 9,463 crore, AUM at Rs 1.16 lakh crore",https://m.economictimes.com/mf/analysis/silver-etf-inflows-jump-139-month-on-month-in-january-to-rs-9463-crore-aum-at-rs-1-16-lakh-crore/articleshow/128157880.cms,,2026-02-10T12:03:23Z,coal demand,"Silver ETFs saw massive January inflows as investors chased precious metals despite sharp volatility. Assets surged, returns topped 50%, and silver outperformed gold before a late-month crash underscored risks amid global uncertainty and profit-booking and he…",Economictimes.com,Global,News,2026-02-14T06:50:05.942295Z
cd43b078bc56d5f5576423cc6034c87c,India to rely on coal for next 25 years before sharp fall: NITI Aayog,https://www.business-standard.com/industry/news/india-will-use-more-coal-over-the-next-25-years-report-126021000855_1.html,Reuters,2026-02-10T11:23:47Z,coal demand,"Under the current policy scenario - which assumes no major new decarbonisation measures - coal demand is expected to peak at 2.62 billion metric tons in 2050, more than double the current 1.26 billion",Business Standard,India,News,2026-02-14T06:50:05.942315Z
bbf3688153ca43e215a16107d7204cb9,"Government Shutdown Fears Trigger 2% Crypto Dip, But Bitcoin Hyper Remains Unshaken",https://bitcoinist.com/crypto-market-down-government-shutdown-bitcoin-hyper-svm/,patrubogdan,2026-02-10T10:13:11Z,coal demand,"Quick Facts: ➡️ The crypto market is down roughly 2% due to fears of a U.S. government shutdown, causing a short-term liquidity crunch and risk-off behavior in major assets like BTC and ETH. ➡️ Despite the downturn, smart money is rotating out of correlated a…",Bitcoinist,Unknown,Market Report,2026-02-14T06:50:05.942379Z
ec6b3b7051254e5f1b9f1de3b5aaa61a,India will use more coal over the next 25 years: NITI Aayog,https://economictimes.indiatimes.com/industry/energy/power/india-will-use-more-coal-over-the-next-25-years-niti-aayog/articleshow/128152466.cms,Reuters,2026-02-10T09:50:51Z,coal demand,"India's coal use is projected to more than double by mid-century. This surge will precede a significant decline as the nation embraces cleaner energy sources. Under current policies, coal demand will peak in 2050. However, with net-zero goals, consumption wil…",The Times of India,India,News,2026-02-14T06:50:05.942405Z
72afc90fd54ba9127eb1d9e9062b755a,Photographer’s New App Gives Digital Photos a Realistic Analog Appearance,https://petapixel.com/2026/02/12/photographers-new-app-gives-digital-photos-a-realistic-analog-appearance/,Jeremy Gray,2026-02-12T21:39:53Z,grain exports,"Back in late 2022, PetaPixel wrote about photographer Tom Schucker's Pieca camera, a 3D-printed Raspberry Pi-powered camera with a Leica M-mount. Schucker is back with yet another awesome photography creation, but this time it's a photo editing app built arou…",PetaPixel,Unknown,News,2026-02-14T06:50:06.438593Z
7d54694f22d7a5c0403cbaf929c23631,"Rye Market Size to Surpass USD 4 Billion by 2031 Supported by Bakery, Craft Spirits, and Feed Sector Demand, Reports Mordor Intelligence",https://www.globenewswire.com/news-release/2026/02/12/3236954/0/en/Rye-Market-Size-to-Surpass-USD-4-Billion-by-2031-Supported-by-Bakery-Craft-Spirits-and-Feed-Sector-Demand-Reports-Mordor-Intelligence.html,Mordor Intelligence Private Limited,2026-02-12T09:48:00Z,grain exports,"Europe remains the largest regional rye market, while Asia-Pacific is projected to register the fastest growth, driven by rising demand from bakery, distilling, and livestock feed applications worldwide. Europe remains the largest regional rye market, while A…",GlobeNewswire,Global,Market Report,2026-02-14T06:50:06.438654Z
ad018ff777cb6f0c44ae583aa5e23929,Free trade agreement lifts hopes of India-EU organic food players,https://economictimes.indiatimes.com/industry/cons-products/food/free-trade-agreement-lifts-hopes-of-india-eu-organic-food-players/articleshow/128240531.cms,PTI,2026-02-12T07:22:33Z,grain exports,India and the European Union are set to boost organic food trade with a new free trade agreement. This pact opens up significant market access for both sides. Indian organic product exporters anticipate substantial opportunities in the EU. European companies …,The Times of India,India,Market Report,2026-02-14T06:50:06.438678Z
fcbdfc89ec343644f866dd3d2a768ab5,Free trade agreement lifts hopes of India-EU organic food traders,https://www.business-standard.com/economy/news/free-trade-agreement-lifts-hopes-of-india-eu-organic-food-traders-126021200410_1.html,Press Trust of India,2026-02-12T05:33:41Z,grain exports,"Organic food traders from India and the European Union are bullish on the recently announced free trade agreement, saying it will expand market access on both sides and create significant opportunities for the sector.
About 2,200 players from the sustainable …",Business Standard,India,Market Report,2026-02-14T06:50:06.438699Z
58adce1ce66c12c6749c4e8603dce14b,"UPSC Key: India-Seychelles relations, PMKVY, and NUDGE campaign",https://indianexpress.com/article/upsc-current-affairs/upsc-key-india-seychelles-relations-pmkvy-nudge-campaign-10524716/,"Roshni Yadav, Khushboo Kumari",2026-02-10T12:50:40Z,grain exports,"How is knowing about the potential impact of the US trade deal on India’s feed market relevant to the UPSC exam? What significance do topics such as the India-Greece relations, the PM CARES Fund, and RoW Corridors have for both the Preliminary and Main examin…",The Indian Express,India,Market Report,2026-02-14T06:50:06.438721Z
5f8a66de43e140c8ee45778a03cb5d19,Are Trump's economic policies alienating his rural MAGA base?,https://www.rte.ie/brainstorm/2026/0210/1557515-us-rural-voters-donald-trump-maga-economic-policies-midterm-elections/,RTÉ Brainstorm,2026-02-10T07:08:02Z,grain exports,"There are signs the US president's domestic policies are alienating the rural and small-town voters who backed him in 2016, 2020 and 2024",RTE,Unknown,News,2026-02-14T06:50:06.438755Z
ad54920bc0d128c320530281cc11b087,"Beyond time for Bord Bia row to be resolved, Barry Cowen says",https://www.irishtimes.com/business/farming-food/2026/02/09/beyond-time-for-bord-bia-row-to-be-resolved-barry-cowen-says/,Jack Power,2026-02-09T21:55:47Z,grain exports,"Contradiction in Irish farmer protests against Bord Bia chair over ‘minuscule’ amount of Brazilian beef, while importing grain from South America, says MEP",The Irish Times,Brazil,News,2026-02-14T06:50:06.438775Z
dc7da20a4c58594052ac6fc5c079ce88,scia-core added to PyPI,https://pypi.org/project/scia-core/,,2026-02-09T15:35:07Z,grain exports,Deterministic SQL Change Impact Analyzer,Pypi.org,Unknown,News,2026-02-14T06:50:06.438797Z
ab54a9888f6b34bac8a660b891fc0231,Indonesia to export premium rice for Hajj pilgrims in Saudi Arabia,https://en.antaranews.com/news/403638/indonesia-to-export-premium-rice-for-hajj-pilgrims-in-saudi-arabia,"Aria Ananda, Resinta Sulistiyandari",2026-02-09T09:44:11Z,grain exports,"The Indonesian government has announced plans to export 2,280 tons of premium rice to Saudi Arabia to meet the consumption needs of around 200,000 Indonesian ...",Antaranews.com,Indonesia,News,2026-02-14T06:50:06.438829Z
5f43b2ca44fc0c663dc28154d86d7126,What India has really given on agriculture in India-US trade deal,https://indianexpress.com/article/business/what-india-has-given-on-agriculture-in-india-us-trade-deal-10519102/,Harish Damodaran,2026-02-07T09:38:13Z,grain exports,"Poultry and dairy industry will benefit from cheaper American DDGS, while soyabean growers and processors stand to lose",The Indian Express,India,News,2026-02-14T06:50:06.438860Z
16f516f6d2cb3aefe5a60911437941bf,"US trade deal won’t flood India with DDGS or Red Sorghum, says Amul MD Jayen Mehta",https://www.thehindubusinessline.com/news/us-trade-deal-wont-flood-india-with-ddgs-or-red-sorghum-says-amul-md-jayen-mehta/article70603370.ece,Avinash Nair,2026-02-07T09:21:37Z,grain exports,"Calling the agreement a major win for farmers, Mehta said the deal has protected domestic dairy and agriculture while sharply improving export competitiveness",BusinessLine,India,News,2026-02-14T06:50:06.438883Z
500644bb94607a905ac770f5941024d5,India-US trade deal: America has stopped short of Indian red lines,https://economictimes.indiatimes.com/news/economy/foreign-trade/india-us-trade-deal-america-has-stopped-short-of-indian-red-lines/articleshow/128024443.cms,ET Online,2026-02-07T07:21:45Z,grain exports,The United States and India have agreed to an interim trade framework. This deal marks a significant step forward in bilateral economic ties. India has successfully protected its crucial agriculture and dairy sectors. The agreement focuses on specific tariff …,The Times of India,India,News,2026-02-14T06:50:06.438909Z
49d3bdd5c278dd9c52a2c13f17239f10,Brazil suspends Amazon river dredging after protests,https://punchng.com/brazil-suspends-amazon-river-dredging-after-protests/,Punch Newspapers,2026-02-07T06:08:18Z,grain exports,"Brazil’s government has suspended Amazon river dredging operations on the Tapajos tributary following sustained protests from Indigenous communities.

Read More: https://punchng.com/brazil-suspends-amazon-river-dredging-after-protests/",The Punch,Brazil,News,2026-02-14T06:50:06.438933Z
7d3754ecfdb292ce08aa847a8e511393,Union ministers say Rahul Gandhi spreading falsehoods on US-India trade deal,https://www.thehindubusinessline.com/news/union-ministers-say-rahul-gandhi-spreading-falsehoods-on-us-india-trade-deal/article70626939.ece,PTI,2026-02-13T02:59:38Z,soybean exports,"Posting video messages on X, Goyal and Chouhan said major crops, fruits, spices, basmati rice, cotton textiles, tea, and marine products would benefit from new export opportunities, boosting farmers’ income.",BusinessLine,India,News,2026-02-14T06:50:06.915371Z
e68d5f74810871c532bae646e6b89820,Trump and Xi Seek Short Term Wins as Summit Nears,https://oilprice.com/Energy/Energy-General/Trump-and-Xi-Seek-Short-Term-Wins-as-Summit-Nears.html,OilPrice.com,2026-02-12T17:00:00Z,soybean exports,"The United States and China are seeking to preserve their fragile trade truce before President Donald Trump visits Chinese President Xi Jinping for a high-stakes summit in Beijing this spring, according to the South China Morning Post. On the sidelines of the…",OilPrice.com,China,News,2026-02-14T06:50:06.915405Z
6587d18541b51f230661e18c67b5254b,Trump calls India-US trade deal ‘historic’ as tariff cuts and coal exports take centre stage,https://economictimes.indiatimes.com/news/economy/foreign-trade/trump-calls-india-us-trade-deal-historic-as-tariff-cuts-and-coal-exports-take-centre-stage/articleshow/128231856.cms,ET Online,2026-02-12T01:03:51Z,soybean exports,"US President Donald Trump hailed a new India-US trade deal as historic, anticipating a significant boost in American energy exports, particularly coal. The interim agreement reduces US tariffs on Indian goods and India lowers duties on American industrial, en…",The Times of India,India,News,2026-02-14T06:50:06.915488Z
0e1311caaab902d832ea745b06f2c9fe,Tariff bill in U.S. states hits $200 billion as affordability and Trump head into midterms showdown,https://www.cnbc.com/2026/02/11/inflation-affordability-trump-tariffs-midterm-elections.html,Lori Ann LaRocco,2026-02-11T11:47:10Z,soybean exports,New data shows that states where key midterm elections races will take place paid over $134 billion in tariffs during 2025 as affordability issues mounted.,CNBC,Unknown,News,2026-02-14T06:50:06.915525Z
7d69da75da1789067e2e14825f5d7492,"India-US trade deal: WH removes pulses from fact sheet, revises key text",https://www.business-standard.com/economy/news/india-us-trade-deal-wh-removes-pulses-from-fact-sheet-revises-key-text-126021100120_1.html,Vrinda Goel,2026-02-11T02:57:57Z,soybean exports,"The US has revised its interim trade deal fact sheet with India, removing pulses from tariff talks and softening language on India's $500 billion purchase plans, even as negotiations continue",Business Standard,India,News,2026-02-14T06:50:06.915546Z
ec9512749e8da282094a4984c0103211,Nigeria posts $10.83bn trade surplus on stronger exports,https://punchng.com/nigeria-posts-10-83bn-trade-surplus-on-stronger-exports/,Punch Newspapers,2026-02-11T00:20:10Z,soybean exports,"Nigeria records a $10.83bn trade surplus in the first nine months of 2025, driven by stronger export earnings and moderated import growth.

Read More: https://punchng.com/nigeria-posts-10-83bn-trade-surplus-on-stronger-exports/",The Punch,Unknown,News,2026-02-14T06:50:06.915595Z
3dec1d28b49619933189c18dd54c32fc,Soybeans Resume Strength on Tuesday,https://www.barchart.com/story/news/143462/soybeans-resume-strength-on-tuesday,Austin Schroeder,2026-02-10T23:12:21Z,soybean exports,Soybeans closed Tuesday with contracts 11 to 13 cent higher in the front months. The cmdtyView national average Cash Bean price was up 11 3/4 cents at $10.56...,Barchart.com,Unknown,Analysis/Opinion,2026-02-14T06:50:06.915622Z
16e45e57d78e42f7167d58b8362621da,India under pressure to toe US line on oil,https://www.thehindubusinessline.com/opinion/india-under-pressure-to-toe-us-line-on-oil/article70616518.ece,Paran Balakrishnan,2026-02-10T15:18:09Z,soybean exports,"India has insisted it would buy the cheapest crude, but with US pressure to cut Russian purchases it is being pushed towards costlier oil",BusinessLine,India,News,2026-02-14T06:50:06.915640Z
