article_id,title,link,creator,pubdate,category,description,source,country,article_type,scrape_timestamp
34442ffd9af118a68964edb945bd3c54,"Drones spotted near Zelenskiy’s flight path to Dublin, triggering major security alert",https://www.irishtimes.com/ireland/2025/12/04/drones-spotted-near-zelenskiys-flight-path-to-dublin-triggering-major-security-alert/,Conor Gallagher,2025-12-04T16:34:31Z,maritime transport,Irish navy ship spotted five drones operating near route of the Ukrainian president’s aircraft by Howth coast,The Irish Times,Ukraine,News,2025-12-05T18:30:35.578457Z
fac664b3864dad56eeaf22f7fd121a92,A New World – Resistance and Reality Against Theater and Rhetoric,https://www.globalresearch.ca/resistance-reality-theater-rhetoric/5907976,Stephen Sefton,2025-12-04T15:55:05Z,maritime transport,"Historical transitions from an outdated configuration of international relations to a new one have always developed in a discontinuous, irregular and uneven way. 
The post A New World – Resistance and Reality Against Theater and Rhetoric appeared first on Glo…",Globalresearch.ca,Global,News,2025-12-05T18:30:35.578519Z
b27b02e0490641f3273d5798aac7ddc9,"Malaysia, Singapore sign additional agreement for RTS Link",https://www.thestar.com.my/news/nation/2025/12/04/malaysia-singapore-sign-additional-agreement-for-rts-link,The Star Online,2025-12-04T13:21:00Z,maritime transport,"SINGAPORE: Malaysia and Singapore on Thursday (Dec 4) inked an additional agreement for the Johor Baru-Singapore Rapid Transit System (RTS) Link, finalising the arrangement for co-located immigration facilities under the project. Read full story",The Star Online,Singapore,News,2025-12-05T18:30:35.578550Z
48f6cda498db8e8cf59598680e0a2de4,NATO state issues Black Sea shipping warning,https://www.rt.com/news/628921-turkiye-black-sea-warning-ukraine/,RT,2025-12-04T11:33:03Z,maritime transport,Turkish Foreign Minister Hakan Fidan has pointed to the widening geography of the Ukraine crisis amid Black Sea drone attacks Read Full Article at RT.com,RT,Ukraine,News,2025-12-05T18:30:35.578572Z
ab46d42f2769f4e9da14e909979546ae,"Malaysia-Singapore FIR talks make progress, says PM Anwar",https://www.thestar.com.my/news/nation/2025/12/04/malaysia-singapore-fir-talks-make-progress-says-pm-anwar,The Star Online,2025-12-04T10:21:00Z,maritime transport,"SINGAPORE: Malaysia and Singapore have reached a key understanding in their ongoing discussions on the Flight Information Region (FIR), with both sides agreeing that any future arrangement must ensure smooth and unhindered air traffic movements. Read full sto…",The Star Online,Singapore,News,2025-12-05T18:30:35.578604Z
da0f01ebd26bb0d6242b9e4b0467b4e6,Beyond barrels: India and Russia build a new energy playbook,https://www.rt.com/india/628898-beyond-barrels-india-and-russia/,RT,2025-12-04T09:42:32Z,maritime transport,"From small modular reactors to rare-earth mining, New Delhi and Moscow are building a localized, secure clean-tech ecosystem Read Full Article at RT.com",RT,India,News,2025-12-05T18:30:35.578623Z
b74702dba57b95727aaf523f103da5f7,Spike in Russian shadow fleet activities during Zelenskiy visit,https://www.irishtimes.com/ireland/2025/12/04/spike-in-russian-shadow-fleet-activities-during-zelenskiy-visit/,Conor Gallagher,2025-12-04T08:00:00Z,maritime transport,Ukrainian president’s visit meant Air Corps’ maritime patrol aircraft were largely unavailable to maintain surveillance,The Irish Times,Russia,News,2025-12-05T18:30:35.578648Z
40539a5e66f445886312fc8f4648f1d2,Orbán lays siege to the EEAS,https://www.euractiv.com/news/rapporteur-orban-lays-siege-to-the-eeas/,Sofia Mandilara,2025-12-04T07:22:33Z,maritime transport,"In Thursday’s edition: Mogherini defiant, Sannino out, S&D’s Qatargate, Hamas files, Belgium vs Germany, Venezuela migration, new EPPO chief",EURACTIV,Germany,News,2025-12-05T18:30:35.578696Z
d413b156bcc606d6bde9771e540ee572,Unlawful Orders and Killing Shipwrecked Boat Strike Survivors: An Expert Backgrounder,https://www.justsecurity.org/125948/illegal-orders-shipwrecked-boat-strike-survivors/,hutsonh,2025-12-04T05:47:01Z,maritime transport,"An expert backgrounder on the reported Hegseth ""no quarter"" order to kill everyone aboard a suspected drug boat in the Caribbean on Sept. 2.",Just Security,Unknown,Market Report,2025-12-05T18:30:35.578728Z
02a18ecae16f3ca8690dd7257c316045,Molecular Evidence of Dengue Virus Serotype 2 in Travelers Returning to Israel from the Sinai Peninsula,https://wwwnc.cdc.gov/eid/article/31/11/25-0991_article,,2025-12-04T05:00:00Z,maritime transport,Molecular Evidence of Dengue Virus Serotype 2 in Travelers Returning to Israel from the Sinai Peninsula,Cdc.gov,Unknown,News,2025-12-05T18:30:35.578761Z
4d86da873146f4e2c75d8c0e7c25f986,"War for Ukraine Day 1,378: One of These Things Is Not Like the Other",https://balloon-juice.com/2025/12/03/war-for-ukraine-day-1378-one-of-these-things-is-not-like-the-other/,Adam L Silverman,2025-12-04T03:06:52Z,maritime transport,"Shot: After the meeting with the Americans, Ushakov, who is currently Putin’s aide, came out to the journalists and stated that there is still no compromise plan for ending the war. The Russians are simply dragging things out. The video has subtitles. [image …",Balloon-juice.com,USA,News,2025-12-05T18:30:35.578812Z
01ab779ffd8b714da28607dbdf4e4132,Names for seven new CalMac ferries chosen in public vote,https://www.bbc.com/news/articles/c8651jdpnpyo,,2025-12-03T17:11:58Z,maritime transport,The first of the boats for Scotland's west coast is expected to arrive in 2027.,BBC News,Unknown,News,2025-12-05T18:30:35.578899Z
aeee194f667c2df04e06de2c03c24795,Government boost for businesses to drive freight innovation,https://www.gov.uk/government/news/government-boost-for-businesses-to-drive-freight-innovation,Department for Transport,2025-12-03T15:55:35Z,maritime transport,"Funding of up to £130,000 will be paid out to 9 small and medium-sized firms, exploring ways to solve challenges within the freight and logistics industry.",Www.gov.uk,Unknown,News,2025-12-05T18:30:35.578933Z
34ae24e8562a9632d58f7b5f5bde9f6d,Coastal regions and climate change: how better risk assessment can help protect infrastructure and livelihoods,https://theconversation.com/coastal-regions-and-climate-change-how-better-risk-assessment-can-help-protect-infrastructure-and-livelihoods-269441,"Anthony Schrapffer, PhD, EDHEC Climate Institute Scientific Director, EDHEC Business School",2025-12-03T15:51:40Z,maritime transport,"Better measuring the risks posed by rising sea levels and more intense storms requires rigorous, comparable and transparent assessment.",The Conversation Africa,Unknown,Market Report,2025-12-05T18:30:35.578965Z
2528bb5ae9592429ed759fa93971b212,"Agri-feedstocks, the emerging backbone of Europe’s biofuel ambitions",https://www.euractiv.com/news/agri-feedstocks-the-emerging-backbone-of-europes-biofuel-ambitions/,Brian Maguire,2025-12-03T15:06:56Z,maritime transport,Europe’s energy giants are seeking to harness the potential of agricultural residues to increase the use of biofuel,EURACTIV,Unknown,News,2025-12-05T18:30:35.579006Z
c0fbcb40b19f0cc7df52708d71ff9f80,Gist of The Hindu : NOVEMBER-2025,https://iasexamportal.com/the-gist/the-hindu-november-2025,trainee5,2025-12-03T14:35:45Z,maritime transport,Gist of The Hindu: NOVEMBER-2025,Iasexamportal.com,Unknown,News,2025-12-05T18:30:35.579028Z
b235fa6e682f3e651377d6c1c4241ac8,Search for Malaysia Airlines flight MH370 to resume over 11 years after it went missing,https://www.thejournal.ie/search-malaysia-airlines-flight-mh370-resume-6892297-Dec2025/,AFP,2025-12-03T13:36:40Z,maritime transport,The Boeing 777 carrying 239 people vanished from radar screens on 8 March 2014 while en route from Kuala Lumpur to Beijing.,TheJournal.ie,China,News,2025-12-05T18:30:35.579043Z
e5f7843a484931f314014ff5efb8df6f,Rosslare Europort to seek planning permission for €220m offshore renewable energy hub,https://www.thejournal.ie/rosslare-europort-planning-offshore-renewable-energy-hub-6892279-Dec2025/,Jane Moore,2025-12-03T13:20:01Z,maritime transport,The new facility would be the largest ever purpose-built port facility in the country dedicated to offshore renewable energy.,TheJournal.ie,Unknown,News,2025-12-05T18:30:35.579080Z
ac510138a493a9918771095ec7d756f8,Australia to provide Ukraine with $95m funding boost,https://www.abc.net.au/news/2025-12-03/australia-to-provide-ukraine-with-95m-funding-boost/106098710,Olivia Caisley,2025-12-03T11:31:09Z,maritime transport,"Australia will provide an additional $95 million in military assistance to Ukraine and slap a fresh round of sanctions on ships believed to be part of Moscow's so-called ""shadow fleet"".",ABC News (AU),Australia,News,2025-12-05T18:30:35.579096Z
a64e01b818cd36bb4afdb71b2517b3ee,Malaysia PM Anwar to visit Singapore on Dec 4 for leaders’ retreat between two countries,https://www.channelnewsasia.com/singapore/lawrence-wong-anwar-ibrahim-singapore-malaysia-leaders-retreat-bilateral-cooperation-5528736,,2025-12-03T10:00:29Z,maritime transport,"The annual retreat is a key platform for the countries’ prime ministers to take stock of bilateral cooperation, explore new avenues of collaboration and provide guidance on how to take the Singapore-Malaysia relationship forward.",CNA,Singapore,News,2025-12-05T18:30:35.579219Z
31fd9404a592ac8d075cd75301b3ea06,Search resumes to solve mystery of missing Malaysia Airlines flight MH370,https://www.aljazeera.com/news/2025/12/3/search-resumes-to-solve-mystery-of-missing-malaysia-airlines-flight-mh370,Kevin Doyle,2025-12-03T07:52:59Z,maritime transport,New search to start on December 30 for Boeing 777 that went missing in 2014 with 227 passengers and 12 crew members.,Al Jazeera English,Unknown,News,2025-12-05T18:30:35.579250Z
ba3b2df14a8ce8a5fcb335fdf425f97a,"Search for long-missing flight MH370 to resume, says Malaysia",https://punchng.com/search-for-long-missing-flight-mh370-to-resume-says-malaysia/,Punch Newspapers,2025-12-03T06:52:11Z,maritime transport,"Malaysia confirms the search for missing flight MH370 will resume in December 2025, led by Ocean Infinity, aiming to provide closure to families.

Read More: https://punchng.com/search-for-long-missing-flight-mh370-to-resume-says-malaysia/",The Punch,Unknown,News,2025-12-05T18:30:35.579285Z
81cbddd81f938c49e0857321d65c3d18,Malaysia says search for long-missing flight MH370 to resume,https://www.digitaljournal.com/world/malaysia-says-search-for-long-missing-flight-mh370-to-resume-2/article,AFP,2025-12-03T06:07:20Z,maritime transport,"The search for missing Malaysia Airlines flight MH370 will resume at the end of December, Malaysia’s transport ministry said on Wednesday, more than a decade after the plane disappeared. The Boeing 777 carrying 239 people vanished from radar screens on March …",Digital Journal,Unknown,News,2025-12-05T18:30:35.579330Z
9009c2ba7646dcb342d7ef247ad8fcdb,Malaysia revives hunt for missing Boeing 777 which vanished 11 years ago - When will the mystery of long-missing flight MH370 be solved after two fruitless searches,https://economictimes.indiatimes.com/news/international/us/malaysia-revives-hunt-for-missing-boeing-777-which-vanished-11-years-ago-when-will-the-mystery-of-long-missing-flight-mh370-be-solved-after-two-fruitless-searches/articleshow/125734833.cms,Mukesh Thapliyal,2025-12-03T05:46:25Z,maritime transport,"Hopes are rekindled for families of MH370 victims as Malaysia announces a new deep-sea search commencing December 30, 2025. Maritime firm Ocean Infinity will undertake a 55-day mission in a high-probability zone, operating on a 'no find, no fee' basis. This m…",The Times of India,Unknown,News,2025-12-05T18:30:35.579382Z
5f54f0813875bd5472ec7652d2b9905e,Malaysia says search for long-missing flight MH370 to resume,https://www.hurriyetdailynews.com/malaysia-says-index-for-long-missing-flight-mh370-to-resume-216395,hurriyetdailynews.com,2025-12-03T05:38:52Z,maritime transport,"The search for missing Malaysia Airlines flight MH370 will resume at the end of December, Malaysia's transport ministry said on Wednesday, more than a decade after the plane disappeared.",Hurriyet Daily News,Unknown,News,2025-12-05T18:30:35.579418Z
d6d2d0ef8414296c13072b5de9807624,Malaysia says search for long-missing flight MH370 to resume,https://www.digitaljournal.com/world/malaysia-says-search-for-long-missing-flight-mh370-to-resume/article,AFP,2025-12-03T03:53:16Z,maritime transport,"The search for missing Malaysia Airlines flight MH370 will resume at the end of December, Malaysia’s transport ministry said on Wednesday, more than a decade after the plane disappeared. The Boeing 777 carrying 239 people vanished from radar screens on March …",Digital Journal,Unknown,News,2025-12-05T18:30:35.579460Z
c47c2331f8c100cb00a31a74da6f9778,"Breaking: Search for missing flight MH370 to resume this month, Malaysia says",https://www.abc.net.au/news/2025-12-03/search-for-missing-flight-mh370-to-resume/106097466,ABC News,2025-12-03T03:53:04Z,maritime transport,"The search for missing Malaysia Airlines Flight MH370 will resume at the end of December, more than a decade after the Beijing-bound flight disappeared.",ABC News (AU),China,News,2025-12-05T18:30:35.579473Z
c1fc8de2f682521bff91f7e13cc88be0,Planning permission sought for €220m Europort project,https://www.rte.ie/news/leinster/2025/1203/1546992-rosslare-europort-development-project/,Marc O'Driscoll,2025-12-03T00:10:52Z,maritime transport,Iarnród Éireann has confirmed it is to seek planning permission for a major transformation of Rosslare Europort in Co Wexford.,RTE,Unknown,News,2025-12-05T18:30:35.579510Z
fd8c0a67f39e7d23b819da3ab6058e8d,Decarbonizing potential of global container shipping with hydrogen-based fuels,https://pubs.rsc.org/en/content/articlelanding/2025/ee/d5ee03477a,"Shijie Wei, Arnold Tukker, Bernhard Steubing",2025-12-03T00:00:00Z,maritime transport,"Energy Environ. Sci., 2025, Advance ArticleDOI: 10.1039/D5EE03477A, Paper Open Access &nbsp This article is licensed under a Creative Commons Attribution 3.0 Unported Licence.Shijie Wei, Arnold Tukker, Bernhard SteubingWe systematically assess the climate cha…",Royal Society of Chemistry,Global,News,2025-12-05T18:30:35.579558Z
4cd70a4b64ce88802bf0ea3763833dc8,"C-17 airlifts para field hospital to Colombo, Army deploys integrated task force to aid Sri Lanka",https://economictimes.indiatimes.com/news/defence/c-17-airlifts-para-field-hospital-to-colombo-army-deploys-integrated-task-force-to-aid-sri-lanka/articleshow/125723581.cms,PTI,2025-12-02T17:00:41Z,maritime transport,India is providing extensive aid to Sri Lanka after Cyclone Ditwah. The Indian Air Force airlifted a field hospital and relief supplies. The Indian Army deployed a special task force. Naval ships also delivered essential materials. These efforts aim to restor…,The Times of India,India,News,2025-12-05T18:30:35.579586Z
6e4a0a85da431f81fa1b6d1e4af8ab4c,India–Russia ties: What to expect from Putin’s high-stakes visit as New Delhi navigates US pressure,https://economictimes.indiatimes.com/news/economy/foreign-trade/indiarussia-ties-what-to-expect-from-putins-high-stakes-visit-as-new-delhi-navigates-us-pressure/articleshow/125722201.cms,ET Online,2025-12-02T16:57:25Z,maritime transport,"President Putin's visit marks a critical juncture for India, solidifying its position as Russia's largest oil supplier and a key defense partner. The summit aims to secure energy, defense, and payment mechanisms amidst global fragmentation, balancing India's …",The Times of India,India,News,2025-12-05T18:30:35.579616Z
b43001d24e4965278e82146a60c980f4,Fincantieri Marinette Marine Delivered Final Freedom-Class LCS,https://www.forbes.com/sites/petersuciu/2025/12/02/fincantieri-marinette-marine-delivered-final-freedom-class-lcs/,"Peter Suciu, Contributor, 
 Peter Suciu, Contributor
 https://www.forbes.com/sites/petersuciu/",2025-12-02T16:46:42Z,maritime transport,"Last month, the United States Navy took delivery of the USS Cleveland (LCS-31). The warship will be commissioned in a ceremony in Cleveland, Ohio, early next year",Forbes,USA,News,2025-12-05T18:30:35.579634Z
04e5591299a617d4b8a75861f02a2617,Opinion: We need frank talk about the ‘symbolic’ West Coast tanker ban,https://financialpost.com/opinion/opinion-frank-talk-symbolic-west-coast-tanker-ban,Special to Financial Post,2025-12-02T11:00:21Z,maritime transport,"Stewart Muir: On the coast of B.C., tanker safety causes people to jump into a time machine and transport us back to the 1980s. Read more.",Financial Post,Unknown,Analysis/Opinion,2025-12-05T18:30:35.579706Z
6db6dad5e83e1158a8f534dd3cd7ed90,Professor Patricia Thornley appointed as new DfT Chief Scientific Adviser,https://www.gov.uk/government/news/professor-patricia-thornley-appointed-as-new-dft-chief-scientific-adviser,Department for Transport,2025-12-02T11:00:01Z,maritime transport,"Professor Patricia Thornley brings extensive expertise across sustainable energy and clean transport, ensuring science advice is vital to decision-making.",Www.gov.uk,Unknown,News,2025-12-05T18:30:35.579742Z
45b8915d71b4bf6da9a21e87eed84264,Yet Another Russia-Linked Tanker Gets Attacked in the Black Sea,https://financialpost.com/pmn/business-pmn/yet-another-russia-linked-tanker-gets-attacked-in-the-black-sea,Bloomberg News,2025-12-02T09:47:36Z,maritime transport,"A fourth Russia-connected tanker in under a week was attacked on Tuesday, a sharp uptick in strikes on Moscow-associated shipping as the war in Ukraine nears a fifth year.",Financial Post,Russia,News,2025-12-05T18:30:35.579767Z
4adfaa9294fa6ac555ff380752b2ff3a,Russian-flagged tanker attacked in Black Sea – Türkiye,https://www.rt.com/news/628755-russian-tanker-attacked-black-sea/,RT,2025-12-02T08:51:59Z,maritime transport,"A Russian-flagged MIDVOLGA-2 tanker carrying sunflower oil to Georgia has been attacked off the Turkish coast, officials have said Read Full Article at RT.com",RT,Russia,News,2025-12-05T18:30:35.579791Z
1b7e7c4157bfbedbc21b13bdcb6bd33d,Another tanker hit in Black Sea attacks off Turkish shores,https://www.hurriyetdailynews.com/another-tanker-hit-in-black-sea-attacks-off-turkish-shores-216353,hurriyetdailynews.com,2025-12-02T07:32:15Z,maritime transport,"A Russian-flagged tanker loaded with sunflower oil came under attack Monday in the Black Sea, some 80 nautical miles off Türkiye's coast, marking the third such incident in a week amid escalating maritime tensions.",Hurriyet Daily News,Russia,News,2025-12-05T18:30:35.579816Z
6041a6575616d6d6318d7f584dc9e6f1,Aktsiaselts Infortar Reporting Calendar 2026,https://www.globenewswire.com/news-release/2025/12/02/3197596/0/en/Aktsiaselts-Infortar-Reporting-Calendar-2026.html,AS Infortar,2025-12-02T07:00:00Z,maritime transport,"During 2026, Aktsiaselts Infortar plans to disclose its financial results according to the following schedule:  25 FebruaryUnaudited 12-months interim......",GlobeNewswire,Unknown,Market Report,2025-12-05T18:30:35.579847Z
cb59040d4e4ce751b991563f16795a70,New delay for Turkish-built CalMac ferry MV Isle of Islay,https://www.bbc.com/news/articles/cdxwnlkr034o,,2025-12-02T06:55:50Z,maritime transport,The first of four new CalMac ferries being built in Turkey will not now arrive in Scotland until before Christmas.,BBC News,Turkey,News,2025-12-05T18:30:35.579870Z
826d52fddf7fa49216f6d1d83c0f153b,"Corfu Port: Impressive performance, confirming its role as a maritime hub in the Adriatic",https://www.naftemporiki.gr/english/2041113/corfu-port-impressive-performance-confirming-its-role-as-a-maritime-hub-in-the-adriatic/,Αλεξία Σωτηρίου,2025-12-02T06:32:50Z,maritime transport,"Τhe port of Corfu recorded one of the most impressive performances, confirming its role as a powerful maritime hub in the Adriatic.
The latest data from the Port Authority reflect…
Corfu Port: Impressive performance, confirming its role as a maritime hub in t…",Naftemporiki.gr,Unknown,News,2025-12-05T18:30:35.579919Z
e84b4b36f6a8778714bb7b6c52d649f1,Who Venezuela's key allies and opponents are in the face of a US conflict,https://www.abc.net.au/news/2025-12-02/us-venezuela-global-and-regional-alliances-amid-tensions/106086318,Luke Cooper,2025-12-02T04:20:30Z,maritime transport,"As the United States mounts pressure on Venezuelan President Nicolás Maduro, nations in the Caribbean, South America and across the world are revealing where their support lies.",ABC News (AU),USA,News,2025-12-05T18:30:35.579941Z
1f2d2be891065bc4a7085b010f6e17bc,Pacific island office enabling sanctions-busting ‘shadow fleets’,https://www.digitaljournal.com/world/pacific-island-office-enabling-sanctions-busting-shadow-fleets/article,AFP,2025-12-02T01:27:20Z,maritime transport,"Dozens of oil tankers suspected of smuggling contraband crude for Russia and Iran have been using a beachside office in the tropical South Pacific to cover their tracks, an AFP analysis of sanctions data has revealed. Nestled next to a pizza shop in the far-f…",Digital Journal,Russia,Analysis/Opinion,2025-12-05T18:30:35.579964Z
2b537f0c5ad8a6f3030bb86a5fc4a877,Brussels vows to press ahead with road decarbonisation despite political pushback,https://www.euractiv.com/interview/brussels-vows-to-press-ahead-with-road-decarbonisation-despite-political-pushback/,Brian Maguire,2025-12-01T21:20:02Z,maritime transport,"The Commission plans to defend its climate targets, address investment shortfalls in road infrastructure and reconcile ambitions for shifting traffic to greener modes.",EURACTIV,Unknown,News,2025-12-05T18:30:35.580000Z
3a31dc54819cfcaa56a7817f51d42583,Shipping is positive on ‘Sustainable Transport Investment Plan’ but transition concerns remain,https://www.euractiv.com/news/shipping-is-positive-on-sustainable-transport-investment-plan-but-transition-concerns-remain/,Vasiliki Angouridi,2025-12-01T21:02:31Z,maritime transport,"The Commission’s STIP plan is viewed as a positive first step for clean-fuel investment, but stronger measures and funding are needed, industry warns",EURACTIV,Unknown,Analysis/Opinion,2025-12-05T18:30:35.580039Z
370274bf684a14e6ade6d5e88f667bcc,African state denies ownership of vessel seized by Iran,https://www.rt.com/africa/628730-eswatini-denies-ownership-ship-seized-iran/,RT,2025-12-01T14:08:52Z,maritime transport,Eswatini has said it has no ships under its flag after Iran seized a fuel-smuggling vessel allegedly belonging to the kingdom Read Full Article at RT.com,RT,Unknown,News,2025-12-05T18:30:35.580074Z
d2e21bb4242251ee4065c03430bdf762,Hotel Indigo Opens Hotel in Torquay – The Heart of the English Riviera,https://www.hospitalitynet.org/announcement/41013686.html,Hotel Indigo Torquay by IHG,2025-12-01T11:08:28Z,maritime transport,"Hotel Indigo, part of IHG Hotels & Resorts luxury and lifestyle portfolio, officially opens the doors to Hotel Indigo Torquay. Set within the heart of the charming British coastal town in South Devon, the new boutique hotel is a stone’s throw from transport l…",Hospitality Net,UK,News,2025-12-05T18:30:35.580121Z
b665501a138afec56320dee9d35463a9,China bristles as Japan weighs missile export to Philippines,https://www.yahoo.com/news/articles/china-bristles-japan-weighs-missile-093000492.html,South China Morning Post,2025-12-01T09:30:00Z,maritime transport,"Tokyo is considering exporting a missile system to the Philippines as it seeks to ease its weapons-export restrictions, Japanese media reported - a move...",Yahoo Entertainment,China,Market Report,2025-12-05T18:30:35.580133Z
f1a47ec82819aa478ea3b83f67ae5ef9,Greek-Saudi cooperation in shipping,https://www.naftemporiki.gr/english/2040666/greek-saudi-cooperation-in-shipping/,Ελίζα Καραγιώργη,2025-12-01T08:56:33Z,maritime transport,"The Minister of Maritime Affairs and Insular Policy, Vassilis Kikilias, had a private meeting with the Deputy Minister of Transport of Saudi Arabia, Dr. Rumaih Al-Rumaih, on the sidelines of…
Greek-Saudi cooperation in shipping - Η ΝΑΥΤΕΜΠΟΡΙΚΗ",Naftemporiki.gr,Greece,News,2025-12-05T18:30:35.580173Z
dec4121402e3be81639103505497cd2e,PLA Navy's Type 075 amphibious assault ship can carry Army's Z-10 helicopter: official media report,https://www.globalsecurity.org/wmd/library/news/china/2025/11/china-251130-globaltimes02.htm,John Pike,2025-12-01T07:14:35Z,maritime transport,"The Type 075 amphibious assault ship of the Chinese People's Liberation Army (PLA) Navy can carry the PLA Army's Z-10 attack helicopter, in addition to the Navy's own helicopters, air-cushioned landing craft and amphibious armored vehicles, according to an of…",Globalsecurity.org,China,Market Report,2025-12-05T18:30:35.580191Z
0c5b93292a647e513bbff5e447b79ea5,Europe Needs a Broader Vision for Decarbonising Road Transport,https://www.euractiv.com/opinion/europe-needs-a-broader-vision-for-decarbonising-road-transport/,Laurine Augere,2025-12-01T06:00:29Z,maritime transport,"Carmakers, automotive suppliers and fuel manufacturers call for inclusion of renewable fuels in CO₂ standards for light-duty vehicles, urging coherent regulation and clear long-term frameworks to support investments, industry competitiveness and decarbonisati…",EURACTIV,Unknown,News,2025-12-05T18:30:35.580238Z
744251b75c81a7c31a172895c5700987,Aktsiaselts Infortar own share acquisition transactions,https://www.globenewswire.com/news-release/2025/12/01/3196644/0/en/Aktsiaselts-Infortar-own-share-acquisition-transactions.html,AS Infortar,2025-12-01T06:00:00Z,maritime transport,Aktsiaselts Infortar acquired its own shares on the Nasdaq Tallinn Stock Exchange during the period of 24 – 28 November 2025 as follows: DateAggregated......,GlobeNewswire,Unknown,News,2025-12-05T18:30:35.580277Z
