article_id,title,link,creator,pubdate,category,description,source,country,article_type,scrape_timestamp
097c2397098460caff76c36b21955f22,Swiss mining giant Glencore in merger talks with Rio Tinto,https://www.digitaljournal.com/world/swiss-mining-giant-glencore-in-merger-talks-with-rio-tinto/article,AFP,2026-01-08T22:47:33Z,coal demand,Swiss mining and commodity trading giant Glencore said Friday it is in merger talks with British-Australian rival Rio Tinto. Glencore said it was in preliminary discussions with Rio Tinto “about a possible combination of some or all of their businesses”. The …,Digital Journal,Australia,Market Report,2026-01-13T12:52:56.287544Z
15bd6a32455a6fa726804b0f7ce23304,Oil Companies Are Key Partners in Trump’s Imperial Plans for Latin America,https://truthout.org/articles/oil-companies-are-key-partners-in-trumps-imperial-plans-for-latin-america/,Derek Seidman,2026-01-08T21:49:47Z,coal demand,"Stocks in ExxonMobil, Halliburton, and ConocoPhillips surged the day after Trump’s illegal attack on Venezuela.",Truthout,USA,News,2026-01-13T12:52:56.287571Z
ca1a0de4b99e5ae61e7d8c915b280b04,From scourge to saviour: How the sun powered the grid through a heatwave,https://www.abc.net.au/news/2026-01-09/solar-powers-australia-through-heatwave-conditions/106211394,Daniel Mercer,2026-01-08T19:01:56Z,coal demand,"For so long, the pounding sunshine of an Australian heatwave was the grid's biggest threat. It has now become its greatest asset.",ABC News (AU),Australia,News,2026-01-13T12:52:56.287589Z
2d9e9615d946d5f3bf9bf9495ce9ea6b,"BCCL IPO: Cheap on paper, costly in a downcycle; why Coal India may be the smarter pick",https://www.thehindubusinessline.com/portfolio/stock-fundamental-analysis-india/bccl-ipo-cheap-on-paper-costly-in-a-downcycle-why-coal-india-may-be-the-smarter-pick/article70487935.ece,Kumar Shankar Roy & BL Research Bureau,2026-01-08T16:44:40Z,coal demand,"FY25 multiples look tempting, but profits have already cooled and costs are rising—making Coal India’s diversified cash flows the steadier exposure.",BusinessLine,India,News,2026-01-13T12:52:56.287614Z
8ad25176c55c3363d15679cb02821b41,"ED raids on I-PAC: BJP accuses Mamata of ‘destroying evidence’, CPI(M) demands her arrest",https://indianexpress.com/article/cities/kolkata/bjp-accuses-mamata-ed-raids-i-pac-destroying-evidence-cpim-arrest-10462801/,Ravik Bhattacharya,2026-01-08T15:17:09Z,coal demand,Congress’s Adhir questions Trinamool chief’s ‘selective outrage’ on ED raids,The Indian Express,Unknown,News,2026-01-13T12:52:56.287656Z
730bad13d195a7fc682c7d4e7e8fdf94,Nvidia’s Vera Rubin keeps crypto networks like Render in demand,https://cointelegraph.com/news/nvidia-vera-rubin-crypto-networks-render-demand,Cointelegraph by Yohan Yun,2026-01-08T13:59:19Z,coal demand,"Nvidia’s Vera Rubin slashes AI costs, challenging decentralized GPU networks like Render that thrive on scarce and underused computing power.",Cointelegraph,Unknown,News,2026-01-13T12:52:56.287712Z
a8804efa3aacf4d953b77ca2f91c0ea9,Indonesia to cut coal production to around 600 million tons in 2026,https://en.antaranews.com/news/399053/indonesia-to-cut-coal-production-to-around-600-million-tons-in-2026,"Putu Indah, Raka Adji",2026-01-08T12:44:08Z,coal demand,"The Indonesian Ministry of Energy and Mineral Resources plans to reduce coal production to around 600 million tons in 2026, nearly 200 million tons lower than ...",Antaranews.com,Indonesia,News,2026-01-13T12:52:56.287742Z
6e8751ccbc8f7e91c0092dcde0fd47ce,Retail trader hero Eric Jackson says investors missed the big takeaway from Jensen Huang's CES talk,https://www.businessinsider.com/nvidia-jensen-huang-eric-jackson-ces-rubin-ai-chips-infrastructure-2026-1,sobrient@insider.com (Samuel O'Brient),2026-01-08T10:45:01Z,coal demand,"Jackson said that faster chips aren't the big news from Jensen Huang's talk. Instead, the shifting nature of AI infrastructure is the key takeaway.",Business Insider,Unknown,News,2026-01-13T12:52:56.287781Z
6795c29fbb9ac636e94d41733ee737ad,Why 2026 is make or break for Vedanta’s aluminium raw material security,https://www.livemint.com/companies/2026-vedanta-s-aluminium-raw-material-security-captive-bauxite-11767852980210.html,"Dipali Banka, Nehal Chaliawala",2026-01-08T09:13:20Z,coal demand,"Vedanta is navigating a high-stakes transition in 2026 to secure captive bauxite for its aluminium business, which accounts for almost half of its Ebitda.",Livemint,Unknown,News,2026-01-13T12:52:56.287825Z
9240011f1e0b203c8b4d6d22fe11c5b1,Australian State Faces Catastrophic Fire Risk From Heat Wave,https://www.insurancejournal.com/news/international/2026/01/08/853541.htm,Admin,2026-01-08T06:25:07Z,coal demand,Australia is bracing for catastrophic fire risk in parts of Victoria on Friday as the country swelters through its worst heat wave since the Black Summer bushfires in the summer of 2019 and 2020. Temperatures rose above 45C (113F) in …,Insurance Journal,Australia,News,2026-01-13T12:52:56.287849Z
78e294e794764c7755f74f45d1d89a13,Bharat Coking Coal IPO opens tomorrow; GMP signals strong debut with 50% premium. Here are key details,https://economictimes.indiatimes.com/markets/ipos/fpos/bharat-coking-coal-ipo-opens-tomorrow-gmp-signals-strong-debut-with-50-premium-here-are-key-details/articleshow/126408107.cms,Ritesh Presswala,2026-01-08T06:14:30Z,coal demand,"As of January 8, the IPO’s grey market premium (GMP) is around Rs 11.5, implying a 50% premium over the upper end of the price band of Rs 23.",The Times of India,Unknown,Market Report,2026-01-13T12:52:56.287887Z
22a7452dcf9321fc1ce12c187337a784,Coal India's five-year run creates Rs 1.8 lakh crore wealth for investors. Can Bharat Coking Coal match it?,https://economictimes.indiatimes.com/markets/stocks/news/coal-indias-five-year-run-creates-rs-1-8-lakh-crore-wealth-for-investors-can-bharat-coking-coal-match-it/articleshow/126406410.cms,Akash Podishetti,2026-01-08T04:24:44Z,coal demand,"Coal India's five-year run generated Rs 1.8 lakh crore in investor wealth, driven by commodity cycles and PSU re-rating. Now, its subsidiary Bharat Coking Coal (BCCL) seeks funds, aiming to replicate this success with its strategic coking coal assets and expa…",The Times of India,India,News,2026-01-13T12:52:56.288007Z
5fbc87ef2d284e7e973fafad6e2e7381,Australian State Faces Catastrophic Fire Risk From Heat Wave,https://financialpost.com/pmn/business-pmn/australian-state-faces-catastrophic-fire-risk-from-heat-wave,Bloomberg News,2026-01-08T01:31:03Z,coal demand,Australia is bracing for catastrophic fire risk in parts of Victoria on Friday as the country swelters through its worst heat wave since the Black Summer bushfires in the summer of 2019 and 2020.,Financial Post,Australia,News,2026-01-13T12:52:56.288024Z
8979ac7f165cf6c2a69043e7ee08b72f,Can Bharat Coking Coal’s IPO deliver long-term value for retail investors?,https://economictimes.indiatimes.com/markets/ipos/fpos/can-bharat-coking-coals-ipo-deliver-long-term-value-for-retail-investors/articleshow/126404576.cms,Sachin Kumar,2026-01-08T00:45:43Z,coal demand,"Bharat Coking Coal plans a ₹1,071 crore Offer for Sale, reducing Coal India's stake to 90%. The company is poised to benefit from rising steel demand and is expanding its operations with new washeries. Despite strong growth, investors should note customer con…",The Times of India,India,News,2026-01-13T12:52:56.288054Z
a7f38b19fc95dafbe579024ced133396,"Energy Investors Rearrange Priorities, Focus on Supply",https://oilprice.com/Energy/Energy-General/Energy-Investors-Rearrange-Priorities-Focus-on-Supply.html,Irina Slav,2026-01-08T00:00:00Z,coal demand,"For years, energy investors flocked to anything labeled “green” or “clean”, with governments making it clear that there is only one energy policy path forward, and that is the green, clean one. That ended in 2025 with the rise of AI, which caused a surge in e…",OilPrice.com,Unknown,News,2026-01-13T12:52:56.288103Z
b92df8026e7fd36c7faf9f3b39ecd17a,UK renewables enjoy record year in 2025 – but gas power still rises,https://skepticalscience.com/uk-renewables-record-2025.html,,2026-01-07T22:06:16Z,coal demand,"This is a re-post from Carbon Brief
The UK’s fleet of wind, solar and biomass power plants all set new records in 2025, Carbon Brief analysis shows, but electricity generation from gas still went up.
The rise in gas power was due to the end of UK coal generat…",Skepticalscience.com,Unknown,Analysis/Opinion,2026-01-13T12:52:56.288145Z
09b47009b0dd082fea6d482b9c928007,Elon Musk's xAI Secures Massive Power Infrastructure with Five 380 MW Natural Gas Turbines,https://www.ibtimes.com/elon-musks-xai-secures-massive-power-infrastructure-five-380-mw-natural-gas-turbines-3794652,Michael Lee,2026-01-07T21:50:14Z,coal demand,Elon Musk's xAI confirms purchase of five 380 MW natural gas turbines from Doosan Enerbility to power massive AI supercomputing expansion in 2026.,International Business Times,Unknown,News,2026-01-13T12:52:56.288180Z
97b4fb7a10b12e751bc4b0cbfac2804c,Want To End Wars For Oil? Do A Clean Energy.,https://www.wonkette.com/p/want-to-end-wars-for-oil-do-a-clean,Doktor Zoom,2026-01-07T16:01:38Z,coal demand,Caveat: Trump is already immune to things that make sense.,Wonkette.com,Unknown,News,2026-01-13T12:52:56.288206Z
507ec82800c721e90e7a09e2bd4f0212,"In Colorado, one regulatory body oversees everything from home energy costs to driverless cars",https://www.denverpost.com/2026/01/07/colorado-public-utilities-commission-puc/,Judith Kohler,2026-01-07T13:00:36Z,coal demand,"""Everything we touch impacts the daily lives of Coloradans."" So says Rebecca White, director of the Colorado Public Utilities Commission.",The Denver Post,Unknown,Market Report,2026-01-13T12:52:56.288353Z
12f46882388dbfba6170728332a88ecd,"Steel cos hike prices by ₹4,000/tonne post safeguard levy",https://www.thehindubusinessline.com/news/steel-cos-hike-prices-by-4000tonne-post-safeguard-levy/article70482212.ece,Suresh P Iyengar,2026-01-07T12:43:06Z,coal demand,"Steel companies raise prices by ₹4,000/tonne following government safeguard duty, aligning costs closer to import levels.",BusinessLine,Unknown,Market Report,2026-01-13T12:52:56.288386Z
bf4a8bab65706ce5e7d33f30f3602518,'Venezuela has oil',https://theecologist.org/2026/jan/07/venezuela-has-oil,brendan,2026-01-07T12:08:00Z,coal demand,The kidnapping of the Venezuelan president and attempt to seize the country's oil is act of desperation from the US hegemony.,Theecologist.org,Unknown,News,2026-01-13T12:52:56.288415Z
6df9ca149334a77ca55a77acc5ccc6fb,PV Power commissions Nhon Trach 3&4 gas-fired power plant in Vietnam,https://www.power-technology.com/news/pv-power-commissions-nhon-trach/,Anwesha Pattanaik,2026-01-07T10:20:01Z,coal demand,"Equipped with 9HA.02 gas turbines, the LNG-fired Nhon Trach 3&4 plant is expected to help meet rising power needs in southern Vietnam.",Power Technology,Unknown,News,2026-01-13T12:52:56.288448Z
017f27ff1e3132d5abbf9f47d10a6fe3,How clean energy could save us trillions,https://www.dw.com/en/fossil-fuel-price-tag-cost-of-energy-transition-solar-wind-future/a-75237447,Charli Shield,2026-01-07T08:44:00Z,coal demand,"As clean energy prices fall, a fast transition to renewable energy is the cheapest option on the table. Experts say it could save us trillions in energy costs alone.",DW (English),Unknown,Market Report,2026-01-13T12:52:56.288478Z
596610bf7107b44b6d6eb162e1d1cc25,Monopoly business: 5 reasons why SBI Securities says subscribe to Bharat Coking Coal IPO,https://economictimes.indiatimes.com/markets/stocks/news/monopoly-business-5-reasons-why-sbi-securities-says-subscribe-to-bharat-coking-coal-ipo/articleshow/126389444.cms,Akash Podishetti,2026-01-07T07:27:17Z,coal demand,"SBI Securities recommends subscribing to the Bharat Coking Coal IPO, citing its dominant market position, long reserve life, capacity expansion plans and reasonable valuation, even as India faces a structural coking coal shortage driven by rising steel demand.",The Times of India,India,Market Report,2026-01-13T12:52:56.288497Z
f19638c806ccce850d45abdbadfa800a,"Net Zero: Fantasy, Red Herring, or Reality?",https://www.counterpunch.org/2026/01/07/net-zero-fantasy-red-herring-or-reality/,John K. White,2026-01-07T06:58:07Z,coal demand,"Ten years after the 2015 Paris Agreement provided a framework to keep average global temperatures from rising 1.5 °C (2.7 °F) above pre-industrial levels, the world continues to advance towards climate breakdown. Time is running out on a human-induced Anthrop…",CounterPunch,Global,News,2026-01-13T12:52:56.288545Z
c78caab3c8918658d5e19f20c0e9fd2f,Fossil Fuels Are Not Going Away: Why the Boulder Climate Case Is So Dangerous and SCOTUS Must Step In,https://wattsupwiththat.com/2026/01/06/fossil-fuels-are-not-going-away-why-the-boulder-climate-case-is-so-dangerous-and-scotus-must-step-in/,Guest Blogger,2026-01-07T06:00:00Z,coal demand,Climate litigation like Boulder is the exact opposite of making progress and the ultimate shoot yourself in the foot energy-climate thinking that Americans rejected when all seven battleground states voted for President Trump for a second time in November 202…,Wattsupwiththat.com,USA,News,2026-01-13T12:52:56.288574Z
1900ce910e3e0b61cad17d8b17bebd6a,Domestic steel prices rise after safeguard duty,https://www.livemint.com/industry/domestic-steel-prices-rise-safeguard-duty-capacity-utilization-11767697590819.html,Dipali Banka,2026-01-07T03:15:06Z,coal demand,The increase in domestic price so far appears to be sustainable with more headroom for increase. However growth in domestic capacity and capacity utilization might restrict gains.,Livemint,Unknown,Market Report,2026-01-13T12:52:56.288619Z
866d39f53d625fa122db5f1e76146746,Venezuelan Oil: Statism to Liberation?,https://wattsupwiththat.com/2026/01/06/venezuelan-oil-statism-to-liberation/,Guest Blogger,2026-01-07T02:00:00Z,coal demand,"There will be many geopolitical ramifications from the Venezuelan leadership change, including the termination of sanctions on Venezuela and its oil. President Trump indicated a willingness to sell oil to China, helping Venezuela to pay down its $60 billion d…",Wattsupwiththat.com,China,News,2026-01-13T12:52:56.288640Z
74371f39500d7ed1821e3b940b6e1105,Constellation Energy Stock: Why Nuclear Is the New Tech Trade,https://www.marketbeat.com/originals/constellation-energy-stock-why-nuclear-is-the-new-tech-trade/?utm_source=yahoofinance&amp;utm_medium=yahoofinance,"Jeffrey Neal Johnson, MarketBeat",2026-01-06T21:20:00Z,coal demand,Constellation Energy is transforming from a traditional utility into an infrastructure partner for tech giants by powering the data centers needed for AI.,MarketBeat,Unknown,News,2026-01-13T12:52:56.288718Z
2f4e80efe4ca0a9a6eaed098f7430b20,The Great Energy Contradiction of 2026,https://oilprice.com/Energy/Energy-General/The-Great-Energy-Contradiction-of-2026.html,Robert Rapier,2026-01-06T19:00:00Z,coal demand,"If 2025 felt like a year of mixed signals in energy markets, 2026 will feel like a contradiction. We are entering a year defined by divergence—a paradox in which the world has too much of what once worried us most, and not nearly enough of what we assumed wou…",OilPrice.com,Unknown,Market Report,2026-01-13T12:52:56.288761Z
d9871e032cca0225e2eeb066e47f202c,"Coal output nears demand, exports may follow: Reddy",https://economictimes.indiatimes.com/industry/indl-goods/svs/metals-mining/coal-output-nears-demand-exports-may-follow-reddy/articleshow/126379726.cms,ET Bureau,2026-01-06T17:47:22Z,coal demand,"India is on the brink of achieving coal self-sufficiency, creating opportunities for selective coal exports while keeping domestic needs first. The nation is enhancing production capabilities, boosting quality, and streamlining supply chains. Upcoming reforms…",The Times of India,India,News,2026-01-13T12:52:56.288790Z
ab1477dac754f4723825fcc070ec4701,Goldman Sachs Warns US Grids Face Power Crunch by 2030,https://financialpost.com/pmn/business-pmn/goldman-sachs-warns-us-grids-face-power-crunch-by-2030,Bloomberg News,2026-01-06T17:01:07Z,coal demand,"Almost all US power grids will lack critical spare capacity by 2030 as demand surges to supply data centers, with bottlenecks threatening to hand China an edge in the artificial-intelligence boom, according to an analyst at Goldman Sachs Group Inc.",Financial Post,China,News,2026-01-13T12:52:56.288806Z
691b9ad56f41d14da61473bb1add8a70,How the stock market could sink Trump in 2026,https://www.thehindubusinessline.com/opinion/how-the-stock-market-could-sink-trump-in-2026/article70479383.ece,Desmond  Lachman,2026-01-06T15:59:13Z,coal demand,"Spike in long-term interest rates, deflation of the AI bubble, economic reversals abroad, and unforeseen geopolitical events could hurt the US economy and the already overpriced stock market",BusinessLine,Unknown,Market Report,2026-01-13T12:52:56.288838Z
c3b7c157ce90e6d7bfb6b8b0573d34ff,India imported €144 billion worth of Russian oil since Ukraine war,https://economictimes.indiatimes.com/news/economy/foreign-trade/india-imported-euro-144-billion-worth-of-russian-oil-since-ukraine-war/articleshow/126377016.cms,PTI,2026-01-06T15:00:05Z,coal demand,India has become a major buyer of Russian crude oil since the Ukraine war. The country imported billions of euros worth of oil. This trade continues despite international sanctions. Some Indian companies have stopped purchases due to new US sanctions. Other r…,The Times of India,India,News,2026-01-13T12:52:56.288869Z
c95d2b15f103a5f34ee1dc36ee5ff59b,"Blackboxstocks (NASDAQ: BLBX) Merger Target, REalloys and Mission Critical Materials Form Strategic Partnership to Build First U.S. Mine-Waste-to-Magnet Supply Chain",https://www.globenewswire.com/news-release/2026/01/06/3213762/0/en/Blackboxstocks-NASDAQ-BLBX-Merger-Target-REalloys-and-Mission-Critical-Materials-Form-Strategic-Partnership-to-Build-First-U-S-Mine-Waste-to-Magnet-Supply-Chain.html,"Blackboxstocks, Inc.",2026-01-06T14:30:00Z,coal demand,"BlackboxStocks (NASDAQ: BLBX) Merger Target, REalloys and Mission Critical Materials Form Strategic Partnership...",GlobeNewswire,Unknown,News,2026-01-13T12:52:56.288909Z
f22cbd583dc338b27afe3a62c0269258,"Budget 2026: Supercharge this sector for global clout, domestic growth",https://economictimes.indiatimes.com/industry/renewables/budget-2026-renewables-sector-supercharge-this-sector-for-global-clout-domestic-growth-renewables-manufacturing/articleshow/126376224.cms,ET Online,2026-01-06T14:13:48Z,coal demand,"Budget 2026: Renewables manufacturing is crucial for India's economic and geopolitical future, offering energy security and sustainable growth. The sector can create millions of jobs and position India as a global alternative to China in clean-energy supply c…",The Times of India,China,News,2026-01-13T12:52:56.288931Z
255c06a51adec9d4af259c757d4490d8,Cement firms to log better Q3 profit despite pricing pressure,https://www.thehindubusinessline.com/companies/cement-cos-to-log-better-q3-profit-despite-pricing-pressure/article70478151.ece,Suresh P Iyengar,2026-01-06T14:09:11Z,coal demand,"Cement companies forecast 30% Q3 profit rise despite pricing pressures, driven by increased demand and lower input costs.",BusinessLine,Unknown,Analysis/Opinion,2026-01-13T12:52:56.288959Z
58fff6b37bd7a57f98eeb24fee6f88ee,"Smart Logistics Global Limited Establishes Northern Supply Chain Center in Xuzhou, Strengthens Nationwide Network",https://financialpost.com/globe-newswire/smart-logistics-global-limited-establishes-northern-supply-chain-center-in-xuzhou-strengthens-nationwide-network,GlobeNewswire,2026-01-06T14:04:40Z,coal demand,"HONG KONG, Jan. 06, 2026 (GLOBE NEWSWIRE) — Smart Logistics Global Limited (Nasdaq: SLGB) (the “Company”), a Hong Kong-based business-to-business contract logistics solution provider, today announced it has established a Northern Supply Chain Center in Xuzhou…",Financial Post,Global,News,2026-01-13T12:52:56.289010Z
adc3a3fc2f88dae8bbb73b7bf62ea754,The battle over a global energy transition is on between petro-states and electro-states – here’s what to watch for in 2026,https://theconversation.com/the-battle-over-a-global-energy-transition-is-on-between-petro-states-and-electro-states-heres-what-to-watch-for-in-2026-272205,"Jennifer Morgan, Senior Fellow, Center for International Environment and Resource Policy and Climate Policy Lab, Tufts University",2026-01-06T13:38:06Z,coal demand,"While wind and solar energy led in investments globally, liquefied natural gas is also booming.  A former climate envoy for Germany explains what’s coming and the countries to watch.",The Conversation Africa,Germany,News,2026-01-13T12:52:56.289055Z
59ade780a41962a0083015183d7c96c8,"Oil markets facing biggest glut since COVID, leaving prices in the basement: new forecast",https://financialpost.com/commodities/energy/oil-gas/oil-markets-glut-covid-prices-basement-new-forecast,Meghan Potkins,2026-01-06T12:34:51Z,coal demand,Oil prices could slide further in 2026 amid deepening geopolitical uncertainty and a global crude market facing oversupply. Read more.,Financial Post,Global,Analysis/Opinion,2026-01-13T12:52:56.289084Z
c803f959e8419429aaab9a09676d28e1,Osaka Gas begins operations at new Himeji plant in Japan,https://www.power-technology.com/news/osaka-gas-operations-himeji-japan/,Salong Debbarma,2026-01-06T12:23:10Z,coal demand,"The Himeji power station comprises two units, each with a capacity of 622.6MW.",Power Technology,Japan,News,2026-01-13T12:52:56.289104Z
b87b8d93d0a5f334b20a7ea3f9d3f00a,Akola Group controlled company “Linas Agro” secures EUR 30 million financing from international bank Citibank,https://www.globenewswire.com/news-release/2026/01/12/3216555/0/en/Akola-Group-controlled-company-Linas-Agro-secures-EUR-30-million-financing-from-international-bank-Citibank.html,AB Akola Group,2026-01-12T07:30:00Z,grain exports,"“Linas Agro”, one of the largest agribusiness companies in Lithuania and part of AB Akola Group, has signed a EUR 30 million working capital financing agreement with Citibank N.A., London Branch. The funds will be used to finance grain purchasing operations a…",GlobeNewswire,UK,News,2026-01-13T12:52:56.672208Z
c417e9c105bbbb5986aa982431d107fb,The Trump Administration’s ‘Magical Thinking’ on Cuba,https://www.theatlantic.com/national-security/2026/01/trump-cuba-havana-venezuela-maduro/685579/,Vivian Salama,2026-01-11T12:00:00Z,grain exports,"Havana is under pressure after Maduro’s ouster, but the regime’s resilience is legendary.",The Atlantic,Unknown,News,2026-01-13T12:52:56.672288Z
af6d14a5d9519d62b1e4e14201874ac1,One Agriculture Equipment Giant Dominated Last Month Despite Sector Challenges,https://247wallst.com/investing/2026/01/10/one-agriculture-equipment-giant-dominated-last-month-despite-sector-challenges/,William Temple,2026-01-10T14:12:05Z,grain exports,"The U.S. economy added just 50,000 jobs in December, marking the slowest labor market expansion in years and pushing unemployment to 4.4%. This cooling...",24/7 Wall St.,Unknown,Market Report,2026-01-13T12:52:56.672350Z
a2a2e534efd4e6e15e36cd4b85a69c62,India’s record rice crop is set to deepen slide in global prices,https://www.bloomberg.com/news/articles/2026-01-09/india-s-record-rice-crop-is-set-to-deepen-slide-in-global-prices,Bloomberg,2026-01-10T08:20:17Z,grain exports,"Indian farmers are wrapping up another bumper rice harvest, adding a wave of grain to the global market that’s already well supplied and likely putting further pressure on benchmark prices.",Bloomberg,India,Market Report,2026-01-13T12:52:56.672389Z
dbd3cc47e886fe10457b406c0572b149,India’s record rice crop is set to deepen slide in global prices,https://economictimes.indiatimes.com/news/economy/agriculture/indias-record-rice-crop-is-set-to-deepen-slide-in-global-prices/articleshow/126449188.cms,Bloomberg,2026-01-10T07:40:00Z,grain exports,"India's record rice harvest is flooding the global market, pressuring prices as demand weakens and key buyers impose stricter import rules.  Farmers may face significant rate cuts to compete with rivals like Thailand and Vietnam.  Analysts predict a potential…",The Times of India,India,Market Report,2026-01-13T12:52:56.672428Z
88e5d5a3b1cfe6cd992af479e85ea810,India's 2025 rice exports surge 19.4% to 21.55 ‍mt as curbs are lifted,https://www.thehindubusinessline.com/economy/agri-business/indias-2025-rice-exports-surge-194-to-2155-mt-as-curbs-are-lifted/article70493839.ece,Reuters,2026-01-10T07:04:43Z,grain exports,"India’s rice exports jumped ​19.4 per cent last year to the second-highest on record after New Delhi lifted all export curbs, making shipments more competitive",BusinessLine,India,News,2026-01-13T12:52:56.672471Z
39a983c606c99360d92749092f604712,India's 2025 rice exports surge to near record as curbs lifted,https://economictimes.indiatimes.com/news/economy/agriculture/indias-2025-rice-exports-surge-to-near-record-as-curbs-lifted/articleshow/126448623.cms,Reuters,2026-01-10T06:35:25Z,grain exports,"India’s rice exports rose 19.4% last year to 21.55 million tonnes, the second-highest level on record, after the government lifted all export curbs. Officials said shipments recovered quickly from March as supplies improved on record production and the last r…",The Times of India,India,News,2026-01-13T12:52:56.672518Z
