article_id,title,link,creator,pubdate,category,description,source,country,article_type,scrape_timestamp
b4164b25243070b668a267f7ff69e7a1,Bio-based Pouching Material Market Trends 2026-35,https://www.globenewswire.com/news-release/2026/01/23/3224843/0/en/Bio-based-Pouching-Material-Market-Trends-2026-35.html,Precedence Research,2026-01-23T14:14:00Z,dry bulk shipping,"According to Towards Packaging consultants, the global bio-based pouching material market is projected to reach approximately USD 1256.06 million by 2035, increasing from USD 735.34 million in 2025, at a CAGR of 5.5% during the forecast period 2026 to 2035. A…",GlobeNewswire,Global,Analysis/Opinion,2026-01-26T18:39:38.374158Z
48bf5092f4d17006647ca4ae8354cec9,"Ship Leasing Market Projected to Reach US$ 68.76 Billion by 2035, Supported by Changing Global Shipping Patterns Says Astute Analytica",https://www.globenewswire.com/news-release/2026/01/23/3224765/0/en/Ship-Leasing-Market-Projected-to-Reach-US-68-76-Billion-by-2035-Supported-by-Changing-Global-Shipping-Patterns-Says-Astute-Analytica.html,AstuteAnalytica India Pvt. Ltd.,2026-01-23T13:30:00Z,dry bulk shipping,"Driven by North American capital and Asian manufacturing, the sector has shifted from bank debt to Sale and Leaseback models. Strict environmental regulations are now rewriting asset values, creating a distinct split between premium eco-vessels and obsolete l…",GlobeNewswire,USA,Market Report,2026-01-26T18:39:38.374201Z
740cad44e2f285178bb8b664b8898d14,"Green Methanol Ships Research Report 2026 - Global Industry Size, Share, Trends, Opportunity, and Forecast, 2021-2031",https://www.globenewswire.com/news-release/2026/01/23/3224664/28124/en/Green-Methanol-Ships-Research-Report-2026-Global-Industry-Size-Share-Trends-Opportunity-and-Forecast-2021-2031.html,Research and Markets,2026-01-23T12:42:00Z,dry bulk shipping,"The Green Methanol Ships Market is driven by stringent decarbonization mandates, with a demand spike for methanol-fueled vessels. Opportunities lie in newbuild orders, fleet renewals, and expanding green methanol production. Challenges include high costs and …",GlobeNewswire,Global,Analysis/Opinion,2026-01-26T18:39:38.374248Z
f731c89b44e6ff2348134ce83851ce90,"Stock Market Highlights 23 January 2026: Sensex ended 769.67 pts or 0.94% lower at 81,537.70, Nifty 50 fell by 241.25 pts or 0.95% to 25,048.65.",https://www.thehindubusinessline.com/markets/share-market-nifty-sensex-highlights-23-january-2026/article70538438.ece,"Team BL, KS Badri Narayanan",2026-01-23T01:21:52Z,dry bulk shipping,"Sensex, Nifty, Share Price Highlights: - Indian shares fell on ‍Friday and posted weekly losses as sustained foreign outflows and ​a mixed earnings season outweighed relief from easing geopolitical tensions ‌linked to Greenland. The Nifty 50 fell 0.95% ​to 25…",BusinessLine,India,Market Report,2026-01-26T18:39:38.374273Z
2a64c6c110846572bc622bfe6a2e75ce,"Marine Vessel Energy Efficiency Research Report 2026: $3.39 Bn Market Opportunities, Trends, Competitive Landscape, Strategies, and Forecasts, 2020-2025, 2025-2030F, 2035F",https://www.globenewswire.com/news-release/2026/01/21/3223153/28124/en/Marine-Vessel-Energy-Efficiency-Research-Report-2026-3-39-Bn-Market-Opportunities-Trends-Competitive-Landscape-Strategies-and-Forecasts-2020-2025-2025-2030F-2035F.html,Research and Markets,2026-01-21T17:37:00Z,dry bulk shipping,"The marine vessel energy efficiency market is driven by rising fuel costs, stricter emission regulations, and growing international trade. Key opportunities include adopting autonomous and electric vessels, retrofitting for energy savings, using alternative f…",GlobeNewswire,Global,Analysis/Opinion,2026-01-26T18:39:38.374325Z
afffafdf372729d6a8b1f22d94f6030a,Icon Energy Corp. Announces Updates in Connection with the SEPA,https://www.globenewswire.com/news-release/2026/01/21/3222951/0/en/Icon-Energy-Corp-Announces-Updates-in-Connection-with-the-SEPA.html,Icon Energy Corp.,2026-01-21T14:40:00Z,dry bulk shipping,"ATHENS, Greece, Jan. 21, 2026 (GLOBE NEWSWIRE) -- Icon Energy Corp. (“Icon” or the “Company”) (Nasdaq: ICON), an international shipping company providing worldwide seaborne transportation services for dry bulk cargoes via its fleet of oceangoing vessels, anno…",GlobeNewswire,Greece,News,2026-01-26T18:39:38.374386Z
b9ad9efb100b2b65099b92b731b409bd,Genco Shipping & Trading Limited Announces Fourth Quarter 2025 Conference Call and Webcast,https://www.globenewswire.com/news-release/2026/01/20/3222276/37397/en/Genco-Shipping-Trading-Limited-Announces-Fourth-Quarter-2025-Conference-Call-and-Webcast.html,Genco Shipping & Trading Limited,2026-01-20T21:15:00Z,dry bulk shipping,"NEW YORK, Jan. 20, 2026 (GLOBE NEWSWIRE) -- Genco Shipping & Trading Limited (NYSE: GNK) announced today that it will hold a conference call to discuss the Company’s results for the fourth quarter of 2025 on Wednesday, February 18, 2026 at 8:30 a.m. Eastern T…",GlobeNewswire,Unknown,Market Report,2026-01-26T18:39:38.374433Z
cb322589feb773a73de421511106cc2d,"Stewart Brand – Maintenance: Of Everything, Part One",https://press.stripe.com/maintenance-part-one,,2026-01-20T19:01:30Z,dry bulk shipping,"An in-depth exploration of maintenance, and a powerful argument for its civilizational importance.",Stripe.com,Unknown,News,2026-01-26T18:39:38.374478Z
8e463a42f83c0d8921fe30d61f3205fa,"The Left in shock over President Maria…of Niki (Lord have mercy), Brussels eats up Davos, “for sale” signs in IT, Marios shops from Attica",https://en.protothema.gr/2026/01/20/the-left-in-shock-over-president-mariaof-niki-lord-have-mercy-brussels-eats-up-davos-for-sale-signs-in-it-marios-shops-from-attica/,Newsroom,2026-01-20T08:07:08Z,dry bulk shipping,"Who is right about Jumbo & Wall Street fears its own heights
The post The Left in shock over President Maria…of Niki (Lord have mercy), Brussels eats up Davos, “for sale” signs in IT, Marios shops from Attica appeared first on ProtoThema English.",Protothema.gr,Unknown,News,2026-01-26T18:39:38.374540Z
943c137a3c14d385763e7bfc2601317f,Diana responds after Genco takeover bid is turned down,https://www.naftemporiki.gr/english/2060485/diana-responds-after-genco-takeover-bid-is-turned-down/,Αλεξία Σωτηρίου,2026-01-19T10:04:01Z,dry bulk shipping,"Diana Shipping is promoting the change of the members of the Genco board of directors. After the rejection, without dialogue, of the Genco takeover proposal, Diana as the largest shareholder…
Diana responds after Genco takeover bid is turned down - Η ΝΑΥΤΕΜΠΟ…",Naftemporiki.gr,Unknown,News,2026-01-26T18:39:38.374589Z
31159182508f98d94b1640e613797f49,"Buying a new phone in 2026 is going to suck, so it’s worth planning ahead",http://9to5google.com/2026/01/24/buying-new-phone-2026-sucks-ram-shortage-price-increase-tips/,Will Sattelberg,2026-01-24T12:00:00Z,bulk carrier,"If you’re a regular 9to5Google reader, you probably already know the turbulence happening inside the consumer electronics space. We’re all collectively looking down the barrel of significantly higher prices across the board, primarily — though not exclusively…",9to5google.com,Unknown,Market Report,2026-01-26T18:39:38.860967Z
64f502a37c582e97bb06f901032cc086,C3is Inc. Provides Fleet Expansion Update in the Tanker Sector and Announces Management’s Estimate of Net Asset Value,https://www.globenewswire.com/news-release/2026/01/23/3224767/0/en/C3is-Inc-Provides-Fleet-Expansion-Update-in-the-Tanker-Sector-and-Announces-Management-s-Estimate-of-Net-Asset-Value.html,C3is Inc.,2026-01-23T13:30:00Z,bulk carrier,"ATHENS, Greece, Jan. 23, 2026 (GLOBE NEWSWIRE) -- C3is Inc. (NASDAQ: CISS) (the “Company”), a ship-owning company providing dry bulk and tanker seaborne transportation services, provided today an update on its fleet expansion, with the delivery of two MR prod…",GlobeNewswire,Greece,News,2026-01-26T18:39:38.861061Z
ecb5cfe1ecaa0cccf1acbc5d04ae9a66,At least 2 sailors dead after cargo ship sinks in disputed South China Sea,https://www.aljazeera.com/news/2026/1/23/cargo-ship-capsizes-in-disputed-area-of-south-china-sea,"Al Jazeera Staff, News Agencies",2026-01-23T10:25:03Z,bulk carrier,"A Singapore-flagged vessel with 21 Filipino sailors on board capsizes, killing two and leaving four missing.",Al Jazeera English,China,News,2026-01-26T18:39:38.861129Z
0e4b97a725aa4517d436a06a962b1bd5,FirstSpear Friday Focus: New Low Visibility Plate Carrier (LVPC),https://soldiersystems.net/2026/01/23/firstspear-friday-focus-new-low-visibility-plate-carrier-lvpc/,Eric G,2026-01-23T10:15:00Z,bulk carrier,"The FirstSpear Low Visibility Plate Carrier (LVPC) is engineered for military, law enforcement, and special operations personnel who require ballistic protection without a visible tactical footprint. The LVPC provides a lightweight, durable, and flexible plat…",Soldiersystems.net,Unknown,News,2026-01-26T18:39:38.861178Z
3efe77d1da46f65a693abe8a466fddab,"China, Philippines go to aid of sinking cargo ship near disputed Scarborough Shoal",https://www.yahoo.com/news/articles/china-coast-guard-says-rescued-031306051.html,Reuters,2026-01-23T09:24:45Z,bulk carrier,"BEIJING, Jan 23 (Reuters) - China and the Philippines said on Friday they launched rescue operations after receiving reports of a sinking cargo ship near the...",Yahoo Entertainment,China,Market Report,2026-01-26T18:39:38.861192Z
c08ec271faf367b1ee26ab79556645d2,"Japan Plastic Additives Market Projected to Reach US$ 4,194.09 Million by 2035, Supported by Evolving Automotive Safety Standards Says Astute Analytica",https://www.globenewswire.com/news-release/2026/01/23/3224431/0/en/Japan-Plastic-Additives-Market-Projected-to-Reach-US-4-194-09-Million-by-2035-Supported-by-Evolving-Automotive-Safety-Standards-Says-Astute-Analytica.html,AstuteAnalytica India Pvt. Ltd.,2026-01-23T07:25:00Z,bulk carrier,"Stakeholders pivot toward high-value functional formulations to counter upstream contractions. Future growth relies on specialized additives enabling automotive circularity and semiconductor precision, with profitability increasingly tethered to sustainabilit…",GlobeNewswire,Japan,Market Report,2026-01-26T18:39:38.861227Z
394d7dc8a434559518ed5ab417326e57,Vafias: 13 ships in the current shipbuilding program,https://www.naftemporiki.gr/english/2062637/vafias-13-ships-in-the-current-shipbuilding-program/,Αλεξία Σωτηρίου,2026-01-23T06:18:45Z,bulk carrier,"The shipbuilding program of the Vafias Group is approaching 1 billion dollars.
According to sources, Stealth Maritime exercised the option it had with the Hyundai shipbuilding group for the construction…
Vafias: 13 ships in the current shipbuilding program - …",Naftemporiki.gr,Unknown,News,2026-01-26T18:39:38.861273Z
c8e93d331822b136883193d8200abee2,"Polar discontinuities, emergent conductivity, and critical twist-angle-dependent behaviour at wafer-bonded ferroelectric interfaces",https://www.nature.com/articles/s41467-026-68553-7,"Andrew Rogers, Kristina Holsgrove, Nils A. Schäfer, Boris Koppitz, Conor J. McCluskey, Shivani Yedama, Ronan Lynch, Keelan Sloan, Barry Porter, Adam Sykes, Alex Catalan Daniels, Romualdo S. Silva Jr., Flavio Y. Bruno, Sam D. Seddon, Haidong Lu, Michael Ruesing, Christa Fink, Philipp Fahler-Muenzer, Sarah Fearn, Sandrine E. M. Heutz, Marios Hadjimichael, Quentin M. Ramasse, Marin Alexe, Amit Kumar, Raymond G. P. McQuaid, Alexei Gruverman, Simone Sanna, Lukas M. Eng, J. Marty Gregg",2026-01-23T00:00:00Z,bulk carrier,Wafer bonding has allowed the synthesis of twisted interfaces which support polar discontinuities in ferroelectric lithium niobate. Two-dimensional sheet conductivity arises but is suppressed when twist angles lead to interfacial lattice aperiodicity.,Nature.com,Unknown,News,2026-01-26T18:39:38.861341Z
bf78b0aab9ad4c046cdd437efd1b5210,Global Commercial Refrigeration Market to Surpass USD 55.15 Billion by 2033 | Astute Analytica,https://www.globenewswire.com/news-release/2026/01/22/3224203/0/en/Global-Commercial-Refrigeration-Market-to-Surpass-USD-55-15-Billion-by-2033-Astute-Analytica.html,AstuteAnalytica India Pvt. Ltd.,2026-01-22T18:54:00Z,bulk carrier,"Driven by rapid growth in e-grocery, pharmaceutical cold chains, and energy-efficient retail cooling, the global commercial refrigeration market is set to expand by 2033. Accelerating adoption of natural refrigerants, IoT-enabled systems, decentralized cold s…",GlobeNewswire,Global,Market Report,2026-01-26T18:39:38.861400Z
e83d37958f1c36b5a380d08768b73ece,IntelliTrans and DAT Bring Smarter Rate Intelligence to Shippers,https://www.globenewswire.com/news-release/2026/01/22/3223920/0/en/IntelliTrans-and-DAT-Bring-Smarter-Rate-Intelligence-to-Shippers.html,IntelliTrans,2026-01-22T15:00:00Z,bulk carrier,"Integration of DAT iQ within the IntelliTrans TMS empowers shippers with trusted freight benchmarking and forecasting for faster, data-driven decisions....",GlobeNewswire,Unknown,Analysis/Opinion,2026-01-26T18:39:38.861434Z
a8bc1446ad4962060c08e0fbcdf359b9,"Australia, 2026, and hospitality: What’s actually changing?",https://www.revinate.com/hotel-moment-podcast/australia-2026-and-hospitality-whats-actually-changing/,"Revinate, Inc.",2026-01-22T12:08:00Z,bulk carrier,"In this episode of Hotel Moment, Dylan Cole, Managing Director of EMEA, is joined by Nick Ellis, Country Director Oceania & Indonesia – Enterprise Director SE Asia, to unpack what hospitality trends for 2026 actually look like in Australia — a market defined …",Revinate.com,Australia,Market Report,2026-01-26T18:39:38.861454Z
afd917f33cd1c650a34904d89c69bd97,"Qatar Freight and Logistics Market Analysis & Growth Forecasts, 2026-2031: E-Commerce Surge Sparks Last-Mile Delivery Innovations in Qatar, Driving Total Revenues to USD 14 Billion by 2031",https://www.globenewswire.com/news-release/2026/01/22/3223548/28124/en/Qatar-Freight-and-Logistics-Market-Analysis-Growth-Forecasts-2026-2031-E-Commerce-Surge-Sparks-Last-Mile-Delivery-Innovations-in-Qatar-Driving-Total-Revenues-to-USD-14-Billion-by-2.html,Research and Markets,2026-01-22T11:21:00Z,bulk carrier,"Key market opportunities include capacity upgrades at Hamad Port and Airport, bolstering transshipment and e-commerce logistics. Rising maritime demand from LNG expansion and a surge in e-commerce drive growth. Key market opportunities include capacity upgrad…",GlobeNewswire,Unknown,Analysis/Opinion,2026-01-26T18:39:38.861501Z
69392c2fdfc2c930c184fb691475407f,Philippines eyes green and localized shipbuilding growth,https://asia.nikkei.com/business/transportation/philippines-eyes-green-and-localized-shipbuilding-growth,Ramon Royandoyan,2026-01-22T02:02:40Z,bulk carrier,"Filipino methanol-capable bulk carrier will send a message to the world, Marcos says",Nikkei.com,Unknown,News,2026-01-26T18:39:38.861528Z
afacae93482cd4723f491e0fbc138f1a,"Imported Materials Are Manageable, Imported Energy Reprices Economies",https://cleantechnica.com/2026/01/21/imported-materials-are-manageable-imported-energy-reprices-economies/,Michael Barnard,2026-01-21T23:01:59Z,bulk carrier,"Europe’s gas crisis in 2022 is often described as a supply shock driven by geopolitics, but that framing misses the core lesson. The crisis was not caused by import dependence in general, nor by shortages of industrial feedstocks. It was caused by reliance on…",CleanTechnica,Unknown,Market Report,2026-01-26T18:39:38.861572Z
e69028d9e3029e4a3d7d4b92a1a7665a,"Trump Considers “Decisive” Options Against Iran as U.S. Aircraft Carrier, Fighter Jets Head to Middle East",https://legalinsurrection.com/2026/01/trump-considers-decisive-options-against-iran-as-u-s-aircraft-carrier-fighter-jets-head-to-middle-east/,Vijeta Uniyal,2026-01-21T18:00:57Z,bulk carrier,"The WSJ: ""Those deployments may be the start of a broader buildup that would give Trump the firepower to strike Iran should he choose to use them.""
The post Trump Considers “Decisive” Options Against Iran as U.S. Aircraft Carrier, Fighter Jets Head to Middle …",Legalinsurrection.com,Unknown,News,2026-01-26T18:39:38.861624Z
116a226fd5fa154b1747901804361e2f,Tree species-specific strategies of soil aggregation driven by SOC–GRSP coupling under nitrogen addition and precipitation reduction,https://journals.plos.org/plosone/article?id=10.1371/journal.pone.0341117,"Mingxin Zhou, Yibo Li, Wei Liu, Chao Jia, Jiantao Hao",2026-01-21T14:00:00Z,bulk carrier,"Soil structural stability underpins ecosystem function, yet how nitrogen (N) enrichment and precipitation reduction jointly regulate glomalin-related soil proteins (GRSP) and aggregate formation in temperate forests remains poorly understood. This knowledge g…",Plos.org,Unknown,News,2026-01-26T18:39:38.861683Z
a8673fa1761373614a38a9bea096bd8f,"MiFi Market Projected to Reach US$ 9.04 Billion by 2035, Supported by Enterprise Connectivity and Managed Service Demand Says Astute Analytica",https://www.globenewswire.com/news-release/2026/01/21/3222679/0/en/MiFi-Market-Projected-to-Reach-US-9-04-Billion-by-2035-Supported-by-Enterprise-Connectivity-and-Managed-Service-Demand-Says-Astute-Analytica.html,AstuteAnalytica India Pvt. Ltd.,2026-01-21T12:30:00Z,bulk carrier,"While the demand for connectivity is universal, the MiFi market is fragmented by economic realities. The trends of 2025 indicate a clear divergence: the West pursues performance and security at a premium, while the East drives accessibility and volume. While …",GlobeNewswire,Unknown,Market Report,2026-01-26T18:39:38.861728Z
060273391d6956f69dbfcf15e562c33b,Seed Additives Market Size to Worth USD 12.29 billion by 2035 Amid Rising Demand for Advanced Seed Treatments,https://www.globenewswire.com/news-release/2026/01/21/3222604/0/en/Seed-Additives-Market-Size-to-Worth-USD-12-29-billion-by-2035-Amid-Rising-Demand-for-Advanced-Seed-Treatments.html,Precedence Research,2026-01-21T11:30:00Z,bulk carrier,"According to Towards FnB, the global seed additives market size is calculated at USD 6.69 billion in 2026 and is forecast to expand steadily to USD 12.29 billion by 2035, registering a robust CAGR of 7% from 2026 to 2035. This growth trajectory highlights the…",GlobeNewswire,Global,Analysis/Opinion,2026-01-26T18:39:38.861770Z
9af5a3fedbfda8459e2a18cd67823dba,Show HN: IP over Avian Carriers with Quality of Service,https://www.rfc-editor.org/rfc/rfc2549.html,mig4ng,2026-01-20T11:06:54Z,bulk carrier,"g(old)

Comments URL: https://news.ycombinator.com/item?id=46690530
Points: 1
# Comments: 0",Rfc-editor.org,Unknown,Analysis/Opinion,2026-01-26T18:39:38.861793Z
00cd7160fb2aa8a0d2b8ec1f94e7387e,IP Addresses through 2025,https://www.potaroo.net/ispcol/2026-01/addr2025.html,,2026-01-19T18:30:00Z,bulk carrier,It's time for another annual roundup from the world of IP addresses. Let’s see what has changed in the past 12 months in addressing the Internet and look at how IP address allocation information can inform us of the changing nature of the network itself.,Potaroo.net,Unknown,News,2026-01-26T18:39:38.861838Z
109d948b416d6d45c3346f61ae9f1bbb,Baby Care,https://kk.org/cooltools/baby-care/,claudia,2026-01-19T16:00:00Z,bulk carrier,Tools for Possibilities: issue no. 173,Kk.org,Unknown,News,2026-01-26T18:39:38.861861Z
0baec2ca0392e408b4c8efb5638f4be6,Europe's underestimated weak spot: Financial dependence on the US,https://www.iss.europa.eu/publications/commentary/europes-underestimated-weak-spot-financial-dependence-us,marianna.lianantonaki@iss.europa.eu,2026-01-19T10:20:46Z,bulk carrier,"Europe's underestimated weak spot: Financial dependence on the US
marianna.liana…
Mon, 01/19/2026 - 12:20


 4 minutes
 
 In European capitals, familiar disaster scenarios dominate the debate. What should Europe do now on Ukraine and how should it respond to …",Europa.eu,Ukraine,News,2026-01-26T18:39:38.861894Z
3b1b929dea977900320cb851a64e6c27,Driving Floquet physics with excitonic fields,https://www.nature.com/articles/s41567-025-03132-z,"Vivek Pareek, David R. Bacon, Xing Zhu, Yang-Hao Chan, Fabio Bussolotti, Marcos G. Menezes, Nicholas S. Chan, Joel Pérez Urquizo, Kenji Watanabe, Takashi Taniguchi, Enrico Perfetto, Michael K. L. Man, Julien Madéo, Gianluca Stefanucci, Diana Y. Qiu, Kuan Eng Johnson Goh, Felipe H. da Jornada, Keshav M. Dani",2026-01-19T00:00:00Z,bulk carrier,"Floquet engineering is often limited by weak light–matter coupling and heating. Now it is shown that exciton-driven fields in monolayer semiconductors produce stronger, longer-lived Floquet effects and reveal hybridization linked to excitonic phases.",Nature.com,Unknown,News,2026-01-26T18:39:38.861938Z
162e385e701ecd4eca9854b36047cde7,Salamis Shipyards: Collaboration with ACT Infraport Ltd for strategic shipbuilding investment in India,https://www.naftemporiki.gr/english/2061727/salamis-shipyards-collaboration-with-act-infraport-ltd-for-strategic-shipbuilding-investment-in-india/,Μιχάλης Ματσίγκος,2026-01-21T12:25:20Z,capesize,"In the presence of the Indian Ambassador to Greece, Rudrendra Tandon, Salamis Shipyards signed a Memorandum of Understanding (MoU) with the Indian company ACT Infraport Ltd, at the offices of…
Salamis Shipyards: Collaboration with ACT Infraport Ltd for strate…",Naftemporiki.gr,India,News,2026-01-26T18:39:39.097909Z
a3c09acb6a30fd81ef3bc63497aacb16,Icebreaker Botnica charter agreement with Baffinland,https://www.globenewswire.com/news-release/2026/01/23/3224810/0/en/Icebreaker-Botnica-charter-agreement-with-Baffinland.html,AS Tallinna Sadam,2026-01-23T14:00:00Z,panamax,"AS Tallinna Sadam subsidiary, OÜ TS Shipping (hereinafter: ""TS Shipping""), and Baffinland Iron Mines Corporation (hereinafter: Baffinland) extended the long-term cooperation agreement in 2024 for the chartering of the multifunctional icebreaker MS Botnica to …",GlobeNewswire,Unknown,News,2026-01-26T18:39:39.534690Z
92de02fc46a9af5458bb25011b3871b5,Capital Clean Energy Carriers Corp. Declares Quarterly Dividend,https://www.globenewswire.com/news-release/2026/01/22/3224274/20327/en/Capital-Clean-Energy-Carriers-Corp-Declares-Quarterly-Dividend.html,Capital Clean Energy Carriers Corp.,2026-01-22T21:10:00Z,panamax,"ATHENS, Greece, Jan. 22, 2026 (GLOBE NEWSWIRE) -- Capital Clean Energy Carriers Corp. (NASDAQ: CCEC) today announced that its board of directors has declared a cash dividend per share of $0.15 for the fourth quarter of 2025 ended December 31, 2025.",GlobeNewswire,Greece,News,2026-01-26T18:39:39.534772Z
a20f241e1667aaa117247a14e181e6ee,Capital Clean Energy Carriers Corp. Announces the Delivery of the M/V Buenaventura Express to Its New Owner,https://www.globenewswire.com/news-release/2026/01/21/3223233/20327/en/Capital-Clean-Energy-Carriers-Corp-Announces-the-Delivery-of-the-M-V-Buenaventura-Express-to-Its-New-Owner.html,Capital Clean Energy Carriers Corp.,2026-01-21T21:05:00Z,panamax,"ATHENS, Greece, Jan. 21, 2026 (GLOBE NEWSWIRE) -- Capital Clean Energy Carriers Corp. (the “Company”, “CCEC,” “we” or “us”) (NASDAQ: CCEC), an international owner of ocean-going vessels, today announced the delivery of the M/V Buenaventura Express (142,411 DW…",GlobeNewswire,Greece,News,2026-01-26T18:39:39.534819Z
f518fbedd033428f1b4a9eff37d5048a,Bank of America Downgrades Scorpio Tankers (STNG) as Freight Rates Near Peak Levels,https://finance.yahoo.com/news/bank-america-downgrades-scorpio-tankers-043924503.html,Vardah Gill,2026-01-19T04:39:24Z,handymax,"Scorpio Tankers Inc. (NYSE:STNG) is included among the 15 Dividend Growth Stocks with the Highest Growth Rates. On January 9, Bank of America downgraded...",Yahoo Entertainment,USA,Market Report,2026-01-26T18:39:39.770411Z
55d46ae1610195c19b33db0137187417,C3is Inc. Announces Reverse Stock Split,https://www.globenewswire.com/news-release/2026/01/22/3223750/0/en/C3is-Inc-Announces-Reverse-Stock-Split.html,C3is Inc.,2026-01-22T13:30:00Z,handysize,"To be effective January 26, 2026  Aiming to meet the minimum bid price requirement for maintaining listing on Nasdaq   ATHENS, Greece, Jan.  22, 2026 ...",GlobeNewswire,Greece,News,2026-01-26T18:39:40.165145Z
bfaafaf5dc586d8e7e3cac2014408bfa,Genomic characterization of a severe West Nile Virus transmission season using a single reaction amplicon sequencing approach,https://journals.plos.org/plosntds/article?id=10.1371/journal.pntd.0013931,"Shawn Freed Jr., Sarah Chandler, Sarah Uhm, Zach Pella, Dikchha Gurung, Hallie Smith, Tammy Dowdy, Amanda M. Bartling, Ava Butz, Michael R. Wiley, M. Jana Broadhurst, Sydney Stein, Emily L. McCutchen, Jeff Hamik, Peter C. Iwen, Nick Downey, Kaylee S. Herzog, Joseph R. Fauver",2026-01-21T14:00:00Z,baltic dry index,"Author summary West Nile virus (WNV) remains the most impactful arthropod-borne virus in the United States. Genomic epidemiology of WNV can inform our understanding of virus emergence and transmission, ultimately informing mosquito surveillance and control pr…",Plos.org,USA,News,2026-01-26T18:39:40.392537Z
703ec986295e992dc49fe7d1861e0695,Australia makes £4.5 trillion find that could change entire world’s economy,https://www.ladbible.com/news/world-news/australia-4-trillion-discovery-iron-ore-jackpot-810009-20260125,Anish Vij,2026-01-25T12:56:59Z,iron ore,A £4.5trillion discovery has been made in Australia,LADbible,Australia,News,2026-01-26T18:39:40.890328Z
2c3dddc7f94bee286548ce235ea4d560,"JSW Steel sharpens expansion roadmap, eyes 55 mtpa capacity by FY31",https://www.livemint.com/companies/news/jsw-steel-exapnsion-fy31-capacity-target-56-mtpa-11769315776048.html,"Dipali Banka, Nehal Chaliawala",2026-01-25T08:32:37Z,iron ore,The move comes as steel prices show early signs of stabilizing and the company steps up raw material sourcing.,Livemint,Unknown,Market Report,2026-01-26T18:39:40.890394Z
