article_id,title,link,creator,pubdate,category,description,source,country,article_type,scrape_timestamp
24e87b8b6d71c4d588818844782b085b,Stocks drop as Fed rate bets hit tech royalty; dollar gains,https://www.channelnewsasia.com/business/stocks-drop-fed-rate-bets-hit-tech-royalty-dollar-gains-6202331,,2026-06-23T09:27:10Z,Strait of Hormuz,"LONDON, June 23 : Global stocks fell on Tuesday, led by broad-based declines in technology shares, including SpaceX, as growing expectations for the Federal Reserve to be more aggressive in tackling inflation drove investors into bonds and the dollar.Futures …",CNA,UK,News,2026-06-24T09:34:07.627858Z
b9c975a698911cb9b385de840ed43421,Stocks hit by Fed rate reality check; oil slips,https://www.channelnewsasia.com/business/stocks-hit-fed-rate-reality-check-oil-slips-6202331,,2026-06-23T09:27:10Z,Strait of Hormuz,"LONDON, June 23 : Global stocks fell on Tuesday, led by broad-based declines in technology stocks, as investors expect the Federal Reserve to take more aggressive action to tackle inflation, even after a 16 per cent drop in oil prices this month.The STOXX 600…",CNA,UK,Market Report,2026-06-24T09:34:07.627898Z
74e6749ba608dabd40f58031c20256fc,Pierrakakis at Cantina Academy: The regulation on loans under the Katseli Law is a matter of political responsibility; the retroactive effect is a government initiative,https://en.protothema.gr/2026/06/23/pierrakakis-at-cantina-academy-the-regulation-on-loans-under-the-katseli-law-is-a-matter-of-political-responsibility-the-retroactive-effect-is-a-government-initiative/,Newsroom,2026-06-23T09:10:07Z,Strait of Hormuz,"Konstantinos Tasoulas at the 5th Cantina Academy: “Authenticity is the magic word that fits Epirus”
The post Pierrakakis at Cantina Academy: The regulation on loans under the Katseli Law is a matter of political responsibility; the retroactive effect is a gov…",Protothema.gr,Unknown,News,2026-06-24T09:34:07.627956Z
7d66e5f3604a37f5147a0fbdce28945c,Iran denies J.D. Vance’s claim of readmitting nuclear inspectors amid US sanctions relief talks,https://cryptobriefing.com/iran-denies-vance-nuclear-inspectors-sanctions/,Editorial Team,2026-06-23T09:07:10Z,Strait of Hormuz,"The denial highlights ongoing geopolitical tensions, impacting global oil markets and potentially influencing crypto strategies amid sanctions dynamics.
The post Iran denies J.D. Vance’s claim of readmitting nuclear inspectors amid US sanctions relief talks a…",Crypto Briefing,Global,Market Report,2026-06-24T09:34:07.628030Z
437f59058af24e40d1638a0ce1550b73,The $400 million machine powering the future of chipmaking,https://www.technologyreview.com/2026/06/23/1138837/asml-400-million-dollar-machine-powering-future-of-chipmaking/,Clive Thompson,2026-06-23T09:00:00Z,Strait of Hormuz,"Jos Benschop is climbing a ladder to get to the top of his newest machine.  It’s a bit of a schlep. The contraption is the size of a double-decker bus—more than 150 tons of gleaming precision-milled aluminum covered in thousands of snaking tubes, colored cabl…",MIT Technology Review,Unknown,News,2026-06-24T09:34:07.628077Z
0e3baffe1b8b2e4433e2b035ff1c1882,Iran says technical talks with US in Switzerland conclude successfully,https://www.aljazeera.com/news/2026/6/23/iran-says-technical-talks-with-us-in-switzerland-conclude-successfully,Al Jazeera Staff,2026-06-23T08:49:58Z,Strait of Hormuz,Iran's top negotiator Mohammad Ghalibaf also says an agreement reached with the US to release $12bn in frozen assets.,Al Jazeera English,Unknown,News,2026-06-24T09:34:07.628153Z
68fb5fc0bad73a6f9c34b5655f573dac,Iran Quickly Pursues Top Oil Importers after US Waiver,https://www.rigzone.com/news/wire/iran_quickly_pursues_top_oil_importers_after_us_waiver-23-jun-2026-183969-article/,Yongchang Chin,2026-06-23T08:46:08Z,Strait of Hormuz,Iran is racing to court some of Asia's largest oil buyers as a 60-day U.S. sanctions waiver takes effect.,Rigzone,Unknown,News,2026-06-24T09:34:07.628182Z
a0570b2f6784a19a9ce3b52a46b4321a,Iran promises to maintain control of Hormuz as Swiss talks end,https://punchng.com/iran-promises-to-maintain-control-of-hormuz-as-swiss-talks-end/,Punch Newspapers,2026-06-23T08:25:33Z,Strait of Hormuz,"Iran asserts its intent to maintain control over the vital Strait of Hormuz following peace talks in Switzerland, a key point in Middle East negotiations.

Read More: https://punchng.com/iran-promises-to-maintain-control-of-hormuz-as-swiss-talks-end/",The Punch,Unknown,News,2026-06-24T09:34:07.628226Z
8945b332bd968cb639dd2efb64bafaed,Trump says he can fix Chicago’s crime epidemic ‘fast and permanently’ after 39 shot over weekend,https://nypost.com/2026/06/23/us-news/trump-says-he-can-fix-chicagos-crime-epidemic-fast-and-permanently-after-39-shot-over-weekend/,Chris Bradford,2026-06-23T08:08:50Z,Strait of Hormuz,"President Trump on Tuesday said he could fix Chicago's gun violence epidemic ""fast and permanently"" urging left-wing Illinois Governor JB Pritzker to call him -- after 39 were shot in the Windy City this weekend.",New York Post,Unknown,News,2026-06-24T09:34:07.628313Z
78a8539b603ba1b2a4f0ba4003356ded,Iran war day 116: US eases Iran sanctions; Lebanon ceasefire holds,https://www.aljazeera.com/news/2026/6/23/iran-war-day-116-us-eases-iran-sanctions-lebanon-ceasefire-holds,Al Jazeera Staff,2026-06-23T07:58:51Z,Strait of Hormuz,US eases oil sanctions for 60 days after Iran agrees to allow international nuclear inspections.,Al Jazeera English,Global,News,2026-06-24T09:34:07.628382Z
c2eb90743fd83d2ce8a56cfd916bd231,The 9 at 9: Tuesday,https://www.thejournal.ie/9-at-9-tuesday-65-7079097-Jun2026/,Andrew Walsh,2026-06-23T07:55:58Z,Strait of Hormuz,"Abuse victims suing the State for redress, Iran to administer Hormuz Strait after peace talks and hot spell continues.",TheJournal.ie,Unknown,News,2026-06-24T09:34:07.628432Z
912187c6497a6b80a7fdda645d33ee08,"A Claim to Lead, a Hesitation to Act: Germany’s New Military Strategy",https://warontherocks.com/a-claim-to-lead-a-hesitation-to-act-germanys-new-military-strategy/,Roderich Kiesewetter,2026-06-23T07:30:38Z,Strait of Hormuz,"In the public perception, it seems like a big deal for Germany to publish a military strategy for the first time. But let me pour a little cold water on that. A form of military strategy has always existed. Where today we have a National Security Strategy pai…",War on the Rocks,Germany,News,2026-06-24T09:34:07.628479Z
c330f62a05c3efa3e0c6b64186428f9c,"US and Iran conclude technical talks in Switzerland, establish oversight committee",https://cryptobriefing.com/us-iran-talks-switzerland-oversight-committee/,Editorial Team,2026-06-23T07:13:10Z,Strait of Hormuz,"The establishment of an oversight committee may foster regional stability and economic impacts, influencing global oil markets and geopolitical dynamics.
The post US and Iran conclude technical talks in Switzerland, establish oversight committee appeared firs…",Crypto Briefing,Global,Market Report,2026-06-24T09:34:07.628523Z
18c22f2aed697d049afbe27cb5abe8a1,UK Has Enough Electricity for Winter Despite Energy Market Turmoil,https://oilprice.com/Latest-Energy-News/World-News/UK-Has-Enough-Electricity-for-Winter-Despite-Energy-Market-Turmoil.html,Irina Slav,2026-06-23T07:00:00Z,Strait of Hormuz,"The UK will have sufficient electricity supply this winter despite the Strait of Hormuz crisis, NESO, the country’s grid operator, said today. “While we will continue to monitor global energy markets, households and businesses can be confident that electricit…",OilPrice.com,Global,Market Report,2026-06-24T09:34:07.628565Z
d8eb38b10f3467ec5fddf50d27aeba6d,Oil prices hold decline amid signs of peace talks progress,https://www.irishtimes.com/business/markets/2026/06/23/oil-prices-hold-decline-amid-signs-of-peace-talks-progress/,Yongchang Chin and Gabriel Levin,2026-06-23T06:43:09Z,Strait of Hormuz,US waiver would allow some sales of crude and fuels from Iran,The Irish Times,Unknown,Market Report,2026-06-24T09:34:07.628589Z
ce7949ae61c95150146ef256e2f322ff,Oil prices fall after US waives Iran sanctions and peace talks in Switzerland progress – business live,https://biztoc.com/x/ad4c10660fa6d60c,theguardian.com,2026-06-23T06:43:05Z,Strait of Hormuz,"US waives sanctions on Iran for 60 days after first talks in Switzerland to negotiate peace deal; communications line opened to ensure safe passage through strait of Hormuz
Good morning, and welcome to our rolling coverage of business, the financial markets a…",Biztoc.com,Unknown,Market Report,2026-06-24T09:34:07.628661Z
3a605abe8fa67b26b1e0242a217b288a,Israel assets plunge amid peace talks with Iran,https://cryptobriefing.com/israel-assets-plunge-amid-peace-talks-with-iran/,Estefano Gomez,2026-06-23T06:39:28Z,Strait of Hormuz,"Investor anxiety over peace talks with Iran may reshape regional power dynamics, impacting Israel's strategic and economic positioning.
The post Israel assets plunge amid peace talks with Iran appeared first on Crypto Briefing.",Crypto Briefing,Unknown,News,2026-06-24T09:34:07.628762Z
b5b3760b2bc2e9d813c87594710ae204,Why Iran’s President Pezeshkian is heading to Pakistan after US-Iran talks,https://www.aljazeera.com/news/2026/6/23/why-irans-president-pezeshkian-is-heading-to-pakistan-after-us-iran-talks,Abid Hussain,2026-06-23T06:37:52Z,Strait of Hormuz,"This is Pezeshkian's first overseas trip since Iran war began, and comes a day after the high-stakes Switzerland talks.",Al Jazeera English,Unknown,News,2026-06-24T09:34:07.628801Z
cf7bda581dbd7c0a6d51fcf1f57ae384,No bids made in Indian Oil Corp tender for ships to carry Gulf cargoes,https://www.thehindubusinessline.com/companies/no-bids-made-in-indian-oil-corp-tender-for-ships-to-carry-gulf-cargoes/article71136369.ece,Reuters,2026-06-23T06:32:24Z,Strait of Hormuz,Shipowners stay cautious amid uncertainty over transit through the strategically vital Strait of Hormuz.,BusinessLine,India,News,2026-06-24T09:34:07.628818Z
1d08eb311aff35a1b1f2dbe8ecca81bc,"NZ shares trade flat amid global uncertainty, domestic hiring hesitancy – Market close",https://www.nzherald.co.nz/business/markets/shares/nz-shares-trade-flat-amid-global-uncertainty-domestic-hiring-hesitancy-market-close/premium/6XMXERL6W5FVZOMCEPB564BDNY/,BusinessDesk,2026-06-23T06:30:15Z,Strait of Hormuz,Afternoon trading fell away as geopolitical concerns continue to weigh on enthusiasm.,New Zealand Herald,Global,Market Report,2026-06-24T09:34:07.628851Z
321100abb8cd061a0fc5f15a4b2f2a98,"Asia shares, oil slip as markets reprice Fed expectations",https://finance.yahoo.com/markets/articles/asia-shares-slip-markets-reprice-011538149.html,By Gregor Stuart Hunter,2026-06-23T06:24:23Z,Strait of Hormuz,"By Gregor Stuart Hunter SINGAPORE, June 23 (Reuters) - Asian stocks and oil prices fell on Tuesday after the U.S. waived sanctions on Iran, while traders gra...",Yahoo Entertainment,Singapore,Market Report,2026-06-24T09:34:07.628870Z
a3fe57d95aadfaaf61756fa263e87052,"No bids made in Indian Oil tender for ships to carry Gulf cargoes, say sources",https://economictimes.indiatimes.com/industry/energy/oil-gas/no-bids-made-in-indian-oil-tender-for-ships-to-carry-gulf-cargoes-say-sources/articleshow/131927490.cms,Reuters,2026-06-23T06:20:18Z,Strait of Hormuz,"Indian Oil Corporation has failed to secure any bids for chartering vessels to transport crude oil and LPG from the Strait of Hormuz.  Ship owners are hesitant due to the current geopolitical climate, preferring to await clearer terms before entering the regi…",The Times of India,India,News,2026-06-24T09:34:07.628899Z
7b4097de415bcaa423d51df30dd69326,Brahmos gets another customer: One of Middle East's biggest arms importers and top US weapons buyer eyes India's BrahMos and Akashteer systems,https://economictimes.indiatimes.com/news/defence/brahmos-gets-another-customer-one-of-middle-easts-biggest-arms-importers-and-top-us-weapons-buyer-eyes-indias-brahmos-and-akashteer-systems/articleshow/131926764.cms,ET Online,2026-06-23T06:20:12Z,Strait of Hormuz,"India and the UAE are in early-stage discussions for the potential sale of Indian defence platforms, including the supersonic BrahMos missile and the Akashteer air defence network. This move signifies the UAE's push to bolster its military capabilities amid r…",The Times of India,India,News,2026-06-24T09:34:07.628930Z
57bbd20b958b69105c84c74fd35d5e86,Iran says Strait of Hormuz ‘will never return to pre-war conditions’ despite US sanctions relief,https://en.protothema.gr/2026/06/23/iran-says-strait-of-hormuz-will-never-return-to-pre-war-conditions-despite-us-sanctions-relief/,admin,2026-06-23T06:08:03Z,Strait of Hormuz,"Tehran says it will continue to maintain control of the key Gulf waterway, as Washington pauses some oil-related sanctions during talks aimed at ending the Middle East war
The post Iran says Strait of Hormuz ‘will never return to pre-war conditions’ despite U…",Protothema.gr,Unknown,News,2026-06-24T09:34:07.628980Z
9c23308618e4d88923917e112f759fa2,"Peace talks between U.S. and Iran yield progress, but tensions remain high",https://www.naturalnews.com/2026-06-23-peace-talks-iran-progress-tensions.html,Cassie B.,2026-06-23T06:00:00Z,Strait of Hormuz,U.S.-Iran talks in Switzerland made encouraging progress and established a 60-day roadmap toward a final settlement. The agreement includes a 60-day sanctions waiver on Iranian oil sales and the release of $12 billion in frozen assets. Trump threatened to bom…,Naturalnews.com,Unknown,News,2026-06-24T09:34:07.629073Z
37f115bb71f2d4174758147601dfb097,Hemorrhaging the country to death: Pentagon asks Congress for $80 billion more for the Iran War,https://www.naturalnews.com/2026-06-23-pentagon-asks-congress-more-funds-iran-war.html,Lance D Johnson,2026-06-23T06:00:00Z,Strait of Hormuz,"The Iran war, a devastating 15-week conflict that ended with an electronic peace deal in June 2026, has already exacted a staggering financial toll on the United States. According to the Iran War Cost Tracker, the direct taxpayer burden stands at $113.3 billi…",Naturalnews.com,USA,News,2026-06-24T09:34:07.629102Z
0b8121c2ab56d0d0ba188b8b55399c04,U.S.-Iran MOU marks strategic pivot as Trump administration shifts from military to economic objectives,https://www.naturalnews.com/2026-06-23-trump-administration-shifts-from-military-to-economic-objectives.html,Willow Tohi,2026-06-23T06:00:00Z,Strait of Hormuz,President Trump and Iranian President Pezeshkian signed a 14-point memorandum of understanding ending the U.S.-Israeli war with Iran The deal reopens the Strait of Hormuz and lifts sanctions in exchange for Iran diluting its enriched uranium stockpile Retired…,Naturalnews.com,Unknown,News,2026-06-24T09:34:07.629155Z
7e96490d9f62d2740c401e4b0b4bf11a,Why is the US in Iran?,https://www.counterpunch.org/2026/06/23/why-is-the-us-in-iran/,Gerald Sussman,2026-06-23T05:57:58Z,Strait of Hormuz,“God created war so that Americans would learn geography.” – Attributed to various sources. “One of the delightful things about Americans is that they have absolutely no historical memory.” – Zhou En-lai (cited by William Blum) There is no irreducible answer …,CounterPunch,USA,News,2026-06-24T09:34:07.629181Z
7f65e3d723982f4b5de525a7fe3ce504,Why the China-Iran Relationship Has Been Friendly But Distant Since Ancient Times,https://thediplomat.com/2026/06/why-the-china-iran-relationship-has-been-friendly-but-distant-since-ancient-times/,Akhilesh Pillalamarri,2026-06-23T05:57:00Z,Strait of Hormuz,"The two civilizations have consistently found each other to be useful, yet they haven’t invested heavily in their partnership.",The Diplomat,China,News,2026-06-24T09:34:07.629199Z
116ec773a61023a7c6f14cd720f5bd8e,Iran says they will administer Strait of Hormuz as peace talks in Switzerland conclude,https://www.thejournal.ie/iran-strait-of-hormuz-peace-talks-7079041-Jun2026/,AFP,2026-06-23T05:55:29Z,Strait of Hormuz,Iranian negotiators said that talks with US officials at a Swiss resort had produced “good achievements”.,TheJournal.ie,Unknown,News,2026-06-24T09:34:07.629234Z
85fef5d12b01cb5702fd57a53be3b2b4,Asian shares are trading mixed amid caution about the war in Iran,https://abcnews.com/Business/wireStory/asian-shares-trading-mixed-amid-caution-war-iran-134119501,YURI KAGEYAMA AP business writer,2026-06-23T05:53:35Z,Strait of Hormuz,Asian shares are mixed in subdued trading as recent enthusiasm cools and markets face uncertainty about efforts to end the war in Iran,Abcnews.com,Unknown,Market Report,2026-06-24T09:34:07.629313Z
c1d55f52a02425378297ce2c23153e23,"India's LPG imports from US set to cross 1 million tons in June, sources say",https://www.thehindubusinessline.com/markets/commodities/indias-lpg-imports-from-us-set-to-cross-1-million-tons-in-june-sources-say/article71136162.ece,Reuters,2026-06-23T05:42:20Z,Strait of Hormuz,India's LPG imports from the US are expected to reach a record 1 million metric tons in June as the country offsets supply disruptions from West Asia caused by the closure of the Strait of Hormuz,BusinessLine,India,News,2026-06-24T09:34:07.629333Z
388841ee263dab7e955397034e1e6c11,Iran says no new commitments on nuclear sites after Vance says inspectors to be invited back,https://www.bbc.co.uk/news/articles/c3vy3nr63gxo,https://www.facebook.com/bbcnews,2026-06-23T05:39:17Z,Strait of Hormuz,"Iran's foreign ministry says it made ""no new commitments"" on nuclear inspections after talks in Switzerland.",BBC News,Unknown,News,2026-06-24T09:34:07.629364Z
4aafa09e41989015112b92f4188408da,Hormuz will never go back to its pre-war status: Iran's Parliament Speaker says Iran will manage the strait,https://www.thehindubusinessline.com/news/world/hormuz-will-never-go-back-to-its-pre-war-status-irans-parliament-speaker-says-iran-will-manage-the-strait/article71135954.ece,ANI,2026-06-23T05:32:28Z,Strait of Hormuz,Mohammad Bagher Ghalibaf asserts international rules will be followed but insists operational control will remain with Iran.,BusinessLine,Global,News,2026-06-24T09:34:07.629398Z
c44ce40578661335dd1e0b21ba2eaf24,Iran courts Asia’s largest oil importers under 60-day US sanctions waiver,https://cryptobriefing.com/iran-oil-waiver-asia-importers/,Editorial Team,2026-06-23T05:31:09Z,Strait of Hormuz,"Iran's temporary sanctions waiver could reshape oil markets and geopolitical dynamics, impacting global prices and diplomatic negotiations.
The post Iran courts Asia’s largest oil importers under 60-day US sanctions waiver appeared first on Crypto Briefing.",Crypto Briefing,Global,Market Report,2026-06-24T09:34:07.629441Z
970a99f90c658d484a8455d94f461900,Oil Prices Continue to Slide as Peace Talks Progress,https://oilprice.com/Latest-Energy-News/World-News/Oil-Prices-Continue-to-Slide-as-Peace-Talks-Progress.html,Irina Slav,2026-06-23T05:30:00Z,Strait of Hormuz,"Crude oil prices extended their decline today, with Brent crude sliding to $77.51 per barrel at the time of writing, and West Texas Intermediate at $73.62 per barrel, on reports that the United States and Iran were making progress in their peace talks. The la…",OilPrice.com,USA,Market Report,2026-06-24T09:34:07.629468Z
4807ca35f7c4c3e9ae692ae91071d47a,"India welcomes US-Iran peace deal, NSA Doval says pact brings 'cautious optimism'",https://economictimes.indiatimes.com/news/defence/india-welcomes-us-iran-peace-deal-nsa-doval-says-pact-brings-cautious-optimism/articleshow/131926351.cms,ET Online,2026-06-23T05:22:10Z,Strait of Hormuz,"India's National Security Advisor Ajit Doval expressed cautious optimism regarding the US-Iran MOU, anticipating it will bolster energy security and ease supply chain issues for crucial goods like fertilisers. He highlighted the positive implications for free…",The Times of India,India,News,2026-06-24T09:34:07.629493Z
822c2d47baebccf2d85983992dc33471,Iran Rushes to Woo Asia’s Largest Oil Importers After US Waiver,https://financialpost.com/pmn/business-pmn/iran-rushes-to-woo-asias-largest-oil-importers-after-us-waiver,Bloomberg News,2026-06-23T05:20:05Z,Strait of Hormuz,"Iran is racing to court some of Asia’s largest oil buyers as a 60-day US sanctions waiver takes effect, a temporary lifeline that should allow Tehran to resume exports and begin clearing a backlog of cargoes on the water, even as peace talks continue.",Financial Post,Unknown,News,2026-06-24T09:34:07.629541Z
94c5cdaabff4371eda9054915bb07732,There’s little to celebrate when the West gets a beating,https://www.israelnationalnews.com/news/429055,Giulio Meotti,2026-06-23T05:12:25Z,Strait of Hormuz,"Between Trump’s defeat in Iran and European mediocrity, there is little to be cheerful about. Especially while the West demands of Israel  that it wage a war without war and neutralize its enemies without fighting them. Opinion.",Israelnationalnews.com,Unknown,Analysis/Opinion,2026-06-24T09:34:07.629578Z
a68ba7b01d5b193ee58ac919df91427f,"Erosion of major-power deterrence could spur adventurism, make world more dangerous: Chan Chun Sing",https://www.channelnewsasia.com/singapore/iran-war-middle-east-institute-unclos-chan-chun-sing-6202676,,2026-06-23T05:08:00Z,Strait of Hormuz,"""The impulse to resort to force to resolve disputes reflects a worrying trend of breakdown in diplomacy,"" says Singapore's defence minister at the Middle East Institute's annual conference.",CNA,Singapore,News,2026-06-24T09:34:07.629602Z
1a02057eb30fd4cec850ff00cf292196,US temporarily suspends Iran oil sanctions as nuclear inspectors return,https://www.hurriyetdailynews.com/us-temporarily-suspends-iran-oil-sanctions-as-nuclear-inspectors-return-223584,hurriyetdailynews.com,2026-06-23T05:03:51Z,Strait of Hormuz,The United States suspended sanctions on Iranian oil on June 22 after Vice President JD Vance said Iran would allow U.N. nuclear inspectors to return to the country.,Hurriyet Daily News,USA,News,2026-06-24T09:34:07.629623Z
d89ccdfa16c963b5376c54ee720f30cc,"Ireland saw fourth largest decrease in diesel prices across EU in May, data shows",https://www.irishtimes.com/business/2026/06/23/ireland-saw-fourth-largest-decrease-in-diesel-prices-across-eu-in-may-data-shows/,Conor Healy,2026-06-23T05:00:01Z,Strait of Hormuz,"Irish fuel prices start to drop, but still tower over 2025 figures",The Irish Times,Unknown,Market Report,2026-06-24T09:34:07.629664Z
14c26cad18630b24d3b4702e8f17f2c9,Ghalibaf: Iran will be in charge of the Strait of Hormuz,https://www.israelnationalnews.com/flashes/688317,,2026-06-23T04:43:49Z,Strait of Hormuz,"Mohammad Bagher Ghalibaf, the speaker of the Iranian parliament and head of Iran’s negotiating team, arrived for an official visit to Muscat and declared that Iran would be the country responsible for managing the strategic Strait of Hormuz.Ghalibaf’s remarks…",Israelnationalnews.com,Unknown,News,2026-06-24T09:34:07.629713Z
cbe26bddc578998e390aabd3a20a0a41,"India's LPG imports from US set to cross 1 million tons in June, sources say",https://economictimes.indiatimes.com/industry/energy/oil-gas/indias-lpg-imports-from-us-set-to-cross-1-million-tons-in-june-sources-say/articleshow/131925385.cms,Reuters,2026-06-23T04:43:00Z,Strait of Hormuz,"India's LPG imports from the U.S. are projected to cross a record 1 million metric tons in June, driven by Middle Eastern supply disruptions. This surge in U.S. purchases, despite higher costs, ensures uninterrupted cooking gas for households. Efforts to boos…",The Times of India,India,News,2026-06-24T09:34:07.629740Z
30eaf04f3d6caaf53d759f658fc3feda,Poll: 67% of Americans Support U.S.-Iran Peace Deal,https://www.breitbart.com/middle-east/2026/06/22/poll-67-americans-support-u-s-iran-peace-deal/,Olivia Rondeau,2026-06-23T04:32:37Z,Strait of Hormuz,"The majority of Americans are in favor of the deal between the U.S. and Iran, according to poll results shared by President Donald Trump.
The post Poll: 67% of Americans Support U.S.-Iran Peace Deal appeared first on Breitbart.",Breitbart News,USA,News,2026-06-24T09:34:07.629761Z
2b6287420633b8ac9527f31434f3c6b9,The Strait of Hormuz's future is unsettled even as more ships venture through,https://www.seattlepi.com/news/politics/article/the-strait-of-hormuz-s-future-is-unsettled-even-22316217.php,"By WYATTE GRANTHAM-PHILIPS and MAE ANDERSON, AP Business Writers",2026-06-23T04:09:17Z,Strait of Hormuz,Ship traffic has picked up in the Strait of Hormuz since Iran and the U.S. signed an interim deal to end a war that's constricted global oil supplies. But questions surrounding control of the waterway and tolls to cross it could interfere with ongoing negotia…,seattlepi.com,Global,News,2026-06-24T09:34:07.629812Z
94bf889d8b1a97bfb1597410bdb06ae4,"US-Iran negotiations end, technical talks will continue after Trump shakes talks with threats",https://thechronicle.com.gh/us-iran-negotiations-end-technical-talks-will-continue-after-trump-shakes-talks-with-threats/,admin,2026-06-23T04:07:06Z,Strait of Hormuz,"High-level negotiations in Switzerland seeking a permanent end to the Iran war concluded early Monday, with lower-level talks planned for the rest of the week as Iran and the United States agreed to create a “de-confliction cell” to address the fighting in Le…",Thechronicle.com.gh,USA,News,2026-06-24T09:34:07.629840Z
9f420ca680cdbc8d4ff60f7aff9e491b,"The American Way of War, War, War",https://www.juancole.com/2026/06/the-american-way.html,Tom Engelhardt,2026-06-23T04:04:36Z,Strait of Hormuz,What could go wrong on a world in which no American president ever seems to realize that wars are simply never to be won by this country,Juancole.com,USA,News,2026-06-24T09:34:07.629858Z
