article_id,title,link,creator,pubdate,category,description,source,country,article_type,scrape_timestamp
69141853e7808534e80fcde98ca81a7c,Graco Slimfit 3-in-1 Convertible Car Seat for $172 + free shipping,https://www.dealnews.com/Graco-Slimfit-3-in-1-Convertible-Car-Seat-for-172-free-shipping/21908798.html,,2026-07-18T08:35:47Z,dry bulk shipping,"This Graco Slimfit 3-in-1 convertible car seat is $172.49, down from its $229.99 regular price. It grows with a child through three stages, from a rear-facing harness seat to a forward-facing harness seat to a highback booster. Buy Now at Amazon
 Features
 …",Dealnews.com,Unknown,News,2026-07-21T08:31:43.342024Z
456badab94c324298483d091d3dc065b,Auxin biosynthesis and signaling drive virulence and plant adaptation in Dickeya dadantii,https://journals.plos.org/plospathogens/article?id=10.1371/journal.ppat.1014429,"Amalia Roca, Saray Santamaría-Hernando, Zulema Udaondo, Juan J. Cabrera, Patricia Godoy, Ana Nogueira, Emilia López-Solanilla, Miguel A. Matilla",2026-07-17T14:00:00Z,dry bulk shipping,"Author summary Plants live in close association with large bacterial communities. Plant-bacteria interactions rely on a complex chemical language exchanged between both partners. One of these signal molecules is indole-3-acetic acid (IAA), a plant hormone bes…",Plos.org,Unknown,News,2026-07-21T08:31:43.342136Z
2f63bcf959ea251594d662ffdc12c50b,G Gradual Men's Dry Fit Stretch Golf Polo Shirt (various) $13,https://slickdeals.net/f/19769289-g-gradual-men-s-dry-fit-stretch-golf-polo-shirt-various-12-99-free-shipping-w-prime-or-on-35,hawkblu09,2026-07-17T03:23:25Z,dry bulk shipping,G-GRADUAL via Amazon [amazon.com] has *G Gradual Men's Dry Fit Stretch Golf Polo Shirt *(various) on sale for $19.99 - 35% off when you apply promo code WIK5BSQQ at checkout = *$12.99*. Shipping is...,Slickdeals.net,Unknown,News,2026-07-21T08:31:43.342174Z
08e2dd02253da6105c2a2e5ad6c30e20,Framing The Trojan War As A Trade War Over A Shipping Route,https://scienceblogs.com/sb-admin/2026/07/16/framing-trojan-war-trade-war-over-shipping-route-151475,sb admin,2026-07-16T23:13:42Z,dry bulk shipping,"The USA Science & Engineering Festival Revolutionizing STEM Education Through Groundbreaking Nifty Fifty Program

 
By F. Mark Modzelewski

The USA Science & Engineering Festival, supported by presenting host sponsor Lockheed Martin, is pleased to announce t…",Scienceblogs.com,Unknown,News,2026-07-21T08:31:43.342224Z
d7e3d2c6cad0cbf273567a653c173acd,How controlling (and tolling) a narrow waterway near ancient Troy changed history,https://theconversation.com/how-controlling-and-tolling-a-narrow-waterway-near-ancient-troy-changed-history-287571,"David M. Pritchard, Associate Professor of Greek History, The University of Queensland",2026-07-16T19:51:01Z,dry bulk shipping,Control of the Dardanelles and the Bosphorus strait was life and death for ancient Athens. Waterways are no less important – and contentious – today.,The Conversation Africa,Unknown,News,2026-07-21T08:31:43.342275Z
01aa675a8195f215abbfbc44140326e3,Ship traffic through Strait of Hormuz drops after U.S. blockade,https://economictimes.indiatimes.com/industry/transportation/shipping-/-transport/ship-traffic-through-strait-of-hormuz-drops-after-u-s-blockade/articleshow/132428688.cms,Reuters,2026-07-16T03:26:44Z,dry bulk shipping,"Fewer vessels traversed the Strait of Hormuz on Wednesday after the US reimposed its naval blockade. Shipping data indicated a decrease in traffic, with seven vessels crossing the strait. Hostilities intensified, impacting ship movements through this vital gl…",The Times of India,Unknown,News,2026-07-21T08:31:43.342325Z
9fe1ca6653912084cfa173297d1414f0,Baby Food Maker for $60 + free shipping,https://www.dealnews.com/Baby-Food-Maker-for-60-free-shipping/21903562.html,,2026-07-15T08:12:53Z,dry bulk shipping,"At Amazon, get this Baby Food Maker for $60. It's the best deal Amazon has offered for this model. It steams and blends in one step, with auto and manual modes that adjust texture as your baby grows from purees to chunkier bites, plus a self-cleaning cycle th…",Dealnews.com,Unknown,News,2026-07-21T08:31:43.342379Z
9e6b6b5630dd9633a1a31efb57a0226e,Iran-linked vessels pass through Strait of Hormuz ahead of US blockade,https://www.thehindubusinessline.com/economy/logistics/iran-linked-vessels-pass-through-strait-of-hormuz-ahead-of-us-blockade/article71223949.ece,Reuters,2026-07-15T03:58:51Z,dry bulk shipping,"Iran-linked vessels increased transit through the Strait of Hormuz before a US-imposed blockade, escalating tensions in the region.",BusinessLine,Unknown,News,2026-07-21T08:31:43.342415Z
0757d63f0dd1f07bedda7b1e213e4ddb,Iran-linked vessels pass through Hormuz ahead of US blockade,https://economictimes.indiatimes.com/news/international/global-trends/iran-linked-vessels-pass-through-hormuz-ahead-of-us-blockade/articleshow/132405160.cms,Reuters,2026-07-15T03:22:01Z,dry bulk shipping,Vessels transited the Strait of Hormuz linked to Iranian trade before a US blockade took effect. Nine of eleven vessels passed through the strait via the Iranian route on Tuesday. Three empty oil tankers entered the strait while others exited with Iranian exp…,The Times of India,Unknown,News,2026-07-21T08:31:43.342464Z
c879cb7c2c366fa80500e07801e70457,Humble Crew Kids' 4-Tier Bookshelf for $24 + free shipping w/ Prime,https://www.dealnews.com/products/Humble/Humble-Crew-Kids-4-Tier-Bookshelf/508589.html,,2026-07-15T00:17:47Z,dry bulk shipping,"Amazon offers the Humble Crew Kids' 4-Tier Bookshelf for $24.22.  That's a $12 low.  Shipping is free for Prime members. Buy Now at Amazon
 Features
 <ul> <li>Holds books upright to show covers, not spines</li> <li>Measures 25""W x 11""D x 24""H</li> </ul>",Dealnews.com,Unknown,News,2026-07-21T08:31:43.342505Z
e39f9a65d8c8ca9391abb6b2102d44a7,Genco Shipping & Trading Limited Announces Second Quarter 2026 Conference Call and Webcast,https://www.globenewswire.com/news-release/2026/07/14/3327275/37397/en/Genco-Shipping-Trading-Limited-Announces-Second-Quarter-2026-Conference-Call-and-Webcast.html,Genco Shipping & Trading Limited,2026-07-14T20:15:00Z,dry bulk shipping,"NEW YORK, July 14, 2026 (GLOBE NEWSWIRE) -- Genco Shipping & Trading Limited (NYSE: GNK) announced today that it will hold a conference call to discuss the Company’s results for the second quarter of 2026 on Thursday, August 6, 2026 at 8:30 a.m. Eastern Time.…",GlobeNewswire,Unknown,Market Report,2026-07-21T08:31:43.342580Z
0f81e417bca732a7e70144bde3f5a689,Navigating the Future of Shipping: Leadership Insights – Q2 2026,https://www.globenewswire.com/news-release/2026/07/14/3327176/20326/en/Navigating-the-Future-of-Shipping-Leadership-Insights-Q2-2026.html,Capital Link,2026-07-14T16:56:00Z,dry bulk shipping,"NEW YORK, July 14, 2026 (GLOBE NEWSWIRE) -- Capital Link is pleased to release the Q2 2026 edition of its Quarterly Shipping Insights—a carefully curated collection of original articles based on exclusive discussions with senior executives across the Containe…",GlobeNewswire,Unknown,Analysis/Opinion,2026-07-21T08:31:43.342652Z
1a359a61e24b3b422381d09b26f903c1,"Ukraine Hits Russian Refineries, Ships, Moscow Hits Odesa",https://www.rigzone.com/news/wire/ukraine_hits_russian_refineries_ships_moscow_hits_odesa-14-jul-2026-184130-article/,Bloomberg News,2026-07-14T14:05:57Z,dry bulk shipping,"Kyiv struck a slew of Russian energy targets overnight, while Moscow hit fuel facilities in the Ukrainian port of Odesa.",Rigzone,Russia,News,2026-07-21T08:31:43.342676Z
5cb57dfdaaac3f9258ff46fc08915715,"Diana Shipping Inc. Announces the Date for the 2026 Second Quarter Financial Results, Conference Call and Webcast",https://www.globenewswire.com/news-release/2026/07/14/3326717/10065/en/Diana-Shipping-Inc-Announces-the-Date-for-the-2026-Second-Quarter-Financial-Results-Conference-Call-and-Webcast.html,Diana Shipping Inc. c/o Diana Shipping Services S.A.,2026-07-14T11:05:00Z,dry bulk shipping,"ATHENS, Greece, July 14, 2026 (GLOBE NEWSWIRE) -- Diana Shipping Inc. (NYSE: DSX), (the “Company”), a global shipping company specializing in the ownership and bareboat charter-in of dry bulk vessels, today announced that its financial results for the second …",GlobeNewswire,Greece,News,2026-07-21T08:31:43.342726Z
c02fdb34d0a35d8050737ec2dd6cba6c,Heidmar acquires Q-Shipping,https://www.naftemporiki.gr/english/2137278/heidmar-acquires-q-shipping/,Αλεξία Σωτηρίου,2026-07-14T04:45:01Z,dry bulk shipping,"Athens-based and New York-listed Heidmar Maritime Holdings Corp. has completed the acquisition of Dutch ship management company Q-Shipping B.V., expanding its fleet management platform and international presence.
Q-Shipping provides ship…
Heidmar acquires Q-S…",Naftemporiki.gr,Global,News,2026-07-21T08:31:43.342771Z
e383ab18c190a29da41c432386e7e2b2,Oil tanker appears to halt in Hormuz after Iran targets vessels,https://www.bloomberg.com/news/articles/2026-07-20/oil-tanker-appears-to-halt-in-hormuz-after-iran-targets-vessels,Bloomberg,2026-07-20T04:42:51Z,bulk carrier,"The Kavomaleas, a products tanker, signalled early Monday near the tip of the Musandam Peninsula, indicating that it was anchored and empty",Bloomberg,Unknown,News,2026-07-21T08:31:44.064047Z
a98cec381d200a71711b1201a18b7a9d,Seized drug-smuggling ship MV Matthew sold for one dollar,https://www.irishtimes.com/crime-law/2026/07/18/seized-drug-smuggling-ship-mv-matthew-sold-for-one-dollar/,,2026-07-18T12:43:00Z,bulk carrier,"Revenue says State spent around €17 million on maintaining ship, which departed Cork on Friday after almost three years",The Irish Times,Unknown,News,2026-07-21T08:31:44.064262Z
5f3f35484dfa37f948ac8ad0dcf43d12,MV Matthew leaves Cork after 3 years and €16m in costs,https://www.rte.ie/news/ireland/2026/0717/1583938-mvmatthew-departure/,RTÉ News,2026-07-17T19:52:47Z,bulk carrier,"The MV Matthew freighter, which was at the centre of a dramatic drug interdiction off the south coast in 2023, has set sail to a European scrappage company.",RTE,Unknown,News,2026-07-21T08:31:44.064305Z
d278be789a5d032c12309117c5a40628,Drug-smuggling ship MV Matthew finally leaves Cork Harbour to head to Dutch scrapyard,https://www.thejournal.ie/mv-matthew-leaves-cork-harbour-for-dutch-scrapyard-7106109-Jul2026/,Jane Moore and Niall O'Connor,2026-07-17T19:48:41Z,bulk carrier,The cargo vessel at the centre of Ireland’s largest-ever cocaine seizure has been berthed in Cork Harbour since September 2023.,TheJournal.ie,Unknown,News,2026-07-21T08:31:44.064351Z
dc2f08ffb0bfb6b3159f3b0b7c6b7f49,"Iran Revolutionary Guards fire on Thai-flagged ship in Strait of Hormuz, sparking oil surge and crypto toll demands",https://cryptobriefing.com/iran-strait-hormuz-ship-attack-crypto-tolls/,Editorial Team,2026-07-17T17:41:21Z,bulk carrier,"Iran's IRGC fired on a Thai-flagged ship in the Strait of Hormuz, killing three sailors. Brent crude hit $126 as Iran reportedly demands crypto transit
The post Iran Revolutionary Guards fire on Thai-flagged ship in Strait of Hormuz, sparking oil surge and cr…",Crypto Briefing,Unknown,Market Report,2026-07-21T08:31:44.064406Z
acc9287c42bff5f7fb9e84cc6aae6432,Whistleblower Law Collaborative Client Successfully Blows Whistle On Redi-Bag USA and its CEO For Alleged Customs Fraud Scheme Involving Chinese-Made Retail Carrier Bags,https://www.prnewswire.com/news-releases/whistleblower-law-collaborative-client-successfully-blows-whistle-on-redi-bag-usa-and-its-ceo-for-alleged-customs-fraud-scheme-involving-chinese-made-retail-carrier-bags-302828690.html,,2026-07-17T16:29:00Z,bulk carrier,"BOSTON, July 17, 2026 /PRNewswire/ -- Whistleblower Law Collaborative LLC (WLC) is pleased to announce that the United States has settled a False Claims Act case alleging customs fraud brought by one of its clients against New York Packaging II LLC d/b/a Redi…",PRNewswire,China,News,2026-07-21T08:31:44.064429Z
533a8fd1a70239c16d928a18cc58987a,"MV Matthew to depart Cork having cost State €16m in berthing, crew and maintenance fees",https://www.irishtimes.com/crime-law/2026/07/17/mv-matthew-to-depart-cork-having-cost-state-16m-in-berthing-crew-and-maintenance-fees/,Barry Roche,2026-07-17T16:21:51Z,bulk carrier,Vessel was boarded by Army Rangers in 2023 in operation that led to seizure of €157m worth of cocaine,The Irish Times,Unknown,News,2026-07-21T08:31:44.064470Z
58486274a16e03f0cf6a4291df9bc498,US Central Command disables oil tanker M/T Belma with Hellfire missiles near Iran’s Kharg Island,https://cryptobriefing.com/centcom-disables-tanker-belma-hellfire-missiles-iran/,Editorial Team,2026-07-17T16:04:18Z,bulk carrier,"US Central Command fired Hellfire missiles to disable the M/T Belma near Iran's Kharg Island, the first enforcement action after reinstating its naval
The post US Central Command disables oil tanker M/T Belma with Hellfire missiles near Iran’s Kharg Island ap…",Crypto Briefing,Unknown,News,2026-07-21T08:31:44.064525Z
211ef1360e77dbfcba57e3aa86a16f2b,Scouting New York Jets UDFA cornerback Mory Bamba,https://www.ganggreennation.com/new-york-jets-roster/95018/scouting-jets-udfa-cornerback-mory-bamba,Bent Double,2026-07-17T15:00:00Z,bulk carrier,Taking a look at a Jets cornerback prospect,Gang Green Nation,Unknown,News,2026-07-21T08:31:44.064554Z
0f52df1610b08b0a3dd808ef71d4363c,Only 3 vessels transit Strait of Hormuz over past 24 hours amid renewed US-Iran hostilities,https://www.globalsecurity.org/wmd/library/news/iran/2026/07/iran-260717-azertac01.htm,John Pike,2026-07-17T12:00:00Z,bulk carrier,"Only three commodity vessels crossed the Strait of Hormuz in the last 24 hours as of 0730GMT Friday, marking the lowest daily transit level since May as maritime traffic remained largely halted amid renewed military escalation between the US and Iran, Anadolu…",Globalsecurity.org,Unknown,Market Report,2026-07-21T08:31:44.064683Z
24e595cb64df21e4aba62a49a6e17593,"Bankruptcies, financial challenges involve multiple trucking companies",https://www.truckingdive.com/news/bankruptcies-financial-challenges-involve-multiple-trucking-companies/825360/,David Taube,2026-07-17T10:15:00Z,bulk carrier,"At the forefront, Mountain Valley Express ended operations and is auctioning assets, according to representatives.",Truckingdive.com,Unknown,News,2026-07-21T08:31:44.064716Z
ec06d57e159edb8395b578072b98f3da,"The OPEKEPE saga and the European prosecutors (who are not finished yet…), Aperol and wine, but no more hard liquor at the Presidency, Piraeus Bank…denies while confirming regarding IASO",https://en.protothema.gr/2026/07/17/the-opekepe-saga-and-the-european-prosecutors-who-are-not-finished-yet-aperol-and-wine-but-no-more-hard-liquor-at-the-presidency-piraeus-bankdenies-while-confirming-regarding-ia/,Newsroom,2026-07-17T07:07:26Z,bulk carrier,"Greeks are locking in shipping’s next big bet early but not a single Greek newbuilding order in the past week 
The post The OPEKEPE saga and the European prosecutors (who are not finished yet…), Aperol and wine, but no more hard liquor at the Presidency, Pira…",Protothema.gr,Greece,News,2026-07-21T08:31:44.064774Z
72634b7c921b7b3f7c5787e38f3bc9fd,Sailors stranded in the Strait of Hormuz had explicit message for US forces: ‘F–k off’,https://nypost.com/2026/07/16/world-news/sailors-skeptical-of-us-promise-for-safe-passage-in-the-strait-of-hormuz-f-off/,Ronny Reyes,2026-07-16T18:40:26Z,bulk carrier,"The US had radioed ships in the waterway to direct them toward the Omani section of the strait under its protection, as the American blockade on Iran's ports took effect on Tuesday.",New York Post,USA,News,2026-07-21T08:31:44.064799Z
d9a61cb705e798e56135181b0dba802a,Russian Forces Hit Drone Manufacturing Enterprises in Kiev - Defense Ministry,https://www.globalsecurity.org/wmd/library/news/ukraine/2026/07/ukraine-260716-sputnik03.htm,John Pike,2026-07-16T12:00:00Z,bulk carrier,"The Russian armed forces hit defense industry complex enterprises in Kiev involved in the production of drones, infrastructure facilities in the ports of Odessa (Odesa) and Yuzhny as a result of group strikes carried out at night, the Russian Defense Ministry…",Globalsecurity.org,Russia,News,2026-07-21T08:31:44.064836Z
37dca0ec604327c9cfe3523df0298aa4,The drug-smuggling ship MV Matthew is finally leaving Cork today and heading for a Dutch scrapyard,https://www.thejournal.ie/mv-matthew-netherlands-scrap-leaving-cork-7103901-Jul2026/,Niall O'Connor and Andrew Walsh,2026-07-16T11:50:45Z,bulk carrier,The cargo vessel at the centre of Ireland’s largest-ever cocaine seizure has remained berthed in Cork Harbour since September 2023.,TheJournal.ie,Unknown,News,2026-07-21T08:31:44.064876Z
8b72ad6c9a17d94a190c49fdd574fb1c,Analysts Examine Hormuz Crossings,https://www.rigzone.com/news/analysts_examine_hormuz_crossings-16-jul-2026-184145-article/,Andreas Exarheas,2026-07-16T11:34:36Z,bulk carrier,Rigzone talks to analysts from Hartree Partners and Energy Aspects.,Rigzone,Unknown,News,2026-07-21T08:31:44.064902Z
b126480bf311c3733e5ad56f61a07955,"Fares Have Been Primed to Rise, Airlines Are Finally Making It Happen",https://crankyflier.com/2026/07/16/fares-have-been-primed-to-rise-airlines-are-finally-making-it-happen/,Brett,2026-07-16T10:45:00Z,bulk carrier,"Earnings season has officially begun with, as always, Delta kicking off festivities late last week and then United just yesterday releasing its numbers. The airlines unsurprisingly did very well, but the results and more importantly, forward-looking guidance,…",Crankyflier.com,Unknown,News,2026-07-21T08:31:44.064951Z
10d542c085525b4eb0f6cdd94de0385a,US strikes Iranian-linked oil tanker deep within Persian Gulf,https://www.bloomberg.com/news/articles/2026-07-16/us-strikes-iranian-linked-oil-tanker-deep-within-persian-gulf,Bloomberg,2026-07-16T10:12:04Z,bulk carrier,"The operation so deep within the gulf, far from the Strait of Hormuz, may signal the US is widening the scope from its first blockade",Bloomberg,Unknown,News,2026-07-21T08:31:44.064982Z
2c11907a1e3a78955da1a8e1a0939685,Russian Forces Hit Drone Manufacturing Enterprises in Kiev - Defense Ministry,https://sputnikglobe.com/20260716/russian-forces-hit-drone-manufacturing-enterprises-in-kiev---defense-ministry-1124453124.html,Sputnik International,2026-07-16T07:25:00Z,bulk carrier,"MOSCOW, (Sputnik) - The Russian armed forces hit defense industry complex enterprises in Kiev involved in the production of drones, infrastructure facilities in the ports of Odessa (Odesa) and Yuzhny as a result of group strikes carried out at night, the Russ…",Sputnikglobe.com,Russia,News,2026-07-21T08:31:44.065014Z
b0767160a1cd740331baf93677d32642,US Strikes Iranian-Linked Oil Tanker Deep Within Persian Gulf,https://financialpost.com/pmn/business-pmn/us-strikes-iranian-linked-oil-tanker-deep-within-persian-gulf,Bloomberg News,2026-07-16T04:39:22Z,bulk carrier,"The US military has hit a supertanker deep within the Persian Gulf near Iran’s key oil export terminal, its first attack on a vessel since it reimposed its blockade of the country’s shipping.",Financial Post,Unknown,News,2026-07-21T08:31:44.065056Z
4e0cdd4c537aad82b53c70ddf3cc444e,Tern’s New HSD Levels Up Cargo Biking,https://www.bikehugger.com/posts/terns-new-hsd-levels-up-cargo-biking/,Byron,2026-07-15T15:46:29Z,bulk carrier,"Tern’s New HSD Levels Up Cargo Biking Without Upsizing the Bike Tern has refreshed its compact cargo platform with an all-new HSD that stays short…
The post Tern’s New HSD Levels Up Cargo Biking appeared first on Bike Hugger.",Bikehugger.com,Unknown,News,2026-07-21T08:31:44.065143Z
d2a364e0ca138ae84581f2d775f94758,The K-Shaped Economy Is Forcing Companies to Operate Two Supply Chains,https://logisticsviewpoints.com/2026/07/15/the-k-shaped-economy-is-forcing-companies-to-operate-two-supply-chains/,Jim Frazer,2026-07-15T10:20:00Z,bulk carrier,"Affluent consumers continue to reward availability, speed, and service, while financially pressured households prioritize value. Supply chain leaders must increasingly support both operating models at once. By Jim Frazer The economy may still be growing, but …",Logisticsviewpoints.com,Unknown,News,2026-07-21T08:31:44.065190Z
423823d3275180e30654a15dfe330a8b,"The Southern Route Through Hormuz Is No Longer Safe, Regardless of What Trump Says",https://gcaptain.com/the-strait-of-hormuzs-southern-route-is-no-longer-safe/,Paul Morgan,2026-07-14T14:24:17Z,bulk carrier,"For the best part of a year, shipowners transiting the Strait of Hormuz have worked to a simple and largely unspoken rule of thumb, stay off the Iranian side, hug...",gcaptain.com,Unknown,News,2026-07-21T08:31:44.065302Z
9a77e146577016ab523f72bf34f41a3d,Iran rescues bulk carrier crew after collision in Strait of Hormuz,https://cryptobriefing.com/iran-rescues-bulk-carrier-crew-after-collision-in-strait-of-hormuz/,Estefano Gomez,2026-07-14T05:59:50Z,bulk carrier,"Heightened maritime risks in the Strait of Hormuz could disrupt global shipping, impacting trade and escalating geopolitical tensions.
The post Iran rescues bulk carrier crew after collision in Strait of Hormuz appeared first on Crypto Briefing.",Crypto Briefing,Global,News,2026-07-21T08:31:44.065341Z
260ae66e738cf9cd9d6453b3e1fdf53d,Iran's tankers take secret route through Hormuz to dodge US sanctions,https://economictimes.indiatimes.com/news/international/world-news/irans-tankers-take-secret-route-through-hormuz-to-dodge-us-sanctions/articleshow/132380356.cms,ET Online,2026-07-14T03:59:34Z,bulk carrier,"Iran secretly moved oil tankers through the Strait of Hormuz before US threats. US strikes followed an Iranian attack on a Cyprus-flagged container ship. Iran retaliated against US allies, striking UAE oil tankers and killing an Indian sailor. The US announce…",The Times of India,India,News,2026-07-21T08:31:44.065368Z
da320e0328913bcaa113ad8e8bdba253,Composition-engineered Sr1−xBaxTiO3 for high-efficiency dielectric resonator antennas in 5G/6G bands,https://www.nature.com/articles/s41598-026-61044-1,"Moustafa A. Darwish, F. Fakhry, Marwa M. Hussein, Yousef M. Abd El-Maboud, Enas H. El-Ghazzawy, Anwer S. Abd El-Hameed, Asmaa I. Afifi, Sherif G. Elsharkawy, M. M. Salem",2026-07-14T00:00:00Z,bulk carrier,Scientific Reports - Composition-engineered Sr1−xBaxTiO3 for high-efficiency dielectric resonator antennas in 5G/6G bands,Nature.com,Unknown,Market Report,2026-07-21T08:31:44.065408Z
dcdca44ba389eff17022c56ae23ec66a,"Adonis, Samaras (and the blame game), how many contenders can fit in PASOK, the invitations to the Presidential Mansion, the Piraeus Bank–IASO deal is closed",https://en.protothema.gr/2026/07/15/adonis-samaras-and-the-blame-game-how-many-contenders-can-fit-in-pasok-the-invitations-to-the-presidential-mansion-the-piraeus-bank-iaso-deal-is-closed/,Newsroom,2026-07-15T05:18:00Z,panamax,"Discounts from the refineries & the bill on occupational insurance
The post Adonis, Samaras (and the blame game), how many contenders can fit in PASOK, the invitations to the Presidential Mansion, the Piraeus Bank–IASO deal is closed appeared first on ProtoTh…",Protothema.gr,Greece,News,2026-07-21T08:31:45.204273Z
f1da75fb041f531604f484a13fbbfd17,Concentrations of essential and non-essential elements in eastern North Pacific killer whales (Orcinus orca),https://journals.plos.org/plosone/article?id=10.1371/journal.pone.0353196,"Catherine F. Lo, Joseph K. Gaydos, Robert Poppenga, Lynne Barre, Kathy Burek-Huntington, John Calambokidis, Paul Cottrell, Debbie Duffield, Jessica L. Huggins, Dyanna M. Lambourn, Jim Rice, Heindrich N. Snyman, Judy St. Leger, Matthew Van Daele, Kristi L. West, Forrest M. Gomez, Stephen Raverty",2026-07-15T14:00:00Z,baltic dry index,"Essential and non-essential elements can harm marine wildlife and impact ecosystems. Using liver (n = 35) and kidney (n = 17) samples from 35 animals from three distinct killer whale (Orcinus orca) ecotypes (fish-eating residents, mammal-eating transients, an…",Plos.org,Unknown,News,2026-07-21T08:31:46.985421Z
af652480dea5b87cd69a5476c36c1374,L&T bags mega orders in metals and minerals business from public and private sector companies,https://www.thehindubusinessline.com/markets/stock-markets/lt-bags-mega-orders-in-metals-and-minerals-business-from-public-and-private-sector-companies/article71244061.ece,ANI,2026-07-20T07:24:43Z,iron ore,"The scope of work includes design and engineering, procurement, installation and commissioning of a downhill conveyor system, screening plant, stockpile, yard equipment, RWLS and associated auxiliaries",BusinessLine,Unknown,News,2026-07-21T08:31:47.508844Z
9a82250993c0d0674c92b906f73d7efb,L&T bags 'mega' orders in metals and minerals business from public and private sector companies,https://economictimes.indiatimes.com/industry/indl-goods/svs/metals-mining/lt-bags-mega-orders-in-metals-and-minerals-business-from-public-and-private-sector-companies/articleshow/132507500.cms,ANI,2026-07-20T06:42:47Z,iron ore,Larsen & Toubro's Metals & Minerals business secured multiple mega orders. These contracts are from leading domestic public and private sector companies. One order involves an 18-MTPA iron ore handling plant in Chhattisgarh. Another project expands a steel pl…,The Times of India,Unknown,News,2026-07-21T08:31:47.509081Z
436af093202c170240c2d3d0af6e3005,JSW Steel shares gain over 2% as Q1 earnings boost investor sentiment,https://www.thehindubusinessline.com/markets/jsw-steel-shares-gain-over-2-as-q1-earnings-boost-investor-sentiment/article71243887.ece,BL Bengaluru Bureau,2026-07-20T05:18:00Z,iron ore,JSW Steel shares rise over 2% after strong Q1 earnings boost investor confidence amid positive brokerage outlooks.,BusinessLine,Unknown,Analysis/Opinion,2026-07-21T08:31:47.509113Z
