article_id,title,link,creator,pubdate,category,description,source,country,article_type,scrape_timestamp
cf1023777463fad2e1d7f86706c22ecc,The Strait of Hormuz is about more than just oil. It feeds 100 million people | CNN Business,https://www.cnn.com/2026/03/21/business/strait-of-hormuz-food-supply-intl,Eleni Giokos,2026-03-21T04:20:55Z,dry bulk shipping,"Oil and liquefied natural gas tankers moving through the Strait of Hormuz carry around 20% of the world’s supply. But for countries on the Persian Gulf, the waterway is more than just an energy route – it’s a lifeline for more than 100 million people.",CNN,Unknown,News,2026-03-22T06:55:38.794199Z
d4815189f66721ff4a69879fdd56ea89,Great Eastern Shipping gains as charter rates double due to war in West Asia,https://www.livemint.com/companies/great-eastern-shipping-gains-as-charter-rates-double-due-to-war-in-west-asia-vessels-fuel-oil-11773994135861.html,Nehal Chaliawala,2026-03-21T00:20:22Z,dry bulk shipping,The shipping firm is using high spot-market exposure to capitalize on increased global charter rates fuelled by the West Asia war. Its strategic fleet positioning and successful navigation of blockaded waters have driven a 27% stock rally despite a broader ma…,Livemint,Global,Market Report,2026-03-22T06:55:38.794260Z
ce1ba2b6e16d828439aac801384cee7d,Genco Shipping & Trading Issues Statement,https://www.globenewswire.com/news-release/2026/03/20/3259895/37397/en/Genco-Shipping-Trading-Issues-Statement.html,Genco Shipping & Trading Limited,2026-03-20T17:34:00Z,dry bulk shipping,"NEW YORK, March 20, 2026 (GLOBE NEWSWIRE) -- Genco Shipping & Trading Limited (NYSE:GNK) (“Genco” or the “Company”), the largest U.S. headquartered drybulk shipowner focused on the global transportation of commodities, today issued the following statement:",GlobeNewswire,Global,Market Report,2026-03-22T06:55:38.794306Z
8ce6bcbc8186756b82ca5a1e9abfcfee,Star Bulk Announces the Availability of Its 2025 Annual Report on Form 20‐F,https://www.globenewswire.com/news-release/2026/03/20/3259859/0/en/Star-Bulk-Announces-the-Availability-of-Its-2025-Annual-Report-on-Form-20-F.html,Star Bulk Carriers Corp.,2026-03-20T16:00:00Z,dry bulk shipping,"ATHENS, Greece, March 20, 2026 (GLOBE NEWSWIRE) -- Star Bulk Carriers Corp. (the ""Company"" or ""Star Bulk"") (Nasdaq: SBLK), today announced that the Company’s annual report on Form 20‐F (the “Annual Report”), which contains the Company’s audited financial stat…",GlobeNewswire,Greece,Market Report,2026-03-22T06:55:38.794353Z
a1c04440d09abfd24572e01147c5bbfa,"Diana Shipping Inc. Comments on Genco Shipping & Trading Rejection of Diana’s Increased Offer to Acquire Genco, Made in Partnership with Star Bulk Carriers",https://www.globenewswire.com/news-release/2026/03/20/3259795/10065/en/Diana-Shipping-Inc-Comments-on-Genco-Shipping-Trading-Rejection-of-Diana-s-Increased-Offer-to-Acquire-Genco-Made-in-Partnership-with-Star-Bulk-Carriers.html,Diana Shipping Inc. c/o Diana Shipping Services S.A.,2026-03-20T13:24:00Z,dry bulk shipping,Diana Urges Genco Board to Engage in Good Faith Negotiations to Reach Definitive Agreement   Proposal Has No Execution Risk Given Financing Commitment from...,GlobeNewswire,Unknown,Analysis/Opinion,2026-03-22T06:55:38.794397Z
eaa25e5580d934564fcb51ffa7e8193d,Vafias to “N”: Gulf freight rates soar – Market open only to the bold,https://www.naftemporiki.gr/english/2087675/vafias-to-n-gulf-freight-rates-soar-market-open-only-to-the-bold/,Μιχάλης Ματσίγκος,2026-03-19T12:12:28Z,dry bulk shipping,"Time is running out before the war in Iran begins to have serious knock‑on effects on the global economy and shipping markets.
Haris Vafias, who was named EY “Entrepreneur of…
Vafias to “N”: Gulf freight rates soar – Market open only to the bold - Η ΝΑΥΤΕΜΠΟΡ…",Naftemporiki.gr,Global,Market Report,2026-03-22T06:55:38.794450Z
e97633ded102dff3b7bb6f584ff2385a,Skeptical Science New Research for Week #12 2026,https://skepticalscience.com/new_research_2026_12.html,,2026-03-19T05:06:05Z,dry bulk shipping,"Open access notables

The emerging human fingerprint on global extreme fire weather, Turco et al., Science Advances

Extreme fire weather (hot, dry, and windy conditions) has intensified globally, yet formally attributing this trend to anthropogenic climate c…",Skepticalscience.com,Global,News,2026-03-22T06:55:38.794500Z
e30fb87f99130aa36eadd1b275ba4ea8,"Dire Straits: Some vessels trickle through Hormuz, their unusual paths indicate a nod from Iran",https://indianexpress.com/article/explained/explained-economics/strait-of-hormuz-blockade-iran-selective-ship-passage-10589775/,Sukalp Sharma,2026-03-19T02:01:27Z,dry bulk shipping,"India currently has 22 merchant vessels stuck in the Persian Gulf. A majority of those are oil and gas tankers, cumulatively holding 3.2 lakh tonnes of LPG, 2 lakh tonnes of LNG, and 16 lakh tonnes of crude oil destined for India",The Indian Express,India,News,2026-03-22T06:55:38.794531Z
7b5c8b0ba714b5bdd43e0bac70df6865,"Hormuz chokehold leaves over 1.7 million tonnes of India’s oil, LNG and LPG cargo stranded",https://economictimes.indiatimes.com/industry/energy/oil-gas/hormuz-chokehold-leaves-over-1-7-million-tonnes-of-indias-oil-lng-and-lpg-cargo-stranded/articleshow/129659781.cms,PTI,2026-03-18T15:07:22Z,dry bulk shipping,"In the heart of the Persian Gulf, twenty-two Indian vessels laden with essential oil and gas remain stranded. With millions of tonnes of crude oil, LPG, and LNG in limbo, these ships are eagerly awaiting clearance to navigate the obstructed Strait of Hormuz. …",The Times of India,India,News,2026-03-22T06:55:38.794578Z
e4896975fedebae37bb4414ad345bd79,Star Bulk: Turn to larger bulkers,https://www.naftemporiki.gr/english/2087013/star-bulk-turn-to-larger-bulkers/,Γιάννα Βαρδαλαχάκη,2026-03-18T05:26:34Z,dry bulk shipping,"Star Bulk Carriers presented its strategy for further development of its fleet, with an emphasis on larger dry bulk vessels, with the listed company’s CEO Petros Pappas pointing out that…
Star Bulk: Turn to larger bulkers - Η ΝΑΥΤΕΜΠΟΡΙΚΗ",Naftemporiki.gr,Unknown,News,2026-03-22T06:55:38.794624Z
2a4519a93a5d8667c5bdb39bae56aec0,Second LPG tanker reaches India from war zone,https://statetimes.in/second-lpg-tanker-reaches-india-from-war-zone/,statetimes_editor,2026-03-17T19:42:56Z,dry bulk shipping,"STATE TIMES NEWS NEW DELHI: A second Indian-flagged LPG tanker reached the country early Tuesday after safely sailing from the war-hit Strait of Hormuz, and efforts are on to ensure the safe passage of the remaining 22 Indian vessels still stranded in the con…",Statetimes.in,India,News,2026-03-22T06:55:38.794651Z
a717a2fb6190ce7dd8ebf7a93febd4bd,Globus Maritime Announces Filing of its 2025 Annual Report on Form 20–F,https://www.globenewswire.com/news-release/2026/03/16/3256765/0/en/Globus-Maritime-Announces-Filing-of-its-2025-Annual-Report-on-Form-20-F.html,Globus Maritime Limited,2026-03-16T20:45:00Z,dry bulk shipping,"GLYFADA, Greece, March 16, 2026 (GLOBE NEWSWIRE) -- Globus Maritime Limited (""Globus,"" the “Company,"" “we,” or “our”), (NASDAQ: GLBS), a dry bulk shipping company, announced today that the Company’s annual report on Form 20-F that contains the Company’s audit…",GlobeNewswire,Greece,Market Report,2026-03-22T06:55:38.794692Z
7cc105a545ea56c4e43dbafa21dbc67d,"Crude, petrol, diesel & natural gas stocks comfortable, even as LPG supply remains tight: Government",https://www.thehindubusinessline.com/economy/logistics/crude-petrol-diesel-natural-gas-stocks-comfortable-even-as-lpg-supply-remains-tight-government/article70750744.ece,Rishi Ranjan Kala,2026-03-16T15:12:02Z,dry bulk shipping,"Of the two Indian-flag LPG carriers that crossed the Strait of Hormuz on March 14 carrying about 92,712 tonne LPG, vessel Shivalik has reached Mundra Port around 1700 hrs",BusinessLine,India,News,2026-03-22T06:55:38.794713Z
eaa3a30f9e862f7b15073ee0dd704d34,Diana Shipping Inc. Announces the Filing of Its 2025 Annual Report on Form 20-F,https://www.globenewswire.com/news-release/2026/03/16/3256373/10065/en/Diana-Shipping-Inc-Announces-the-Filing-of-Its-2025-Annual-Report-on-Form-20-F.html,Diana Shipping Inc. c/o Diana Shipping Services S.A.,2026-03-16T13:22:00Z,dry bulk shipping,"ATHENS, Greece, March 16, 2026 (GLOBE NEWSWIRE) -- Diana Shipping Inc. (NYSE: DSX), (the “Company”), a global shipping company specializing in the ownership and bareboat charter-in of dry bulk vessels, today announced that it has filed its 2025 Annual Report …",GlobeNewswire,Greece,Market Report,2026-03-22T06:55:38.794755Z
f0b1dae78f2c9cbbf76c134719efcd83,Existential Attrition: Iran’s Closure of the Strait of Hormuz,https://www.counterpunch.org/2026/03/16/existential-attrition-irans-closure-of-the-strait-of-hormuz/,Binoy Kampmark,2026-03-16T05:51:57Z,dry bulk shipping,"“The geopolitical genie is out of the bottle: by capitalizing on geography to disrupt global trade, countries can strengthen their strategic position at relatively low cost.” – Alex Mills, The Atlantic Council, March 12, 2026 With each day of glorified action…",CounterPunch,Global,News,2026-03-22T06:55:38.794803Z
20844e4809e239558d8df27a169ea8bc,Tanker carrying crude safely exits Fujairah even as drone hits oil terminal,https://www.thehindubusinessline.com/economy/logistics/tanker-carrying-crude-safely-exits-fujairah-even-as-drone-hits-oil-terminal/article70747052.ece,Rishi Ranjan Kala,2026-03-15T15:46:15Z,dry bulk shipping,Indian tanker Jag Laadki safely departs Fujairah for India despite a drone attack on the UAE oil terminal.,BusinessLine,India,News,2026-03-22T06:55:38.794823Z
af990694d947f4b74b251849fe02de5c,Tanker carrying crude safely exits Fujairah even as drone hits oil terminal,https://www.thehindubusinessline.com/companies/tanker-carrying-crude-safely-exits-fujairah-even-as-drone-hits-oil-terminal/article70747052.ece,Rishi Ranjan Kala,2026-03-15T14:52:33Z,dry bulk shipping,Indian tanker Jag Laadki safely departs Fujairah for India despite a drone attack on the UAE oil terminal.,BusinessLine,India,News,2026-03-22T06:55:38.794837Z
8b85671c1da0f0313ef0475e8db90739,Liberia-flagged oil tanker with Saudi Arabian crude reaches India after crossing Strait of Hormuz,https://indianexpress.com/article/business/oil-tanker-smyrni-reaches-mumbai-strait-of-hormuz-west-asia-war-energy-supply-10583538/,Sukalp Sharma,2026-03-15T13:36:01Z,dry bulk shipping,"The oil tanker—Smyrni—is estimated to be carrying up to 1 million barrels of Saudi Arabian crude, and arrived at Mumbai anchorage late Saturday, as per ship tracking data.",The Indian Express,India,News,2026-03-22T06:55:38.794862Z
672a5167abf91419d726e96f5afe7bd9,The biggest oil risk is at the bottom of the barrel,https://economictimes.indiatimes.com/news/international/business/the-biggest-oil-risk-is-at-the-bottom-of-the-barrel/articleshow/129586234.cms,Bloomberg,2026-03-15T07:27:30Z,dry bulk shipping,"Fuel oil, once the cheapest commodity, has become ultra-expensive due to the Iran war, threatening global trade. Key Asian ports face potential shortages, forcing ships to reroute or halt operations. The closure of the Strait of Hormuz is a primary cause, imp…",The Times of India,Global,News,2026-03-22T06:55:38.794908Z
fdad8349bb63a7aba8fa11adfa0b64f8,Top 10 Best SMS Marketing Platform in USA,https://www.textmunication.com/blog/top-10-sms-marketing-platforms,Textmunication Inc,2026-03-21T02:34:11Z,bulk carrier,"Discover the top 10 best SMS marketing platforms for 2025 including Textmunication, SlickText, EZ Texting, Klaviyo, and Twilio. Compare features, pricing, and find the perfect platform for your business needs.",Textmunication.com,Unknown,Market Report,2026-03-22T06:55:39.340452Z
325343c059f49c4972e92ddfd2aa7b23,Patriots draft profile: Chris Brazzell looks tailor-made for Drake Maye,https://www.patspulpit.com/new-england-patriots-draft/124452/chris-brazzell-tennessee-scouting-report,Bernd Buchmasser,2026-03-21T01:36:06Z,bulk carrier,Brazzell is one of the top wide receiver prospects in this year’s draft.,Pats Pulpit,Unknown,News,2026-03-22T06:55:39.340496Z
8f7979b03a198b6555774f53cf832a28,Second Amphibious Assault Ship Now Heading To Middle East...,http://www.twz.com/news-features/uss-boxer-the-second-amphibious-assault-ship-now-heading-to-middle-east,the war zone,2026-03-20T19:00:12Z,bulk carrier,"With two Amphibious Ready Groups heading to the Middle East, there is increasing speculation that the U.S. will try to seize Iran's strategic Kharg Island.",Twz.com,Unknown,News,2026-03-22T06:55:39.340532Z
1c453cf511957717df8d6e9f26396fb6,8 Best EDC Knives To Choose Based on Your Outdoor Personality,https://www.yankodesign.com/2026/03/19/8-best-edc-knives-to-choose-based-on-your-outdoor-personality/,Sarang Sheth,2026-03-20T01:46:51Z,bulk carrier,8 Best EDC Knives To Choose Based on Your Outdoor PersonalityThe gear people carry tends to reflect how they move through the world. A minimalist packs light and intentionally. A tactical thinker layers redundancy into...,Yanko Design,Unknown,News,2026-03-22T06:55:39.340591Z
f49195579fce43852392631e7d8d5e7c,Algoma Central Corporation Announces Renewal of Normal Course Issuer Bid,https://financialpost.com/pmn/business-wire-news-releases-pmn/algoma-central-corporation-announces-renewal-of-normal-course-issuer-bid-7,Business Wire,2026-03-19T11:09:19Z,bulk carrier,"ST. CATHARINES, Ontario — Algoma Central Corporation (“Algoma” or the “Company”) (TSX:ALC), a leading provider of marine transportation services, announced today that the Toronto Stock Exchange (“TSX”) has accepted its notice of intention to proceed with the …",Financial Post,Unknown,News,2026-03-22T06:55:39.340843Z
5f5dee647024733faecb6f444b24661a,Dipole-assisted functionalization enables long-range ordering of ZnTeSe quantum dots for efficient and stable deep-blue electroluminescence,https://www.nature.com/articles/s41566-026-01878-3,"Wan-Shan Shen, Li-Ming Xie, Wen-Long Fei, Xin Gu, Ye Wang, Hua-Hui Li, Wei-Zhi Liu, Yun-Jun Wang, Wen-Ming Su, Ya-Kun Wang, Liang-Sheng Liao",2026-03-19T00:00:00Z,bulk carrier,"Functionalization of ZnTeSe quantum dots via ordering arrangement and energy-level modulation enables deep-blue quantum dot light-emitting diodes with a peak external quantum efficiency of 23.6% and a half-lifetime exceeding 50,000 h at an initial luminance o…",Nature.com,Unknown,News,2026-03-22T06:55:39.340928Z
df0d89b905447d5543be8a289d545822,THE NITROGEN TRAP,https://freerepublic.com/focus/f-chat/4371197/posts,Shanaka,2026-03-18T20:59:31Z,bulk carrier,The world spent fifty years and hundreds of billions of dollars building Strategic Petroleum Reserves so that no geopolitical rupture could fully sever modern civilization from energy. The United States alone holds just over 400 million barrels of crude oil i…,Freerepublic.com,USA,News,2026-03-22T06:55:39.340955Z
108757a699ac17943721f78c6d88afac,Not a typo: Mint Mobile is now selling the Google Pixel 10 for only $299 — plus get 50% off a year of unlimited,https://www.androidcentral.com/phones/google-pixel/not-a-typo-mint-mobile-is-now-selling-the-google-pixel-10-for-only-usd299-plus-get-50-percent-off-a-year-of-unlimited,"patrick.farmer@futurenet.com (Patrick Farmer) , Patrick Farmer",2026-03-18T19:23:35Z,bulk carrier,Looking for a new phone and a new wireless carrier? Mint Mobile has a deal that will get you both for less than 500 bucks.,Android Central,Unknown,News,2026-03-22T06:55:39.340999Z
6f925e81e877dacef8f120d3b237eb88,Iranians Celebrate On Streets - IRGC Lose Control - Huge Missile Attack On Israel,https://freerepublic.com/focus/f-bloggers/4371155/posts,Tousi TV,2026-03-18T15:42:11Z,bulk carrier,"People out in streets doing fire festival, shouting Javid Shah, regime warned that anyone in streets will get shot, and IRGC Basij have shot people, and IDF has droned a lot of the IRGC Basij, and people celebrate boisterously regardless. Ayatollahs dropping …",Freerepublic.com,Unknown,News,2026-03-22T06:55:39.341048Z
68541a11cacff5b77fb0639263985d37,ゃゃパゃケ❼ィ ゃケ❼ィゃ潟ソ若ぇ荀＜ャ合/ ...,http://www.st.ryukoku.ac.jp/~kjm/security/memo/2026/03.html#20260319__southpars,,2026-03-18T15:00:00Z,bulk carrier,"ゃゃパゃケ❼ィ <ul> <li>
 ゃケ❼ィゃ潟ソ若ぇ荀＜ャ合/a> (Wall Street Journal, 3/19) 
 <li>
 ゃ潟ゃケ❼ィ膠喝紊сケ違オケ鴻紙茵/a> (≪ャ 3/19) 
 <li> ゃ恰紊сケ違祿竊域辱ソ若吾紙膓⒢ (CNN, 3/19) 
 、鴻賢宴莎激泣ヲ鴻若ケ、❼源荀荐㏍羶c紙祿竊渥蓙昆穩NS磧Λ禮秉齋祀礙垂r> 障嘘純劫ゃ
唇鴻ソ若罕∝篁筝綽泣、❼篋オケ号障ｄ絎篏パャ筝筝罩ｃソ若恐ぉ吟ャ刻LNG鐚荐㏍筝i
源綣泣 
 <li>
 ゃ潟筝㊥ぉ吟ャ号荐㊥怨奨…",Ryukoku.ac.jp,Unknown,News,2026-03-22T06:55:39.341085Z
c391ee3f08da3361f0ffe05a6cc04990,"(㏍、帥, 3/12) 紙с、❼蕭絨＜ゅ見絎潟ゃ潟膕冗、鴻 ...",http://www.st.ryukoku.ac.jp/~kjm/security/memo/2026/03.html#20260319__iran,,2026-03-18T15:00:00Z,bulk carrier,"(㏍、帥, 3/12) 紙с、❼蕭絨＜ゅ見絎潟ゃ潟膕冗、鴻初茵罔❼膓㊥絎膠恰掩≪怨吾羌綵ｃ <li> ゃ潟絎┤≪ク帥絽莢キ肴；ч篏峡繞 (G端ney Y脹ld脹z / Forbs, 3/13) 
 膈＜ゅ見絎潟腥榊繍緇潟激⒢ェゆ≧с蕭キ⒢♂初茵緇⒤絨腴┤羌≪帥、画筝㏍吾ソ見若、鴻絖冴御с⒢決㍽。吟篋⒥絎 
 ≪ク帥絽ゃケ❼篏叫窿パ⒧膣≧蕭絨ゃケ❼羈⑥篏罨≪ク帥絽羈⑥㍾О激吾禹礇９磴礇羽祟荐種сd膣「ゃ腑
 吟＜ゅ見蕭絨冴決88篋冴e㌻篌⑯絲障荳⒢祚腓冴ゃ恰蕭＞「⒢❼吾激パ吾ソ見㍼冴撮肅❼ゃ絽絖拷羇冗吟オ潟ゃ絽…",Ryukoku.ac.jp,Unknown,News,2026-03-22T06:55:39.341119Z
1470da17045579318ae31f39be8095c5,"Joe Kent, a Top U.S. Counterterrori ...",http://www.st.ryukoku.ac.jp/~kjm/security/memo/2026/03.html#20260319__joe,,2026-03-18T15:00:00Z,bulk carrier,"<ul> <li> Joe Kent, a Top U.S. Counterterrorism Official, Resigns Over the Iran War (NYTimes, 3/17) 
 宴罸с⒢充㏍域茫上┝パ⒢障021綛ャｉヲ茘遺茘遺ゲ篁吟FBI絎＜篁パ⒢ず障激「016綛眼紊х輝源綣泣ゃｃ激「祉
⒢莵眼 障ア潟羂冴ィ❼cョｃ違≪ⅺ紫祿秧罔⑭蓙В窿磧峭竅 href=""https://www.nytimes.com/2025/05/16/us/politics/trump-appointee-ve…",Ryukoku.ac.jp,Unknown,News,2026-03-22T06:55:39.341159Z
c6a1083bc0b5da2571ac0ec2629b2228,"(NYTimes, 3/16) USS Gerald R. Ford ...",http://www.st.ryukoku.ac.jp/~kjm/security/memo/2026/03.html#20260319__ford,,2026-03-18T15:00:00Z,bulk carrier,"(NYTimes, 3/16) <li> USS Gerald R. Ford Now in the Red Sea, USS George H.W. Bush Wraps Pre-Deployment Exercises (USNI News, 3/6)/6 羌激パｃ祺с 帥ф 
 <li> Missed Funerals and Blocked Toilets: Iran Deployment Takes a Toll on U.S. Sailors (Wall Street Journal, 2/21)傑…",Ryukoku.ac.jp,Unknown,News,2026-03-22T06:55:39.341203Z
690ed1f9e939dc36ba77ddf43f269a45,"(Google, 3/18)テhrome 146.0.7680.153 ...",http://www.st.ryukoku.ac.jp/~kjm/security/memo/2026/03.html#20260319__chrome,,2026-03-18T15:00:00Z,bulk carrier,"(Google, 3/18)テhrome 146.0.7680.153/154 for Windows/Mac 146.0.7680.153 for Linux 祉ュャ」贋障⒢",Ryukoku.ac.jp,Unknown,News,2026-03-22T06:55:39.341232Z
15c67dbd32d7d570cd1483fee80a52d0,Middle East & Africa (MEA) Freight and Logistics Market Outlook Report 2026-2031 - Mega-investments Propel Multimodal Logistics Growth in Saudi Arabia and Beyond,https://www.globenewswire.com/news-release/2026/03/18/3257979/28124/en/Middle-East-Africa-MEA-Freight-and-Logistics-Market-Outlook-Report-2026-2031-Mega-investments-Propel-Multimodal-Logistics-Growth-in-Saudi-Arabia-and-Beyond.html,Research and Markets,2026-03-18T10:02:00Z,bulk carrier,"Dublin, March 18, 2026 (GLOBE NEWSWIRE) -- The ""Middle East and Africa Freight and Logistics - Market Share Analysis, Industry Trends & Statistics, Growth Forecasts (2026-2031)"" has been added to ResearchAndMarkets.com's offering.",GlobeNewswire,Unknown,Analysis/Opinion,2026-03-22T06:55:39.341269Z
60a50b7e5ebf974e990ce0a743404676,Trump’s Strait showdown: Five bold moves to crush the Iran threat now,https://www.foxnews.com/opinion/trumps-strait-showdown-five-bold-moves-crush-iran-threat,,2026-03-18T09:00:36Z,bulk carrier,President Donald Trump predicts commercial traffic will resume through the Strait of Hormuz within weeks as Operation Epic Fury targets Iranian forces.,Fox News,Unknown,News,2026-03-22T06:55:39.341310Z
0eed34ea4006594b44ff54b9d1e5e7fb,"Fuel Storage for Survival Retreats, by Flighter",https://survivalblog.com/2026/03/18/fuel-storage-for-survival-retreats-by-flighter/,SurvivalBlog Contributor,2026-03-18T00:05:27Z,bulk carrier,"Editor’s Introductory Note: The following is a re-post of a 2007 SurvivalBlog article. Given the recent spike in gasoline and diesel fuel prices, I thought that is was apropos to re-post a few articles related to fuel from SurvivalBlog’s early days. — The wor…",Survivalblog.com,Unknown,Market Report,2026-03-22T06:55:39.341350Z
28a46b841198a2e5935fb83e276652f5,"Precise, minimally evolved adenine base editors generated through mutation reversion analysis",https://www.nature.com/articles/s41587-026-03045-z,"Mallory Evanoff, Sanjana Korpal, Zachary D. Krill, Quinn T. Cowan, Alexis C. Komor",2026-03-18T00:00:00Z,bulk carrier,Base editor precision is increased by reverting established mutations.,Nature.com,Unknown,Analysis/Opinion,2026-03-22T06:55:39.341376Z
3fac514f3ba14caad783d64aa9b8a8cb,Seahawks RB George Holani could have huge 2026 opportunity,https://seahawkswire.usatoday.com/story/sports/nfl/seahawks/2026/03/17/seahawks-rb-george-holani-could-have-huge-2026-opportunity/89191600007/,"Justin Melo, Seahawks Wire",2026-03-17T13:01:32Z,bulk carrier,Seattle Seahawks running back George Holani could have a huge opportunity during the 2026 season.,USA Today,Unknown,News,2026-03-22T06:55:39.341404Z
ef05ae289b96b899a250c07e0b43985b,How many ships have been attacked in the Gulf?,https://www.rte.ie/news/2026/0317/1563832-ship-attacks-gulf/,RTÉ News,2026-03-17T12:00:52Z,bulk carrier,"The US-Israeli war on Iran has threatened Gulf ports and disrupted global trade through the Strait of Hormuz, a vital waterway through which roughly a fifth of the world's oil and liquefied natural gas normally passes.",RTE,Global,News,2026-03-22T06:55:39.341439Z
4c63aa0478609b368a28eb9f884c3a70,Price Hikes at the Pump Destabilize Southeast Asian Politics,http://foreignpolicy.com/2026/03/17/iran-war-thailand-indonesia-fuel-price/,Joseph Rachman,2026-03-17T05:00:00Z,bulk carrier,"Indonesia, for one, has a bloody history of fuel-related riots.",Foreign Policy,Indonesia,News,2026-03-22T06:55:39.341460Z
d4cafeaac0c64251e195f816969ad1b4,Why The Strait Of Hormuz Is Such A Pivotal Waterway,https://www.huffpost.com/entry/strait-of-hormuz-iran_n_69b8b52de4b09a39145e61f6,HuffPost,2026-03-17T04:55:05Z,bulk carrier,"In the wake of U.S. and Israeli attacks, Iran has effectively shut down the waterway by threatening to target ships that pass through it",HuffPost,Unknown,News,2026-03-22T06:55:39.341489Z
6278ef52da04cde1ec1c8b64c8453a4b,"Trump’s Hormuz problem, briefly explained",https://www.vox.com/the-logoff-newsletter-trump/482803/donald-trump-iran-war-strait-of-hormuz-oil-gas-us-allies,Cameron Peters,2026-03-16T21:49:20Z,bulk carrier,"This story appeared in The Logoff, a daily newsletter that helps you stay informed about the Trump administration without letting political news take over your life. Subscribe here. Welcome to The Logoff: Donald Trump is looking for help with the war he start…",Vox,Unknown,Market Report,2026-03-22T06:55:39.341530Z
585817238a5ba5d7ee5dfef55586a9d2,Optus appoints new OSS chief,https://www.itnews.com.au/news/optus-appoints-new-oss-chief-624333,,2026-03-16T20:08:14Z,bulk carrier,To strengthen leadership of new division.,iTnews,Unknown,News,2026-03-22T06:55:39.341569Z
939a87dcc5b886af23df2011eb3eab63,Google Pixel 10 Pro 10 Fold Review,https://www.thurrott.com/mobile/android/google-pixel/333789/google-pixel-10-pro-10-fold-review,Paul Thurrott,2026-03-16T18:30:58Z,bulk carrier,"The Google Pixel 10 Pro Fold is a godsend for those who need a bigger display and can afford the cost.
The post Google Pixel 10 Pro 10 Fold Review appeared first on Thurrott.com.",Thurrott.com,Unknown,Analysis/Opinion,2026-03-22T06:55:39.341596Z
d17ce0e356e19e7d3135ccb99c64ddb3,"Mint Mobile just quietly dropped one of the best Galaxy S26 deals I've seen yet — over 40% off the phone, heavily discounted wireless",https://www.androidcentral.com/phones/samsung-galaxy/mint-mobile-samsung-galaxy-s26-deal-march-2026,"patrick.farmer@futurenet.com (Patrick Farmer) , Patrick Farmer",2026-03-16T16:38:35Z,bulk carrier,"Mint Mobile finally got the Galaxy S26 series in stock, and its deal on the phones is truly remarkable.",Android Central,Unknown,News,2026-03-22T06:55:39.341639Z
3dfcc48b6871c2e9b97911022ca885fc,Update 012 - JMIC Advisory Note 12_ ...,http://www.st.ryukoku.ac.jp/~kjm/security/memo/2026/03.html#20260317__iran,,2026-03-16T15:00:00Z,bulk carrier,"<ul> <li> Update 012 - JMIC Advisory Note 12_MAR_2026_FINAL (JMIC, 3/12) 
 <ul> <li>ZEFYROS / Tanker / Laden - Struck by unknown
projectiles during STS
transfer. Crew abandoned. <li>SAFESEA VISHNU
/ Tanker / Laden - Struck by unknown
projectiles during STS
t…",Ryukoku.ac.jp,Unknown,News,2026-03-22T06:55:39.341682Z
