article_id,title,link,creator,pubdate,category,description,source,country,article_type,scrape_timestamp
a91a4aff57fe164a8df2356766a280cc,NAF helicopter used in Borno operations returns to service,https://punchng.com/naf-helicopter-used-in-borno-operations-returns-to-service/,Punch Newspapers,2026-02-04T16:07:29Z,maritime transport,"The Nigerian Air Force has reactivated its Super Puma helicopter, NAF 565, boosting its operational capability for national security missions.

Read More: https://punchng.com/naf-helicopter-used-in-borno-operations-returns-to-service/",The Punch,Unknown,News,2026-02-07T18:38:47.770971Z
ffb11f696129e7015c72dae43ec7787a,"Drone Payload Market to Reach US$ 39.7 Billion by 2033 as Defense, AI Integration, and Autonomous Systems Drive Adoption | Astute Analytica",https://www.globenewswire.com/news-release/2026/02/04/3232072/0/en/Drone-Payload-Market-to-Reach-US-39-7-Billion-by-2033-as-Defense-AI-Integration-and-Autonomous-Systems-Drive-Adoption-Astute-Analytica.html,AstuteAnalytica India Pvt. Ltd.,2026-02-04T13:45:00Z,maritime transport,"The global drone payload market is experiencing rapid, high-growth, driven by advanced, lightweight sensors, AI integration, and intense defense demand for surveillance and intelligence (ISR) capabilities. The market is shifting toward smarter, autonomous, an…",GlobeNewswire,Global,Market Report,2026-02-07T18:38:47.771018Z
e0f6cdd84978612f45c16b7a897e36b6,DYNAMARINe – Maran Shuttle Tankers Collaboration,https://www.naftemporiki.gr/english/2068217/dynamarine-maran-shuttle-tankers-collaboration/,Γιάννα Βαρδαλαχάκη,2026-02-04T11:54:21Z,maritime transport,"DYNAMARINe announced the integration of the Maran Shuttle Tankers fleet, owned by the Angelicoussis Group, interests of Maria Angelicoussis, into the DYNAMARINe STS Service platform, further strengthening risk management in…
DYNAMARINe – Maran Shuttle Tankers…",Naftemporiki.gr,Unknown,News,2026-02-07T18:38:47.771067Z
8241abdfa1bc19604f3fdfd25e57113e,40 Little-Known Moments In History You Won’t Find In Textbooks,https://www.demilked.com/interesting-old-historical-pics/,Saumya Ratan,2026-02-04T11:17:03Z,maritime transport,"There is something magnetic about vintage photos. They freeze real moments in time, capturing everyday life, major events, and tiny details that history books often miss. For anyone obsessed with the past, these images feel like little windows into another...…",Demilked.com,Unknown,News,2026-02-07T18:38:47.771129Z
184f4454dd2243075e5db55bb0dd5706,"Public Safety LTE & 5G Market Report 2025-2030: $6.3 Bn Opportunities by 2028 - Standards, Spectrum, Regulation, Use Cases, and Ecosystem Strategies Shape the Roadmap",https://www.globenewswire.com/news-release/2026/02/04/3231808/28124/en/Public-Safety-LTE-5G-Market-Report-2025-2030-6-3-Bn-Opportunities-by-2028-Standards-Spectrum-Regulation-Use-Cases-and-Ecosystem-Strategies-Shape-the-Roadmap.html,Research and Markets,2026-02-04T09:05:00Z,maritime transport,"The public safety LTE and 5G sector is expanding rapidly, driven by global moves to replace legacy systems with mission-critical networks. Opportunities lie in infrastructure rollouts, deploying private 5G networks for specialized needs, integrating AI and vi…",GlobeNewswire,Global,Market Report,2026-02-07T18:38:47.771177Z
23325f6c73701ad85f0bfebd854337f3,Airbus inaugurates Centre of Excellence to drive sustainable aerospace research at Gati Shakti Vishwavidyalaya,https://economictimes.indiatimes.com/industry/transportation/airlines-/-aviation/airbus-inaugurates-centre-of-excellence-to-drive-sustainable-aerospace-research-at-gati-shakti-vishwavidyalaya/articleshow/127905060.cms,ANI,2026-02-04T09:01:28Z,maritime transport,Airbus has opened a new Centre of Excellence at Gati Shakti Vishwavidyalaya in Vadodara. This center will boost aerospace research and innovation in India. A key focus is developing Sustainable Aviation Fuel from waste. The collaboration aims to train skilled…,The Times of India,India,Market Report,2026-02-07T18:38:47.771205Z
84efbfb3c527d2d8f85bcdccb861549f,"Tawau MMEA foils bid to smuggle petrol, gas cylinders worth RM46,000",https://www.thestar.com.my/news/nation/2026/02/04/tawau-mmea-foils-bid-to-smuggle-petrol-gas-cylinders-worth-rm46000,STEPHANIE LEE,2026-02-04T05:05:00Z,maritime transport,"KOTA KINABALU: A licensed and registered boat operated by a local man and carrying only small amounts of ""cargo"" failed to disguise a smuggling operation in waters off Tawau. Read full story",The Star Online,Unknown,News,2026-02-07T18:38:47.771244Z
d54032b8609a0da80db13e1cda1d457a,Trump says India will stop buying Russian oil. Shadow fleet vessels are still unloading sanctioned crude at its ports,https://www.cnbc.com/2026/02/03/russian-oil-sanctions-trump-us-india-trade-deal.html,Lori Ann LaRocco,2026-02-03T16:19:51Z,maritime transport,"President Trump says India will stop buying sanctioned Russian oil as part of trade deal, but data shows shadow fleet vessels unloading the crude at its ports.",CNBC,India,News,2026-02-07T18:38:47.771263Z
53af97492931d51cad9df18055b32ffd,U.S. tanker reportedly approached by Iranian gunboats in Strait of Hormuz,https://www.cbsnews.com/news/us-tanker-stena-imperative-approached-iran-gunboats-strait-of-hormuz/,,2026-02-03T16:00:40Z,maritime transport,"A U.S.-flagged tanker heading for Bahrain was approached and threatened by Iranian gunboats in the Strait of Hormuz, a British maritime security firm says.",CBS News,UK,Market Report,2026-02-07T18:38:47.771294Z
42db482140993f8794d2c58ce59041dd,"Panama Construction Industry Report 2025: Output to Grow at an AAGR of 5.2% Between 2026-2029, Driven by Investments in Energy, Residential and Transport Infrastructure Projects",https://www.globenewswire.com/news-release/2026/02/03/3231316/28124/en/Panama-Construction-Industry-Report-2025-Output-to-Grow-at-an-AAGR-of-5-2-Between-2026-2029-Driven-by-Investments-in-Energy-Residential-and-Transport-Infrastructure-Projects.html,Research and Markets,2026-02-03T15:34:00Z,maritime transport,"Panama's construction industry growth is driven by investments in energy, transport infrastructure, and renewable projects. Key opportunities lie in the Panama Canal's expansion, the Port of Corozal, and energy corridors, amid governmental aims to boost renew…",GlobeNewswire,Panama,Market Report,2026-02-07T18:38:47.771338Z
d1c4eb3070a3cd65a5419956d6a717ff,"Norwich City Guide: What to See and Do in Norwich, England – Your Complete Guide to England’s Most Complete Medieval City",https://anglotopia.net/british-travel/british-city-guides/norwich-city-guide-what-to-see-and-do-in-norwich-england-your-complete-guide-to-englands-most-complete-medieval-city/,Jonathan,2026-02-03T15:00:00Z,maritime transport,"Norwich stands as England’s most complete medieval city, where cobbled streets wind between magnificent churches, half-timbered merchants’ houses, and the soaring spire of its Norman cathedral. Known as the “City of Stories” for its rich literary heritage and…",Anglotopia.net,Unknown,News,2026-02-07T18:38:47.771391Z
087f5bb816701962fc73a62034657bbe,A NEW “Time-Traveling” Theme Park EXPANSION Is Coming in Summer 2026,https://allears.net/2026/02/03/a-new-time-traveling-theme-park-expansion-is-coming-in-summer-2026/,Lauren Writtenberry,2026-02-03T14:00:34Z,maritime transport,There's a new theme park being built in the United Kingdom that will take you back in time.,allears.net,UK,News,2026-02-07T18:38:47.771423Z
78219906fc0650b660f05b7d6007cb2f,The U.S. Is Ceding Its Africa Trade Advantage,http://foreignpolicy.com/2026/02/03/united-states-africa-trade-african-growth-opportunity-act-agoa/,Landry Signé,2026-02-03T11:00:57Z,maritime transport,Renewing the African Growth and Opportunity Act would protect U.S. jobs and economic power.,Foreign Policy,Unknown,News,2026-02-07T18:38:47.771451Z
a98194607541e8e3a7404e5f742bf429,Construction to begin on missing link of Dublin Port cycle route,https://www.irishtimes.com/ireland/dublin/2026/02/03/construction-to-begin-on-missing-link-of-dublin-port-cycle-route/,Olivia Kelly,2026-02-03T06:00:00Z,maritime transport,"Designed to open access to city ferries, the route’s two phases should be complete by 2027 and 2030",The Irish Times,Unknown,News,2026-02-07T18:38:47.771483Z
ec1d63f4ebf94784d77ff4ef3bb765c4,Sydney's maritime history faces uncertain future amid rezoning plan,https://www.abc.net.au/news/2026-02-03/working-port-bays-west-rezoning-sydney-harbour/106294212,Declan Bowring,2026-02-03T00:00:04Z,maritime transport,The Sydney Heritage Fleet says it will have nowhere to work on Sydney's century-old ships if it is evicted from Rozelle Bay due to a rezoning plan.,ABC News (AU),Unknown,News,2026-02-07T18:38:47.771514Z
ca269c8630d49ebecb8d00e68ab3393a,How underwater 3D printing could soon transform maritime construction,https://newatlas.com/3d-printing/underwater-3d-printing-maritime-construction-darpa-cornell/,Abhimanyu Ghoshal,2026-02-02T10:28:45Z,maritime transport,"There are all kinds of critical infrastructure lying beneath the surface of our oceans – road and rail tunnels connecting land masses, pipelines for oil and gas, power cables connecting islands and countries, underwater research stations, and submerged dams a…",New Atlas,Unknown,News,2026-02-07T18:38:47.771637Z
e97e4afb64585f18dc00d0540ae4774c,Xenokostas: Shipyards are the cornerstone of energy independence,https://www.naftemporiki.gr/english/2066902/xenokostas-shipyards-are-the-cornerstone-of-energy-independence/,Αλεξία Σωτηρίου,2026-02-02T06:32:27Z,maritime transport,"Shipyards are a key link in global energy chains, as they are the place where the ships for the transport of energy and other critical goods are built, repaired and…
Xenokostas: Shipyards are the cornerstone of energy independence - Η ΝΑΥΤΕΜΠΟΡΙΚΗ",Naftemporiki.gr,Global,News,2026-02-07T18:38:47.771683Z
ee67ca6deb952ac19f8e13396dab071d,Aktsiaselts Infortar own share acquisition transactions,https://www.globenewswire.com/news-release/2026/02/02/3229948/0/en/Aktsiaselts-Infortar-own-share-acquisition-transactions.html,AS Infortar,2026-02-02T06:00:00Z,maritime transport,Aktsiaselts Infortar acquired its own shares on the Nasdaq Tallinn Stock Exchange during the period of 26 – 30 January 2026 as follows: DateAggregated...,GlobeNewswire,Unknown,News,2026-02-07T18:38:47.771721Z
a02ed784b012fdd422aa641766029e41,"Beyond roads and rails: How Rs 12,000-crore National Waterway-5 could turn Odisha into India’s maritime powerhouse",https://indianexpress.com/article/india/beyond-roads-and-rails-how-rs-12000-crore-national-waterway-5-could-turn-odisha-into-indias-maritime-powerhouse-10508183/,Sujit Bisoyi,2026-02-02T02:08:05Z,maritime transport,"Union Finance Minister Nirmala Sitharaman, while presenting the Budget, announced the operationalisation of 20 new National Waterways over the next five years, starting with Rs 12,204-crore NW-5 in Odisha.",The Indian Express,India,News,2026-02-07T18:38:47.771747Z
29b95cca77e85fb99855f87e1ffa2dc4,Union Budget instrumental in sailing Bharat towards becoming a top global maritime superpower: Union minister Sarbananda Sonowal,https://economictimes.indiatimes.com/industry/transportation/shipping-/-transport/union-budget-instrumental-in-sailing-bharat-towards-becoming-a-top-global-maritime-superpower-union-minister-sarbananda-sonowal/articleshow/127843718.cms,Bikash Singh,2026-02-01T15:01:56Z,maritime transport,"The Union Budget is set to boost India's maritime sector and inland waterways. A new Container Manufacturing Assistance Scheme will create jobs and reduce import dependence. Twenty new National Waterways will become operational, promoting greener cargo moveme…",The Times of India,India,News,2026-02-07T18:38:47.771777Z
9d7b1dab3c053036bf8754ab55940392,Spanish Hornets Intercept Russian Navy Su-30SM With a Rare Weapon Loadout Over the Baltic,https://theaviationist.com/2026/02/01/russian-navy-su-30sm-weapon-loadout-over-the-baltic/,David Cenciotti,2026-02-01T14:14:39Z,maritime transport,"During a recent mission, Spanish Air Force F-18M Hornets intercepted a Russian Naval Aviation Su-30SM2 carrying an unusual loadout for operations over the Baltic region. On Jan. 28, 2026, the Spanish Ministry of Defense released details about an interesting m…",Theaviationist.com,Russia,News,2026-02-07T18:38:47.771807Z
db586085a8f5bce4d0f68ef5113f87b5,"Centre bets on inland waterways, coastal shipping to drive logistics efficiency",https://www.thehindubusinessline.com/economy/logistics/centre-bets-on-inland-waterways-coastal-shipping-to-drive-logistics-efficiency/article70578674.ece,T E Raja Simhan,2026-02-01T13:26:41Z,maritime transport,"The Union Budget aims to enhance logistics efficiency by boosting inland waterways and coastal shipping, targeting a significant modal shift.",BusinessLine,Unknown,News,2026-02-07T18:38:47.771841Z
f8d492cf377d69cc4db83ce01e143594,Sea route carried 56 pct of exports in 2025,https://www.hurriyetdailynews.com/sea-route-carried-56-pct-of-exports-in-2025-218465,hurriyetdailynews.com,2026-02-01T09:16:42Z,maritime transport,"More than half of Türkiye’s record exports in 2025 were shipped by sea, according to data compiled from the Turkish Statistical Institute (TÜİK).",Hurriyet Daily News,Turkey,News,2026-02-07T18:38:47.771869Z
2377c7a3612219ceaef83ae6bf1d32b7,"Crew abandonment a scourge: Record in 2025 with 6,223 sailors and the “shadow fleet” in focus",https://en.protothema.gr/2026/02/01/crew-abandonment-a-scourge-record-in-2025-with-6223-sailors-and-the-shadow-fleet-in-focus/,Newsroom,2026-02-01T07:19:25Z,maritime transport,"Ships with opaque ownership structures, inadequate insurance, and flags of convenience are increasingly involved in cases of crew abandonment, leaving seafarers unpaid and stranded for months
The post Crew abandonment a scourge: Record in 2025 with 6,223 sail…",Protothema.gr,Unknown,News,2026-02-07T18:38:47.771921Z
ea7f215de790795617b3ed21a71ae213,"UPSC Weekly Current Affairs Quiz | January 25 to January 31, 2026",https://indianexpress.com/article/upsc-current-affairs/upsc-essentials/upsc-weekly-current-affairs-quiz-january-25-to-january-31-2026-10505804/,"Manas Srivastava, Nitendra Pal Singh",2026-01-31T14:39:16Z,maritime transport,UPSC Prelims Weekly Current Affairs MCQs: Why these questions for Prelims 2026? Kickstart your UPSC Prelims preparation early. Brush up on your current affairs knowledge with this week’s top questions and consolidate your UPSC CSE preparation. Find answers al…,The Indian Express,Unknown,Market Report,2026-02-07T18:38:47.771962Z
9c5659bfab2670c4000caacffe1a44fa,"Amid Specter Of Possible US Strikes, Iran's Neighbors Brace For Blowback",https://www.globalsecurity.org/wmd/library/news/iran/2026/01/iran-260130-rferl02.htm,John Pike,2026-01-31T05:43:51Z,maritime transport,"As the United States expands its military presence in the Middle East amid growing expectations of a strike against Iran, countries around the Middle East are bracing for another conflict in the region.",Globalsecurity.org,USA,News,2026-02-07T18:38:47.771983Z
fe19daa8b5a2278ebc9ae85a228809ce,‘Focus on Credibility’: DEA Secretary Anuradha Thakur Outlines 370+ Reforms at businessline Budget Forum,https://www.thehindubusinessline.com/economy/focus-on-credibility-dea-secretary-anuradha-thakur-outlines-370-reforms-at-businessline-budget-forum/article70601146.ece,Poornima Joshi 10387,2026-02-06T15:39:37Z,cargo shipping,DEA Secretary Anuradha Thakur highlights over 370 reforms to enhance credibility and ease of doing business at the Budget Forum.,BusinessLine,Unknown,News,2026-02-07T18:38:48.388656Z
3520f4fda5f3cf5934779656cebbaa7c,New technologies are stepping up the global fight against wildlife trafficking,https://theconversation.com/new-technologies-are-stepping-up-the-global-fight-against-wildlife-trafficking-272137,"Eve Bohnett, Assistant Research Scholar, Center for Landscape Conservation Planning, University of Florida",2026-02-06T13:41:06Z,cargo shipping,"Emerging digital tools can help authorities prioritize inspections and rapidly identify illicit goods by linking online monitoring, legal references and on-the-ground investigations.",The Conversation Africa,Global,News,2026-02-07T18:38:48.388762Z
759a14f36dd59bbaf8a1f286ad70f43a,Mexico Weighs Cuba Oil Exports as U.S. Pressure Mounts,https://oilprice.com/Latest-Energy-News/World-News/Mexico-Weighs-Cuba-Oil-Exports-as-US-Pressure-Mounts.html,Charles Kennedy,2026-02-06T10:30:00Z,cargo shipping,"Mexico is looking for ways to keep supplying oil to Cuba amid a U.S. squeeze on energy supplies to the island nation without triggering a response from Washington, Reuters has reported, citing unnamed sources. “There are talks happening almost every other day…",OilPrice.com,Unknown,Market Report,2026-02-07T18:38:48.388906Z
d49a52afe2436cb12dedc1a15cb242dd,Tankers Speed Through Hormuz Chokepoint on US-Iran Tensions,https://www.insurancejournal.com/news/international/2026/02/06/857168.htm,Admin,2026-02-06T09:43:23Z,cargo shipping,"Some supertanker operators, nervous about rising US-Iran tensions and potential risks to shipping in the Strait of Hormuz, are speeding their vessels through the chokepoint. Very Large Crude Carriers are traveling around the narrow, congested waterway — throu…",Insurance Journal,Unknown,News,2026-02-07T18:38:48.388956Z
ab3f8c33fd9c8bf679d67e20488e8505,Tankers Speed Through Hormuz Chokepoint,https://www.rigzone.com/news/wire/tankers_speed_through_hormuz_chokepoint-06-feb-2026-182934-article/,Weilun Soon,2026-02-06T09:43:07Z,cargo shipping,"Very Large Crude Carriers are traveling around the narrow, congested waterway - through which about a quarter of the world's seaborne oil trade travels - at as much as 17 knots, ship-tracking data show.",Rigzone,Unknown,News,2026-02-07T18:38:48.388990Z
0baee84e4249c4020dceb3e2115c996f,Tankers speed through Hormuz chokepoint on rising Iran tensions,https://economictimes.indiatimes.com/industry/energy/oil-gas/oil-prices-tankers-speed-through-hormuz-chokepoint-on-rising-iran-tensions/articleshow/127975315.cms,Bloomberg,2026-02-06T07:04:31Z,cargo shipping,Some supertanker operators are speeding up their vessels while passing through the Strait of Hormuz due to rising US-Iran tensions and concerns over safety in the key oil shipping route. Ship-tracking data show some large crude carriers moving at up to 17 kno…,The Times of India,Unknown,News,2026-02-07T18:38:48.389038Z
9e4dc21fe5bf82297d404ce07a08e45b,I reversed Tower of Fantasy's anti-cheat driver: a BYOVD toolkit never loaded,https://vespalec.com,samuel,2026-02-06T03:22:29Z,cargo shipping,How four layers of authentication in a production anti-cheat driver still hand you a complete BYOVD toolkit,Vespalec.com,Unknown,News,2026-02-07T18:38:48.389069Z
740ab1cd5bb4c8e6225adb3ac855e5ac,U.S.-China power struggle thrusts Panama Canal back into the spotlight,https://www.cnbc.com/2026/02/06/panama-canal-us-trump-china-xi-ck-hutchison-ports.html,"Sam Meredith, Anniek Bao",2026-02-06T02:24:21Z,cargo shipping,It follows a contentious decision from Panama's top court to rule against a Hong Kong-backed firm’s right to operate two key terminals on the waterway.,CNBC,China,News,2026-02-07T18:38:48.389100Z
1732a41acec1ef2983d5a25c512460fb,"Panama going into the penalty box; Cuban Foreign Minister in Beijing; Ma Xingrui, TCM 5-year plan; ""Smartphones on wheels""",https://sinocism.com/p/panama-going-into-the-penalty-box,Bill Bishop,2026-02-05T23:21:09Z,cargo shipping,"The PRC is opening its economic coercion toolbox to punish Panama for the court decision to expropriate the two CK Hutchison port facilities. Bloomberg broke the story:



China is asking state firms to halt talks over new projects in Panama..Beijing has also…",Sinocism.com,China,News,2026-02-07T18:38:48.389151Z
3d3ce704d3876d07aabc3d790b9cabd4,"Up to 50% off + Extra 10% in Cart, 3301 Jeans from $100, mens t-shirts from $35, Free Shipping over $75 @ G-STAR",https://www.ozbargain.com.au/node/947078,sticky8anana,2026-02-05T22:43:53Z,cargo shipping,"My 50th post, please be gentle. Free shipping over $75, items shipped from the Netherlands. Pretty decent sale from a quality brand. I remember they were very popular here around 20 years …",Ozbargain.com.au,Unknown,News,2026-02-07T18:38:48.389194Z
72e9380fb0b2d58a808b6bb13b924873,"Majority Of Americans Say Trump’s Tariffs Hurt Economy, Poll Shows",https://dailycaller.com/2026/02/05/majority-trump-tariffs-hurt-economy/,Ireland Owens,2026-02-05T17:06:45Z,cargo shipping,"Most Americans think tariffs harm the nation's economy, according to a new survey out Thursday.",The Daily Caller,USA,News,2026-02-07T18:38:48.389251Z
f27cb5b365aba1d747bc1ffb2bc8b0a4,Russia says huge meteorite chunk discovered before being smuggled to U.K.,https://www.cbsnews.com/news/russia-aletai-meteorite-smuggling-uk-disguised-garden-ornament-shipping-container/,,2026-02-05T15:54:40Z,cargo shipping,"Russia's customs service says a 2.8-ton chunk of the Aletai meteorite was found in a shipping container, labeled as a garden ornament.",CBS News,Russia,News,2026-02-07T18:38:48.389271Z
a69443e894998fb0d6c9adc929c5da15,Study maps thousands of non native plants that could colonize Arctic,https://www.spacedaily.com/reports/Study_maps_thousands_of_non_native_plants_that_could_colonize_Arctic_999.html,,2026-02-05T12:52:01Z,cargo shipping,"Berlin, Germany (SPX) Feb 04, 2026


Species that are not native to an area can displace the species that already live there, and the Intergovernmental Panel on Nature has identified invasive alien organisms as one of the greatest threats to global biodiversi…",Space Daily,Germany,News,2026-02-07T18:38:48.389369Z
7abafdda6439cc212a2e6742020c7075,$14.52* | Lee Men's Extreme Motion Carolina Cargo Short (Various Colors) at Amazon,https://slickdeals.net/f/19177231-14-52-lee-men-s-extreme-motion-carolina-cargo-short-various-colors-at-amazon,phoinix,2026-02-05T11:25:46Z,cargo shipping,"Amazon [amazon.com] has Lee Men's Extreme Motion Carolina Cargo Short (Various Colors) for $14.52.
Shipping is free with Prime or on $35+ orders.Black Ripstop29 [amazon.com]
30 [amazon.com]
33 [a",Slickdeals.net,Unknown,News,2026-02-07T18:38:48.389405Z
4321419e80af3b2d1b014646b082788e,India exports first fuel to Europe since ban on Russian crude-derived products,https://www.thehindubusinessline.com/markets/commodities/india-exports-first-fuel-to-europe-since-ban-on-russian-crude-derived-products/article70595421.ece,Reuters,2026-02-05T11:01:36Z,cargo shipping,"Reliance told that it has been giving written
declarations to ⁠European buyers and traders that Russian crude
has not been used to produce fuels exported to Europe.",BusinessLine,India,News,2026-02-07T18:38:48.389428Z
bfdb566664826d084cb62d5db598da96,India exports first fuel to Europe since ban on Russian crude-derived products,https://economictimes.indiatimes.com/news/economy/foreign-trade/india-exports-first-fuel-to-europe-since-ban-on-russian-crude-derived-products/articleshow/127931968.cms,Reuters,2026-02-05T10:52:17Z,cargo shipping,India has begun exporting jet fuel to Europe again. Reliance Industries sent a cargo to Italy after a European Union ban on Russian oil products. This move follows India's increased purchases of discounted Russian crude. Reliance assures European buyers that …,The Times of India,India,News,2026-02-07T18:38:48.389454Z
a457a1f60910d8ddf16afa5c80435d23,Russia Signals It Will Keep Sending Oil to Cuba Despite U.S. Pressure,https://oilprice.com/Latest-Energy-News/World-News/Russia-Signals-It-Will-Keep-Sending-Oil-to-Cuba-Despite-US-Pressure.html,Irina Slav,2026-02-05T10:30:00Z,cargo shipping,"Russia has been supplying crude oil to Cuba repeatedly over the past few years and supplies will continue, the Russian ambassador to Havana, Viktor Koronelli, told state news agency RIA today. The statement comes following the latest U.S. squeeze on Cuba, wit…",OilPrice.com,Russia,News,2026-02-07T18:38:48.389485Z
2577a189bc18a7935588a0bb73b5513d,Chittagong Port operations shut as workers protest foreign lease deal,https://newsnextbd.com/chittagong-port-operations-shut-as-workers-protest-foreign-lease-deal/,Newsnext,2026-02-05T08:04:30Z,cargo shipping,"Dhaka – Operations at the Chittagong Port, main maritime gateway for Bangladesh’s trade, are practically shut down due to an indefinite work stoppage. Port workers are protesting the government’s decision to lease the facility to a foreign company. The protes…",Newsnextbd.com,Unknown,News,2026-02-07T18:38:48.389533Z
fec5d9fbf3de504160e9abfe212d89f9,Mombasa port cargo outperforms forecasts amid lingering congestion,https://www.standardmedia.co.ke/business/shipping-logistics/article/2001540079/mombasa-port-cargo-outperforms-forecasts-amid-lingering-congestion,Benard Sanga And Patrick Beja,2026-02-05T07:15:36Z,cargo shipping,"Kenya Ports Authority says cargo volumes through the Mombasa port hit a high record 45.45 million metric tonnes in 2025, up from 40.99 million tonnes processed at the facility in 2024.",Standard Digital,Unknown,Analysis/Opinion,2026-02-07T18:38:48.389582Z
fdf9dde5ccad688f44fb628408320da2,Orders for ships with alternative fuels decline,https://www.naftemporiki.gr/english/2068599/orders-for-ships-with-alternative-fuels-decline/,Γιάννα Βαρδαλαχάκη,2026-02-05T06:13:42Z,cargo shipping,"Orders for ships with alternative fuels showed a decline, according to the latest available data from DNV’s Alternative Fuels Insight (AFI) platform, with the momentum of the green orderbook showing…
Orders for ships with alternative fuels decline - Η ΝΑΥΤΕΜΠ…",Naftemporiki.gr,Unknown,Analysis/Opinion,2026-02-07T18:38:48.389620Z
