article_id,title,link,creator,pubdate,category,description,source,country,article_type,scrape_timestamp
89b563a072a37000ef5d267d8ecd1991,Environmental Crisis: It’s All About the Money,https://www.counterpunch.org/2025/12/02/environmental-crisis-its-all-about-the-money/,David Rosen,2025-12-02T06:52:05Z,coal demand,"For regular viewers of Amy Goodman’s Democracy Now! Program, she and her team recently reported from the COP30 conference in Belém, Brazil.  This COPS spotlighted Indigenous people, and the program had numerous interviews with not only representatives of diff…",CounterPunch,Brazil,Analysis/Opinion,2025-12-05T18:30:31.262560Z
2fcf9d50f62b04d64c35e00416c88440,Have we Reached Peak Fossil Fuels? Wind & Solar met all New Energy Demand in Q1-Q3 ’25,https://www.juancole.com/2025/12/reached-fossil-energy.html,Juan Cole,2025-12-02T05:15:32Z,coal demand,"Ann Arbor (Informed Comment) - Richard Black and other analysts at the Ember energy consultancy find that all new electricity demand in the first three quarters of 2025 was met by solar and wind, mainly solar. That statistic requires us to conclude that there…",Juancole.com,Unknown,Analysis/Opinion,2025-12-05T18:30:31.262601Z
3c16e4cedee92200f22ccf25be283eb9,Pimco Closed-End Funds Declare Monthly Common Share Distributions,https://www.globenewswire.com/news-release/2025/12/01/3197518/220/en/Pimco-Closed-End-Funds-Declare-Monthly-Common-Share-Distributions.html,PIMCO Account Management,2025-12-01T22:33:00Z,coal demand,"NEW YORK, Dec. 01, 2025 (GLOBE NEWSWIRE) -- The Boards of Trustees/Directors of the PIMCO closed-end funds below (each, a “Fund” and, collectively, the “Funds”) have declared a monthly distribution for each Fund’s common shares as summarized below.",GlobeNewswire,Unknown,Market Report,2025-12-05T18:30:31.262700Z
4b5a626049694685a6be2e7019175335,Aussie AEMO Pushes the Grid Stability Panic Button,https://wattsupwiththat.com/2025/12/01/aussie-aemo-pushes-the-grid-stability-panic-button/,Eric Worrall,2025-12-01T22:00:00Z,coal demand,"""... Major uncertainties include ... exit or connection of large loads, dependability of new technologies ... regular or seasonal decommitment of coal units ... changes to exit timing or unexpected plant failure. ...""",Wattsupwiththat.com,Unknown,News,2025-12-05T18:30:31.262737Z
92badec199b3203931d60c92e9c9f966,China's great green leap forward,https://mondediplo.com/2025/12/10china,Arnaud Bertrand,2025-12-01T21:41:24Z,coal demand,"Both superpowers put sovereignty ahead of emissions cuts. While the US is still backing fossil fuels, China is pushing ahead with renewables – and building a vast export engine in the process.

-
2025/12

/ 
article",Mondediplo.com,China,News,2025-12-05T18:30:31.262756Z
515b8935a3aa7c895de3b3b20ae169bf,Buying these 3 ASX shares could change your life,https://www.fool.com.au/2025/12/02/buying-these-3-asx-shares-could-change-your-life-2/,Tristan Harrison,2025-12-01T18:30:00Z,coal demand,"These 3 stocks could make a big difference to someone’s long-term wealth.
The post Buying these 3 ASX shares could change your life appeared first on The Motley Fool Australia.",Motley Fool Australia,Australia,News,2025-12-05T18:30:31.262822Z
24b35cc027cac3473e6e9eaa1f4a4e28,Steel panel meets companies on import substitution of high-value products,https://economictimes.indiatimes.com/news/economy/foreign-trade/steel-panel-meets-companies-on-import-substitution-of-high-value-products/articleshow/125700860.cms,Nikita Periwal,2025-12-01T18:08:57Z,coal demand,"In a bid to bolster local industry, a parliamentary committee is advocating for the domestic production of essential steel components. Leading manufacturers gathered to strategize on replacing imports of premium materials essential for transformers and automo…",The Times of India,Unknown,News,2025-12-05T18:30:31.262871Z
d2b3da414ce146cd8948347e8df20f9c,Barchart- Commodity Roundup- November’s Top Performers and Underperformers,https://www.barchart.com/story/news/36389855/barchart-commodity-roundup-novembers-top-performers-and-underperformers,Andrew Hecht,2025-12-01T16:42:02Z,coal demand,"Silver reached a new record high on the final day of November. Silver, gold, platinum, palladium, and copper were higher. At the same time, animal protein...",Barchart.com,Unknown,News,2025-12-05T18:30:31.262911Z
a8bebdd7ca4054f84c77bb7ed70c9e7a,CARE Ratings reaffirms Tata Chemicals amid market challenges,https://www.livemint.com/companies/news/care-ratings-reaffirms-tata-chemicals-amid-market-challenges-11764604087926.html,Livemint Automation,2025-12-01T16:01:20Z,coal demand,"These ratings underscore Tata Chemicals' strong financial flexibility and refinancing capabilities, supported by Tata Sons, which holds a substantial stake in the company.",Livemint,Unknown,Market Report,2025-12-05T18:30:31.262942Z
c85209fbfdb5b9c849a211c5938b6d78,GST Rationalisation: ₹260/tonne average reduction in price of coal supplied to power sector,https://www.thehindubusinessline.com/economy/gst-rationalisation-260tonne-average-reduction-in-price-of-coal-supplied-to-power-sector/article70345622.ece,Rishi Ranjan Kala,2025-12-01T13:36:11Z,coal demand,"The revision in GST has rationalized the tax burden across various coal grades, as the previous GST regime led to higher effective tax incidence on low grade coal and low priced coal",BusinessLine,Unknown,News,2025-12-05T18:30:31.263011Z
7a4a423e43321662bcd5e3ceafa20eec,GST Rationalisation: ₹260/Tonne average reduction in price of coal supplied to Power sector,https://www.thehindubusinessline.com/news/gst-rationalisation-260tonne-average-reduction-in-price-of-coal-supplied-to-power-sector/article70345622.ece,Rishi Ranjan Kala,2025-12-01T13:36:11Z,coal demand,"The revision in GST has rationalized the tax burden across various coal grades, as the previous GST regime led to higher effective tax incidence on low grade coal and low priced coal.",BusinessLine,Unknown,News,2025-12-05T18:30:31.263042Z
26504596c1606e7c45979840978500be,Weekly Climate and Energy News Roundup #668,https://wattsupwiththat.com/2025/12/01/weekly-climate-and-energy-news-roundup-668/,Guest Blogger,2025-12-01T10:00:00Z,coal demand,"“Anybody who has been seriously engaged in scientific work of any kind realizes that over the entrance to the gates of the temple of science are written the words: 'Ye must have faith.’"" — Max Planck",Wattsupwiththat.com,Unknown,Market Report,2025-12-05T18:30:31.263080Z
1f1b1ae754f7248cb947b84a20f1c39e,"Govt simplifies approval process for exploration of coal, lignite",https://www.thehindubusinessline.com/markets/commodities/govt-simplifies-approval-process-for-exploration-of-coal-lignite/article70344704.ece,PTI,2025-12-01T09:06:10Z,coal demand,"Govt simplifies coal and lignite exploration approvals, boosting efficiency and private sector participation in sustainable resource development.",BusinessLine,Unknown,News,2025-12-05T18:30:31.263113Z
3031e58b34438c85f84fe6ff745745e2,"Govt simplifies approval process for exploration of coal, lignite",https://economictimes.indiatimes.com/industry/indl-goods/svs/metals-mining/govt-simplifies-approval-process-for-exploration-of-coal-lignite/articleshow/125689892.cms,PTI,2025-12-01T08:46:28Z,coal demand,"The Coal Ministry has streamlined the approval process for coal and lignite exploration. This reform aims to improve business ease and promote efficient, sustainable resource exploration. The new system bypasses the need for government panel approval.",The Times of India,Unknown,News,2025-12-05T18:30:31.263153Z
692acc70ccfc031cbadfe73d3904b5fd,Is CSX Corporation Stock Underperforming the S&P 500?,https://www.barchart.com/story/news/36379970/is-csx-corporation-stock-underperforming-the-s-p-500,Kritika Sarmah,2025-12-01T07:15:36Z,coal demand,"Despite lagging the S&P 500 in the past year, CSX receives a cautiously positive outlook from Wall Street analysts regarding its long-term potential.",Barchart.com,Unknown,Analysis/Opinion,2025-12-05T18:30:31.263180Z
0937d61826d08376b5e6bbb4a5ae5476,"India weighs Mongolian coking coal imports despite transport hurdles, source says",https://economictimes.indiatimes.com/news/economy/foreign-trade/india-weighs-mongolian-coking-coal-imports-despite-transport-hurdles-source-says/articleshow/125686928.cms,Reuters,2025-12-01T06:10:40Z,coal demand,"India is exploring importing coking coal from Mongolia to diversify supplies, despite transport and geopolitical challenges. Currently reliant on Australia for over half its coal, India faces rising demand and is evaluating Mongolia’s high-grade, lower-cost c…",The Times of India,Australia,News,2025-12-05T18:30:31.263201Z
aab239219989d65f07afc5d4167b2b51,Australia’s green energy shift triggers blackout warnings as coal plant closures outpace grid stability,https://www.naturalnews.com/2025-12-01-australia-green-energy-blackout-warnings.html,Cassie B.,2025-12-01T06:00:00Z,coal demand,"Australia’s rapid shift from coal to renewables risks nationwide blackouts. A government report warns the grid will lack critical stability after a major coal plant closes. Essential stabilizing equipment may not be ready in time, leaving a dangerous gap. Pol…",Naturalnews.com,Australia,Market Report,2025-12-05T18:30:31.263224Z
9c5ce40491cbbdadb050ca43ff008e60,APA and CS Energy Advance 400MW Brigalow Gas Peaker in Queensland,https://finance.yahoo.com/news/apa-cs-energy-advance-400mw-045155308.html,Charles Kennedy,2025-12-01T04:51:55Z,coal demand,APA and CS Energy sign a joint development pact for a new 400MW gas-fired peaking plant.,Yahoo Entertainment,Unknown,News,2025-12-05T18:30:31.263253Z
d0c366c1a251a5576144dc8d30330d36,"Facing U.S. Electricity Shortfall, Crisis Years Unfolding",https://www.forbes.com/sites/llewellynking/2025/11/30/facing-us-electricity-shortfall-crisis-years-unfolding/,"Llewellyn King, Contributor, 
 Llewellyn King, Contributor
 https://www.forbes.com/sites/llewellynking/",2025-12-01T04:43:22Z,coal demand,"""Energy is everything"" is a quote as compelling today as ever. As the nation moves into the age of electrification, it could be modified to “electricity is everything.”",Forbes,Unknown,News,2025-12-05T18:30:31.263292Z
489e073e3482454e81179208010abc07,Ozone pollution monitoring using a full-time hyperspectral tomography system for multiple air pollutants,https://www.nature.com/articles/s41467-025-66944-w,"Wanchao Ma, Chengzhi Xing, Weiheng Wang, Qijin Zhang, Zaiwei Wang, Yue Yang, Cheng Liu",2025-12-01T00:00:00Z,coal demand,"The study demonstrates a cost-effective hyperspectral tomography system for continuous monitoring of ozone and its precursors, using drones and light-emitting diodes. It provides high-resolution, all-day data, aiding in understanding pollution dynamics and id…",Nature.com,Unknown,Market Report,2025-12-05T18:30:31.263336Z
972799595581b2a17a8f1b5357242713,How to Cut the Electricity Price in Australia,https://wattsupwiththat.com/2025/11/30/how-to-cut-the-electricity-price-in-australia/,Guest Blogger,2025-11-30T22:00:00Z,coal demand,"With the greater understanding that should come from using a day-ahead system, it should be possible to improve the long-term planning (""Capacity Market""). In future, will a nuclear plant be cheaper in total than more renewables, for example? Certainly, Austr…",Wattsupwiththat.com,Australia,Market Report,2025-12-05T18:30:31.263353Z
a922f6d824bf6d7e23cc51f2ca4f3bcd,"Eon CEO Urges Germany to Slow Wind, Solar Push Amid Grid Strain",https://financialpost.com/pmn/business-pmn/eon-ceo-urges-germany-to-slow-wind-solar-push-amid-grid-strain,Bloomberg News,2025-11-30T18:49:20Z,coal demand,"The head of German utility EON SE said Europe’s largest economy should slow the pace of wind and solar expansion, saying the country’s power grids are struggling to cope with the surge in new renewable projects.",Financial Post,Germany,News,2025-12-05T18:30:31.263393Z
a4695b78ee7bbac8f1002df1777a9256,Electricity Bills to Skyrocket This Holiday Season: Here's Why,https://www.westernjournal.com/electricity-bills-skyrocket-holiday-season/,The Daily Caller News Foundation,2025-11-30T18:12:35Z,coal demand,"Though Trump has worked to unlock resources, several stressors on the power grid mean ratepayers will continue to see electricity costs rise.",Westernjournal.com,Unknown,News,2025-12-05T18:30:31.263424Z
01e109a26e6450047d965e7821fe4c53,Geothermal Breakthrough in South Texas Signals New Era for Ercot,http://www.powermag.com/geothermal-breakthrough-in-south-texas-signals-new-era-for-ercot/,Sonal Patel,2025-11-30T14:29:26Z,coal demand,"In just 12 months, Sage Geosystems and San Miguel Electric Cooperative built the world’s first pressure geothermal system. It is now poised to deliver long-duration, dispatchable storage for the Electric Reliability Council of Texas (ERCOT) as variable genera…",POWER magazine,Unknown,News,2025-12-05T18:30:31.263472Z
cf092d98dd5721b2de916fcb045da992,The role of apparel in climate action: How the fast fashion industry could become a catalyst for green hydrogen,https://www.livemint.com/opinion/online-views/climate-action-fast-fashion-industry-green-hydrogen-clean-energy-shein-temu-carbon-emissions-11764219264395.html,mint,2025-11-30T10:12:14Z,coal demand,"China is racing ahead not just on clean green hydrogen, but also fast fashion with mega-successes like Shein. Should demand for petrochem synthetics that go into shoes and clothes be met by using green rather than dirty hydrogen, it would cut carbon emissions.",Livemint,China,News,2025-12-05T18:30:31.263489Z
562109d4076c94c0b18bd22bcd63bf33,AI Is Keeping Coal on Life Support,https://gizmodo.com/ai-is-keeping-coal-on-life-support-2000693460,Mike Pearl,2025-11-30T10:00:25Z,coal demand,"The technology of the future that no one seems to want, brought to you by the energy of the past.",Gizmodo.com,Unknown,News,2025-12-05T18:30:31.263515Z
e95fd1d7ef87e294736b9dfa0e59b134,"Cement makers expect second half of FY26 to be better, upbeat on Q2 sales growth",https://www.thehindubusinessline.com/companies/cement-makers-expect-second-half-of-fy26-to-be-better-upbeat-on-q2-sales-growth/article70341435.ece,PTI,2025-11-30T09:13:27Z,coal demand,"Top five cement makers such as UltraTech, Ambuja Cement, Shree Cement, Dalmia Bharat and Nuvoco Vistas Q2 revenue grew backed by healthy sales realisations, benign costs and premiumisation.",BusinessLine,Unknown,News,2025-12-05T18:30:31.263551Z
f3b28d01e48d4b1fa980a4733f06d3b8,"Cement makers upbeat on Q2 sales growth, expect second half of FY26 to be better",https://economictimes.indiatimes.com/industry/indl-goods/svs/cement/cement-makers-upbeat-on-q2-sales-growth-expect-second-half-of-fy26-to-be-better/articleshow/125670601.cms,PTI,2025-11-30T08:41:48Z,coal demand,"Top five cement makers such as UltraTech, Ambuja Cement, Shree Cement, Dalmia Bharat and Nuvoco Vistas have reported up to 18 per cent growth in their revenue from operations in the second quarter ended September, backed by healthy sales realisations, benign …",The Times of India,Unknown,Market Report,2025-12-05T18:30:31.263596Z
9474b61ab05da9104fd8be51523395bb,Inside the power-hungry data centres taking over Britain,https://www.thetimes.com/business/technology/article/inside-britains-ai-data-centre-boom-can-the-grid-keep-up-jllzb3b0p,Jim Armitage,2025-11-30T07:01:46Z,coal demand,Our thirst for AI is fuelling a new construction wave: of giant data centres. But can our electricity and water systems cope — and what will the neighbours say?,Thetimes.com,UK,News,2025-12-05T18:30:31.263634Z
7b1e24b24b1f022415594974090827bf,Economic Digest: Nepal’s Business News in a Snap,https://english.khabarhub.com/2025/30/508498/,Khabarhub,2025-11-30T02:15:45Z,coal demand,"KATHMANDU: Economic Digest offers a concise yet comprehensive overview of significant business happenings in Nepal, presented in easily digestible summaries. Nepal’s economy is exhibiting a mix of short-term optimism and deep structural strain: the equity mar…",Khabarhub.com,Unknown,Analysis/Opinion,2025-12-05T18:30:31.263684Z
fa23b7a34b9ca70f7209abf07a67da88,Energy independence? It would reduce the impact of global energy shocks,https://www.abc.net.au/news/2025-11-30/energy-independence-reduce-the-impact-of-global-energy-shocks/106081924,Gareth Hutchens,2025-11-30T00:59:13Z,coal demand,"If Australia produced 100 per cent of its energy from renewable sources, it would reduce the impact of global energy shocks on Australia's economy.",ABC News (AU),Australia,News,2025-12-05T18:30:31.263700Z
623f32ff359255433c1ef8c0cec57ebc,‘UNCONSCIONABLE’: Christian Leader Condemns the ‘Climate Colonialism’ That Would Doom the Global South to Grinding Poverty,https://www.dailysignal.com/2025/11/29/unconscionable-christian-leader-condemns-climate-colonialism-would-doom-global-south-grinding-poverty/,Tyler O'Neil,2025-11-29T17:00:00Z,coal demand,"Climate alarmists don’t just get the science wrong but also demonize the engine of wealth that has brought billions out of grinding poverty; and this... Read More
The post ‘UNCONSCIONABLE’: Christian Leader Condemns the ‘Climate Colonialism’ That Would Doom t…",Daily Signal,Global,News,2025-12-05T18:30:31.263752Z
fca65cad5bf4a96074cac5f51c874adf,'Untold story' of Charlie Munger's last years,https://www.cnbc.com/2025/11/29/untold-story-of-charlie-mungers-last-years.html,,2025-11-29T11:56:04Z,coal demand,"The Wall Street Journal reports Berkshire's late vice chair was ""making gutsy investments, forging unlikely friendships and facing new challenges to the end.""",CNBC,Unknown,Market Report,2025-12-05T18:30:31.263787Z
4fbfeb92481bac5b26194571a882b5cc,The UK Is Cursed: How Finance Destroyed Our Economy,https://www.nakedcapitalism.com/2025/11/the-uk-is-cursed-how-finance-destroyed-our-economy.html,Yves Smith,2025-11-29T11:54:50Z,coal demand,"More discussion of how the UK's post World War II decline was a choice, due in large measure to the embrace of finance and neoliberalism.",Nakedcapitalism.com,Unknown,News,2025-12-05T18:30:31.263817Z
b3a36aefb35109888a1eed4e13999c6f,Why China’s Bitcoin mining activity is surging again after a 4-year crackdown,https://cointelegraph.com/explained/why-china-s-bitcoin-mining-activity-is-surging-again-after-a-4-year-crackdown,Cointelegraph by Dilip Kumar Patairya,2025-11-29T07:30:00Z,coal demand,"Discover why China’s Bitcoin mining is quietly rebounding, driven by cheap energy, data center oversupply and shifting digital asset signals.",Cointelegraph,China,News,2025-12-05T18:30:31.263836Z
2e8baa1e4a637f98c8cb9ab266896ca9,Startup makes major breakthrough in pursuit of limitless energy source: 'Has been demonstrated',https://www.yahoo.com/news/articles/startup-makes-major-breakthrough-pursuit-051500576.html,Leslie Sattler,2025-11-29T05:15:00Z,coal demand,No commercial-scale proof exists yet.,Yahoo Entertainment,Unknown,News,2025-12-05T18:30:31.263864Z
ff3c02412ae52dd58c7246fc6afb8247,Manitoba signs onto Ontario-led proposal to create national energy grid,https://www.cbc.ca/news/canada/manitoba/manitoba-signs-onto-ontario-led-proposal-to-create-national-energy-grid-9.6996380,,2025-11-28T20:21:51Z,coal demand,"Manitoba has signed onto an Ontario-led proposal to expand and modernize interprovincial transmission lines and establish a nationwide energy grid to ""Trump-proof"" the country's energy security.",CBC News,Unknown,News,2025-12-05T18:30:31.263904Z
233aff01f0493b218ed54ac0cb810564,Green power to play key role in India's energy mix by 2047: Secretary,https://economictimes.indiatimes.com/industry/energy/power/green-power-to-play-key-role-in-indias-energy-mix-by-2047-secretary/articleshow/125645884.cms,ET Bureau,2025-11-28T19:22:56Z,coal demand,"As India's energy appetite continues to escalate, it opens an exciting landscape for growth across nuclear, renewable, and thermal energy sectors. By the milestone year of 2047, green energy is expected to be at the forefront, showcasing pioneering initiative…",The Times of India,India,News,2025-12-05T18:30:31.263932Z
33b69891cd2c2c194f95287ae52a0223,Green transition targets are not realistic – how to decarbonise at the right pace,https://theconversation.com/green-transition-targets-are-not-realistic-how-to-decarbonise-at-the-right-pace-270720,"Siavash Alimadadi, Research Associate at the Centre for Sustainable Business, King's College London, Jonatan Pinkse, Professor of Sustainable Business, Centre for Sustainable Business, King's College London",2025-11-28T18:37:03Z,coal demand,Decarbonisation is not just about changing fuels. It involves a change in our pace of living and adjusting expectations.,The Conversation Africa,Unknown,News,2025-12-05T18:30:31.263971Z
45f889d582d1727aa426650d7a66ee03,Trump’s Second Term Dispels Any Notion of CEOs Saving Us From Climate Crisis,https://truthout.org/articles/trumps-second-term-dispels-any-notion-of-ceos-saving-us-from-climate-crisis/,Derek Seidman,2025-11-28T16:23:31Z,coal demand,Corporate actors have shed any pretense of climate action and now openly back Trump’s doubling down on fossil fuels.,Truthout,Unknown,News,2025-12-05T18:30:31.264008Z
9290a10e9e8f8ad2b720cf14f50a7d42,"Bitcoin is redrawing where cities and data centers rise as it competes for wasted energy, not cheap labor",https://cryptoslate.com/bitcoin-wasted-energy-not-cheap-labor-cities-data-centers/,Gino Matos,2025-11-28T11:45:04Z,coal demand,"For two centuries, factories chased cheap hands and dense ports. Today, miners roll into windy plateaus and hydro spillways, asking a simpler question: where are the cheapest wasted watts? When computing can move to energy rather than energy to people, the ma…",CryptoSlate,Unknown,News,2025-12-05T18:30:31.264059Z
55c019f5a24b373f74cbd1c94e972a18,"Canada Cement Industry Report 2025: Portland, Blended, Specialty, and Green Cement Size & Forecast by Value and Volume Across 80+ Market Segments 2020-2029",https://www.globenewswire.com/news-release/2025/11/28/3196166/28124/en/Canada-Cement-Industry-Report-2025-Portland-Blended-Specialty-and-Green-Cement-Size-Forecast-by-Value-and-Volume-Across-80-Market-Segments-2020-2029.html,Research and Markets,2025-11-28T11:31:00Z,coal demand,"Canada's cement market thrives amid decarbonization, infrastructure focus, and digitalization, with growth in public projects and sustainable builds. Opportunities lie in green technology adoption, supply chain resilience, and policy-aligned, low-carbon solut…",GlobeNewswire,Unknown,Analysis/Opinion,2025-12-05T18:30:31.264106Z
7623fdf7dce780f359d781b3efd7f1db,The Quick and Shameful Death of Biden’s Biggest Policy,https://newrepublic.com/article/202755/inflation-reduction-act-biden-biggest-policy-death,Kate Aronoff,2025-11-28T11:00:00Z,coal demand,"In late 2024, an operative for the right-wing gotcha group Project Veritas clandestinely filmed his Tinder date with a 29-year-old EPA employee. The employee, who talked freely about his work distributing grant funds allocated by the Inflation Reduction Act, …",The New Republic,Unknown,News,2025-12-05T18:30:31.264152Z
dcaef5956be32bf292a435d0aefb106b,Nanocatalysts Market Size to Worth USD 7.30 Billion by 2035,https://www.globenewswire.com/news-release/2025/11/28/3196114/0/en/Nanocatalysts-Market-Size-to-Worth-USD-7-30-Billion-by-2035.html,Precedence Research,2025-11-28T10:24:00Z,coal demand,"According to Towards Chemical and Materials Consulting, the global nanocatalysts market size valued at USD 3.16 billion in 2025 and is expected to be worth around USD 7.30 billion by 2035, exhibiting at a compound annual growth rate (CAGR) of 9.75% over the f…",GlobeNewswire,Global,Market Report,2025-12-05T18:30:31.264192Z
fdfe38dc4ce2b7d0fe29db62f961ee15,I went to COP30—and saw how the rest of the world is pushing climate action even as the U.S. steps back,https://fortune.com/2025/11/28/cop30-brazil-asia-climate-change-global-south/,Natalie Sum Yue Chung,2025-11-28T10:00:00Z,coal demand,"Amid the diplomatic gridlock, perhaps the real story of COP30 was happening outside the negotiation halls.",Fortune,Unknown,News,2025-12-05T18:30:31.264228Z
83b7a2442592c35e71e8f7a06c36c1c0,U.S. LNG Exports Set to Surge 40% as Europe Buys Record Volumes,https://oilprice.com/Latest-Energy-News/World-News/US-LNG-Exports-Set-to-Surge-40-as-Europe-Buys-Record-Volumes.html,Irina Slav,2025-11-28T09:15:00Z,coal demand,"Exports of liquefied natural gas from the United States are on track to book a 40% annual increase this month, hitting 10.7 million tons, projections from Kpler have shown, as cited by Bloomberg. An ample supply of liquefied gas has already pushed natural gas…",OilPrice.com,USA,News,2025-12-05T18:30:31.264254Z
afa724dd795bfc054dd865c1eb3ab77b,Grey Hydrogen Market Size to Surpass USD 661.22 Billion by 2033; Rising Demand from Petroleum Refineries Augment Market Growth | SNS Insider,https://www.globenewswire.com/news-release/2025/11/28/3195992/0/en/Grey-Hydrogen-Market-Size-to-Surpass-USD-661-22-Billion-by-2033-Rising-Demand-from-Petroleum-Refineries-Augment-Market-Growth-SNS-Insider.html,SNS Insider pvt ltd,2025-11-28T05:20:00Z,coal demand,"The U.S. Grey Hydrogen Market Size was estimated to be worth USD 72.59 billion in 2025E and is projected to increase at a compound annual growth rate (CAGR) of 8.99% from 2026 to 2033, reaching USD 144.49 billion. The U.S. Grey Hydrogen Market Size was estima…",GlobeNewswire,Unknown,Market Report,2025-12-05T18:30:31.264302Z
