article_id,title,link,creator,pubdate,category,description,source,country,article_type,scrape_timestamp
694c6654e9c5c9c992a5a70bea370682,India Road Freight Transport Market Report 2026-2031 - E-commerce Rise in Tier-3 and Tier-4 Cities Expands India's Road Freight Opportunities,https://www.globenewswire.com/news-release/2026/01/23/3224494/28124/en/India-Road-Freight-Transport-Market-Report-2026-2031-E-commerce-Rise-in-Tier-3-and-Tier-4-Cities-Expands-India-s-Road-Freight-Opportunities.html,Research and Markets,2026-01-23T10:17:00Z,freight rates,"Dublin, Jan. 23, 2026 (GLOBE NEWSWIRE) -- The ""India Road Freight Transport - Market Share Analysis, Industry Trends & Statistics, Growth Forecasts (2026-2031)"" has been added to ResearchAndMarkets.com's offering.",GlobeNewswire,India,Analysis/Opinion,2026-01-26T18:39:44.806611Z
74999b0de00f01b1c97f10a3114745e1,Soy Protein Concentrate Market Size to Worth USD 7.13 Billion by 2035 | Towards FnB,https://www.globenewswire.com/news-release/2026/01/23/3224479/0/en/Soy-Protein-Concentrate-Market-Size-to-Worth-USD-7-13-Billion-by-2035-Towards-FnB.html,Precedence Research,2026-01-23T09:59:00Z,freight rates,"According to Towards FnB, the global soy protein concentrate market size is calculated at USD 4.64 billion in 2026 and expand to approximately USD 7.13 billion by 2035, advancing at CAGR of 4.9% from 2026 to 2035. This growth is driven by the increasing prefe…",GlobeNewswire,Global,Market Report,2026-01-26T18:39:44.806656Z
582dd9640d11d064c233c69fa5530d49,"Bon Appétit: Pattern, Preparing, Humorous, Food",https://www.smallbusinessbranding.com/112192/bon-appetit-pattern-preparing-humorous-food/,Sean M Kelly,2026-01-23T08:00:24Z,freight rates,Load chat rooms can deal with it giving actual-date tracking status to own best communication. For those who reach out to her or him and publication a lot,Smallbusinessbranding.com,Unknown,News,2026-01-26T18:39:44.806692Z
f4f5e89ae561d36a73367388e01e3240,"ITS Logistics Distribution and Fulfillment Q4 Index: Tariff-Driven Cost Pressure Reshapes Inventory Ownership, Tightening Truck Capacity",https://www.globenewswire.com/news-release/2026/01/22/3224181/0/en/ITS-Logistics-Distribution-and-Fulfillment-Q4-Index-Tariff-Driven-Cost-Pressure-Reshapes-Inventory-Ownership-Tightening-Truck-Capacity.html,ITS Logistics,2026-01-22T18:00:00Z,freight rates,"Lean inventory strategies accelerate freight flows as middle-mile networks expand without return to COVID-era extremes, and push distribution closer to end markets Lean inventory strategies accelerate freight flows as middle-mile networks expand without retur…",GlobeNewswire,Unknown,Market Report,2026-01-26T18:39:44.806824Z
5142a46953a3322897b0edee75649b5a,Knight-Swift eyeing margin improvement in 2026,https://finance.yahoo.com/news/knight-swift-eyeing-margin-improvement-134234291.html,Todd Maiden,2026-01-22T13:42:34Z,freight rates,Knight-Swift Transportation outlines a path to margin recovery in 2026 following a fourth quarter that was worse than expected. The post Knight-Swift eyeing ...,Yahoo Entertainment,Unknown,News,2026-01-26T18:39:44.806891Z
f649f6d6c55b13949593f1000525fce8,"Project Logistics Market Share Analysis, Industry Trends & Statistics, Growth Forecasts Worldwide (2026-2031)",https://www.globenewswire.com/news-release/2026/01/22/3223445/28124/en/Project-Logistics-Market-Share-Analysis-Industry-Trends-Statistics-Growth-Forecasts-Worldwide-2026-2031.html,Research and Markets,2026-01-22T09:10:00Z,freight rates,"Dublin, Jan. 22, 2026 (GLOBE NEWSWIRE) -- The ""Project Logistics - Market Share Analysis, Industry Trends & Statistics, Growth Forecasts (2026-2031)"" has been added to ResearchAndMarkets.com's offering.",GlobeNewswire,Global,Analysis/Opinion,2026-01-26T18:39:44.806991Z
118e2e556db68a5f51d47cd9532bb0ca,"ITS Logistics tried to 'offset' $85,000 payment to carrier before Echo Global acquisition",https://www.overdriveonline.com/business/article/15815218/its-logistics-tried-to-offset-85000-payment-to-carrier-before-echo-global-acquisition,Alex Lockie,2026-01-22T08:56:00Z,freight rates,A recent clash between the broker and a 350-truck carrier gets to the heart of a fiery debate about who takes the financial hit when brokers fall for a hacker impersonating a carrier.,Overdriveonline.com,Global,News,2026-01-26T18:39:44.807030Z
0b22f0c217949c3e44f0d2f77a0c41c9,Merits of user tax on infra services,https://www.thehindubusinessline.com/opinion/merits-of-user-tax-on-infra-services/article70534747.ece,Madan Sabnavis,2026-01-22T00:30:00Z,freight rates,"Private vehicle purchase, telecom services and rail/air travel can be taxed nominally. Consumers won’t feel the pinch",BusinessLine,Unknown,News,2026-01-26T18:39:44.807120Z
70e27b56026d21bac60453759a1e6b01,"China Accelerates Investment, Trade, and Influence in Central Asia",https://oilprice.com/Geopolitics/Asia/China-Accelerates-Investment-Trade-and-Influence-in-Central-Asia.html,OilPrice.com,2026-01-21T19:00:00Z,freight rates,"Chinese entities are making a push to expand joint ventures and corporate takeovers in Central Asia. In Kazakhstan, the mining sector appears to be a focus of Chinese attention. The Zhejiang Mining Heavy Industry Co., Ltd. signed a conditional deal to pay 29.…",OilPrice.com,China,Market Report,2026-01-26T18:39:44.807137Z
907690a602fcddcd64d9ec626e02770f,Indian Refiners Boost Middle East Supply To Offset Lost Russian Oil,https://oilprice.com/Latest-Energy-News/World-News/Indian-Refiners-Boost-Middle-East-Supply-To-Offset-Lost-Russian-Oil.html,Tsvetana Paraskova,2026-01-21T12:00:00Z,freight rates,"Indian state-run refiner Bharat Petroleum Corporation Limited (BPCL) has awarded tenders to buy Iraqi and Omani crude on the spot market, as India’s refiners are raising supply of crude from the Middle East to offset in part the volumes they lost from Russia …",OilPrice.com,India,Market Report,2026-01-26T18:39:44.807159Z
6e10615e4b362043efbeac0f859b7241,India’s largest company is caught in geopolitical tensions. But it faces the biggest challenge at home,https://www.cnbc.com/2026/01/21/india-reliance-oil-russia-trump-tariff-sanctions-retail-slowdown.html,,2026-01-21T03:56:04Z,freight rates,"The retail business is facing a slow down in sales, which has pushed brokerages to cut down on target price.",CNBC,India,News,2026-01-26T18:39:44.807260Z
7a7257d74860672843277d4bb0832523,"North Island weather warnings: Heavy rain and gales hit Bay of Plenty, Rotorua",https://www.nzherald.co.nz/bay-of-plenty-times/news/north-island-weather-warnings-heavy-rain-and-gales-hit-bay-of-plenty-rotorua/S5Z6BB3L3VHIZLZZBTNGHECU2I/,Bay of Plenty Times,2026-01-20T19:33:53Z,freight rates,MetService warns heavy rain could reach red-alert levels in some regions.,New Zealand Herald,Unknown,News,2026-01-26T18:39:44.807373Z
3bb227a5efbf23e1ba1e7c68535feb67,From housing affordability to green buildings: what real estate expects from Budget 2026,https://economictimes.indiatimes.com/markets/digital-real-estate/realty-news/from-housing-affordability-to-green-buildings-what-real-estate-expects-from-budget-2026/articleshow/126757176.cms,Kshitij Anand,2026-01-20T04:58:00Z,freight rates,"As Budget 2026 nears, India's real estate sector seeks policy continuity, fiscal support, and structural reforms to sustain growth. Industry leaders emphasize affordability, infrastructure, capital access, and regulatory efficiency to boost confidence across …",The Times of India,India,News,2026-01-26T18:39:44.807466Z
f8e2397ea1fc2aac5105547172742861,Does anyone own an induction range ?,https://freerepublic.com/focus/f-chat/4362973/posts,necessity,2026-01-19T20:03:53Z,freight rates,I'm forced to live in an all electric mobile home and electricity is through the roof.I'm looking for ideas (don't suggest gas . . .SHE'S afraid) and compare / contrasts,Freerepublic.com,Unknown,News,2026-01-26T18:39:44.807543Z
5905fc384d1cc788a79137282de63a3f,Reliance Posts Refining Gains despite Sourcing Challenges,https://www.rigzone.com/news/reliance_posts_refining_gains_despite_sourcing_challenges-19-jan-2026-182797-article/,Jov Onsat,2026-01-19T15:17:38Z,freight rates,'Agile crude sourcing helped sustain throughput despite procurement challenges'.,Rigzone,Unknown,News,2026-01-26T18:39:44.807617Z
6d5b13d30f6f9d6626729e3b76bf9e10,"‘MRPL considering Venezuelan crude, decision depends on commercial terms’",https://www.thehindubusinessline.com/companies/mrpl-considering-venezuelan-crude-decision-depends-on-commercial-terms/article70525891.ece,AJ Vinayak,2026-01-19T14:04:51Z,freight rates,"MRPL is exploring Venezuelan crude purchases, contingent on favorable commercial terms and compliance with international sanctions.",BusinessLine,Global,News,2026-01-26T18:39:44.807678Z
f5699062bb3e9fd18d36ddef8e48fd66,Exhaust Aftertreatment System Market worth $40.93 billion by 2032 | MarketsandMarkets™,https://www.globenewswire.com/news-release/2026/01/19/3221011/0/en/Exhaust-Aftertreatment-System-Market-worth-40-93-billion-by-2032-MarketsandMarkets.html,MarketsandMarkets Research Pvt. Ltd.,2026-01-19T14:00:00Z,freight rates,"Delray Beach, FL, Jan. 19, 2026 (GLOBE NEWSWIRE) -- According to MarketsandMarkets™, the ""Exhaust Aftertreatment System Market is projected to grow from USD 32.77 billion in 2025 and to reach USD 40.93 billion by 2032, at a Compound Annual Growth Rate (CAGR) …",GlobeNewswire,Unknown,Market Report,2026-01-26T18:39:44.807722Z
16d576b86bfd7f732fcaa76e3cd95f02,Indian Refiner MRPL Shifts from Russian to Venezuelan Oil Supply,https://oilprice.com/Latest-Energy-News/World-News/Indian-Refiner-MRPL-Shifts-from-Russian-to-Venezuelan-Oil-Supply.html,Tsvetana Paraskova,2026-01-19T13:30:00Z,freight rates,"Indian state-run Mangalore Refinery and Petrochemicals Limited (MRPL) is exploring potential purchases of crude from Venezuela after stopping imports of Russian oil, a top official at the refiner said on Monday.  “We are in strict compliance with all sanction…",OilPrice.com,India,News,2026-01-26T18:39:44.807748Z
4a3de43be7e19432d9b97410aa20f2a2,"Bathroom Vanities Market Projected to Reach US$ 85.62 Billion by 2035, Supported by Renovation Activity and Replacement Demand Says Astute Analytica",https://www.globenewswire.com/news-release/2026/01/19/3220957/0/en/Bathroom-Vanities-Market-Projected-to-Reach-US-85-62-Billion-by-2035-Supported-by-Renovation-Activity-and-Replacement-Demand-Says-Astute-Analytica.html,AstuteAnalytica India Pvt. Ltd.,2026-01-19T12:30:00Z,freight rates,"The market currently witnesses a technical evolution where structural engineering meets aesthetic furniture design. Manufacturers prioritize moisture-resistant hardwoods and standard dimensions to satisfy contractor installation requirements, while homeowners…",GlobeNewswire,Unknown,Market Report,2026-01-26T18:39:44.807797Z
c2af84e14c0e874926a358ad555daa04,"Commercial Rice Cooker Market Projected to Reach US$ 5.05 Billion by 2035, Supported by Foodservice Chain Expansion and Capital Investment Says Astute Analytica",https://www.globenewswire.com/news-release/2026/01/19/3220828/0/en/Commercial-Rice-Cooker-Market-Projected-to-Reach-US-5-05-Billion-by-2035-Supported-by-Foodservice-Chain-Expansion-and-Capital-Investment-Says-Astute-Analytica.html,AstuteAnalytica India Pvt. Ltd.,2026-01-19T10:30:00Z,freight rates,"Discover how automation and induction technologies are revolutionizing commercial kitchens. Astute Analytica’s analysis covers supply chain dynamics, regional growth hotspots, and competitive strategies driving the future of the global foodservice equipment i…",GlobeNewswire,Global,Analysis/Opinion,2026-01-26T18:39:44.807842Z
e142e72dc50498eff5c90305a47c1163,Old buildings give way to used-car showrooms,https://www.standardmedia.co.ke/business/business/article/2001538828/old-buildings-give-way-to-used-car-showrooms,Willis Oketch,2026-01-19T09:00:44Z,freight rates,The number of second-hand car showrooms in Mombasa has grown rapidly over the past year as dealers increasingly stock imported vehicles in the port city before distributing them to regional markets.,Standard Digital,Unknown,Market Report,2026-01-26T18:39:44.807873Z
9eff93c6f31fd59924c3f2b2b0531e9b,Mangalore Refinery & Petrochem scouts for Venezuelan oil as it halts Russian imports,https://economictimes.indiatimes.com/industry/energy/oil-gas/mangalore-refinery-petrochem-scouts-for-venezuelan-oil-as-it-halts-russian-imports/articleshow/126673132.cms,Reuters,2026-01-19T08:22:09Z,freight rates,"India's Mangalore Refinery and Petrochemicals Ltd (MRPL) is exploring Venezuelan oil purchases as it halts Russian crude imports to comply with Western sanctions. The state-run refiner is also focusing on direct retail sales to boost profits, planning to sign…",The Times of India,India,News,2026-01-26T18:39:44.807900Z
e21f2d2b4d78d6fdc436f2328cd709e0,"Fresh bagels in the polls, the rise of New Democracy, the finding about PASOK and President Maria, a napalm bomb in Lavrio (EAS), a Greek billionaire who is not a shipowner",https://en.protothema.gr/2026/01/19/fresh-bagels-in-the-polls-the-rise-of-new-democracy-the-finding-about-pasok-and-president-maria-a-napalm-bomb-in-lavrio-eas-a-greek-billionaire-who-is-not-a-shipowner/,Newsroom,2026-01-19T05:24:28Z,freight rates,"The smart game of Greek shipowners and how patience turns into gold
The post Fresh bagels in the polls, the rise of New Democracy, the finding about PASOK and President Maria, a napalm bomb in Lavrio (EAS), a Greek billionaire who is not a shipowner appeared …",Protothema.gr,Greece,News,2026-01-26T18:39:44.807953Z
439442f228aed13d95c4d9dd144fd1a4,Evercore ISI Raises Old Dominion (ODFL) Target but Warns Transport Optimism is Priced In,https://finance.yahoo.com/news/evercore-isi-raises-old-dominion-043536873.html,Vardah Gill,2026-01-19T04:35:36Z,freight rates,"Old Dominion Freight Line, Inc. (NASDAQ:ODFL) is included among the 15 Dividend Growth Stocks with the Highest Growth Rates. On January 13, Evercore ISI...",Yahoo Entertainment,Unknown,Market Report,2026-01-26T18:39:44.807999Z
8b8c66d673239343aedf9f79c9056cdd,As the 'rules-based world order' is threatened old economic ideas are revisited,https://www.abc.net.au/news/2026-01-26/trump-us-dollar-keynes-bretton-woods-economy/106260832,Alan Kohler,2026-01-25T18:00:00Z,charter rates,"In the wake of Trump, the world will now have to revisit the conference that set the ""rules-based world order"" up.",ABC News (AU),Unknown,News,2026-01-26T18:39:45.181819Z
9ec3b2c499e8c1b300862ff431e91bba,New explosive IPO surge proves smart money has abandoned high-risk tokens for this specific safe haven,https://cryptoslate.com/new-explosive-ipo-surge-proves-the-smart-money-has-officially-abandoned-high-risk-tokens-for-this-specific-safe-haven/,Gino Matos,2026-01-24T14:15:51Z,charter rates,"Crypto's IPO market is back, but the companies leading the charge aren't the ones most exposed to token volatility. BitGo priced its initial public offering on Jan. 21 at $18 per share, raising $212.8 million and valuing the custody platform at $2.08 billion.…",CryptoSlate,Unknown,Market Report,2026-01-26T18:39:45.181896Z
04015cdd8914a82f246603cd6a6aa486,How We Build a Better System: Celebrating Ranked-Choice Voting Day,https://msmagazine.com/2026/01/23/ranked-choice-voting-day-women/,Cynthia Richie Terrell,2026-01-23T20:46:12Z,charter rates,"Weekend Reading for Women’s Representation is a compilation of stories about women’s representation in politics, sports and entertainment, judicial offices and the private sector—with a little gardening mixed in!
This week:
—Friday marks is Ranked-Choice Voti…",Ms. Magazine,Unknown,News,2026-01-26T18:39:45.181949Z
5696b05ab32d4c99e4cc4fe741e101fd,Wyman & Williamson Study Reveals the Percentage of Criminal Charges in Calgary That End in Conviction,https://www.globenewswire.com/news-release/2026/01/23/3224945/0/en/Wyman-Williamson-Study-Reveals-the-Percentage-of-Criminal-Charges-in-Calgary-That-End-in-Conviction.html,Wyman & Williamson,2026-01-23T15:43:00Z,charter rates,"Calgary’s conviction rate is low, but the stakes are high. Know the real numbers, understand why most charges don’t result in guilt, and see how legal strategy—not statistics—determines outcomes Calgary’s conviction rate is low, but the stakes are high. Know …",GlobeNewswire,Unknown,News,2026-01-26T18:39:45.182000Z
fd9b32981bdfad75983962ef8c28b744,"Northrim BanCorp Earns $12.4 Million, or $0.55 Per Diluted Share, in Fourth Quarter 2025, and $64.6 Million, or $2.87 Per Diluted Share, for the Year Ended December 31, 2025",https://www.globenewswire.com/news-release/2026/01/23/3224807/8875/en/Northrim-BanCorp-Earns-12-4-Million-or-0-55-Per-Diluted-Share-in-Fourth-Quarter-2025-and-64-6-Million-or-2-87-Per-Diluted-Share-for-the-Year-Ended-December-31-2025.html,Northrim BanCorp Inc,2026-01-23T14:00:00Z,charter rates,"ANCHORAGE, Alaska, Jan. 23, 2026 (GLOBE NEWSWIRE) -- Northrim BanCorp, Inc. (NASDAQ:NRIM) (“Northrim” or the “Company”) today reported net income of $12.4 million, or $0.55 per diluted share, in the fourth quarter of 2025, compared to $27.1 million, or $1.20 …",GlobeNewswire,Unknown,Market Report,2026-01-26T18:39:45.182055Z
1b9dc1888400f4489c99bc2f84ed80a1,Houston school district trying to woo parents while losing students amid school choice competition,https://www.foxnews.com/media/houston-school-district-forced-woo-parents-losing-students-school-choice-competition,,2026-01-23T11:00:23Z,charter rates,"The Houston Independent School District lost 16,000 students over two years, reflecting nationwide enrollment drops in large urban districts as families seek education alternatives.",Fox News,Unknown,News,2026-01-26T18:39:45.182172Z
1e7a10c3dca6d5b732a9c52e95d82a68,"Recreational Boats Market Report 2026 - Global Industry Size, Share, Trends, Opportunity, and Forecast, 2021-2031",https://www.globenewswire.com/news-release/2026/01/23/3224515/28124/en/Recreational-Boats-Market-Report-2026-Global-Industry-Size-Share-Trends-Opportunity-and-Forecast-2021-2031.html,Research and Markets,2026-01-23T10:37:00Z,charter rates,"The Global Recreational Boats Market is poised for growth due to rising disposable incomes and marine tourism interest. Opportunities include expanding boat-sharing services, IoT integration, and sustainable propulsion systems. Challenges include economic vol…",GlobeNewswire,Global,Analysis/Opinion,2026-01-26T18:39:45.182219Z
401285363133eed64e45b0c8af947b9d,Foresight Reports 2025 Fourth Quarter and Full Year Results,https://www.globenewswire.com/news-release/2026/01/22/3224288/0/en/Foresight-Reports-2025-Fourth-Quarter-and-Full-Year-Results.html,"Foresight Financial Group, Inc.",2026-01-22T21:20:00Z,charter rates,Foresight Reports Fourth Quarter 2025 Results...,GlobeNewswire,Unknown,Market Report,2026-01-26T18:39:45.182284Z
73497f41e5fcc26b3686949c528f9ec6,Mission Produce Adopts Limited Duration Stockholder Rights Plan,https://www.globenewswire.com/news-release/2026/01/22/3223856/0/en/Mission-Produce-Adopts-Limited-Duration-Stockholder-Rights-Plan.html,"Mission Produce, Inc.",2026-01-22T14:05:00Z,charter rates,"OXNARD, Calif., Jan. 22, 2026 (GLOBE NEWSWIRE) -- Mission Produce, Inc. (Nasdaq: AVO) (“Mission Produce” or the “Company”), a world leader in sourcing, producing, and distributing fresh Hass avocados, with additional offerings in mangos and blueberries, today…",GlobeNewswire,Unknown,News,2026-01-26T18:39:45.182390Z
812f1c2f79919634e2c7e93469024c82,Major city school districts losing students as parents seek better options,https://www.foxnews.com/media/major-city-school-districts-losing-students-parents-seek-better-options,,2026-01-22T12:00:03Z,charter rates,Public schools lose students to homeschooling and charter schools as Colorado Education Commissioner Susana Córdova reports 5.5% increase in home-school enrollment statewide.,Fox News,Unknown,Market Report,2026-01-26T18:39:45.182429Z
23dd3b342e5766080b33c97d3fce2c5a,Morning Bid: Davos détente,https://finance.yahoo.com/news/morning-bid-davos-d-tente-113408841.html,By Mike Dolan,2026-01-22T11:39:11Z,charter rates,"By Mike Dolan Jan 22 -   What matters in U.S. and global markets today By Mike Dolan, Editor-At-Large, Finance and Markets World stocks bounced back after...",Yahoo Entertainment,Global,Market Report,2026-01-26T18:39:45.182460Z
e6859cbd8501c3fa29966eba756d72e4,Russia Escalates Ukraine War as Civilian Strikes and Casualties Mount: UK Statement to the OSCE,https://www.globalsecurity.org/wmd/library/news/ukraine/2026/01/ukraine-260121-ukfcdo01.htm,John Pike,2026-01-22T07:44:01Z,charter rates,"UK Chargé d'Affaires, Deputy Ambassador James Ford, rejects Russia's claim that the war is lawful and restrained, as strikes escalate on Ukraine's power and water systems, causing widespread civilian harm. As millions lose heat and electricity, Russian casual…",Globalsecurity.org,Russia,News,2026-01-26T18:39:45.182496Z
fdc9f3d39a7abee2af2208dd001e060a,Trump in Davos says won't use force to take Greenland,https://www.hurriyetdailynews.com/trump-in-davos-says-wont-use-force-to-take-greenland-218096,hurriyetdailynews.com,2026-01-21T15:36:00Z,charter rates,"President Donald Trump insisted he wants to “get Greenland, including right, title and ownership,” but he said he wouldn’t employ force to achieve that — using his speech on Jan. 21 at the World Economic Forum to repeatedly deride European allies and vow that…",Hurriyet Daily News,Unknown,News,2026-01-26T18:39:45.182629Z
11b249bbd5aef6c50e7106548ff92144,Southwest Sued For Not Paying Flight Attendants Overtime — Does A Union Contract Override State Wage Law?,https://viewfromthewing.com/southwest-sued-for-not-paying-flight-attendants-overtime-does-a-union-contract-override-state-wage-law/,Gary Leff,2026-01-21T15:04:21Z,charter rates,"Southwest is being sued by a former flight attendant who says the airline did not pay overtime required under Illinois law because its pay system focuses on flight time, not total duty time. Southwest argues the claim cannot proceed in court because flight at…",Viewfromthewing.com,Unknown,News,2026-01-26T18:39:45.182684Z
7d738f61148c95a2e4644785e922e6a2,Russia Escalates Ukraine War as Civilian Strikes and Casualties Mount: UK Statement to the OSCE,https://www.gov.uk/government/speeches/russia-escalates-ukraine-war-as-civilian-strikes-and-casualties-mount-uk-statement-to-the-osce,"Foreign, Commonwealth & Development Office",2026-01-21T14:26:26Z,charter rates,"UK Chargé d’Affaires, Deputy Ambassador James Ford, rejects Russia’s claim that the war is lawful and restrained, as strikes escalate on Ukraine’s power and water systems, causing widespread civilian harm. As millions lose heat and electricity, Russian casual…",Www.gov.uk,Russia,News,2026-01-26T18:39:45.182729Z
70c1cf0a8880d57cf312e85f97757cfb,Unequal Treaties Revisited: Coercive Trade Agreements in a Fragmented Global Economy,http://opiniojuris.org/2026/01/21/unequal-treaties-revisited-coercive-trade-agreements-in-a-fragmented-global-economy/,Beichen Ding,2026-01-21T13:00:07Z,charter rates,"[Beichen Ding is a PhD Candidate in Law at the World Trade Institute, University of Bern] This post was originally written as a reflection for the PhD Workshop “Current Dynamics and Challenges of Contemporary Trade Policy and Regulatory Frameworks” by World T…",Opiniojuris.org,Global,News,2026-01-26T18:39:45.182779Z
6e2b948159fce2ee7e82e40d2e49c596,Luxury Yachts Global Market Intelligence Report 2026-2031 | Emerging Markets See Surge in Ultra-High-Net-Worth Individuals Pushing Yacht Demand,https://www.globenewswire.com/news-release/2026/01/21/3222577/28124/en/Luxury-Yachts-Global-Market-Intelligence-Report-2026-2031-Emerging-Markets-See-Surge-in-Ultra-High-Net-Worth-Individuals-Pushing-Yacht-Demand.html,Research and Markets,2026-01-21T11:14:00Z,charter rates,"The market presents opportunities driven by rising UHNWIs, eco-friendly innovations, and yacht tourism growth. Hybrid/electric systems gain attention due to environmental policies, while Asia-Pacific shows robust expansion. The market presents opportunities d…",GlobeNewswire,Global,Market Report,2026-01-26T18:39:45.182872Z
fb88d945a7eb3695b6b120fc6370fb34,Interactive Brokers Group Q4 Earnings Call Highlights,https://www.marketbeat.com/instant-alerts/interactive-brokers-group-q4-earnings-call-highlights-2026-01-20/?utm_source=yahoofinance&amp;utm_medium=yahoofinance,MarketBeat,2026-01-20T23:12:46Z,charter rates,"Interactive Brokers Group (NASDAQ:IBKR) executives used the company’s fourth-quarter 2025 earnings call to highlight record annual results, continued account...",MarketBeat,Unknown,News,2026-01-26T18:39:45.182948Z
e08e1fb7c6a27819c5721acdc64a1e68,"Wealth Quote of the Day by Paul M. Romer, “Growth springs from better recipes, not just from more cooking” What Nobel Laureate Paul Romer got right about innovation and modern wealth creation",https://economictimes.indiatimes.com/news/international/us/wealth-quote-of-the-day-by-paul-m-romer-growth-springs-from-better-recipes-not-just-from-more-cooking-what-nobel-laureate-paul-romer-got-right-about-innovation-and-modern-wealth-creation/articleshow/126809102.cms,Piyush Shukla,2026-01-20T18:49:25Z,charter rates,"Wealth Quote of the Day by Paul M. Romer, “Growth springs from better recipes, not just from more cooking” Paul M. Romer’s famous wealth quote explains why innovation, not effort alone, drives lasting economic growth. The Nobel laureate shows how ideas fuel p…",The Times of India,Unknown,News,2026-01-26T18:39:45.183076Z
