article_id,title,link,creator,pubdate,category,description,source,country,article_type,scrape_timestamp
160da5ae977ac3340568029e1d056dc9,"Iran war: Strait of Hormuz traffic barely affected on first day of US blockade, data shows",https://economictimes.indiatimes.com/news/international/world-news/iran-war-strait-of-hormuz-traffic-barely-affected-on-first-day-of-us-blockade-data-shows/articleshow/130264333.cms,Reuters,2026-04-14T17:21:51Z,dry bulk shipping,"US-Iran war news: Traffic through the Strait of Hormuz remained limited on the first full day of a U.S. blockade of Iranian ports, despite some vessels transiting. Announced by Donald Trump, the move has heightened uncertainty for global shipping, oil flows a…",The Times of India,Global,News,2026-04-16T07:51:18.955084Z
e228255b0986f6dbde8afff8ec2c96ae,Fresh Bros Ranked #1 Best THCA Flower Brand Online in 2026 by Mydecine,https://www.globenewswire.com/news-release/2026/04/14/3273380/0/en/Fresh-Bros-Ranked-1-Best-THCA-Flower-Brand-Online-in-2026-by-Mydecine.html,Fresh Bros,2026-04-14T12:30:00Z,dry bulk shipping,"Independent review evaluated eight brands across cultivation, genetics, lab transparency, and value. Fresh Bros earned the top spot across all categories. Independent review evaluated eight brands across cultivation, genetics, lab transparency, and value. Fre…",GlobeNewswire,Unknown,Analysis/Opinion,2026-04-16T07:51:18.955141Z
3dd0daaf6fa8b566eb4432798272d347,NATO allies refuse to join Trump's Iranian port blockade,https://japantoday.com/category/world/nato-allies-refuse-to-join-trump%27s-iranian-port-blockade,,2026-04-13T21:40:41Z,dry bulk shipping,"NATO allies said on Monday they would not get involved in U.S. President Donald Trump's plan to blockade Iranian ports, proposing to intervene only once fighting ends, in a move likely ‌to anger Trump and increase strains in the alliance. Trump said the U.S. …",Japan Today,Unknown,News,2026-04-16T07:51:18.955194Z
8e81d4036d72e1094b8cab6647393a1f,Genco Shipping & Trading Issues Statement Regarding Diana Shipping’s Letter to Shareholders,https://www.globenewswire.com/news-release/2026/04/13/3272930/37397/en/Genco-Shipping-Trading-Issues-Statement-Regarding-Diana-Shipping-s-Letter-to-Shareholders.html,Genco Shipping & Trading Limited,2026-04-13T21:23:00Z,dry bulk shipping,"NEW YORK, April 13, 2026 (GLOBE NEWSWIRE) -- Genco Shipping & Trading Limited (NYSE:GNK) (“Genco” or the “Company”), the largest U.S.-headquartered drybulk shipowner focused on the global transportation of commodities, today issued the following statement reg…",GlobeNewswire,Global,Market Report,2026-04-16T07:51:18.955245Z
4569d1381c63edfa728554c9bb2e997a,Diana Shipping Inc. Sends Open Letter to Genco Shipping & Trading Shareholders,https://www.globenewswire.com/news-release/2026/04/13/3272667/10065/en/Diana-Shipping-Inc-Sends-Open-Letter-to-Genco-Shipping-Trading-Shareholders.html,Diana Shipping Inc. c/o Diana Shipping Services S.A.,2026-04-13T14:37:00Z,dry bulk shipping,"Calls Out Genco Board's Five-Month Refusal to Engage on Fully Financed, All-Cash Offer Delivering Certain, Premium Value at Cyclically High Asset Values ...",GlobeNewswire,Unknown,Market Report,2026-04-16T07:51:18.955280Z
5dc0ae93a96574563ac1a3aef8659192,Ruohang Feng: 504 Extensions: Expand the PostgreSQL Landscape,https://vonng.com/en/pg/extension-504/,Ruohang Feng,2026-04-13T00:00:00Z,dry bulk shipping,"One GitHub issue turned into an extension sprint. 32 new additions, 504 in total, say a lot about where PostgreSQL is headed.",Vonng.com,Unknown,News,2026-04-16T07:51:18.955318Z
7d720ec86edf35cafbe8f79d14ede76c,Strait of Hormuz Traffic Remains Near Standstill on April 11 Despite US-Iran Ceasefire as Iran Limits Access,https://www.ibtimes.com.au/strait-hormuz-traffic-remains-near-standstill-april-11-despite-us-iran-ceasefire-iran-limits-1866126,Anthony Will,2026-04-11T04:06:38Z,dry bulk shipping,"DUBAI, United Arab Emirates — Shipping through the Strait of Hormuz, the vital chokepoint for roughly one-fifth of the world's oil supply, remained severely restricted Saturday as Iran continued to control access and limit transits more than three days after …",Ibtimes.com.au,Unknown,Market Report,2026-04-16T07:51:18.955367Z
32c23280395ffbcd125530593c9e5f8d,Ceasefire sends dollar toward weekly drop with US-Iran talks in focus,https://economictimes.indiatimes.com/markets/forex/forex-news/ceasefire-sends-dollar-toward-weekly-drop-with-us-iran-talks-in-focus/articleshow/130173818.cms,Reuters,2026-04-10T15:23:38Z,dry bulk shipping,"Investors are shifting their focus as the dollar declines, buoyed by the resumption of oil shipping after a ceasefire in the Gulf alleviates war anxieties with Iran. This shift has sparked a sell-off in safe-haven assets, with the euro and sterling enjoying g…",The Times of India,Unknown,Market Report,2026-04-16T07:51:18.955420Z
d2404f875cb68b5b64f88ee2f71c4b09,Hormuz choke point persists as Iran halts oil traffic despite Trump ceasefire,https://www.foxnews.com/politics/hormuz-choke-point-persists-iran-halts-oil-traffic-despite-trump-ceasefire,,2026-04-10T09:00:03Z,dry bulk shipping,"The Strait of Hormuz remains effectively closed despite a ceasefire deal, with 800 tankers among 3,200 vessels backed up and mariners stranded.",Fox News,Unknown,News,2026-04-16T07:51:18.955457Z
5f0c3db5bbd750638ed8e073e13d9e50,Strait of Hormuz Traffic Near Standstill Despite US-Iran Ceasefire: Only 9 Ships Transit on April 10,https://www.ibtimes.com.au/strait-hormuz-traffic-near-standstill-despite-us-iran-ceasefire-only-9-ships-transit-april-10-1866033,Anthony Will,2026-04-10T08:52:45Z,dry bulk shipping,"DUBAI, United Arab Emirates — Ship traffic through the Strait of Hormuz remained at a virtual standstill Friday, with just nine vessels transiting the critical waterway in the past 24 hours despite a fragile U.S.-Iran ceasefire agreement, as Iran maintained t…",Ibtimes.com.au,Unknown,Market Report,2026-04-16T07:51:18.955504Z
65bf730696edef6cba313066e4af8339,AS Tallinna Sadam operational volumes for 2026 Q1,https://www.globenewswire.com/news-release/2026/04/10/3271511/0/en/AS-Tallinna-Sadam-operational-volumes-for-2026-Q1.html,AS Tallinna Sadam,2026-04-10T05:00:00Z,dry bulk shipping,"In 2026 Q1, 3.1 million tons of cargo and 1.4 million passengers passed through the harbours of Tallinna Sadam. Compared to the same period previous year, the cargo volume decreased by –8% i.e 265 thousand tonnes. Liquid bulk decreased the most, influenced by…",GlobeNewswire,Unknown,News,2026-04-16T07:51:18.955552Z
170665cdbfca84d052473d71af49754a,Dollar set for weekly drop ahead of US-Iran peace talks,https://economictimes.indiatimes.com/markets/forex/dollar-set-for-weekly-drop-ahead-of-us-iran-peace-talks/articleshow/130156949.cms,Reuters,2026-04-10T01:55:43Z,dry bulk shipping,The US dollar is experiencing its biggest weekly fall since January. Other currencies are strengthening as a Gulf ceasefire appears to be holding. Oil shipping is expected to resume. Markets are watching US-Iran talks in Islamabad for direction. The dollar ha…,The Times of India,Unknown,Market Report,2026-04-16T07:51:18.955594Z
1840c870d5d173c917061b0c9e09f315,Hormuz at near standstill despite ceasefire,https://www.rte.ie/news/business/2026/0409/1567444-hormuz-standstill/,RTÉ News,2026-04-09T15:21:48Z,dry bulk shipping,Ship traffic through the Strait of Hormuz stood at well below 10% of normal volumes on Thursday despite a US-Iran ceasefire as Tehran asserted its control by warning ships to keep to its territorial waters while doing so.,RTE,Unknown,News,2026-04-16T07:51:18.955631Z
e9459430d83c39cded586567e5a303eb,Hormuz at near standstill as Iran warns ships to keep to its waters,https://economictimes.indiatimes.com/news/defence/hormuz-at-near-standstill-as-iran-warns-ships-to-keep-to-its-waters/articleshow/130145125.cms,Reuters,2026-04-09T14:02:02Z,dry bulk shipping,Iran's Revolutionary Guard Corps is directing ships to a new route near Larak Island.  This change has caused confusion for shipping firms.  Traffic in the Strait of Hormuz is now less than ten percent of normal volumes.  Companies await government guidance o…,The Times of India,Unknown,News,2026-04-16T07:51:18.955681Z
97ae50c08b0d98b0b5714959f90d21bd,Israeli Strikes on Lebanon Jeopardize Iran Truce; Talks Planned but Strait Still Shut,https://www.insurancejournal.com/news/international/2026/04/09/865113.htm,Admin,2026-04-09T14:01:00Z,dry bulk shipping,"Israel bombed more targets in Lebanon on Thursday, putting the U.S.-Iran ceasefire into further jeopardy after the biggest Israeli attacks on its neighbor of the war killed more than 250 people and threatened to torpedo Donald Trump’s truce. In Pakistan, …",Insurance Journal,Unknown,News,2026-04-16T07:51:18.955732Z
1b499985e0afc981a8132e7498133f2b,United Maritime Announces Availability of its 2025 Annual Report on Form 20-F,https://www.globenewswire.com/news-release/2026/04/09/3271067/0/en/United-Maritime-Announces-Availability-of-its-2025-Annual-Report-on-Form-20-F.html,United Maritime Corporation,2026-04-09T13:15:00Z,dry bulk shipping,"GLYFADA, Greece, April 09, 2026 (GLOBE NEWSWIRE) -- United Maritime Corporation (the “Company” or “United”) (NASDAQ: USEA) announced today that its Annual Report on Form 20-F for the fiscal year ended December 31, 2025 (the “Annual Report”) has been filed wit…",GlobeNewswire,Greece,Market Report,2026-04-16T07:51:18.955775Z
e81e0857563f14c4892fd4cd1be46bba,Hormuz Stays Blocked for Now as Hundreds of Ships Seek Exit,https://www.insurancejournal.com/news/international/2026/04/09/865095.htm,Admin,2026-04-09T05:48:14Z,dry bulk shipping,"The Strait of Hormuz remained largely blocked on Wednesday, as shipowners try to understand if they can safely transit the vital waterway following a fragile ceasefire between the US and Iran that was announced overnight. Just three ships were observed …",Insurance Journal,Unknown,News,2026-04-16T07:51:18.955822Z
a348c7c3a4f1ec5e12a55154f4ec2722,Ships exit Gulf from Iran despite US blockade: Tracker,https://www.channelnewsasia.com/world/strait-hormuz-blockage-iran-middle-east-war-6057031,,2026-04-15T00:52:51Z,bulk carrier,"<![CDATA[ At least three ships sailing from Iranian ports crossed the Strait of Hormuz despite a US military blockade, but some vessels taking the route later turned back, maritime tracking data indicated on Tuesday (Apr 14). ]]>",CNA,Unknown,News,2026-04-16T07:51:19.382529Z
daa99026d9f5e95826339b3608a60d83,"Chinese Tankers Turn Back from Challenging U.S. Blockade, Others Pass Strait of Hormuz Safely",https://www.breitbart.com/middle-east/2026/04/14/chinese-tankers-turn-back-challenging-u-s-blockade-others-pass-strait-hormuz-safely/,John Hayward,2026-04-14T22:02:44Z,bulk carrier,"Several ships passed through the Strait of Hormuz, while two Chinese tankers apparently changed their minds about challenging the U.S. blockade.
The post Chinese Tankers Turn Back from Challenging U.S. Blockade, Others Pass Strait of Hormuz Safely appeared fi…",Breitbart News,China,News,2026-04-16T07:51:19.382576Z
43b0e234965473cb69e65db151920f2f,"HRT Introduces the XVC Plate Carrier: A New Standard in Lightweight, Load-Bearing Performance",https://soldiersystems.net/2026/04/14/hrt-introduces-the-xvc-plate-carrier-a-new-standard-in-lightweight-load-bearing-performance/,Eric G,2026-04-14T16:00:00Z,bulk carrier,"Columbus, OH — 4/7/26 — HRT is proud to announce the release of the HRT XVC Plate Carrier, a next-generation modular system engineered to redefine lightweight performance, airflow, and adaptability in modern load-bearing equipment. Designed for professionals …",Soldiersystems.net,Unknown,News,2026-04-16T07:51:19.382632Z
cdfb5fbef26af95b70f1f8a3b1239776,Oil Markets on Edge as U.S. Blockade Takes Effect,https://oilprice.com/Energy/Energy-General/Oil-Markets-on-Edge-as-US-Blockade-Takes-Effect.html,RFE/RL staff,2026-04-14T14:00:00Z,bulk carrier,"A US naval blockade on ships entering Iranian ports and coastal areas has come into effect, following failed peace talks between US and Iranian negotiators over the weekend. And it already poses a dilemma: risk attack from Iranian assets near the Strait of Ho…",OilPrice.com,Unknown,Market Report,2026-04-16T07:51:19.382677Z
ada8ad6243fc26eae679d85293cc4d4f,How many ships have passed the Strait of Hormuz and how many were attacked?,https://www.aljazeera.com/news/2026/4/14/how-many-ships-have-passed-the-strait-of-hormuz-and-how-many-were-attacked,Marium Ali,2026-04-14T12:27:47Z,bulk carrier,Ship-tracking data shows 279 ships have passed through the strait and 22 have been attacked since the war on Iran began.,Al Jazeera English,Unknown,News,2026-04-16T07:51:19.382709Z
d0c80a757fe8c4e4f9966da8af6813b1,"United Airlines CEO pitched American Airlines tie-up in meeting with Trump, sources say",https://economictimes.indiatimes.com/news/international/business/united-airlines-ceo-pitched-american-airlines-tie-up-in-meeting-with-trump-sources-say/articleshow/130250331.cms,Reuters,2026-04-14T03:32:39Z,bulk carrier,United Airlines CEO Scott Kirby discussed a potential merger with American Airlines during a meeting with President Donald Trump. The deal could reshape the airline industry but faces major regulatory and political hurdles. Concerns include reduced competitio…,The Times of India,USA,News,2026-04-16T07:51:19.382741Z
f612257f6b7988010957752be385f299,moto pad – 2026 vs. iPad Air (M4): Is Motorola’s first US-bound tablet in 15 years a way around Apple’s expensive pricing?,https://thegadgetflow.com/blog/moto-pad-2026-vs-ipad-air-m4/,Grigor Baklajyan,2026-04-13T13:00:00Z,bulk carrier,"Did you know that the moto pad – 2026 is the first Motorola tablet since the 2011 Xoom that Android enthusiasts in the States can get from a major carrier? We went over 15 years without a Motorola tablet, so..
The post moto pad – 2026 vs. iPad Air (M4): Is Mo…",Gadget Flow,Unknown,News,2026-04-16T07:51:19.382794Z
d23be641143f2973f099c4414d122a0c,What To Know About The US Naval Blockade Of Iran,https://www.globalsecurity.org/military/library/news/2026/04/mil-260413-rferl03.htm,John Pike,2026-04-13T12:00:00Z,bulk carrier,"A US naval blockade on ships entering Iranian ports and coastal areas has come into effect, following failed peace talks between US and Iranian negotiators over the weekend.",Globalsecurity.org,Unknown,News,2026-04-16T07:51:19.382830Z
c9db0ba3aaf09ec2e4aa20e7f2a38c7b,A Closed Strait of Hormuz Risks a Global Food Security Crisis,https://warontherocks.com/a-closed-strait-of-hormuz-risks-a-global-food-security-crisis/,"Morgan D. Bazilian, Gabriel Collins, Jahara Matisek",2026-04-13T07:30:12Z,bulk carrier,"The war in Iran has done more than rattle energy markets. It has exposed an ordinary farm input as a strategic commodity. Urea is a concentrated, easy-to-transport nitrogen fertilizer that increases the yields of many crops, especially staple grains like corn…",War on the Rocks,Global,Market Report,2026-04-16T07:51:19.382895Z
bcc67fe961ab184e77b5358e4932f8c1,"iPhone 18 Pro Max Rumors: Massive Battery, Variable Aperture Camera and 2nm Chip Set for 2026 Debut",https://www.ibtimes.com.au/iphone-18-pro-max-rumors-massive-battery-variable-aperture-camera-2nm-chip-set-2026-debut-1866333,Daniel Lee,2026-04-13T06:49:11Z,bulk carrier,"CUPERTINO, California — Apple's iPhone 18 Pro Max is shaping up as one of the most significant upgrades in years, with rumors pointing to a larger battery, the company's first variable aperture camera and a cutting-edge 2nm processor as the device prepares fo…",Ibtimes.com.au,Unknown,News,2026-04-16T07:51:19.382948Z
f960125774368b8c59b6e52ed6f3a215,A thousand-state optoelectronic memory for high-precision spatiotemporal encoding,https://www.nature.com/articles/s41467-026-71504-x,"Guangdong Zhou, Yu Xu, Xuesen Xie, Chaoyi Zhu, Jin Ye, Yang Chai",2026-04-13T00:00:00Z,bulk carrier,"Noise in optoelectronic memories causes harmful overlap of photoconductance states and degrades computing precision. Zhou et al. report an optoelectronic memory that achieves thousands of distinguishable states without denoising, enabling the detection of fas…",Nature.com,Unknown,Market Report,2026-04-16T07:51:19.382994Z
8be169ac626888cdbaf61b6aa9c9adbc,Internal homojunction Sb2Se3 solar cell,https://www.nature.com/articles/s41566-026-01888-1,"Junjie Yang, Jianyu Li, Shuwei Sheng, Zhiyuan Cai, Ke Li, Zichen Ruan, Bo Che, Rongfeng Tang, Tao Chen",2026-04-13T00:00:00Z,bulk carrier,A thermally evaporated Sb2Se3 solar cell featuring an internal n-type/p-type homojunction achieves a power conversion efficiency of 10.15% with a voltage deficit of 0.459 V.,Nature.com,Unknown,News,2026-04-16T07:51:19.383033Z
b3eb0954265f16615a6e8579de245e7b,Swedish coast guard boards Panama-flagged vessel over pollution claim,https://www.thelocal.se/20260412/swedish-coast-guard-boards-panama-flagged-vessel-over-pollution-claim,The Local,2026-04-12T12:01:51Z,bulk carrier,Swedish authorities on Sunday boarded a Panama-flagged vessel suspected of committing an environmental offence in the Baltic Sea.,The Local Sweden,Panama,News,2026-04-16T07:51:19.383060Z
37f8aa99b35296b35ba14a852d01afa8,The bulk carrier is allowed to leave Sweden,https://www.globalsecurity.org/intell/library/news/2026/intell-260412-se-coastguard01.htm,John Pike,2026-04-12T12:00:00Z,bulk carrier,The master of the bulk carrier Hui Yuan has admitted violating the Swedish Environmental Code and has deposited money for future fines.,Globalsecurity.org,Unknown,News,2026-04-16T07:51:19.383090Z
f5bbe20dbef652584d24f6199f6ddb19,Newark Liberty International Airport TSA Wait Times Today: Terminal C Hits 34 Minutes,https://www.ibtimes.com.au/newark-liberty-international-airport-tsa-wait-times-today-terminal-c-hits-34-minutes-1866247,Joe Green,2026-04-12T11:51:40Z,bulk carrier,"NEWARK, N.J. — Travelers at Newark Liberty International Airport faced uneven security lines Sunday as general TSA wait times ranged from as little as 3 minutes in some Terminal B checkpoints to 34 minutes at Terminal C, according to the airport's real-time d…",Ibtimes.com.au,Global,News,2026-04-16T07:51:19.383141Z
f98a784260a4ee01486d689b46ff9b14,Polyfluorophenyl quinoxaline derived acceptors with long exciton diffusion length for efficient thin-film/thick-film organic solar cells,https://www.nature.com/articles/s41467-026-71677-5,"Kai Xiang, Zihao Deng, Wenyan Su, Hairui Bai, Bitao Dong, Na Chen, Ning Su, Haotian Wu, Zhaozhao Bi, Han Liu, Tengfei Li, Yanan Shen, Ke Wang, Dandan Zhang, Rui Sun, Muhammad Hamza Maqsood, Ping Li, Lihe Yan, Guanghao Lu, Yuhang Liu, Jin-Liang Wang, Feng He, Jianhua Chen, Wei Ma, Qunping Fan",2026-04-10T00:00:00Z,bulk carrier,"Organic solar cells need acceptor molecules with long exciton diffusion lengths, but most available materials fail in thick films. The authors design new fluorinated quinoxaline acceptors that significantly improve carrier mobilities resulting in superior eff…",Nature.com,Unknown,News,2026-04-16T07:51:19.383230Z
71492f326dea7fe4ea7610898542d738,adidas Running Has You Covered for Spring Marathon Season,https://www.nicekicks.com/adidas-running-has-you-covered-for-spring-marathon-season/,Nice Kicks,2026-04-09T18:37:49Z,bulk carrier,"From your first training run to the finish line, the adizero range is built light, built fast,and built for every…
The post adidas Running Has You Covered for Spring Marathon Season appeared first on Nice Kicks.",Nicekicks.com,Unknown,News,2026-04-16T07:51:19.383275Z
6104c350bf6e940445767e17095a4961,Australia Bans Bulk Carrier After 7 Months of Unpaid Crew Wages,https://gcaptain.com/australia-bans-bulk-carrier-after-7-months-of-unpaid-crew-wages/,Mike Schuler,2026-04-09T14:46:03Z,bulk carrier,Australia’s maritime regulator has issued a stark warning to shipowners after banning a Liberia-flagged bulk carrier for six months over serious breaches of seafarer welfare standards. The Australian Maritime Safety Authority (AMSA)...,gcaptain.com,Australia,News,2026-04-16T07:51:19.383298Z
1549ab7b629e8e94a043e0e532bab8c6,Chinese shipyards’ aggressive production expansion in 2025,https://www.naftemporiki.gr/english/2096298/chinese-shipyards-aggressive-production-expansion-in-2025/,Γιάννα Βαρδαλαχάκη,2026-04-09T05:11:13Z,capesize,"China’s shipbuilding industry is entering a new, more aggressive phase of expansion, further reinforcing not only its dominance in the global newbuilding market but also its strategic importance within the…
Chinese shipyards’ aggressive production expansion i…",Naftemporiki.gr,China,Market Report,2026-04-16T07:51:19.751934Z
bf1fddc395d3bdbcda5d02dd2c6ebef6,The impact of Seanergy’s strategy on the Capesize market,https://www.naftemporiki.gr/english/2096288/the-impact-of-seanergys-strategy-on-the-capesize-market/,Γιάννα Βαρδαλαχάκη,2026-04-09T04:42:01Z,capesize,"Seanergy Maritime Holdings Corp. presented its strategic direction and key priorities in the dry bulk market as part of Capital Link’s Corporate Presentation Series 2026.
The company’s Chief Executive Officer,…
The impact of Seanergy’s strategy on the Capesiz…",Naftemporiki.gr,Unknown,Market Report,2026-04-16T07:51:19.751980Z
6c61abef645330aea228e879b2f0e131,Oil tankers transiting Strait of Hormuz since start of Iran war,https://economictimes.indiatimes.com/news/international/world-news/oil-tankers-transiting-strait-of-hormuz-since-start-of-iran-war/articleshow/130272642.cms,Reuters,2026-04-15T04:15:12Z,panamax,"Oil tankers are successfully transiting the Strait of Hormuz. Vessels from various nations are carrying crude oil and refined products to destinations including Vietnam, Malaysia, China, India, Pakistan, and Thailand. These movements occur despite ongoing ten…",The Times of India,China,News,2026-04-16T07:51:20.117283Z
15a8bea4505b5577588e569e5c4a0d53,Here’s a List of Non-Iranian Oil Tankers Transiting Strait of Hormuz Since Start of War,https://www.insurancejournal.com/news/international/2026/04/14/865758.htm,Admin,2026-04-14T10:51:10Z,panamax,"The U.S. blockade on vessels entering or leaving Iranian ports adds to uncertainty over shipping through the Strait of Hormuz, which has been all-but-shut since the start of the Iran war. Ordinarily, roughly one fifth of global oil and gas …",Insurance Journal,Global,News,2026-04-16T07:51:20.117346Z
ef0f69b6898ad4c40b5d5c4fa89a15e5,Oil Tankers Steer Clear of Hormuz Ahead of US Blockade,https://www.insurancejournal.com/news/international/2026/04/13/865554.htm,Admin,2026-04-13T09:14:20Z,panamax,"Oil tankers are steering clear of the Strait of Hormuz ahead of a U.S. blockade later on Monday following failed peace talks between the U.S. and Iran over the weekend, shipping data showed. President Donald Trump said on Sunday the …",Insurance Journal,Unknown,News,2026-04-16T07:51:20.117396Z
042a220c193b14194c3ebb8852a13628,Crude oil tankers steer clear of Hormuz ahead of US blockade,https://www.thehindubusinessline.com/news/world/crude-oil-tankers-steer-clear-of-hormuz-ahead-of-us-blockade/article70856066.ece,Reuters,2026-04-13T02:45:24Z,panamax,Move follows an announcement that U.S. forces would begin implementing ‌the blockade of all maritime traffic entering and exiting Iranian ports on Monday.,BusinessLine,Unknown,News,2026-04-16T07:51:20.117438Z
fcf174be3951c119eb6cc91c58ffb3bf,Scorpio Tankers Inc. Announces Closing of Convertible Senior Notes due 2031 and Concurrent Stock Repurchase,https://www.globenewswire.com/news-release/2026/04/10/3272040/0/en/Scorpio-Tankers-Inc-Announces-Closing-of-Convertible-Senior-Notes-due-2031-and-Concurrent-Stock-Repurchase.html,Scorpio Tankers Inc.,2026-04-10T20:15:00Z,handymax,"MONACO, April 10, 2026 (GLOBE NEWSWIRE) -- Scorpio Tankers Inc. (NYSE: STNG) (the “Company”) announced today that it has closed its previously announced private offering (the “Offering”) for $375,000,000 in aggregate principal amount of convertible senior not…",GlobeNewswire,Unknown,News,2026-04-16T07:51:20.488897Z
c8cd24eec18a4dcdf153b1ad64e03c43,Buildner Launches Unbuilt Award 2026 With €100K in Awards and Announces 2nd Edition Winners,https://www.archdaily.com/1040047/buildner-launches-unbuilt-award-2026-with-eu100k-in-awards-and-announces-2nd-edition-winners,Rene Submissions,2026-04-10T06:45:00Z,handymax,"Buildner has launched the Unbuilt Award 2026, the third edition of its annual competition, offering a €100,000 prize fund. At the same time, the results of the Unbuilt Award 2025 have been announced, marking the second competition in a series that celebrates …",ArchDaily,Unknown,Market Report,2026-04-16T07:51:20.488956Z
1cf2565bf711bd3f816d1e47da537a26,Navigator Gas Announces Signing of Non-Binding Letter of Intent for Sale of Eight Gas Vessels and Its Shareholding in Unigas Joint Venture,https://www.globenewswire.com/news-release/2026/04/15/3274131/0/en/Navigator-Gas-Announces-Signing-of-Non-Binding-Letter-of-Intent-for-Sale-of-Eight-Gas-Vessels-and-Its-Shareholding-in-Unigas-Joint-Venture.html,Navigator Holdings Ltd.,2026-04-15T06:00:00Z,handysize,"LONDON, April 15, 2026 (GLOBE NEWSWIRE) -- Navigator Holdings Ltd. (“Navigator Gas” or the “Company”) (NYSE: NVGS), the owner and operator of the world’s largest fleet of handysize liquefied gas carriers, today announces that yesterday, April 14, it signed a …",GlobeNewswire,UK,News,2026-04-16T07:51:20.874060Z
