article_id,title,link,creator,pubdate,category,description,source,country,article_type,scrape_timestamp
92af6983916bb838b3f352e392eb6c32,"Iran war, Strait of Hormuz reopening: Donald Trump is warned for tactics against Tehran by allies, critics. Here is why",https://economictimes.indiatimes.com/news/international/us/iran-war-strait-of-hormuz-reopening-donald-trump-is-warned-for-tactics-against-tehran-by-allies-critics-here-is-why/articleshow/131518890.cms,Global Desk,2026-06-04T23:46:57Z,Strait of Hormuz,Iran war: A series of strikes by the U.S. and Iran this week has raised fresh concern the ceasefire could collapse. Donald Trump on Wednesday downplayed the significance.,The Times of India,Unknown,News,2026-06-06T08:35:43.892146Z
0bbd84dd13f70d315ebf7006fc9a5a83,Oil Steadies After First Drop This Week on Peace Talk Optimism,https://financialpost.com/pmn/business-pmn/oil-steadies-after-first-drop-this-week-on-peace-talk-optimism,Bloomberg News,2026-06-04T23:06:47Z,Strait of Hormuz,Oil was steady after its first decline this week on optimism that talks between the US and Iran will see energy flows resume through the Strait of Hormuz.,Financial Post,Unknown,News,2026-06-06T08:35:43.892181Z
eb7f46638b343dd4d8721d93fd8f5c09,"Brazil, Guyana, Venezuela Fuel South America’s Oil Export Boom",https://oilprice.com/Energy/Crude-Oil/Brazil-Guyana-Venezuela-Fuel-South-Americas-Oil-Export-Boom.html,Tsvetana Paraskova,2026-06-04T23:00:00Z,Strait of Hormuz,"South America has raised its oil exports more than the U.S. has done so far this year as key producers in the region boosted production and shipments to a world scrambling for crude that’s not dependent on the Strait of Hormuz. Over the past five years, South…",OilPrice.com,Brazil,News,2026-06-06T08:35:43.892206Z
7352478817e7da283313fccb2014e105,What is El Niño and how could it affect weather this year?,https://www.pbs.org/newshour/science/what-is-el-nino-and-how-could-it-affect-weather-this-year,Maria Ramirez Uribe,2026-06-04T22:28:02Z,Strait of Hormuz,"A strong El Niño this year, colloquially dubbed a super El Niño, could lead to extreme weather events — from heavy rainfall to exacerbated droughts.",PBS,Unknown,News,2026-06-06T08:35:43.892248Z
9a4d4564460677ee166a3e4b5a307420,Iran endgame nears — as Trump faces two stark choices,https://nypost.com/2026/06/04/opinion/iran-endgame-nears-as-trump-faces-two-stark-choices/,Victor Davis Hanson,2026-06-04T22:27:56Z,Strait of Hormuz,"After three months of intermittent war, we see the realities of the conflict: Iran does not regard overwhelming military defeat on the battlefield as a strategic loss.",New York Post,Unknown,News,2026-06-06T08:35:43.892287Z
22238a30c070930febe7b858043105f9,Trump’s red line: Killing American troops could trigger more pain as Iran admits to targeting US bases,https://nypost.com/2026/06/04/world-news/trump-warns-iran-that-killing-american-troops-would-restart-war/,Caitlin Doornbos,2026-06-04T21:58:51Z,Strait of Hormuz,Trump's warning comes as Iran targets US bases in the region.,New York Post,USA,News,2026-06-06T08:35:43.892311Z
8b15e924ffcf06cefc54b5c6fdea7cb5,American Airlines temporarily suspends some of its summer routes due to steep jet fuel costs,https://japantoday.com/category/business/american-airlines-temporarily-suspends-some-of-its-summer-routes-due-to-steep-jet-fuel-costs,,2026-06-04T21:58:14Z,Strait of Hormuz,"American Airlines is temporarily suspending some of its routes this summer, as steep jet fuel costs continue to strain carriers' budgets amid the war with Iran. In a statement, American said it had adjusted service for “select routes” in August and September …",Japan Today,USA,News,2026-06-06T08:35:43.892340Z
213f3d7f22e4bb6401287ad60fc8b99d,The Trump White House keeps losing,https://www.vox.com/podcasts/490984/trump-white-house-iran-war-courts-congress-agenda-failure,"dustin-desoto, Sean Rameswaram",2026-06-04T21:44:30Z,Strait of Hormuz,"President Donald Trump’s second term began at a breakneck pace, with a wave of executive orders and other actions imposing tariffs; targeting law firms, universities, and individuals he believed had wronged him while he was out of office; and reshaping the US…",Vox,Unknown,News,2026-06-06T08:35:43.892386Z
350354ca8e3d28288a3afbaac723b811,Hezbollah rejection clouds Lebanon ceasefire and prospects for ending Iran war,https://japantoday.com/category/world/hezbollah-rejection-clouds-lebanon-ceasefire-and-prospects-for-ending-iran-war2,,2026-06-04T21:41:07Z,Strait of Hormuz,"The Iran-backed Hezbollah militia rejected a new ceasefire in Lebanon on Thursday and Israel said it would not withdraw troops from the country, undermining ‌U.S. President Donald Trump's efforts to halt fighting there to forge peace with Tehran. Iran has mad…",Japan Today,Unknown,News,2026-06-06T08:35:43.892436Z
3bf00a41fca5f056df2f872df2235b7c,Trump Thinks His Administration Is ‘Like Pirates’,https://www.theatlantic.com/newsletters/2026/06/trumps-pirates-of-the-persian-gulf/687439/,David A. Graham,2026-06-04T21:41:00Z,Strait of Hormuz,"They’re seizing ships, plundering cargo, and inflicting casualties on the high seas.",The Atlantic,Unknown,Market Report,2026-06-06T08:35:43.892465Z
030068cf8290b1556e8d94d57e070603,How Trump Should Approach an Iran Endgame,http://foreignpolicy.com/2026/06/04/robert-malley-trump-war-iran-negotiations-cease-fire-endgame/,Ravi Agrawal,2026-06-04T21:01:06Z,Strait of Hormuz,Former Iran negotiator Robert Malley on the White House’s best options right now.,Foreign Policy,Unknown,News,2026-06-06T08:35:43.892496Z
730b53f9ddfc71dd1357c2a3c83d4d6c,Trafigura Pays Record Dividend as Profit Soars Over $4B,https://www.rigzone.com/news/wire/trafigura_pays_record_dividend_as_profit_soars_over_4b-04-jun-2026-183854-article/,"Archie Hunter, Jack Farchy",2026-06-04T21:00:00Z,Strait of Hormuz,Trafigura Group made a record payout to its top traders and executives.,Rigzone,Unknown,News,2026-06-06T08:35:43.892522Z
94875129f4ec1f2f759ac9851499dd8e,Hezbollah rejects Lebanon ceasefire as Israeli strikes kill four,https://www.abc.net.au/news/2026-06-05/hezbollah-rejects-latest-lebanon-israel-ceasefire-agreement/106762184,,2026-06-04T20:40:38Z,Strait of Hormuz,"Iran has made a ceasefire in Lebanon a condition for any peace deal with Washington, and has suggested in recent days that it could intervene directly if Israel keeps up attacks there.",ABC News (AU),Unknown,News,2026-06-06T08:35:43.892559Z
2a16b0d09fae9f40aff1635a63fb7b8e,"US stocks today: Dow soars 800 points to hit record as Iran optimism offsets chip slump, weak jobs data",https://economictimes.indiatimes.com/markets/us-stocks/news/us-stocks-today-us-stocks-ends-higher-dow-claims-record-closing-high/articleshow/131516540.cms,Reuters,2026-06-04T20:04:08Z,Strait of Hormuz,"Wall Street closed higher with the Dow hitting a record, lifted by easing Iran war concerns and gains in healthcare and financial stocks. However, weak results from Broadcom dragged chipmakers, capping Nasdaq gains. Rising jobless claims and AI-driven layoffs…",The Times of India,Unknown,News,2026-06-06T08:35:43.892636Z
c15a58e92be51a2ed28ee9264d2540b0,The World Is Approaching “Tank Bottoms” As Experts Warn That Very Painful Oil Shortages Are Ahead This Summer,http://theeconomiccollapseblog.com/the-world-is-approaching-tank-bottoms-as-experts-warn-that-very-painful-oil-shortages-are-ahead-this-summer/,Michael,2026-06-04T19:49:15Z,Strait of Hormuz,"Without sufficient quantities of oil, the global economy will not be able to operate normally. So the fact that the global economy is running a massive “oil deficit” right now should deeply alarm all of us. Even since the war with Iran began, the world has be…",Theeconomiccollapseblog.com,Global,News,2026-06-06T08:35:43.892716Z
a71a509de34977eec3de36219c68e3c5,Air Canada assures customers there is no fuel shortage to disrupt summer flight operations,https://nationalpost.com/news/canada/air-canada-assures-customers-there-is-no-fuel-shortage-to-disrupt-summer-flight-operations,Stewart Lewis,2026-06-04T19:39:39Z,Strait of Hormuz,"'Please be assured that we are fully expecting to operate our current summer schedule,' Air Canada tells customers in an email",National Post,Unknown,News,2026-06-06T08:35:43.892751Z
9e882534e6ce1d2b1788e29dfa55b5ca,American Airlines temporarily suspends some of its summer routes due to steep jet fuel costs,https://www.kpbs.org/news/living/2026/06/04/american-airlines-temporarily-suspends-some-of-its-summer-routes-due-to-steep-jet-fuel-costs,Wyatte Grantham-Philips,2026-06-04T19:28:07Z,Strait of Hormuz,"The airline says it adjusted service for select routes in August and September. Other media outlets are reporting six routes would be affected — largely from Los Angeles, among other destinations in North America.",KPBS,USA,Market Report,2026-06-06T08:35:43.892775Z
7963157d91dfbc5f738f9f186c9fce79,Smaller Inventories and Hotter US Temps Boost Nat-Gas Prices,https://www.barchart.com/story/news/2311400/smaller-inventories-and-hotter-us-temps-boost-nat-gas-prices,Rich Asplund,2026-06-04T19:16:54Z,Strait of Hormuz,July Nymex natural gas (NGN26 ) on Thursday rose +0.122 (+3.80%). Nat-gas prices rallied sharply on Thursday due to a smaller-than-expected increase in...,Barchart.com,Unknown,Market Report,2026-06-06T08:35:43.892805Z
d869e6c32ec403e3eb3590aa6753607c,Dow soars nearly 900 points as Wall Street bets on Iran peace deal,https://www.cbsnews.com/news/dow-jones-today-900-points-record-high-iran-deal/,Alain  Sherter,2026-06-04T19:01:22Z,Strait of Hormuz,"Despite flare-ups in Middle East violence, investors remain optimistic that the U.S. and Iran will soon end the war.",CBS News,Unknown,News,2026-06-06T08:35:43.892837Z
0011f2f4cd28eb3f9c3db0215a9fa15c,Ships stranded in Persian Gulf quietly coordinate with U.S. Navy to exit Hormuz,https://www.cnbc.com/2026/06/04/iran-war-strait-hormuz-persian-gulf-oil-tanker-transit.html,Spencer Kimball,2026-06-04T18:54:57Z,Strait of Hormuz,Clashes erupted between the U.S. and Iran over commercial ships earlier this week.,CNBC,Unknown,News,2026-06-06T08:35:43.892867Z
8127746c2fe101f7f6c7f0b3ae432ee2,Why war has made Iran's leadership frictions more 'consequential',https://www.abc.net.au/news/2026-06-05/wartime-iran-s-leadership-frictions-more-consequential-/106753196,Lucia Stein,2026-06-04T18:45:54Z,Strait of Hormuz,"A report about the resignation of Iran's president earlier this week came at a turbulent moment for Iran's regime, which is grappling with frictions between moderates and hardliners as the war drags on.",ABC News (AU),Unknown,Market Report,2026-06-06T08:35:43.892927Z
520cc0520b6d377c1a796dda183b4ddd,Saudi energy minister calls for ‘stable energy sector’ during Russia visit,https://www.aljazeera.com/news/2026/6/4/saudi-energy-minister-call-for-stable-energy-sector-on-russia-visit,Al Jazeera Staff,2026-06-04T18:30:49Z,Strait of Hormuz,Prince Abdulaziz bin Salman and other top OPEC officials visit the St Petersburg International Economic Forum.,Al Jazeera English,Russia,News,2026-06-06T08:35:43.892997Z
a77b507346490d80fc506f72e43a9299,White House Tries to Bury Alarming Warning From Oil Execs,https://newrepublic.com/post/211386/white-house-warning-oil-execs-gas-prices,Malcolm Ferguson,2026-06-04T18:28:20Z,Strait of Hormuz,"The Trump administration is denying reports of incoming oil price spikes, even as the White House has been warned by multiple executives in the region.Politico reported that one anonymous executive told the administration that their storage tanks were “at dan…",The New Republic,Unknown,Market Report,2026-06-06T08:35:43.893043Z
0cc1191f9ad082f51dbca341ee03defb,Trump's war in Iran cancels summer vacation,https://boingboing.net/2026/06/04/trumps-war-in-iran-cancels-summer-vacation.html,Jason Weisberger,2026-06-04T18:24:49Z,Strait of Hormuz,"The Orange Menace promised cheap gas and no new wars, then delivered expensive fuel and canceled flights.
American Airlines says it is temporarily suspending some August and September routes because jet fuel costs are punishing for carriers amid the war in Ir…",Boing Boing,USA,News,2026-06-06T08:35:43.893070Z
32aad2e5c1a8321b611223dc02b23c55,Did Trump stay out of public eye after having stroke? We set the record straight,https://www.snopes.com//fact-check/trump-stroke-public-appearances/,Laerke Christensen,2026-06-04T18:23:00Z,Strait of Hormuz,"Posts from reporters and photographers showed the president recorded interviews and met with White House advisers between May 27 and June 3, 2026.",Snopes.com,Unknown,Analysis/Opinion,2026-06-06T08:35:43.893096Z
b78a9c2bdc554d9219635dabbe8d4718,Dollar Weakness Lifts Sugar Prices on Short Covering,https://www.barchart.com/story/news/2310680/dollar-weakness-lifts-sugar-prices-on-short-covering,Rich Asplund,2026-06-04T18:22:53Z,Strait of Hormuz,"July NY world sugar #11 (SBN26 ) on Thursday closed up +0.03 (+0.21%), and Aug London ICE white sugar #5 (SWQ26 ) closed up +4.40 (+0.99%). Sugar prices...",Barchart.com,UK,Market Report,2026-06-06T08:35:43.893123Z
45f49ba5507e5b7edb18467e2ec5d66e,White House insists oil execs' ominous new warning never happened: report,https://www.rawstory.com/trump-iran-war-oil/,Travis Gettys,2026-06-04T17:21:20Z,Strait of Hormuz,"Senior oil industry executives have privately warned Trump administration officials that global fuel inventories are draining at an alarming rate following the effective closure of the Strait of Hormuz, but the White House denies those high-level talks.Four i…",Raw Story,Global,Market Report,2026-06-06T08:35:43.893257Z
217e2eaa7246182a73518b99b054d8e9,China Is Too Big for Shangri-La,http://foreignpolicy.com/2026/06/04/china-shangri-la-dong-jun-defense-minister/,Deng Yuwen,2026-06-04T17:17:03Z,Strait of Hormuz,Snubbing a key security forum shows Beijing’s new confidence.,Foreign Policy,China,News,2026-06-06T08:35:43.893270Z
26c0252217e53f52de77f7a1f0548bfa,"Letters: In a connected world, New Zealand isn’t so isolated after all",https://www.nzherald.co.nz/nz/letters-in-a-connected-world-new-zealand-isnt-so-isolated-after-all/premium/4LMHKG4QFJFKTIH2J2DBMC66KY/,NZ Herald,2026-06-04T17:00:00Z,Strait of Hormuz,OPINION: Geographical isolation has been raised as an issue in our defence strategy.,New Zealand Herald,Unknown,Analysis/Opinion,2026-06-06T08:35:43.893347Z
f2fc4e24d23a309670aae040ffcb188a,‘Tank bottom’: Oil industry warning Trump administration that drained inventories threaten to spike gasoline prices,https://freerepublic.com/focus/f-news/4382341/posts,Politico (via MSN),2026-06-04T16:50:35Z,Strait of Hormuz,"The oil industry is warning the Trump administration that a Hormuz-sized hole in the world’s petroleum market is steadily draining inventories to levels that are likely to send global energy prices surging in the next several weeks, according to four executiv…",Freerepublic.com,Global,Market Report,2026-06-06T08:35:43.893395Z
db7ae5dba48b2209440b36a113d8f3b2,Paul Krugman's Deranged Call to Purge America of MAGA Is Scarier Than You Think,https://freerepublic.com/focus/f-chat/4382339/posts,Hot Air,2026-06-04T16:40:39Z,Strait of Hormuz,"It is now so common for leftists, indeed most Democrats, to call Trump supporters Nazis that it's easy to shrug and move on. Unfortunately, as much as we would like to think it is a mere rhetorical flourish, it is not one at all. If you think that Democrats a…",Freerepublic.com,USA,News,2026-06-06T08:35:43.893424Z
c61a00ba49275de23ef02288005b13e7,Iran to Charge Ships for Service Provided During Transit Through Hormuz - Foreign Ministry,https://sputnikglobe.com/20260604/iran-to-charge-ships-for-service-provided-during-transit-through-hormuz---foreign-ministry-1124263488.html,Sputnik International,2026-06-04T16:39:24Z,Strait of Hormuz,"TEHRAN (Sputnik) - Iran plans to charge ships for services provided during passage through the Strait of Hormuz, not for the transit itself, Iranian Deputy Foreign Minister Kazem Gharibabadi said on Thursday.",Sputnikglobe.com,Unknown,News,2026-06-06T08:35:43.893463Z
72702f8aa10fc983a77c7f14c0f4d965,Treasuries Rise as Oil Signals Optimism on Iran Peace Accord,https://financialpost.com/pmn/business-pmn/treasuries-rise-as-oil-signals-optimism-on-iran-peace-accord,Bloomberg News,2026-06-04T16:34:39Z,Strait of Hormuz,"Treasuries rose and the dollar slipped as investors drew optimism about the prospects of a US-Iran peace deal from a conditional ceasefire between Israel and Lebanon, despite ongoing clashes.",Financial Post,Unknown,News,2026-06-06T08:35:43.893533Z
81560a29662f73e0a6937e2cb32e33e6,House Hearing Devolves Into Nasty Spat As Trump Official Grilled On Rising Prices: Don’t Be ‘So Rude’,https://www.mediaite.com/media/news/house-hearing-devolves-into-nasty-spat-as-trump-official-grilled-on-rising-prices-dont-be-so-rude/,Alex Griffing,2026-06-04T16:34:00Z,Strait of Hormuz,"""OK, I just ask you not to be so rude. I mean, I'd really like to have a legitimate conversation.""
The post House Hearing Devolves Into Nasty Spat As Trump Official Grilled On Rising Prices: Don’t Be ‘So Rude’ first appeared on Mediaite.",Mediaite,Unknown,Market Report,2026-06-06T08:35:43.893580Z
0ca8eb1eeddc5dbe69dcb6e46e3259e9,"Dow soars 900 points to all-time high, while chipmaker Broadcom sends tech sector stumbling",https://nypost.com/2026/06/04/business/dow-soars-900-points-to-all-time-high-while-chipmaker-broadcom-sends-tech-sector-stumbling/,Reuters,2026-06-04T16:26:24Z,Strait of Hormuz,"The blue-chip Dow was boosted by UnitedHealth and financials shares, while Boradcom weighed on the Nasdaq.",New York Post,Unknown,News,2026-06-06T08:35:43.893611Z
9a930206441e563c63510fd88210feb7,Today’s Slump in Crude Oil Weighs on Sugar Prices,https://www.barchart.com/story/news/2308692/todays-slump-in-crude-oil-weighs-on-sugar-prices,Rich Asplund,2026-06-04T16:22:34Z,Strait of Hormuz,"July NY world sugar #11 (SBN26 ) today is down -0.02 (-0.14%), and Aug London ICE white sugar #5 (SWQ26 ) is up +0.50 (+0.11%). Sugar prices recovered from...",Barchart.com,UK,Market Report,2026-06-06T08:35:43.893641Z
68cf835f128e4181f0d91633f3747a7d,A More Optimistic View on Iran,http://www.powerlineblog.com/archives/2026/06/a-more-optimistic-view-on-iran.php,John Hinderaker,2026-06-04T16:13:35Z,Strait of Hormuz,"I have often expressed puzzlement over the Trump administration’s cease fire in Iran and its strategy going forward. In general, my views align with Scott’s, as expressed earlier today. However, for a more optimistic view, check out Condoleezza Rice’s op-ed i…",Power Line,Unknown,Analysis/Opinion,2026-06-06T08:35:43.893680Z
e475597e8a949429dcf81fe2e17804e4,'Architects Are Lost as a Profession:' Former HOK CEO Patrick MacLeamy Speaks Out,https://archinect.com/features/article/150545552/architects-are-lost-as-a-profession-former-hok-ceo-patrick-macleamy-speaks-out,Niall Patrick Walsh,2026-06-04T16:10:00Z,Strait of Hormuz,"Almost two years ago, in September 2024, Archinect spoke with former HOK CEO and Chairman Patrick MacLeamy for advice on how architects could navigate through economic downturns. Back then, high interest rates, inflation, and post-pandemic construction costs …",Archinect,Unknown,Market Report,2026-06-06T08:35:43.893723Z
eb821058d116defcd03694ba0bf64f47,Ahead of Market: 10 things that will decide stock market action on Friday,https://economictimes.indiatimes.com/markets/stocks/news/ahead-of-market-10-things-that-will-decide-stock-market-action-on-friday/articleshow/131511250.cms,Akash Podishetti,2026-06-04T15:53:47Z,Strait of Hormuz,"Indian equities ended largely unchanged as West Asia tensions tempered risk appetite. Broader markets outperformed despite recent corrections, while investors awaited the RBI policy decision and GDP data. Analysts flagged 23,500 as a key resistance and 23,300…",The Times of India,India,Market Report,2026-06-06T08:35:43.893744Z
3e41e31d596e3164c48333edcb629554,American Airlines temporarily suspends some of its summer routes due to steep jet fuel costs,https://abcnews.com/Business/wireStory/american-airlines-temporarily-suspends-summer-routes-due-steep-133590437,WYATTE GRANTHAM-PHILIPS AP business writer,2026-06-04T15:52:23Z,Strait of Hormuz,American Airlines is temporarily suspending some routes this summer due to steep jet fuel costs amid the war with Iran,Abcnews.com,USA,News,2026-06-06T08:35:43.893763Z
0d71a8fb4f57f36dc88d6cc8cb825762,India’s LPG Imports in March-May 2026: West Asia’s loss is Washington’s gain,https://www.thehindubusinessline.com/economy/indias-lpg-imports-in-march-may-2026-west-asias-loss-is-washingtons-gain/article71061808.ece,Rishi Ranjan Kala,2026-06-04T15:48:52Z,Strait of Hormuz,"The first 90 days of the West Asian conflict has significantly altered the trade dynamics of India’s liquefied petroleum gas (LPG) imports, with the US eating into the share of India’s top four traditional suppliers in West Asia — the UAE, Qatar, Saudi Arabia…",BusinessLine,India,News,2026-06-06T08:35:43.893791Z
814d28093c9dd48df821acc807ea2e09,Wilful ignorance is not an acceptable dodge when it comes to Aughinish Alumina,https://www.irishtimes.com/opinion/2026/06/05/justine-mccarthy-russia-ukraine-aughinish-alumina-sanctions-irish-neutrality/,Justine McCarthy,2026-06-05T05:00:01Z,shipping sanctions,Irish neutrality is rightly questioned when governments do utmost to prevent ban on alumina exports to Russia,The Irish Times,Russia,News,2026-06-06T08:35:44.245036Z
b2d0b41653c8346ef83b5172ba5f7e4c,SEE IT: Lavish $35M mansion bought by tech CEO accused of feeding US gear to Iran's nuclear machine,https://www.foxnews.com/politics/see-lavish-35m-mansion-bought-tech-ceo-accused-feeding-us-gear-irans-nuclear-machine,,2026-06-04T18:42:07Z,shipping sanctions,"Dual U.S.-Iranian citizen allegedly used millions from Iran sanctions-evasion scheme to build a $35 million Newport Beach mansion, federal prosecutors say.",Fox News,Unknown,News,2026-06-06T08:35:44.245483Z
32917b977ce1061846e382a358d27348,Feds: He Made a Fortune Illegally Selling US Gear to Iran,https://www.newser.com/story/390446/feds-he-made-a-fortune-illegally-selling-us-gear-to-iran.html,Arden Dier with Newser.AI,2026-06-04T16:40:00Z,shipping sanctions,"A California tech executive is accused of making millions through a decade-long effort to funnel US computer gear to Iran. Federal prosecutors on Wednesday charged 63-year-old Jamshid Ghomi, a dual US-Iranian citizen and CEO of Tehran-based Faraz Pardaz Rayan…",Newser,Unknown,News,2026-06-06T08:35:44.245572Z
94b54ceaaa09789f17227778479d2025,Who is the Indian guru Venezuelan acting President Delcy Rodriguez follows?,https://www.aljazeera.com/news/2026/6/4/who-is-the-indian-guru-venezuelan-acting-president-delcy-rodriguez-follows,Al Jazeera Staff,2026-06-04T11:04:16Z,shipping sanctions,"The Venezuelan leader, who is a devotee of Sathya Sai Baba, is in India as the two countries aim to boost energy ties.",Al Jazeera English,India,News,2026-06-06T08:35:44.245727Z
1e0ed3411747ec7c71bd0bd16191823a,Israel and Lebanon agree to implement conditional truce,https://www.rte.ie/news/middle-east/2026/0604/1576682-middle-east-lebanon-israel/,RTÉ News,2026-06-04T04:25:02Z,shipping sanctions,"Israel and Lebanon agreed to implement a ceasefire to end hostilities, the Trump administration has said, in a boost to hopes for a broader deal to end the US-Israeli war on ⁠Iran.",RTE,Unknown,News,2026-06-06T08:35:44.246030Z
2b46915e6b7c14d7f4f5e85ccfdefd78,"Israel And Lebanon Agree To Implement Ceasefire, Trump Admin Says",https://www.huffpost.com/entry/israel-lebanon-ceasefire_n_6a20c30ae4b08a03cfbfa551,HuffPost,2026-06-04T00:23:17Z,shipping sanctions,"The two sides agreed last month to a ceasefire, but hostilities had continued.",HuffPost,Unknown,News,2026-06-06T08:35:44.246059Z
b5bd2a65c66975ebc71d81bdbb6fb2e5,Iran hits Kuwait; U.S. strikes near Hormuz in Gulf flare-up,https://japantoday.com/category/world/iran-hits-kuwait-us-strikes-near-hormuz-in-gulf-flare-up,,2026-06-03T21:46:36Z,shipping sanctions,"Gulf hostilities flared again on Wednesday as Iranian attacks on Kuwait damaged its airport and injured dozens while the U.S. military carried out strikes near the Strait of Hormuz, with diplomacy to halt the war showing little sign of progress. The attacks a…",Japan Today,Unknown,News,2026-06-06T08:35:44.246110Z
19464056509015bca05c2ac67333f53f,"Marco Rubio declares Iran war over, citing victory in Operation Epic Fury",https://cryptobriefing.com/rubio-declares-iran-war-over-epic-fury/,Editorial Team,2026-06-03T16:49:31Z,shipping sanctions,"The conclusion of Operation Epic Fury may shift focus to diplomatic efforts, impacting regional stability and global oil markets.
The post Marco Rubio declares Iran war over, citing victory in Operation Epic Fury appeared first on Crypto Briefing.",Crypto Briefing,Global,Market Report,2026-06-06T08:35:44.246173Z
5f448d056f26b7d9a8dde11b538ac358,Chinese firms that help Russia are next for EU sanctions,https://www.politico.eu/article/china-russia-firms-that-help-are-next-for-eu-sanctions/,Nicholas Vinocur,2026-06-03T15:35:19Z,shipping sanctions,Latest move likely to feed into rising tensions between Brussels and Beijing.,POLITICO.eu,China,News,2026-06-06T08:35:44.246231Z
628c53e3524b2c26f72b46bca1d56c26,Putin Allows TotalEnergies to Sell 10% Stake in Arctic LNG 2,https://financialpost.com/pmn/business-pmn/putin-allows-totalenergies-to-sell-10-stake-in-arctic-lng-2-2,Bloomberg News,2026-06-03T15:24:15Z,shipping sanctions,"Russian President Vladimir Putin authorized TotalEnergies SE to sell its stake in a US-sanctioned liquefied natural gas export project in the Arctic, a rare move that will allow the French major to exit a project strangled by western restrictions.",Financial Post,Russia,News,2026-06-06T08:35:44.246257Z
