article_id,title,link,creator,pubdate,category,description,source,country,article_type,scrape_timestamp
d701fc8f268fc259122c43f880062267,Maersk to take steps to resume Red Sea transits,https://www.thehindubusinessline.com/economy/logistics/maersk-to-take-steps-to-resume-red-sea-transits/article70322716.ece,BL Mumbai Bureau,2025-11-25T15:13:29Z,Suez Canal,"Maersk plans to resume Red Sea transits cautiously, prioritizing crew safety after a two-year hiatus due to Houthi attacks.",BusinessLine,Unknown,News,2025-12-01T06:36:58.837680Z
32be8eff411fdae48cfabf8b427d7826,Fake it till you make it,https://www.lrb.co.uk/blog/2025/november/fake-it-till-you-make-it,Erin L. Thompson,2025-11-24T17:55:51Z,Suez Canal,"Jonathan Tokeley-Parry, who died last month, had a business card in the early 1990s that described him as ‘Jonty “Brown Trews” Tokeley: Smuggler...",London Review of Books,Unknown,News,2025-12-01T06:36:58.837715Z
62d73da594feaa7f046e97c50f823a33,A Brief History of Panama,https://everything-everywhere.com/a-brief-history-of-panama/,Gary Arndt,2025-11-30T05:42:07Z,Panama Canal,"Podcast Transcript The country of Panama is best known as the location of the Panama Canal, the waterway that revolutionized international sea transportation. However, there is a lot more to the country. Its history is unlike any other nation in the Americas,…",Everything-everywhere.com,USA,News,2025-12-01T06:36:59.128937Z
be5af4aa28bb58cdd7b05026a631cd14,Caribbean nations lining up to join Trump's bid to stomp out Venezuela narcoregime,https://www.americanthinker.com/blog/2025/11/caribbean_nations_lining_up_to_join_trump_s_bid_to_stomp_out_venezuela_narcoregime.html,,2025-11-30T05:00:00Z,Panama Canal,"As President Trump bears down on Venezuela's Maduro murderous narco-regime, and its witting and unwitting Chavista shills and bots pop out to defend it, the one thing these leftists can't say is that the U.S. is going it a...",Americanthinker.com,Unknown,News,2025-12-01T06:36:59.128996Z
154d51f69dd89be16261d192522f41f1,EU Set to Launch Full Antitrust Probe Into BlackRock–MSC Bid for Barcelona Port Terminal,https://gcaptain.com/eu-set-to-launch-full-antitrust-probe-into-blackrock-msc-bid-for-barcelona-port-terminal/,Reuters,2025-11-28T18:21:57Z,Panama Canal,"BlackRock and MSC's bid for CK Hutchison's terminal at Barcelona port faces a hurdle with EU antitrust regulators set to investigate the Spanish deal, a person with direct knowledge of the matter said on Thursday.",gcaptain.com,Unknown,News,2025-12-01T06:36:59.129049Z
f87a6ce2bcf7500632dfa895a7dd060c,Links 11/27/2025,https://www.nakedcapitalism.com/2025/11/links-11-27-2025.html,Conor Gallagher,2025-11-27T11:55:14Z,Panama Canal,"Our stuffed daily links, including Thanksgving economics, the AI bailout begins, UK budget, and Europe no longer matters.",Nakedcapitalism.com,Unknown,Market Report,2025-12-01T06:36:59.129116Z
722c8843a78a5f99f50f84576e41fa87,NordVPN Black Friday Deal: Unlock 77% off VPN plans in 2025,https://www.bleepingcomputer.com/news/security/nordvpn-black-friday-deal-unlock-77-percent-off-vpn-plans-in-2025/,Ray Walsh,2025-11-26T20:00:37Z,Panama Canal,"The NordVPN Black Friday Deal is now live, and you can get the best discount available: 77% off that applies automatically when you follow our link. If you've been waiting for the right moment to upgrade your online security, privacy, and streaming freedom, t…",BleepingComputer,Unknown,News,2025-12-01T06:36:59.129164Z
b624d6e1bb373b3e43f1dcb580be7543,"How to watch Arsenal vs Bayern Munich: free streams, TV details for Champions League 2025/26 game",https://www.techradar.com/how-to-watch/football/arsenal-vs-bayern-munich-champions-league-2025-26-free,Aatif Sulleyman,2025-11-26T16:00:00Z,Panama Canal,"All the ways to watch Arsenal vs Bayern Munich live streams from anywhere, with England teammates Eberechi Eze and Harry Kane set to light up this UCL tie.",TechRadar,Unknown,News,2025-12-01T06:36:59.129200Z
4c212effe2c7ebdb51a0bed0b331b430,China likely to bid on building new Panama Canal ports,https://www.digitaljournal.com/world/china-likely-to-bid-on-building-new-panama-canal-ports/article,AFP,2025-11-26T04:17:20Z,Panama Canal,"China is among parties interested in bidding to build two new ports on the Panama Canal, its administrator said Tuesday, despite US talk of retaking control of the vital trade route. US President Donald Trump made the threat earlier this year, alleging that C…",Digital Journal,China,News,2025-12-01T06:36:59.129222Z
eea06fa4054c42a8237c5baa43e65333,China likely to bid on building new Panama Canal ports,https://finance.yahoo.com/news/china-likely-bid-building-panama-041637491.html,AFP,2025-11-26T04:16:37Z,Panama Canal,"China is among parties interested in bidding to build two new ports on the Panama Canal, its administrator said Tuesday, despite US talk of retaking control ...",Yahoo Entertainment,China,News,2025-12-01T06:36:59.129238Z
3320ccdd557a34c649267f4ea1ab1098,Adapt or die: Latin America’s response to Trump,https://www.digitaljournal.com/world/adapt-or-die-latin-americas-response-to-trump/article,AFP,2025-11-26T03:07:20Z,Panama Canal,"Latin America has navigated a minefield of economic and military coercion since Donald Trump’s return to the White House. Some leaders have fought back, some acquiesced. Some played possum. No country was left untouched by what many view as a return to US int…",Digital Journal,USA,Analysis/Opinion,2025-12-01T06:36:59.129260Z
16a40e2db63d82ff52eb617b1e347ff8,JACOB CHOE And JAMES CARTER: China’s Interest In Overlooked Part Of Africa Should Alarm US,https://dailycaller.com/2025/11/25/opinion-chinas-interest-in-overlooked-part-of-africa-should-alarm-us-jacob-choe-and-james-carter/,James Carter And Jacob Choe,2025-11-25T23:15:54Z,Panama Canal,"China is moving with speed, discipline, and enormous capital to lock down the world’s most important mineral corridors.",The Daily Caller,China,News,2025-12-01T06:36:59.129280Z
f5ab4b1e71d29f1e9244b437f049af90,31 Florida Cabins & Tiny House Airbnbs (2025 Travel Guide),https://tinyhousetalk.com/florida-cabin-airbnbs-tiny-houses/,Alex,2025-11-25T15:31:19Z,Panama Canal,"If you love tiny homes and cozy cabin getaways, you’re going to love this list! Florida is full of hidden gems—from lakefront A-frames to modern tiny houses in the woods—so we rounded up 31 of the coolest small cabin Airbnbs in the state. These spots are perf…",Tinyhousetalk.com,Unknown,News,2025-12-01T06:36:59.129326Z
b46b962affeedf509ea550a3a1bb0b81,Case Study in Hemispheric Capture: How Beijing Exploited a Corrupt Politician in Panama to Bend a Nation’s Destiny,https://gatewayhispanic.com/2025/11/case-study-hemispheric-capture-how-beijing-exploited-corrupt/,Gateway Hispanic,2025-11-25T01:40:00Z,Panama Canal,"This is a Gateway Hispanic article.
The post Case Study in Hemispheric Capture: How Beijing Exploited a Corrupt Politician in Panama to Bend a Nation’s Destiny appeared first on The Gateway Pundit.",Gatewayhispanic.com,China,News,2025-12-01T06:36:59.129349Z
3c57fbc26719fbdfb0e3073751e8dc45,"2 vacations, 1 flight fare: A first look at Copa Airlines' Panama Stopover program",https://thepointsguy.com/airline/copa-airlines-panama-stopover-program/,Ellie Nan Storck,2025-11-24T14:00:09Z,Panama Canal,Copa Airlines offers travelers a convenient and affordable way to see Panama up close. Here's what to know about Copa Airlines' Panama Stopover program.,The Points Guy,Panama,News,2025-12-01T06:36:59.129379Z
71993a7bc51f30d696e23a972e46d7eb,The Conservative Movement’s Intellectual Collapse,https://www.theatlantic.com/ideas/2025/11/trump-heritage-foundation-carlson-fuentes/685011/,Jonathan Chait,2025-11-24T14:00:00Z,Panama Canal,Trump is both a product and a cause of the decline in intellectual standards on the right.,The Atlantic,Unknown,News,2025-12-01T06:36:59.129412Z
f978b3e08a0d854256afc1c8c8f5731c,Black Friday cruise deals 2025: The ultimate guide,https://thepointsguy.com/cruise/black-friday-cyber-monday-cruise-deals/,Donna Heiderstadt,2025-11-24T13:00:22Z,Panama Canal,"Book a sailing today with these solid holiday sales from cruise lines, and receive fare discounts and extra perks.",The Points Guy,Unknown,News,2025-12-01T06:36:59.129451Z
d529228d5d9184ec98c84a526975e68e,NYTs Calls Trump Strategy in South America “Pragmatic”,https://www.counterpunch.org/2025/11/24/nyts-calls-trump-strategy-in-south-america-pragmatic/,Melvin Goodman,2025-11-24T06:59:05Z,Panama Canal,"There is nothing “pragmatic” about engaging in a conflict where only one side, the United States, is armed, and the factual basis for the conflict is created  out of whole cloth.  It wasn’t pragmatic to create false facts to justify the Mexican-American War, …",CounterPunch,USA,News,2025-12-01T06:36:59.129479Z
77c283f54f15b237fd95ccfe52b6f70a,Impossible Repairs S03 1080p WEB h264-BAE,https://post.rlsbb.to/impossible-repairs-s03-1080p-web-h264-bae/,Lisa,2025-11-24T05:02:54Z,Panama Canal,Host Mike Davidson is on a globetrotting mission to get an up-close look at some of the most incredible machines on Earth and to meet the hard-hat heroes that keep them running. This six-part series will take us from the forests of the Pacific Northwest for a…,Rlsbb.to,Unknown,News,2025-12-01T06:36:59.129525Z
f4d53fda61c2d591acc2bd3bcabe39b2,lululemon Women's Scuba Oversized Half-Zip Hoodie for $79 + free shipping,https://www.dealnews.com/lululemon-Womens-Scuba-Oversized-Half-Zip-Hoodie-for-79-free-shipping/21790594.html,,2025-11-29T11:56:51Z,Black Sea shipping,"lululemon has dropped the price on this half-zip, which is $20 less than the usual special price, and ties the best price we've seen during their Black Friday sale. It is available in Dusty Lilac or Sea Mist at this price. Shipping is free, too. Buy Now at lu…",Dealnews.com,Unknown,News,2025-12-01T06:36:59.430480Z
e269d436700903b1663eec0da735bd3b,Buy Select Lego Toys + 50% off Legoland Ticket from $37.99 + Free Shipping,https://slickdeals.net/f/18897925-buy-select-lego-toys-50-off-legoland-ticket-from-37-99-free-shipping,PennyFound,2025-11-29T01:08:41Z,Black Sea shipping,"Amazon [amazon.com] has Select Lego Toy Sets + 50% off Legoland Ticket from $37.99. Shipping is free.478-Piece LEGO City Fire Rescue Plane Toy [amazon.com] $37.99 
850-Piece LEGO Classic Vibrant Creat",Slickdeals.net,Unknown,News,2025-12-01T06:36:59.430657Z
d69ed02087d8a47135140f5958ce0218,Moment two shadow fleet tankers hit by drones...,https://www.the-sun.com/news/15566130/russian-tankers-sink-drones-hit-crew-evacuated/,Sayan Bose,2025-11-28T23:01:38Z,Black Sea shipping,"Moment two shadow fleet tankers hit by drones...

 
 
 
 (Third column, 3rd story, link)

 

 

 
 Related stories:Trump to recognize occupied Ukraine as part of Russia...
Zelensky chief of staff resigns as corruption investigations widen...

 

 
 
 D…",The-sun.com,Russia,Analysis/Opinion,2025-12-01T06:36:59.430683Z
9bd4398558f97eccda906a3ec251ef30,"Two tankers catch fire in Black Sea after being struck, Turkish authorities report",https://japantoday.com/category/world/a-gambian-flagged-tanker-catches-fire-in-black-sea-and-crew-is-safe,,2025-11-28T21:27:04Z,Black Sea shipping,"Two tankers were struck and caught fire in the Black Sea, prompting rescue operations, Turkish authorities reported Friday. Crew members on board both vessels were reported to be safe. The OpenSanctions database, which tracks people or organizations involved …",Japan Today,Turkey,Market Report,2025-12-01T06:36:59.430720Z
2f9c7ff15f2249a5e672fdc0cdf0a32c,"Tanker hit by blast and fire north of Turkey's Bosphorus strait, agency says",https://www.thestar.com.my/news/world/2025/11/29/tanker-hit-by-blast-and-fire-north-of-turkey039s-bosphorus-strait-agency-says,The Star Online,2025-11-28T16:11:00Z,Black Sea shipping,"ISTANBUL (Reuters) -An explosion and fire broke out in the engine room of a tanker in the Black Sea to the north of Turkey's Bosphorus strait on Friday, shipping agency Tribeca said. Read full story",The Star Online,Turkey,News,2025-12-01T06:36:59.430763Z
0fcfcf82403b8cb3e38b87601474d45c,What to Watch This Week | 9 Recent Works Worth Your Time,https://sspai.me/post/what-to-watch-this-week-9-recent-works-worth-your-time-20251128,kiwi,2025-11-28T14:05:53Z,Black Sea shipping,"☕️ TL;DR Recent highlights worth watching: Stranger Things Season 5 / Final Season (Part 1), Zootopia 2, Taxi Driver Season 3 (K-drama), Such Brave Girls (UK), The Glorious My Life (K-drama), Extended Family Season 2 (US), Train Dreams (film), Salt Road (film…",Sspai.me,Unknown,News,2025-12-01T06:36:59.430830Z
133c7c3ff51b0a2f798bf3cb5ed0e980,Black Friday: The 30 Best Outdoor Deals of 2025,https://hiconsumption.com/gear/best-black-friday-outdoor-deals-2025/,Ethan Brehm,2025-11-28T06:09:52Z,Black Sea shipping,Shop these amazing wilderness wares at their lowest savings of the year.,Hiconsumption.com,Unknown,News,2025-12-01T06:36:59.430927Z
4029fddf3df34f1b645501ed15e61626,Black Friday: The 27 Best Everyday Carry Deals of 2025,https://hiconsumption.com/gear/best-black-friday-edc-deals-2025/,Ethan Brehm,2025-11-28T06:09:40Z,Black Sea shipping,Get quality gear for much less with these amazing deals.,Hiconsumption.com,Unknown,News,2025-12-01T06:36:59.430953Z
c29bf248908f84a7021272a78ca3ddb8,These are the best deals from Canadian brands for Black Friday,https://dailyhive.com/canada/black-friday-deals-canada-brands,Isabelle Docto,2025-11-27T16:51:57Z,Black Sea shipping,"If you're a holiday shopper on a budget, you may want to take advantage of the upcoming Black Friday deals in Canada.This year, Black Friday is on Nov. 28, and if you're looking for amazing deals, why not keep it local and support Canadian brands?From cozy th…",Daily Hive,Unknown,News,2025-12-01T06:36:59.431001Z
4a35d3ac903f36db3e078fff0eb8ee4b,"Nordstrom Black Friday Sale 2025: Up to 60% Off on Madewell, The North Face, Ugg, and More",http://wwd.com/shop/shop-fashion/nordstrom-black-friday-2025-top-fashion-deals-shop-online-1238362917/,Stanislava Datskovska,2025-11-26T17:03:27Z,Black Sea shipping,"Nordstrom's Black Friday deals are live, featuring trending fashion for up to 60% off, from top brands like Madewell and The North Face. Shop here.",WWD,Unknown,News,2025-12-01T06:36:59.431038Z
99a54679db2eb3aeafb4f5d7afe53e46,Manar Abu Dhabi Illuminates a Growing Ecosystem of Creativity and Public Engagement,https://observer.com/2025/11/review-manar-abu-dhabi-2025-khai-hori-jubail-island/,"Elisa Carollo, Elisa Carollo",2025-11-26T16:13:57Z,Black Sea shipping,"The sweeping open-air exhibition stretches from Al Ain’s 400-year-old fort to the mangrove islands of Jubail, recasting the U.A.E.’s cultural landscape through the elemental language of light.",Observer,Unknown,News,2025-12-01T06:36:59.431097Z
694944544603ffbd7b653017fcc503d7,Hands-On With The New Clemence Photic MKII Divers,https://www.fratellowatches.com/hands-on-with-the-new-clemence-photic-mkii-divers/,Michael Stockton,2025-11-26T14:00:00Z,Black Sea shipping,"Admittedly, I don’t try many microbrand watches. I have nothing against them, but I haven’t found many here in the UK. This all changed when I attended the World Time UK event in late September with my buddies Dave (of Fratello fame), Lawrence, and Parm. I sa…",Fratellowatches.com,Unknown,News,2025-12-01T06:36:59.431163Z
22b113f557c3178b265b316884d034ce,"TurkStream Is in Washington and Brussels’ Crosshairs, But Math to Replace the Russian Gas Doesn’t Add Up",https://www.nakedcapitalism.com/2025/11/washington-and-brussels-plan-to-muscle-out-turkstreams-russian-gas-but-math-doesnt-add-up.html,Conor Gallagher,2025-11-26T11:00:55Z,Black Sea shipping,"The latest stop on the natural gas magical mystery tour: Greece, with its imports of American LNG, is declared a “gas hub” that’s going to save Ukraine this winter—and make up for southeastern Europe’s lost TurkStream supply in the future.",Nakedcapitalism.com,USA,News,2025-12-01T06:36:59.431196Z
cc75149d3f2806ed4afde37cb373cb6d,‘This is an Xbox’ now includes Crocs,https://mobilesyrup.com/2025/11/25/xbox-crocs-announced/,Bradly Shankar,2025-11-25T16:34:35Z,Black Sea shipping,"Microsoft has partnered with Crocs on Xbox-branded footwear. Dubbed the “Xbox Classic Clog,” the foam shoes sport a black finish with green Xbox lettering inside. There are also Xbox controller-esque buttons and analogue sticks towards the top of the Crocs. T…",MobileSyrup,Unknown,News,2025-12-01T06:36:59.431401Z
0f681376d770ad13b546d2b9814aeae7,Five reasons Trump's Ukraine plan is deal Putin can't afford to refuse,https://www.foxnews.com/opinion/five-reasons-trumps-ukraine-plan-deal-putin-cant-afford-refuse,,2025-11-24T20:20:16Z,Black Sea shipping,"Trump Special Envoy Witkoff's 28-point Ukraine peace plan emerges from Geneva talks, offering prosperity and military strength but territorial losses remain painful.",Fox News,Ukraine,News,2025-12-01T06:36:59.431425Z
499b016efa831a838975376640a2b5d4,"Let the dancing begin, Pope Alexios (the Infallible), his poor comrades, the Left’s vaudeville, the shop windows and the media",https://en.protothema.gr/2025/11/24/let-the-dancing-begin-pope-alexios-the-infallible-his-poor-comrades-the-lefts-vaudeville-the-shop-windows-and-the-media/,Newsroom,2025-11-24T08:09:43Z,Black Sea shipping,"The Trojan horse of socialism in golden California & Ray Dalio who no longer believes in bitcoin
The post Let the dancing begin, Pope Alexios (the Infallible), his poor comrades, the Left’s vaudeville, the shop windows and the media appeared first on ProtoThe…",Protothema.gr,Unknown,News,2025-12-01T06:36:59.431479Z
67418d9da2710eab2cf64e0020d2f4aa,100 Irish websites for all your Christmas presents: Shopping guide for the festive season,https://www.irishtimes.com/your-money/2025/11/24/100-irish-websites-for-all-your-christmas-presents-shopping-guide-for-the-festive-season/,Conor Pope,2025-11-24T06:00:00Z,Black Sea shipping,"A curated, all-Irish roundup of the best places to shop for gifts — online and on time",The Irish Times,Unknown,News,2025-12-01T06:36:59.431513Z
dce3d0d6cfbb0cd18ae38a6778257b3d,100 Irish websites for all your Christmas presents: Shopping guide for the festive season,https://www.irishtimes.com/your-money/2025/11/26/christmas-shopping-guide-black-friday-presents-gifts/,Conor Pope,2025-11-24T06:00:00Z,Black Sea shipping,"A curated, all-Irish roundup of the best places to shop for gifts — online and on time",The Irish Times,Unknown,News,2025-12-01T06:36:59.431541Z
23c986f4256cfb8e124875022bb476b4,Top 10: Crazy World War 2 Modified Warplanes,https://www.yahoo.com/news/articles/top-10-crazy-world-war-193149456.html,Autocar,2025-11-28T19:31:49Z,Red Sea shipping,Top 10:Crazy World War 2 Modified Warplanes,Yahoo Entertainment,Unknown,News,2025-12-01T06:36:59.755489Z
cf8ce99eb757c9832ab932fa5ba8b6f6,"In Chad, inside camps for Sudan’s refugees",https://www.cbc.ca/radio/frontburner/in-chad-inside-camps-for-sudans-refugees-9.6993775,,2025-11-27T12:30:00Z,Red Sea shipping,Sudan’s civil war is the worst displacement crisis in the world. Michelle Shephard brings us a rare on the ground report from inside two refugee camps near Sudan’s eastern border.,CBC News,Unknown,Market Report,2025-12-01T06:36:59.755835Z
ec638e982d56871219ad6a44cf47c4c1,Beware the Houthi Paradox: Iran's silent surrender makes its last proxy more dangerous,https://www.israelnationalnews.com/news/418421,Amine Ayoub,2025-11-26T20:07:02Z,Red Sea shipping,The Houthis understand that they are now the primary engine for Iran's anti-Israel and anti-US posturing. This gives them immense leverage. Opinion.,Israelnationalnews.com,Unknown,Analysis/Opinion,2025-12-01T06:36:59.755866Z
93fb6ab32b5a773066bb0b3c39a7d6af,A global shipping detour just revealed a hidden climate twist,https://www.sciencedaily.com/releases/2025/11/251125081914.htm,,2025-11-26T08:55:02Z,Red Sea shipping,"Rerouted shipping during Red Sea conflicts accidentally created a massive real-world experiment, letting scientists study how new low-sulfur marine fuels affect cloud formation. The sudden surge of ships around the Cape of Good Hope revealed that cleaner fuel…",Science Daily,Global,News,2025-12-01T06:36:59.756030Z
ef547914803061a818e1ffec8d490273,Tech Support - Army Historian Answers World War II Questions,https://www.wired.com/video/watch/tech-support-wwii-support/,Condé Nast,2025-11-25T17:00:00Z,Red Sea shipping,"Army historian Peter Knight joins WIRED to answer the internet’s burning questions about World War II. What is the timeline of World War II? Who, exactly, were the ‘Ghost Army’ in World War II? How effective were German U-Boats in WW2? What is the Blitzkrieg?…",Wired,Germany,News,2025-12-01T06:36:59.756275Z
f6f5fcd83140656d09e7dd09ed45abc0,"What Happened To The HMHS Britannic, The White Star Line Ship That Sank Four Years After The Titanic?",https://allthatsinteresting.com/hmhs-britannic,Ainsley Brown,2025-11-25T00:00:00Z,Red Sea shipping,"A British ocean liner and sister ship of the Titanic, the Britannic sank after hitting a German naval mine in the Aegean Sea on November 21, 1916.
The post What Happened To The HMHS Britannic, The White Star Line Ship That Sank Four Years After The Titanic? a…",Allthatsinteresting.com,Germany,News,2025-12-01T06:36:59.756370Z
e258773dd5b95a5526513786e4e15f5f,DragonFire laser to be fitted to Royal Navy ships after acing drone-zapping trials,https://www.theregister.com/2025/11/24/royal_navy_dragonfire_laser/,Dan Robinson,2025-11-24T11:05:08Z,Red Sea shipping,"Costs a tenner a shot instead of £1M per anti-aircraft missile
Britain's Royal Navy ships will be fitted with the DragonFire laser weapon by 2027 – five years earlier than planned – following recent successful trials involving fast-moving drones.…<!--#include…",Theregister.com,UK,News,2025-12-01T06:36:59.756418Z
eeee181374f9d7e8ead0c2ed01f80100,Is the Arctic Sea the Key to Ending the Ukraine War?,https://oilprice.com/Energy/Energy-General/Is-the-Arctic-Sea-the-Key-to-Ending-the-Ukraine-War.html,Robert Berke,2025-11-29T22:00:00Z,shipping sanctions,"In a recent article, a professor at the Naval Academy argues that “Trump can leverage the Arctic to end the Ukraine war.” It’s clear that Trump was excited by the possibilities the article raised in ending the war.  Written by Lyle J. Goldstein, a research pr…",OilPrice.com,Ukraine,News,2025-12-01T06:37:00.506609Z
443721d7bed8f907d223b5d5aed2f488,How decades of flashpoints could see Trump soon attack this nation,https://www.abc.net.au/news/2025-11-28/us-venezuela-tension-flashpoints-and-history-explained/106037756,Luke Cooper,2025-11-27T18:52:24Z,shipping sanctions,Tensions between Donald Trump and Venezuelan President Nicolás Maduro Moros have been escalating after months of launching lethal air strikes on vessels accused of shipping deadly drugs north to the US.,ABC News (AU),Unknown,News,2025-12-01T06:37:00.506976Z
68029fc4d6228c51a89a617995c5a722,Leaked wedding video lays bare luxurious lives of Iran’s political elite and highlights hypocrisy of Islamic Republic,https://theconversation.com/leaked-wedding-video-lays-bare-luxurious-lives-of-irans-political-elite-and-highlights-hypocrisy-of-islamic-republic-264942,"Farhang Morady, Reader in International Development, University of Westminster",2025-11-27T13:32:00Z,shipping sanctions,A wedding video which has gone viral in Iran has highlighted the country’s inequality and exposed hypocrisy at the core of the ruling regime.,The Conversation Africa,Unknown,News,2025-12-01T06:37:00.507022Z
e407150672b7c439db68f0c7fa9f368b,"Russia’s ‘shadow vessels’ using false flags to skirt sanctions, report says",https://www.aljazeera.com/economy/2025/11/27/russias-shadow-vessels-using-false-flags-to-skirt-sanctions-report-says,Megha Bahree,2025-11-27T02:26:13Z,shipping sanctions,Centre for Research on Energy says 113 Russian vessels have flown a false flag in the first nine months of 2025.,Al Jazeera English,Russia,Market Report,2025-12-01T06:37:00.507043Z
a2bbc56e651166035f564664dcd5d875,Cubans Watch the Escalating US-Venezuelan Crisis,https://www.thenation.com/article/world/cuba-venezuela-trump-war/,Marc Frank,2025-11-26T14:21:25Z,shipping sanctions,"Marc Frank



For most people on the island, the threat is just one more worry amid a grueling economic crisis.




The post Cubans Watch the Escalating US-Venezuelan Crisis appeared first on The Nation.",Thenation.com,Unknown,News,2025-12-01T06:37:00.507193Z
2524e093ed2a3aeb614236addf4d6b11,India’s crude oil imports from Russia in November 2025 hit a monthly record,https://www.thehindubusinessline.com/economy/indias-crude-oil-imports-from-russia-in-november-2025-hit-a-monthly-record/article70323459.ece,Rishi Ranjan Kala,2025-11-26T07:19:42Z,shipping sanctions,India’s crude oil imports from Russia during November 2025 have averaged at roughly 1.9 million barrels per day (mb/d)—a record high for the month—as refiners topped up on supplies before the US sanctions came into effect.,BusinessLine,India,Market Report,2025-12-01T06:37:00.507385Z
0a45354c2991b18556cceeb35e0bb096,Is Africa's solar power revolution finally happening?,https://www.dw.com/en/is-africas-solar-power-revolution-finally-happening/a-74795571,"David Ehl, Privilege Musvanhiri",2025-11-25T14:50:00Z,shipping sanctions,"Chinese solar equipment has been flooding African markets, partly as a ripple effect of the US-China trade war. It's one of several factors helping the continent gain traction with electrification.",DW (English),China,Market Report,2025-12-01T06:37:00.507444Z
