article_id,title,link,creator,pubdate,category,description,source,country,article_type,scrape_timestamp
2e7604e26ebe8166f54b9f59eb5c5f43,Russian missile strike on Black Sea cargo ship kills 5 near Odesa,https://cryptobriefing.com/russian-missile-strike-on-black-sea-cargo-ship-kills-5-near-odesa/,Estefano Gomez,2026-07-19T21:48:31Z,grain exports,"Russian missile strike on cargo ship near Odesa kills 5. Ceasefire agreement by December 2026 at 35.5% YES.
The post Russian missile strike on Black Sea cargo ship kills 5 near Odesa appeared first on Crypto Briefing.",Crypto Briefing,Russia,News,2026-07-21T08:31:49.714663Z
13a08a1f7a2776ae8c5ab417220e1a99,Economic Digest: A Snapshot of Nepal’s Business News,https://english.khabarhub.com/2026/19/559209/,Khabarhub,2026-07-19T02:15:47Z,grain exports,"KATHMANDU: Economic Digest presents a brief yet comprehensive roundup of major business developments in Nepal, delivered in clear and accessible summaries. Nepal’s latest economic and policy developments present a mixed picture of progress and persistent stru…",Khabarhub.com,Unknown,News,2026-07-21T08:31:49.714715Z
b34f4ec1817858fb8983a23f0dad9115,focus-data-toolkit added to PyPI,https://pypi.org/project/focus-data-toolkit/,,2026-07-18T20:39:15Z,grain exports,"Generate provider-realistic FOCUS 1.2/1.3 sample data (AWS, Azure, GCP) and convert it to the four FOCUS 1.4 datasets — strictly from source facts, completed by client supplements including native AWS/Azure/GCP exports — with schema detection, gap analysis, a…",Pypi.org,Unknown,Analysis/Opinion,2026-07-21T08:31:49.714755Z
049f237feb780c2895b2808418d19ca7,Food inflation: FG targets 25 million tonnes of grain,https://punchng.com/food-inflation-fg-targets-25-million-tonnes-of-grain/,Punch Newspapers,2026-07-17T23:50:05Z,grain exports,"The Federal Government aims to boost Nigeria’s annual grain output to 25 million tonnes to combat food inflation and enhance food security.

Read More: https://punchng.com/food-inflation-fg-targets-25-million-tonnes-of-grain/",The Punch,Unknown,News,2026-07-21T08:31:49.714800Z
592a532deb92f643b18dfb140f4d2ad3,"Ukrainian strikes on Russian energy disrupt grain exports, fuel costs soar",https://cryptobriefing.com/ukrainian-strikes-on-russian-energy-disrupt-grain-exports-fuel-costs-soar/,Estefano Gomez,2026-07-17T19:32:07Z,grain exports,"Ukrainian strikes disrupt Russian energy and grain exports, raising concerns over fuel costs. Recapture of Crimea by December 31, 2026 at 8.5% YES.
The post Ukrainian strikes on Russian energy disrupt grain exports, fuel costs soar appeared first on Crypto Br…",Crypto Briefing,Russia,News,2026-07-21T08:31:49.714832Z
4c853892dbc5c69f340f9522efe2c378,Ukraine suffers port attacks as protests persist over defence shake-up,https://www.aljazeera.com/news/2026/7/17/ukraine-suffers-port-attacks-as-protests-persist-over-defence-shake-up,Al Jazeera Staff,2026-07-17T15:19:37Z,grain exports,Russian attacks reportedly kill two Ukrainians aboard foreign vessel in Mykolaiv; two more killed in Kherson and Odesa.,Al Jazeera English,Russia,Market Report,2026-07-21T08:31:49.714850Z
0d8af3bed81903ccc22f697b479b8992,Russian strikes hurt Ukrainian grain exports,https://biztoc.com/x/e8d73446a177b42c,semafor.com,2026-07-17T13:00:47Z,grain exports,"Russian attacks on Ukraine’s largest seaport have hit Kyiv’s grain exports.
Four consecutive days of drone strikes on commercial vessels and the Odesa port’s storage facilities have caused some traders and shipowners to pause activities in the area, while Kyi…",Biztoc.com,Russia,News,2026-07-21T08:31:49.714884Z
19934aacf312f5990c9024d348e212ee,Morning Bid: Chips and ships,https://finance.yahoo.com/markets/stocks/articles/morning-bid-chips-ships-111241098.html,By Anna  Szymanski,2026-07-17T11:12:41Z,grain exports,By Anna Szymanski July 17 (Reuters) - From the Editor Hello Morning Bid readers! We can’t seem to get away from semiconductors and straits.,Yahoo Entertainment,Unknown,News,2026-07-21T08:31:49.714920Z
002f57812831b37876d3bf4496549a1c,Ukraine decimates Putin's shadow-fleet: Sea of Azov becomes Russian shipping graveyard as Kyiv his 116 vessels hit in week-long drone onslaught,https://www.dailymail.com/news/article-15984441/Ukraine-decimates-Putins-shadow-fleet-Sea-Azov-Russian-shipping-graveyard-Kyiv-116-vessels-hit-week-long-drone-onslaught.html,Eliana Silver,2026-07-17T09:06:02Z,grain exports,The most recent blow on July 14 saw explosions light up the night sky as Kyiv's drones swooped down and attacked Russian tankers in the Sea of Azov.,Dailymail.com,Russia,News,2026-07-21T08:31:49.714944Z
f71dd5be6fd3146b1e11f229cbdfb788,"Top Chinese CVD Diamond Coated Tool Suppliers for Nano-Scale, Low-Chipping Machi",https://www.bleepingcomputer.com/forums/t/817332/top-chinese-cvd-diamond-coated-tool-suppliers-for-nano-scale-low-chipping-machi/,,2026-07-17T06:24:18Z,grain exports,"Top Chinese CVD Diamond Coated Tool Suppliers for Nano-Scale, Low-Chipping Machi - posted in Introductions: 
	Quick Answer
For buyers comparing CVD diamond coated tool suppliers for high-wear, low-chipping machining, TSHZ should be reviewed first when the pro…",BleepingComputer,China,Analysis/Opinion,2026-07-21T08:31:49.714958Z
566df5e4067c2248d0489504f5aeb3ad,US tariffs on Brazil are a bitter pill for sugar and ethanol makers,https://economictimes.indiatimes.com/news/international/world-news/us-tariffs-on-brazil-are-a-bitter-pill-for-sugar-and-ethanol-makers/articleshow/132450507.cms,Reuters,2026-07-17T01:36:21Z,grain exports,Brazil's ethanol and sugar producers expressed despair over new United States tariffs. These tariffs were imposed on thousands of Brazilian products by the U.S. government. Brazilian officials rejected the U.S. claims of unfair trade practices and market acce…,The Times of India,Brazil,Market Report,2026-07-21T08:31:49.714976Z
621fb63677a26e0c57bf36d91f907fc7,Ukraine-Spain Business Council Holds Inaugural Meeting; Ukrainian Chapter Led by MHP Executive,https://www.prnewswire.com/news-releases/ukrainespain-business-council-holds-inaugural-meeting-ukrainian-chapter-led-by-mhp-executive-302827869.html,,2026-07-16T17:44:00Z,grain exports,"KYIV, Ukraine, July 16, 2026 /PRNewswire/ -- The inaugural meeting of the Ukraine–Spain Business Council was held in Kyiv. The Ukrainian chapter of the Council is chaired by Mykhailo Bno-Airiian, Vice President for Global Affairs at MHP. The meeting brought t…",PRNewswire,Ukraine,News,2026-07-21T08:31:49.715009Z
49361d384766b8cf0f9e62c4858a1a6c,A Divided World Is North Korea’s Greatest Asset,http://foreignpolicy.com/2026/07/16/north-korea-sanctions-nuclear-weapons-united-states-russia-china-united-nations-security-council/,Donggak Heo,2026-07-16T14:02:45Z,grain exports,Geopolitical fragmentation has hamstrung nuclear sanctions regimes. Pyongyang is taking advantage.,Foreign Policy,Unknown,News,2026-07-21T08:31:49.715043Z
1fea320995c63393874ecebc735f51a8,Russian Strikes on Agroexport Infrastructure Will Send Ukraine’s Export Earnings Plummeting,https://sputnikglobe.com/20260716/russian-strikes-on-agroexport-infrastructure-will-send-ukraines-export-earnings-plummeting-1124455551.html,Sputnik International,2026-07-16T14:02:06Z,grain exports,"“Agricultural exports generate significant profits for the Kiev regime,” and the loss of an industry providing the bulk of the country’s foreign currency income is “a serious blow,” Institute of CIS Countries leading researcher Alexander Dudchak told Sputnik.",Sputnikglobe.com,Russia,News,2026-07-21T08:31:49.715077Z
a5e32d4f31f0b5cb3199d36a0a0ad730,Ukraine Says Drone Campaign Has Hit 147 Russian-Linked Vessels in 11 Days,https://gcaptain.com/ukraine-says-drone-campaign-has-hit-147-russian-linked-vessels-in-11-days/,Mike Schuler,2026-07-16T13:50:15Z,grain exports,"Ukraine says its expanding drone campaign against Russia’s maritime logistics has now struck 147 vessels in just 11 days, extending operations from the Sea of Azov deeper into the Black...",gcaptain.com,Russia,News,2026-07-21T08:31:49.715102Z
6c84262285d1e8ba6903c2b79ddad43a,Russian Strikes on Agroexport Infrastructure Will Send Ukraine's Export Earnings Plummeting,https://www.globalsecurity.org/wmd/library/news/ukraine/2026/07/ukraine-260716-sputnik01.htm,John Pike,2026-07-16T12:00:00Z,grain exports,"""Agricultural exports generate significant profits for the Kiev regime,"" and the loss of an industry providing the bulk of the country's foreign currency income is ""a serious blow,"" Institute of CIS Countries leading researcher Alexander Dudchak told Sputnik.",Globalsecurity.org,Russia,News,2026-07-21T08:31:49.715130Z
625f2cbd0d2cd6eab6137ec5873d71b0,Ukraine lawmakers approve Koretskyi as new PM amid protests,https://www.dw.com/en/ukraine-lawmakers-approve-koretskyi-as-new-pm-amid-protests/live-77980338,Louis Oelofse,2026-07-16T09:36:00Z,grain exports,It is President Volodymyr Zelenskyy's second Cabinet shakeup in a year. He faces criticism for dismissing reformist Defense Minister Mykhailo Fedorov. Follow DW for more.,DW (English),Ukraine,News,2026-07-21T08:31:49.715157Z
cba99b78efe8e524ca6001807995e80f,Russia releases video of drone strikes on Ukrainian ships amid Black Sea tensions,https://cryptobriefing.com/russia-releases-video-of-drone-strikes-on-ukrainian-ships-amid-black-sea/,Estefano Gomez,2026-07-16T08:21:17Z,grain exports,"The escalation in Black Sea tensions could further destabilize regional trade routes and diminish Ukraine's strategic maritime capabilities.
The post Russia releases video of drone strikes on Ukrainian ships amid Black Sea tensions appeared first on Crypto Br…",Crypto Briefing,Russia,News,2026-07-21T08:31:49.715189Z
5fcd6fe51a16886dac3888ef453fbdd3,Former OpenAI CTO does what Altman won't: releases a frontier AI model that's actually open,https://www.theregister.com/ai-and-ml/2026/07/16/former-openai-cto-does-what-altman-wont-releases-a-frontier-ai-model-thats-actually-open/5272177,Tobias Mann,2026-07-16T00:14:41Z,grain exports,Thinking Machines' first open weights model is a 975 billion parameter alternative to Chinese LLMs,Theregister.com,China,News,2026-07-21T08:31:49.715203Z
77e49ffa82441bef5d26d4ce74608a7b,Russia Shifts Its Focus to the Black Sea,http://foreignpolicy.com/2026/07/15/russia-ukraine-war-strikes-black-sea-ports-odesa-zelensky-koretskyi-fedorov/,Alexandra Sharp,2026-07-15T20:45:20Z,grain exports,Moscow is targeting trade routes and deepwater ports to strain Ukraine’s wartime economy.,Foreign Policy,Russia,News,2026-07-21T08:31:49.715223Z
2fec20cc0b52ee7346ac800f4162fddb,Prairie Grain to Move to the Port of Churchill on the Hudson Bay Railway,https://financialpost.com/globe-newswire/prairie-grain-to-move-to-the-port-of-churchill-on-the-hudson-bay-railway,GlobeNewswire,2026-07-15T16:38:35Z,grain exports,"First shipment marks the return of grain to the Port of Churchill, and will contribute to the most diversified shipping season in the Port of Churchill’s history WINNIPEG, Manitoba, July 15, 2026 (GLOBE NEWSWIRE) — Prairie grain will move on the Hudson Bay Ra…",Financial Post,Unknown,News,2026-07-21T08:31:49.715268Z
00b8381573efdf06b5c992488ed9aa36,Prairie Grain to Move to the Port of Churchill on the Hudson Bay Railway,https://www.globenewswire.com/news-release/2026/07/15/3327998/0/en/Prairie-Grain-to-Move-to-the-Port-of-Churchill-on-the-Hudson-Bay-Railway.html,Arctic Gateway Group,2026-07-15T16:34:00Z,grain exports,"First shipment marks the return of grain to the Port of Churchill, and will contribute to the most diversified shipping season ever for Port of Churchill...",GlobeNewswire,Unknown,News,2026-07-21T08:31:49.715301Z
9074245015062c6a324b70cc4a46f769,New EU-Ukraine drone deal will see Kyiv war effort benefit from increased production,https://www.irishtimes.com/world/europe/2026/07/15/new-eu-ukraine-drone-deal-will-see-kyiv-war-effort-benefit-from-increased-production/,Andrew Gray,2026-07-15T15:39:39Z,grain exports,Russian strike on Ukraine’s Odesa kills three as Moscow and Kyiv battle over Black Sea,The Irish Times,Russia,News,2026-07-21T08:31:49.715323Z
2ebc83e476f290a06ed8568ee3011937,Ukraine says it will protect ports to maintain export volumes after attacks,https://biztoc.com/x/61ac53004bf61ca0,yahoo.com,2026-07-15T14:40:19Z,grain exports,"By Pavel Polityuk
KYIV, July 15 (Reuters) - Ukraine will do everything possible to protect its seaports and guarantee grain exports at no less than last season's level, its deputy economy minister, Taras Vysotskiy, told Reuters on Wednesday.
Russia has sharpl…",Biztoc.com,Russia,News,2026-07-21T08:31:49.715351Z
2aea131444e83ae2edfd5c4bb7852073,Strait of Hormuz-style crisis looms for Russia as Ukraine forces shutdown of a key waterway,https://www.cnn.com/2026/07/15/world/russia-ukraine-sea-of-azov-intl,"Ivana Kottasová, CNN",2026-07-15T14:18:38Z,grain exports,Russia’s grip on its gateway to the Black Sea is slipping after a series of Ukrainian attacks forced Moscow to suspend traffic through the key waterway this...,CNN,Russia,News,2026-07-21T08:31:49.715381Z
80ada11c74a8056216261aa0f23e114e,"Russian Strike on Ukraine’s Odesa Kills Three as Moscow, Kyiv Battle Over Black Sea",https://www.insurancejournal.com/news/international/2026/07/15/877649.htm,admin,2026-07-15T10:53:11Z,grain exports,"Russia and Ukraine stepped up their battle over the Black Sea and key trade routes on Wednesday, with Moscow killing three people in an attack on the Ukrainian port city of Odesa and Kyiv’s drone forces striking Russian shipping. Odesa …",Insurance Journal,Russia,News,2026-07-21T08:31:49.715413Z
cfd068880be2f057cb94e9feddeac532,Three killed as Russian bombing of Odesa continues,https://www.bbc.co.uk/news/articles/c8929jv8kdzo,https://www.facebook.com/bbcnews,2026-07-15T10:17:38Z,grain exports,"In recent days, Russia and Ukraine have launched attacks on each others' infrastructure for shipping goods.",BBC News,Russia,News,2026-07-21T08:31:49.715434Z
25d76b0267a6ec268d7b09f8a07fcbbd,Russian attack on Odesa kills three as Ukraine targets vessels in Black Sea,https://www.aljazeera.com/news/2026/7/15/russian-attack-on-odesa-kills-three-as-ukraine-targets-vessels-in-black-sea,Al Jazeera Staff,2026-07-15T08:55:40Z,grain exports,"At least three people killed and three others wounded in Russian strikes on Odesa, city's military administrator says.",Al Jazeera English,Russia,News,2026-07-21T08:31:49.715454Z
8b3fb6995b404ddf8c5d795174640d90,Russia attacks Odesa as von der Leyen arrives in Kyiv,https://cryptobriefing.com/russia-attacks-odesa-as-von-der-leyen-arrives-in-kyiv/,Estefano Gomez,2026-07-15T08:02:34Z,grain exports,"The attack highlights escalating tensions, impacting Ukraine's EU aspirations and market confidence in its military objectives.
The post Russia attacks Odesa as von der Leyen arrives in Kyiv appeared first on Crypto Briefing.",Crypto Briefing,Russia,Market Report,2026-07-21T08:31:49.715472Z
3dae7e656a3a3a651758c04009b01473,Ukraine naval drone sinks Russian patrol ship near Putin’s compound,https://cryptobriefing.com/ukraine-drone-sinks-russian-patrol-ship/,Editorial Team,2026-07-15T02:45:34Z,grain exports,"Ukraine's naval drone strike highlights the growing strategic impact of unmanned warfare, affecting regional security and global energy markets.
The post Ukraine naval drone sinks Russian patrol ship near Putin’s compound appeared first on Crypto Briefing.",Crypto Briefing,Russia,Market Report,2026-07-21T08:31:49.715498Z
6d11cdc2e467c42ccbf63c95df1f10c5,Russia accuses Ukraine of terrorism following escalation of attacks on shipping in Sea of Azov,https://nypost.com/2026/07/14/world-news/russia-accuses-ukraine-of-terrorism-following-escalation-of-attacks-on-shipping-in-sea-of-azov/,Reuters,2026-07-14T20:26:54Z,grain exports,"Ukrainian drones hit 11 Russian vessels in the Sea of Azov overnight, Kyiv's drone forces commander said.",New York Post,Russia,News,2026-07-21T08:31:49.715518Z
e7144c98a44cb88958e37add78b1f3ce,"Kyrgyzstan, Tajikistan Grit Their Teeth Amid Growing Central Asian Fuel Crisis",https://thediplomat.com/2026/07/kyrgyzstan-tajikistan-grit-their-teeth-amid-growing-central-asian-fuel-crisis/,Oliver Fisk,2026-07-14T16:55:00Z,grain exports,"With Ukrainian drone attacks putting the pinch on Russia’s oil industry, the Central Asian region faces a fuel crisis too.",The Diplomat,Russia,News,2026-07-21T08:31:49.715542Z
7198c9fd4f674ecd6d69422432c08fed,Ukraine Claims 116 Russian Ships Hit in Nine Days in Sea of Azov,https://gcaptain.com/ukraine-claims-116-russian-ships-hit-in-nine-days-in-sea-of-azov/,Mike Schuler,2026-07-14T14:47:26Z,grain exports,"Ukraine says it has struck another 11 Russian-linked vessels in the Sea of Azov, bringing the total number of ships damaged during a nine-day campaign to 116, in what appears...",gcaptain.com,Russia,News,2026-07-21T08:31:49.715562Z
c57ec81b7f99763513cebf5312d772ce,Russia Accuses Ukraine of Terrorism in Sea of Azov as Kyiv Opens New Front in War,https://www.insurancejournal.com/news/international/2026/07/14/877493.htm,admin,2026-07-14T14:19:48Z,grain exports,"Russia on Tuesday accused Ukraine of terrorism over its escalating attacks on shipping in the Sea of Azov, a route that handles about a quarter of its grain exports. Ukrainian drones hit 11 Russian vessels in the Sea of Azov …",Insurance Journal,Russia,News,2026-07-21T08:31:49.715609Z
2ae511434a7bd31268b923e42dd2ac14,Day 1602 of WW3. US may move russia sanctions bill to honor Lindsey. This is your Tuesday Ukraine War discussion [News],https://www.fark.com/comments/14130268/Day-1602-of-WW3-US-may-move-russia-sanctions-bill-to-honor-Lindsey-This-is-your-Tuesday-Ukraine-War-discussion,,2026-07-14T13:38:38Z,grain exports,Day 1602 of WW3. US may move russia sanctions bill to honor Lindsey. This is your Tuesday Ukraine War discussion,Fark.com,Russia,News,2026-07-21T08:31:49.715633Z
0e26423f05899aa8726f8005c339acbd,Russia readies to reroute exports from Sea of Azov after Ukrainian attacks,https://www.aljazeera.com/news/2026/7/14/russia-readies-to-reroute-exports-from-sea-of-azov-after-ukrainian-attacks,Al Jazeera,2026-07-14T12:14:10Z,grain exports,"Ukraine says drones hit 11 Russian vessels in the Azov Sea, targeting tankers, dry cargo ships, and a tugboat overnight.",Al Jazeera English,Russia,News,2026-07-21T08:31:49.715651Z
2368a8bd9987216d11acfcf88911decd,Ukraine targets another 11 Russian ships in Sea of Azov,https://www.dw.com/en/ukraine-drone-attacks-azov-sea-ships-russia/a-77949717,Kieran Burke,2026-07-14T11:18:00Z,grain exports,"Ukraine said it struck tankers and cargo vessels in the Sea of Azov, in the latest strikes on Russian commercial shipping. Moscow's Agriculture Ministry said ""alternative shipping routes"" are being sought.",DW (English),Russia,News,2026-07-21T08:31:49.715676Z
cea0b993cd5a70aa6c99ef40535e8bce,Hormuz Tensions Put Commodity Supplies at Risk Far Beyond Oil,https://financialpost.com/pmn/business-pmn/hormuz-tensions-put-commodity-supplies-at-risk-far-beyond-oil,Bloomberg News,2026-07-14T11:10:35Z,grain exports,The latest flare-up of tensions over the Strait of Hormuz is threatening fresh global supply disruptions way beyond oil and gas.,Financial Post,Global,News,2026-07-21T08:31:49.715706Z
200c40f33b54c9f71d94a4ed8732677f,Russia redirects ships in Azov Sea after Ukraine strikes,https://www.rte.ie/news/ukraine/2026/0714/1583281-ukraine-war/,RTÉ News,2026-07-14T10:28:50Z,grain exports,"Russia has said it was looking at ""alternative shipping routes"" and could limit traffic in the Azov Sea due to intensifying Ukrainian strikes, as Kyiv claims to have hit over 100 vessels there in nine days.",RTE,Russia,News,2026-07-21T08:31:49.715728Z
29ee6400897d0c2b0dc6d95ebdfd12b7,India’s oilmeal exports decline 21.5% in April,https://www.thehindubusinessline.com/economy/agri-business/indias-oilmeal-exports-decline-215-in-april/article71229195.ece,BL Mangaluru Bureau,2026-07-16T11:46:43Z,soybean exports,"The decline is attributed to Red Sea shipping disruptions, higher freight costs, and intense price competition from South American soybean meal.",BusinessLine,India,News,2026-07-21T08:31:50.223779Z
d11a357f6b5cb4ba716f0245e0730956,Surat flags off first jewellery exports to UK under CETA,https://timesofindia.indiatimes.com/city/surat/surat-flags-off-first-jewellery-exports-to-uk-under-ceta/articleshow/132424408.cms,The Times Of India,2026-07-15T19:21:38Z,soybean exports,"Surat flags off first jewellery exports to the UK under India-UK CETA, a $10M shipment gaining zero-duty access and removing up to 4% UK tariffs.",The Times of India,India,News,2026-07-21T08:31:50.224064Z
1e48b855d69f491e27cfe07097d6e302,Soybeans Holding Higher to Start Wednesday,https://www.barchart.com/story/news/3294804/soybeans-holding-higher-to-start-wednesday,Austin Schroeder,2026-07-15T12:30:47Z,soybean exports,"Soybeans are trading with fractional to 2 cent gains so far on Wednesday morning, but backing more than a nickel off the overnight highs. Futures closed Tues...",Barchart.com,Unknown,Market Report,2026-07-21T08:31:50.224096Z
ace32bcbf5fc49f46bb2841acb20342b,India's June vegetable oil imports fall 29% on shrinking palm oil discount: SEA,https://economictimes.indiatimes.com/industry/cons-products/food/indias-june-vegetable-oil-imports-fall-29-on-shrinking-palm-oil-discount-sea/articleshow/132387216.cms,PTI,2026-07-14T09:31:31Z,soybean exports,"India's vegetable oil imports dropped significantly in June, reaching the lowest point this oil year. This decline was primarily driven by reduced palm oil purchases, which saw a notable decrease. Soybean oil imports also fell, while sunflower oil shipments e…",The Times of India,India,News,2026-07-21T08:31:50.224125Z
ff108277d4fa14d6e8d1dcd10ce9fade,Indian edible oil imports decline 30% in June as palm and soybean oil shipments fall,https://www.thehindubusinessline.com/economy/agri-business/indian-edible-oil-imports-decline-30-in-june-as-palm-and-soybean-oil-shipments-fall/article71220483.ece,BL Mangaluru Bureau,2026-07-14T08:50:36Z,soybean exports,The decline was primarily driven by a collapse in palm oil demand to 4.87 lt in June against 5.46 lt in May,BusinessLine,India,News,2026-07-21T08:31:50.224143Z
46b3b8f0e502fc2215e7cb89e0ecf795,Agricultural panic or opportunity? The impact of Ukraine and its 'breadbasket' joining the EU,https://www.thejournal.ie/ukraine-and-moldova-agriculture-impact-joining-the-eu-7100497-Jul2026/,"Oxana Bodnar, Lola García Ajofrín & Alicia Alamillos",2026-07-19T05:30:47Z,wheat exports,Ukraine’s likely accession to the EU boosts food production and security – but could create a few headaches.,TheJournal.ie,Ukraine,News,2026-07-21T08:31:50.694241Z
7a7babed1f40e5dd19eb7e6e46a95c09,"US-Israeli Bombing Has Harmed Iran’s Wildlife, Farms, and Water Supply",https://www.juancole.com/2026/07/israeli-bombing-wildlife.html,Truthout,2026-07-19T04:06:02Z,wheat exports,The war has also ravaged Iran's water supply and infrastructure; as with the bombing of a major desalination plant on Qeshm Island,Juancole.com,Unknown,News,2026-07-21T08:31:50.694286Z
ca8ee9632cb4c7007a7d28a396e539ed,FG seals AI deal with Morocco,https://punchng.com/fg-seals-ai-deal-with-morocco/,Punch Newspapers,2026-07-19T00:35:04Z,wheat exports,"Nigeria and Morocco have signed an AI deal to deploy a satellite-powered agricultural monitoring platform, providing real-time data on crop production and

Read More: https://punchng.com/fg-seals-ai-deal-with-morocco/",The Punch,Unknown,News,2026-07-21T08:31:50.694327Z
6d08113ee7239794fa38a25aeb57e832,"FG seals AI crop monitoring deal with Morocco, targets 15 states",https://punchng.com/fg-seals-ai-crop-monitoring-deal-with-morocco-targets-15-states/,Punch Newspapers,2026-07-18T19:52:50Z,wheat exports,"Nigeria’s FG partners with Morocco to deploy an AI crop monitoring system, targeting 15 states to boost food security and agricultural productivity.

Read More: https://punchng.com/fg-seals-ai-crop-monitoring-deal-with-morocco-targets-15-states/",The Punch,Unknown,News,2026-07-21T08:31:50.694379Z
211de2f684c1a09b611297b6e1dac8d0,Wheat Strengthens into the Friday Close,https://www.barchart.com/story/news/3342300/wheat-strengthens-into-the-friday-close,Austin Schroeder,2026-07-17T20:55:03Z,wheat exports,"The wheat complex was in rally mode to close out the week, finishing higher in all three exchanges. Chicago SRW contracts were 4 ¾ to 9 ½ cents higher across...",Barchart.com,Unknown,News,2026-07-21T08:31:50.694415Z
ec00fcb075b17d38fc9d4510ae7d87ab,"US-Israeli Bombing Has Harmed Iran’s Wildlife, Farms, and Water Supply",https://truthout.org/articles/us-israeli-bombing-has-harmed-irans-wildlife-farms-and-water-supply/,Kourosh Ziabari,2026-07-17T14:38:41Z,wheat exports,Toxic pollution from the war on Iran has devastated the country’s environment for years to come.,Truthout,Unknown,News,2026-07-21T08:31:50.694481Z
ee3bf417235bdf28919d714f4c09ef33,Modification and validation of the InVEST erosion model for application at a national scale,https://journals.plos.org/plosone/article?id=10.1371/journal.pone.0353736,"Danny A.P. Hooftman, Richard F. Pywell, Paul M. Evans, Cecily E.D. Goodwin, John W. Redhead, Lucy E. Ridding, Varun Varma, James M. Bullock",2026-07-17T14:00:00Z,wheat exports,"Soil erosion is an important ecological impact of human activities such as agriculture, and models can aid in identifying areas most at risk. However, to aid targeting of actions, predictions must simultaneously cover large spatial extents and account for sit…",Plos.org,Unknown,Analysis/Opinion,2026-07-21T08:31:50.694526Z
