article_id,title,link,creator,pubdate,category,description,source,country,article_type,scrape_timestamp
56228e8ce2cb517d1cd7708f63675bf6,"How to watch Crystal Palace vs Manchester United: live stream Premier League 2025/26 game, TV channels, preview",https://www.techradar.com/how-to-watch/football/how-to-watch-crystal-palace-vs-manchester-united-live-stream-premier-league-2025-26-game-tv-channels-preview,Adrian Back,2025-11-30T08:00:00Z,Panama Canal,All the ways to watch Crystal Palace vs Manchester United live streams online and from anywhere as the Eagles look to inflict another loss on United.,TechRadar,Unknown,Analysis/Opinion,2025-12-05T18:30:37.264028Z
62d73da594feaa7f046e97c50f823a33,A Brief History of Panama,https://everything-everywhere.com/a-brief-history-of-panama/,Gary Arndt,2025-11-30T05:42:07Z,Panama Canal,"Podcast Transcript The country of Panama is best known as the location of the Panama Canal, the waterway that revolutionized international sea transportation. However, there is a lot more to the country. Its history is unlike any other nation in the Americas,…",Everything-everywhere.com,USA,News,2025-12-05T18:30:37.264059Z
be5af4aa28bb58cdd7b05026a631cd14,Caribbean nations lining up to join Trump's bid to stomp out Venezuela narcoregime,https://www.americanthinker.com/blog/2025/11/caribbean_nations_lining_up_to_join_trump_s_bid_to_stomp_out_venezuela_narcoregime.html,,2025-11-30T05:00:00Z,Panama Canal,"As President Trump bears down on Venezuela's Maduro murderous narco-regime, and its witting and unwitting Chavista shills and bots pop out to defend it, the one thing these leftists can't say is that the U.S. is going it a...",Americanthinker.com,Unknown,News,2025-12-05T18:30:37.264105Z
154d51f69dd89be16261d192522f41f1,EU Set to Launch Full Antitrust Probe Into BlackRock–MSC Bid for Barcelona Port Terminal,https://gcaptain.com/eu-set-to-launch-full-antitrust-probe-into-blackrock-msc-bid-for-barcelona-port-terminal/,Reuters,2025-11-28T18:21:57Z,Panama Canal,"BlackRock and MSC's bid for CK Hutchison's terminal at Barcelona port faces a hurdle with EU antitrust regulators set to investigate the Spanish deal, a person with direct knowledge of the matter said on Thursday.",gcaptain.com,Unknown,News,2025-12-05T18:30:37.264155Z
642ad8ff09712e6406f8bc141842e38e,"Antigravity A1 drone officially released with 8K 360 video, just weeks before DJI drones are banned in the US",https://photorumors.com/2025/12/04/antigravity-a1-drone-announced-with-8k-360-video/,PR admin,2025-12-04T17:28:12Z,Black Sea shipping,"The Antigravity A1 drone by Insta360 with 8K 360 video is now officially released (see previous coverage), just weeks before DJI drones are banned in the US (December 23rd): DJI drones will be banned in the US next month – here is your last chance to get one …",Photorumors.com,Unknown,News,2025-12-05T18:30:37.646017Z
d517fcc3e3adc8e332772f99a65598c1,"Will Hegseth Go? Defense Secretary Faces Anger from Congress over Boat Strikes, Signal Chat",https://www.democracynow.org/2025/12/4/matt_duss,webdev@democracynow.org (Democracy Now!),2025-12-04T13:12:00Z,Black Sea shipping,"“Pete Hegseth, much like the president he serves, sees himself as, essentially, above the law, as unconstrained by legal procedure.” Foreign policy analyst Matt Duss discusses the brewing conflict within the Trump administration over the leadership of Defense…",Democracy Now!,Unknown,News,2025-12-05T18:30:37.646083Z
49257fb5c295b1cf7d533fed4838c158,Air Jordan 4 ‘Black Cat’ Sneakers Scored Big on StockX This Weekend + More Shoes That Won the Shopping Holiday,http://wwd.com/footwear-news/sneaker-news/jordan-4-black-cat-stockx-cyber-weekend-top-shoes-1238370713/,Stephen Garner,2025-12-03T19:17:09Z,Black Sea shipping,The Air Jordan 4 'Black Cat' sneaker was the best-selling product on Cyber Weekend and the biggest Black Friday sneaker release in StockX history.,WWD,Unknown,News,2025-12-05T18:30:37.646392Z
3e02668a4b60e159c872ced7ae49d3ff,Turkish Shipping Company Ends Russia-Linked Voyages After Tanker Explosions - The Moscow Times,https://slashdot.org/firehose.pl?op=view&amp;id=180276587,feedfeeder,2025-12-03T19:13:23Z,Black Sea shipping,"Turkish Shipping Company Ends Russia-Linked Voyages After Tanker ExplosionsThe Moscow Times Turkey's Erdogan says attacks on Black Sea commercial ships unacceptableReuters A third Russian tanker attacked in the Black Sea, Turkish authority saysAP News Turkish…",Slashdot.org,Russia,News,2025-12-05T18:30:37.646421Z
6f5ada29aeb8d2a149bb322e2fa0bad4,Turkey discusses Black Sea safety with NATO after attacks on Russian ships - Reuters,https://slashdot.org/firehose.pl?op=view&amp;id=180275051,feedfeeder,2025-12-03T15:52:59Z,Black Sea shipping,Turkey discusses Black Sea safety with NATO after attacks on Russian shipsReuters Russian tanker struck off Turkiye as Ukraine targets ‘shadow fleet’Al Jazeera Putin Warns Russia May Hit Ukraine Allies’ Ships If Attacks LastBloomberg.com Ukraine’s naval drone…,Slashdot.org,Russia,News,2025-12-05T18:30:37.646476Z
f70f84e949743cfd73db083b0df0d384,Putin threatens to 'cut Ukraine off from the sea' after attacks on tankers,https://economictimes.indiatimes.com/news/defence/putin-threatens-to-cut-ukraine-off-from-the-sea-after-attacks-on-tankers/articleshow/125723367.cms,Reuters,2025-12-02T16:46:24Z,Black Sea shipping,Russian President Vladimir Putin has threatened to sever Ukraine's access to the sea. This comes in response to drone attacks on Russian oil tankers in the Black Sea. Putin stated Russia will intensify strikes on Ukrainian facilities and vessels. Measures wil…,The Times of India,Russia,News,2025-12-05T18:30:37.646565Z
2731c96e0c165c10b00e1fbf48d50b06,"If Europe wants war, then Russia is ready, says Vladimir Putin",https://indianexpress.com/article/world/if-europe-wants-war-then-russia-is-ready-says-vladimir-putin-10398733/,Express Web Desk,2025-12-02T15:51:38Z,Black Sea shipping,"Putin also threatened to sever Ukraine's access to the sea in response to drone attacks on tankers of Russia's ""shadow fleet"" in the Black Sea.",The Indian Express,Russia,News,2025-12-05T18:30:37.646584Z
cac503fda7bbff51d10677b637fbd1f7,Putin threatens to 'cut Ukraine off from the sea' after attacks on tankers,https://www.thestar.com.my/news/world/2025/12/02/putin-threatens-to-039cut-ukraine-off-from-the-sea039-after-attacks-on-tankers,The Star Online,2025-12-02T15:46:00Z,Black Sea shipping,"MOSCOW, Dec 2 (Reuters) - Russian President Vladimir Putin threatened on Tuesday to sever Ukraine's access to the sea in response to drone attacks on tankers of Russia's ""shadow fleet"" in the Black Sea. Read full story",The Star Online,Russia,News,2025-12-05T18:30:37.646608Z
6fbd0d9a069f19ecefee80962d1cb08a,"Russian-Flagged Tanker Reports Drone Attack Off Turkey, Authorities Say",https://gcaptain.com/russian-flagged-tanker-reports-drone-attack-off-turkey-authorities-say/,Reuters,2025-12-02T13:16:27Z,Black Sea shipping,"A Russian-flagged tanker loaded with sunflower oil reported a drone attack off the Turkish coast on Tuesday, but its 13 crew members were unharmed, Turkey's maritime authority and the Tribeca shipping agency said.",gcaptain.com,Russia,Market Report,2025-12-05T18:30:37.646628Z
9ffcd7ddf7c48ace28ee544a0bcc6ae2,The Radicalization of Ziz Lasota: How an AI Doomer Became an Accused Cult Leader,http://www.rollingstone.com/culture/culture-features/ziz-lasota-zizians-ai-cult-1235468289/,Kate Storey,2025-12-02T13:00:00Z,Black Sea shipping,"Lasota’s friends, colleagues, and family talk about how a NASA intern and Google employee wound up at the center of a bizarre string of murders across the country",Rolling Stone,Unknown,News,2025-12-05T18:30:37.646681Z
6b278e9b452ac5a65769189c7ade21af,Russian tanker struck off Turkiye as Ukraine targets ‘shadow fleet’,https://www.aljazeera.com/news/2025/12/2/russian-tanker-struck-off-turkiye-as-ukraine-targets-shadow-fleet,Al Jazeera,2025-12-02T11:46:35Z,Black Sea shipping,The reported attack on the Midvolga-2 comes days after Ukraine hit two other Russian-flagged ships in the Black Sea.,Al Jazeera English,Russia,Market Report,2025-12-05T18:30:37.646704Z
58e3584bedd6d0e00049542d674500b7,Lit Hub’s 43 Favorite Books of 2025,https://lithub.com/lit-hubs-43-favorite-books-of-2025/,Literary Hub,2025-12-02T10:01:24Z,Black Sea shipping,"It’s been another hard year for so many people, and in so many ways, but best-of lists are for remembering the good times, and reading is always good (at least the way we do it). Here are the Literary Hub",Lithub.com,Unknown,News,2025-12-05T18:30:37.646777Z
c9ca7cd5e66da89921963adbf02201d5,"A third Russian tanker attacked in the Black Sea, Turkish authority says",https://abcnews.go.com/International/wireStory/russian-tanker-attacked-black-sea-turkish-authority-128026587,The Associated Press,2025-12-02T07:51:03Z,Black Sea shipping,The Turkish maritime authority reports a tanker carrying sunflower oil from Russia to Georgia was attacked in the Black Sea,ABC News,Russia,Market Report,2025-12-05T18:30:37.646844Z
23555ca2836529e56df1ffe172f0a3f8,"A third Russian tanker attacked in the Black Sea, Turkish authority says",https://financialpost.com/pmn/a-third-russian-tanker-attacked-in-the-black-sea-turkish-authority-says,The Associated Press,2025-12-02T07:27:42Z,Black Sea shipping,"ANKARA, Turkey (AP) — A tanker carrying sunflower oil from Russia to Georgia was attacked in the Black Sea, the Turkish maritime authority said Tuesday, days after two Russian “shadow fleet” oil tankers were attacked by Ukrainian naval drones. The Turkish Dir…",Financial Post,Russia,News,2025-12-05T18:30:37.646902Z
42828974b393698477d5f8c1767399b9,Turkish owned tanker hit by explosions off Senegal,https://www.hurriyetdailynews.com/turkish-owned-tanker-hit-by-explosions-off-senegal-216346,hurriyetdailynews.com,2025-12-01T17:29:31Z,Black Sea shipping,"A Turkish-owned oil tanker, the Mersin, was damaged near Senegal’s coast last week by four external explosions, but all crew members are safe and no pollution occurred, its operator confirmed Monday.",Hurriyet Daily News,Turkey,News,2025-12-05T18:30:37.647192Z
3507bc59bc7cca8559603b25b72c7c56,The Best Movies of 2025,http://www.vulture.com/article/best-movies-2025-new-films.html,"Bilge Ebiri,Alison Willmore",2025-12-01T14:00:00Z,Black Sea shipping,"Sprawling dreams of revolution took over the big screen this year, and it’s not hard to imagine why. But subtler forms of catharsis emerged, too. Here are the best movies of 2025.",Vulture,Unknown,News,2025-12-05T18:30:37.647295Z
96042cb10ca1af0d568a7fdcf3e3a033,Famine In Sudan And How The Powerful Use Starvation As A Weapon,https://www.forbes.com/sites/andyjsemotiuk/2025/11/30/famine-in-sudan-and-how-the-powerful-use-starvation-as-a-weapon/,"Andy J. Semotiuk, Contributor, 
 Andy J. Semotiuk, Contributor
 https://www.forbes.com/sites/andyjsemotiuk/",2025-12-01T02:38:50Z,Black Sea shipping,"In a world so rich, a famine in Sudan is an indictment, not an inevitability. But is the world ready to see forced hunger as intolerable? That is the question today.",Forbes,Unknown,News,2025-12-05T18:30:37.647355Z
65256fa8c06be0aa7106166e5ae4ce92,"Features Expected For Linux 6.19: ASUS Armoury, Many Intel Bits, AMD GCN 1.0/1.1 Enhanced",https://www.phoronix.com/news/Linux-6.19-Features-Expected,Michael Larabel,2025-11-30T16:32:11Z,Black Sea shipping,"With the Linux 6.18 kernel likely being released later today, here is a look at some of the features on the table for the next kernel cycle, Linux 6.19. The list is based on changes queued in various ""-next"" branches ahead of the Linux 6.19 merge window. Ther…",Phoronix,Unknown,News,2025-12-05T18:30:37.647439Z
2a48cf0e9760665c2389d9de30328797,The Sunday Papers,https://www.rockpapershotgun.com/the-sunday-papers-787,Julian Benson,2025-11-30T12:00:00Z,Black Sea shipping,"Sundays are for writing your first ever Sunday Papers. Though your excitement, like mine, may slip a little when you realise you've been reading almost anything but gaming articles this week. So, I shall be leaning quite heavily into the ""(mostly)"" in the col…",Rock Paper Shotgun,Unknown,News,2025-12-05T18:30:37.647483Z
6fa504d331f4e1eb4cef8cbc99054e1d,Turkey condemns Ukrainian strikes on Russian oil tankers off Black Sea coast,https://abcnews.go.com/International/wireStory/turkey-condemns-ukrainian-strikes-russian-oil-tankers-off-127976754,The Associated Press,2025-11-30T09:34:26Z,Black Sea shipping,The Turkish Foreign Ministry spokesman has condemned Ukrainian drone attacks on two Russian “shadow fleet” oil tankers in the Black Sea,ABC News,Russia,News,2025-12-05T18:30:37.647510Z
42558fdb7e956042c309fef490f98135,Turkey condemns Ukrainian strikes on Russian oil tankers off Black Sea coast,https://www.yahoo.com/news/articles/turkey-condemns-ukrainian-strikes-russian-092524498.html,Associated Press,2025-11-30T09:25:24Z,Black Sea shipping,The Turkish government has condemned Ukrainian drone attacks on two Russian “shadow fleet” oil tankers in the Black Sea.  Foreign Ministry spokesman Oncu...,Yahoo Entertainment,Russia,News,2025-12-05T18:30:37.647534Z
f4d53fda61c2d591acc2bd3bcabe39b2,lululemon Women's Scuba Oversized Half-Zip Hoodie for $79 + free shipping,https://www.dealnews.com/lululemon-Womens-Scuba-Oversized-Half-Zip-Hoodie-for-79-free-shipping/21790594.html,,2025-11-29T11:56:51Z,Black Sea shipping,"lululemon has dropped the price on this half-zip, which is $20 less than the usual special price, and ties the best price we've seen during their Black Friday sale. It is available in Dusty Lilac or Sea Mist at this price. Shipping is free, too. Buy Now at lu…",Dealnews.com,Unknown,News,2025-12-05T18:30:37.647704Z
e269d436700903b1663eec0da735bd3b,Buy Select Lego Toys + 50% off Legoland Ticket from $37.99 + Free Shipping,https://slickdeals.net/f/18897925-buy-select-lego-toys-50-off-legoland-ticket-from-37-99-free-shipping,PennyFound,2025-11-29T01:08:41Z,Black Sea shipping,"Amazon [amazon.com] has Select Lego Toy Sets + 50% off Legoland Ticket from $37.99. Shipping is free.478-Piece LEGO City Fire Rescue Plane Toy [amazon.com] $37.99 
850-Piece LEGO Classic Vibrant Creat",Slickdeals.net,Unknown,News,2025-12-05T18:30:37.647894Z
d69ed02087d8a47135140f5958ce0218,Moment two shadow fleet tankers hit by drones...,https://www.the-sun.com/news/15566130/russian-tankers-sink-drones-hit-crew-evacuated/,Sayan Bose,2025-11-28T23:01:38Z,Black Sea shipping,"Moment two shadow fleet tankers hit by drones...

 
 
 
 (Third column, 3rd story, link)

 

 

 
 Related stories:Trump to recognize occupied Ukraine as part of Russia...
Zelensky chief of staff resigns as corruption investigations widen...

 

 
 
 D…",The-sun.com,Russia,Analysis/Opinion,2025-12-05T18:30:37.647917Z
9bd4398558f97eccda906a3ec251ef30,"Two tankers catch fire in Black Sea after being struck, Turkish authorities report",https://japantoday.com/category/world/a-gambian-flagged-tanker-catches-fire-in-black-sea-and-crew-is-safe,,2025-11-28T21:27:04Z,Black Sea shipping,"Two tankers were struck and caught fire in the Black Sea, prompting rescue operations, Turkish authorities reported Friday. Crew members on board both vessels were reported to be safe. The OpenSanctions database, which tracks people or organizations involved …",Japan Today,Turkey,Market Report,2025-12-05T18:30:37.647966Z
2f9c7ff15f2249a5e672fdc0cdf0a32c,"Tanker hit by blast and fire north of Turkey's Bosphorus strait, agency says",https://www.thestar.com.my/news/world/2025/11/29/tanker-hit-by-blast-and-fire-north-of-turkey039s-bosphorus-strait-agency-says,The Star Online,2025-11-28T16:11:00Z,Black Sea shipping,"ISTANBUL (Reuters) -An explosion and fire broke out in the engine room of a tanker in the Black Sea to the north of Turkey's Bosphorus strait on Friday, shipping agency Tribeca said. Read full story",The Star Online,Turkey,News,2025-12-05T18:30:37.647996Z
0fcfcf82403b8cb3e38b87601474d45c,What to Watch This Week | 9 Recent Works Worth Your Time,https://sspai.me/post/what-to-watch-this-week-9-recent-works-worth-your-time-20251128,kiwi,2025-11-28T14:05:53Z,Black Sea shipping,"☕️ TL;DR Recent highlights worth watching: Stranger Things Season 5 / Final Season (Part 1), Zootopia 2, Taxi Driver Season 3 (K-drama), Such Brave Girls (UK), The Glorious My Life (K-drama), Extended Family Season 2 (US), Train Dreams (film), Salt Road (film…",Sspai.me,Unknown,News,2025-12-05T18:30:37.648042Z
133c7c3ff51b0a2f798bf3cb5ed0e980,Black Friday: The 30 Best Outdoor Deals of 2025,https://hiconsumption.com/gear/best-black-friday-outdoor-deals-2025/,Ethan Brehm,2025-11-28T06:09:52Z,Black Sea shipping,Shop these amazing wilderness wares at their lowest savings of the year.,Hiconsumption.com,Unknown,News,2025-12-05T18:30:37.648126Z
4029fddf3df34f1b645501ed15e61626,Black Friday: The 27 Best Everyday Carry Deals of 2025,https://hiconsumption.com/gear/best-black-friday-edc-deals-2025/,Ethan Brehm,2025-11-28T06:09:40Z,Black Sea shipping,Get quality gear for much less with these amazing deals.,Hiconsumption.com,Unknown,News,2025-12-05T18:30:37.648151Z
460d409784a36f857e94ec7f16cc6203,Pentagon IG Finds Hegseth ‘Signalgate’ Messages Violated DOD Policy,https://dailycaller.com/2025/12/04/pentagon-ig-finds-hegseth-signalgate-messages-violated-dod-policy/,Wallace White,2025-12-04T18:11:42Z,Red Sea shipping,The Department of Defense Inspector General (DoDIG) concluded in a new report released Thursday that Hegseth did not comply with department regulations in disclosing operational details regarding strikes on Houthi targets in March.,The Daily Caller,Unknown,Market Report,2025-12-05T18:30:37.979867Z
a8e3649081cc71ce049fb62453895f1b,Armed clashes reported between Yemeni army and southern separatists,https://www.aljazeera.com/news/2025/12/4/armed-clashes-reported-between-yemeni-army-and-southern-separatists,Al Jazeera,2025-12-04T08:14:23Z,Red Sea shipping,Yemeni troops battle with Southern Transitional Council forces in oil-rich Hadramout governorate.,Al Jazeera English,Unknown,Market Report,2025-12-05T18:30:37.980543Z
978cd8651551dd89b3248ae223b12845,Inside Meta's Effort to Build the World's Longest Underwater Cable,https://uk.pcmag.com/networking/161796/inside-metas-effort-to-build-the-worlds-longest-underwater-cable,Emily Forlini,2025-12-03T14:00:00Z,Red Sea shipping,"Meta has largely kept details about Project Waterworth under wraps, but subsea cable engineer Andy Palmer-Felgate gives us sneak peek at how it will put off this 'incredible feat.'
Meta announced Project Waterworth in February 2025, but we haven't heard much …",PCMag.com,Unknown,News,2025-12-05T18:30:37.980898Z
59dcbf70979a11358f45921b498b20fa,Inside Meta's Effort to Build the World's Longest Underwater Cable,https://me.pcmag.com/en/networking/33853/inside-metas-effort-to-build-the-worlds-longest-underwater-cable,Emily Forlini,2025-12-03T14:00:00Z,Red Sea shipping,"Meta has largely kept details about Project Waterworth under wraps, but subsea cable engineer Andy Palmer-Felgate gives us sneak peek at how it will put off this 'incredible feat.'
Meta announced Project Waterworth in February 2025, but we haven't heard much …",PCMag.com,Unknown,News,2025-12-05T18:30:37.980933Z
07daa5c3a6c150b10d38b1a7aba21b08,Potentially toxic harbor sludge pressures marine environment,https://politiken.dk/edition/news/art10645162/Potentially-toxic-harbor-sludge-pressures-marine-environment,,2025-12-03T06:45:15Z,Red Sea shipping,"If we continue to pollute the marine environment with tons of potentially toxic harbor sludge, even more of the life in our marine areas could disappear, warns expert.",Politiken.dk,Unknown,News,2025-12-05T18:30:37.980969Z
9eaa97c3619cfc43c57a81c0a4cfc7b7,"The D Brief: WH, DOD change their stories; Trump pardons drug trafficker; Today’s US-Russia talks; ‘Awful arithmetic’; And a bit more.",https://www.defenseone.com/threats/2025/12/the-d-brief-december-02-2025/409866/,Ben Watson and Bradley Peniston,2025-12-02T16:18:30Z,Red Sea shipping,,Defense One,Russia,News,2025-12-05T18:30:37.981025Z
676d750e51c0eab253efe2ff14d87b66,China's Guizhou's green agricultural products make way into Persian Gulf,https://www.globenewswire.com/news-release/2025/12/02/3197681/0/en/China-s-Guizhou-s-green-agricultural-products-make-way-into-Persian-Gulf.html,The Department of Agriculture and Rural Affairs of Guizhou Province,2025-12-02T10:22:00Z,Red Sea shipping,"GUIYANG, China, Dec. 02, 2025 (GLOBE NEWSWIRE) -- The 2025 Middle East Organic & Natural Expo kicked off on Nov. 17 in Dubai, United Arab Emirates, where the Department of Commerce of Guizhou Province and the Department of Agriculture and Rural Affairs, joint…",GlobeNewswire,China,Market Report,2025-12-05T18:30:37.981133Z
632ab61f46110583b1cfd92e03a89315,The awful arithmetic of our wars,https://www.defenseone.com/ideas/2025/12/awful-arithmetic-our-wars/409852/,Peter W. Singer,2025-12-02T04:18:21Z,Red Sea shipping,"If we don't figure out a way to fight far more cheaply, we won’t be able to afford to win a single battle.",Defense One,Unknown,News,2025-12-05T18:30:37.981164Z
234165b258a6da1f4e6f8f405936f14a,"If Bitmain gets hit, what breaks first in the US mining machine?",https://cryptoslate.com/if-bitmain-gets-hit-what-breaks-first-in-the-us-mining-machine/,Andjela Radmilac,2025-12-01T16:00:05Z,Red Sea shipping,"The US government has opened a security review into Bitmain, the Beijing-based manufacturer that sells most of the world’s Bitcoin mining rigs. A months-long federal investigation, known internally as Operation Red Sunset, has been probing whether Bitmain’s m…",CryptoSlate,China,Analysis/Opinion,2025-12-05T18:30:37.981360Z
cb504f65468a611fe78fb0c991387a01,Travelling to Morocco? Bring a tape-measure and an empty suitcase,https://www.irishtimes.com/life-style/travel/2025/12/01/travelling-to-morocco-bring-a-tape-measure-and-an-empty-suitcase/,Rosita Boland,2025-12-01T05:58:00Z,Red Sea shipping,"Morocco’s landmark buildings are impressive, but it’s the market stalls and street bakeries that make the biggest impression",The Irish Times,Unknown,Market Report,2025-12-05T18:30:37.981435Z
23c986f4256cfb8e124875022bb476b4,Top 10: Crazy World War 2 Modified Warplanes,https://www.yahoo.com/news/articles/top-10-crazy-world-war-193149456.html,Autocar,2025-11-28T19:31:49Z,Red Sea shipping,Top 10:Crazy World War 2 Modified Warplanes,Yahoo Entertainment,Unknown,News,2025-12-05T18:30:37.981482Z
c2726a7b03200dbaaade9695dc3cdf8b,IRGC Navy to stage two-day military exercise in Persian Gulf waters,https://www.globalsecurity.org/wmd/library/news/iran/2025/12/iran-251203-presstv03.htm,John Pike,2025-12-04T08:52:48Z,Strait of Hormuz,The Islamic Revolution Guards Corps (IRGC) Navy is set to launch a military exercise in Iran's southern territorial waters in the Persian Gulf with the participation of various units from the elite force.,Globalsecurity.org,Unknown,News,2025-12-05T18:30:38.278507Z
69d9467e8145965b222ca1642c9c0c9e,"Persian Gulf security a 'red line,' aggression to face full-force response:IRGC commander",https://www.globalsecurity.org/wmd/library/news/iran/2025/12/iran-251203-presstv02.htm,John Pike,2025-12-04T08:52:41Z,Strait of Hormuz,"The deputy commander-in-chief of the Islamic Revolution Guards Corps (IRGC) has issued a firm warning to the United States and its allies regarding the Persian Gulf and the Strait of Hormuz, saying the security of the strategic waterway is a ""red line"" for Ir…",Globalsecurity.org,USA,News,2025-12-05T18:30:38.278572Z
c8852fa67e78d7c7ecf2b4287b590d48,The Gathering Storm,https://www.shtfplan.com/conspiracy-fact-and-theory/the-gathering-storm,Michael Snyder,2025-12-03T13:30:59Z,Strait of Hormuz,"While many Americans are searching for the best online holiday deals and figuring out what to watch on Netflix tonight, a storm is gathering. Decisions that are being made right now could radically alter the course of human history, but most of the population…",Shtfplan.com,USA,News,2025-12-05T18:30:38.278713Z
b95ba5b21ee1dcecae421697880850b5,Iran Captures Another Tanker In Strait Of Hormuz For 'Fuel Smuggling',https://biztoc.com/x/9a365117fe863942,zerohedge.com,2025-12-01T20:45:13Z,Strait of Hormuz,"Iran Captures Another Tanker In Strait Of Hormuz For 'Fuel Smuggling'
 
Via Middle East Eye
Iran has seized an Eswatini-flagged ship carrying ""smuggled fuel"", according to state media. The Islamic Revolutionary Guard Corps (IRGC) said they intercepted the shi…",Biztoc.com,Unknown,News,2025-12-05T18:30:38.278809Z
10cedd7ed95008d1ce6f013bf355a0a6,Links 12/1/2025,https://www.nakedcapitalism.com/2025/12/links-12-1-2025.html,Conor Gallagher,2025-12-01T11:55:45Z,Strait of Hormuz,"Our daily links, including energy wars, Tether and the dollar, Putin and Modi channel Ben Franklin, Airbus solar flares, and the imperial doom loop.",Nakedcapitalism.com,Unknown,Market Report,2025-12-05T18:30:38.278839Z
b1e7d262fdc371d8f6409f3f2c44e0da,IRGC seizes foreign-flagged vessel for smuggling fuel in Persian Gulf,https://www.globalsecurity.org/wmd/library/news/iran/2025/11/iran-251130-presstv02.htm,John Pike,2025-12-01T06:55:21Z,Strait of Hormuz,The Islamic Revolution Guard Corps (IRGC) says its naval forces have seized an Eswatini-flagged vessel carrying hundreds of thousands of liters of smuggled fuel in the Persian Gulf.,Globalsecurity.org,Unknown,News,2025-12-05T18:30:38.278873Z
