article_id,title,link,creator,pubdate,category,description,source,country,article_type,scrape_timestamp
fce5ea0cde0dede2f97a5f9b04da90da,‘What comes next?’: Fear grips Pakistani families of Somali piracy victims,https://www.aljazeera.com/features/2026/5/5/what-comes-next-fear-grips-pakistani-families-of-somali-piracy-victims,Abid Hussain,2026-05-05T06:39:17Z,Red Sea shipping,"As piracy resurges off Somalia, families of hijacked tanker crew in Pakistan search for answers and help.",Al Jazeera English,Unknown,News,2026-05-09T13:22:44.108347Z
bc0b7197408dfd3850f9b0701b1e9786,"Maersk Ship Clears Hormuz Under US Escort as MSC, Hapag-Lloyd Pivot Routes",http://wwd.com/sourcing-journal/logistics/maersk-transit-strait-of-hormuz-us-military-escort-ships-msc-hapag-lloyd-project-freedom-ceasefire-pivot-1238939934/,Glenn Taylor,2026-05-04T22:24:52Z,Red Sea shipping,"Although the U.S.-Iran ceasefire was put to the test Monday, a Maersk vessel transited the Strait of Hormuz safely under American military guidance.",WWD,USA,News,2026-05-09T13:22:44.108406Z
76c8e3558d0ee36d0c411e9db289b686,Report: Somali Pirates Team Up with Houthi Terrorists to Attack Key Oil Trade Route,https://www.breitbart.com/africa/2026/05/04/report-somali-pirates-team-up-with-houthi-terrorists-to-attack-key-oil-trade-route/,John Hayward,2026-05-04T21:09:29Z,Red Sea shipping,"A report published this week suggests pirates from Somalia are once again threatening commercial shipping in the Red Sea, reportedly working with the Iran-backed Houthi insurgents of Yemen to menace a trillion-dollar flow of seaborne oil.
The post Report: Som…",Breitbart News,Unknown,Market Report,2026-05-09T13:22:44.108450Z
ee077585ad792edf358fda1b15c9ff8c,US Apache and Seahawk helicopters sank half a dozen Iranian small boats while clearing out threats around the Strait of Hormuz,https://www.businessinsider.com/us-apache-seahawk-helicopters-sank-iranian-small-boats-hormuz-strait-2026-5,"Jake Epstein,Chris Panella",2026-05-04T20:23:21Z,Red Sea shipping,"US forces have cleared a defended path through the Strait of Hormuz for vessels to transit the waters safely, a top American commander said.",Business Insider,USA,News,2026-05-09T13:22:44.108500Z
e52388823e2643c2ad27cf005184fc22,Europe Without America,https://www.theatlantic.com/national-security/2026/05/europe-trump-iran-war-nato/687051/,Isaac Stanley-Becker,2026-05-04T20:03:57Z,Red Sea shipping,The Iran war has given European leaders new impetus to plan for self-defense.,The Atlantic,USA,News,2026-05-09T13:22:44.108516Z
26d26154d4732f372405ba5aadb7c163,[Breaking] Korean-operated vessel reports damage in Hormuz; no casualties,https://freerepublic.com/focus/f-bloggers/4377599/posts,Korea Herald,2026-05-04T15:41:14Z,Red Sea shipping,"A Panama-flagged cargo vessel operated by a South Korean shipping company caught fire following an explosion while anchored in the Strait of Hormuz late Monday, according to government officials. No casualties were reported. The vessel, identified as HMM Namu…",Freerepublic.com,South Korea,Market Report,2026-05-09T13:22:44.108549Z
cc6b4f9875bb6be7d40059ba240026be,Does Trump hold ‘all the cards’ against Iran in the Strait of Hormuz?,https://www.aljazeera.com/news/2026/5/4/does-trump-hold-all-the-cards-against-iran-in-the-strait-of-hormuz,Usaid Siddiqui,2026-05-04T14:56:22Z,Red Sea shipping,Trump signals confidence in Iran standoff as tensions rise in the Strait of Hormuz.,Al Jazeera English,Unknown,News,2026-05-09T13:22:44.108585Z
2954be2da618c06b1c46afa0b5436495,Bajaj Auto sales rise 40% in April on export surge; buyback ahead,https://www.thehindubusinessline.com/companies/bajaj-auto-sales-rise-40-in-april-on-export-surge-buyback-ahead/article70937375.ece,Amit Vijay  Mohile,2026-05-04T06:22:27Z,Red Sea shipping,"Commercial vehicle exports, primarily three-wheelers, jumped 125%, while two-wheeler exports rose 78%, highlighting a broad-based recovery in overseas markets",BusinessLine,Unknown,Market Report,2026-05-09T13:22:44.108671Z
e2e29515f3f92a97b02ba64af76c211c,"Iran offers 14-point Peace Plan, Trump declares the US “Pirates”",https://www.juancole.com/2026/05/offers-declares-pirates.html,Juan Cole,2026-05-04T04:15:31Z,Red Sea shipping,"of course, Trump immediately rejected </a> the Iranian proposals. He went on to boast that America is ""pirates.""",Juancole.com,USA,Market Report,2026-05-09T13:22:44.108689Z
b13e911213fd4b92c75a2de2f5c1f27c,What’s Iran’s 14-point proposal to end the war? And will Trump accept it?,https://www.aljazeera.com/news/2026/5/3/whats-irans-14-point-proposal-to-end-the-war-and-will-trump-accept-it,Priyanka Shankar,2026-05-03T11:10:48Z,Red Sea shipping,"Trump is reviewing Iran's latest proposal to end the war, but the mistrust between the two sides is a big obstacle.",Al Jazeera English,Unknown,Analysis/Opinion,2026-05-09T13:22:44.108719Z
7d8ab7a5108a7deb7d628a21b81774c6,India’s Horn of Africa strategy has shifted: what it’s trying to do and how it could work,https://theconversation.com/indias-horn-of-africa-strategy-has-shifted-what-its-trying-to-do-and-how-it-could-work-281252,"Federico Donelli, Associate Professor of International Relations, University of Trieste, Chiara Boldrini, PhD researcher, Università di Bologna, Riccardo Gasco, PhD Candidate, Università di Bologna",2026-05-03T09:48:20Z,Red Sea shipping,"Over the past decade, India has come to see the Horn of Africa as a primary theatre of influence.",The Conversation Africa,India,News,2026-05-09T13:22:44.108741Z
1e3b4e46fd649b960f3f1b19b3f6324b,The US Navy’s secret weapon - ;everaging Israel’s naval capabilities,https://www.israelnationalnews.com/news/426439,Amb. (ret.) Yoram Ettinger,2026-05-03T03:37:38Z,Red Sea shipping,Data on Israel as a force and dollar multiplier for the US. Op-ed.,Israelnationalnews.com,Unknown,News,2026-05-09T13:22:44.108774Z
6f71e5342f0ecb82cfe203ce6677436c,"Iran war ‘likely’ to restart, senior Tehran official warns after Trump says US might be ‘better off’ without deal",https://nypost.com/2026/05/02/world-news/iran-war-likely-to-restart-senior-tehran-official-warns-after-trump-says-us-might-be-better-off-without-deal/,"Geoff Earle, Kathianne Boniello",2026-05-02T13:40:25Z,Red Sea shipping,"The war between the US and Iran is “likely” to restart, a senior Iranian official predicted on the heels of comments by President Trump that the US might be “better off” without an agreement.…",New York Post,Unknown,Analysis/Opinion,2026-05-09T13:22:44.108843Z
5847ca0cb13c21f837b44a697a65c1a2,What alternatives do Gulf states have to Strait of Hormuz?,https://www.thehindubusinessline.com/news/world/what-alternatives-do-gulf-states-have-to-strait-of-hormuz/article70930771.ece,The  Conversation,2026-05-02T04:40:46Z,Red Sea shipping,"Plans and projects to diversify away from Hormuz have been on drawing boards for decades, and those workarounds are now being stress-tested as never before",BusinessLine,Unknown,News,2026-05-09T13:22:44.108922Z
d5a1bcd9b4048792f6b2dcd78a5b7e47,"Iran official says 10 sailors wounded, five missing after overnight clash with US",https://www.channelnewsasia.com/world/iran-us-overnight-clash-10-sailors-wounded-five-missing-6109786,,2026-05-08T13:21:08Z,Strait of Hormuz,"It was not immediately clear whether the cargo vessel the sailors were on was directly targeted, though Iran and the United States exchanged fire overnight from Thursday to Friday despite a truce.",CNA,USA,News,2026-05-09T13:22:44.439640Z
c32b1ed4a40678dd401ba3a6a1fe6db3,"Under-recovery for IOC, HPCL, BPCL touches ₹30,000 crore",https://www.thehindubusinessline.com/economy/under-recovery-for-ioc-hpcl-bpcl-touches-30000-crore/article70955451.ece,Shishir Sinha,2026-05-08T13:18:04Z,Strait of Hormuz,"Indian oil companies face ₹30,000 crore monthly under-recovery due to subsidized fuel prices amid escalating global oil costs.",BusinessLine,India,Market Report,2026-05-09T13:22:44.439872Z
0c33aadd6f74f7b85473ba979991a7c9,A Taste for Genocide: Why the West Can’t Shake Its Most Violent Habits,https://www.fairobserver.com/region/europe/a-taste-for-genocide-why-the-west-cant-shake-its-most-violent-habits/,Peter Isackson,2026-05-08T13:17:04Z,Strait of Hormuz,"On February 27, I began my The Devil’s Advocate column with this statement: “Europe finds itself submerged in a deepening crisis, financial, social and political.” The next day, as everyone now knows, things got significantly worse. That was the day that saw …",Fair Observer,Unknown,Analysis/Opinion,2026-05-09T13:22:44.439920Z
964ed795903428a689c0915d7838f45c,"US employers defy economic shock from Iran war and add a surprisingly strong 115,000 jobs in April",https://economictimes.indiatimes.com/markets/us-stocks/us-employers-defy-economic-shock-from-iran-war-and-add-a-surprisingly-strong-115000-jobs-in-april/articleshow/130961011.cms,AP,2026-05-08T13:08:12Z,Strait of Hormuz,"Average hourly earnings rose 0.2% from March and 3.6% from April 2025, consistent with the Federal Reserve's 2% inflation target.",The Times of India,Unknown,News,2026-05-09T13:22:44.439957Z
e9e6b0718a097cd68693299adc59b49c,Rubio says expecting Iran response to US proposal on Friday,https://www.digitaljournal.com/world/rubio-says-expecting-iran-response-to-us-proposal-on-friday/article,AFP,2026-05-08T13:07:20Z,Strait of Hormuz,"US Secretary of State Marco Rubio said Washington was expecting a response from Iran on Friday to US proposals for a deal to end the conflict. “We’re expecting a response from them today at some point… I hope it’s a serious offer, I really do,” Rubio told rep…",Digital Journal,Unknown,News,2026-05-09T13:22:44.440010Z
17b230d2f582cfac31a90e42647c8c42,Major escalation in Strait of Hormuz as U.S. and Iran trade attacks,https://www.cbsnews.com/video/major-escalation-in-strait-of-hormuz-as-us-and-iran-trade-attacks/,CBS News,2026-05-08T13:07:09Z,Strait of Hormuz,"The U.S. and Iran traded attacks in the strait of Hormuz, but the Trump administration insists the ceasefire remains. CBS News' Aaron Navarro reports, and retired U.S. Marine Corps. Col. Ray Gerber joins with more insight.",CBS News,Unknown,Analysis/Opinion,2026-05-09T13:22:44.440048Z
7dbf3a5cb92fca27bb330e2a40f37f8a,US forces block over 70 tankers in Strait of Hormuz amid ongoing conflict,https://cryptobriefing.com/us-forces-block-over-70-tankers-in-strait-of-hormuz-amid-ongoing-conflict/,Estefano Gomez,2026-05-08T13:03:56Z,Strait of Hormuz,"The blockade exacerbates regional tensions, disrupts global oil supply chains, and influences market expectations on geopolitical stability.
The post US forces block over 70 tankers in Strait of Hormuz amid ongoing conflict appeared first on Crypto Briefing.",Crypto Briefing,Global,Market Report,2026-05-09T13:22:44.440120Z
75dc95fb0d830f43995566e6086cc918,"U.S. economy surprises with 115,000 new jobs created in April",https://fortune.com/2026/05/08/u-s-economy-surprises-with-115000-new-jobs-created-in-april/,"Paul Wiseman, The Associated Press",2026-05-08T13:01:22Z,Strait of Hormuz,"Hiring was better than the 65,000 forecasters had expected, though it decelerated from the 185,000 jobs created in March.",Fortune,Unknown,Analysis/Opinion,2026-05-09T13:22:44.440147Z
22ee64c6f1fc1efd321c4bb3928a74f7,"Employers added 115,000 jobs last month...",https://apnews.com/article/jobs-economy-unemployment-trump-iran-war-2cf46bfbf7748403ea0245100af45504,ap news,2026-05-08T13:00:22Z,Strait of Hormuz,"America’s employers a delivered a surprising 115,000 new jobs last month despite an economic shock from the Iran war. Hiring was better than the 65,000 that economists had expected, though it decelerated from the 185,000 jobs created in March. The unemploymen…",Associated Press,USA,News,2026-05-09T13:22:44.440175Z
c2cd89104223de2f4e70889524ce9c4f,British Airways owner warns ALL airlines will have to increase fares as jet fuel prices surge due to Iran war in another blow to UK tourists,https://www.dailymail.com/news/article-15801279/Jet-fuel-Iran-war-British-Airways-ticket-prices-summer-holidays.html,Mark Duell,2026-05-08T12:56:11Z,Strait of Hormuz,British Airways owner International Airlines Group warned its profits will be hit as it expects to spend about €2billion (£1.7billion) more than planned on fuel this year because of the oil crisis.,Dailymail.com,UK,Market Report,2026-05-09T13:22:44.440222Z
276fe01e241afd39496bdc75c1448e0e,OOPS: Iranians Strike Cargo Ship Owned by Their Chinese Allies in the Strait of Hormuz,https://freerepublic.com/focus/f-chat/4378295/posts,thegatewaypundit.com,2026-05-08T12:54:44Z,Strait of Hormuz,"Just yesterday, the Iranian Foreign Minister Abbas Araghchi was in Beijing, meeting with his counterpart, Chinese Foreign Minister Wang Yi. The two ministers reportedly discussed bilateral ties, the Iran-U.S. conflict, the Strait of Hormuz, and regional issue…",Freerepublic.com,China,Market Report,2026-05-09T13:22:44.440258Z
9ae53b685ac1efea9795b7b86ad2e8e0,"U.S. employers added a surprising 115,000 jobs last month despite the economic shock from Iran war",https://economictimes.indiatimes.com/news/international/global-trends/u-s-employers-added-a-surprising-115000-jobs-last-month-despite-the-economic-shock-from-iran-war/articleshow/130960476.cms,AP,2026-05-08T12:41:45Z,Strait of Hormuz,"America's employers added 115,000 jobs in April, exceeding forecasts despite the Iran war's disruption of global oil supplies and surging gas prices. The unemployment rate held steady at a low 4.3%, indicating resilience in the job market for now. However, ec…",The Times of India,USA,Analysis/Opinion,2026-05-09T13:22:44.440439Z
9ed474cfd789a71f7da0de20cd56eaae,"U.S. added 115K jobs in April, nearly doubling expectations",https://www.coindesk.com/markets/2026/05/07/u-s-added-115k-jobs-in-april-nearly-doubling-expectations,Krisztian Sandor,2026-05-08T12:33:42Z,Strait of Hormuz,The data comes ahead of what's expected to be a new Federal Reserve chairman taking the reins at the U.S. central bank later this month.,CoinDesk,Unknown,News,2026-05-09T13:22:44.440471Z
655c2c88a79d835f41ef8c4e82a83042,Everyone’s a loser in Strait of Hormuz game that simulates global crisis,https://slashdot.org/firehose.pl?op=view&amp;id=183160904,feedfeeder,2026-05-08T12:32:14Z,Strait of Hormuz,The game asks players to find the least worst options for a shipping chokepoint.,Slashdot.org,Global,News,2026-05-09T13:22:44.440504Z
84c521f5ca241bea83a0c1b62658a100,Trump warns Iran of consequences as peace deal confidence wanes,https://cryptobriefing.com/trump-warns-iran-of-consequences-as-peace-deal-confidence-wanes/,Estefano Gomez,2026-05-08T12:31:37Z,Strait of Hormuz,"Rising geopolitical tensions may lead to increased energy market volatility and hinder diplomatic efforts, impacting global stability.
The post Trump warns Iran of consequences as peace deal confidence wanes appeared first on Crypto Briefing.",Crypto Briefing,Global,Market Report,2026-05-09T13:22:44.440543Z
e806fc4f41a9d1dd4ba5b16d76c16d53,Fertilizer shortages: What are Africa's options during the Hormuz crisis?,https://www.dw.com/en/fertilizer-shortages-what-are-africas-options-during-the-hormuz-crisis/a-77094073,David Ehl,2026-05-08T12:26:00Z,Strait of Hormuz,"The ongoing blockade of the Strait of Hormuz is affecting African nations particularly badly. But there are potential solutions for mitigating the drastic effects on the continent in the short, medium and long term. For more than two months, there have hardly…",DW (English),Unknown,News,2026-05-09T13:22:44.440592Z
5366d39975c8a4ede5f45072019f3093,Fertilizer shortages: What Africa's options during the Hormuz crisis?,https://www.dw.com/en/fertilizer-shortages-what-africas-options-during-the-hormuz-crisis/a-77094073,David Ehl,2026-05-08T12:26:00Z,Strait of Hormuz,"The ongoing blockade of the Strait of Hormuz is affecting African nations particularly badly. But there are potential solutions for mitigating the drastic effects on the continent in the short, medium, and long term. For more than two months, there have hardl…",DW (English),Unknown,News,2026-05-09T13:22:44.440637Z
503aea57f0238d7e626669dc17f8dcfb,Iran seizes US-sanctioned tanker carrying Islamic regime’s oil in Gulf of Oman,https://nypost.com/2026/05/08/world-news/iran-seizes-us-sanctioned-tanker-carrying-islamic-regimes-oil-in-gulf-of-oman/,Emily Crane,2026-05-08T12:23:25Z,Strait of Hormuz,"Iran seized a US-sanctioned tanker carrying Iranian oil in the Gulf of Oman, Iran's army said Friday -- as US and Iranian forces clashed in the Strait of Hormuz.",New York Post,Unknown,News,2026-05-09T13:22:44.440717Z
746a67735f7375f0468a0f8475d106ec,Iran claims to have seized ‘offending’ oil tanker in Gulf of Oman,https://www.aljazeera.com/news/2026/5/8/iran-says-it-has-seized-oil-tanker-over-attempts-to-disrupt-its-oil-exports,Al Jazeera Staff,2026-05-08T12:22:09Z,Strait of Hormuz,"State TV releases a video of IRGC forces boarding and detaining the Barbados-flagged vessel, Ocean Koi.",Al Jazeera English,Unknown,News,2026-05-09T13:22:44.440752Z
1de682e454b484dddc10fc18b78a74f1,When the world’s most powerful country has no war plan,https://www.rt.com/india/639609-us-strategy-iran-war-kanwal-sibal/,RT,2026-05-08T12:20:24Z,Strait of Hormuz,Washington’s rhetoric and mixed signals are turning the Iran conflict into a wider test of US power – and of global trust in its leadership Read Full Article at RT.com,RT,Global,News,2026-05-09T13:22:44.440794Z
d53ca64330c826bfd4d4a418c9b709be,Donald Trump says ceasefire still holds after fighting between the US and Iran flares,https://economictimes.indiatimes.com/news/defence/donald-trump-says-ceasefire-still-holds-after-fighting-between-the-us-and-iran-flares/articleshow/130959962.cms,Reuters,2026-05-08T12:20:24Z,Strait of Hormuz,"U.S. and Iranian forces clashed in the Gulf and Strait of Hormuz, with both sides accusing the other of breaching a ceasefire. Despite the flare-up and renewed attacks on the UAE, President Trump stated diplomacy was still on track and a ceasefire was holding…",The Times of India,Unknown,News,2026-05-09T13:22:44.440842Z
1ccfc55230cff0a49bb38f86523f5923,Here's Why Trump Scrapped Hormuz Escort Plan,https://www.newser.com/story/388768/heres-why-trump-scrapped-hormuz-escort-plan.html,Arden Dier with Newser.AI,2026-05-08T12:15:00Z,Strait of Hormuz,"President Trump's bid to send US warships to escort tankers through the Strait of Hormuz reportedly ran aground not in Tehran, but in Riyadh. The New York Times , citing Saudi and US officials, reports Crown Prince Mohammed bin Salman refused American use of …",Newser,USA,Market Report,2026-05-09T13:22:44.440867Z
dff96cf1ded4f978e42b6dc4cceee406,US Stock Market Today | Dow Jones | Nasdaq Live: US stocks future climb on chip rebound ahead of key payrolls data,https://m.economictimes.com/markets/us-stocks/news/us-stock-market-live-dow-jones-sp-500-nasdaq-trump-us-iran-israel-war-peace-talks-crude-brent-oil-cloudflare-trade-desk-coreweave-expedia-stock-price-news/liveblog/130959823.cms,Economic Times,2026-05-08T12:14:11Z,Strait of Hormuz,"Dow Jones Today | US Stock Market Live Updates: The gains helped offset broader market concerns after U.S. and Iranian forces clashed in the Gulf, undermining hopes for a quick resolution to the Middle East conflict and a gradual reopening of the Strait of Ho…",Economictimes.com,Unknown,Market Report,2026-05-09T13:22:44.440911Z
6b935549f22c072dbbff3f95c73d9322,Allowing any party to restrict Strait of Hormuz transit could set dangerous precedent: PM Wong,https://www.channelnewsasia.com/singapore/asean-summit-lawrence-wong-hormuz-myanmar-thailand-cambodia-6108671,,2026-05-08T12:10:14Z,Strait of Hormuz,Singapore's prime minister says ASEAN must uphold navigational rights and work with external partners to keep critical sea lanes open.,CNA,Singapore,News,2026-05-09T13:22:44.440934Z
12833c7b7000d2de99808dfc8d1086f0,India’s Bangladesh Policy Quagmire: Big Brother’s Recalcitrance and the Chinese Embrace,https://thediplomat.com/2026/05/indias-bangladesh-policy-quagmire-big-brothers-recalcitrance-and-the-chinese-embrace/,Shanthie Mariet D’Souza,2026-05-08T12:09:00Z,Strait of Hormuz,"The BJP, or its allies, are now in power in all five Indian states that share a border with Bangladesh.",The Diplomat,China,News,2026-05-09T13:22:44.440953Z
717fe34c0975fb558b601efbf893e42c,Did the U.S. and Iran ceasefire hold? #politics,https://alltoc.com/politics/did-the-u-s-and-iran-ceasefire-hold,AllToc,2026-05-08T12:02:41Z,Strait of Hormuz,"Ceasefire claimed to hold amid renewed attacks President Donald Trump said a fragile ceasefire between the U.S. and Iran was still holding, even as attacks escalated in the wider conflict around the Strait of Hormuz. U.S. Central Command also indicated that t…",Alltoc.com,Unknown,News,2026-05-09T13:22:44.441110Z
2eac58deb392ed194b109744e6635523,Israel ramps up airstrikes across Lebanon despite ceasefire,https://www.hurriyetdailynews.com/israel-ramps-up-airstrikes-across-lebanon-despite-ceasefire-221945,hurriyetdailynews.com,2026-05-08T12:01:54Z,Strait of Hormuz,"Israeli and Lebanese envoys will sit down for a fresh round of peace talks in Washington next week, even as Israel presses its campaign against the militant group Hezbollah in spite of a ceasefire.",Hurriyet Daily News,Unknown,News,2026-05-09T13:22:44.441146Z
cb46c5258e5805d77606d657e58a4db4,World Shares Fall And Oil Prices Dip After Attacks Imperil The Ceasefire With Iran,https://www.huffpost.com/entry/financial-markets-trump-ceasefire_n_69fdcecbe4b065a1677db7bc,HuffPost,2026-05-08T12:00:42Z,Strait of Hormuz,World shares have mostly retreated and oil prices fell again after climbing as the fragile ceasefire with Iran was strained by missile and drone attacks that prompted U.S. retaliatory strikes on Iranian military facilities.,HuffPost,Unknown,Market Report,2026-05-09T13:22:44.441183Z
3fc01577ac1d4a49335dc2de84459f39,Rubio Says US Awaiting Iran Response to Peace Proposal,https://www.globalsecurity.org/wmd/library/news/iran/2026/05/iran-260508-rferl04.htm,John Pike,2026-05-08T12:00:00Z,Strait of Hormuz,US Secretary of State Marco Rubio has said that Washington is awaiting Iran's response to a US proposal aimed at ending the conflict.,Globalsecurity.org,Unknown,News,2026-05-09T13:22:44.441214Z
889233693af6ed4f8abdb6e98fa243f3,Rubio Wraps Up Rome Visit With Sharp Warning To Iran Over Hormuz,https://www.globalsecurity.org/wmd/library/news/iran/2026/05/iran-260508-rferl02.htm,John Pike,2026-05-08T12:00:00Z,Strait of Hormuz,"US Secretary of State Marco Rubio concluded a high-stakes, two-day diplomatic mission to Rome and the Vatican City on May 8, a visit defined by efforts to recalibrate a longstanding relationship with Italy following weeks of heightened friction over Iran.",Globalsecurity.org,Unknown,News,2026-05-09T13:22:44.441269Z
0328b082cdc53d8092e1796cacaecabc,Iran Says Latest Clashes With US In Strait Of Hormuz Have 'Ceased',https://www.globalsecurity.org/wmd/library/news/iran/2026/05/iran-260508-rferl03.htm,John Pike,2026-05-08T12:00:00Z,Strait of Hormuz,Tehran has said armed clashes with US Navy vessels in the Strait of Hormuz have come to an end and that the situation is now calm.,Globalsecurity.org,Unknown,News,2026-05-09T13:22:44.441300Z
45143a82ffd2c0bee95de3d1e4cb3d93,"Attacked oil tanker flagged by Marshall Islands with Chinese crew, no casualties reported so far: FM responds to reported attack of Chinese oil tanker near Hormuz",https://www.globalsecurity.org/wmd/library/news/iran/2026/05/iran-260508-globaltimes03.htm,John Pike,2026-05-08T12:00:00Z,Strait of Hormuz,"In response to media inquiries regarding reports claiming that a Chinese-owned oil products tanker was attacked near the Strait of Hormuz on Monday, Chinese Foreign Ministry spokesperson Lin Jian said at a press briefing on Friday that according to informatio…",Globalsecurity.org,China,Market Report,2026-05-09T13:22:44.441321Z
f79ad17bec309c01c6ce9253b3aa998b,Iran Presses Ahead With Agency To Regulate Hormuz Shipping,https://www.globalsecurity.org/wmd/library/news/iran/2026/05/iran-260508-rferl05.htm,John Pike,2026-05-08T12:00:00Z,Strait of Hormuz,"Iran has launched a new agency to oversee and collect tolls from ships transiting the Strait of Hormuz, amid ongoing regional tensions and diplomatic efforts to end the conflict with the United States, according to shipping journal Lloyd's List.",Globalsecurity.org,USA,News,2026-05-09T13:22:44.441342Z
c592f9f45d5e37d8bf9d22f8eacc61ca,Somalia teeters on the brink of catastrophe as hunger crisis deepens,https://www.globalsecurity.org/military/library/news/2026/05/mil-260508-unnews02.htm,John Pike,2026-05-08T12:00:00Z,Strait of Hormuz,"""This is not a distant warning. This is a crisis that is unfolding right now and it's deepening quickly.""",Globalsecurity.org,Unknown,News,2026-05-09T13:22:44.441373Z
14fcedebdf98e79bd9092aed8733ecf1,Pakistan’s Rising Role in West Asia’s Shifting Geopolitical Landscape,https://thediplomat.com/2026/05/pakistans-rising-role-in-west-asias-shifting-geopolitical-landscape/,Abdul Basit,2026-05-08T11:56:00Z,Strait of Hormuz,"Irrespective of the outcomes of the U.S.-Iran talks, Pakistan’s expanded role in West Asia as a security stabilizer and an assertive diplomatic actor is here to stay.",The Diplomat,Unknown,News,2026-05-09T13:22:44.441419Z
02cc0026896ce3b1c15fd783bc768d46,EU agency opens door to using US jet fuel,https://www.rte.ie/news/business/2026/0508/1572368-eu-opens-door-to-using-us-jet-fuel/,RTÉ News,2026-05-08T11:50:48Z,Strait of Hormuz,"The European Union Aviation Safety Agency has today cleared the way for the possible use of US jet fuel in the bloc, which is seeking ways to confront the threat of shortages due to the Middle East war.",RTE,Unknown,News,2026-05-09T13:22:44.441454Z
