article_id,title,link,creator,pubdate,category,description,source,country,article_type,scrape_timestamp
1675ef326ba6764216c12835f6d50a3d,This Trolley Stacks and Rotates Like Shipping Containers at a Port,https://www.yankodesign.com/2026/01/28/this-trolley-stacks-and-rotates-like-shipping-containers-at-a-port/,JC Torres,2026-01-28T17:20:16Z,Red Sea shipping,"This Trolley Stacks and Rotates Like Shipping Containers at a PortMost storage furniture sits where you put it, fixed shelves and cabinets that do their job but rarely respond to how space changes during a...",Yanko Design,Unknown,News,2026-02-04T06:56:17.342496Z
6b71e05854431edc0a505b0dc714f3f6,Today in Germany: A roundup of the latest news on Wednesday,https://www.thelocal.de/20260128/today-in-germany-a-roundup-of-the-latest-news-on-wednesday-105,Tom Pugh,2026-01-28T07:36:35Z,Red Sea shipping,"The government takes aim at 'bureaucratic jungle' with welfare reforms, renewables supply Germany with electricty almost every day, Germany's largest lake freezes completely and more news on Wednesday, January 28th.",The Local Germany,Germany,News,2026-02-04T06:56:17.342532Z
65b3256cf3b19b4f7a03949017cc4fd4,Turkey seeks to broker US-Iran talks by week’s end,https://www.bostonherald.com/2026/02/02/turkey-us-iran/,Associated Press,2026-02-02T21:47:22Z,Strait of Hormuz,Neither the U.S. nor Iran has confirmed whether they plan to take part in any negotiations.,Boston Herald,Turkey,News,2026-02-04T06:56:17.708988Z
0d6ac6da6d7c34a0bdca3a2d5fa638aa,Iran War? A Look at Boundary Conditions Says Trump Will TACO With Intent to Strike Later; Israel Terrorism Set to Continue,https://www.nakedcapitalism.com/2026/02/iran-war-a-look-at-boundary-conditions-says-trump-will-taco-with-intent-to-strike-later-israel-terrorism-set-to-continue.html,Yves Smith,2026-02-02T11:28:35Z,Strait of Hormuz,"Many factors point to the value, one might even say necessity, of Trump going TACO on Iran soon. But what might happen then?",Nakedcapitalism.com,Unknown,News,2026-02-04T06:56:17.709042Z
ea05f59d4fd44b5b6bdc966b8b199f20,"Araghchi: IRGC upholds peace, stability as foreign meddling fuels escalation",https://www.globalsecurity.org/wmd/library/news/iran/2026/02/iran-260201-irna04.htm,John Pike,2026-02-02T10:01:46Z,Strait of Hormuz,"Foreign Minister Abbas Araghchi says the Islamic Revolution Guards Corps (IRGC) has played a consistent role in maintaining peace and stability in the Persian Gulf region and the Strait of Hormuz within it, while warning that the presence and actions of extra…",Globalsecurity.org,Unknown,News,2026-02-04T06:56:17.709277Z
bad83d576ae67939560244c139937ac8,Iran summons ambassadors to protest Revolutionary Guard being listed as terror group,https://abcnews.go.com/International/wireStory/iran-summons-eu-ambassadors-protest-revolutionary-guard-listed-129774076,JON GAMBRELL Associated Press,2026-02-02T08:45:18Z,Strait of Hormuz,Iran says it has had summoned all of the European Union ambassadors in the Islamic Republic to protest the bloc’s listing of the paramilitary Revolutionary Guard as a terror group,ABC News,Unknown,News,2026-02-04T06:56:17.709325Z
0e9bcbc22ce55417d409736ac827cecb,Crude oil futures fall over 4% as Trump hints at US-Iran talks,https://www.thehindubusinessline.com/markets/commodities/crude-oil-futures-fall-over-4-as-trump-hints-at-us-iran-talks/article70581587.ece,BL Mangaluru Bureau,2026-02-02T04:52:57Z,Strait of Hormuz,Crude oil futures declined by more than 4 per cent on Monday morning after US President Donald Trump said that Iran was seriously talking with the US.,BusinessLine,Unknown,News,2026-02-04T06:56:17.709384Z
367a0d12643a816dca48b94c53ba1fd4,OMC Shares Rise After Crude Oil Prices Drop 4% On Easing US-Iran Tensions,https://www.ndtvprofit.com/markets/omc-shares-rise-after-crude-oil-prices-drop-on-easing-us-iran-ties-10929133,Shubhayan Bhattacharya,2026-02-02T04:16:44Z,Strait of Hormuz,"Brent, the global benchmark, dropped more than 4% to just above $66 per barrel, while the West Texas Intermediate (WTI) fell below $63 during Asian trading hours.",Ndtvprofit.com,Global,Market Report,2026-02-04T06:56:17.709419Z
ddde738c3e0fc3e86f81b3335e6bfa46,Iran denies Guards planned live-fire drills in Strait of Hormuz,https://www.israelnationalnews.com/news/421812,Elad Benari,2026-02-02T03:11:09Z,Strait of Hormuz,"Iran denies reports that the Revolutionary Guards planned live-fire drills in the Strait of Hormuz, saying media claims were incorrect.",Israelnationalnews.com,Unknown,Market Report,2026-02-04T06:56:17.709453Z
022c5aa3f3a28f4adb32f0af0c800018,Iran Warns Of Regional Conflict If US Attacks,https://gcaptain.com/iran-warns-of-regional-conflict-if-us-attacks/,Reuters,2026-02-02T02:14:13Z,Strait of Hormuz,"DUBAI, Feb 1 (Reuters) – Iran’s leadership warned of a regional conflict on Sunday if the U.S. were to attack it, stoking the tension between Washington and Tehran, and it designated EU...",gcaptain.com,Unknown,News,2026-02-04T06:56:17.709497Z
d60c542235a5ff3100f7456b8d6253f4,Oil prices fall by 3% on US-Iran de-escalation,https://economictimes.indiatimes.com/markets/commodities/news/oil-prices-fall-by-3-on-us-iran-de-escalation/articleshow/127850531.cms,Reuters,2026-02-02T02:06:41Z,Strait of Hormuz,"Oil prices dropped significantly as President Trump indicated Iran was engaged in serious talks with Washington, signaling a de-escalation of tensions. This news eased geopolitical risk premiums that had previously driven prices to multi-month highs. OPEC+ al…",The Times of India,Unknown,Market Report,2026-02-04T06:56:17.709548Z
8780628a062e0f4f8c11f3c9dde38c4c,"Iran stages Khamenei photos to mask cracks in IRGC, opposition groups say",https://www.foxnews.com/world/iran-stages-khamenei-photos-mask-cracks-irgc-opposition-groups-say,,2026-02-02T00:52:54Z,Strait of Hormuz,"Iranian regime projects strength through staged images of Supreme Leader Ayatollah Ali Khamenei at prayers, a senior official with the National Council of Resistance of Iran said.",Fox News,Unknown,News,2026-02-04T06:56:17.709587Z
fe6fff38bf6c41e7babff6d147b19bec,Oil prices fall by 3% on US-Iran de-escalation,https://www.channelnewsasia.com/business/oil-prices-fall-3-us-iran-de-escalation-5899821,,2026-02-01T23:20:19Z,Strait of Hormuz,"TOKYO, Feb 2 : Oil prices fell 3 per cent on Monday as U.S. President Donald Trump said over the weekend Iran was ""seriously talking"" with Washington, signalling de-escalation with an OPEC member after risks of a military strike drove prices to multi-month hi…",CNA,Japan,Market Report,2026-02-04T06:56:17.709619Z
7beb32e7119f8b81e608e00c2868e5fd,Iran's supreme leader warns any U.S. attack would spark 'regional war' in the Middle East,https://www.pbs.org/newshour/world/irans-supreme-leader-warns-any-u-s-attack-would-spark-regional-war-in-the-middle-east,,2026-02-01T20:12:47Z,Strait of Hormuz,"Iran's supreme leader warned Sunday that any attack by the United States would spark a ""regional war"" in the Middle East.",PBS,USA,News,2026-02-04T06:56:17.709729Z
11eb72f817d3cad4f61f1150f43a217c,"Iran warns of regional conflict if US attacks, designates EU armies as 'terrorists'",https://www.independent.ie/world-news/middle-east/iran-warns-of-regional-conflict-if-us-attacks-designates-eu-armies-as-terrorists/a775492716.html,Irish Independent,2026-02-01T18:20:54Z,Strait of Hormuz,"Iran's leadership warned of a regional conflict on Sunday if the U.S. were to attack it, stoking the tension between Washington and Tehran, and it designated EU armies as ""terrorist groups"" in a retaliatory move.",Independent.ie,Unknown,News,2026-02-04T06:56:17.709772Z
500d20da0fbbb95cda968ddae9fa9290,"Iran's supreme leader warns of ""regional war"" in Middle East if U.S. attacks",https://www.cbsnews.com/news/irans-supreme-leader-warns-of-regional-war-in-middle-east-if-us-attacks/,,2026-02-01T16:53:56Z,Strait of Hormuz,Ayatollah Ali Khamenei's comments are the most direct threat he's made so far amid escalating tensions with the U.S.,CBS News,Unknown,Analysis/Opinion,2026-02-04T06:56:17.709799Z
4c8bf385ed9cfb8e10468a7760f16389,"Iran warns of regional conflict if US attacks, designates EU armies 'terrorists'",https://economictimes.indiatimes.com/news/defence/iran-warns-of-regional-conflict-if-us-attacks-designates-eu-armies-terrorists/articleshow/127844213.cms,Reuters,2026-02-01T15:54:58Z,Strait of Hormuz,Iran has warned of regional conflict if the United States attacks. This comes amid heightened tensions and increased U.S. naval presence in the Middle East. Iran also designated European Union armies as terrorist groups. This move is a direct response to the …,The Times of India,USA,News,2026-02-04T06:56:17.709829Z
e82f8820cf57a9ca2a9e68509ea5c489,Iran's Supreme Leader Warns Any U.S. Attack Would Spark 'Regional War',https://www.huffpost.com/entry/iran-supreme-leader-warns-us-attack-would-spark-regional-war_n_697f6fd9e4b042d95543e658,HuffPost,2026-02-01T15:41:23Z,Strait of Hormuz,Ayatollah Ali Khamenei spoke to a crowd at his compound in Tehran as Iran marked the start of a dayslong commemoration of the country's 1979 Islamic Revolution.,HuffPost,Unknown,News,2026-02-04T06:56:17.709864Z
6e90f36bc06e519a5b120fa432c80462,Iran's Khamenei warns any U.S. attack would spark 'regional war',https://www.cbc.ca/news/world/iran-supreme-leader-us-attack-regional-war-9.7069829,,2026-02-01T13:24:17Z,Strait of Hormuz,"Iran's supreme leader warned Sunday that any attack by the United States would spark a ""regional war"" in the Middle East, further escalating tensions as U.S. President Donald Trump has threatened to militarily strike the Islamic Republic over its crackdown on…",CBC News,USA,News,2026-02-04T06:56:17.709893Z
b092a9eb6f5b66417e77897e69156224,Iranian official says Revolutionary Guards have no plan to hold military exercises in the Gulf,https://www.thestar.com.my/news/world/2026/02/01/iranian-official-says-revolutionary-guards-have-no-plan-to-hold-military-exercises-in-the-gulf,The Star Online,2026-02-01T13:22:00Z,Strait of Hormuz,"DUBAI, Feb ‌1 (Reuters) - The naval ‌forces of Iran's Revolutionary ‌Guards have no plan to carry out live-fire exercises in ‍the Strait of Hormuz ‍as reported ‌by some media outlets earlier ‍this ​week, an Iranian official told ⁠Reuters on Sunday. Read full …",The Star Online,Unknown,Market Report,2026-02-04T06:56:17.709943Z
bf6c746f7faad65650e7526642b44384,Iranian official says Revolutionary Guards have no plan to hold military exercises in the Gulf,https://www.internazionale.it/ultime-notizie-reuters/2026/02/01/iranian-official-says-revolutionary-guards-have-no-plan-to-hold-military-exercises-in-the-gulf,Internazionale,2026-02-01T12:17:29Z,Strait of Hormuz,"DUBAI, Feb 1 (Reuters) - The naval forces of Iran’s Revolutionary Guards have no plan to carry out live-fire exercises in the Strait of Hormuz as reported by some media o… Leggi",Internazionale.it,Unknown,Market Report,2026-02-04T06:56:17.709985Z
b6531ec0b01398e6bc1248aaeec6fc6a,"Iran's supreme leader warns US that if 'they start a war, this time it will be a regional war'",https://economictimes.indiatimes.com/news/international/world-news/irans-supreme-leader-warns-us-that-if-they-start-a-war-this-time-it-will-be-a-regional-war/articleshow/127839933.cms,AP,2026-02-01T11:06:19Z,Strait of Hormuz,"Iran's supreme leader has issued a stark warning to the United States, stating any war initiated by them will escalate into a regional conflict.  Meanwhile, Iran's parliament speaker has designated all European Union militaries as terrorist organizations.  Th…",The Times of India,USA,News,2026-02-04T06:56:17.710016Z
5245f0fa00f993498fe0003969eeee30,Iran’s supreme leader warns any US attack would spark ‘regional war’,https://nypost.com/2026/02/01/world-news/iran-supreme-leader-ayatollah-ali-khamenei-warns-us-attack-would-spark-regional-war/,Associated Press,2026-02-01T10:54:14Z,Strait of Hormuz,"Iran’s supreme leader warned Sunday that any attack by the United States would spark a “regional war” in the Mideast, further escalating tensions as President Donald Trump has threatened to militarily strike the Islamic Republic.",New York Post,USA,News,2026-02-04T06:56:17.710047Z
47da5e63cf90f6497b1504317b3650ab,Iran's supreme leader warns any US attack would spark 'regional war',https://www.npr.org/2026/02/01/nx-s1-5695698/iran-khamenei-us-attack-warns-regional-war,The Associated Press,2026-02-01T10:23:56Z,Strait of Hormuz,"Iran's supreme leader warned Sunday that any attack by the United States would spark a ""regional war"" in the Mideast, further escalating tensions as President Donald Trump has threatened to militarily strike the Islamic Republic.",NPR,USA,News,2026-02-04T06:56:17.710069Z
3a249a1d219ec98fab623f387574a230,"FM: IRGC upholds peace, stability as foreign meddling fuels escalation",https://www.globalsecurity.org/wmd/library/news/iran/2026/01/iran-260131-presstv02.htm,John Pike,2026-02-01T09:44:16Z,Strait of Hormuz,"Foreign Minister Abbas Araghchi says the Islamic Revolution Guards Corps (IRGC) has played a consistent role in maintaining peace and stability in the Persian Gulf region and the Strait of Hormuz within it, while warning that the presence and actions of extra…",Globalsecurity.org,Unknown,News,2026-02-04T06:56:17.710120Z
d21299fbea4d822d8c2c465e848aaace,Trump says Iran 'seriously talking to us' as military ships head to Middle East,https://www.foxnews.com/politics/trump-says-iran-seriously-talking-us-military-ships-head-middle-east,,2026-02-01T09:21:56Z,Strait of Hormuz,"President Donald Trump said Iran is negotiating “seriously"" with the U.S. as he keeps military options on the table and American naval forces move into the region.",Fox News,USA,News,2026-02-04T06:56:17.710146Z
9de46eac09f33d11739041c09cee9fa1,"Iran in 'serious discussions' with US, Trump says, as military threat looms",https://www.bbc.com/news/articles/cx20z5nv9jxo,,2026-02-01T09:10:35Z,Strait of Hormuz,"Iran is expected to begin a live-fire naval exercise in the Strait of Hormuz, a key shipping route.",BBC News,Unknown,News,2026-02-04T06:56:17.710176Z
7d3fbcefe515c09d58a557b84c78c309,Iran designates EU armies ‘terrorist groups’ in retaliatory move,https://www.aljazeera.com/news/2026/2/1/iran-designates-eu-armies-terrorist-groups-in-retaliatory-move,Al Jazeera Staff,2026-02-01T08:47:38Z,Strait of Hormuz,Move comes after a European Union decision to label the Islamic Revolutionary Guard Corps a 'terrorist organisation'.,Al Jazeera English,Unknown,News,2026-02-04T06:56:17.710216Z
1c252e340033d6f1c5355d2ab2c0be97,Iran says progress made towards US talks,https://www.thejournal.ie/iran-says-progress-made-towards-us-talks-6944114-Feb2026/,Sophie Finn,2026-02-01T08:36:18Z,Strait of Hormuz,Washington has deployed warships off Iran’s shores.,TheJournal.ie,Unknown,News,2026-02-04T06:56:17.710244Z
e2fa42700f0c85dd48853b90ebd8feda,Iran says it now considers EU militaries to be terrorist groups,https://japantoday.com/category/world/iran-says-it-considers-eu-militaries-to-be-terrorist-groups,,2026-02-01T07:00:26Z,Strait of Hormuz,"The speaker of Iran's parliament said Sunday that the Islamic Republic now considers all European Union militaries to be terrorist groups, lashing out after the bloc declared the country's paramilitary Revolutionary Guard a terror group over its bloody crackd…",Japan Today,Unknown,News,2026-02-04T06:56:17.710293Z
c4d9fe745107284fd9fc5b84151123ad,Iran says progress made towards US talks despite attack jitters,https://www.hurriyetdailynews.com/iran-says-progress-made-towards-us-talks-despite-attack-jitters-218454,hurriyetdailynews.com,2026-02-01T06:47:46Z,Strait of Hormuz,"Iran's top security official said Saturday that progress had been made towards negotiations with the United States, even as the Islamic republic's army chief warned Washington against launching military strikes.",Hurriyet Daily News,USA,News,2026-02-04T06:56:17.710316Z
fda785a2b847cb74749db18cbfee1cc0,Iran says it now considers EU militaries to be terrorist groups,https://abcnews.go.com/International/wireStory/iran-considers-eu-militaries-terrorist-groups-129747626,JON GAMBRELL Associated Press,2026-02-01T06:31:29Z,Strait of Hormuz,The speaker of Iran's parliament says that the Islamic Republic now considers all European Union militaries to be terrorist groups,ABC News,Unknown,News,2026-02-04T06:56:17.710349Z
51c8639ddd13c36e7bde8ab2e8d993f2,How a US/Israeli Strike on Iran could Provoke a wider Conflict,https://www.juancole.com/2026/02/israeli-strike-conflict.html,Paul Rogers,2026-02-01T05:04:14Z,Strait of Hormuz,What would a US/Israel operation in Tehran look like? Research carried out two decades ago offers some answers,Juancole.com,Unknown,News,2026-02-04T06:56:17.710380Z
b968c810eff56807fa4db2a324f56aab,U.S. military warns Iran as Middle Eastern county prepares to conduct live fire drills,https://www.cbsnews.com/video/us-military-warns-iran-amid-live-fire-drills/,CBS News,2026-02-01T01:52:00Z,Strait of Hormuz,"The U.S. military has assembled a formidable force within striking distance of Iran. Meanwhile, Iran said it would be starting live fire drills in the Strait of Hormuz this weekend as tensions in the region are sky high. Haley Ott reports.",CBS News,Unknown,Market Report,2026-02-04T06:56:17.710421Z
852ce7bb303627681f016a0c33802c95,Iran says progress made towards US talks,https://www.rte.ie/news/world/2026/0201/1556188-iran-us/,RTÉ News,2026-02-01T01:14:00Z,Strait of Hormuz,"Iran's top security official said that progress had been made towards negotiations with the United States, even as the Islamic republic's army chief warned the US against launching military strikes.",RTE,USA,News,2026-02-04T06:56:17.710441Z
eed92bc183f3d9bde768e2bdebe6c95a,Explosion in Iranian port city ahead of Iran's naval drill in the Strait of Hormuz,https://www.cbsnews.com/news/iranian-port-city-blast-ahead-of-iran-naval-drill-strait-of-hormuz/,,2026-02-01T01:13:07Z,Strait of Hormuz,"The blast happened a day before a planned naval drill by Iran in the Strait of Hormuz, the narrow mouth of the Persian Gulf through which a fifth of all oil traded passes.",CBS News,Unknown,News,2026-02-04T06:56:17.710478Z
a47ae1b2045c27de4372ac42e6dcdd43,BRICS could become a new pillar of global governance—if its rapid growth doesn’t erode its newfound clout,https://fortune.com/2026/01/31/brics-expansion-china-india-tariffs-trump/,Brian Wong,2026-01-31T23:00:00Z,Strait of Hormuz,"Enlargement may look pretty on paper, but BRICS needs ground rules, enforcement, and even just a common message.",Fortune,Global,News,2026-02-04T06:56:17.710518Z
38f68b61c23a41a97c44f11954b16c65,Iranian official says progress made on talks as US-Iran tensions persist,https://www.aljazeera.com/news/2026/1/31/iranian-official-says-progress-made-on-talks-as-us-iran-tensions-persist,Al Jazeera Staff,2026-01-31T22:13:03Z,Strait of Hormuz,"Ali Larijani says efforts to get framework for negotiations advancing, as US naval deployment in Gulf fuels concerns.",Al Jazeera English,Unknown,News,2026-02-04T06:56:17.710552Z
e720b5c6925e321ca8bf11c094b45fb6,Heavier Than Usual Police Presence Reported In Iran,https://dailycaller.com/2026/01/31/iran-heavy-police-presence-tehran-trump-irgc-tensions/,Mark Tanos,2026-01-31T21:10:09Z,Strait of Hormuz,Security forces have flooded the streets of Tehran and other major Iranian cities as the regime braces for potential unrest amid rising tensions with the US.,The Daily Caller,Unknown,Market Report,2026-02-04T06:56:17.710584Z
e32b8152c2a1110a8328337db19091ac,"Blast in Iran port city kills 1, wounds 14 before Strait of Hormuz naval drill watched by US",https://abcnews.go.com/Business/wireStory/blast-iran-port-city-kills-1-wounds-14-129738369,JON GAMBRELL Associated Press,2026-01-31T19:09:41Z,Strait of Hormuz,"An explosion has ripped through an apartment building in the Iranian port city of Bandar Abbas, killing a 4-year-old girl",ABC News,Unknown,News,2026-02-04T06:56:17.710645Z
4215eaa0fd662d19e8374c9ac6974b11,Iran says progress made towards US talks despite attack jitters,https://www.digitaljournal.com/world/iran-says-progress-made-towards-us-talks-despite-attack-jitters/article,AFP,2026-01-31T19:02:20Z,Strait of Hormuz,"Iran’s top security official said Saturday that progress had been made towards negotiations with the United States, even as the Islamic republic’s army chief warned Washington against launching military strikes. Washington has deployed a naval battle group le…",Digital Journal,USA,News,2026-02-04T06:56:17.710674Z
3a9654213579d39d8e3d027eabe36cc8,"Blast in Iran port city kills 1, wounds 14 before navy drill",https://apnews.com/article/iran-bandar-abbas-explosion-us-tensions-protests-881d9b0c3e1178242ff150bd8bb0e091,Jon Gambrell,2026-01-31T18:40:03Z,Strait of Hormuz,"An explosion has ripped through an apartment building in the Iranian port city of Bandar Abbas, killing a 4-year-old girl. Local media footage showed a security force member being carried out by rescuers. The blast happened on Saturday, a day before a planned…",Associated Press,Unknown,News,2026-02-04T06:56:17.710725Z
667b642ef1e269d91b353c9bb494bd6a,"US, Israel deny involvement in mysterious blasts that killed 6, wounded over dozen across Iran",https://nypost.com/2026/01/31/world-news/us-israel-deny-involvement-in-mysterious-blasts-that-killed-6-wounded-over-dozen-across-iran/,Shane Galvin,2026-01-31T18:35:37Z,Strait of Hormuz,The US and Israel are denying involvement in the mysterious blasts that killed six and wounded more than a dozen others across Iran Saturday.,New York Post,Unknown,News,2026-02-04T06:56:17.710762Z
97521785a5c7179845f4a34775386383,No Deal With Iran! An Apocalyptic “Regime Change War” Appears To Be Imminent,https://www.shtfplan.com/headline-news/no-deal-with-iran-an-apocalyptic-regime-change-war-appears-to-be-imminent,Michael Snyder,2026-01-31T18:00:17Z,Strait of Hormuz,"It appears that an apocalyptic war is about to begin in the Middle East, and yet most people living in the Western world don’t seem alarmed by this at all.  But they should be, because once the missiles start flying, the death and destruction that we will wit…",Shtfplan.com,Unknown,News,2026-02-04T06:56:17.710816Z
5410de784677eb9c3a3a2145a1f28cb9,US military warns Iran it will not tolerate any 'unsafe' actions ahead of live-fire drills in Strait of Hormuz,https://www.foxnews.com/us/us-military-warns-iran-not-tolerate-any-unsafe-actions-ahead-live-fire-drills-strait-hormuz,,2026-01-31T17:45:56Z,Strait of Hormuz,"U.S. Central Command warned Iran it will not tolerate ""Any unsafe and unprofessional behavior"" near American forces ahead of live-fire naval drills.",Fox News,USA,News,2026-02-04T06:56:17.710839Z
8a3a25a149b74f5052592547998c2e9b,"Explosion in Iran’s Bandar Abbas caused by gas leak, official says",https://www.aljazeera.com/news/2026/1/31/explosion-in-irans-bandar-abbas-caused-by-gas-leak-official-says,Al Jazeera Staff,2026-01-31T17:26:52Z,Strait of Hormuz,Local fire official says gas leak likely caused blast that ripped through residential building in Iranian port city.,Al Jazeera English,Unknown,News,2026-02-04T06:56:17.710876Z
e4c04fee0775adb26e8385fa842ec319,트럼프가 지명한 새로운 연준 의장 후보 이해하기,https://ryueyes11.tistory.com/512075,T.B,2026-01-31T15:44:56Z,Strait of Hormuz,"Mojtaba Khamenei has amassed sprawling international investments, while economic hardship at home has sparked Iran's deadliest protests in decades. Read the Big Take: https://t.co/525FrI3p6U️: Rouzbeh Fouladi/ZUMA Wire/Shutterstock pic.twitter.com/AY1Dn2F1r…",Tistory.com,Global,News,2026-02-04T06:56:17.710964Z
e4b6a8fdb43bfc981224d90295147cf4,"Bitcoin plunges under $81,000 amid reports of Iran explosions and Binance spat",https://www.coindesk.com/markets/2026/01/31/bitcoin-plunges-under-usd81-000-amid-reports-of-iran-explosions-and-binance-spat,Shaurya Malwa,2026-01-31T14:46:46Z,Strait of Hormuz,"Bitcoin slid toward $81,000 on Saturday as thin weekend liquidity magnified selling pressure, with traders pointing to Middle East tensions, U.S. political risk and lingering crypto-specific uncertainty.",CoinDesk,Unknown,Market Report,2026-02-04T06:56:17.711001Z
31c63c0bcdeaa77bc4cc8af6fdc6086b,"Bitcoin plunges under $80,000 as U.S-Iran attacks deepen",https://www.coindesk.com/markets/2026/01/31/bitcoin-plunges-under-usd80-000-as-u-s-iran-attacks-deepen,"Shaurya Malwa, Francisco Rodrigues",2026-01-31T14:46:46Z,Strait of Hormuz,"Bitcoin slid under $80,000 on Saturday as thin weekend liquidity magnified selling pressure, with traders pointing to Middle East tensions, U.S. political risk and lingering crypto-specific uncertainty.",CoinDesk,Unknown,News,2026-02-04T06:56:17.711037Z
4be46285fd8d81d055d69ca4e3fc4d78,Explosion reportedly rocks Iran’s Bandar Abbas port,https://nypost.com/2026/01/31/world-news/explosion-reportedly-rocks-irans-bandar-abbas-port/,Shane Galvin,2026-01-31T13:15:05Z,Strait of Hormuz,"An explosion rocked Iran Saturday, although the cause of the blast has not been announced, state media reported.",New York Post,Unknown,Market Report,2026-02-04T06:56:17.711071Z
e8b5695133e84eded03e0cd01b8f6831,How a US/Israeli Strike on Iran Could Ignite a Wider Conflict,https://www.nakedcapitalism.com/2026/01/how-a-us-israeli-strike-on-iran-could-ignite-a-wider-conflict.html,Yves Smith,2026-01-31T11:51:59Z,Strait of Hormuz,Neither Iran nor Trump look likely to blink in their regime change staredown. What happens if the US proceeds and can't win quickly?,Nakedcapitalism.com,Unknown,News,2026-02-04T06:56:17.711105Z
