article_id,title,link,creator,pubdate,category,description,source,country,article_type,scrape_timestamp
143cbc4fdcddc0e2f9bbce3103e21eb7,This Thanksgiving’s real drama may be Michael Burry versus Nvidia,https://finance.yahoo.com/news/thanksgiving-real-drama-may-michael-193221928.html,Connie Loizos,2025-11-27T19:32:21Z,coal demand,"Is Burry the canary in the coal mine, warning of a collapse that's inevitable? Or could his fame, his track record, his now unrestricted voice, and a fast...",Yahoo Entertainment,Unknown,News,2025-12-01T06:36:53.428744Z
2c20b39ac627b1313b61a265901fdf40,Here’s Why Your Electricity Bill May Skyrocket This Holiday Season,https://dailycaller.com/2025/11/27/heres-why-your-electricity-bill-may-skyrocket-holiday-season/,Audrey Streb,2025-11-27T19:05:24Z,coal demand,"As the holiday season approaches, one prevailing headache set to keep hammering Americans is exorbitant electricity costs.",The Daily Caller,USA,News,2025-12-01T06:36:53.428765Z
12e55bfcbe2415d423231c65c82f9639,A flawed but authentic COP30 in the Brazilian Amazon,https://www.cbc.ca/news/climate/what-on-earth-cop30-9.6994258,,2025-11-27T19:00:00Z,coal demand,"In this issue of our environmental newsletter, we hear about the surprises faced by reporters at the UN climate conference in Belém, Brazil; find out why plug-in hybrids aren't turning out to be as green as expected; and meet people hosting whale-detecting sy…",CBC News,Brazil,Market Report,2025-12-01T06:36:53.428786Z
0f2f03c365254c316aeab249ca5f659a,"The Cloud’s Not Fluffy, It’s a Hot, Loud Factory",https://oilprice.com/Energy/Energy-General/The-Clouds-Not-Fluffy-Its-a-Hot-Loud-Factory.html,Michael Kern,2025-11-27T19:00:00Z,coal demand,"The Cloud"" might be the greatest branding trick in history. It sounds fluffy, ethereal, and notably light. It implies that our digital lives…our emails, our crypto wallets, our endless scrolling…exist in some vaporous layer of the atmosphere, detached from ea…",OilPrice.com,Unknown,News,2025-12-01T06:36:53.428831Z
bcf299387f5ccb6d87b72762a37e38cc,China Braces for a Winter That Could Break Its Power Grid,https://oilprice.com/Latest-Energy-News/World-News/China-Braces-for-a-Winter-That-Could-Break-Its-Power-Grid.html,Julianne Geiger,2025-11-27T18:30:00Z,coal demand,"China is heading into winter expecting record power use again, and officials are already warning that both electricity load and daily gas demand are likely to set new highs. The NDRC says the heating season will run longer this year. That usually means heavie…",OilPrice.com,China,Market Report,2025-12-01T06:36:53.428850Z
9c7b46c25a2ca51cb9ca21849f270b89,Railways eyes new ways to boost non-fare revenue,https://economictimes.indiatimes.com/industry/transportation/railways/railways-eyes-new-ways-to-boost-non-fare-revenue/articleshow/125621796.cms,Twesh Mishra,2025-11-27T18:25:11Z,coal demand,"Indian Railways is intensifying efforts to boost non-fare revenue (NFR) by exploring new avenues like leasing guesthouse space, monetizing residue materials from wagons, and selling station waste. The goal is to significantly increase NFR earnings, which curr…",The Times of India,India,News,2025-12-01T06:36:53.428876Z
ef3cc440a0c9ade0cf79b60cc46878ea,Tata Power’s Mundra plant likely to restart by year-end,https://www.thehindubusinessline.com/companies/tata-powers-mundra-plant-likely-to-restart-by-year-end/article70331464.ece,Our Bureau,2025-11-27T15:06:58Z,coal demand,Tata Power's Mundra plant is set to restart operations by year-end after discussions with the Gujarat government.,BusinessLine,Unknown,News,2025-12-01T06:36:53.428950Z
67b2216611e912ed9c7b8a8712ccba46,A Few Markers on the Road to The Demise of The Climate Apocalypse,https://wattsupwiththat.com/2025/11/27/a-few-markers-on-the-road-to-the-demise-of-the-climate-apocalypse/,Guest Blogger,2025-11-27T14:00:00Z,coal demand,May the climate apocalypse continue to fade slowly into the rear view mirror.,Wattsupwiththat.com,Unknown,Analysis/Opinion,2025-12-01T06:36:53.428973Z
52d499325b84c365130ba9434b33e4cd,The Green Swap: Recalibrating Sovereign Finance for Climate and Development Symbiosis,https://www.fairobserver.com/economics/the-green-swap-recalibrating-sovereign-finance-for-climate-and-development-symbiosis/,Masaaki Yoshimori,2025-11-27T13:51:59Z,coal demand,The contemporary global economy stands at a pivotal inflection point — one at which debt sustainability and climate resilience can no longer be regarded as orthogonal policy domains but as mutually constitutive imperatives within a single macro-financial syst…,Fair Observer,Global,News,2025-12-01T06:36:53.429024Z
e0cec2dfb09df4bafd0055aa99686c38,"UPSC Key: Bangladesh’s request to extradite Hasina, Rare earth magnet scheme, and Digital sovereignty",https://indianexpress.com/article/upsc-current-affairs/upsc-key-extradite-hasina-rare-earth-magnet-digital-sovereignty-10389499/,"Khushboo Kumari, Roshni Yadav",2025-11-27T12:49:41Z,coal demand,"UPSC current affairs: How is the Centre’s approval of the rare-earth magnet scheme important for your UPSC exam? What significance do topics such as digital sovereignty, Aravalli Hills, and Bill on a single higher education authority have for both the Prelimi…",The Indian Express,Unknown,News,2025-12-01T06:36:53.429088Z
613ee1ff8d392391b5c2aca891c6e2b5,Why America’s Power Grid Will Be Able To Withstand The $2.5 Trillion A.I. Datacenter Building Boom,https://www.forbes.com/sites/christopherhelman/2025/11/27/why-americas-power-grid-will-be-able-to-withstand-the-25-trillion-ai-datacenter-building-boom/,"Christopher Helman, Forbes Staff, 
 Christopher Helman, Forbes Staff
 https://www.forbes.com/sites/christopherhelman/",2025-11-27T11:30:00Z,coal demand,"The U.S. has plenty of options to meet the vast energy demands of A.I. From solar and batteries to natural gas and new nuclear, if there is a will there's a way.",Forbes,USA,News,2025-12-01T06:36:53.429116Z
3058e62c04e39fd55f869cf503c4dca1,Broker’s call: NLC India (Buy),https://www.thehindubusinessline.com/markets/brokers-call-nlc-india-buy/article70330111.ece,KS Badri Narayanan,2025-11-27T11:26:43Z,coal demand,"Elara Capital recommends buying NLC India with a target price of ₹320, citing strong revenue and EBITDA growth.",BusinessLine,India,News,2025-12-01T06:36:53.429135Z
45392c60066bfb1b55d700b613a1ee76,China’s Envision Group mulls India battery plant as storage demand rises,https://www.bloomberg.com/news/articles/2025-11-27/chinese-firm-mulls-india-battery-plant-as-storage-demand-rises,Bloomberg,2025-11-27T10:39:50Z,coal demand,India’s ability to accelerate the installation of renewables is threatened by a lack of storage systems that are needed to stabilize power transmission,Bloomberg,China,News,2025-12-01T06:36:53.429154Z
67ccb468c87866fabfc78ff235ad2ee5,Chinese Firm Mulls India Battery Plant as Storage Demand Rises,https://financialpost.com/pmn/business-pmn/chinese-firm-mulls-india-battery-plant-as-storage-demand-rises,Bloomberg News,2025-11-27T09:53:45Z,coal demand,China’s Envision Group is considering building a battery making plant in India to take advantage of a push by authorities to upgrade the grid to handle more renewables.,Financial Post,China,News,2025-12-01T06:36:53.429172Z
fe4e5d4c657860d564f7afab2e7e0c68,"Decarbonizing the Chemical Industry Research Report 2025: Electrification and Process Efficiency for Short-term Emission Reductions and Scaling Up CCUS, Low-carbon Hydrogen, and Alternative Feedstocks",https://www.globenewswire.com/news-release/2025/11/27/3195524/28124/en/Decarbonizing-the-Chemical-Industry-Research-Report-2025-Electrification-and-Process-Efficiency-for-Short-term-Emission-Reductions-and-Scaling-Up-CCUS-Low-carbon-Hydrogen-and-Alter.html,Research and Markets,2025-11-27T09:05:00Z,coal demand,"Key opportunities in the chemical industry market include advancing electrification and process efficiency for short-term emission reductions and scaling up CCUS, low-carbon hydrogen, and alternative feedstocks for long-term decarbonization. The sector's tran…",GlobeNewswire,Unknown,Market Report,2025-12-01T06:36:53.429223Z
4651f02324566314e8191eac3160255c,Russians Are Starting to Feel Real Economic Pain From Putin’s War,https://finance.yahoo.com/news/russians-starting-feel-real-economic-180000653.html,Bloomberg News,2025-11-27T08:04:37Z,coal demand,Dozens of regions in central and southern Russia are now feeling the war’s proximity as drones and sometimes missiles hit energy sites and residential...,Yahoo Entertainment,Russia,News,2025-12-01T06:36:53.429250Z
47694a274185b85e90c86bf374177016,Skeptical Science New Research for Week #48 2025,https://skepticalscience.com/new_research_2025_48.html,,2025-11-27T07:53:36Z,coal demand,"Open access notables

Observed large-scale and deep-reaching compound ocean state changes over the past 60 years, Tan et al., Nature Climate Change

Multiple climate-related stressors affect the ocean, including warming, acidification, deoxygenation and varia…",Skepticalscience.com,Unknown,News,2025-12-01T06:36:53.429297Z
16e7e4c0b9136c6f26c1457b2156a34e,"IREDA's 632% vertical takeoff to 42% slide in just 50 sessions, PSU stock gives a reality check. Buy, hold or exit?",https://economictimes.indiatimes.com/markets/stocks/news/iredas-632-vertical-takeoff-to-42-slide-in-just-50-sessions-psu-stock-gives-a-reality-check-buy-hold-or-exit/articleshow/125606952.cms,Shivendra Kumar,2025-11-27T06:29:41Z,coal demand,"IREDA shares have witnessed volaityly in the recent past,  surging 632% in 13 months before tumbling 42% in just 50 sessions. Despite strong Q2FY26 earnings and long-term growth potential, analysts warn of ongoing bearish momentum, margin pressures, and secto…",The Times of India,Unknown,News,2025-12-01T06:36:53.429347Z
5dd837135c3b0f511d41956e638abea9,"World off track on climate action amid fossil fuel crisis, lobbying pressures, warns Treaty director",https://economictimes.indiatimes.com/news/international/world-news/world-off-track-on-climate-action-amid-fossil-fuel-crisis-lobbying-pressures-warns-treaty-director/articleshow/125605920.cms,PTI,2025-11-27T05:37:23Z,coal demand,The climate crisis disproportionately affects the poor. A global campaign urges a new treaty to phase out fossil fuels. Current climate talks are not on track. India's energy transition is crucial. A conference in Colombia will discuss overcoming fossil fuel …,The Times of India,India,News,2025-12-01T06:36:53.429375Z
3449bcf7726942043dd87f7bf4efa441,Ferrero Launches Full 2025 Collection Of Holiday Sweets,https://bleedingcool.com/pop-culture/ferrero-launches-full-2025-collection-of-holiday-sweets/,Gavin Sheehan,2025-11-27T03:35:03Z,coal demand,"Ferrero is celebrating the holidays with a complete catalog of sweets and candies for the holiday season, as they have over 50 products that have been dropped into stores and online. Some of the new items include Schoko Bons, a Raffaello Holiday Gift Box, a R…",Bleeding Cool News,Unknown,News,2025-12-01T06:36:53.429421Z
dfcf3f16a337aa3c1eeab7940d85f68b,Why these 4 infra/realty stocks will remain in focus,https://www.thehindubusinessline.com/markets/why-these-4-infrarealty-stocks-will-remain-in-focus/article70328633.ece,KS Badri Narayanan,2025-11-27T02:00:27Z,coal demand,"Explore why Patel Engineering, Oberoi Realty, Kesar India, and Anant Raj are key players in the real estate and infrastructure sectors.",BusinessLine,India,News,2025-12-01T06:36:53.429439Z
bb902313536b1576d0eacfa5d3597c18,DAVID BLACKMON: Trump’s New AI Focused ‘Manhattan Project’ Adds Pressure To Grid,https://dailycaller.com/2025/11/26/opinion-trumps-new-ai-focused-manhattan-project-adds-pressure-to-grid-david-blackmon/,David Blackmon,2025-11-27T01:07:39Z,coal demand,Will America’s electricity grid make it through the impending winter of 2025-26 without suffering major blackouts? It’s a legitimate question.,The Daily Caller,USA,News,2025-12-01T06:36:53.429463Z
6c4718035db2dbec34622ce5922682d3,All You Need To Know Going Into Trade On Thursday,https://www.ndtvprofit.com/markets/stock-market-today-all-you-need-to-know-going-into-trade-on-november-27-2025,Vansh Pansari,2025-11-27T00:30:00Z,coal demand,"Nifty settled above 26,200 mark on Wednesday, just 72 points away from a record-high. Nifty Dec futures is up by 1.28 % to 26381 at a premium of 176 points. Nifty Nov futures open interest up by 2.28% Nifty Options 18 Nov Expiry: Maximum Call open interest at…",Ndtvprofit.com,Unknown,News,2025-12-01T06:36:53.429508Z
5475c91ba60b59939a716eb4e6ef9f63,How to Play the Nuclear Boom,https://dailyreckoning.com/how-to-play-the-nuclear-boom/,Matt Badiali,2025-11-26T23:00:40Z,coal demand,"This post How to Play the Nuclear Boom appeared first on Daily Reckoning.
Matt Badiali says one stock stands to benefit the most (not Cameco)...
The post How to Play the Nuclear Boom appeared first on Daily Reckoning.",Dailyreckoning.com,Unknown,Market Report,2025-12-01T06:36:53.429540Z
f132f74c5b0bdfb4bfa7b8e1cd69ad1f,IEA Publishes Climate Era’s Obituary,https://wattsupwiththat.com/2025/11/26/iea-publishes-climate-eras-obituary/,Guest Blogger,2025-11-26T22:00:00Z,coal demand,"The end is nigh – not for the world, but for the climate industrial complex. It has been a decline brought about mainly by the sheer reality of energy economics in the developing world.",Wattsupwiththat.com,Unknown,News,2025-12-01T06:36:53.429579Z
4d226e7b7276af196252375de9576feb,Green Hydrogen Market Size to Worth USD 413.20 Bn by 2035,https://www.globenewswire.com/news-release/2025/11/26/3195362/0/en/Green-Hydrogen-Market-Size-to-Worth-USD-413-20-Bn-by-2035.html,Precedence Research,2025-11-26T20:06:00Z,coal demand,"According to Towards Chemical and Materials Consulting, the global green hydrogen market is projected to grow from USD 12.85 billion in 2025 to USD 413.20 billion by 2035, growing at a compound annual growth rate (CAGR) of 41.49% over the forecast period from…",GlobeNewswire,Global,Analysis/Opinion,2025-12-01T06:36:53.429617Z
6921f0cedb94ddbe076201564706e254,Amazon Workers Issue Warning About Company’s ‘All-Costs-Justified’ Approach to AI Development,https://www.wired.com/story/amazon-employees-open-letter-artificial-intelligence-layoffs/,Paresh Dave,2025-11-26T19:04:54Z,coal demand,"Amazon Employees for Climate Justice says that over 1,000 workers have signed a petition raising “serious concerns” about the company’s “aggressive rollout” of artificial intelligence tools.",Wired,Unknown,News,2025-12-01T06:36:53.429660Z
1dc0e0f2bb351d1e1c6beabb28353913,Russians Are Starting to Feel Real Economic Pain From Putin’s War,https://financialpost.com/pmn/business-pmn/russians-are-starting-to-feel-real-economic-pain-from-putins-war,Bloomberg News,2025-11-26T18:20:22Z,coal demand,"As President Vladimir Putin’s war on Ukraine enters a fourth winter, Russians are having to come to grips with its growing impact on nearly every aspect of their daily lives.",Financial Post,Russia,Market Report,2025-12-01T06:36:53.429684Z
e8d05b6dc9ac0f1f211bfb9e7b1f8fe5,The UK must secure supplies of 34 critical minerals says new report – here’s how,https://theconversation.com/the-uk-must-secure-supplies-of-34-critical-minerals-says-new-report-heres-how-269022,"Michael Kendall, Professor of Geophysics, University of Oxford, Caitlin McElroy, Departmental Research Lecturer, Smith School of Enterprise and the Environment, University of Oxford, Jon Blundy, Royal Society Research Professor, Earth Sciences, University of Oxford",2025-11-26T18:19:51Z,coal demand,New technologies could transform the way we mine – and recycle – critical minerals.,The Conversation Africa,Unknown,Market Report,2025-12-01T06:36:53.429716Z
c6207df1681f0bb55de3d8736141ada8,Turkey will host the next UN climate summit – here’s how it plans to use its moment in the spotlight,https://theconversation.com/turkey-will-host-the-next-un-climate-summit-heres-how-it-plans-to-use-its-moment-in-the-spotlight-270495,"Ezgi Unsal, Lecturer in Development Economics, SOAS, University of London",2025-11-26T18:19:50Z,coal demand,Can a country so key to the global oil and gas trade help broker a deal that accelerates the end of fossil fuels?,The Conversation Africa,Turkey,Market Report,2025-12-01T06:36:53.429745Z
a17b7071c3af248323acb8c5a890cc80,"Tata Power in talks with Odisha to set up 10 GW ingots, wafers plant",https://economictimes.indiatimes.com/industry/renewables/tata-power-in-talks-with-odisha-to-set-up-10-gw-ingots-wafers-plant/articleshow/125596639.cms,Kalpana Pathak and Nikita Periwal,2025-11-26T18:11:16Z,coal demand,"Ingots and wafers are key raw materials used in the production of solar cells and modules, as well as semiconductor chips. Tata Power, which currently has 4.55 GW of cell and module manufacturing capacity, aims to backward integrate ingots and wafers into its…",The Times of India,Unknown,News,2025-12-01T06:36:53.429792Z
8f2284d854aef5ca85e72f7b276d2085,"COP30: petrostates block climate deal once again, but some countries are taking their own decisive steps to phase out fossil fuels",https://theconversation.com/cop30-petrostates-block-climate-deal-once-again-but-some-countries-are-taking-their-own-decisive-steps-to-phase-out-fossil-fuels-270580,"Jordi Roca Jusmet, Catedrático de Economía, Universitat de Barcelona",2025-11-26T16:07:53Z,coal demand,"Saudi Arabia and Russia often veto COP agreements, but Colombia and The Netherlands are taking matters into their own hands.",The Conversation Africa,Russia,News,2025-12-01T06:36:53.429815Z
8c76a3d97dacddfce8009d2ff4519fe8,Budget 2025 speech,https://www.gov.uk/government/speeches/budget-2025-speech,HM Treasury,2025-11-26T15:58:51Z,coal demand,Budget 2025 speech as delivered by Chancellor Rachel Reeves.,Www.gov.uk,Unknown,News,2025-12-01T06:36:53.429838Z
eb1a6775b160fd47afec9b8c657c5c6d,Time for Indonesian durian to triumph in the global market,https://en.antaranews.com/news/393909/time-for-indonesian-durian-to-triumph-in-the-global-market,Yashinta Difa Pramudyani,2025-11-26T13:49:18Z,coal demand,"Indonesian durian is emerging as a new force in the global durian industry, following increasing demand and stronger international cooperation in the sector, ...",Antaranews.com,Indonesia,Market Report,2025-12-01T06:36:53.429860Z
75a4ab75e24b2e2eec2b98051269d39b,"Liquified Petroleum Gas Market Forecasts Report 2025-2030: Urbanization, Industrial Growth, Environmental Regulations, and Emerging Use in the Shipping Sector are Accelerating Growth",https://www.globenewswire.com/news-release/2025/11/26/3195145/28124/en/Liquified-Petroleum-Gas-Market-Forecasts-Report-2025-2030-Urbanization-Industrial-Growth-Environmental-Regulations-and-Emerging-Use-in-the-Shipping-Sector-are-Accelerating-Growth.html,Research and Markets,2025-11-26T13:33:00Z,coal demand,"The LPG market growth is spurred by its eco-friendly nature and cost-effectiveness, especially in the residential, commercial, and marine sectors. Key opportunities lie in Asia-Pacific's urbanization and energy needs, backed by government support, and North A…",GlobeNewswire,Unknown,Analysis/Opinion,2025-12-01T06:36:53.429910Z
3087f19f1e2c2f00f525ad6285394e77,A Few Markers On The Road To The Demise Of The Climate Apocalypse,https://freerepublic.com/focus/f-chat/4354680/posts,Manhattan Contrarian,2025-11-26T12:56:37Z,coal demand,"For a long time it has been obvious to me, and to any thinking person, that the climate apocalypse scare would sooner or later collapse of its own absurdity. But how? And when? During the past couple of weeks I have noted a few markers. Maybe you have noted o…",Freerepublic.com,Unknown,News,2025-12-01T06:36:53.429955Z
137c84bd273753afa4a38e4ab6df871b,"Fans think this is the best strategy board game ever made, and I have to admit that they've got a point",https://www.gamesradar.com/games/board-games/brass-birmingham-review/,Matt Thrower,2025-11-26T12:31:46Z,coal demand,Is this highly-regarded strategy game worth diving into?,GamesRadar+,Unknown,News,2025-12-01T06:36:53.429982Z
881e2dea81564c8af93e5b6ef7d931d4,Trump’s Plan for Drilling off California and Florida Coasts Faces Bipartisan Opposition,https://www.motherjones.com/politics/2025/11/trump-order-offshore-drilling-california-florida-bipartisan-opposition/,Keerti Gopal,2025-11-26T12:30:00Z,coal demand,"This story was originally published by Inside Climate News and is reproduced here as part of the Climate Desk collaboration. It’s not often that the governors of California and Florida are on the same page, but this week they’re aligned in opposition to the W…",Mother Jones,Unknown,News,2025-12-01T06:36:53.430033Z
66dd1cb9add74f22754b68895baa0975,Links 11/26/2025,https://www.nakedcapitalism.com/2025/11/links-11-26-2025.html,Conor Gallagher,2025-11-26T11:55:23Z,coal demand,"Our daily links, including Russiagate 2.0, multipolar mirage, deviance decline, and cocaine hippos.",Nakedcapitalism.com,Russia,Market Report,2025-12-01T06:36:53.430048Z
a2f70b34e9b5b6a9f514bd2754c169f6,'Make-or-break' Budget as oil industry calls for windfall tax to go,https://www.bbc.com/news/articles/ckg9z2r8d3ko,,2025-11-26T11:39:59Z,coal demand,"North Sea producers say the tax, introduced when Russia's invasion of Ukraine caused oil prices to spike, is crippling the sector.",BBC News,Russia,Market Report,2025-12-01T06:36:53.430075Z
b8e34f5d70c5ee21d7e95358655a7893,Legal & Illegal Immigration numbers must drop to carrying capacity,https://energyskeptic.com/2025/legal-illegal-immigration-must-stop/,energyskeptic,2025-11-26T11:20:09Z,coal demand,"Source: The Overpopulation Project (2020) Is overpopulation a dirty word?  Too many people consuming too much Preface. Without fossil fuels, the carrying capacity of the planet would be around 300 million people. With fossils population has exploded 27-fold t…",Energyskeptic.com,Unknown,News,2025-12-01T06:36:53.430122Z
e305d0cd931f0b5adf443585ab337fbb,Electricity Price Squeeze: Something’s Going to Give,https://www.resilience.org/stories/2025-11-26/electricity-price-squeeze-somethings-going-to-give/,Richard Heinberg,2025-11-26T11:00:18Z,coal demand,"Electricity is our energy future, but the details of that future are still sketchy. Right now, the picture is being drawn by billionaire investors, but it looks dark and dystopian. Surely more imaginative artists could do better.",Resilience,Unknown,News,2025-12-01T06:36:53.430163Z
4980cf8d5c4e136536288ad1ac350de4,US communities fight to save renewable energy projects,https://www.dw.com/en/can-the-us-renewables-sector-get-around-trump-and-replace-oil-coal-gas/a-74882730,Gaea Katreena Cabico,2025-11-26T10:01:00Z,coal demand,"Ten months into Donald Trump's second term, communities across the US are scrambling to keep clean energy projects alive as federal support dries up.",DW (English),Unknown,News,2025-12-01T06:36:53.430214Z
c3580dd96bd3516d654222e850f1df99,"G20, COP30 and More Mickey-Mouse Multilateralism to Come",https://www.counterpunch.org/2025/11/26/g20-cop30-and-more-mickey-mouse-multilateralism-to-come/,Patrick Bond,2025-11-26T06:56:02Z,coal demand,"The third weekend in November offered the world two disastrous days for solving polycrisis problems, starting in the Brazilian Amazon city of Belém at the United Nations climate summit (‘COP30’) on November 22, just as South African President Cyril Ramaphosa …",CounterPunch,Brazil,News,2025-12-01T06:36:53.430237Z
dbc7f6beb8a1b4b7bd337a9a293dc5f1,"Rs 4 lakh crore rally in 1 day! Key factors driving Sensex, Nifty to near record high",https://economictimes.indiatimes.com/markets/stocks/news/rs-4-lakh-crore-rally-in-1-day-key-factors-driving-sensex-nifty-to-near-record-high/articleshow/125580896.cms,ETMarkets.com,2025-11-26T05:50:28Z,coal demand,"Indian stock markets, Nifty and Sensex, surged on Wednesday, breaking a three-day losing streak. Hopes of a US Fed rate cut, easing FII outflows, declining crude oil prices, and a broad-based rally in global and domestic equities fueled the market's upward mo…",The Times of India,India,Market Report,2025-12-01T06:36:53.430258Z
c8ab17a0ce82d1fcc9beefc18c621450,Ozymandias on the Potomac: Energy Policy and the Politics of American Decline,https://www.juancole.com/2025/11/ozymandias-politics-american.html,Alfred W. McCoy,2025-11-26T05:04:11Z,coal demand,"( Tomdispatch.com ) - At the dawning of the British Empire in 1818, the romantic poet Percy Bysshe Shelley penned a memorable sonnet freighted with foreboding about the inevitable decline of all empires, whether in ancient Egypt or then-modern Britain. In She…",Juancole.com,USA,News,2025-12-01T06:36:53.430286Z
3d4ba8c973df42ded0087ce92847c1ef,"The long, fun list of things we could do with unlimited clean energy",https://www.vox.com/climate/470389/energy-abundance-solar-wind-nuclear-desalination-food-climate,Umair Irfan,2025-11-25T23:39:38Z,coal demand,"What could you do with energy that’s cheap, clean, and near unlimited? You could live in a home built to your precise needs that stays cozy and cool all year long. You could swim in a heated pool filled with ultra-pure recycled water. You could grill a steak …",Vox,Unknown,News,2025-12-01T06:36:53.430331Z
3cf9eeb99da72206a0fdf8cd241e585f,"Data Centers, AI, and Energy: Everything You Need to Know",https://oilprice.com/Energy/Energy-General/Data-Centers-AI-and-Energy-Everything-You-Need-to-Know.html,Michael Kern,2025-11-25T22:00:00Z,coal demand,"For the past decade, the defining narrative of the global energy sector has been the transition of supply. Governments, utilities, and investors have focused almost exclusively on shifting generation assets from fossil fuels to renewables, retiring coal plant…",OilPrice.com,Global,News,2025-12-01T06:36:53.430377Z
