article_id,title,link,creator,pubdate,category,description,source,country,article_type,scrape_timestamp
be3c4ef899bfe36fbd366e5ddb247e66,Beyond the lanterns—how Hoi An’s creative scene is lighting up,https://www.nationalgeographic.com/travel/article/explore-how-contemporary-hoi-ans-creative-scene-is-lighting-up-vietnam,@NatGeoTravel,2026-05-31T00:00:00Z,maritime transport,"Lit by silk lanterns and lined with timber-framed shophouses, Hoi An is the jewel of Vietnam’s central coast — but this historic city also has a contemporary side, one where abstract artists and sophisticated bars illuminate hidden corners.",National Geographic,Unknown,News,2026-06-06T08:35:41.354317Z
95f7aedfbaf390e7f14abf203206f33c,TTW Unveils Top 50 Coolcation Travel Destinations in the World for 2026,https://www.prnewswire.com/news-releases/ttw-unveils-top-50-coolcation-travel-destinations-in-the-world-for-2026-302786333.html,,2026-05-30T19:36:00Z,maritime transport,"NEW YORK, May 30, 2026 /PRNewswire/ -- Travel And Tour World (TTW) today reveals its definitive guide for the adventurous and the style-savvy: TTW Unveils Top 50 Coolcation Destinations in the World for 2026. This groundbreaking ranking celebrates destination…",PRNewswire,Unknown,Market Report,2026-06-06T08:35:41.354361Z
6448a42ffedcd72e81b658b35068a109,Oldest Active Navy Aircraft Carrier To Make Final Overseas Port Call,https://www.forbes.com/sites/petersuciu/2026/05/30/oldest-active-navy-aircraft-carrier-to-make-final-overseas-port-call/,"Peter Suciu, Contributor, 
 Peter Suciu, Contributor
 https://www.forbes.com/sites/petersuciu/",2026-05-30T16:45:13Z,maritime transport,"The United States Navy’s USS Nimitz will arrive in Jamaica on Monday, the final overseas port call during the warship’s goodwill tour.",Forbes,USA,News,2026-06-06T08:35:41.354383Z
228c744833d4af43f8b6fe0bd1e452b8,"Arctic Route, Far From Tensions, Could Be Alternative to Hormuz",https://www.globalresearch.ca/arctic-route-alternative-hormuz/5928178,Ahmed Adel,2026-05-30T14:16:13Z,maritime transport,"The far north of the globe is seeing new maritime routes open as the Arctic ice sheet melts, shortening the distance between China and Europe. 
Beijing has seized the opportunity and expanded its operations in the region. The Northern Sea …
The post Arctic Ro…",Globalresearch.ca,China,News,2026-06-06T08:35:41.354403Z
5bee4064bd06f406502b7a77886d48fa,UAE ports lose ground as Iran-Pakistan land corridor reshapes regional transit: Report,https://www.globalsecurity.org/military/library/news/2026/05/mil-260530-presstv04.htm,John Pike,2026-05-30T12:00:00Z,maritime transport,"The newly activated land corridor between Iran and Pakistan has reportedly broken the UAE's maritime monopoly on West Asian transit, offering a route that bypasses the Strait of Hormuz and connects to China's $60 billion economic corridor.",Globalsecurity.org,China,Market Report,2026-06-06T08:35:41.354417Z
d612864edb6e1e0257b6a9c991575246,"Russia, India Committed to Strengthening Naval Cooperation - Russian Maritime Board",https://sputnikglobe.com/20260530/russia-india-committed-to-strengthening-naval-cooperation---russian-maritime-board-1124214627.html,Sputnik International,2026-05-30T11:22:22Z,maritime transport,"MOSCOW (Sputnik) - Russia and India are committed to strengthening naval cooperation, the Russian Maritime Board said on Saturday following consultations on maritime cooperation in Moscow.",Sputnikglobe.com,India,News,2026-06-06T08:35:41.354438Z
c799092edcc6045c0fdeea18c19e8102,BMKG warns of 4-meter waves in Indonesian waters through June 2,https://en.antaranews.com/news/417372/bmkg-warns-of-4-meter-waves-in-indonesian-waters-through-june-2,Arie Novarina,2026-05-30T10:53:10Z,maritime transport,"Indonesia&#39;s Meteorology, Climatology, and Geophysics Agency (BMKG) has warned of waves reaching up to 4 meters in several Indonesian waters, posing risks ...",Antaranews.com,Indonesia,News,2026-06-06T08:35:41.354465Z
8c8902e5532aa7c58e3d97debb9148f5,Rare Russian Tu-142MR Submarine Communications Aircraft Reportedly Destroyed In Ukrainian Drone Strike,https://theaviationist.com/2026/05/30/tu-142mr-ukrainian-drones-attack/,David Cenciotti,2026-05-30T10:32:59Z,maritime transport,An overnight attack on Russia’s Taganrog airfield reportedly destroyed two Tu-142s including a rare “MR” radio relay variant used to communicate with ballistic missile submarines. Ukraine launched coordinated drone strikes on Russian energy infrastructure and…,Theaviationist.com,Russia,Market Report,2026-06-06T08:35:41.354495Z
7c2a35892e8b6fbc0c9f3e3484cc13cd,Taj Malabar Resort & Spa review: Where the hardest decision is to do nothing at all,https://www.nzherald.co.nz/travel/taj-malabar-resort-spa-review-where-the-hardest-decision-is-to-do-nothing-at-all/VPUW53YJJFCMNMTMO6QQIGES44/,NZ Herald,2026-06-05T07:00:00Z,cargo shipping,A stay where relaxation comes first and lounging in bed is encouraged.,New Zealand Herald,Unknown,Analysis/Opinion,2026-06-06T08:35:41.714780Z
61ab76f6878e6ab1cfc495024ac520c9,Shipping industry expo in China's Tianjin highlights AI opportunities,https://www.globenewswire.com/news-release/2026/06/05/3307176/0/en/Shipping-industry-expo-in-China-s-Tianjin-highlights-AI-opportunities.html,Zhenwei International Exhibition Group,2026-06-05T02:48:00Z,cargo shipping,"TIANJIN, China, June 04, 2026 (GLOBE NEWSWIRE) -- The 4th Tianjin International Shipping Industry Expo (TISIE) opened in north China's Tianjin Municipality on June 2, was organized by Zhenwei International Exhibition Group, showcasing growing AI opportunities…",GlobeNewswire,China,News,2026-06-06T08:35:41.715029Z
72bba259268d7f1a820f0bf59e461397,‘Dockworkers central to green port transformation’,https://punchng.com/dockworkers-central-to-green-port-transformation/,Punch Newspapers,2026-06-05T00:35:53Z,cargo shipping,Maritime stakeholders have stressed the need for targeted training of dockworkers and workforce development to prepare workers for emerging technologies and sustainable port operations. Stakeholders also stated that dockworkers are an integral part of Nigeria…,The Punch,Unknown,News,2026-06-06T08:35:41.715086Z
f012bae494f30cb663524727cd5426c8,New York DA Indicts Uzbek Truck Hijackers in $4.5 Million Theft Ring,https://www.breitbart.com/crime/2026/06/04/new-york-da-indicts-uzbek-truck-hijackers-in-4-5-million-theft-ring/,Warner Todd Huston,2026-06-04T22:38:13Z,cargo shipping,"Authorities in New York have busted a truck cargo hijacking ring allegedly run by Uzbek national Murodullo “Murad” Khasanov.
The post New York DA Indicts Uzbek Truck Hijackers in $4.5 Million Theft Ring appeared first on Breitbart.",Breitbart News,Unknown,News,2026-06-06T08:35:41.715175Z
cca5480dfd59f660a42f201281ffe5a1,"Sarbananda Sonowal discusses Rs 19,209 cr investment plan with Suvendu to boost Bengal maritime sector",https://thehillstimes.in/national/sarbananda-sonowal-discusses-rs-19209-cr-investment-plan-with-suvendu-to-boost-bengal-maritime-sector,The Hills Times,2026-06-04T22:35:00Z,cargo shipping,"KOLKATA, June 4: Union Minister Sarbananda Sonowal on Thursday met West Bengal Chief Minister Suvendu Adhikari and discussed a proposed investment of Rs 19,209 crore aimed at transforming the state into eastern India’s maritime, logistics and shipbuilding hub…",Thehillstimes.in,India,News,2026-06-06T08:35:41.715204Z
1453fb6c444cea833368a63c7b49fb1d,WSL 2 is getting faster Windows file system access,https://www.boxofcables.dev/wsl2-per-device-swiotlb-pools-for-virtiofs-and-virtioproxy/,haydenbarnes,2026-06-04T19:21:18Z,cargo shipping,"From DrvFs in WSL 1 to Plan 9 to virtiofs, cross-OS file access in WSL 2 has improved with each generation. A new change gives each virtio device its own dedicated DMA pool, removing the last major contention point on the virtiofs path.",Boxofcables.dev,Unknown,News,2026-06-06T08:35:41.715244Z
d8c580cb70c99d1de6d9d1ebedc6929d,Cold storages struggle as Gulf cargo lands in India,https://economictimes.indiatimes.com/news/economy/foreign-trade/cold-storages-struggle-as-gulf-cargo-lands-in-india/articleshow/131515744.cms,Shambhavi Anand,2026-06-04T18:53:46Z,cargo shipping,"Indian cold storages are full of imported apples, avocados, and dry fruits.  Shipping disruptions due to the Iran war are causing these diversions.  This situation also impacts India's own produce exports.  Traders note a slowdown in demand for dry fruits in …",The Times of India,India,News,2026-06-06T08:35:41.715272Z
178be5ea48f5f6ec1b769aabf905653e,"Eskute M200 48V 27.5"" Electric Mountain Bike for $329 + free shipping",https://www.dealnews.com/Eskute-M200-48-V-27-5-Electric-Mountain-Bike-for-329-free-shipping/21838126.html,,2026-06-04T14:23:43Z,cargo shipping,"The Eskute M200 48V 27.5"" Electric Mountain Bike drops to $329 via promo code ""58USAFFSS"", and is the lowest price we could find by $370. The bike runs on a 48V 10.4Ah lithium battery with a 1,200W peak motor, a top speed of 28 mph, and a 21-speed gear system…",Dealnews.com,Unknown,News,2026-06-06T08:35:41.715403Z
bf3cf7c2714ee4fc05d083ac5b308cc8,Moment NATO intercepts six Russian warplanes over the Baltic in tense aerial stand-off,https://www.dailymail.com/news/article-15873823/NATO-intercepts-six-Russian-warplanes-Baltic-aerial-stand-off.html,Sabrina Penty,2026-06-04T13:23:22Z,cargo shipping,Six Russian jets were intercepted over the Baltic this week after NATO scrambled its planes as part of an air policing mission.,Dailymail.com,Russia,News,2026-06-06T08:35:41.715425Z
eb3f1e34371347e6677a7b96360770f2,Inside the Clashes at Delaney Hall Detention Center : A Timeline from a Mutual Aid Volunteer,https://crimethinc.com/2026/06/04/inside-the-clashes-at-delaney-hall-detention-center-a-timeline-from-a-mutual-aid-volunteer,CrimethInc. Ex-Workers Collective,2026-06-04T13:05:05Z,cargo shipping,"A participant in mutual aid efforts at Delaney Hall Detention Center recounts how the clashes with federal, state, and local authorities unfolded during the hunger strike.",Crimethinc.com,Unknown,News,2026-06-06T08:35:41.715464Z
27b39219a5e479d21647f3b23cd97051,"Ladped 26"" Electric Mountain Bike + free shipping",https://www.dealnews.com/Ladped-26-Electric-Mountain-Bike-free-shipping/21838006.html,,2026-06-04T09:47:52Z,cargo shipping,"Apply the eBay promo code ""FAVEDEAL20"" at checkout to drop this Ladped electric mountain bike to just $266, a drop from $369. The bike runs on a 48V/5.2Ah removable battery with a 350W rear hub motor, a 20-30 mile range, and is certified to UL 2849 standards.…",Dealnews.com,Unknown,News,2026-06-06T08:35:41.715561Z
2c73751224e83226580e06efa23f10f5,Iran war: Even a peace deal won't fix energy crunch,https://www.dw.com/en/iran-war-even-a-peace-deal-wont-fix-energy-crunch/a-77322623,Nik Martin,2026-06-04T07:43:00Z,cargo shipping,The growing energy and supply chain crisis is unlikely to ease even if the US and Iran step back from the brink. Experts warn that reopening the Strait of Hormuz and repairing infrastructure could take months or years.,DW (English),Unknown,News,2026-06-06T08:35:41.715633Z
ec5f89a48108f7c6ec4a498b6caf0d5e,"More oil escapes Hormuz, keeping traders guessing",https://economictimes.indiatimes.com/industry/energy/oil-gas/more-oil-escapes-hormuz-keeping-traders-guessing/articleshow/131498212.cms,Reuters,2026-06-04T06:25:05Z,cargo shipping,"Iran war: Tankers are using stealth to exit the Strait of Hormuz, freeing oil trapped in the Gulf. The practice of ships going dark is widespread. This makes it harder to gauge market flows. Oil on water in the Gulf has dropped. This shows outflows are inchin…",The Times of India,Unknown,Market Report,2026-06-06T08:35:41.715677Z
9fd5870bba066b56353b7587e8f40e0e,The next oil crisis may be the recovery,https://finance.yahoo.com/sectors/energy/articles/next-oil-crisis-may-recovery-213051376.html,Oil & Gas 360,2026-06-03T21:30:51Z,cargo shipping,"(By Oil & Gas 360) – The global oil market remains focused on the immediate disruption caused by the Iran conflict, […]",Yahoo Entertainment,Global,Market Report,2026-06-06T08:35:41.715850Z
32c8651a7dbec2dd16ec0c9485ed2480,"Veolo 2.0 Rolls Out Lighter, Faster, More Versatile Adventure-Ready Bike Trailer",https://bikerumor.com/veolo-2-0-rolls-out-lighter-faster-more-versatile-adventure-ready-bike-trailer/,editor@bikerumor.com (Bikerumor.com / Tyler Benedict),2026-06-03T20:43:26Z,cargo shipping,"Veolo is back, better than ever with Trailer 2.0, a lighter, more stable, and more versatile way to haul gear without making your bike heavy!
The post Veolo 2.0 Rolls Out Lighter, Faster, More Versatile Adventure-Ready Bike Trailer appeared first on Bikerumor.",Bikerumor.com,Unknown,News,2026-06-06T08:35:41.715908Z
ca1e5a142281161e271a5a1a6f04630e,Celebrating environmental leadership at the Port of Vancouver with Blue Circle Awards,https://www.globenewswire.com/news-release/2026/06/03/3306313/0/en/Celebrating-environmental-leadership-at-the-Port-of-Vancouver-with-Blue-Circle-Awards.html,Vancouver Fraser Port Authority,2026-06-03T17:00:00Z,cargo shipping,"Almost 30 terminals, tenants, marine operators, and cruise and shipping lines recognized for helping Canada to more sustainably move more trade Almost 30 terminals, tenants, marine operators, and cruise and shipping lines recognized for helping Canada to more…",GlobeNewswire,Unknown,News,2026-06-06T08:35:41.715977Z
38a6f3ceaa08c41dd4ddc80b31d2d212,Belk Sun & Fun Sale Men's Doorbusters + free shipping w/ $99,https://www.dealnews.com/Belk-Sun-Fun-Sale-Mens-Doorbusters-free-shipping-w-99/21837571.html,,2026-06-03T16:59:55Z,cargo shipping,"Belk's Men's Doorbusters event includes over 800 items with discounts across apparel and activewear. We've pictured the IZOD Men's Saltwater Beach Performance Swim Trunks for $19.99 ($42 off). Shipping adds $10.95, or get free shipping on orders of $99 or mor…",Dealnews.com,Unknown,News,2026-06-06T08:35:41.716024Z
5f0cc330c887be4a76419fcf176413c6,"Show HN: Rscrypto, pure-Rust crypto with industry leading public benches",https://github.com/loadingalias/rscrypto,loadingalias,2026-06-03T16:41:14Z,cargo shipping,"Rust crypto w/ zero default deps: BLAKE3, Ed25519/X25519, hashes, MACs, KDFs, AEADs, and checksums w/ full SIMD/ASM acceleration - loadingalias/rscrypto",Github.com,Unknown,News,2026-06-06T08:35:41.716057Z
2811515da36b7c6e446acb1e7b44f177,Kuwait Says Oil Output Won't Recover for 10-12 Weeks After Hormuz Reopens,https://oilprice.com/Latest-Energy-News/World-News/Kuwait-Says-Oil-Output-Wont-Recover-for-10-12-Weeks-After-Hormuz-Reopens.html,Charles Kennedy,2026-06-03T16:30:00Z,cargo shipping,"Kuwait Petroleum Company expects it will take considerably longer to restore oil production than many traders appear to assume if the Strait of Hormuz reopens in the coming days. Speaking at the S&P Global Energy Middle East Petroleum and Gas Conference, the …",OilPrice.com,Global,News,2026-06-06T08:35:41.716103Z
73b51512afa2fd26f363b14d01cb7da9,Shipping Magnate Says Iranian Tolls Worth It To Open Strait of Hormuz,https://dailycaller.com/2026/06/03/greek-shipping-giant-iran-tolls-strait-hormuz/,Spencer Lombardo,2026-06-03T15:58:36Z,cargo shipping,A billionaire shipping magnate says he's willing to pay Iran fees to cross the contested Strait of Hormuz.,The Daily Caller,Unknown,News,2026-06-06T08:35:41.716134Z
dedb7be4a72add9ae5cdef1d0955a541,Strain Grows on Shipping Industry With Vessels Stuck Inside Hormuz,https://www.insurancejournal.com/news/international/2026/06/03/872271.htm,Admin,2026-06-03T13:15:28Z,cargo shipping,"Even if the U.S. and Iran agreed to halt the war and open the Strait of Hormuz, ships trapped in the Gulf will be unable to leave without safety assurances, the CEO of V.Group, a leading global ship manager, told …",Insurance Journal,Global,News,2026-06-06T08:35:41.716206Z
37db85b2fd9e06d1b1ed742c21e63770,lululemon We Made Too Much Father's Day Pants Savings + free shipping,https://www.dealnews.com/lululemon-We-Made-Too-Much-Fathers-Day-Pants-Savings-free-shipping/21837365.html,,2026-06-03T08:49:57Z,cargo shipping,"The lululemon We Made Too Much Event includes lots of pairs of men's pants starting at $49, many of which would make a great gift this Father's Day (June 21). The lululemon Soft Jersey Tapered Pants are at $49, down from $98, the lululemon Zeroed In Classic-F…",Dealnews.com,Unknown,News,2026-06-06T08:35:41.716310Z
d06ffac23a6daa6dc35fd701c0bd32b5,Pro-Palestine Activists arrested blocking New Jersey Port,https://www.juancole.com/2026/06/palestine-activists-arrested.html,Waging Nonviolence,2026-06-03T04:06:37Z,cargo shipping,"The protesters attempted to blockade weapons bound for Israel, part of a growing global movement to undercut the  war machine.",Juancole.com,Global,News,2026-06-06T08:35:41.716341Z
3faf32fa4089a7c94bb671596af67b3d,Drone and Missile Attacks Target Cargo Ships near Iraq,https://www.breitbart.com/middle-east/2026/06/02/drone-and-missile-attacks-target-cargo-ships-near-iraq/,John Hayward,2026-06-02T23:24:27Z,cargo shipping,"A cargo ship was attacked by drones while sailing near the Umm Qasr port in Iraq on Monday. On Tuesday, Iran’s terrorist Islamic Revolutionary Guard Corps (IRGC) claimed responsibility for a missile attack against a commercial vessel, describing it as justifi…",Breitbart News,Unknown,News,2026-06-06T08:35:41.716389Z
ecf3fa6344865f3c757f64c2359fe6b4,"Soon 80,000-pound self-driving trucks could deliver packages to your door",https://www.dailymail.com/yourmoney/article-15868457/self-driving-trucks-fedex-aurora-texas.html,Benjamin Curry,2026-06-02T21:35:34Z,cargo shipping,"Just as Americans were getting used to the idea of robotaxis, shipping firms are planning to flood the nation's interstates with driverless 18-wheeler cargo trucks.",Dailymail.com,USA,News,2026-06-06T08:35:41.716409Z
26f1022e0249ceaa542e6879e784ac46,Enormous ship en route to pick up world's largest electric ferry,https://www.abc.net.au/news/2026-06-03/mv-black-marlin-en-route-hobart-incat-china-zorrilla/106748842,Clancy Balen,2026-06-02T19:33:13Z,cargo shipping,"The 217-metre-long heavy-lift vessel Black Marlin will deliver a Tasmanian shipbuilder's new electric ferry to South America, after the previous transporter became caught up in the Strait of Hormuz closure.",ABC News (AU),USA,News,2026-06-06T08:35:41.716431Z
d8a4a4e778d851d173e56f1f2b017be5,Russia Ships Most Oil Since 2022 as Drones Strike Refineries,https://gcaptain.com/russia-ships-most-oil-since-2022-as-drones-strike-refineries/,Bloomberg,2026-06-02T15:56:26Z,cargo shipping,Russia is exporting the most crude since its invasion of Ukraine back in 2022 as Kyiv's record attacks on its neighbor's oil refineries force more barrels into the global market.,gcaptain.com,Russia,Market Report,2026-06-06T08:35:41.716500Z
990544011058ec3bbb7fb45c1ce579cd,MSC Confirms Containership Was Hit Twice by Projectiles Off Iraq,https://gcaptain.com/msc-confirms-containership-was-hit-twice-by-projectiles-off-iraq/,Mike Schuler,2026-06-02T14:34:36Z,cargo shipping,"Mediterranean Shipping Company (MSC) says its containership MSC Sariska V was struck by two projectiles while departing Iraq’s Port of Umm Qasr on Sunday, confirming one of the most serious attacks on...",gcaptain.com,Unknown,News,2026-06-06T08:35:41.716542Z
0e66278763a6c8bea1052e81d70be5d8,"Baolujie 2602 Dual-Motor 26"" Fat Tire Electric Mountain Bike + free shipping",https://www.dealnews.com/Baolujie-2602-Dual-Motor-26-Fat-Tire-Electric-Mountain-Bike-free-shipping/21837101.html,,2026-06-02T14:08:46Z,cargo shipping,"This electric mountain bike is the lowest price we could find by $381 after applying promo code ""USAFF120"". It ships for free from a U.S. warehouse. This deal ends June 11 at 2:59 AM EDT. Shop Now at AliExpress
 Features
 <ul> <li>Peak 3000W dual motor</li>…",Dealnews.com,Unknown,News,2026-06-06T08:35:41.716588Z
1f9e44e0e3d5115fe9ad444c8de64dd6,"Vizhinjam Port scales new heights with record throughput, expansion drive",https://www.thehindubusinessline.com/news/vizhinjam-port-scales-new-heights-with-record-throughput-expansion-drive/article71052791.ece,V  Sajeev Kumar,2026-06-02T13:00:33Z,cargo shipping,"Over the last six months, the terminal has consistently operated well above its standard baseline capacity of 34,000 TEUs, frequently managing an excess volume of over 40,000 TEUs.",BusinessLine,Unknown,News,2026-06-06T08:35:41.716665Z
98a7387f1589f3c4e0af5283bab33e25,"Fleetzero, Thoma-Sea, and Glosten Announce Collaboration to Deliver Long-Duration Autonomous Vessels",https://www.prnewswire.com/news-releases/fleetzero-thoma-sea-and-glosten-announce-collaboration-to-deliver-long-duration-autonomous-vessels-302787881.html,,2026-06-02T12:07:00Z,cargo shipping,"The collaboration pairs Fleetzero's marine power and autonomy stack with Thoma-Sea's shipbuilding scale and Glosten's vessel design and marine engineering expertise, advancing autonomous vessel solutions for commercial and defense missions. HOUSTON, June 2, 2…",PRNewswire,Unknown,News,2026-06-06T08:35:41.716758Z
7ec1d1835dcbd01ac5a3033d2c7f99a2,Foreign Ministry Spokeswoman Maria Zakharova's comment on the detention of the Tagor vessel on the high seas by French military forces,https://www.globalsecurity.org/wmd/library/news/russia/2026/06/russia-260602-russia-mfa01.htm,John Pike,2026-06-02T11:26:08Z,cargo shipping,"""On May 31, French military forces, with support from the United Kingdom, intercepted and detained the Tagor - a vessel sailing from the Russian port of Murmansk to Cameroon with virtually no cargo on board - on the high seas, some 400 nautical miles west of …",Globalsecurity.org,Russia,Analysis/Opinion,2026-06-06T08:35:41.716779Z
65bb2e2a263c14b0ad977db52659ca3c,The Iran War Is Pushing the Global Gas Trade Into the Shadows,https://gcaptain.com/the-iran-war-is-pushing-the-global-gas-trade-into-the-shadows/,Bloomberg,2026-06-02T09:50:46Z,cargo shipping,"A day before crossing the Strait of Hormuz, an Indonesian seafarer aboard the Al Rayyan tanker published a picture of a rainbow cutting across the bow. “When the dream ship becomes reality,” he wrote on social media, thanking God for the blessing. Then the li…",gcaptain.com,Indonesia,News,2026-06-06T08:35:41.716863Z
b2b51193707bd2c4f0708d6f8dd9f7df,The Toll Booth at the Throat of World Trade,https://warontherocks.com/the-toll-booth-at-the-throat-of-world-trade/,Sujit Raman,2026-06-02T07:15:59Z,cargo shipping,"In late February 2026, Iran closed the Strait of Hormuz to foreign shipping. What began as a chaotic wartime closure has, in the past few days, hardened into something more consequential: an official sovereign toll regime, codified in Iranian law, and priced …",War on the Rocks,Unknown,News,2026-06-06T08:35:41.717001Z
620599f140dd8c30264bf5935cc9da11,Overstock Deals at Woot: Up to 73% off + extra 60% off 6+ + free shipping w/ Prime,https://www.dealnews.com/Overstock-Deals-at-Woot-Up-to-73-off-extra-60-off-6-free-shipping-w-Prime/21836965.html,,2026-06-02T06:53:37Z,cargo shipping,"Add any six items to your cart and see a further 60% discounted from the total automatically. The sale includes phone accessories, kitchen items, home, apparel, tech, and more. We've pictured these Carhartt Men's Force Relaxed Fit Ripstop Work Cargo Shorts fo…",Dealnews.com,Unknown,News,2026-06-06T08:35:41.717048Z
143e18ed9585796caeaf60ad1a810f41,The Iran war is pushing the global gas trade into the shadows,https://economictimes.indiatimes.com/industry/energy/oil-gas/strait-of-hormuz-lng-prices-the-iran-war-is-pushing-the-global-gas-trade-into-the-shadows/articleshow/131457203.cms,Bloomberg,2026-06-02T06:49:42Z,cargo shipping,"As the Strait of Hormuz remains under Iranian control amid the ongoing West Asia conflict, Qatar has quietly resumed some LNG exports by adopting tactics more commonly associated with the oil industry's “shadow fleet.” LNG carriers are increasingly switching …",The Times of India,Global,News,2026-06-06T08:35:41.717096Z
9cc25df8c5e10119bf443445ee4859bc,"CFTEC, AEOTrade Co-host China-Singapore Digital Trade Roadshow at WCIFIT",https://en.antaranews.com/news/417597/cftec-aeotrade-co-host-china-singapore-digital-trade-roadshow-at-wcifit,PR Wire,2026-06-02T06:39:17Z,cargo shipping,A news report from iChongqing - Chongqing Qianxin Foreign Trade and Economic Cooperation Group (CFTEC) and AEOTrade co-hosted a digital cross-border trade ...,Antaranews.com,China,Market Report,2026-06-06T08:35:41.717108Z
c8b38af3cdd228ba43c054b638fcb195,Google Workspace CLI: Unified Command-Line Tool Built for Humans and AI Agents,https://www.infoq.com/news/2026/06/google-workspace-cli/,Daniel Curtis,2026-06-02T06:33:00Z,cargo shipping,"Google has released a new CLI for Google Workspace, offering a unified interface for various services like Drive, Gmail, and Calendar. Built in Rust, the tool dynamically adjusts to API changes and features over 100 bundled skills. It requires Node.js and a G…",InfoQ.com,Unknown,News,2026-06-06T08:35:41.717155Z
8232c1d0970ed4cf45aa7a04c8915423,The Iran War Is Pushing the Global Gas Trade Into the Shadows,https://finance.yahoo.com/sectors/energy/articles/iran-war-pushing-global-gas-060005394.html,Stephen Stapczynski,2026-06-02T06:00:05Z,cargo shipping,"(Bloomberg) -- A day before crossing the Strait of Hormuz, an Indonesian seafarer aboard the Al Rayyan tanker published a picture of a rainbow cutting across...",Yahoo Entertainment,Indonesia,News,2026-06-06T08:35:41.717185Z
