article_id,title,link,creator,pubdate,category,description,source,country,article_type,scrape_timestamp
e88d46c73de0c0dc7fccc661d20ef7ef,Your utility bills keep going up. Here’s everyone you can blame—AI data centers included,https://fortune.com/2026/03/01/utility-bills-keep-rising-everyone-blame-ai-data-centers-included/,Jordan Blum,2026-03-01T07:58:00Z,coal demand,Utilities announce hundreds of billions in spending as data centers boom and ratepayers' costs rise.,Fortune,Unknown,News,2026-03-07T18:37:36.029491Z
ee8f06c685b061914f279d6cc45c0a88,World’s Farmers See Fertilizer Price Surge as Iran War Blocks Exports,https://www.insurancejournal.com/news/international/2026/03/06/860869.htm,Admin,2026-03-06T16:25:27Z,grain exports,"The world’s farmers face soaring fertilizer and fuel prices as the war in the Middle East escalates, leaving some scrambling for supplies as the spring planting season approaches. The war, which has closed the Strait of Hormuz, has shut down …",Insurance Journal,Unknown,Market Report,2026-03-07T18:37:36.532307Z
47bcff39f91f456bb2836ead0a6727ad,"From fertilisers to rice, pulses, tea and apples: Middle East conflict threatens India-Iran agri trade",https://economictimes.indiatimes.com/news/economy/agriculture/from-fertilisers-to-rice-pulses-tea-and-apples-middle-east-conflict-threatens-india-iran-agri-trade/articleshow/129125325.cms,Ashish Pandey,2026-03-06T01:33:05Z,grain exports,India faces a potential squeeze as the war in Iran threatens shipments of rice and other agricultural commodities.,The Times of India,India,News,2026-03-07T18:37:36.532345Z
1f83e59aa699088e224557126bf0e106,Beyond Oil: How The Iran War Could Send Food Prices Soaring,https://oilprice.com/Geopolitics/International/Beyond-Oil-How-The-Iran-War-Could-Send-Food-Prices-Soaring.html,Robert Rapier,2026-03-05T20:00:00Z,grain exports,"In the wake of U.S. and Israeli strikes on Iranian military infrastructure, the financial press has reflexively focused on oil. Tanker traffic, Brent crude, and the risk of triple-digit prices dominate the discussion. But oil is not the only commodity posing …",OilPrice.com,Unknown,Market Report,2026-03-07T18:37:36.532425Z
fad7349bb9eb15b58042c19f268c9479,Fertiliser costs are soaring amid war in the Middle East. Will your grocery bill follow?,https://theconversation.com/fertiliser-costs-are-soaring-amid-war-in-the-middle-east-will-your-grocery-bill-follow-277511,"David Ubilava, Associate Professor of Economics, University of Sydney",2026-03-05T19:07:15Z,grain exports,Australia gets half its urea – a crucial nitrogen fertiliser – from countries now impacted by the war. But research suggests higher food prices aren’t a given.,The Conversation Africa,Australia,Market Report,2026-03-07T18:37:36.532443Z
5d547ecbacd6a2cd1174d5d7d8a5a7ce,Show HN: Montage – Quickly build product launch videos with coding agents,https://github.com/simplexlabs/montage,marcon680,2026-03-05T16:37:10Z,grain exports,"Montage is a fork of Remotion's NextJS template, set up for coding agents to quickly produce motion graphics videos.In May 2025 I commissioned a team of motion designers to create a launch video. It cost us $2000 and 4-5 days of my full attention.I noticed th…",Github.com,Unknown,News,2026-03-07T18:37:36.532495Z
bb701b59c630066fce900424991bc0c2,"Expanding Iran conflict threatens Brazil grain exports, fertilizer supplies",https://consent.yahoo.com/v2/collectConsent?sessionId=1_cc-session_89e5eaf7-7a9e-49ef-93ca-fc65bc58debb,,2026-03-05T13:28:48Z,grain exports,,Yahoo Entertainment,Brazil,News,2026-03-07T18:37:36.532510Z
bf03970f9cc0f49d62b689768b87e747,China Lowers Growth Target Amid Headwinds,https://www.newser.com/story/384833/china-lowers-growth-target-amid-headwinds.html,Jenn Gidman with Newser.AI,2026-03-05T12:05:00Z,grain exports,"China just took a red pen to its growth ambitions, setting its slowest official expansion goal in more than three decades. On Wednesday, Beijing announced a 2026 GDP target of 4.5% to 5% at the opening of the annual ""two sessions"" political gathering, the low…",Newser,China,News,2026-03-07T18:37:36.532591Z
c732b0dfdd122bb19b9189583726d895,Opinion: Users need more say about Vancouver’s rail bridges,https://financialpost.com/opinion/opinion-users-need-more-say-about-vancouvers-rail-bridges,Special to Financial Post,2026-03-05T11:00:10Z,grain exports,Last week's malfunction of the Second Narrows Bridge shows how dependent the Prairie economy is on this transportation chokepoint. Read on,Financial Post,Unknown,Analysis/Opinion,2026-03-07T18:37:36.532677Z
d8c766d7ac04e311f226f170a1f49ca6,"China lowers economic growth target to 4.5-5% amid global, domestic uncertainties",https://www.thehindubusinessline.com/news/world/china-lowers-economic-growth-target-to-45-5-amid-global-domestic-uncertainties/article70706848.ece,PTI,2026-03-05T10:23:22Z,grain exports,"China has been setting a five per cent target for the GDP for the last three years amid growing domestic economic challenges. This year, the target is lowered to 4.5 per cent to 5 for the first time",BusinessLine,China,News,2026-03-07T18:37:36.532693Z
d100aa35c5499844a95d67388fbd0137,"Weather woes, reduced area weigh on India’s 2026 cumin crop size",https://www.thehindubusinessline.com/economy/agri-business/weather-woes-reduced-area-weigh-on-indias-2026-cumin-crop-size/article70705974.ece,Vishwanath Kulkarni,2026-03-05T05:40:41Z,grain exports,"India's cumin crop for 2026 faces production declines due to weather, reduced acreage, and market uncertainties amid regional conflicts.",BusinessLine,India,Market Report,2026-03-07T18:37:36.532741Z
deb88b7c2b89d68bf35574361d600538,Basmati rice prices fall in local market as Iran war disrupts exports,https://economictimes.indiatimes.com/industry/cons-products/food/basmati-rice-prices-fall-in-local-market-as-iran-war-disrupts-exports/articleshow/129044995.cms,Jayashree Bhosale,2026-03-04T18:48:44Z,grain exports,"Basmati rice prices have dropped locally due to disruptions in exports to the Middle East. This key market accounts for half of India's basmati rice shipments. Industry experts anticipate further price declines if the conflict persists. Around 400,000 tonnes …",The Times of India,India,Market Report,2026-03-07T18:37:36.532763Z
5902885ef33992bb1e5ff330b04f7620,Indonesia launches first rice exports for Hajj Pilgrims,https://en.antaranews.com/news/406979/indonesia-launches-first-rice-exports-for-hajj-pilgrims,"M. Harianto, Tegar Nurfitra",2026-03-04T12:14:18Z,grain exports,"Indonesia has begun exporting 2,280 tonnes of rice to Saudi Arabia, marking the first time the nation supplies its citizens performing the Hajj pilgrimage ...",Antaranews.com,Indonesia,News,2026-03-07T18:37:36.532790Z
6a1849df33e0be9a2eea45f73f0a8575,"Trump’s Hormuz Assurances Are Only a Partial Fix, Shippers Say",https://www.insurancejournal.com/news/international/2026/03/04/860367.htm,Admin,2026-03-04T08:26:14Z,grain exports,President Donald Trump says the US will ensure the free flow of energy through the Persian Gulf with insurance guarantees and even naval escorts. But the shipping industry sees it — at best — as only a partial solution to …,Insurance Journal,Unknown,News,2026-03-07T18:37:36.532841Z
5e9b14128ec7e448513c5289753f2cf0,How closure of Strait of Hormuz shows how trade can be weaponised,https://www.rte.ie/brainstorm/2026/0304/1561532-strait-of-hormuz-iran-conflict-shipping-maritime-trade-supply-chains/,RTÉ Brainstorm,2026-03-04T07:09:12Z,grain exports,"As the closure of this vital shipping route shows, the structural vulnerability of maritime trade and supply chains is often underestimated",RTE,Unknown,News,2026-03-07T18:37:36.532876Z
1f27cb210f5e4c778aeeff702eed1f11,"Trump’s Hormuz Assurances Are Only a Partial Fix, Shippers Say",https://financialpost.com/pmn/business-pmn/trumps-hormuz-assurances-are-only-a-partial-fix-shippers-say,Bloomberg News,2026-03-04T05:43:53Z,grain exports,President Donald Trump says the US will ensure the free flow of energy through the Persian Gulf with insurance guarantees and even naval escorts. But the shipping industry sees it — at best — as only a partial solution to a historic crisis.,Financial Post,Unknown,News,2026-03-07T18:37:36.532918Z
18990e3eef776ac655953800c33b60ef,$15 billion in Australian trade affected by Middle East conflict,https://www.abc.net.au/news/2026-03-04/middle-east-conflict-affects-meat-exports-farmers-rising-costs/106414240,"Emily Middleton, Lucy Thackray, and Belinda Varischetti",2026-03-04T04:20:13Z,grain exports,Exports have been halted and shipping containers filled with Australian meat are stranded at sea as the Middle East conflict takes a toll on trade.,ABC News (AU),Australia,News,2026-03-07T18:37:36.532934Z
949b9badd2b32f4dc76c1fc6626f1df7,Chinese Debates on a Fragmenting Global Order | Sinification: February 2026,https://sinocism.com/p/chinese-debates-on-a-fragmenting,James Farquharson,2026-03-02T12:59:48Z,grain exports,Global Order & US-China Relations | Japan | Taiwan | Middle East | Europe | Latin America | Chinese Economy | Technology & Society - Commentary on the Iran conflict from four prominent international relations experts spans the days before and after the US–Isr…,Sinocism.com,China,Analysis/Opinion,2026-03-07T18:37:36.532946Z
bdc8e2141bd02eed4ee6f698977e6279,Chokepoints Under Pressure: When Geography and Conflict Strain the Arteries of Global Trade,https://gcaptain.com/chokepoints-under-pressure-when-geography-and-conflict-strain-the-arteries-of-global-trade/,Paul Morgan,2026-03-01T15:15:31Z,grain exports,"There are moments when geopolitics feels distant from daily life. This is not one of them. By Paul Morgan (gCaptain) – With confirmed US–Israeli strikes on Iran, renewed Houthi threat...",gcaptain.com,Global,Market Report,2026-03-07T18:37:36.532987Z
95c2a1ad7e07fcbfd1f6ab3ff627dc4c,Beyond Oil: The Strait Of Hormuz And The Global Food Risk,https://www.forbes.com/sites/rrapier/2026/03/01/beyond-oil-the-strait-of-hormuz-and-the-global-food-risk/,"Robert Rapier, Senior Contributor, 
 Robert Rapier, Senior Contributor
 https://www.forbes.com/sites/rrapier/",2026-03-01T15:13:47Z,grain exports,"How a disruption in the Strait of Hormuz could choke off global nitrogen fertilizer exports, threatening crops, food prices, and the stability of the global food system.",Forbes,Global,Market Report,2026-03-07T18:37:36.533015Z
56a8e96782e48ccc8993c0750436e74b,"Iran tensions threaten India rice exports with shipping snags, payment risks",https://economictimes.indiatimes.com/news/economy/foreign-trade/iran-tensions-threaten-india-rice-exports-with-shipping-snags-payment-risks/articleshow/128912494.cms,PTI,2026-03-01T10:17:32Z,grain exports,"Haryana rice exporters are experiencing payment delays and shipment hold-ups to Iran and Afghanistan.  The conflict has already impacted trade, causing a drop in basmati rates.  Shipments to Iran, a major buyer, are affected.  The full impact depends on the c…",The Times of India,India,Market Report,2026-03-07T18:37:36.533037Z
8688cc1fbda34d2ff1776706d1b35e67,How the Iran war could create a ‘fertiliser shock’ – an often ignored global risk to food prices and farming,https://theconversation.com/how-the-iran-war-could-create-a-fertiliser-shock-an-often-ignored-global-risk-to-food-prices-and-farming-277552,"Nima Shokri, Professor, Applied Engineering, United Nations University, Salome M. S. Shokri-Kuehni, Lecturer in Environmental Engineering, United Nations University; Technical University of Hamburg",2026-03-05T10:32:38Z,soybean exports,"Without this form of fertiliser, crops will not produce yields on which the world’s population depends, leaving people starving.",The Conversation Africa,Global,Market Report,2026-03-07T18:37:37.013703Z
593ea28c50e06fa6a1cb241eab6de8c8,US trade report acknowledges gaps in India-US trade deal talks,https://www.thehindubusinessline.com/economy/us-trade-report-acknowledges-gaps-in-india-us-trade-deal-talks/article70699423.ece,Amiti Sen,2026-03-03T13:09:51Z,soybean exports,"India-US trade deal talks continue amid tariff changes after US Supreme Court ruling, with gaps persisting on key market access and trade issues.",BusinessLine,India,Market Report,2026-03-07T18:37:37.013722Z
779c6d42bf247cc63a5a347b86cf06a9,"India, US continue to work on agreement for enhanced market access: USTR",https://economictimes.indiatimes.com/news/economy/foreign-trade/india-us-continue-to-work-on-agreement-for-enhanced-market-access-ustr/articleshow/128953278.cms,ET Bureau,2026-03-02T18:22:46Z,soybean exports,India and the US are progressing towards a trade agreement. Both nations are working to improve market access and lower trade barriers. An interim agreement will see India reduce tariffs on US industrial and agricultural products. It also addresses barriers f…,The Times of India,India,Market Report,2026-03-07T18:37:37.013747Z
c837c034ebeb963d07b80fa69ef5804a,"Indian edible oil, oilmeals sector turn cautious amid Iran crisis",https://www.thehindubusinessline.com/economy/agri-business/indian-edible-oil-oilmeals-sector-turn-cautious-amid-iran-crisis/article70694422.ece,AJ Vinayak,2026-03-02T08:23:39Z,soybean exports,"Sunflower supplies to India may be affected, if the Suez Canal and Strait of Hormuz are affected, as the consignments will have to take a longer route",BusinessLine,India,News,2026-03-07T18:37:37.013768Z
8a9a9dc38e1de01f609ad6ecdfa44d03,The Vintage Guard: Why the American Response to Rivalry Refuses to Grow Old,https://www.fairobserver.com/economics/the-vintage-guard-why-the-american-response-to-rivalry-refuses-to-grow-old/,Arlen Agliga,2026-02-28T12:57:32Z,soybean exports,"The US is in the grips of a trade war, battling against a resurgent Asian economic power. This Asian economy’s undervalued currency, formidable manufacturing capacity and unfair trade practices are driving its trade surplus with America to unconscionable leve…",Fair Observer,USA,News,2026-03-07T18:37:37.013833Z
ce1aa3420c1f733ec658a5320fd2bef0,Maharashtra’s crop yields: A mixed bag with national implications,https://www.thehindubusinessline.com/economy/agri-business/maharashtras-crop-yields-a-mixed-bag-with-national-implications/article70685661.ece,Subramani Ra Mancombu,2026-02-28T03:46:08Z,soybean exports,"With focused policies, better technology adoption, and farmer-centric interventions, the state has the potential to enhance productivity",BusinessLine,Unknown,News,2026-03-07T18:37:37.013874Z
98392f96c7909a9d068fa7315b427436,GAPKI sees zero tariff lifting US palm oil sales,https://en.antaranews.com/news/406406/gapki-sees-zero-tariff-lifting-us-palm-oil-sales,"Suharsana ASJC, Rahmad Nasution",2026-02-28T00:46:59Z,soybean exports,"The Indonesian Palm Oil Association (GAPKI) expects exports to the US to climb toward 3 million tons within three years if tariffs return to zero, as trade ...",Antaranews.com,Indonesia,News,2026-03-07T18:37:37.013903Z
a4b09d3621ef67e88a79cdfc7e4358e2,Canada seeks stronger ties with Japan as Carney pushes ‘middle-power’ strategy,https://www.channelnewsasia.com/asia/canada-japan-mark-carney-visit-strengthen-cooperation-5975466,,2026-03-06T02:15:31Z,wheat exports,Canadian Prime Minister Mark Carney will wrap up his Asia-Pacific tour with talks in Tokyo aimed at deepening economic and security cooperation.,CNA,Japan,News,2026-03-07T18:37:37.568405Z
eb019876e3a0725ed286ce46af1e071a,"It’s time to step up India, Bangladesh ties",https://www.thehindubusinessline.com/opinion/its-time-to-step-up-india-bangladesh-ties/article70708231.ece,Pratim Ranjan Bose,2026-03-05T15:01:38Z,wheat exports,"IMPACT OF WAR. For Bangladesh, better ties with India will help it weather the economic effects of the current Middle East crisis",BusinessLine,India,News,2026-03-07T18:37:37.568545Z
133b52ec7d41b19d36726aba014839fd,"Soil organic carbon stocks after ten years of reduced tillage, compost and mulch application in temperate organic agriculture",https://www.nature.com/articles/s41598-026-42050-9,"Wiebke Niether, Simeon Leisch-Waskönig, Maria R. Finckh, Stephan Martin Junge, Carolina Bilibio, Stephan Peth, Jan Henrik Schmidt, Juliet Wanjiku Kamau, Andreas Gattinger",2026-03-05T00:00:00Z,wheat exports,"Increasing soil organic carbon (SOC) aims to increase and maintain soil quality for sustainable crop production and to achieve carbon removal targets. Agronomic practices are therefore needed to reduce carbon losses and increase SOC stocks, especially in deep…",Nature.com,Unknown,News,2026-03-07T18:37:37.568723Z
74bd8fb3b4990ff1fb0431f8f6b63827,Strait of Hormuz: Gulf states’ food security is at immediate risk but wider shortages could push up consumer prices globally,https://theconversation.com/strait-of-hormuz-gulf-states-food-security-is-at-immediate-risk-but-wider-shortages-could-push-up-consumer-prices-globally-277214,"Gokcay Balci, Lecturer in Sustainable Freight Transport and Logistics, University of Leeds, Ebru Surucu-Balci, Assistant Professor in Circular Supply Chains, University of Bradford",2026-03-04T16:51:23Z,wheat exports,Gulf states depend on food imported via the strait – and shipping surcharges could raise the cost of consumer goods around the world.,The Conversation Africa,Global,Market Report,2026-03-07T18:37:37.568768Z
6f1b35f45d7d281d2a05954b645113f4,Wheat Sneaking Back Higher Early on Tuesday,https://www.barchart.com/story/news/532920/wheat-sneaking-back-higher-early-on-tuesday,Austin Schroeder,2026-03-03T13:27:54Z,wheat exports,"Wheat is trading with Tuesday morning gains, up 1 to 7 cents across the three markets. The wheat complex was in give back mode on Monday, with all three...",Barchart.com,Unknown,Market Report,2026-03-07T18:37:37.568856Z
35a71786f2271e25b08d33267d9972aa,"Prolonged Iran war could impact rupee, inflation says BoB",https://economictimes.indiatimes.com/news/economy/indicators/prolonged-iran-war-could-impact-rupee-inflation-says-bob/articleshow/129155964.cms,Joel Rebello,2026-03-06T12:56:30Z,fertilizer exports,The Indian rupee faces pressure and could weaken past 92 rupees per dollar if the US-Israel conflict with Iran extends. Rising oil prices will impact India's fiscal deficit and inflation. Economists predict a hit to India's GDP due to higher crude costs. Supp…,The Times of India,India,Market Report,2026-03-07T18:37:37.999087Z
9ca18cf7d3666a258d78ef76400cbf1e,How US Aid Propelled Tyranny in Africa,https://www.counterpunch.org/2026/03/06/how-us-aid-propelled-tyranny-in-africa/,James Bovard,2026-03-06T06:52:28Z,fertilizer exports,"U.S. foreign aid is a Tyrant Entitlement Program. Phony piety has long been one of America’s top political exports.  President Barack Obama, in a 2015 speech to the African Union, the organization of the African heads of state,  derided nations that institute…",CounterPunch,USA,News,2026-03-07T18:37:37.999124Z
bf36ab7be680e57fcd42614c6211b148,Middle East conflict poses fresh test to world central banks as oil shock fuels inflation,https://freerepublic.com/focus/f-news/4369496/posts,CNBC,2026-03-06T01:05:00Z,fertilizer exports,"A widening Middle East conflict has posed a fresh test for global central banks, as fears of an oil shock and renewed inflation risks complicate policymakers’ calculus for shoring up growth. Crude prices soared on Monday after the U.S. and Israel launched str…",Freerepublic.com,Global,Market Report,2026-03-07T18:37:37.999171Z
9b83375a02d99f3b95812467855f9315,India may prioritize gas supply to CGD after Qatar disruption,https://www.livemint.com/industry/energy/india-may-prioritize-gas-supply-to-cgd-after-qatar-disruption-lng-ras-laffan-gail-petronet-11772717946512.html,Rituraj Baruah,2026-03-06T00:00:56Z,fertilizer exports,"According to officials, if such a move is implemented, gas allocation for CGD networks—which involve piped cooking gas for households and compressed natural gas for transport—may be increased, with supplies diverted from non-priority sectors such as industrie…",Livemint,India,News,2026-03-07T18:37:37.999199Z
fc1903dcc282ae252b8e45c771e3bcce,Kitsault Energy Continues to Advance Goals to Create West Coast Energy/Commodity Corridor–Increasing Canadian Exports,https://financialpost.com/pmn/business-wire-news-releases-pmn/kitsault-energy-continues-to-advance-goals-to-create-west-coast-energy-commodity-corridor-increasing-canadian-exports,Business Wire,2026-03-05T20:16:24Z,fertilizer exports,"OTTAWA, Ontario — As global energy demand shifts toward the Pacific Rim, Canada faces growing pressure to expand export capacity beyond traditional U.S. markets. While many major infrastructure projects encounter prolonged regulatory delays, Kitsault Energy (…",Financial Post,Global,Market Report,2026-03-07T18:37:37.999278Z
9f128e44058b38e58dc0a2107defac61,Why Aren’t Energy Markets Reacting More to the Iran War?,http://foreignpolicy.com/2026/03/05/oil-gas-markets-reaction-iran-war-hormuz-insurance/,Keith Johnson,2026-03-05T17:57:24Z,fertilizer exports,"Each day of war that passes adds to the physical risks to global oil and gas, but so far markets have basically shrugged.",Foreign Policy,Global,Market Report,2026-03-07T18:37:37.999354Z
866a9cdc2618dac3492c429440fa68dc,How will the Middle East conflict affect global energy prices? #world,https://alltoc.com/world/how-will-the-middle-east-conflict-affect-global-energy-prices,AllToc,2026-03-05T12:10:58Z,fertilizer exports,"Short term shocks, medium term risks The military campaign in and around Iran has already pushed energy prices higher by constricting flows through critical routes and raising risk premiums across markets. Attacks on shipping, strikes on facilities and threat…",Alltoc.com,Global,Market Report,2026-03-07T18:37:37.999412Z
c1fe0a3bb4998a0a50b6c54701a9b309,Famine Incoming? About One-Fourth Of All Globally Traded Nitrogen Fertilizer Normally Travels Through The Strait Of Hormuz,http://theeconomiccollapseblog.com/famine-incoming-about-one-fourth-of-all-globally-traded-nitrogen-fertilizer-normally-travels-through-the-strait-of-hormuz/,Michael,2026-03-04T22:30:20Z,fertilizer exports,"If the war with Iran persists for an extended period of time, a lot of people could literally starve. Approximately half of all global food production is dependent on the use of fertilizer. Without fertilizer, crop yields would drop precipitously and there wo…",Theeconomiccollapseblog.com,Global,News,2026-03-07T18:37:37.999494Z
fb791486412595d029ce8b709267eb1f,"Home loans, gas, groceries: How the Iran war could upend Trump’s touted economic gains",https://www.nbcnews.com/business/markets/iran-war-threaten-upend-trump-economic-gains-gas-groceries-rcna261599,Shannon Pettypiece,2026-03-04T22:26:40Z,fertilizer exports,President Donald Trump's State of the Union speech pointed to economic bright spots. The Iran war threatens to dim them.,NBC News,Unknown,News,2026-03-07T18:37:37.999534Z
4223194ca191010c58d8d278d1a2a981,Trump’s War on Iran Could Screw Over US Farmers,https://www.wired.com/story/trumps-war-on-iran-could-screw-over-us-farmers/,Molly Taft,2026-03-04T19:08:46Z,fertilizer exports,The Middle East supplies a huge amount of the world’s fertilizer. Conflict in the region has sent prices soaring ahead of the critical spring planting season.,Wired,Unknown,Market Report,2026-03-07T18:37:37.999586Z
e6c03c0764c4c01e40673d17e1e45c4c,Kenya braces as Middle East conflict escalates,https://www.dw.com/en/kenya-braces-as-middle-east-conflict-escalates/a-76218179,Andrew Wasike,2026-03-04T16:34:00Z,fertilizer exports,"As tensions rise across the Middle East, Kenyans fear economic shocks, disrupted exports, and risks to the more than 400,000 Kenyans working in Gulf states. Kenyan President William Ruto in the weeks leading up to the US-Israel war with Iran called for restra…",DW (English),Unknown,News,2026-03-07T18:37:37.999635Z
1a8a2cbaeaff4cc2e7a3147932caa917,Pakistan Cuts Gas for Some Industry Buyers as War Upends Supply,https://financialpost.com/pmn/business-pmn/pakistan-cuts-gas-for-some-industry-buyers-as-war-upends-supply,Bloomberg News,2026-03-04T10:55:44Z,fertilizer exports,"Pakistan’s largest gas distributor is set to cut supplies to some of its industrial customers, suggesting growing strain in one of the economies most dependent on energy exports from Qatar.",Financial Post,Unknown,News,2026-03-07T18:37:37.999678Z
fc221e2f6a32cd10bc8c6ff4488ca704,The Iran War Is Jeopardizing the Entire Global Economy,http://foreignpolicy.com/2026/03/04/iran-war-dubai-saudi-qatar-global-economy-oil-shipping-trade/,Esfandyar Batmanghelidj,2026-03-04T09:32:54Z,fertilizer exports,The fallout from conflict in the Gulf will be much bigger than just oil.,Foreign Policy,Global,News,2026-03-07T18:37:37.999704Z
2b94f981d973f783275bbc1c1de27a5a,"Andy Mukherjee: From oil and gold to capital flows and fertilizer, how the Iran conflict could rattle India’s economy",https://www.livemint.com/opinion/online-views/andy-mukherjee-iran-conflict-oil-gold-capital-flows-fertilizer-india-economy-west-asian-war-11772563518089.html,mint,2026-03-04T04:31:09Z,fertilizer exports,"Past West Asian wars hit India at the petrol pump. This one could scorch far more—from remittances and smartphone exports to the rupee, fertilizer feedstock and the Centre’s gold-linked debt. How resilient is India’s economy to a prolonged Gulf inferno?",Livemint,India,News,2026-03-07T18:37:37.999746Z
