article_id,title,link,creator,pubdate,category,description,source,country,article_type,scrape_timestamp
3241bdc13167a1a8ea8e3e839cc6ef07,Gas Turbine Shortage Is Forcing Companies Back to Coal,https://financialpost.com/pmn/business-pmn/gas-turbine-shortage-is-forcing-companies-back-to-coal,Bloomberg News,2025-10-03T04:52:00Z,coal demand,"Booming electricity demand driven by AI is causing a shortage of gas turbines worldwide, Stephen Stapczynski and Akshat Rathi explain why on Zero podcast.",Financial Post,Global,News,2025-10-06T06:32:07.179729Z
e5f78aee89933d59cc00fa4e0b4afc08,"To Permanently Unleash our Federal Lands, Congress Must Reform the Antiquities Act",https://wattsupwiththat.com/2025/10/02/to-permanently-unleash-our-federal-lands-congress-must-reform-the-antiquities-act/,Guest Blogger,2025-10-03T01:00:00Z,coal demand,"If the U.S. is to meet the challenges of the future, powering AI, electrification, data centers, and beyond, we cannot allow unchecked executive authority to lock away the resources needed to get there. Permanently unleashing America’s federal lands will requ…",Wattsupwiththat.com,USA,News,2025-10-06T06:32:07.179758Z
a4d238893c888e210beee1ebb42104a5,Inside Meta’s fight to change climate reality… all so it can frantically expand a risky AI program,http://www.crikey.com.au/2025/10/03/meta-climate-change-reality-artificial-intelligence/,Ketan Joshi,2025-10-03T00:45:48Z,coal demand,"Everyone is ignoring the science on what Meta’s generative AI investment really costs, even though there's no evidence of a single, significant societal benefit.
The post Inside Meta’s fight to change climate reality… all so it can frantically expand a risky …",Crikey,Unknown,News,2025-10-06T06:32:07.179810Z
3b9e17e050405ce137b5b6b731ec54b9,CNOOC Expands Presence in South China Sea with New Projects,https://oilprice.com/Energy/Energy-General/CNOOC-Expands-Presence-in-South-China-Sea-with-New-Projects.html,Charles Kennedy,2025-10-02T22:00:00Z,coal demand,"China’s network of subsea pipelines has reached a total length of 10,000 kilometers, CNOOC reported this week. The news was hailed by media as a milestone in offshore oil and gas development in the world’s largest importer of energy commodities as it seeks to…",OilPrice.com,China,Market Report,2025-10-06T06:32:07.179828Z
6de1991ba01e0aaf8200ba5be748fd77,CNOOC Expands Presence in South China Sea with New Projects,https://finance.yahoo.com/news/cnooc-expands-presence-south-china-220000865.html,Charles Kennedy,2025-10-02T22:00:00Z,coal demand,"China's subsea pipeline network has reached 10,000 kilometers, marking a significant milestone in its efforts to boost domestic oil and gas production and...",Yahoo Entertainment,China,News,2025-10-06T06:32:07.179842Z
73e35241516482a98dc58bd501fd81d7,Southeast Asia’s Onshore Wind Market Set for Fourfold Growth by 2030,https://oilprice.com/Alternative-Energy/Wind-Power/Southeast-Asias-Onshore-Wind-Market-Set-for-Fourfold-Growth-by-2030.html,OilPrice.com,2025-10-02T21:00:00Z,coal demand,"The onshore wind sector has historically witnessed mild growth in Southeast Asia (SEA) since the start of the decade due to a combination of regulatory hurdles, weak grid infrastructure, high costs associated with developing local supply chains, and persisten…",OilPrice.com,Unknown,Market Report,2025-10-06T06:32:07.179884Z
2b523ae72a5a330822f6ec2e8a663d3b,"Amid partisan divides on renewables, National Clean Energy Week’s chair still sees hope for conservative climate action",https://insideclimatenews.org/news/01102025/heather-reams-conservative-climate-action/,Clarion Energy Content Directors,2025-10-02T19:26:19Z,coal demand,"Heather Reams, the longtime leader, describes the industry’s challenges—and who deserves a seat under a “bigger tent.”",InsideClimate News,Unknown,News,2025-10-06T06:32:07.179927Z
94a44f57e2e04e19e86a7a90d1982e9a,This Farm Has Been in the Rizzo Family for 68 Years. AI Could Take It All Away,https://me.pcmag.com/en/ai/32602/this-farm-has-been-in-the-rizzo-family-for-68-years-ai-could-take-it-all-away,Emily Forlini,2025-10-02T18:45:57Z,coal demand,"As 240-foot-high power lines are set to rise across rural Pennsylvania, longtime residents are fighting eminent domain claims. The worst part? There's not even enough juice to keep Big Tech's data centers humming.
When Humphrey the camel drinks root beer, he …",PCMag.com,Unknown,News,2025-10-06T06:32:07.179974Z
cca7c3edba9493597a92fb2d7c7eccfb,This Farm Has Been in the Rizzo Family for 68 Years. AI Could Take It All Away,https://uk.pcmag.com/ai/160409/this-farm-has-been-in-the-rizzo-family-for-68-years-ai-could-take-it-all-away,Emily Forlini,2025-10-02T18:45:57Z,coal demand,"As 240-foot-high power lines are set to rise across rural Pennsylvania, longtime residents are fighting eminent domain claims. The worst part? There's not even enough juice to keep Big Tech's data centers humming.
When Humphrey the camel drinks root beer, he …",PCMag.com,Unknown,News,2025-10-06T06:32:07.180022Z
ff89eaf7e3912bbe60708d4bca8e2a73,White House cancels nearly $8B in clean energy projects in blue states,https://www.pbs.org/newshour/politics/white-house-cancels-nearly-8b-in-clean-energy-projects-in-blue-states,"Michael Phillis, Associated Press, Matthew Daly, Associated Press",2025-10-02T18:23:02Z,coal demand,The Trump administration has announced the cancellation of $7.6 billion in funding for clean energy projects across 16 states.,PBS,Unknown,News,2025-10-06T06:32:07.180054Z
ead52fe413fab661b0fb50854a2dfbc6,How Canada can support rural regions in its net-zero transition,https://theconversation.com/how-canada-can-support-rural-regions-in-its-net-zero-transition-264747,"Tamara Krawchenko, Associate Professor, School of Public Administration, University of Victoria",2025-10-02T18:06:03Z,coal demand,An equitable net-zero transition requires promoting regional competitiveness while ensuring no place is left behind.,The Conversation Africa,Unknown,News,2025-10-06T06:32:07.180086Z
17b46ddbe5211c002ca40e224db854f3,"Nuclear fusion, the ‘holy grail’ of power, was always 30 years away—now it’s a matter of when, not if, fusion comes online to power AI",https://finance.yahoo.com/news/nuclear-fusion-holy-grail-power-170000773.html,Jordan Blum,2025-10-02T17:00:00Z,coal demand,"Fusion has the potential to solve the world's energy demand and climate goals, but questions remain about crossing the technology finish line and scaling up ...",Yahoo Entertainment,Unknown,News,2025-10-06T06:32:07.180130Z
4360b6febc98d8751bbaf6e4972ff5ae,"Nuclear fusion, the ‘holy grail’ of power, was always 30 years away—now it’s a matter of when, not if, fusion comes online to power AI",https://fortune.com/2025/10/02/nuclear-fusion-online-commercial-ai-power/,Jordan Blum,2025-10-02T17:00:00Z,coal demand,"Fusion has the potential to solve the world's energy demand and climate goals, but questions remain about crossing the technology finish line and scaling up economically.",Fortune,Unknown,News,2025-10-06T06:32:07.180167Z
9af5c89f6bc6e324c5615a02be25d05f,What passes for keen insight at the Wall Street Journal?,https://freerepublic.com/focus/f-news/4343914/posts,American Thinker,2025-10-02T15:23:13Z,coal demand,"When did the Wall Street Journal give up on making coherent arguments? It certainly seems to be the case with a recent WSJ article entitled, “The U.S. Is Forfeiting the Clean-Energy Race to China”. The premise of the article, as you might have guessed, is tha…",Freerepublic.com,China,Analysis/Opinion,2025-10-06T06:32:07.180181Z
db8a8dab877fdf2b5122779d69d96d9b,Becoming Acquainted with America,http://www.nybooks.com/articles/2025/10/23/becoming-acquainted-with-america-ben-shahn-on-nonconformity/,Nicole Rudick,2025-10-02T12:00:00Z,coal demand,"In “The Biography of a Painting,” an essay drawn from his Charles Eliot Norton Lectures at Harvard in 1956–1957, Ben Shahn remembers his early years as an artist in the 1920s, when he was enamored of Post-Impressionist and Fauvist landscapes and peopled his c…",The New York Review of Books,USA,News,2025-10-06T06:32:07.180231Z
71b279d1b0e2e0ade8000cca4b706bdd,Algorithm Nation,http://www.nybooks.com/articles/2025/10/23/algorithm-nation-invisible-rulers-character-limit-filterworld/,Jacob Weisberg,2025-10-02T12:00:00Z,coal demand,Fights about digital filtering tools have turned more and more bitter. That's because of their extraordinary power to shape both political opinion and mass culture.,The New York Review of Books,Unknown,Analysis/Opinion,2025-10-06T06:32:07.180258Z
1958cc93db7e5ceb8a4a8f0c29abfb8d,Mixed Bag for Gujarat PSU scrips in H1 FY 2026,https://www.thehindubusinessline.com/markets/mixed-bag-for-gujarat-psu-scrips-in-h1-fy-2026/article70117627.ece,Avinash Nair,2025-10-02T11:22:57Z,coal demand,"According to data compiled from the bourses, GMDC emerged as a standout performer among the listed state PSUs with 125.17% surge in its stock price, rising from ₹265.35 to ₹597.50 between March 28 and Sep 30",BusinessLine,Unknown,News,2025-10-06T06:32:07.180298Z
4047211204e7a98927ef38b62a933592,EnviroGold Global Announces Progress to Support U.S. Silver Supply Security with NVRO Process™,https://www.globenewswire.com/news-release/2025/10/02/3160241/0/en/EnviroGold-Global-Announces-Progress-to-Support-U-S-Silver-Supply-Security-with-NVRO-Process.html,EnviroGold Global Limited,2025-10-02T11:05:00Z,coal demand,"EnviroGold Global advances NVRO Process™ to recover silver from U.S. mine waste, boosting supply security, jobs, and environmental remediation.......",GlobeNewswire,Global,News,2025-10-06T06:32:07.180339Z
3a6ee6394bb11fb2ecaf7fb8874dcb78,Coal demand to remain sluggish in current fiscal year: mjunction,https://economictimes.indiatimes.com/industry/indl-goods/svs/metals-mining/coal-demand-to-remain-sluggish-in-current-fiscal-year-mjunction/articleshow/124273284.cms,PTI,2025-10-02T10:46:06Z,coal demand,"Coal demand is currently sluggish due to an extended monsoon and increased supply, leading to a market glut and high stock levels across the system. While coal-based generation shows negative growth, demand is expected to grow mid-to-long term from new therma…",The Times of India,Unknown,Market Report,2025-10-06T06:32:07.180381Z
ec542582700433025d8516111438b7d6,Coal demand to remain sluggish in current fiscal year: mjunction,https://www.thehindubusinessline.com/economy/coal-demand-to-remain-sluggish-in-current-fiscal-year-mjunction/article70117532.ece,PTI,2025-10-02T10:20:08Z,coal demand,"From a mid-to-long term perspective, however, coal demand is expected to keep growing, albeit at a slower rate, in view of the strong pipeline of thermal power projects being planned and announced",BusinessLine,Unknown,Analysis/Opinion,2025-10-06T06:32:07.180411Z
4554e13dbfa73707037415082a6f7510,Inside Nova Scotia’s $60-billion wind gamble to power Canada’s clean energy future,https://financialpost.com/commodities/energy/nova-scotia-60-billion-wind-gamble-power-clean-energy-future,Andrew Rankin,2025-10-02T10:00:43Z,coal demand,"Some industry players say this is the most difficult time in more than a decade to launch offshore wind projects, both politically and financially",Financial Post,Unknown,News,2025-10-06T06:32:07.180450Z
b2d120c2d373345d7884f4041375be58,Skeptical Science New Research for Week #40 2025,https://skepticalscience.com/new_research_2025_40.html,,2025-10-02T07:50:48Z,coal demand,"Open access notables

The first emergence of unprecedented global water scarcity in the Anthropocene, Ravinandrasana & Franzke, Nature Communications

Access to water is crucial for all aspects of life. Anthropogenic global warming is projected to disrupt the…",Skepticalscience.com,Global,News,2025-10-06T06:32:07.180496Z
2948173b19bd309b854d2662110b44ea,How Climate Change Is Driving Home Insurance Turmoil,https://www.nakedcapitalism.com/2025/10/how-climate-change-is-driving-home-insurance-turmoil.html,Yves Smith,2025-10-02T05:07:36Z,coal demand,Climate-fueled storms and wildfires are increasing costs and pushing insurers to the limit. What happens if the market breaks?,Nakedcapitalism.com,Unknown,Market Report,2025-10-06T06:32:07.180523Z
c89495c738519f7e35538b9b8e79d4e6,Promising Energy Stocks To Research – September 30th,https://www.etfdailynews.com/2025/10/02/promising-energy-stocks-to-research-september-30th/,MarketBeat News,2025-10-02T05:06:50Z,coal demand,"Tesla, AltC Acquisition, and Oklo are the three Energy stocks to watch today, according to MarketBeat’s stock screener tool. Energy stocks are shares of publicly traded companies involved in the production, refinement, distribution or servicing of energy reso…",ETF Daily News,Unknown,Market Report,2025-10-06T06:32:07.180564Z
16efa09f141f5adbad6b7c3ce7a88956,Pakistan’s Solar Boom Faces Ire From Debt-Strapped Government,https://financialpost.com/pmn/business-pmn/pakistans-solar-boom-faces-ire-from-debt-strapped-government,Bloomberg News,2025-10-02T00:19:05Z,coal demand,The spread of rooftop solar has been an unlikely lifeline for Pakistan’s citizens burdened by sky-high bills and frequent blackouts. Now it’s also testing the country’s ability to pay its energy debts.,Financial Post,Unknown,News,2025-10-06T06:32:07.180620Z
37f36dda3a62eaa69a974c6ef11be0af,Vistra Corp. (VST) Becomes One of the Utilities Industry’s Most Notable Performers in the United States,https://finance.yahoo.com/news/vistra-corp-vst-becomes-one-232343312.html,Faheem Tahir,2025-10-01T23:23:43Z,coal demand,"Vistra Corp. (NYSE:VST) is one of the 10 Most Promising Green Stocks According to Wall Street Analysts, supported by hedge fund interest and analyst-rated...",Yahoo Entertainment,USA,News,2025-10-06T06:32:07.180643Z
d33595f20099550e1a362415b25826a7,"Melius Research Raises Cummins Inc. (CMI) from Hold to Buy, Share Price Reaches All-Time High",https://finance.yahoo.com/news/melius-research-raises-cummins-inc-224457768.html,Faheem Tahir,2025-10-01T22:44:57Z,coal demand,"Cummins Inc. (NYSE:CMI) is one of the 20 Best Stocks to Buy and Hold for a Lifetime, delivering consistent revenue and dividend growth. Melius Research...",Yahoo Entertainment,Unknown,News,2025-10-06T06:32:07.180678Z
c7e7006db0cd0b2e18f5410788d6c185,PIMCO Closed-End Funds Declare Monthly Common Share Distributions,https://www.globenewswire.com/news-release/2025/10/01/3160010/220/en/PIMCO-Closed-End-Funds-Declare-Monthly-Common-Share-Distributions.html,PIMCO Account Management,2025-10-01T21:01:00Z,coal demand,"NEW YORK, Oct. 01, 2025 (GLOBE NEWSWIRE) -- The Boards of Trustees/Directors of the PIMCO closed-end funds below (each, a “Fund” and, collectively, the “Funds”) have declared a monthly distribution for each Fund’s common shares as summarized below.",GlobeNewswire,Unknown,Market Report,2025-10-06T06:32:07.180718Z
e2546329144c82ba4de62123b533830c,Duke Energy Hoping To Keep Coal Units Alive As Grid Crisis Looms,https://dailycaller.com/2025/10/01/duke-energy-hoping-to-keep-coal-units-alive-as-grid-crisis-looms/,Audrey Streb,2025-10-01T20:34:10Z,coal demand,Duke Energy is hoping to keep some of its coal units humming to meet electricity demand as a grid reliability crisis looms large.,The Daily Caller,Unknown,News,2025-10-06T06:32:07.180749Z
55b74ddf18df3c32735b646091ef4f8a,Trump Is Betting Big on Rare Earth Minerals. He Could Snap Up These 3 Stocks Next.,https://www.barchart.com/story/news/35172352/trump-is-betting-big-on-rare-earth-minerals-he-could-snap-up-these-3-stocks-next,Aditya Raghunath,2025-10-01T20:28:39Z,coal demand,"Investors should consider gaining exposure to rare earth metal stocks, given that the Trump administration is eying equity stakes in strategic material...",Barchart.com,Unknown,News,2025-10-06T06:32:07.180783Z
2d690dca56c787815f141df541eb0fdb,Dynamic database addresses vanadium supply flow,https://techxplore.com/news/2025-10-dynamic-database-vanadium.html,Jan Berndorff,2025-10-01T19:24:05Z,coal demand,"Scientists at PSI have created a dynamic database for vanadium, an important raw material. This metal has enormous potential for the energy transition. Vanadium redox flow batteries (VRFB) can store electricity for longer than the widely used lithium-ion tech…",Tech Xplore,Unknown,News,2025-10-06T06:32:07.180830Z
7b0d738322e39809c48f322e19ce6bed,Trump wants to revive coal. Will it work?,https://theweek.com/business/economy/trump-coal-revival,"theweekonlineeditors@futurenet.com (Joel Mathis, The Week US) , Joel Mathis, The Week US",2025-10-01T18:18:03Z,coal demand,"Wind, solar and natural gas are ascendant",The Week Magazine,Unknown,News,2025-10-06T06:32:07.180853Z
bed3bc797bacbe42352e564cc42d486e,Corporate procurement stabilizes renewable energy projects: CEBA,https://www.utilitydive.com/news/corporate-procurement-renewable-energy-vppa-rec-hyperscaler-ceba/801750/,Diana DiGangi,2025-10-01T18:01:31Z,coal demand,“The primary role of corporate offtake agreements [is] to mitigate the financial risk associated with earning revenue from the variable wholesale electricity...,Utilitydive.com,Unknown,News,2025-10-06T06:32:07.180894Z
0e14333100c1a6132811059b6bc866e6,Poor Communities Are Paying the Price for “Free” AI Tools,https://inthesetimes.com/article/artificial-intelligence-ai-data-centers-climate-change,Dan Howells and Todd Larsen,2025-10-01T18:00:00Z,coal demand,"AI data centers produce massive noise pollution, use huge amounts of water and keep us hooked on fossil fuels.",In These Times,Unknown,News,2025-10-06T06:32:07.180926Z
2f7dc3f5f175f1fd0d43faeb7cf1ba73,Coal India production drops in September to 48.97 MT,https://economictimes.indiatimes.com/industry/indl-goods/svs/metals-mining/coal-india-production-drops-in-september-to-48-97-mt/articleshow/124263873.cms,PTI,2025-10-01T17:18:37Z,coal demand,"Coal India Limited reported a 3.9 percent production decline in September, reaching 48.97 million tonnes. This drop occurred despite government efforts to boost output. Many CIL subsidiaries saw reduced production. Experts cited heavy monsoon rains and waterl…",The Times of India,India,Market Report,2025-10-06T06:32:07.180949Z
dea4b4e489718e308c51196ae6bf5a46,"Climate, Money, Markets, And Trump’s ‘Stupid People’ U.N. Remark",https://www.forbes.com/sites/hershshefrin/2025/10/01/climate-money-markets-and-trumps-stupid-people-un-remark/,"Hersh Shefrin, Contributor, 
 Hersh Shefrin, Contributor
 https://www.forbes.com/sites/hershshefrin/",2025-10-01T17:11:28Z,coal demand,"Climate scientists are not stupid. Rather, stupidity is preventing climate science, money, and markets from creating a rational response to global warming.",Forbes,Global,Market Report,2025-10-06T06:32:07.180993Z
2a70cf5a345b2d4e3c10e10127f65d5d,US manufacturing slowdown continues for 7th straight month,https://economictimes.indiatimes.com/news/international/global-trends/us-manufacturing-slowdown-continues-for-7th-straight-month/articleshow/124263389.cms,AFP,2025-10-01T16:35:39Z,coal demand,"The US manufacturing sector contracted for a seventh consecutive month in September, though at a slightly slower pace, with the ISM index rising to 49.1 from 48.7 in August. Production improved, but declines in new orders and inventories offset gains. Survey …",The Times of India,Unknown,Market Report,2025-10-06T06:32:07.181034Z
b92c195decde72689ab8eccba3deafee,"Short-sighted Duke Energy Plan Recognizes Benefits of Solar and Battery Storage While Still Extending Outdated, Expensive Coal in North Carolina",https://www.edf.org/media/short-sighted-duke-energy-plan-recognizes-benefits-solar-and-battery-storage-while-still,awenzel,2025-10-01T16:25:57Z,coal demand,"""Duke Energy’s proposed 2025 Carbon Plan reaffirms that large amounts of solar and battery storage remain the cheapest choice to meet growing demand [...]""",Environmental Defense Fund,Unknown,News,2025-10-06T06:32:07.181082Z
dc77244937ae477adfc966a4a9492049,Andhra Pradesh's demand for transmission fee waiver troubles Adani solar deal,https://www.thehindubusinessline.com/companies/andhra-pradeshs-demand-for-transmission-fee-waiver-troubles-adani-solar-deal/article70116536.ece,Reuters,2025-10-01T15:52:21Z,coal demand,Adani Green Energy solar deal faces challenges in Andhra Pradesh amid US bribery investigation and transmission fee dispute.,BusinessLine,Unknown,News,2025-10-06T06:32:07.181116Z
18d5e73cfad705f00cbd6298fcc376d6,Physical AI - Building The Energy Infrastructure For Data Centers,https://www.forbes.com/sites/sabbirrangwala/2025/10/01/physical-aibuilding-the-energy-infrastructure-for-data-centers/,"Sabbir Rangwala, Senior Contributor, 
 Sabbir Rangwala, Senior Contributor
 https://www.forbes.com/sites/sabbirrangwala/",2025-10-01T15:00:59Z,coal demand,"Construction of renewable energy capacity like solar, to power digital AI and data centers is critical.  Physical AI and construction autonomy are making it happen.",Forbes,Unknown,News,2025-10-06T06:32:07.181151Z
934c3e3cedf0b73883ce19d6a7610997,What is fracking and why is it controversial?,https://www.bbc.com/news/articles/c9v73r1ljl0o,,2025-10-01T13:51:53Z,coal demand,The government says it plans to pass legislation to permanently ban fracking for shale gas in England.,BBC News,Unknown,News,2025-10-06T06:32:07.181178Z
26467125528acebfe6cca96c9e4e1fc1,Texas used twice as much energy as California and three times as much as Florida in 2023,https://www.eia.gov/todayinenergy/detail.php?id=66224,,2025-10-01T13:10:00Z,coal demand,"In 2023, Texas consumed more energy than any other state. Total energy consumption in Texas was twice as much as in California, the second-highest consuming state, and more than three times as much as in Florida, the third-highest consuming state, according t…",Eia.gov,Unknown,News,2025-10-06T06:32:07.181228Z
c0b35fe0190d07206c06dbb1bba52649,Why more EU countries might add targeted BEV incentives that exclude China imports,https://finance.yahoo.com/news/why-more-eu-countries-might-114427316.html,Nick Gibbs,2025-10-01T11:44:27Z,coal demand,Incentives offered by France and Britain to boost sales of locally built EVs have become more important as competition from China grows. Italy and Spain are ...,Yahoo Entertainment,China,News,2025-10-06T06:32:07.181288Z
e50fe3d28260c47bed7720c0aaa65873,Team Trump Will Spend $625 Million and Open Public Lands to Revive a Dying Industry,https://www.motherjones.com/politics/2025/10/trump-administration-625-million-public-lands-revive-coal-industry/,Dharna Noor,2025-10-01T11:30:00Z,coal demand,"This story was originally published by Guardian and is reproduced here as part of the Climate Desk collaboration. The White House will open 13.1 million acres of public land to coal mining while providing $625 million for coal-fired power plants, the Trump ad…",Mother Jones,Unknown,News,2025-10-06T06:32:07.181334Z
daffa6da42b959caec1968427dbacc0f,Xcel Purchases Turbines From Siemens for New Gas Plants in Texas,https://financialpost.com/pmn/business-pmn/xcel-purchases-turbines-from-siemens-for-new-gas-plants-in-texas,Bloomberg News,2025-10-01T11:28:35Z,coal demand,Xcel Energy Inc. agreed to buy natural gas turbines — among the most sought-after equipment in energy markets today — from Siemens Energy AG to power two power plants in West Texas.,Financial Post,Unknown,Market Report,2025-10-06T06:32:07.181370Z
720f5ca9cd91c9bf9d4c1ff9dba63c4d,Claim: Renewable Australia will Have No Problem with Zero Generation Days,https://wattsupwiththat.com/2025/10/01/claim-renewable-australia-will-have-no-problem-with-zero-generation-days/,Eric Worrall,2025-10-01T09:00:00Z,coal demand,"A new study suggests blackouts will only happen sometimes, if we build enough batteries and overcapacity, and a hydrogen export industry.",Wattsupwiththat.com,Australia,News,2025-10-06T06:32:07.181412Z
c0304fbf2b91f93076a3b33ae1f37caf,‘Not a good sign.’ Weak demand continues amid tariff uncertainty: PMI,https://www.manufacturingdive.com/news/pmi-september-2025-tariffs-weak-demand/761560/,Sara Samora,2025-10-01T08:55:57Z,coal demand,"In addition to new orders contracting and backlog orders increasing, the government shutdown adds further concerns for the industry.",Manufacturingdive.com,Unknown,News,2025-10-06T06:32:07.181449Z
c13c4282cde115d57a883e9c404fe27f,"The playbook for fighting antisemism in America, Part II",https://www.israelnationalnews.com/news/415679,"Eran Shayshon, Esq.",2025-10-01T08:33:30Z,coal demand,How Hamas weaponized progressive discourse to generate the highest wave of Jew-Hatred since the Holocaust and What Needs to Be Done to Fight It Effectively.,Israelnationalnews.com,USA,News,2025-10-06T06:32:07.181471Z
7d3b95e0d5a464d9ac4a5527a8508157,CNBC's The China Connection newsletter: China's K-visa plans spark worries of a talent flood,https://www.cnbc.com/2025/10/01/cnbcs-the-china-connection-newsletter-chinas-k-visa-plans-spark-worries-of-a-talent-flood.html,,2025-10-01T08:28:32Z,coal demand,"Despite signaling a greater openness to global talent, the policy does not represent a sweeping liberalization of China's immigration stance.",CNBC,China,News,2025-10-06T06:32:07.181486Z
5ac3408c168b569fb873e370fb191a1f,The Coal is Burning: FSP Blows Whistle on Govt. Over Coal Tender,https://english.gossiplankanews.com/2025/10/the-coal-is-burning-fsp-blows-whistle.html,noreply@blogger.com (Unknown),2025-10-01T07:54:00Z,coal demand,"The Frontline Socialist Party (FSP) has accused the government of rewriting the rulebook to hand a controversial coal import tender to a favoured company, reigniting debate over corruption in Sri Lanka’s energy sector.Speaking at a seminar in Bendiwewa, Polon…",Gossiplankanews.com,Unknown,News,2025-10-06T06:32:07.181533Z
