article_id,title,link,creator,pubdate,category,description,source,country,article_type,scrape_timestamp
05f1918797686b863781cd9955878b9d,Iran says missile programme ‘never negotiable’ as hopes rise for US talks,https://economictimes.indiatimes.com/news/defence/iran-says-missile-programme-never-negotiable-as-hopes-rise-for-us-talks/articleshow/128054471.cms,AFP,2026-02-08T01:03:56Z,Red Sea shipping,Iran's Foreign Minister Abbas Araghchi hopes for renewed talks with the United States soon. He stressed Iran's missile program is non-negotiable and warned of retaliation if attacked. US officials visited an aircraft carrier in the Arabian Sea. The US has imp…,The Times of India,USA,News,2026-02-14T06:50:14.503206Z
a02494513db8d04ea89468f7423ce73d,"More than 7,000 dead in Iran's crackdown on protests, activists say",https://www.pbs.org/newshour/world/more-than-7000-dead-in-irans-crackdown-on-protests-activists-say,"Jon Gambrell, Associated Press",2026-02-12T22:26:16Z,Strait of Hormuz,The continued rise in the tally of the dead from the demonstrations adds to the overall tensions facing Iran both inside the country and abroad as it tries to negotiate with the United States over its nuclear program.,PBS,USA,News,2026-02-14T06:50:14.925462Z
44c24231e3f0638f96070792c0227fb4,"Stock market today: Dow, S&P 500, Nasdaq sink as tech gets hit as AI disruption fears grow; gold, bitcoin sink",https://finance.yahoo.com/news/live/stock-market-today-dow-sp-500-nasdaq-sink-as-tech-gets-hit-as-ai-disruption-fears-grow-gold-bitcoin-sink-210353533.html,Rian Howlett,2026-02-12T21:03:53Z,Strait of Hormuz,"Wall Street is gearing up for an update on the Fed's favored inflation gauge, after the jobs report bolstered the case for keeping rates unchanged.",Yahoo Entertainment,Unknown,Market Report,2026-02-14T06:50:14.925506Z
bd27fda9979d03528a8d664a6092750a,"Deaths in Iran’s crackdown on protests reach at least 7,000, activists say",https://www.bostonherald.com/2026/02/12/iran-crackdown-death-toll/,Associated Press,2026-02-12T18:13:22Z,Strait of Hormuz,The U.S.-based Human Rights Activists News Agency offered the latest figures Thursday.,Boston Herald,Unknown,News,2026-02-14T06:50:14.925548Z
1e4799afaaf48b01e7b3a71b71db0b38,Crude Oil Prices Slip as US-Iran Tensions Ease,https://www.barchart.com/story/news/186850/crude-oil-prices-slip-as-us-iran-tensions-ease,Rich Asplund,2026-02-12T16:34:45Z,Strait of Hormuz,"March WTI crude oil (CLH26 ) today is down -1.19 (-1.83%), and March RBOB gasoline (RBH26 ) is down -0.0533 (-2.69%). Crude oil and gasoline prices are...",Barchart.com,Unknown,Market Report,2026-02-14T06:50:14.925578Z
ea244ace2e04c2b7285f6cd67ecb06d4,Bloomberg’s $108 Oil as Worst Case Iran War Scenario: Too Optimistic?,https://www.nakedcapitalism.com/2026/02/bloombergs-108-oil-as-worst-case-iran-war-scenario-too-optimistic.html,Yves Smith,2026-02-12T11:52:08Z,Strait of Hormuz,A detailed Bloomberg report lays out different scenarios for oil prices if Iran attacks. Is its forecast of a worst case of $108 a barrel too cheery?,Nakedcapitalism.com,Unknown,Analysis/Opinion,2026-02-14T06:50:14.925613Z
b28724926b91c1ff0ce3fb40542e3eab,Why Ghana Must Support Diplomacy in the U.S.–Iran Tensions,https://thechronicle.com.gh/why-ghana-must-support-diplomacy-in-the-u-s-iran-tensions/,admin,2026-02-12T11:06:42Z,Strait of Hormuz,"Your Excellency, As tensions between the United States and Iran continue to simmer with warships positioned in the Gulf, indirect talks in Oman delicately unfolding, and warnings issued from both sides, I write with concern for Ghana’s national interest. If I…",Thechronicle.com.gh,USA,News,2026-02-14T06:50:14.925872Z
dfcca898b78fb2ee53b8fbe2cf56c487,Why the U.S. Hasn’t Yet Struck Iran,https://www.theatlantic.com/national-security/2026/02/iran-trump-war-us-israel-netanyahu/685970/,"Nancy A. Youssef, Vivian Salama",2026-02-12T11:00:00Z,Strait of Hormuz,Diplomacy meets The Art of the Deal.,The Atlantic,Unknown,News,2026-02-14T06:50:14.925902Z
b29a0a2fe2dfccdd82efb9aac307cd61,"US Spy Plane, Drone Detected Near Iranian Border",https://sputnikglobe.com/20260212/us-spy-plane-drone-detected-near-iranian-border-1123623216.html,Sputnik International,2026-02-12T09:33:41Z,Strait of Hormuz,"MOSCOW (Sputnik) - A US Boeing P-8A Poseidon anti-submarine reconnaissance aircraft and a Northrop Grumman-made MQ-4C Triton surveillance drone were detected near Iran's border, according to flight tracking data seen by Sputnik.",Sputnikglobe.com,Unknown,News,2026-02-14T06:50:14.925987Z
41eabe804d68ebfb491486a47ee0d4f5,"Deaths in Iran's crackdown on protests reach at least 7,000, activists say",https://abcnews.com/International/wireStory/deaths-irans-crackdown-protests-reach-7000-activists-130082784,JON GAMBRELL Associated Press,2026-02-12T08:32:16Z,Strait of Hormuz,"Activists say the death toll from a crackdown over Iran’s nationwide protests has reached at least 7,002 with many more people still feared dead",Abcnews.com,Unknown,News,2026-02-14T06:50:14.926027Z
471751155cd2e3c77ec6d14664a98dec,"Deaths in Iran’s crackdown on protests reach at least 7,000, activists say",https://nypost.com/2026/02/12/world-news/deaths-in-irans-crackdown-on-protests-reach-at-least-7000-activists-say/,Associated Press,2026-02-12T07:31:29Z,Strait of Hormuz,"The death toll from a crackdown over Iran’s nationwide protests last month has reached at least 7,002 people killed with many more still feared dead, activists said Thursday.",New York Post,Unknown,News,2026-02-14T06:50:14.926069Z
21526fdd62bf4eb33602f2809de97216,"Death toll in Iran protest crackdown rises over 7,000, say activists",https://www.business-standard.com/world-news/death-toll-in-iran-protest-crackdown-rises-over-7-000-say-activists-126021200069_1.html,AP,2026-02-12T01:28:49Z,Strait of Hormuz,"The death toll from a crackdown over Iran's nationwide protests last month has reached at least 7,002 people killed with many more still feared dead, activists said Thursday.
The US-based Human Rights Activists News Agency, which offered the latest figures, h…",Business Standard,Unknown,News,2026-02-14T06:50:14.926116Z
78e335dd5ad044e8a08d823078899b12,EIA Sees Brent Price Dropping in 2026 and 2027,https://www.rigzone.com/news/eia_sees_brent_price_dropping_in_2026_and_2027-11-feb-2026-182964-article/,Andreas Exarheas,2026-02-11T16:09:18Z,Strait of Hormuz,The U.S. Energy Information Administration projected that the average Brent spot price will drop in 2026 and 2027.,Rigzone,Unknown,News,2026-02-14T06:50:14.926147Z
1d2cdd02e86eb788e4542150cfefbb53,"Squeezed by U.S. tensions and public anger over crackdown, Iran commemorates 1979 revolution",https://www.pbs.org/newshour/world/squeezed-by-u-s-tensions-and-public-anger-over-crackdown-iran-commemorates-1979-revolution,"Jon Gambrell, Associated Press",2026-02-11T14:59:59Z,Strait of Hormuz,President Masoud Pezeshkian got on stage at Azadi Square in Tehran and insisted that Iran is willing to negotiate over its nuclear program as fledgling nuclear talks talks with America hang in the balance.,PBS,USA,Market Report,2026-02-14T06:50:14.926166Z
50ef3e8720621fd6e6f0f5f1077cafc1,"Market Wrap: Sensex snaps 3-day gain, Nifty holds 25,900 as IT selloff dampens sentiment",https://economictimes.indiatimes.com/markets/stocks/news/market-wrap-sensex-snaps-3-day-gain-nifty-holds-25900-as-it-selloff-dampens-sentiment/articleshow/128201314.cms,Veer Sharma,2026-02-11T10:17:23Z,Strait of Hormuz,"Benchmark indices Sensex and Nifty ended largely flat on Wednesday, with the 30-share Sensex snapping its three-day gaining streak, while Nifty managed to close marginally higher.",The Times of India,Unknown,Market Report,2026-02-14T06:50:14.926199Z
8909c50fea4c4a08d1f24add74e735bc,Iran marks 1979 Islamic Revolution anniversary amid geopolitical tensions,https://economictimes.indiatimes.com/news/international/world-news/iran-celebrates-1979-islamic-revolution-amid-rising-tensions/articleshow/128196504.cms,AP,2026-02-11T08:29:45Z,Strait of Hormuz,Iran celebrated its 47th anniversary of its 1979 Islamic Revolution amidst significant pressure. US President Donald Trump suggested sending another aircraft carrier to the Middle East. Prime Minister Netanyahu visited Washington to advocate for strict terms …,The Times of India,Unknown,News,2026-02-14T06:50:14.926249Z
45940d3960c2f09e6d3f8180c153f5c9,"Opec+ supply pause, geopolitical risks tighten outlook for crude: Analyst",https://www.business-standard.com/markets/news/opec-supply-pause-geopolitical-risks-tighten-outlook-for-crude-analyst-126021100783_1.html,Mohammed Imran,2026-02-11T08:03:37Z,Strait of Hormuz,"Mirae Asset Sharekhan maintains a constructive short- to medium-term outlook for crude oil, supported by elevated geopolitical risks and Opec+'s decision to hold production at December levels.",Business Standard,Unknown,Analysis/Opinion,2026-02-14T06:50:14.926279Z
b7b2994f756bf0ad6e3ef5d8bb832f0d,Iran marks 47th anniversary of revolution,https://apnews.com/article/iran-revolution-anniversary-us-nuclear-talks-protests-4ffab53ef628073ca90b9c8707485577,Jon Gambrell,2026-02-11T07:24:06Z,Strait of Hormuz,Iran’s president has apologized to “all those affected” by the nationwide protest and bloody crackdown that followed it. President Masoud Pezeshkian also denounced on Wednesday unspecified “Western propaganda” surrounding the protests. Pezeshkian said he knew…,Associated Press,Unknown,News,2026-02-14T06:50:14.926326Z
4009d2c617f80018a754a96e33073fd5,Iran marks 1979 Islamic Revolution anniversary under pressure from inside and out,https://abcnews.com/International/wireStory/iran-marks-1979-islamic-revolution-anniversary-pressure-inside-130052258,JON GAMBRELL Associated Press,2026-02-11T07:09:45Z,Strait of Hormuz,Iran has marked the 47th anniversary of its 1979 Islamic Revolution on Wednesday during ongoing pressure from the U.S. and domestic unrest,Abcnews.com,Unknown,News,2026-02-14T06:50:14.926360Z
2b40f5953afd4e0930311a6965f6bd1d,Middle East on the brink: U.S.-Iran talks stall as military threats loom,https://www.naturalnews.com/2026-02-11-us-iran-talks-stall-military-threats-loom.html,Kevin Hughes,2026-02-11T06:00:00Z,Strait of Hormuz,"U.S.-Iran talks in Oman have stalled, with Iran refusing to halt uranium enrichment and the U.S. demanding broader concessions, including restrictions on Iran’s missile program and proxy networks. The U.S. insists Iran dismantle its nuclear infrastructure—ost…",Naturalnews.com,Unknown,News,2026-02-14T06:50:14.926453Z
f55a3cc86c3b2ceb0f5d2f79fd87db2d,"Trump: Iran Would Be ‘Foolish’ Not to Make Nuclear, Missile Deal — Mulls Sending Second Aircraft Carrier to Region",https://www.breitbart.com/politics/2026/02/10/trump-iran-foolish-not-make-nuclear-missile-deal/,Joshua Klein,2026-02-11T04:00:45Z,Strait of Hormuz,"President Donald Trump warned Iran that it would be “foolish” not to make a deal as a massive flotilla heads toward the region, with the United States again prepared to take “very tough” military action — including the possible dispatch of a second aircraft c…",Breitbart News,USA,News,2026-02-14T06:50:14.926483Z
7a7cd47cd53fa6e667cae05bca74f7d8,"Have You Heard About The Crazy Things That Iran, China And Russia Just Did?",https://www.activistpost.com/have-you-heard-about-the-crazy-things-that-iran-china-and-russia-just-did/,Editor,2026-02-11T02:58:00Z,Strait of Hormuz,"When global events reach a fever pitch, global leaders should be trying to bring the temperature down.  But instead, we are witnessing almost constant provocations.  In fact, I am extremely alarmed by a number of things that Iran, China and Russia have just d…",Activistpost.com,China,News,2026-02-14T06:50:14.926534Z
490ce26966c9fab2e9055255aea09799,Report: Trump officials debate seizing tankers to cut Iran’s main revenue source,https://www.israelnationalnews.com/news/422245,Israel National News,2026-02-11T02:11:25Z,Strait of Hormuz,"US officials say seizure of more tankers carrying Iranian oil is under consideration to pressure Tehran, but fears of retaliation and market disruption have so far kept Washington cautious.",Israelnationalnews.com,Unknown,Market Report,2026-02-14T06:50:14.926572Z
2e06a7edf5144519406a20e1e627b2ba,Oil Edges Down,https://www.rigzone.com/news/wire/oil_edges_down-10-feb-2026-182959-article/,"Mia Gindis, Weilun Soon",2026-02-10T21:56:53Z,Strait of Hormuz,Oil slid in a choppy session.,Rigzone,Unknown,News,2026-02-14T06:50:14.926683Z
089a4e52e3fd5aa8920b9c49b1e32e9f,"Top Iran security official is in Oman, the site of talks with the US, likely over nuclear messages",https://www.channelnewsasia.com/world/top-iran-security-official-in-oman-site-talks-us-likely-over-nuclear-messages-5921516,,2026-02-10T21:00:00Z,Strait of Hormuz,"<![CDATA[ Ali Larijani, a top Iranian security official, meets Omani leaders following fresh US-Iran nuclear talks. ]]>",CNA,Unknown,News,2026-02-14T06:50:14.926718Z
31c2f5259c845a7de2a800eb0744bdbe,Five Scenarios for Iran and What They Would Mean for Oil Markets,https://oilprice.com/Energy/Energy-General/Five-Scenarios-for-Iran-and-What-They-Would-Mean-for-Oil-Markets.html,OilPrice.com,2026-02-10T21:00:00Z,Strait of Hormuz,"To help navigate the uncertainty, we have framed five possible scenarios, detailed below, that outline plausible pathways, from diplomatic normalization to severe destabilization, and assess their consequences for geopolitics and global oil markets. Only a we…",OilPrice.com,Global,Market Report,2026-02-14T06:50:14.926760Z
258444fc211559e6e8e74647954ec036,Saudis have nukes – ex-Iranian commander,https://www.rt.com/news/632271-saudi-nuclear-iran-us/,RT,2026-02-10T20:57:49Z,Strait of Hormuz,"Saudi Arabia possesses nuclear weapons and the US knows it, former Iranian military commander Hussein Kanani has told RT Read Full Article at RT.com",RT,Unknown,News,2026-02-14T06:50:14.926798Z
c529db1b8a28895d39e4555545cd5411,"Top Iran security official travels to Oman, site of talks with U.S.",https://www.pbs.org/newshour/world/top-iran-security-official-travels-to-oman-site-of-talks-with-u-s,"Jon Gambrell, Associated Press",2026-02-10T19:30:14Z,Strait of Hormuz,"Iranian security official Ali Larijani is in Oman, the country currently mediating talks between Tehran and Washington over Iran's nuclear program.",PBS,Unknown,News,2026-02-14T06:50:14.926831Z
9d09c2bed20acc8e1f018ac6fd46f121,Energy Demand Concerns Weigh on Crude Prices,https://www.barchart.com/story/news/135066/energy-demand-concerns-weigh-on-crude-prices,Rich Asplund,2026-02-10T16:34:28Z,Strait of Hormuz,"March WTI crude oil (CLH26 ) today is down -0.33 (-0.51%), and March RBOB gasoline (RBH26 ) is down -0.0195 (-0.98%). Crude oil and gasoline prices are under...",Barchart.com,Unknown,Market Report,2026-02-14T06:50:14.926875Z
b9e1f239203ebdd67ab185a82129a4b9,"Market Wrap: Sensex adds 208 points, Nifty extends gain for third session, reclaims 25,900; auto, metal stocks shine",https://economictimes.indiatimes.com/markets/stocks/news/market-wrap-sensex-adds-200-points-nifty-extends-gain-for-third-session-reclaims-25900-auto-metal-stocks-shine/articleshow/128153249.cms,Veer Sharma,2026-02-10T10:14:27Z,Strait of Hormuz,"Benchmark indices Nifty and Sensex extended their gains for a second straight session on Tuesday, supported by a sharp rally in auto and metal stocks that lifted overall sentiment. Meanwhile, broader markets outperformed, with midcap and smallcap indices risi…",The Times of India,Unknown,Market Report,2026-02-14T06:50:14.926937Z
e9a717a27982b5a462ecb22b84495472,"Top Iran security official to travel to Oman, site of talks with US, likely with nuclear message",https://abcnews.go.com/International/wireStory/top-iran-security-official-travel-oman-site-talks-130012806,JON GAMBRELL Associated Press,2026-02-10T09:18:05Z,Strait of Hormuz,"Iranian security official Ali Larijani is traveling to Oman, the country currently mediating talks between Tehran and the United States over Iran's nuclear program",ABC News,USA,News,2026-02-14T06:50:14.926957Z
375082f2f01612d9603d993eeb347023,Crude oil futures trade lower after a rally as markets analyse US advisory to vessels,https://www.thehindubusinessline.com/markets/commodities/crude-oil-futures-trade-lower-after-a-rally-as-markets-analyse-us-advisory-to-vessels/article70613847.ece,BL Mangaluru Bureau,2026-02-10T04:47:06Z,Strait of Hormuz,"At 10.04 am on Tuesday, April Brent oil futures were at $68.91, down by 0.19 per cent, and March crude oil futures on WTI (West Texas Intermediate) were at $64.19, down by 0.26 per cent",BusinessLine,Unknown,Market Report,2026-02-14T06:50:14.926987Z
697589940e1b3699b777b004308f2a59,"Top Iran security official to travel to Oman, site of talks with US, likely with nuclear message",https://abcnews.go.com/Business/wireStory/top-iran-security-official-travel-oman-site-talks-130012807,JON GAMBRELL Associated Press,2026-02-10T04:37:31Z,Strait of Hormuz,"Iranian security official Ali Larijani is traveling to Oman, the country currently mediating talks between Tehran and the United States over Iran's nuclear program",ABC News,USA,News,2026-02-14T06:50:14.927004Z
3f034bbc7b3439fb13797b6061a17ac1,"Sensex gains 150 pts, Nifty above 25,900 for third straight day; smallcaps outperform",https://economictimes.indiatimes.com/markets/stocks/news/sensex-gains-150-pts-nifty-above-25900-for-third-straight-day-smallcaps-outperform/articleshow/128140258.cms,Veer Sharma,2026-02-10T04:01:28Z,Strait of Hormuz,"Indian stock markets opened on a strong note today. The Sensex and Nifty indices climbed higher, continuing their upward trend for the third day. Small-cap stocks showed impressive gains, outperforming the main indices. This positive momentum signals continue…",The Times of India,India,Market Report,2026-02-14T06:50:14.927025Z
2fba48c62e0937bd0b7c1f8c73dc7f0a,Top Iran security official to travel to Oman for nuclear talks with US,https://www.business-standard.com/world-news/top-iran-security-official-to-travel-to-oman-for-nuclear-talks-with-us-126021000109_1.html,AP,2026-02-10T03:40:38Z,Strait of Hormuz,"A top Iranian security official will travel Tuesday to Oman, the Mideast sultanate now mediating talks between Tehran and the United States over the Islamic Republic' nuclear program aimed at halting a possible American strike.
Ali Larijani, a former Iranian …",Business Standard,USA,News,2026-02-14T06:50:14.927055Z
d6555c18ab41362bada12dc77d586952,"Top Iran security official to travel to Oman, site of talks with US, likely with nuclear message",https://economictimes.indiatimes.com/news/defence/top-iran-security-official-to-travel-to-oman-site-of-talks-with-us-likely-with-nuclear-message/articleshow/128138301.cms,AP,2026-02-10T02:41:49Z,Strait of Hormuz,A top Iranian security official is heading to Oman for crucial nuclear talks. This visit aims to de-escalate tensions with the United States. Iran insists on its right to enrich uranium. The US has deployed military assets to the region. Tensions are high in …,The Times of India,USA,News,2026-02-14T06:50:14.927083Z
8ffbf47a8fd9443e4d5df66ec90429ab,Oil drifts lower as traders weigh supply risks amid U.S.-Iran tensions,https://economictimes.indiatimes.com/markets/commodities/news/oil-drifts-lower-as-traders-weigh-supply-risks-amid-u-s-iran-tensions/articleshow/128137022.cms,Reuters,2026-02-10T01:47:57Z,Strait of Hormuz,"On Tuesday, oil prices experienced a minor downturn as traders weigh the impact of potential supply disruptions. Tensions in the Strait of Hormuz, underscored by U.S. navigational advice to ships, contribute to market uncertainty with Iran. This vital shippin…",The Times of India,Unknown,Market Report,2026-02-14T06:50:14.927125Z
16f84a6a7c5a8207ce675e6369a6dc41,U.S. urges ships to stay 'as far as possible' from Iran's waters in Strait of Hormuz after boarding attempts,https://www.cnbc.com/2026/02/10/us-warns-ships-avoid-iran-strait-hormuz-boarding-irgc-tehran-israel-netanyahu.html,Anniek Bao,2026-02-10T01:39:18Z,Strait of Hormuz,"The U.S. told American-flagged ships to stay ""as far as possible"" from Iranian waters when navigating the Strait of Hormuz amid heightened U.S.-Iran tensions.",CNBC,USA,News,2026-02-14T06:50:14.927147Z
e69cb0668d0d010fe73aa1b004c46f11,Oil Holds Two-Day Advance as Traders Focus on Middle East Risks,https://financialpost.com/pmn/business-pmn/oil-holds-two-day-advance-as-traders-focus-on-middle-east-risks,Bloomberg News,2026-02-10T00:13:52Z,Strait of Hormuz,Oil held a two-day advance as rising tensions in the Middle East centered on OPEC member Iran added a risk premium to prices.,Financial Post,Unknown,Market Report,2026-02-14T06:50:14.927175Z
f01310cb6d1c41e17ed2e0927e08729a,"The Kyle Anzalone Show: Sen. Schumer Touts Funding Genocide in Gaza, US Downs Iranian Drone Near Aircraft Carrier",https://www.antiwar.com/blog/2026/02/09/the-kyle-anzalone-show-sen-schumer-touts-funding-genocide-in-gaza-us-downs-iranian-drone-near-aircraft-carrier/,Kyle Anzalone,2026-02-09T23:47:41Z,Strait of Hormuz,"A single clip can reveal the whole playbook. When a powerful senator calls military aid to Israel his “baby,” it says everything about priorities, leverage, and who pays the price. We pull the thread from that moment into the reality on the ground in Gaza, wh…",Antiwar.com,Unknown,News,2026-02-14T06:50:14.927224Z
0667b0abd203aadc36efed5949850db6,Oil Settles Higher as Hormuz Risks Resurface,https://www.rigzone.com/news/wire/oil_settles_higher_as_hormuz_risks_resurface-09-feb-2026-182951-article/,"Mia Gindis, Weilun Soon",2026-02-09T21:30:23Z,Strait of Hormuz,Oil prices closed higher after the US warned ships to avoid Iranian waters near the Strait of Hormuz.,Rigzone,Unknown,Market Report,2026-02-14T06:50:14.927249Z
f728cae5b492c8b7049a13d4090ded5d,Oil rises after US urges caution for vessels traveling near Iran,https://www.cnbc.com/2026/02/09/oil-prices-stable-after-iran-disruption-concerns-ease-russian-flow-to-india-slows.html,Cnbc,2026-02-09T20:01:20Z,Strait of Hormuz,Iran and the U.S. pledged to continue the talks following what both sides described as positive discussions.,CNBC,Unknown,News,2026-02-14T06:50:14.927303Z
376de1067ee4620adf365fc36b1f036d,US issues fresh guidance to vessels transiting Strait of Hormuz as Iran tensions simmer,https://www.thestar.com.my/news/world/2026/02/10/us-issues-fresh-guidance-to-vessels-transiting-strait-of-hormuz-as-iran-tensions-simmer,The Star Online,2026-02-09T16:58:00Z,Strait of Hormuz,"Feb 9 (Reuters) - The United States ‌issued fresh guidance on Monday to commercial vessels transiting the Strait ‌of Hormuz, a key shipping lane for Middle East oil supplies, ‌as tensions simmered between Washington and Tehran over Iran's nuclear program. Rea…",The Star Online,USA,News,2026-02-14T06:50:14.927332Z
b71864cb8d5b667014d03cb80f534d27,US issues fresh guidance to vessels transiting Strait of Hormuz as Iran tensions simmer,https://www.internazionale.it/ultime-notizie-reuters/2026/02/09/us-issues-fresh-guidance-to-vessels-transiting-strait-of-hormuz-as-iran-tensions-simmer,Internazionale,2026-02-09T16:40:21Z,Strait of Hormuz,"Feb 9 (Reuters) - The United States issued fresh guidance on Monday to commercial vessels transiting the Strait of Hormuz, a key shipping lane for Middle East oil supplie… Leggi",Internazionale.it,USA,News,2026-02-14T06:50:14.927354Z
ac4d50e3b49343ed73ad9dd50d918f1e,US issues fresh guidance to vessels transiting Strait of Hormuz as Iran tensions simmer,https://consent.yahoo.com/v2/collectConsent?sessionId=1_cc-session_6f1fd1aa-c14e-4f57-81a7-e2bfb677e753,,2026-02-09T16:40:21Z,Strait of Hormuz,,Yahoo Entertainment,Unknown,News,2026-02-14T06:50:14.927382Z
3368698aee8ebab61625d63b07dd10d4,US Tells American Ships to Keep Away From Iran Amid Tensions,https://financialpost.com/pmn/business-pmn/us-tells-american-ships-to-keep-away-from-iran-amid-tensions,Bloomberg News,2026-02-09T16:22:12Z,Strait of Hormuz,"The US said in an advisory that American-flagged ships should stay as far as possible from Iranian waters when navigating the Strait of Hormuz after a vessel was harassed last week, with tensions remaining high between Washington and Tehran.",Financial Post,USA,News,2026-02-14T06:50:14.927405Z
9a62ef23aeb070091e50c1d69727ff87,Tech Stocks Fuel Wall Street Rebound Before Data: Markets Wrap,https://financialpost.com/pmn/business-pmn/tech-stocks-fuel-wall-street-rebound-before-data-markets-wrap,Bloomberg News,2026-02-09T16:17:04Z,Strait of Hormuz,"Another rally in tech companies after an artificial intelligence-driven rout drove stocks higher before economic data that will help shape the Federal Reserve outlook. Bitcoin fell below $70,000. Gold topped $5,000.",Financial Post,Unknown,Analysis/Opinion,2026-02-14T06:50:14.927435Z
c7cc4a1f188751e31942d498460d0a6f,"Oil prices stable after Iran disruption concerns ease, Russian flow to India slows",https://www.channelnewsasia.com/business/oil-prices-stable-after-iran-disruption-concerns-ease-russian-flow-india-slows-5916516,,2026-02-09T11:20:22Z,Strait of Hormuz,"LONDON, Feb 9 : Oil prices were stable on Monday after the U.S. and Iran pledged to continue indirect talks, easing oil supply fears, but India stepping away from Russian oil purchases is giving prices a floor.Retracing earlier losses, Brent crude oil futures…",CNA,India,Market Report,2026-02-14T06:50:14.927491Z
