article_id,title,link,creator,pubdate,category,description,source,country,article_type,scrape_timestamp
3479d9ba81d7b37ce19aab0ab29e6f53,Should Strategic Ambiguity Be Saved?,https://www.theamericanconservative.com/should-strategic-ambiguity-be-saved/,Rebecca Draeger,2026-01-09T05:01:00Z,Red Sea shipping,"Washington must decide whether its old Taiwan strategy can survive a new world order.
The post Should Strategic Ambiguity Be Saved? appeared first on The American Conservative.",The American Conservative,USA,News,2026-01-13T12:53:02.948940Z
65a39cd7169168fde04e6536c6177841,Saudi Arabia alleges UAE smuggled Yemen separatist leader out of the country,https://www.pbs.org/newshour/world/saudi-arabia-alleges-uae-smuggled-yemen-separatist-leader-out-of-the-country,"Jon Gambrell, Associated Press",2026-01-08T19:22:52Z,Red Sea shipping,The UAE hasn't yet responded to the accusation. The situation further escalates tensions between the neighboring nations on the Arabian Peninsula.,PBS,Unknown,News,2026-01-13T12:53:02.949076Z
455bd5c872e3ca39607ca267a1382db2,Iran: Israeli FM's visit to Somaliland a 'dangerous precedent',https://www.globalsecurity.org/military/library/news/2026/01/mil-260107-presstv06.htm,John Pike,2026-01-08T10:03:36Z,Red Sea shipping,"Iran's Foreign Ministry has condemned the visit of Israeli foreign minister Gideon Saar to the self-declared republic of Somaliland, calling it a ""dangerous precedent in international relations"" and a ""lethal blow to the legal and normative foundations of the…",Globalsecurity.org,Global,News,2026-01-13T12:53:02.949298Z
db326389d37dceecab6e1af819008470,'Irregular' armed guards aboard Russian shadow tankers alarm Nordic-Baltic governments,https://www.foxnews.com/world/irregular-armed-guards-russian-shadow-tankers-alarm-nordic-baltic-governments,,2026-01-08T02:44:36Z,Red Sea shipping,Russia demands humane treatment of crew aboard seized oil tanker Marinera as White House says Venezuelan shadow fleet vessel faces prosecution.,Fox News,Russia,News,2026-01-13T12:53:02.949328Z
b8ee9ce0dba6fd199d714aaa717fb613,Yemen anti-Houthi council expels separatist leader and says he faces treason charges,https://abcnews.go.com/International/wireStory/yemen-anti-houthi-council-expels-separatist-leader-faces-128970987,FATMA KHALED Associated Press,2026-01-07T07:31:32Z,Red Sea shipping,A council fighting against Yemen’s Houthi rebels says it has expelled the leader of a separatist movement and charged him with treason after he reportedly declined to travel to Saudi Arabia for talks,ABC News,Unknown,Market Report,2026-01-13T12:53:02.949515Z
a81c1ca38f641c03ad8748c1bdec1fd4,"GORDON CHANG: After Trump Hits Venezuela, Will China Invade Taiwan?",https://dailycaller.com/2026/01/07/opinion-after-trump-hits-venezuela-will-china-invade-taiwan-gordon-chang/,Gordon Chang,2026-01-07T06:54:56Z,Red Sea shipping,China has never been more trade-dependent in its history. Xi Jinping's only hope for an economy that is probably contracting is to increase exports.,The Daily Caller,China,News,2026-01-13T12:53:02.949536Z
78ef9b44b5fcb7d64b7e879c1b80d33f,Explained: Why countries are lining up to recognise Somaliland,https://www.thehindubusinessline.com/news/world/explained-why-countries-are-lining-up-to-recognise-somaliland/article70480721.ece,Reuters,2026-01-07T03:37:33Z,Red Sea shipping,"Israel’s recognition of Somaliland has drawn global attention to the Horn of Africa region, its key shipping routes and growing geopolitical rivalry.",BusinessLine,Global,News,2026-01-13T12:53:02.949595Z
ab2d272ef916544f64174bbade6c7137,Australians trapped on Yemeni island after flare-up between Saudi Arabia and UAE,https://www.abc.net.au/news/2026-01-07/australians-trapped-socotra-island-yemen-saudi-arabia-uae/106205342,Matthew Doran and Sami Sockol,2026-01-06T19:46:18Z,Red Sea shipping,"Australians are among hundreds of tourists scrambling to leave a remote Yemeni island, as a crisis on the mainland between Saudi Arabia and the United Arab Emirates causes travel chaos.",ABC News (AU),Australia,Market Report,2026-01-13T12:53:02.949614Z
a57bdc0651bf8e349fd9a99760c93e0c,How Israel’s move in Somaliland fits in its broader strategy for regional dominance,https://mondoweiss.net/2026/01/how-israels-move-in-somaliland-fits-in-its-broader-strategy-for-regional-dominance/,Abdaljawad Omar,2026-01-06T16:13:38Z,Red Sea shipping,"Israel’s strategic posture favors a constant state of war over political deals that might constrain future aggression. Its recognition of Somaliland is part of this strategy, and an attempt to plant the first flag of its would-be empire in Africa.",Mondoweiss,Unknown,News,2026-01-13T12:53:02.949704Z
81723460e5f4922511fc709eda3d6e49,Somalia calls Israeli FM visit to Somaliland an ‘incursion’,https://www.digitaljournal.com/world/somalia-calls-israeli-fm-visit-to-somaliland-an-incursion/article,AFP,2026-01-06T15:42:20Z,Red Sea shipping,"The Israeli foreign minister arrived in Somaliland on Tuesday in a high-profile visit, condemned by Somalia as an “unauthorised incursion”, after Israel recognised the breakaway region in the Horn of Africa. Israel announced last month it was officially recog…",Digital Journal,Unknown,News,2026-01-13T12:53:02.949781Z
cbe2c53c71c3000551ebad82b73324b8,"Tourists on remote Yemeni island stranded after Saudi, UAE rift",https://www.thestar.com.my/news/world/2026/01/06/tourists-on-remote-yemeni-island-stranded-after-saudi-uae-rift,The Star Online,2026-01-06T10:25:00Z,Red Sea shipping,"DUBAI, Jan 6 - When the United Arab Emirates withdrew its troops from Yemen last ‌week under a deadline from Saudi Arabia, it also left behind the remote Yemeni island of Socotra and the roughly 600 tourists who had flown in but could no longer fly out. Read …",The Star Online,Unknown,Market Report,2026-01-13T12:53:02.949907Z
3b5101d94e46ec91dba710f2cc11bcdb,"AFCENT caps 2025 with decisive operations, strengthened partnerships across CENTCOM AOR",https://www.globalsecurity.org/military/library/news/2026/01/mil-260105-usaf01.htm,John Pike,2026-01-06T10:08:25Z,Red Sea shipping,"Ninth Air Force (Air Forces Central) closed out 2025 with a series of decisive victories, sustaining combat airpower against terrorist threats, expanding coalition integration across the U.S. Central Command area of responsibility, and advancing agile employm…",Globalsecurity.org,Unknown,News,2026-01-13T12:53:02.949984Z
ae792f33cc3f0b04c78f22e9ff082fdb,Saudi Arabian airstrikes force UAE-backed separatists to withdraw from a key Yemeni city,https://www.naturalnews.com/2026-01-06-saudi-strikes-force-separatists-withdraw-from-yemen.html,Zoey Sky,2026-01-06T06:00:00Z,Red Sea shipping,"Saudi Arabia has forcefully reversed a separatist land grab. After UAE-backed Southern Transitional Council (STC) fighters seized control of key eastern provinces in December, Saudi airstrikes forced them to withdraw from the critical port city of Mukalla. Co…",Naturalnews.com,Unknown,News,2026-01-13T12:53:02.950058Z
1d91bb0ad92cd3ebe334c0db4dfdb9a3,Powell pulls no punches,https://finance.yahoo.com/news/powell-pulls-no-punches-113542889.html,By Anna  Szymanski,2026-01-12T11:35:42Z,Strait of Hormuz,"By Anna Szymanski What matters in U.S. and global markets today By Anna Szymanski, Editor-in-Chief, Reuters Open Interest Markets got yet another weekend...",Yahoo Entertainment,Global,Market Report,2026-01-13T12:53:03.227193Z
1885c9d83c5b60e620f78ad9d2ae15b8,"Oil dips as investors assess Iran supply, Venezuelan export resumption",https://www.channelnewsasia.com/business/oil-dips-investors-assess-iran-supply-venezuelan-export-resumption-5851916,,2026-01-12T09:46:10Z,Strait of Hormuz,"LONDON, Jan ‌12 : Oil prices dipped on Monday, after Iran said it had ""total control"" following weekend violence, easing some concerns over supply from the OPEC producer, while investors also weighed efforts to resume oil exports from Venezuela.Brent crude fu…",CNA,UK,Market Report,2026-01-13T12:53:03.227620Z
ebcf76878a71231fd8ed93f7983d5eac,CNBC Daily Open: Iran has more avenues of retaliating against the U.S. — including oil supply,https://www.cnbc.com/2026/01/12/cnbc-daily-open-iran-has-more-avenues-of-retaliating-against-the-us-including-oil-supply.html,,2026-01-12T07:34:01Z,Strait of Hormuz,"White House officials have shown Trump plans on how he can carry through with his threat to intervene in Iran, according to media reports.",CNBC,Unknown,Market Report,2026-01-13T12:53:03.227706Z
2b70b3c639b34b0c932b2c46bde388d3,World's most vital oil chokepoint back in focus amid possible U.S. intervention in Iran,https://www.cnbc.com/2026/01/12/strait-of-hormuz-back-in-focus-amid-possible-us-intervention-in-iran.html,,2026-01-12T06:08:08Z,Strait of Hormuz,Oil markets are fixated on the Strait of Hormuz as investors assess the risk that a possible U.S. intervention could disrupt the critical energy chokepoints.,CNBC,Unknown,Market Report,2026-01-13T12:53:03.227767Z
c1d573d863ca2bba5041f02249813f28,"Oil steady, investors weigh Venezuela export resumption versus potential Iran supply disruption",https://economictimes.indiatimes.com/industry/energy/oil-gas/oil-steady-investors-weigh-venezuela-export-resumption-versus-potential-iran-supply-disruption/articleshow/126473654.cms,Reuters,2026-01-12T01:46:27Z,Strait of Hormuz,"Oil prices remained stable as investors weighed potential supply disruptions from Iran's intensifying protests against efforts to resume Venezuelan oil exports. Rights groups report over 500 deaths in Iran, with at least 1.9 million barrels of its oil exports…",The Times of India,Unknown,Market Report,2026-01-13T12:53:03.227842Z
efe60ac8a64ce62313765f3b2966c878,Trump’s power play risks global blowback,https://www.livemint.com/opinion/columns/india-geopolitical-repositioning-trump-global-chaos-new-world-order-11768148033140.html,Shashi Shekhar,2026-01-12T00:30:22Z,Strait of Hormuz,"After the US attacked Venezuela and abducted its President Maduro, Beijing imposed a ban on many US products and its banks sped up the process of shifting to Yuan instead of dollars for trade.",Livemint,China,News,2026-01-13T12:53:03.227870Z
8bd48a8ef00ef560770b9eb0fe544cfc,Is an Attack by Iran Imminent?,https://www.nakedcapitalism.com/2026/01/is-an-attack-by-iran-imminent.html,Yves Smith,2026-01-11T06:16:06Z,Strait of Hormuz,Signals are growing that Iran may be on the verge of Doing Something.,Nakedcapitalism.com,Unknown,News,2026-01-13T12:53:03.227908Z
300f180af37f4cd098450db5f9a8e532,USS Fitzgerald returns to San Diego following seven-month underway,https://www.globalsecurity.org/military/library/news/2026/01/mil-260106-usn01.htm,John Pike,2026-01-08T10:04:09Z,Strait of Hormuz,"Arleigh Burke-class guided-missile destroyer USS Fitzgerald (DDG 62) returned to its homeport of Naval Base San Diego following a seven-month underway to the U.S. 3rd, 5th, and 7th Fleet areas of operation, Jan. 6, 2026.",Globalsecurity.org,Unknown,News,2026-01-13T12:53:03.228163Z
944df0b5f0054c15ed437cfdec1dc366,"Israel readies for simultaneous war with Iran, Lebanon as protests threaten Iranian government",https://www.naturalnews.com/2026-01-06-israel-war-iran-lebanon-protests.html,Cassie B.,2026-01-06T06:00:00Z,Strait of Hormuz,Israel orders military to prepare for multi-front war against Iran and others. Israel is covertly fueling unrest inside Iran to destabilize its government. The U.S. is providing threats and potential military backing for Israeli actions. A war could block the…,Naturalnews.com,Unknown,News,2026-01-13T12:53:03.228292Z
2bc892da70a117b6f56e38cee5dd1dc1,"Sweden urges EU ban on support to Russian oil, gas-shipping fleet",https://www.internazionale.it/ultime-notizie-reuters/2026/01/12/sweden-urges-eu-ban-on-support-to-russian-oil-gas-shipping-fleet,Internazionale,2026-01-12T12:16:29Z,shipping sanctions,"STOCKHOLM, Jan 12 (Reuters) - The European Union should ban companies from providing any support to Moscow’s oil and gas-shipping fleet, introduce sanctions against Russi… Leggi",Internazionale.it,Russia,News,2026-01-13T12:53:03.882856Z
0f0cf4de0a15bda7dc5d9b3f6807767e,US Seizes Fifth Vessel Taken in Venezuela Blockade,https://www.insurancejournal.com/news/international/2026/01/12/853894.htm,admin,2026-01-12T11:53:03Z,shipping sanctions,"The U.S. has seized the Olina tanker in the Caribbean, the fifth vessel targeted in recent weeks as Washington steps up efforts to curb Venezuelan oil exports, U.S. officials said on Friday. The Olina, which according to public shipping database …",Insurance Journal,Unknown,News,2026-01-13T12:53:03.883058Z
abbf73057974c944d3ba264efb7e0744,"South Africa defends naval drills with Iran, Russia as 'essential'",https://www.spacewar.com/reports/South_Africa_defends_naval_drills_with_Iran_Russia_as_essential_999.html,,2026-01-12T06:23:07Z,shipping sanctions,"Simon's Town, South Africa (AFP) Jan 10, 2026

 South Africa on Saturday began naval drills with Russia, Iran and China, describing the manoeuvres off its coast as not merely a show of force but a vital response to rising maritime tensions. 

The week?long 'W…",Spacewar.com,China,News,2026-01-13T12:53:03.883152Z
fb31aa4adcf60b58faee8a059d556e22,Trump’s Greenland gambit: A strategic play or NATO’s breaking point?,https://www.naturalnews.com/2026-01-12-trumps-greenland-gambit-strategic-play-natos-breaking-point.html,Belle Carter,2026-01-12T06:00:00Z,shipping sanctions,"President Trump reportedly ordered military plans for a potential invasion of Greenland, citing concerns over Russian and Chinese encroachment on the resource-rich, strategically vital Arctic territory. Greenland’s leadership firmly rejected U.S. overtures, a…",Naturalnews.com,China,Market Report,2026-01-13T12:53:03.883269Z
bdfb38df0e6f20bebce6dcb6206e2182,Trump mulls 'very strong' military options as hundreds killed in Iran protests,https://www.bbc.com/news/articles/czdqy3rmp78o,,2026-01-12T05:36:07Z,shipping sanctions,"The US president says Iranian leaders have called ""to negotiate"", but adds the US ""may have to act"" before a meeting.",BBC News,Unknown,News,2026-01-13T12:53:03.883325Z
280b5af524ffe571823a44f4d488b448,Iranian Foreign Minister's visit to India called off amid protests and US threat,https://economictimes.indiatimes.com/news/india/iranian-foreign-ministers-visit-to-india-called-off-amid-protests-and-us-threat/articleshow/126470125.cms,Dipanjan Roy Chaudhury,2026-01-11T18:47:18Z,shipping sanctions,Iranian Foreign Minister Abbas Araghchi's India visit is cancelled. Growing protests in Iran and threats of external intervention have led to this decision. India is monitoring the situation closely. The future of Chabahar Port was a key agenda item. India ha…,The Times of India,India,News,2026-01-13T12:53:03.883581Z
26c5191e38c3897d36af8e507c2a6558,Iran threatens U.S. and Israel as protests enter third week,https://fortune.com/2026/01/11/iran-protests-death-toll-us-israel-trump-military-options/,"Arsalan Shahla, Bloomberg",2026-01-11T15:32:43Z,shipping sanctions,"The Oslo-based Iran Human Rights group said on Sunday it had confirmed the deaths of at least 192 protesters, including nine individuals under 18.",Fortune,Norway,News,2026-01-13T12:53:03.883721Z
1fccf05fedfa384813af0a5d6f561ee5,Donald Trump's 'no more oil or money' threat to Cuba is actually a warning to China? Details here,https://economictimes.indiatimes.com/news/international/us/donald-trumps-no-more-oil-or-money-threat-to-cuba-is-actually-a-warning-to-china-details-here/articleshow/126466934.cms,Global Desk,2026-01-11T15:04:24Z,shipping sanctions,"Donald Trump-Cuba: China may soon be under pressure elsewhere in Latin America. It ⁠has sought to increase its influence in Cuba, and the U.S. suspects Beijing runs an intelligence-gathering operation there, as per a report.",The Times of India,China,Market Report,2026-01-13T12:53:03.883837Z
e599cab12dc7f94f572a9ff43054e0ee,Trump threatens to cut oil supply to Cuba; suggests US deal ‘before it’s too late’,https://www.thehindubusinessline.com/news/world/trump-threatens-to-cut-oil-supply-to-cuba-suggests-us-deal-before-its-too-late/article70498039.ece,Reuters,2026-01-11T14:06:35Z,shipping sanctions,"Trump warns Cuba to secure a deal with the US, or face loss of Venezuelan oil and financial support.",BusinessLine,Unknown,News,2026-01-13T12:53:03.883927Z
067e0c9672184a8d69ff818cac7f6eb4,"BRICS wargames: Why they matter, why India opted out",https://www.aljazeera.com/news/2026/1/11/brics-wargames-why-they-matter-why-india-opted-out,Yashraj Sharma,2026-01-11T12:27:27Z,shipping sanctions,"South Africa is hosting the BRICS exercises, but two founding members are not participating amid tensions with the US.",Al Jazeera English,India,News,2026-01-13T12:53:03.884008Z
8f56eb34a8604515128f01639554900e,"South Africa holds naval drills with China, Russia and Iran",https://www.hurriyetdailynews.com/south-africa-holds-naval-drills-with-china-russia-and-iran-217710,hurriyetdailynews.com,2026-01-11T11:35:00Z,shipping sanctions,"South Africa on Jan. 10 began naval drills with Russia, Iran and China, describing the maneuvers off its coast as not merely a show of force but a vital response to rising maritime tensions.",Hurriyet Daily News,China,News,2026-01-13T12:53:03.884033Z
aca778e22774803547176e1d3e6a8f64,"Iran warns it will retaliate if US attacks, as hundreds killed in protests",https://www.bbc.co.uk/news/articles/cm2jek15m8no,Shayan Sardarizadeh,2026-01-11T05:44:56Z,shipping sanctions,"President Trump said on Sunday that the US military was considering ""very strong options"" in Iran.",BBC News,Unknown,News,2026-01-13T12:53:03.884084Z
c3d10629df7024436125c4bf5350156e,"Dilapidated ports, old tankers complicate US oil companies’ Venezuela plans",https://economictimes.indiatimes.com/news/international/business/dilapidated-ports-old-tankers-complicate-us-oil-companies-venezuela-plans/articleshow/126460527.cms,Reuters,2026-01-11T00:57:22Z,shipping sanctions,"Global oil firms are rushing to secure tankers and establish safe transfer operations for Venezuelan crude exports to the United States. Companies like Chevron, Vitol, and Trafigura are competing for U.S. government deals.  Venezuela has stored significant oi…",The Times of India,USA,News,2026-01-13T12:53:03.884128Z
9a4d4259fda5800cb012ddaf85eb3b38,"Companies scramble to secure ships, assemble operations to transfer Venezuelan oil, sources say",https://www.livemint.com/companies/companies-scramble-to-secure-ships-assemble-operations-to-transfer-venezuelan-oil-sources-say-11768092923873.html,list.metadata.agency,2026-01-11T00:55:23Z,shipping sanctions,"USA-VENEZUELA/OIL-SHIPPING (CORRECTED, PIX):REFILE-Companies scramble to secure ships, assemble operations to transfer Venezuelan oil, sources say",Livemint,Unknown,News,2026-01-13T12:53:03.884182Z
92a1be4181856bb9e132c7f61a0176fa,South Africa defends BRICS naval drills as ‘essential’ amid tensions,https://www.aljazeera.com/news/2026/1/10/south-africa-defends-brics-naval-drills-as-essential-amid-tensions,Al Jazeera,2026-01-10T15:21:18Z,shipping sanctions,"South African official says drills with Russia, Iran, China and others key to protecting 'maritime economic activities'.",Al Jazeera English,China,News,2026-01-13T12:53:03.884285Z
3bcf4aa53ff9a07ba30750769562ddc2,"South Africa defends naval drills with Iran, Russia as 'essential'",https://www.channelnewsasia.com/world/south-africa-iran-russia-naval-drills-defend-essential-5850501,,2026-01-10T13:31:00Z,shipping sanctions,"The exercises were to ""ensure the safety of shipping lanes and maritime economic activities"", says the joint taskforce commander from South Africa.",CNA,Russia,News,2026-01-13T12:53:03.884315Z
77c40d95cafa7d403f5f6c3aa875ec74,"South Africa defends naval drills with Iran, Russia as ‘essential’",https://www.digitaljournal.com/world/south-africa-defends-naval-drills-with-iran-russia-as-essential/article,AFP,2026-01-10T12:07:20Z,shipping sanctions,"South Africa on Saturday began naval drills with Russia, Iran and China, describing the manoeuvres off its coast as not merely a show of force but a vital response to rising maritime tensions.  The week‑long ‘Will for Peace 2026’ exercises come just days afte…",Digital Journal,China,News,2026-01-13T12:53:03.884348Z
c5ee6290ecbfcbfd2fbf60115d3c396f,"US seizes Olina tanker in Caribbean, fifth vessel taken in Venezuela blockade",https://economictimes.indiatimes.com/news/international/world-news/us-seizes-olina-tanker-in-caribbean-fifth-vessel-taken-in-venezuela-blockade/articleshow/126446442.cms,Reuters,2026-01-10T02:20:20Z,shipping sanctions,"The U.S. has seized the Olina tanker in the Caribbean, the fifth vessel targeted recently as Washington intensifies efforts to curb Venezuelan oil exports. The Olina, falsely flying the Timor Leste flag, had sailed from Venezuela and was returning to the regi…",The Times of India,Unknown,News,2026-01-13T12:53:03.884587Z
e0dfb764933bebfc6304ab953018fbe8,"As the Arctic warms up, the race to control the region is growing ever hotter",https://theconversation.com/as-the-arctic-warms-up-the-race-to-control-the-region-is-growing-ever-hotter-273118,"Klaus Dodds, Interim Dean, Faculty of Science & Technology, Middlesex University",2026-01-09T17:39:44Z,shipping sanctions,"Competition between the US, Russia and China is shutting out regional statkeholders and ignoring the interests of Indigenous people.",The Conversation Africa,China,News,2026-01-13T12:53:03.884754Z
8a3da37c8102adc3116fd6546bdbef5c,What lies ahead for Latin America after the Venezuela raid?,https://theconversation.com/what-lies-ahead-for-latin-america-after-the-venezuela-raid-272774,"Nicolas Forsans, Professor of Management and Co-director of the Centre for Latin American & Caribbean Studies, University of Essex",2026-01-09T16:44:27Z,shipping sanctions,Several other Latin American countries now sit squarely in Washington’s crosshairs.,The Conversation Africa,USA,News,2026-01-13T12:53:03.884784Z
c488af54f613c178e294dbcd47128fc0,"Chinese, Russian and Iranian warships arrive for drills in South Africa",https://www.aljazeera.com/news/2026/1/9/chinese-russian-and-iranian-warships-arrive-for-drills-in-south-africa,Al Jazeera,2026-01-09T16:24:58Z,shipping sanctions,"Naval exercises come as tensions run high after US military intervention in Venezuela, seizures of several oil tankers.",Al Jazeera English,China,News,2026-01-13T12:53:03.884806Z
73043e90e967bf28c373aad92f118ade,"U.S. in process of seizing Olina tanker in the Caribbean, officials say",https://www.cbc.ca/news/world/united-states-seizing-tanker-caribbean-9.7039299,,2026-01-09T14:05:21Z,shipping sanctions,"The U.S. is in the process of seizing the Olina tanker in the Caribbean near Trinidad in the fifth such interdiction of ships in recent weeks as part of Washington's efforts to control Venezuelan oil exports, two U.S. officials said on Friday.",CBC News,Unknown,News,2026-01-13T12:53:03.884998Z
e6f38e5cc2bfb09ed1f040eff03df15f,"US in process of seizing Timor-Leste-flagged Olina tanker in the Caribbean, officials say",https://www.channelnewsasia.com/world/us-seizing-timor-leste-flagged-oil-tanker-olina-caribbean-5848871,,2026-01-09T13:50:26Z,shipping sanctions,WASHINGTON: The US is in the process of seizing the Olina tanker in the Caribbean near Trinidad in the fifth such interdiction of ships in recent weeks as part of W,CNA,Unknown,News,2026-01-13T12:53:03.885048Z
a6f2d1031f221b996428702849cac961,"US seizes Olina tanker in Caribbean, fifth vessel taken in Venezuela blockade",https://www.channelnewsasia.com/world/us-seizes-olina-tanker-in-caribbean-fifth-vessel-taken-in-venezuela-blockade-5848871,,2026-01-09T13:50:00Z,shipping sanctions,The Olina left Venezuela last week fully loaded with oil as part of a flotilla shortly after the US seized Venezuelan President Nicolas Maduro.,CNA,Unknown,News,2026-01-13T12:53:03.885091Z
62b9e193eba84ca74b4ba02cee7ded42,Greg Grandin on Trump’s “Universal Police Warrant”,https://theintercept.com/2026/01/09/trump-venezuela-maduro-greg-grandin/,The Intercept Briefing,2026-01-09T11:00:00Z,shipping sanctions,"From Venezuela to Greenland, the Trump administration is redefining and invoking the Monroe Doctrine to seize whatever it wants, whenever it wants.
The post Greg Grandin on Trump’s “Universal Police Warrant”  appeared first on The Intercept.",The Intercept,Unknown,News,2026-01-13T12:53:03.885176Z
29905f0620154d555499e1ff4a510709,US frees two Russian crew detained on seized oil tanker,https://punchng.com/us-frees-two-russian-crew-detained-on-seized-oil-tanker/,Punch Newspapers,2026-01-09T10:36:55Z,shipping sanctions,"Russia confirms the US has decided to release two Russian crew members from an oil tanker seized in the North Atlantic in violation of sanctions.

Read More: https://punchng.com/us-frees-two-russian-crew-detained-on-seized-oil-tanker/",The Punch,Russia,News,2026-01-13T12:53:03.885205Z
dff66b6806a304298cbea6b88aec56f2,Trump has a China problem in Venezuela: What to do with Beijing's debt and oil stakes,https://www.yahoo.com/news/articles/trump-china-problem-venezuela-beijings-010046974.html,DIDI TANG and BERNARD CONDON,2026-01-09T01:00:46Z,shipping sanctions,"When it comes to claiming that Venezuelan oil is now under his control, President Donald Trump is mincing no words.  After all, Trump is expected to visit...",Yahoo Entertainment,China,News,2026-01-13T12:53:03.885343Z
