article_id,title,link,creator,pubdate,category,description,source,country,article_type,scrape_timestamp
247815bfac9f497ecc6c6b996ef70749,"High school student exposes classmates’ abysmal reading skills — as they struggle with words like ‘silhouette,’ ‘extraordinary’",https://nypost.com/2026/05/03/us-news/high-school-student-exposes-classmates-abysmal-reading-skills/,Anthony Blair,2026-05-03T17:26:55Z,charter rates,"In the clip, made by user “whatthevek” earlier this week, not a single high school-aged student was able to read the sentence, “She wore a silhouette of clothes that were extraordinary but somewhat gauche.”",New York Post,Unknown,News,2026-05-09T13:22:41.468634Z
3b5f5030a2dea0393046c95b872b32d3,Navios sells two supertankers to Sinokor,https://www.naftemporiki.gr/english/2106806/navios-sells-two-supertankers-to-sinokor/,Αλεξία Σωτηρίου,2026-05-06T05:27:30Z,shipbroking,"The disclosure of the Sinokor–Navios transaction confirms that the absorption of available tonnage in the VLCC market has not only continued but is being pursued methodically, with Navios Maritime Partners,…
Navios sells two supertankers to Sinokor - Η ΝΑΥΤΕΜ…",Naftemporiki.gr,Unknown,Market Report,2026-05-09T13:22:41.674341Z
0c027272642073850d007381deca03ed,Cannibalism and the common law,https://www.lawyersgunsmoneyblog.com/2026/05/cannibalism-and-the-common-law,Paul Campos,2026-05-08T13:13:07Z,maritime transport,"Continuing on this theme for a bit, as a law student at Michigan in the late 1980s I had the great good luck to take a class in English legal history from Brian Simpson, who had just been hired by the school after an extensive academic career in the UK and it…",Lawyersgunsmoneyblog.com,Unknown,News,2026-05-09T13:22:42.105777Z
96ee98208ffb9427e1506a7ec2f264d4,"""Absolutely Vulnerable"": Over 20,000 Global South Ship Workers Stranded at Sea Due to Iran War",https://www.democracynow.org/2026/5/8/seafarers_hormuz,webdev@democracynow.org (Democracy Now!),2026-05-08T12:48:38Z,maritime transport,"As Iran and the United States maintain rival blockades on the Strait of Hormuz and surrounding waters, we look at the more than 20,000 seafarers stranded on commercial ships since the outbreak of the war and unable to move out of the region. These maritime wo…",Democracy Now!,USA,News,2026-05-09T13:22:42.105820Z
a2fb02076b5ce20b61dea0531e20b225,The state’s financial black holes: public companies that lost hundreds of millions of lei,https://www.mediafax.ro/english/the-states-financial-black-holes-public-companies-that-lost-hundreds-of-millions-of-lei-23733718,Andreea Tobias,2026-05-08T12:18:41Z,maritime transport,"The National Railway Company CFR SA, Electrocentrale Craiova, Unifarm, and CFR Marfă lead the list of state-owned companies that reported gross losses exceeding 100 million lei in 2024, according to the Report on the Analysis of the Efficiency of Central and …",Mediafax.ro,Unknown,Analysis/Opinion,2026-05-09T13:22:42.105868Z
def73efbd79caa798cb35adc9ab66cce,"Energy Flows, Life Flows: Why Qatar's Real Strategic Asset Is Continuity",https://www.forbes.com/sites/guneyyildiz/2026/05/08/energy-flows-life-flows-why-qatars-real-strategic-asset-is-continuity/,"Güney Yıldız, Contributor, 
 Güney Yıldız, Contributor
 https://www.forbes.com/sites/guneyyildiz/",2026-05-08T12:07:25Z,maritime transport,"Qatar's strategic weight is not gas wealth alone. It runs on flows: LNG, aviation, capital, mediation, and migrant labor. Continuity is now the asset.",Forbes,Unknown,News,2026-05-09T13:22:42.105905Z
260a44ab0cb363e367987c70b37271f0,Satellite imagery shows Philippine construction on two islands in disputed Spratlys,https://www.globalsecurity.org/military/library/news/2026/05/mil-260508-rfa01.htm,John Pike,2026-05-08T12:00:00Z,maritime transport,"The Philippines is actively upgrading facilities on two islands it controls in the disputed Spratly chain in the South China Sea, satellite images reviewed by Radio Free Asia revealed.",Globalsecurity.org,China,Analysis/Opinion,2026-05-09T13:22:42.105919Z
578d41439eb909a76a497671af61bdec,Blount Island Command's Ship-to-Shore Operations Reinforces Southcom Readiness,https://www.globalsecurity.org/military/library/news/2026/05/mil-260508-dodnews02.htm,John Pike,2026-05-08T12:00:00Z,maritime transport,"Marines assigned to the 22nd Marine Expeditionary Unit landed an MK36 Wrecker tactical armored vehicle May 5 at Marine Corps Support Facility Blount Island in Jacksonville, Florida, demonstrating how the service rapidly moves equipment to support operations a…",Globalsecurity.org,Unknown,News,2026-05-09T13:22:42.105972Z
cf4f7fd689d176b0310fba9d0604b86e,"New World’s Largest Car Carrier Can Transport Over 10,000 Vehicles",https://www.odditycentral.com/news/new-worlds-largest-car-carrier-can-transport-over-10000-vehicles.html,Spooky,2026-05-08T09:32:27Z,maritime transport,"Glovis Leader, the world's largest car and truck shipping vessel, features 14 decks and can carry up to 10,800 vehicles.
The post New World’s Largest Car Carrier Can Transport Over 10,000 Vehicles first appeared on Oddity Central - Collecting Oddities.",Odditycentral.com,Unknown,News,2026-05-09T13:22:42.106020Z
64f271f1898c78984985fb2db4ada10b,'Mental well-being' biggest fear for thousands of seafarers stranded in the Strait of Hormuz,https://www.cbc.ca/news/world/seafarers-strait-hormuz-iran-war-9.7190934,,2026-05-08T08:00:00Z,maritime transport,"Food and water remain a significant concern for many of the thousands of seafarers stranded on vessels in the Strait of Hormuz.
But the ""the biggest fear for everybody is their mental well-being,"" says the general secretary of the International Transport Work…",CBC News,Global,News,2026-05-09T13:22:42.106071Z
6b99ca3208d1e06f5460de025e859c9e,Germany Requests Israeli Jet Fuel as Hormuz Disruptions Affect European Aviation,https://www.naturalnews.com/2026-05-08-germany-requests-israeli-jet-fuel-hormuz-disruptions.html,Garrison Vance,2026-05-08T06:00:00Z,maritime transport,"Israel will supply jet fuel to Germany after Berlin requested assistance as the Hormuz crisis disrupts aviation fuel flows into Europe, according to Israeli Foreign Minister Gideon Sa’ar. The shipments will be coordinated through domestic refining companies, …",Naturalnews.com,Germany,News,2026-05-09T13:22:42.106118Z
e0a85a15746f8c1acacb6fccae76256a,Maritime NZ confirms job cuts are proposed to ‘remain solvent’ amid funding shortfall,https://www.nzherald.co.nz/nz/maritime-nz-confirms-job-cuts-are-proposed-to-remain-solvent-amid-funding-shortfall/JLTTO2RKWVB3PA3Q63UGH2XLKM/,Lochlan Lineham,2026-05-08T02:21:51Z,maritime transport,The PSA says 34 Maritime NZ roles are on the line across key teams.,New Zealand Herald,Unknown,News,2026-05-09T13:22:42.106154Z
d93f19b082d072d837bc3c4e17a344dc,"As US and Iran weigh peace deal, stranded seafarers wait in limbo",https://www.aljazeera.com/news/2026/5/8/as-us-and-iran-weigh-peace-deal-stranded-seafarers-wait-in-limbo,Erin Hale,2026-05-08T01:45:17Z,maritime transport,"Some 20,000 seafarers are stranded in the Gulf amid the closure of the Strait of Hormuz.",Al Jazeera English,Unknown,News,2026-05-09T13:22:42.106185Z
aefe12c07bd0e901f478070c80db7235,Shipping firms are being whipsawed by changing stances and risks as they wait for Hormuz to reopen,https://www.pbs.org/newshour/economy/shipping-firms-are-being-whipsawed-by-changing-stances-and-risks-as-they-wait-for-hormuz-to-reopen,"Mae Anderson, Associated Press, David McHugh, Associated Press",2026-05-07T19:58:25Z,maritime transport,"To pressure Iran, the U.S. Navy is blockading Iran's ports, enforcing the blockade outside the strait in the Gulf of Oman and the Arabian Sea.",PBS,Unknown,News,2026-05-09T13:22:42.106224Z
466271de0808dbd98f356997925fb104,Idaho Has a Seagoing Port,https://www.neatorama.com/2026/05/07/Idaho-Has-a-Seagoing-Port/,John Farrier,2026-05-07T19:18:56Z,maritime transport,"It would not have occurred to me that the landlocked Idaho has access to the sea for oceanic transport, but it does. The Snake River touches the Port of Lewiston on the western border of the state. That river connects to the Columbia River and thence the Paci…",Neatorama.com,Unknown,News,2026-05-09T13:22:42.106287Z
c21916f6593ad46d6d088d33fc6b7ea9,Tracing the pathways to Yathrib (Al-Madinah): A GIS-based analysis of settlement patterns and ancient trade networks,https://journals.plos.org/plosone/article?id=10.1371/journal.pone.0348677,"Mohamed Metwaly, Abdullah Alshami",2026-05-07T14:00:00Z,maritime transport,"Ancient human activities in the arid Arabia peninsula are considered one of interesting research subjects in the landscape archaeological field to understand the relationships between human occupation strategies, material culture, and the natural environment …",Plos.org,Unknown,Analysis/Opinion,2026-05-09T13:22:42.106334Z
9d9c5b83f5638b43ccd6f2b1748ac880,Hibernia launches ferry service from Cork to Boulogne,https://www.irishtimes.com/transport/2026/05/07/hibernia-launches-ferry-service-from-cork-to-boulogne/,"Olivia Kelleher, in Cork",2026-05-07T12:13:12Z,maritime transport,Company expects new direct route to France will appeal to holidaymakers nervous about flight disruption and cost over fuel crisis,The Irish Times,Unknown,News,2026-05-09T13:22:42.106412Z
51021311e4924dca8ad7836c630a8296,Why did Trump pause Hormuz operation? #world,https://alltoc.com/world/why-did-trump-pause-hormuz-operation,AllToc,2026-05-07T12:03:56Z,maritime transport,"Trump paused “Project Freedom” after ally blocked airspace President Donald Trump’s administration paused a naval operation intended to help reopen the Strait of Hormuz after Saudi Arabia denied U.S. forces the use of Saudi airspace, according to the coverage…",Alltoc.com,Unknown,News,2026-05-09T13:22:42.106460Z
606be8969535747e75a936128a056c82,Marine Engines Market worth $16.92 billion by 2031 | MarketsandMarkets™,https://www.prnewswire.com/news-releases/marine-engines-market-worth-16-92-billion-by-2031--marketsandmarkets-302765297.html,,2026-05-07T10:31:00Z,maritime transport,"DELRAY BEACH, Fla., May 7, 2026 /PRNewswire/ -- According to MarketsandMarkets™, the global Marine Engines Market size is projected to grow from USD 14.24 billion in 2026 to USD 16.92 billion by 2031 at a compound annual growth rate (CAGR) of 3.5% during the …",PRNewswire,Global,Market Report,2026-05-09T13:22:42.106504Z
6b8dcc4f595575d7d2c0586041a6be49,Germany’s new militarization: Revival of the spirit or blatant revanchism? (by Dmitry Medvedev),https://www.rt.com/news/639537-germanys-new-militarization-revanchism/,RT,2026-05-07T05:20:18Z,maritime transport,On the eve of Victory Day Read Full Article at RT.com,RT,Germany,News,2026-05-09T13:22:42.106607Z
023e4ccd5d43960e1d97ed42f328141c,‘Vessel fund sustainability depends on repayment plans’,https://punchng.com/vessel-fund-sustainability-depends-on-repayment-plans/,Punch Newspapers,2026-05-07T01:05:55Z,maritime transport,"The sustainability of Nigeria’s Cabotage Vessels Financing Fund (CVFF) depends entirely on a strong repayment culture among its beneficiaries.

Read More: https://punchng.com/vessel-fund-sustainability-depends-on-repayment-plans/",The Punch,Unknown,News,2026-05-09T13:22:42.106655Z
d204470c67b428c63b64af24b8ac15de,"US-Iran war: FG rejects subsidy, price control return",https://punchng.com/us-iran-war-fg-rejects-subsidy-price-control-return/,Punch Newspapers,2026-05-06T23:07:45Z,maritime transport,"The Nigerian government has ruled out the return of fuel subsidy and price controls despite rising global oil prices caused by US-Iran tensions.

Read More: https://punchng.com/us-iran-war-fg-rejects-subsidy-price-control-return/",The Punch,Global,Market Report,2026-05-09T13:22:42.106690Z
041795498beac7189b696607fd7d87f8,Cargo ship crews face attacks waiting the Gulf as Trump pauses two-day-old project to ‘guide’ ships,https://fortune.com/2026/05/06/cargo-ship-crews-attacks-gulf-trump-pauses-project-guide/,"Mae Anderson, David McHugh, The Associated Press",2026-05-06T20:23:30Z,maritime transport,A cargo container ship operated by the French CMA CGM Group  came under attack while attempting to transit the Strait of Hormuz as concerns about Iranian speedboats and drones are leading major ship owners and operators to say the strait remains too dangerous.,Fortune,Unknown,News,2026-05-09T13:22:42.106741Z
50fab26f8f38bf0e2024032ee772e44f,Shipping firms are being whipsawed by changing stances and risks as they wait for Hormuz to reopen,https://abcnews.com/US/wireStory/shipping-firms-whipsawed-changing-stances-risks-wait-hormuz-132716869,MAE ANDERSON AND DAVID MCHUGH AP business writers,2026-05-06T17:38:11Z,maritime transport,"With hundreds of vessels still stuck in the Persian Gulf and costs piling up, shipping companies are being whipsawed by uncertainty over how and when the Strait of Hormuz might reopen more than two months into the Iran war",Abcnews.com,Unknown,News,2026-05-09T13:22:42.106782Z
a0d9131d31d0169e3b3d7fa341973c0c,"French Ship Hit by ‘Projectile’ in Strait of Hormuz, President Macron Insists France ‘In No Way’ Under Attack",https://freerepublic.com/focus/f-bloggers/4377965/posts,Breitbart,2026-05-06T16:21:23Z,maritime transport,"A French-owned container ship was “struck by an unknown projectile” in the Strait of Hormuz overnight, causing damage to the vessel and injuring crew members, the owner has confirmed. Container ship San Antonio was attacked in the Strait of Hormuz on Tuesday …",Freerepublic.com,Unknown,News,2026-05-09T13:22:42.106835Z
f7c5da6da60be6a5c317a00f553f8f30,China and Japan Are Entering a More Dangerous Phase of Rivalry,https://thediplomat.com/2026/05/china-and-japan-are-entering-a-more-dangerous-phase-of-rivalry/,Vanshika Saraf,2026-05-06T14:32:00Z,maritime transport,Neither China nor Japan wants war. The danger is that each side increasingly believes the other is preparing for one.,The Diplomat,China,News,2026-05-09T13:22:42.106849Z
d70a0d25af9d0cd0a3a2bc6ed6ed2d30,Crew on Malta-flagged vessel injured in Strait of Hormuz attack,https://timesofmalta.com/article/crew-maltaflagged-vessel-injured-strait-hormuz-attack.1128031,Sponsored,2026-05-06T14:09:07Z,maritime transport,Crew on Malta-flagged vessel injured in Strait of Hormuz attacktimesofmalta.com,Times of Malta,Unknown,News,2026-05-09T13:22:42.106877Z
89e16747fd91a0651e2719f08f18317a,"Is ferry travel the next big thing with flights in jeopardy? All the places you can get to by boat this summer - and some have cinemas, DJs and games rooms",https://www.dailymail.com/travel/article-15794891/ferry-travel-alternatives-flights-summer-destinations.html,"Tom Chesshyre, Alesia Fiddler",2026-05-06T13:27:29Z,maritime transport,"From France to even sunny Spain, there are plenty of destinations you can reach by boat this summer if air travel is too unpredictable.",Dailymail.com,Unknown,News,2026-05-09T13:22:42.106918Z
eacf6dc1866089fc14c23a1fde906ff8,"Balikatan 2026: MRF-D 26, joint, allied forces simulate maritime security on Balabac Island",https://www.globalsecurity.org/military/library/news/2026/05/mil-260506-mcn01.htm,John Pike,2026-05-06T12:00:00Z,maritime transport,"U.S. Marines with Marine Rotational Force - Darwin 26, a now-certified Special-Purpose Marine Air-Ground Task Force assigned to rotational deployments in the South Pacific, participated in a live-fire assault to secure and hold Balabac Airfield in a demonstra…",Globalsecurity.org,Unknown,News,2026-05-09T13:22:42.106972Z
d100d843069b7c0677eeaacaeedaa2b0,"French Ship Hit by 'Projectile' in Strait of Hormuz, President Macron Insists France 'In No Way' Under Attack",https://www.breitbart.com/europe/2026/05/06/french-ship-hit-by-projectile-in-strait-of-hormuz-president-macron-insists-france-in-no-way-under-attack/,Oliver JJ Lane,2026-05-06T11:41:47Z,maritime transport,"A French-owned container ship was ""struck by an unknown projectile"" in the Strait of Hormuz overnight, injuring crew members.
The post French Ship Hit by ‘Projectile’ in Strait of Hormuz, President Macron Insists France ‘In No Way’ Under Attack appeared first…",Breitbart News,Unknown,News,2026-05-09T13:22:42.107023Z
cc456bdbfaf9a11df90e46f16d1b86d6,Oil: 9% plunge after Axios report that US and Iran are nearing an agreement,https://en.protothema.gr/2026/05/06/oil-9-plunge-after-axios-report-that-us-and-iran-are-nearing-an-agreement/,Newsroom,2026-05-06T10:46:34Z,maritime transport,"Axios claims the agreement would include, among other things, the lifting of restrictions on ship passage through the Strait of Hormuz
The post Oil: 9% plunge after Axios report that US and Iran are nearing an agreement appeared first on ProtoThema English.",Protothema.gr,Unknown,Market Report,2026-05-09T13:22:42.107063Z
e917ca9287e1d7a093c6c807daffb94b,Saudi Arabia posts $33.5bn budget deficit amid drop in oil sales,https://www.aljazeera.com/economy/2026/5/6/saudi-arabia-posts-33-5bn-budget-deficit-amid-drop-in-oil-sales,John Power,2026-05-06T10:17:05Z,maritime transport,Kingdom announces sharp rise in budget shortfall amid the effective closure of the Strait of Hormuz.,Al Jazeera English,Unknown,News,2026-05-09T13:22:42.107091Z
5151e3519fade98f6f982c73ca95a96f,"Trade Restrictions Push Up Costs, Strain Supply Chains in Northern Shan",https://english.shannews.org/archives/29682,SHAN,2026-05-06T09:21:13Z,maritime transport,"New restrictions imposed by military authorities on the transport of Chinese goods into northern Shan State are disrupting trade routes, slowing cargo operations, and driving up commodity prices, according to local traders and transport workers. Residents and…",Shannews.org,China,Market Report,2026-05-09T13:22:42.107109Z
f00a786600fd01a28f266b526f74296f,New ferry line to link Çanakkale with Greece’s Lemnos,https://www.hurriyetdailynews.com/new-ferry-line-to-link-canakkale-with-greeces-lemnos-221856,hurriyetdailynews.com,2026-05-06T05:18:26Z,maritime transport,"A new ferry route connecting northwestern Türkiye with the Greek island of Lemnos is set to launch on June 13, marking the latest expansion in cross-border tourism between the two neighbors.",Hurriyet Daily News,Greece,News,2026-05-09T13:22:42.107188Z
acbd98846217cfb27a3e198f8dd8c608,ASEAN’s Angry Summit,http://foreignpolicy.com/2026/05/06/asean-cebu-leaders-summit-philippines-fuel-crisis/,Joseph Rachman,2026-05-06T05:00:32Z,maritime transport,Frustration bubbles with the United States ahead of the leaders’ gathering in Cebu.,Foreign Policy,USA,News,2026-05-09T13:22:42.107206Z
e9a44603c0ea22e5559c76e9a3b711b2,"UN sounds alarm over ‘humanitarian crisis’ as 20,000 seafarers stranded in Persian Gulf stalemate",https://www.thehindubusinessline.com/economy/logistics/un-sounds-alarm-over-humanitarian-crisis-as-20000-seafarers-stranded-in-persian-gulf-stalemate/article70945524.ece,ANI,2026-05-06T04:16:04Z,maritime transport,"Iranian ports pose war-zone risks, while visa restrictions and logistical hurdles along the Arab states lining the Gulf’s southern shores make it difficult for many sailors to leave their vessels",BusinessLine,Unknown,News,2026-05-09T13:22:42.107270Z
df8da7864b24ebecde073d131c2e083b,Iran creates authority to control Strait of Hormuz,https://punchng.com/iran-creates-authority-to-control-strait-of-hormuz/,Punch Newspapers,2026-05-05T23:54:50Z,maritime transport,"Iran introduces a new authority to regulate and control all maritime transit through the strategic Strait of Hormuz amid rising regional tensions.

Read More: https://punchng.com/iran-creates-authority-to-control-strait-of-hormuz/",The Punch,Unknown,News,2026-05-09T13:22:42.107312Z
61721b5d5641f9cf4836261ba342f2d0,Marco Rubio Can’t Believe U.S. Is Reaping What It Sowed In Iran,https://www.huffpost.com/entry/marco-rubio-cant-believe-us-is-reaping-what-it-sowed-in-iran_n_69fa592ce4b016ec076c33c9,HuffPost,2026-05-05T22:28:12Z,maritime transport,The Secretary of State said it's unacceptable for Iran to control the Strait of Hormuz. How did that happen again?,HuffPost,Unknown,News,2026-05-09T13:22:42.107349Z
d2c8dd9085e75ce3895a39636a1d13ac,UAE Buys up to 20 C-390 Millennium Transport Aircraft in Embraer’s Largest Overseas Order,https://theaviationist.com/2026/05/05/uae-buys-up-to-20-c-390-millennium/,James Gray,2026-05-05T19:19:36Z,maritime transport,"The UAE is procuring ten C-390 Millennium transport aircraft, with an option for ten more, making the UAE the largest export customer for the aircraft and the first in the Middle East. The United Arab Emirates (UAE) has signed a deal with Embraer for ten C-39…",Theaviationist.com,Unknown,Market Report,2026-05-09T13:22:42.107394Z
a76de705944efa226f573b8defe11a06,Iran war: Will tensions escalate in the Strait of Hormuz?,https://www.dw.com/en/iran-war-will-tensions-escalate-in-the-strait-of-hormuz/a-77057831,Astrid Prange de Oliveira,2026-05-05T18:37:00Z,maritime transport,"Could US President Trump's ""Project Freedom"" clear the congestion in the Strait of Hormuz? Or could it lead to an escalation of hostilities? Questions and answers. Is a secure escort of tankers and merchant ships by US forces in the Strait of Hormuz possible?…",DW (English),Unknown,News,2026-05-09T13:22:42.107442Z
7103ce9e785d43a6370c3f2c3533a012,Map of dominance: Why Iran can’t afford to give up Hormuz control,https://www.aljazeera.com/news/2026/5/5/map-of-dominance-why-iran-cant-afford-to-give-up-hormuz-control,Federica Marsi,2026-05-05T14:19:39Z,maritime transport,The vital passageway is key for Tehran as it seeks to leverage in negotiations with Washington.,Al Jazeera English,Unknown,News,2026-05-09T13:22:42.107476Z
c44d361b6c5b71bad038d84bccd531ff,"Iran seizes two ships, reducing Strait of Hormuz traffic amid tensions",https://cryptobriefing.com/iran-seizes-two-ships-reducing-strait-of-hormuz-traffic-amid-tensions/,Estefano Gomez,2026-05-05T14:18:36Z,maritime transport,"Heightened tensions in the Strait of Hormuz could disrupt global energy supplies, impacting market stability and geopolitical relations.
The post Iran seizes two ships, reducing Strait of Hormuz traffic amid tensions appeared first on Crypto Briefing.",Crypto Briefing,Global,Market Report,2026-05-09T13:22:42.107512Z
8b15c5ae53e23521c0511c6c5bcf2060,Nearly £50 million government backing to power up drone and flying taxi tech and crack down on illegal drones,https://www.gov.uk/government/news/nearly-50-million-government-backing-to-power-up-drone-and-flying-taxi-tech-and-crack-down-on-illegal-drones,Department for Transport,2026-05-05T12:45:10Z,maritime transport,"Funding will help develop a numberplate ID system for drones, helping police better protect UK skies and prosecute illegal users.",Www.gov.uk,Unknown,News,2026-05-09T13:22:42.107548Z
8ca9b856bad716e5eeb1260f89181b19,Jebel Ali collapse transforms Iran's logistical position,https://www.globalsecurity.org/wmd/library/news/iran/2026/05/iran-260505-presstv10.htm,John Pike,2026-05-05T12:00:00Z,maritime transport,The halt of activity at Jebel Ali port in the United Arab Emirates due to heightened tensions in the Persian Gulf has forced Iran to accelerate a long-planned diversification of its trade routes.,Globalsecurity.org,Unknown,Market Report,2026-05-09T13:22:42.107584Z
9566024e5dd451f4050046b75f415c12,"India-Myanmar bolster maritime partnership, discuss expanding defence collaboration during visit of Navy Chief Admiral Dinesh Tripathi",https://www.thehindubusinessline.com/economy/india-myanmar-bolster-maritime-partnership-discuss-expanding-defence-collaboration-during-visit-of-navy-chief-admiral-dinesh-tripathi/article70941327.ece,ANI,2026-05-05T05:04:25Z,maritime transport,The meeting marked a key milestone towards deepening defence ties with a focus on enhancing maritime security in the Bay of Bengal under MAHASAGAR,BusinessLine,India,News,2026-05-09T13:22:42.107605Z
b1a15a1a02e4b065cc1b4ff7da2b7a59,"US naval ops to safeguard global energy, India's LPG supply, says Treasury Secy Bessent; urges China to help reopen Hormuz Strait",https://www.thehindubusinessline.com/news/world/us-naval-ops-to-safeguard-global-energy-indias-lpg-supply-says-treasury-secy-bessent-urges-china-to-help-reopen-hormuz-strait/article70941216.ece,ANI,2026-05-05T03:33:25Z,maritime transport,"Addressing concerns over global energy markets, Bessent acknowledged a shortfall of up to 10 million barrels per day due to the crisis but expressed confidence that supply would stabilise",BusinessLine,China,Market Report,2026-05-09T13:22:42.107667Z
5d4801f070fdaabebd6ec08623df8dca,Oil prices surge as violence flares in Strait of Hormuz,https://www.aljazeera.com/economy/2026/5/5/oil-prices-surge-as-violence-flares-in-strait-of-hormuz,John Power,2026-05-05T03:23:35Z,maritime transport,Brent crude rises nearly 6 percent as soaring tensions in waterway push ceasefire to the brink.,Al Jazeera English,Unknown,Market Report,2026-05-09T13:22:42.107694Z
1e39abae31659c69cf8e083d39c41fe0,"The Rookie's Boss on That Season 8 Finale Cliffhanger, Chenford, and More",https://www.tvguide.com/news/features/the-rookie-season-8-finale-cliffhanger-chenford/,Max Gao,2026-05-05T03:00:05Z,maritime transport,"The Rookie's Boss on That Season 8 Finale Cliffhanger, Chenford, and Moretvguide.com",TV Guide,Unknown,News,2026-05-09T13:22:42.107723Z
