article_id,title,link,creator,pubdate,category,description,source,country,article_type,scrape_timestamp
1de0f0e797283c6f23ebd339b1b3a827,"Before Waging War, Consult Historians First",http://www.noemamag.com/before-waging-war-consult-historians-first,"March 20, 2026",2026-03-20T00:00:00Z,grain exports,Hoover Institution fellow Niall Ferguson's latest article recounts once again the lessons of “applied history” that decision-makers in Washington would be wise to heed now that they have leapt headlong into the fog of war.,Noemamag.com,Unknown,News,2026-03-22T06:55:43.895842Z
106c5665d5b2fddf97af4dbc51c8614a,Itafos Q4 2025 and Full Year 2025 Operational and Financial Results – A Year of Superior Execution,https://www.globenewswire.com/news-release/2026/03/18/3258668/0/en/Itafos-Q4-2025-and-Full-Year-2025-Operational-and-Financial-Results-A-Year-of-Superior-Execution.html,Itafos,2026-03-18T22:01:00Z,grain exports,"HOUSTON, March 18, 2026 (GLOBE NEWSWIRE) -- Itafos Inc. (TSX-V: IFOS) (OTCQX: ITFS) (the “Company” or “Itafos”) today reported its Q4 2025 and full year 2025 financial results and provided a corporate update. The Company’s financial statements and management’…",GlobeNewswire,Unknown,Market Report,2026-03-22T06:55:43.895894Z
627e7f07c6f0cf801edf9b6f42bb259f,Who Needs Glyphosate?,https://www.activistpost.com/who-needs-glyphosate/,Editor,2026-03-18T20:00:00Z,grain exports,President Donald Trump’s executive order of Feb. 18 invoking the Defense Production Act of 1950 to ensure US glyphosate production and availability is neither necessary nor helpful. HHS Secretary and Make America Healthy Again (MAHA) founder Robert F. Kennedy…,Activistpost.com,USA,News,2026-03-22T06:55:43.895922Z
b9afb62310ec091507ea5a0416499205,The Iran War’s Next Threat Is to Food and Water,https://www.theatlantic.com/national-security/2026/03/the-iran-wars-next-threat-is-to-food-and-water/686435/,Vivian Salama,2026-03-18T16:51:29Z,grain exports,A prolonged closure of the Strait of Hormuz could unleash a humanitarian crisis.,The Atlantic,Unknown,News,2026-03-22T06:55:43.895955Z
6db44b38da7470011c701689de8e9ec4,"India’s corn exports may gain due to Iran war, other factors",https://www.thehindubusinessline.com/economy/agri-business/indias-corn-exports-may-gain-due-to-iran-war-other-factors/article70758873.ece,Subramani Ra Mancombu,2026-03-18T16:04:43Z,grain exports,"India's corn exports are set to rise to 6.5 lakh tonnes this year, driven by competitive pricing and regional demand.",BusinessLine,India,News,2026-03-22T06:55:43.895976Z
178e4995768fd58eca6fa06fe29dbad7,Fuel and fertiliser shortage hits at crunch time for farmers,https://www.abc.net.au/news/2026-03-18/fuel-and-fertiliser-shortage-hits-as-farmers-sow-winter-crops/106459560,Justine Longmore and Matt Brann,2026-03-17T20:18:38Z,grain exports,Farmers are warning consumers to expect price rises in the supermarket as fuel and fertiliser shortages affect crop production and transport.,ABC News (AU),Unknown,Market Report,2026-03-22T06:55:43.896007Z
315d2ec7ef705fa64a6c95ce2976b390,"Explainer: How does the Iran war affect fertiliser supplies, prices and food security?",https://economictimes.indiatimes.com/news/international/world-news/explainer-how-does-the-iran-war-affect-fertiliser-supplies-prices-and-food-security/articleshow/129634752.cms,Reuters,2026-03-17T14:03:45Z,grain exports,"The escalating conflict between the U.S. and Israel against Iran is sending shockwaves through the global fertilizer industry. Trade routes, especially through the vital Strait of Hormuz, are facing disruptions, affecting the flow of both fertilizer and energ…",The Times of India,Global,Market Report,2026-03-22T06:55:43.896052Z
d2c9eb63173ba9d95ab10e7158f4060f,"Share Market Highlights: Sensex jumps 568 points, Nifty nears 23,600 in strong close",https://www.thehindubusinessline.com/markets/stock-market-highlights-march-17-2026/article70749721.ece,"KS Badri Narayanan, Team BL",2026-03-17T10:32:26Z,grain exports,"Sensex, Nifty updates on 17 March 2026:  The Sensex climbed 567.99 points, or 0.75%, to close at 76,070.84, while the Nifty 50 advanced 172.35 points, or 0.74%, to settle at 23,581.15. Indian equities extended their rally for a second straight session, driven…",BusinessLine,India,Market Report,2026-03-22T06:55:43.896079Z
80f25cf706f5e9198d5dee914453dccc,Op-ed: The Persian Gulf Oil Crisis Is a Food Crisis,https://civileats.com/2026/03/17/op-ed-the-persian-gulf-oil-crisis-is-a-food-crisis/,Raj Patel,2026-03-17T08:00:29Z,grain exports,"U.S. Agriculture Secretary Brooke Rollins acknowledged this trouble on Friday, telling reporters the administration is pursuing “every potential avenue” to keep fertilizer prices down. “We are very close to having an announcement on some solutions on what tha…",Civil Eats,Unknown,Market Report,2026-03-22T06:55:43.896124Z
a4236d5aff55795cb1e0ea1414abaa8d,"'Door open' for Canada's military help with shipping crisis in Gulf, defence minister says",https://nationalpost.com/news/canada-iran-david-mcguinty-strait-of-hormuz,Jordan Gowling,2026-03-16T21:59:22Z,grain exports,Defence Minister David McGuinty said Canada is “considering” President Trump's request for NATO allies to help defend the Strait of Hormuz.,National Post,Unknown,News,2026-03-22T06:55:43.896164Z
4b608ab84201c40fabf1ebb1fb17f87d,Breitbart Business Digest: Duration Is Destiny for the Iran War,https://www.breitbart.com/economy/2026/03/16/breitbart-business-digest-duration-is-destiny-for-the-iran-war/,John Carney,2026-03-16T21:29:38Z,grain exports,"We have argued since the opening days of Operation Epic Fury that the economic consequences of the Iran war depend less on the price of oil this week than on one question: how long does this last?
The post Breitbart Business Digest: Duration Is Destiny for th…",Breitbart News,Unknown,News,2026-03-22T06:55:43.896214Z
178467bc8c0471f818638233788c785c,"From the strait of Hormuz to Malacca, global trade relies almost entirely on these five narrow waterways",https://theconversation.com/from-the-strait-of-hormuz-to-malacca-global-trade-relies-almost-entirely-on-these-five-narrow-waterways-278329,"Gokcay Balci, Lecturer in Sustainable Freight Transport and Logistics, University of Leeds, Ebru Surucu-Balci, Assistant Professor in Circular Supply Chains, University of Bradford",2026-03-16T15:40:18Z,grain exports,The vital strait of Hormuz has been effectively closed to shipping since the start of the conflict in Iran.,The Conversation Africa,Global,News,2026-03-22T06:55:43.896248Z
c5a4e2d636804d37519642d0b42aaabe,Countries hesitant to back Trump’s ‘Hormuz coalition’ bid,https://www.hurriyetdailynews.com/countries-hesitant-to-back-trumps-hormuz-coalition-bid-220017,hurriyetdailynews.com,2026-03-16T11:41:26Z,grain exports,"Several countries appeared reluctant to heed a call from U.S. President Donald Trump on March 16, as he urged nations to deploy warships to keep the Strait of Hormuz open.",Hurriyet Daily News,Unknown,News,2026-03-22T06:55:43.896287Z
d6243143b760da1a7b9b4ca58163d8ab,"What is Operation Aspides, the EU naval shield now at the centre of Strait of Hormuz reopening talks",https://economictimes.indiatimes.com/news/international/world-news/what-is-operation-aspides-the-eu-naval-shield-now-at-the-centre-of-strait-of-hormuz-reopening-talks/articleshow/129607663.cms,ET Online,2026-03-16T10:55:53Z,grain exports,"Tensions rise in the global oil arena following Iran's blockade of the Strait of Hormuz. To address this urgent situation, EU ministers are exploring the possibility of broadening Operation Aspides to include the Persian Gulf, initially focused on the Red Sea…",The Times of India,Global,News,2026-03-22T06:55:43.896339Z
b2f91456522b51e076266855e7ccb02e,upc-datasets added to PyPI,https://pypi.org/project/upc-datasets/,,2026-03-16T04:41:40Z,grain exports,Student-facing structured dataset toolkit for the UPC big data course.,Pypi.org,Unknown,News,2026-03-22T06:55:43.896406Z
5502d5dc0dcd42d2ffe601e2cd760b5e,What to know about impact of U.S.-Israel-Iran war on global food security?,https://www.thestar.com.my/news/world/2026/03/16/what-to-know-about-impact-of-us-israel-iran-war-on-global-food-security,Wang Xinfang,2026-03-15T21:38:00Z,grain exports,"CAIRO, March 15 (Xinhua) -- The ongoing conflict between the United States, Israel, and Iran is sending shockwaves across the globe and affecting multiple sectors. Read full story",The Star Online,USA,News,2026-03-22T06:55:43.896426Z
9b24ce2c0eff6b4856aa4fc99031c15a,"Chicken prices soar in India on bird mortality, reduced weight",https://www.thehindubusinessline.com/economy/agri-business/chicken-prices-soar-in-india-on-bird-mortality-reduced-weight/article70766309.ece,V  Sajeev Kumar  & KV Kurmanath,2026-03-20T14:41:56Z,soybean exports,Broiler chicken prices in India soar to ₹270-340/kg due to bird mortality and reduced weights amid rising temperatures.,BusinessLine,India,Market Report,2026-03-22T06:55:44.348902Z
31deab4514996fd7ed1c55bb45b05545,China doesn’t need a trade deal to win. Here’s what CEOs are missing,https://fortune.com/2026/03/19/china-trade-war-ceo-strategy-ram-charan/,Ram Charan,2026-03-19T14:38:51Z,soybean exports,Ram Charan has advised Fortune 500 CEOs for decades. His message after the Paris talks: stop waiting for a diplomatic breakthrough that will never come.,Fortune,China,News,2026-03-22T06:55:44.348929Z
d2893d08442454c8281e8b89fb4532ce,Soybeans Getting an Early Turnaround Tuesday Bounce,https://www.barchart.com/story/news/792337/soybeans-getting-an-early-turnaround-tuesday-bounce,Austin Schroeder,2026-03-17T12:25:35Z,soybean exports,Soybeans are trading with 4 to 7 cent gains so far on Tuesday morning as new crop November us up 12 ½ cents. Futures were down 60 to the 70 cent limit on...,Barchart.com,Unknown,Market Report,2026-03-22T06:55:44.348970Z
d43460321a7decbb8538d6ebee01a88f,Iran war impacts Indian oilmeal exports,https://www.thehindubusinessline.com/economy/agri-business/iran-war-impacts-indian-oilmeal-exports/article70753130.ece,BL Mangaluru Bureau,2026-03-17T09:05:13Z,soybean exports,"Escalating Iran conflict disrupts India's oilmeal exports, causing an 11% decline due to shipping challenges and rising costs.",BusinessLine,India,News,2026-03-22T06:55:44.348990Z
aa0474647e8f35242dd911a2663f46c4,"India oilmeal exports hit by US-Iran conflict, Red Sea disruptions",https://economictimes.indiatimes.com/news/economy/foreign-trade/india-oilmeal-exports-hit-by-us-iran-conflict-red-sea-disruptions/articleshow/129628472.cms,Sutanuka Ghosal,2026-03-17T09:03:44Z,soybean exports,"Escalating US-Iran tensions are disrupting India's oilmeal exports, with significant portions to the Middle East and Europe facing logistics challenges due to Red Sea and Strait of Hormuz instability.  Shipping detours and increased costs are impacting overal…",The Times of India,India,News,2026-03-22T06:55:44.349022Z
9aa1e81853d335d9e80abd6f97865f52,Trump seeks to delay meeting with China's Xi by 'a month or so',https://www.channelnewsasia.com/world/us-president-donald-trump-seeks-delay-meeting-chinese-president-xi-jinping-month-or-so-5997481,,2026-03-16T22:04:50Z,soybean exports,"WASHINGTON: US President Donald Trump on Monday (Mar 16) said he is seeking to delay a highly anticipated trip to China in early April by about a month because of the Iran war.""We've requested that we delay it a month or so,"" Trump told reporters at the White…",CNA,China,Market Report,2026-03-22T06:55:44.349041Z
24c9fadd4286dde779c5d2ecd29f733f,"The blockade in the Strait of Hormuz does not only affect oil: 30% increase in fertilizer prices, concern about food production",https://en.protothema.gr/2026/03/16/the-blockade-in-the-strait-of-hormuz-does-not-only-affect-oil-30-increase-in-fertilizer-prices-concern-about-food-production/,admin,2026-03-16T12:37:00Z,soybean exports,"The Strait is one of the most critical hubs for global fertilizer trade, as around one-third of international seaborne fertilizer shipments pass through this route
The post The blockade in the Strait of Hormuz does not only affect oil: 30% increase in fertili…",Protothema.gr,Global,Market Report,2026-03-22T06:55:44.349089Z
a330b8e96dcf64a50ce64763a398903e,Chinese Steel Output Sinks as Mills Adjust to Weaker Demand,https://financialpost.com/pmn/business-pmn/chinese-steel-output-sinks-as-mills-adjust-to-weaker-demand,Bloomberg News,2026-03-16T03:24:55Z,soybean exports,Chinese steel output fell in the first two months of the year as mills continued to rein in production to counter shrinking demand.,Financial Post,China,News,2026-03-22T06:55:44.349103Z
e8aa2180059fd94d3e8c3776eb704431,"US, China seek to wrap Paris talks on managed trade, agriculture deals for Xi-Trump summit",https://economictimes.indiatimes.com/news/international/world-news/us-china-seek-to-wrap-paris-talks-on-managed-trade-agriculture-deals-for-xi-trump-summit/articleshow/129598484.cms,Reuters,2026-03-16T01:17:55Z,soybean exports,"Top economic officials from the United States and China met in Paris. Discussions focused on agriculture, critical minerals, and managed trade. Potential agreements could be presented to President Trump and President Xi. These talks aim to stabilize the globa…",The Times of India,China,News,2026-03-22T06:55:44.349124Z
6ab2debc405c34716af1c93c70f3c9cc,"U.S., China economic chiefs meet in Paris to clear path to Trump-Xi summit",https://japantoday.com/category/world/us-china-economic-chiefs-meet-in-paris-to-clear-path-to-trump-xi-summit3,,2026-03-15T21:22:37Z,soybean exports,Top U.S. and Chinese economic officials wrapped up the first of two days of talks in Paris on Sunday to iron out kinks in their trade truce and clear a path for U.S. President Donald Trump's trip to Beijing to meet with Chinese President Xi Jinping at the end…,Japan Today,China,News,2026-03-22T06:55:44.349145Z
1704a6bfa39f893d8492454129c991c3,"U.S., China economic chiefs to meet in Paris to clear path to Trump-Xi summit",https://japantoday.com/category/world/us-china-economic-chiefs-to-meet-in-paris-to-clear-path-to-trump-xi-summit,,2026-03-15T07:19:35Z,soybean exports,Top U.S. and Chinese economic officials are set to launch a new round of talks in Paris on Sunday to iron out kinks in their trade truce and clear a smooth path for U.S. President Donald Trump's trip to Beijing to meet with Chinese President Xi Jinping ‌at th…,Japan Today,China,News,2026-03-22T06:55:44.349165Z
fb108dfdb30a435f282f5acaaa7f4830,"US, China economic chiefs meet in Paris to clear path to Trump-Xi summit",https://www.channelnewsasia.com/world/us-china-economic-talks-donald-trump-xi-jinping-5994216,,2026-03-15T05:00:02Z,soybean exports,"Analysts said that with little time to prepare and Washington's attention focused on the US-Israeli war with Iran, prospects for a major trade breakthrough are limited.",CNA,China,News,2026-03-22T06:55:44.349186Z
542e0dfeda7b57fb215de928c8557caf,"US, China economic chiefs meet in Paris to clear path to Trump-Xi summit",https://economictimes.indiatimes.com/news/international/global-trends/us-china-economic-chiefs-meet-in-paris-to-clear-path-to-trump-xi-summit/articleshow/129583729.cms,Reuters,2026-03-15T01:24:06Z,soybean exports,"U.S. and Chinese economic officials are meeting in Paris to address trade issues ahead of President Trump's Beijing visit. Discussions will focus on tariffs, rare earth minerals, tech exports, and agricultural purchases. Analysts suggest limited breakthrough …",The Times of India,China,News,2026-03-22T06:55:44.349207Z
396be4a3019c85fc888b84700863a74d,What smart people are saying about oil's latest spike to nearly $120 a barrel,https://www.businessinsider.com/oil-price-shock-iran-qatar-lng-gas-smart-people-krugman-2026-3,Theron Mohamed,2026-03-19T15:29:04Z,wheat exports,"After Brent crude surged 11% to levels last seen in 2022, energy gurus warned of more volatility, shipping chaos, pricier food, and economic pain.",Business Insider,Unknown,News,2026-03-22T06:55:44.818698Z
08b6c796912f850e80ac02fb529b1bf0,Domestic Strength Shields India from $114 Oil Shock: PMEAC Chairman S Mahendra Dev,https://www.thehindubusinessline.com/economy/domestic-strength-shields-india-from-114-oil-shock-pmeac-chairman-s-mahendra-dev/article70761656.ece,Prabhudatta  Mishra & Shishir Sinha,2026-03-19T13:44:34Z,wheat exports,"The US-Israel-Iran conflict has yet to significantly drive inflation through energy prices, though it has caused specific disruptions in the LPG supply chain",BusinessLine,India,Market Report,2026-03-22T06:55:44.818719Z
b255f67b48a0c72db13f20b2b41f9732,Iran war has U.S. farmers worried about the cost and availability of fertilizer,https://www.pbs.org/newshour/nation/iran-war-has-u-s-farmers-worried-about-the-cost-and-availability-of-fertilizer,"Jack Dura, Associated Press",2026-03-18T20:03:17Z,wheat exports,Farmers are bracing for effects of the Iran war on fertilizer prices and availability as the spring planting season nears.,PBS,Unknown,Market Report,2026-03-22T06:55:44.818749Z
c21393299a1a122dc22dd9142f2582e9,Meet a third-generation Tennessee farmer paying an extra $100k for fertilizer because of the Iran War,https://fortune.com/2026/03/18/farmers-worry-cost-availability-fertilizer-strait-of-hormuz-iran/,"Jack Dura, The Associated Press",2026-03-18T19:47:43Z,wheat exports,"""The problem is, is we’re so strained financially coming into this issue,"" Todd Littleton said about the 40% price spike.",Fortune,Unknown,News,2026-03-22T06:55:44.818791Z
e451a0de7c85a549c90cc76bbd27fee0,"Iran war has US farmers worried about cost, availability of fertilizer",https://www.bostonherald.com/2026/03/18/iran-us-war-fertilizer/,Associated Press,2026-03-18T15:48:27Z,wheat exports,"Iran war has US farmers worried about cost, availability of fertilizerbostonherald.com",Boston Herald,Unknown,News,2026-03-22T06:55:44.818874Z
3e502df80bfbc9df1e16d6a7e72d06ba,Iran war has US farmers worried about the cost and availability of fertilizer,https://abcnews.com/Business/wireStory/iran-war-us-farmers-worried-cost-availability-fertilizer-131184549,JACK DURA Associated Press,2026-03-18T15:28:34Z,wheat exports,Farmers are bracing for effects of the Iran war on fertilizer prices and availability as the spring planting season nears,Abcnews.com,Unknown,Market Report,2026-03-22T06:55:44.818902Z
219c363dcc91740f9039aea461cdee7f,Not just energy: How the Iran war could trigger a global food crisis,https://www.aljazeera.com/economy/2026/3/18/not-just-energy-how-the-iran-war-could-trigger-a-global-food-crisis,Sarah Shamim,2026-03-18T12:23:34Z,wheat exports,A critical fertiliser shortage threatens global food security amid Iran war.,Al Jazeera English,Global,News,2026-03-22T06:55:44.818930Z
865e7747b73b13bebadf4dc7e0029044,Iran war has US farmers worried about the cost and availability of fertilizer,https://abcnews.com/US/wireStory/iran-war-us-farmers-worried-cost-availability-fertilizer-131172351,JACK DURA Associated Press,2026-03-18T04:50:36Z,wheat exports,Farmers are bracing for effects of the Iran war on fertilizer prices and availability as the spring planting season nears,Abcnews.com,Unknown,Market Report,2026-03-22T06:55:44.818953Z
5d9345fb53d30e048c4f6cc1eae9c7c7,“Fertilizer Shock”: The Closure Of The Strait Of Hormuz Could Cause Widespread Global Food Shortages,http://theeconomiccollapseblog.com/fertilizer-shock-the-closure-of-the-strait-of-hormuz-could-cause-widespread-global-food-shortages/,Michael,2026-03-17T19:45:26Z,wheat exports,"If commercial traffic through the Strait of Hormuz remains paralyzed for months, we will witness a global food crisis on a scale that many experts would have once considered to be unthinkable. Over the past couple of weeks, there has been much written about h…",Theeconomiccollapseblog.com,Global,News,2026-03-22T06:55:44.819035Z
758d91d5679d7c6fc2ddd8aa08c52e8b,"India underreported rice, wheat price support: US, others to WTO",https://economictimes.indiatimes.com/news/economy/foreign-trade/india-underreported-rice-wheat-price-support-us-others-to-wto/articleshow/129625359.cms,Kirtika Suneja,2026-03-17T06:25:19Z,wheat exports,"The WTO landscape is heating up as India encounters objections from the US, Australia, Paraguay, and Ukraine regarding its agricultural support practices. These nations contend that India's reported market price support for rice and wheat is misleadingly low,…",The Times of India,Australia,Market Report,2026-03-22T06:55:44.819098Z
bb489a4f18cdd4ac5077e411559fa05c,All the Ways US Support for Israeli Expansionism Freed Russia’s Hands,https://www.juancole.com/2026/03/support-israeli-expansionism.html,Juan Cole,2026-03-17T05:36:32Z,wheat exports,"Russian leaders are clearly taking delight in the way in which Iran is turning into a quagmire for Washington, gleeful at their significant wins",Juancole.com,Russia,News,2026-03-22T06:55:44.819123Z
3e6e192fa8ef288377c5607d9a0c119b,"Iran war could affect fertilizer sector, impacting Indian agriculture",https://www.thehindubusinessline.com/economy/agri-business/iran-war-could-affect-fertilizer-sector-impacting-indian-agriculture/article70749713.ece,Subramani Ra Mancombu,2026-03-16T11:40:12Z,wheat exports,"The Iran war threatens global fertilizer supplies, impacting India's agriculture sector and potentially raising food security concerns.",BusinessLine,India,News,2026-03-22T06:55:44.819174Z
3713375390db3b09eb4c8ece46d209c1,"Cabinet Secretaries Rule Out Export Restrictions to Curb Gas Prices, Citing Energy Security",https://www.naturalnews.com/2026-03-21-cabinet-secretaries-rule-out-export-restrictions-gas-prices.html,Garrison Vance,2026-03-21T06:00:00Z,fertilizer exports,"Introduction Energy Secretary Chris Wright and Interior Secretary Doug Burgum issued a joint statement on March 19 explicitly denying any plans to restrict U.S. oil and natural gas exports as a tool to curb domestic fuel prices, according to officials [1]. Th…",Naturalnews.com,Unknown,Market Report,2026-03-22T06:55:45.393822Z
dd49f5d9a332f682e529bddf8ff84a49,UN secretary general says he’s cooperating with Trump’s Board of Peace in Gaza but doesn’t want it in Hormuz,https://www.politico.eu/article/un-secretary-general-antonio-guterres-cooperating-donald-trump-board-of-peace-gaza-but-doesnt-want-it-in-hormuz/,Anne McElvoy,2026-03-21T03:00:00Z,fertilizer exports,"In an exclusive interview with POLITICO, António Guterres said the Board is not an effective way to manage crises.",POLITICO.eu,Unknown,Analysis/Opinion,2026-03-22T06:55:45.393872Z
1668c2c2f25e4301a53a563ba30f4f89,We Really Are Facing An “Economic Armageddon” Scenario In The Middle East,http://theeconomiccollapseblog.com/we-really-are-facing-an-economic-armageddon-scenario-in-the-middle-east/,Michael,2026-03-20T20:56:56Z,fertilizer exports,"When this war with Iran erupted, everyone knew that it would have an impact on the global economy. But very few anticipated that it would be this bad. We are facing the worst oil disruption in history, the worst natural gas disruption in history, the worst he…",Theeconomiccollapseblog.com,Global,News,2026-03-22T06:55:45.393926Z
fb343f75c9078df0f6495a0b0af3ddad,Aid Group Warns US-Israeli War on Iran Has Unleashed ‘Triple Emergency’ With Devastating Consequences for Millions,https://www.commondreams.org/news/iran-war-worldwide-consequences,Stephen Prager,2026-03-20T20:53:01Z,fertilizer exports,"The US-Israeli war against Iran has unleashed a ""triple emergency"" that is draining the global humanitarian aid system of resources and putting millions of the world's most vulnerable people at even greater risk, according to a dire warning issued Friday by t…",Common Dreams,Global,News,2026-03-22T06:55:45.393985Z
79db6e93a9a81050df293fb5571b1688,How the Iran war threatens global food supply,https://www.npr.org/2026/03/20/nx-s1-5750812/how-the-iran-war-threatens-global-food-supply,Fatma Tanis,2026-03-20T19:35:21Z,fertilizer exports,About a third of all fertilizer shipped globally passes through the Strait of Hormuz.  Now shipping is all-but stopped through the Strait and this could have repercussions for the global food supply.,NPR,Global,News,2026-03-22T06:55:45.394025Z
f7972ec2deb9528552c93e85f3e2b4aa,"Food rationing, grounded planes: Economists outline how hard countries will be hit due to Iran war - a global recession next?",https://economictimes.indiatimes.com/news/international/us/food-rationing-grounded-planes-economists-outline-how-hard-countries-will-be-hit-due-to-iran-war-a-global-recession-next/articleshow/129705104.cms,Piyush Shukla,2026-03-20T17:38:04Z,fertilizer exports,"Iran war economic crisis global oil shock raises urgent fears of fuel shortages and supply disruptions worldwide. With nearly 20% of oil flowing through the Strait of Hormuz, any blockage could cripple energy markets fast. Oil prices surged past key resistanc…",The Times of India,Global,Market Report,2026-03-22T06:55:45.394073Z
29882809bafa762662b67fee8d413cb4,Iran War Puts Global Energy Markets on the Brink of a Worst-Case Scenario,https://www.wired.com/story/iran-war-puts-global-energy-markets-on-the-brink-of-a-worst-case-scenario/,Molly Taft,2026-03-20T16:20:52Z,fertilizer exports,"“This will be so, so, so, so, so bad,” one analyst says.",Wired,Global,Market Report,2026-03-22T06:55:45.394102Z
35815204a500506f5721e389197fa7ec,Why the Global Oil System Cannot Replace Hormuz Flows,https://oilprice.com/Energy/Energy-General/Why-the-Global-Oil-System-Cannot-Replace-Hormuz-Flows.html,Robert Rapier,2026-03-20T16:00:00Z,fertilizer exports,"As the world braces for a potential “Battle of Hormuz” to reopen the world’s most important energy chokepoint, governments and energy markets are scrambling to answer a daunting question: What happens if the Strait of Hormuz stays closed for weeks or even mon…",OilPrice.com,Global,Market Report,2026-03-22T06:55:45.394144Z
