article_id,title,link,creator,pubdate,category,description,source,country,article_type,scrape_timestamp
2cb23b6ce7ad5d1af1bab714afcee7be,US Supreme Court’s end to Trump’s tariff tantrum boosts India’s hand,https://www.livemint.com/opinion/columns/us-supreme-court-ruling-trump-tariffs-india-trade-impact-global-economy-11771656486603.html,Elizabeth Roche,2026-02-21T10:32:21Z,Strait of Hormuz,The US Supreme Court's blocking of Donald Trump's threat of higher tariffs may allow India to re-examine the terms of the trade deal.,Livemint,India,News,2026-02-27T06:58:21.584436Z
9900d558088405242a15f7c6eb4e6104,US-Iran Showdown: War of Asymmetries. Failures of the Pentagon’s “Shock and Awe” Doctrine?,https://www.globalresearch.ca/us-iran-showdown-war-of-asymmetries-failures-of-the-pentagons-shock-and-awe-doctrine/5916553,Drago Bosnic,2026-02-21T10:19:37Z,Strait of Hormuz,"It’s pretty clear that yet another American attack on Iran is a matter of when, not if. 
It might occur over the weekend or perhaps after Ramadan, which ends in about a month from now.
 If the United States acts …
The post US-Iran Showdown: War of Asymmetries…",Globalresearch.ca,USA,News,2026-02-27T06:58:21.584465Z
188af828d98c370b4f98309081b3c801,US-Iran conflict may spike India’s crude prices and fuel inflation,https://economictimes.indiatimes.com/markets/commodities/news/us-iran-conflict-may-spike-indias-crude-prices-and-fuel-inflation/articleshow/128636049.cms,ET CONTRIBUTORS,2026-02-21T06:31:37Z,Strait of Hormuz,"Rising tensions between the United States and Iran risk disrupting crude flows through the strategic Strait of Hormuz, potentially spiking global benchmarks and raising India’s fuel and inflation pressures. Even limited disruption could widen volatility as im…",The Times of India,India,Market Report,2026-02-27T06:58:21.584488Z
09b27931b9a8ea016ec89f31607876a3,"U.S. Iran Strike Planning in ‘Advanced’ Phase; Decapitation, Regime-Change Options Prepared",https://www.breitbart.com/politics/2026/02/20/u-s-iran-strike-planning-advanced-phase-decapitation-regime-change-options-prepared/,Joshua Klein,2026-02-21T06:10:34Z,Strait of Hormuz,"U.S. military planning for potential strikes on Iran has entered what officials describe as an “advanced” phase, with options reportedly expanding beyond nuclear and missile infrastructure to include targeted decapitation strikes against senior regime figures…",Breitbart News,Unknown,Market Report,2026-02-27T06:58:21.584538Z
bc044d73e01d41d2d585f08f0c025410,Trump loves cheap gas—but a military conflict in Iran could nearly double your price at the pump,https://fortune.com/2026/02/21/trump-cheap-gas-crude-oil-prices-conflict-iran-strait-hormuz-airstrikes/,Jordan Blum,2026-02-21T06:02:00Z,Strait of Hormuz,"As Trump builds the biggest military force since 2003 outside Iran, the U.S. impacts could swing from $2.50 to $5 gasoline.",Fortune,Unknown,News,2026-02-27T06:58:21.584575Z
251d5e9bf21bc13973bdfd5af14c66e0,"US military planning to target individual leaders in Tehran, officials say",https://www.independent.ie/world-news/middle-east/us-military-planning-to-target-individual-leaders-in-tehran-officials-say/a1187693323.html,Phil Stewart and Idrees Ali,2026-02-21T05:30:00Z,Strait of Hormuz,"US military planning on Iran has reached an advanced stage with options including targeting individuals as part of an attack and even pursuing regime change in Tehran, if ordered by president Donald Trump, two US officials told Reuters.",Independent.ie,Unknown,News,2026-02-27T06:58:21.584615Z
c4a6743abd118ddc71edcaeb9a3b692c,"Brent rises late, settles higher and with weekly gain on Iran-US jitters",https://economictimes.indiatimes.com/markets/commodities/news/brent-rises-late-settles-higher-and-with-weekly-gain-on-iran-us-jitters/articleshow/128632820.cms,Reuters,2026-02-21T04:00:05Z,Strait of Hormuz,"Brent crude prices saw a late-day surge due to short-covering as investors reacted to escalating U.S.-Iran tensions over nuclear weapon development. Despite this, both Brent and WTI futures experienced weekly gains, with traders betting on higher prices amids…",The Times of India,Unknown,Market Report,2026-02-27T06:58:21.584658Z
ea9293d9e3728ddd800462212d14c78a,US and Iran slide towards conflict as military buildup eclipses talks,https://economictimes.indiatimes.com/news/defence/us-and-iran-slide-towards-conflict-as-military-buildup-eclipses-talks/articleshow/128631121.cms,Reuters,2026-02-21T02:33:22Z,Strait of Hormuz,"Iran and the United States are rapidly approaching military conflict as diplomatic hopes fade over Tehran's nuclear program. Both sides are entrenched, with Washington escalating military deployments and Israel preparing for potential joint action. Regional o…",The Times of India,USA,News,2026-02-27T06:58:21.584685Z
151e9640992d7a2266d4917aa1a72bef,"As US forces near Iran, what we know so far about the prospects of an attack",https://indianexpress.com/article/explained/explained-global/as-us-forces-near-iran-what-we-know-so-far-about-the-prospects-of-an-attack-10543351/,Rishika Singh,2026-02-21T01:00:40Z,Strait of Hormuz,"What is the scale of the military build-up right now? What has Donald Trump said, and how has Iran responded? What could happen next? We explain.",The Indian Express,Unknown,News,2026-02-27T06:58:21.584717Z
c05344c9ba69b8d3e7c836b4d43f3679,"U.S. Strikes On Iran Could Target Individual Leaders, Officials Say",https://www.huffpost.com/entry/us-iran-target-leaders-report_n_6998f846e4b069f4556f7e62,HuffPost,2026-02-21T00:56:22Z,Strait of Hormuz,The military options are the latest signs that the United States is preparing for a serious conflict with Iran should diplomatic efforts fail.,HuffPost,USA,News,2026-02-27T06:58:21.584738Z
d5eac5a3075a0bcd886bfc018122a21d,"Proposed Saudi-U.S. deal could allow uranium enrichment, arms control experts warn",https://www.pbs.org/newshour/world/proposed-saudi-u-s-deal-could-allow-uranium-enrichment-arms-control-experts-warn,"Jon Gambrell, Associated Press",2026-02-20T21:58:23Z,Strait of Hormuz,"Saudi Arabia could have some form of uranium enrichment within the kingdom under a proposed nuclear deal with the United States, congressional documents and an arms control group suggest, raising proliferation concerns as an atomic standoff between Iran and A…",PBS,USA,News,2026-02-27T06:58:21.584765Z
4d52a50467503fefc305b5f370cdea03,Oil Holds Near Six-Month High,https://www.rigzone.com/news/wire/oil_holds_near_sixmonth_high-20-feb-2026-183040-article/,"Mia Gindis, Jack Wittels",2026-02-20T20:50:35Z,Strait of Hormuz,Geopolitical tensions and falling inventories supported crude.,Rigzone,Unknown,News,2026-02-27T06:58:21.584790Z
56ddd048d0bed1dca7f40fbe60e2e5fe,Here's what we know about the buildup of U.S. military assets in the Middle East,https://www.pbs.org/newshour/world/heres-what-we-know-about-the-buildup-of-u-s-military-assets-in-the-middle-east,"Konstantin Toropin, Associated Press, Ben Finley, Associated Press",2026-02-20T19:12:05Z,Strait of Hormuz,"The Pentagon is sending the largest force of American warships and aircraft to the Middle East in decades, including two aircraft carrier strike groups, as President Donald Trump warns of possible military action against Iran if talks over its nuclear program…",PBS,USA,News,2026-02-27T06:58:21.584819Z
b780973e97b23264922044ece9398c50,A look at the military hardware the US has positioned for potential war with Iran | CNN Politics,https://www.cnn.com/2026/02/20/politics/military-power-buildup-us-iran-intl-vis,"Avery Schmitz, Annette Choi",2026-02-20T17:01:50Z,Strait of Hormuz,"The US military has assembled a massive collection of weapons systems in the Middle East in the midst of ongoing diplomatic negotiations between the US and Iran, flooding ships and aircraft to nearby waters and the constellation of US bases in the region.",CNN,Unknown,News,2026-02-27T06:58:21.584861Z
ca329545a23fc381bdf213abdf8ffd2e,Trump says weighing strike on Iran as Tehran says draft deal coming soon,https://www.hurriyetdailynews.com/trump-says-weighing-strike-on-iran-as-tehran-says-draft-deal-coming-soon-219175,hurriyetdailynews.com,2026-02-20T16:20:03Z,Strait of Hormuz,U.S. President Donald Trump said he was considering a limited strike on Iran after ordering a major naval buildup in the Middle East aimed at heaping pressure on Tehran to cut a deal to curb its nuclear programme.,Hurriyet Daily News,Unknown,News,2026-02-27T06:58:21.584902Z
bcf921c5be0ccea4d962b12bf31b76b0,Trump has given Iran a ten-day ultimatum – but chances of an agreement look slim,https://theconversation.com/trump-has-given-iran-a-ten-day-ultimatum-but-chances-of-an-agreement-look-slim-276125,"Sanam Mahoozi, Research Associate, City St George's, University of London",2026-02-20T16:15:15Z,Strait of Hormuz,The US military buildup in the Middle East is now sufficient for Trump to order military action against Iran at any moment.,The Conversation Africa,Unknown,News,2026-02-27T06:58:21.584939Z
00360a41629bebb94414637ecee7eeef,Trump weighing strike as Iran plans nuclear deal proposal,https://www.rte.ie/news/world/2026/0220/1559577-iran-trump/,RTÉ News,2026-02-20T16:11:46Z,Strait of Hormuz,US President Donald Trump has said he was considering a limited strike on Iran after ordering a major naval build-up in the Middle East aimed at heaping pressure on Tehran to cut a deal to curb its nuclear programme.,RTE,Unknown,News,2026-02-27T06:58:21.584976Z
0592ded69481c8238a5bc32b9298507d,Trump weighs strike on Iran as 15-day nuclear deadline nears,https://punchng.com/trump-weighs-strike-on-iran-as-15-day-nuclear-deadline-nears/,Punch Newspapers,2026-02-20T16:07:10Z,Strait of Hormuz,"President Trump is considering a limited US strike on Iran as a 15-day deadline for a new nuclear deal approaches amid rising tensions in the Middle East.

Read More: https://punchng.com/trump-weighs-strike-on-iran-as-15-day-nuclear-deadline-nears/",The Punch,Unknown,News,2026-02-27T06:58:21.585027Z
2952e9197e037dff4e3f1a6d40aface9,US strikes on Iran could target individual leaders...,https://www.yahoo.com/news/articles/exclusive-us-strikes-iran-could-150650877.html,yahoo news,2026-02-20T16:00:13Z,Strait of Hormuz,"By Phil Stewart and Idrees Ali WASHINGTON, Feb 20 (Reuters) - U.S. military planning on Iran has reached an advanced stage with options including targeting...",Yahoo Entertainment,Unknown,News,2026-02-27T06:58:21.585062Z
df355f6ba248971448af2582914b117c,Trump says he's considering limited military strike against Iran,https://www.cnbc.com/2026/02/20/trump-says-hes-considering-limited-military-strike-against-iran.html,Spencer Kimball,2026-02-20T15:42:36Z,Strait of Hormuz,The oil market's biggest fear is that a conflict between the U.S. and Iran could lead to a prolonged disruption of oil flows through the Strait of Hormuz.,CNBC,Unknown,Market Report,2026-02-27T06:58:21.585115Z
7bcc0e91c7e9d98674bce1455e2c7386,How Iran might be preparing itself for a potential US strike,https://news.sky.com/story/how-iran-might-be-preparing-itself-for-a-potential-us-strike-13510032,"Lydia Morrish and Freya Gibson, OSINT Producers",2026-02-20T15:39:00Z,Strait of Hormuz,"Satellite images analysed by Sky News' Data and Forensics team show Iran has fortified its nuclear and defence facilities, alongside conducting live drills with Russian forces amid rising tensions with the US military.",Sky.com,Russia,News,2026-02-27T06:58:21.585139Z
135e47e56d4d3178b8a6c540e412726c,Trump says weighing strike on Iran as Tehran says draft deal coming soon,https://www.digitaljournal.com/world/trump-says-weighing-strike-on-iran-as-tehran-says-draft-deal-coming-soon/article,AFP,2026-02-20T15:37:20Z,Strait of Hormuz,US President Donald Trump said he was considering a limited strike on Iran after ordering a major naval buildup in the Middle East aimed at heaping pressure on Tehran to cut a deal to curb its nuclear programme. The latest threat came after Iran’s foreign min…,Digital Journal,Unknown,News,2026-02-27T06:58:21.585189Z
1e09132f88d6608a2d26b4fe82bd2249,"US military strikes on Iran could target individual leaders, officials say",https://economictimes.indiatimes.com/news/defence/us-military-strikes-on-iran-could-target-individual-leaders-trump-strait-of-hormuz-middle-east/articleshow/128614204.cms,Reuters,2026-02-20T15:17:37Z,Strait of Hormuz,America's military is preparing for significant action against Iran. Advanced plans include targeting specific individuals and even seeking to change Iran's government. These preparations signal a potential conflict if diplomacy fails. The U.S. has amassed co…,The Times of India,USA,News,2026-02-27T06:58:21.585219Z
aa62feb0270280ed7db9469fd40ea70e,Experts Sees Even Odds of Peace or Conflict With Iran,https://oilprice.com/Geopolitics/Middle-East/Experts-Sees-Even-Odds-of-Peace-or-Conflict-With-Iran.html,RFE/RL staff,2026-02-20T15:00:00Z,Strait of Hormuz,"After US-Iran nuclear talks concluded in Geneva under heavy American pressure on Tehran to curb its nuclear activities, leading Washington experts say the crisis now stands at a tipping point, with the chances of peace or war at ""50-50."" Negotiations ended on…",OilPrice.com,USA,News,2026-02-27T06:58:21.585305Z
36d454fd8f73d6df1c3867c207f2120f,Satellite Images Reveal Iran Hardening Key Nuclear Facilities,https://oilprice.com/Energy/Energy-General/Satellite-Images-Reveal-Iran-Hardening-Key-Nuclear-Facilities.html,Editorial Dept,2026-02-20T14:30:00Z,Strait of Hormuz,"Iran is burying parts of its nuclear infrastructure because it is preparing for a U.S. strike, not an invasion. The U.S. has the ability to hit fixed targets inside Iran instantly, without moving ground forces, so the only plausible military scenario in view …",OilPrice.com,Unknown,Analysis/Opinion,2026-02-27T06:58:21.585345Z
71329a1f87873db55c8ee9e85fafb04d,What is the U.S. doing as Iran talks near? #world,https://alltoc.com/world/what-is-the-u-s-doing-as-iran-talks-near,AllToc,2026-02-25T21:12:01Z,shipping sanctions,"Washington’s Push: Sanctions, Military Posture and Diplomatic Talks The U.S. has signaled a two‑track approach as renewed nuclear talks with Iran near: pressure through sanctions and an increased military presence in the region, alongside diplomatic engagemen…",Alltoc.com,Unknown,News,2026-02-27T06:58:22.040358Z
0d635450733fd5e2a73b7eb5ffc172fb,Mary Robinson says Trump administration bullying other countries 'like we've never seen before',https://www.thejournal.ie/mary-robinson-trump-3-6967530-Feb2026/,Hugo Murphy,2026-02-25T20:00:33Z,shipping sanctions,"Robinson was speaking at the Irish premiere of The Veto, a documentary about the United Nations, at Trinity College.",TheJournal.ie,Unknown,News,2026-02-27T06:58:22.040394Z
82bc94f0184b2ae21b4612246825229a,Daily Press Briefing by the Office of the Spokesperson for the Secretary-General,https://press.un.org/en/2026/db260225.doc.htm,United Nations,2026-02-25T18:55:20Z,shipping sanctions,"The UN Office on Drugs and Crime today released an analysis showing illegal waste flows are causing economic, public health and environmental damage, especially in low-income countries. It found that organized crime groups and corporations are involved in was…",UN News,Unknown,Analysis/Opinion,2026-02-27T06:58:22.040437Z
5058d98c619390b5e90542583658df69,"US hits Iran’s oil exports, UAV and missile programs",https://www.israelnationalnews.com/news/422979,Israel National News,2026-02-25T15:53:00Z,shipping sanctions,"US Treasury blacklists vessels, firms, and individuals tied to Iranian oil sales, missile production, UAV proliferation, and procurement networks.",Israelnationalnews.com,Unknown,News,2026-02-27T06:58:22.040521Z
1f390c58719af471f5cda3048ca44c3d,UK Hits Russian Oil Fleet with Biggest Sanctions in Years,https://www.rigzone.com/news/wire/uk_hits_russian_oil_fleet_with_biggest_sanctions_in_years-25-feb-2026-183063-article/,Alex Wickham,2026-02-25T06:46:43Z,shipping sanctions,"Britain targeted 175 companies in the 2Rivers network, according to a statement from the foreign office.",Rigzone,Russia,News,2026-02-27T06:58:22.040599Z
3c0d07424b1683b998e79a70b87722a2,Trump says US has received 80m barrels of Venezuelan oil; 3rd tanker seized,https://www.aljazeera.com/news/2026/2/25/trump-says-us-has-received-80m-barrels-of-venezuelan-oil-3rd-tanker-seized,Lyndal Rowlands,2026-02-25T06:19:03Z,shipping sanctions,US forces have 'captured' a third oil tanker in the Indian Ocean weeks after it reportedly left Venezuelan waters.,Al Jazeera English,India,Market Report,2026-02-27T06:58:22.040657Z
0684c111491ea8b323c2099e1c17faab,"Show HN: Open-source KYC plugin for Claude – 95min→27min, £85K→£240/year",https://github.com/vyayasan/kyc-analyst,vyayasan,2026-02-24T21:40:06Z,shipping sanctions,"Hi HN,Just launched an open-source compliance plugin for Claude Cowork after seeing fintech teams pay £60K+ for platforms that orchestrate free public data.UK fintech pilot (30 days, 5 analysts):
• 95 minutes → 27 minutes per case
• £85K annual platform cost …",Github.com,Unknown,News,2026-02-27T06:58:22.040796Z
1d1eb3f1a32f4562956e1417aceccd02,UK Targets Russian Oil Fleet With Biggest Sanctions Hit in Years,https://www.insurancejournal.com/news/international/2026/02/24/859349.htm,Admin,2026-02-24T12:43:33Z,shipping sanctions,"The UK government announced new sanctions on Russia’s so-called shadow oil fleet as it ramped up efforts to squeeze energy revenues funding the Kremlin’s war in Ukraine. Britain targeted 175 companies in the 2Rivers network, according to a statement from …",Insurance Journal,Russia,News,2026-02-27T06:58:22.040888Z
c0f183837acf1119b8a1bcf7c469ca52,UK Targets Russian Oil Fleet With Biggest Sanctions Hit in Years,https://gcaptain.com/uk-targets-russian-oil-fleet-with-biggest-sanctions-hit-in-years/,Bloomberg,2026-02-24T12:30:27Z,shipping sanctions,The UK government announced new sanctions on Russia’s so-called shadow oil fleet as it ramped up efforts to squeeze energy revenues funding the Kremlin’s war in Ukraine.,gcaptain.com,Russia,News,2026-02-27T06:58:22.040909Z
45749cb7def2dcb27b1cf4d33fb3af36,UK Targets Russian Oil With Sanctions on ‘2Rivers’ Network,https://financialpost.com/pmn/business-pmn/uk-targets-russian-oil-with-sanctions-on-2rivers-network,Bloomberg News,2026-02-24T09:35:39Z,shipping sanctions,The UK government announced new sanctions on Russia’s so-called shadow oil fleet as it ramped up efforts to squeeze energy revenues funding the Kremlin’s war in Ukraine.,Financial Post,Russia,News,2026-02-27T06:58:22.040934Z
6ee5a498f98bf75aa3b39c3656caec77,Shadow fleet captain said Russians on board were ‘security agents’,https://www.politico.eu/article/shadow-fleet-captain-said-russians-on-board-were-security-agents/,Marion Solletty,2026-02-23T18:31:47Z,shipping sanctions,"The captain of the Boracay, an EU-sanctioned vessel, was in court in Brest on Monday.",POLITICO.eu,Russia,News,2026-02-27T06:58:22.041005Z
d1fa893ae839a4f1b8465783c06a4c40,Energy options after US verdict,https://www.thehindubusinessline.com/opinion/energy-options-after-us-verdict/article70668123.ece,Richa Mishra,2026-02-23T16:03:39Z,shipping sanctions,India can use the space created by the US Supreme Court ruling to diversify oil purchases without capitulating on Russian oil,BusinessLine,India,News,2026-02-27T06:58:22.041067Z
bcb5e89e8a3f734c23deec73a11b9f6e,EU ire as Hungary stalls new Russia sanctions,https://www.rte.ie/news/ukraine/2026/0223/1559919-eu-sanctions/,RTÉ News,2026-02-23T09:39:34Z,shipping sanctions,The EU's top diplomat said she did not expect to get a deal on new Russia sanctions today after Hungary vowed to block them unless Ukraine re-opens a key oil pipeline.,RTE,Russia,News,2026-02-27T06:58:22.041087Z
85564c81cb3bacfd65548b43ae9c2f9d,EU ire as Hungary stalls new Russia sanctions over Ukraine,https://punchng.com/eu-ire-as-hungary-stalls-new-russia-sanctions-over-ukraine/,Punch Newspapers,2026-02-23T08:26:56Z,shipping sanctions,"Hungary vows to block new EU sanctions on Russia, demanding Ukraine reopen the Druzhba oil pipeline. The move creates friction within the 27-nation bloc.

Read More: https://punchng.com/eu-ire-as-hungary-stalls-new-russia-sanctions-over-ukraine/",The Punch,Russia,News,2026-02-27T06:58:22.041117Z
93ddd92cee90e0fd65cd963380aa8e65,"India rebalances crude slate as Saudi gains, Russian flows ease under sanctions pressure",https://economictimes.indiatimes.com/industry/energy/oil-gas/india-rebalances-crude-slate-as-saudi-gains-russian-flows-ease-under-sanctions-pressure/articleshow/128668508.cms,PTI,2026-02-22T06:51:26Z,shipping sanctions,"India’s crude import strategy is shifting towards a gradual rebalancing, with Middle Eastern suppliers, especially Saudi Arabia, regaining market share as Russian imports decline amid sanctions and geopolitical pressures.",The Times of India,India,Market Report,2026-02-27T06:58:22.041207Z
b3a106f3f238ad2afe35ca3571b60e4a,"India rebalances crude slate as Saudi gains, Russian flows ease under sanctions pressure",https://www.thehindubusinessline.com/economy/india-rebalances-crude-slate-as-saudi-gains-russian-flows-ease-under-sanctions-pressure/article70662584.ece,PTI,2026-02-22T06:33:20Z,shipping sanctions,Russian volumes ease amid sanctions pressure; Middle East barrels fill the gap,BusinessLine,India,News,2026-02-27T06:58:22.041225Z
797d08bf7266f2998901084f91a46afe,The Supreme Court just blew up Trump’s foreign policy,https://www.vox.com/politics/479992/supreme-court-foreign-policy-tariffs,Joshua Keating,2026-02-20T21:31:26Z,shipping sanctions,"President Donald Trump’s approach to foreign policy so far has been to speak loudly and carry a big stick. On Friday, the Supreme Court took away his favorite stick. From Cuba, to China, to Greenland, it’s not an exaggeration to say that tariffs are the defau…",Vox,China,News,2026-02-27T06:58:22.041423Z
2ac1a5b90931e2ba4b96b82ed20c8d8b,Denmark Seizes Blacklisted Container Ship Tied to Iran's Shadow Fleet,https://oilprice.com/Geopolitics/International/Denmark-Seizes-Blacklisted-Container-Ship-Tied-to-Irans-Shadow-Fleet.html,OilPrice.com,2026-02-20T20:00:00Z,shipping sanctions,"Denmark detained a container vessel previously blacklisted by Washington under last year's sweeping Iran sanctions on Thursday, amid suspicions it was operating under a false flag. The Nora was seized after authorities determined it was allegedly sailing unde…",OilPrice.com,Unknown,News,2026-02-27T06:58:22.041472Z
4eae0cb3c6b34093453aa39c9d1dbac9,EU members divided on 20th Russia sanctions package – media,https://www.rt.com/russia/632841-eu-russia-sanction-fail/,RT,2026-02-20T18:14:54Z,shipping sanctions,"EU members have failed to approve a 20th sanctions package against Russia, with Greece, Malta, Hungary, and Slovakia objecting Read Full Article at RT.com",RT,Russia,News,2026-02-27T06:58:22.041521Z
f4db80e7528222c1fae0f2dbf98e7a0d,Why is the U.S. building up forces near Iran? #politics,https://alltoc.com/politics/why-is-the-u-s-building-up-forces-near-iran,AllToc,2026-02-20T18:07:50Z,shipping sanctions,"Why American forces are concentrating in the region Senior military movements and public reporting show the United States has positioned a substantial array of ships, aircraft and other assets in and around the Middle East. Officials describe the deployments …",Alltoc.com,USA,Market Report,2026-02-27T06:58:22.041547Z
d8b1f12027ba933fb4b50ae0518d5f8b,Preparing for the Future: The “Umbrella & Rain Prayer” Initiative for Persian (fa_IR) Localization,https://make.wordpress.org/polyglots/2026/02/20/preparing-for-the-future-the-umbrella-rain-prayer-initiative-for-persian-fa_ir-localization/,Afshari,2026-02-20T16:08:39Z,shipping sanctions,"Hello Polyglots Team and the Global WordPress Community, My name is Saeid Afshari, and I am a WordPress developer and PTE (Project Translation Editor) for the Persian (fa_IR) locale. Today, I want to share a unique initiative I’ve been leading, which I call t…",Wordpress.org,Global,News,2026-02-27T06:58:22.041617Z
ebbfec4838f1f9385fb52d5588640fc3,Four Scenarios for a Postwar Iran,http://foreignpolicy.com/2026/02/20/four-scenarios-war-iran-trump/,Marc Lynch,2026-02-20T14:22:05Z,shipping sanctions,Trump wants regime change but not the messy aftermath.,Foreign Policy,Unknown,News,2026-02-27T06:58:22.041691Z
a5247fd2915fc012e11d90670addcd41,"As Russian crude flows to India dwindle, Saudi Arabian shipments likely to hit 6-year high",https://www.thehindubusinessline.com/markets/commodities/as-russian-crude-flows-to-india-dwindle-saudi-arabian-shipments-likely-to-hit-6-year-high/article70655154.ece,Rishi Ranjan Kala,2026-02-20T10:37:40Z,shipping sanctions,"Indian imports of Russian crude decline as Saudi shipments surge, reaching a six-year high amid geopolitical shifts and sanctions.",BusinessLine,India,News,2026-02-27T06:58:22.041866Z
2dc158877816b4ef6354f524ca546b48,A US attack on Iran could send oil prices surging at precarious time for Trump | CNN Business,https://www.cnn.com/2026/02/20/business/iran-us-attack-oil-prices,David Goldman,2026-02-20T10:30:33Z,shipping sanctions,"President Donald Trump is weighing whether the United States should attack Iran, a country that controls both the third-largest proven oil reserves on Earth and one of the world’s most important oil shipping lanes. The consequences for oil prices and American…",CNN,USA,Market Report,2026-02-27T06:58:22.041889Z
