article_id,title,link,creator,pubdate,category,description,source,country,article_type,scrape_timestamp
8b9c12404d67c94ca72066ad7c4bc1eb,Iran Peace Talks Are Shaping Up To Be A Huge Embarrassment For JD Vance,https://www.huffpost.com/entry/vance-iran-peace-negotiations_n_6a341f05e4b04f5fa0c04eba,HuffPost,2026-06-19T18:00:03Z,Strait of Hormuz,"The vice president's neck is on the line if the deal doesn’t work out, Trump joked. And Trump said with a laugh that, if it is a success, he’ll take all the credit.",HuffPost,Unknown,News,2026-06-20T19:39:56.895734Z
d2dde687796273626613fe399338405d,"Iran crude oil flows surge as US naval blockade lifts, with Bitcoin playing an unlikely role",https://cryptobriefing.com/iran-crude-oil-surge-bitcoin-transit-fees/,Editorial Team,2026-06-19T17:58:40Z,Strait of Hormuz,"The lifting of the blockade may stabilize oil prices, but Iran's Bitcoin transit fees highlight crypto's complex role in global trade.
The post Iran crude oil flows surge as US naval blockade lifts, with Bitcoin playing an unlikely role appeared first on Cryp…",Crypto Briefing,Global,Market Report,2026-06-20T19:39:56.895804Z
c086e372aaf2fc82baf816511764f285,Vance: ‘If everything is Jew hatred then nothing is Jew hatred’,https://www.newsnationnow.com/politics/jd-vance-jew-hatred-antisemitism/,Bobby Oler,2026-06-19T17:39:04Z,Strait of Hormuz,Vance equated pro-Israeli allegations of antisemitism to progressives alleging racism.,Newsnationnow.com,Unknown,News,2026-06-20T19:39:56.895867Z
97dba49bb9b953f96a8887901475bf63,‘So Unbelievably Radioactive’: Jonah Goldberg Slams ‘Delusional’ Trump For Alienating US Allies,https://www.mediaite.com/media/news/so-unbelievably-radioactive-jonah-goldberg-slams-delusional-trump-for-alienating-us-allies/,Jennifer Bowers Bahney,2026-06-19T17:37:42Z,Strait of Hormuz,"Jonah Goldberg slammed Donald Trump on CNN's Inside Politics for alienating U.S. allies, like Italy's Prime Minister Georgia Meloni.
The post ‘So Unbelievably Radioactive’: Jonah Goldberg Slams ‘Delusional’ Trump For Alienating US Allies first appeared on Med…",Mediaite,Unknown,News,2026-06-20T19:39:56.895919Z
55529e3ca2e3e57fe504155cc013b23c,Mark Rutte Needs to Stop Talking,https://www.theatlantic.com/international/2026/06/europe-stop-appeasing-trump/687646/,Robert Kagan,2026-06-19T17:16:12Z,Strait of Hormuz,Flattering Trump will get Europe nowhere.,The Atlantic,Unknown,News,2026-06-20T19:39:56.896002Z
ff1085f7dd67894d67cb06e08b023ca3,"US and Iran sign peace deal amid ongoing 2026 war, reopen Strait of Hormuz",https://cryptobriefing.com/us-and-iran-sign-peace-deal-amid-ongoing-2026-war-reopen-strait-of-hormuz/,Estefano Gomez,2026-06-19T17:16:00Z,Strait of Hormuz,"The peace deal may stabilize global oil markets but unresolved issues could still impact regional stability and future US-Iran relations.
The post US and Iran sign peace deal amid ongoing 2026 war, reopen Strait of Hormuz appeared first on Crypto Briefing.",Crypto Briefing,Global,Market Report,2026-06-20T19:39:56.896038Z
c4d725cf6b18d1e096eb0f0ce2700c06,Oil prices face fresh wave of volatility amid conflicting reports about Strait of Hormuz reopening and ongoing regional strife,https://biztoc.com/x/413ef832a02e1ddd,marketwatch.com,2026-06-19T17:14:31Z,Strait of Hormuz,A flurry of headlines on Friday point to an increasingly fragile deal between the U.S. and Iran.,Biztoc.com,Unknown,Market Report,2026-06-20T19:39:56.896068Z
37710af9ecc8e150eebd5d2aa1c3c600,Report: US intelligence warns Netanyahu may sabotage Trump’s Iran deal,https://www.israelnationalnews.com/news/428902,Israel National News,2026-06-19T17:13:00Z,Strait of Hormuz,The Washington Post reports that US intelligence officials warn that Prime Minister Netanyahu is poised to derail President Trump's Iran peace accord to ensure his own political survival.,Israelnationalnews.com,Unknown,Market Report,2026-06-20T19:39:56.896107Z
440a18f65d9e0252d9dd28e8e455da82,Oil tops $80 as US-Iran talk cancellation reignites supply fears,https://cryptobriefing.com/oil-tops-80-us-iran-tensions/,Editorial Team,2026-06-19T17:09:11Z,Strait of Hormuz,"Rising oil prices due to geopolitical tensions could reignite inflation fears, impacting global markets and potentially increasing regulatory scrutiny on crypto assets.
The post Oil tops $80 as US-Iran talk cancellation reignites supply fears appeared first o…",Crypto Briefing,Global,Market Report,2026-06-20T19:39:56.896222Z
2c74be0a8b6e0589b255a048c1a41414,Intel surge hints far beyond Apple news,https://www.thestreet.com/investing/stocks/intel-stock-surge-trump-apple-foundry-deal,Opeyemi Babalola,2026-06-19T17:07:00Z,Strait of Hormuz,"Intel jumped roughly 11% on Thursday, June 18, after President Donald Trump posted on Truth Social that Apple agreed to work with Intel to design and manufac...",TheStreet,Unknown,News,2026-06-20T19:39:56.896299Z
828bf4f81f3acf76ca2f791abded110b,"If Iran and Oman Put Tolls on the Strait of Hormuz, They Will Strike It Rich",https://dianeravitch.net/2026/06/19/if-iran-and-oman-put-tolls-on-the-strait-of-hormuz-they-will-strike-it-rich/,dianeravitch,2026-06-19T17:00:00Z,Strait of Hormuz,"Blogger G.F. Brandenburg is upset about Trump’s disastrous deal with Iran. All the sanctions on this rogue state will be lifted, and Iran agreed to keep the Strait of Hormuz open for only 60 days. After 60 days, Iran and Oman will decide about the management …",Dianeravitch.net,Unknown,News,2026-06-20T19:39:56.896398Z
75e82df161f7badca3b5610942a4e311,Barack Obama Claims Trump’s Iran Agreement May Have Left The US ‘Worse Off’ Than Before The War,https://www.mediaite.com/media/news/barack-obama-claims-trumps-iran-agreement-may-have-left-the-us-worse-off-than-before-the-war/,Jennifer Bowers Bahney,2026-06-19T16:56:52Z,Strait of Hormuz,"Former President Barack Obama claimed Friday that the U.S. may be “worse off” now than before President Donald Trump began striking Iran.
The post Barack Obama Claims Trump’s Iran Agreement May Have Left The US ‘Worse Off’ Than Before The War first appeared o…",Mediaite,Unknown,News,2026-06-20T19:39:56.896479Z
71e36cada339410dfc58e541a24c2fcd,US rips ‘preposterous’ claim that UAE — or any other country– has released frozen Iran assets,https://nypost.com/2026/06/19/world-news/us-rips-preposterous-claim-that-any-country-released-iran-assets/,Caitlin Doornbos,2026-06-19T16:53:51Z,Strait of Hormuz,"""The very simple fact is $0 of unfrozen assets have been released by the United States or any other country.''",New York Post,USA,News,2026-06-20T19:39:56.896501Z
d77958f94cb3272c8ab09dae2cc3adb8,Iran Asserts Control Over Hormuz With Rules Paving Way for Tolls - Bloomberg.com,https://slashdot.org/firehose.pl?op=view&amp;id=183995306,feedfeeder,2026-06-19T16:53:28Z,Strait of Hormuz,"Iran Asserts Control Over Hormuz With Rules Paving Way for TollsBloomberg.com Oil tanker traffic in Strait of Hormuz jumps after U.S. and Iran implement deal to open sea laneCNBC In a Still Turbulent Strait of Hormuz, Stranded Ships Wait for ClarityThe New Yo…",Slashdot.org,Unknown,News,2026-06-20T19:39:56.896548Z
681d3656a65d92a2a95d3f70ca90f110,Petrol and diesel demand defies May price hikes,https://www.thehindubusinessline.com/data-stories/data-focus/petrol-and-diesel-demand-defies-may-price-hikes/article71122146.ece,Deepac  Nishanth & Sourashis Banerjee,2026-06-19T16:39:01Z,Strait of Hormuz,"Despite rising petrol and diesel prices in May, fuel demand in India shows resilient growth year-on-year and month-on-month.",BusinessLine,India,Market Report,2026-06-20T19:39:56.896594Z
bf61586499949119a64532f530e56fd2,Iran Floats ‘Insurance Fees’ and Asserts Control Over Hormuz,https://financialpost.com/pmn/business-pmn/iran-floats-insurance-fees-and-asserts-control-over-hormuz,Bloomberg News,2026-06-19T16:36:23Z,Strait of Hormuz,"Iran sought to assert control over Strait of Hormuz by saying that ships need its permission and mandatory insurance in order to cross, even as the US said that 20 ships sailed through overnight via a route it recommends along Oman’s coast.",Financial Post,Unknown,News,2026-06-20T19:39:56.896642Z
5f9f237103316de8adf462a759dafe2a,Oil tanker traffic in Strait of Hormuz jumps after U.S. and Iran implement deal to open sea lane - CNBC,https://slashdot.org/firehose.pl?op=view&amp;id=183994816,feedfeeder,2026-06-19T16:33:22Z,Strait of Hormuz,"Oil tanker traffic in Strait of Hormuz jumps after U.S. and Iran implement deal to open sea laneCNBC In a Still Turbulent Strait of Hormuz, Stranded Ships Wait for ClarityThe New York Times Oil prices are falling and stocks are up. Traders worry they’ve gone …",Slashdot.org,Unknown,Market Report,2026-06-20T19:39:56.896687Z
af1824c151183ab6ad9cf382fd0d1fab,Kuwait Says Oil Output Could Hit 2 Million Bpd Within a Week,https://oilprice.com/Latest-Energy-News/World-News/Kuwait-Says-Oil-Output-Could-Hit-2-Million-Bpd-Within-a-Week.html,Charles Kennedy,2026-06-19T16:30:00Z,Strait of Hormuz,"Kuwait expects to raise its oil production to 2 million barrels per day (bpd) within a week, up from an average of 573,000 bpd in May, amid the reopening of the Strait of Hormuz. This estimate was given by Sheikh Nawaf Saud Al-Sabah, deputy chairman and CEO o…",OilPrice.com,Unknown,News,2026-06-20T19:39:56.896762Z
f939ee4413ffcebd08eb53bd72519a1d,Global equity funds see weekly inflows hit 19-month high on Iran deal optimism,https://cryptobriefing.com/global-equity-funds-inflows-19-month-high-iran-deal/,Editorial Team,2026-06-19T16:18:57Z,Strait of Hormuz,"The Iran deal's optimism boosts global equity inflows, signaling potential shifts in investment strategies and geopolitical risk perceptions.
The post Global equity funds see weekly inflows hit 19-month high on Iran deal optimism appeared first on Crypto Brie…",Crypto Briefing,Global,Market Report,2026-06-20T19:39:56.896806Z
2dcc09996c513b22ff2faefe651f1e06,Israel–Hezbollah ceasefire becomes first test of Trump Iran framework after talks delay,https://www.foxnews.com/politics/israel-hezbollah-ceasefire-becomes-first-test-trump-iran-framework-after-talks-delay,,2026-06-19T16:16:28Z,Strait of Hormuz,A U.S.-backed ceasefire between Israel and Hezbollah was set to take effect Friday as talks with Iran scheduled for Switzerland were abruptly postponed.,Fox News,Unknown,News,2026-06-20T19:39:56.896848Z
7d873f2d76f05286de2a3206439832e6,U.S. Push To Get Iran Talks Started Hits An Early Bump Due To Intense Fighting In Lebanon,https://www.huffpost.com/entry/iran-us-vance-talks_n_6a3568f4e4b0dfdabcee4b2a,HuffPost,2026-06-19T16:12:19Z,Strait of Hormuz,JD Vance had been prepared to make an overnight flight to meet with his Iranian counterparts at a Swiss mountainside resort.,HuffPost,Unknown,News,2026-06-20T19:39:56.896881Z
c4200f9f0740bca70bf833fe320b0dee,Iran Asserts Control Over the Strait of Hormuz,https://gcaptain.com/iran-asserts-control-over-the-strait-of-hormuz/,Mike Schuler,2026-06-19T16:09:54Z,Strait of Hormuz,"Less than 48 hours after President Donald Trump signed a memorandum of understanding with Iran to end the conflict and restore freedom of navigation through the Strait of Hormuz, Tehran...",gcaptain.com,Unknown,News,2026-06-20T19:39:56.896957Z
8614a87c4d6f4ed7a1274e29a91a53af,Gentlemen's agreement: Did the US cut secret side deals with Iran?,https://economictimes.indiatimes.com/news/international/global-trends/gentlemens-agreement-did-the-us-cut-secret-side-deals-with-iran/articleshow/131862372.cms,ET Online,2026-06-19T16:09:34Z,Strait of Hormuz,"Behind the public 14-point MoU, secret negotiations between the US and Iran are reportedly delving into sensitive nuclear program details. While officials deny 'side deals,' unreleased documents, including potential IAEA inspection letters, hint at deeper und…",The Times of India,Unknown,Market Report,2026-06-20T19:39:56.897002Z
e3c275535add440fbdcd10509f8681fd,Republican Lawmaker Slams ‘Frankly Disgusting’ JD Vance Comments on Israel,https://www.mediaite.com/media/news/republican-lawmaker-slams-frankly-disgusting-jd-vance-comments-on-israel/,Jennifer Bowers Bahney,2026-06-19T16:03:38Z,Strait of Hormuz,"Randy Fine had some choice words for J.D. Vance after his veiled threat for the nation to ""wake up and smell the reality of the situation” with Iran.
The post Republican Lawmaker Slams ‘Frankly Disgusting’ JD Vance Comments on Israel first appeared on Mediait…",Mediaite,Unknown,Analysis/Opinion,2026-06-20T19:39:56.897043Z
df09bf407a813e9e742f5ed9fb6b5ddd,Trump has one chance to save face: Resign now,https://www.salon.com/2026/06/19/trump-has-one-chance-to-save-face-resign-now/,Brian Karem,2026-06-19T16:00:35Z,Strait of Hormuz,"If he wants any shot at a positive legacy, time's up. He needs to cut a deal and walk away",Salon,Unknown,News,2026-06-20T19:39:56.897070Z
588d40d88821335fc066022fbb146307,Oil tanker traffic in Strait of Hormuz jumps after U.S. and Iran implement deal to open sea lane,https://biztoc.com/x/e5bbc0e156b46e9a,cnbc.com,2026-06-19T15:58:57Z,Strait of Hormuz,"At least 20 oil tankers have crossed the Strait of Hormuz since the U.S. and Iran began to reopen the sea lane to commercial ship traffic, according to the trade intelligence firm Kpler.
Tanker transits on Thursday hit the highest level since June 2, the firm…",Biztoc.com,Unknown,News,2026-06-20T19:39:56.897165Z
930336f62cd8bb8ee91a9818948e2665,Oil tanker traffic in Strait of Hormuz jumps after U.S. and Iran implement deal to open sea lane,https://www.cnbc.com/2026/06/19/iran-oil-tanker-traffic-strait-hormuz-gulf-vlcc.html,Spencer Kimball,2026-06-19T15:48:04Z,Strait of Hormuz,The U.S.-Iran deal has raised questions about how the Strait of Hormuz will be governed after the toll-free period ends.,CNBC,Unknown,News,2026-06-20T19:39:56.897197Z
62eea89cba1b47469f34a0633663eb69,Israel continues attacks on Lebanon despite agreeing to ceasefire,https://www.aljazeera.com/news/2026/6/19/israel-continues-attacks-on-lebanon-despite-agreeing-to-ceasefire,Al Jazeera Staff,2026-06-19T15:47:15Z,Strait of Hormuz,At least 47 people killed in Israeli attacks on Lebanon since midnight as US-Iran talks stall.,Al Jazeera English,Unknown,News,2026-06-20T19:39:56.897227Z
238ca5dd17d754689c41ecdae1b339f9,Iran’s New ‘Toll by Insurance’ Raises Stakes in Strait of Hormuz,https://gcaptain.com/irans-new-toll-by-insurance-raises-stakes-in-strait-of-hormuz/,Lori Ann LaRocco,2026-06-19T15:42:58Z,Strait of Hormuz,By Lori Ann LaRocco – The already volatile security picture in the Strait of Hormuz has taken a sharp turn for the worse as Iran moves to assert de facto...,gcaptain.com,Unknown,News,2026-06-20T19:39:56.897302Z
925a69ee77fecf54b795c3362d83a6c0,Energy Sector Faces Long Recovery Despite U.S.-Iran Breakthrough,https://biztoc.com/x/dd7b860f8b7dd5e9,finance.yahoo.com,2026-06-19T15:31:05Z,Strait of Hormuz,"Oil prices fell sharply after the United States and Iran unveiled a framework agreement aimed at ending their conflict and reopening the Strait of Hormuz, with markets quickly pricing in the prospect of renewed energy flows.
However, industry experts caution …",Biztoc.com,USA,Market Report,2026-06-20T19:39:56.897324Z
c3e78e93d8c0f536178807cd772ac88b,Iran Imposes New Insurance Rules For Ships In Strait Of Hormuz,https://biztoc.com/x/858f3672c3731a0c,tippinsights.com,2026-06-19T15:28:10Z,Strait of Hormuz,"Iran has introduced new conditions for vessels passing through the Strait of Hormuz, one of the world’s most important energy shipping routes.
According to a document obtained by CBS News, all ships transiting the strait must carry insurance policies approved…",Biztoc.com,Unknown,News,2026-06-20T19:39:56.897371Z
df8a7bb7b755040234df18e0a8760ebc,"Iran announces Strait of Hormuz to remain closed, despite opening it being one of the key points of the MOU",https://freerepublic.com/focus/f-news/4384524/posts,New York Post,2026-06-19T15:25:32Z,Strait of Hormuz,"WASHINGTON — Iran re-closed the Strait of Hormuz Friday instead of heading to Switzerland for nuclear negotiations, citing Israel’s refusal to pull forces out of southern Lebanon and US forces’ ongoing presence in the region. In a statement read over maritime…",Freerepublic.com,Unknown,News,2026-06-20T19:39:56.897453Z
7c7218b59cc5c2385271796b20d3bdb8,"If Obama Had Done What Trump Just Did on Iran, He’d
Be Crucified",https://newrepublic.com/post/212101/obama-trump-iran-deal-failure,Michael Tomasky,2026-06-19T15:25:16Z,Strait of Hormuz,"When I read history, I often wonder
what it must have felt like to live those events in real time, as I’m sure you
do. Did it seem an ominous moment in June 1914 when Gavrilo Princip shot
Archduke Franz-Ferdinand? If I were a Briton in September 1938, would I…",The New Republic,Unknown,News,2026-06-20T19:39:56.897503Z
4ed51b4de6e459bd3620a146249b9e8a,"US and Iran sign Islamabad Memorandum, reopening Strait of Hormuz",https://cryptobriefing.com/us-and-iran-sign-islamabad-memorandum-reopening-strait-of-hormuz/,Estefano Gomez,2026-06-19T15:16:58Z,Strait of Hormuz,"The Islamabad Memorandum fosters U.S.-Iran diplomacy, potentially easing tensions and impacting global markets through strategic cooperation.
The post US and Iran sign Islamabad Memorandum, reopening Strait of Hormuz appeared first on Crypto Briefing.",Crypto Briefing,Global,Market Report,2026-06-20T19:39:56.897540Z
df3a6170a903d48266d5eaeb70c31312,Trump’s Iran deal: A victory lap before the victory,https://www.aljazeera.com/opinions/2026/6/19/trumps-iran-deal-a-victory-lap-before-the-victory,Adolfo Franco,2026-06-19T15:14:17Z,Strait of Hormuz,"The MOU may pause the war, but it leaves Israel exposed while giving Iran relief before real verification.",Al Jazeera English,Unknown,News,2026-06-20T19:39:56.897577Z
a1b32cc901cabe7e25d22a383aece76e,Iran to seek ‘insurance fees’ for passage through Strait of Hormuz - Financial Times,https://slashdot.org/firehose.pl?op=view&amp;id=183993022,feedfeeder,2026-06-19T15:13:31Z,Strait of Hormuz,"Iran to seek ‘insurance fees’ for passage through Strait of HormuzFinancial Times Oil prices are falling and stocks are up. Traders worry they’ve gone too farCNN After Deal to Reopen Strait of Hormuz, Ships Begin to Move CautiouslyThe New York Times Iran anno…",Slashdot.org,Unknown,Market Report,2026-06-20T19:39:56.897623Z
bd10fece85e68ab9db18b8c08d5e4ec0,Is Trump’s Iran Deal Splitting MAGA? The Mark Levin–Alex Bruesewitz Feud Reveals a Growing Divide,https://gatewayhispanic.com/2026/06/is-trumps-iran-deal-splitting-maga-mark-levin/,Gateway Hispanic,2026-06-19T15:10:27Z,Strait of Hormuz,"The recent public clash between veteran conservative commentator Mark Levin and Alex Bruesewitz, a close adviser to President Donald Trump, has caught many MAGA supporters by surprise on X.
The post Is Trump’s Iran Deal Splitting MAGA? The Mark Levin–Alex Bru…",Gatewayhispanic.com,Unknown,Analysis/Opinion,2026-06-20T19:39:56.897664Z
55c046add40d9a32afa632dffddfbcae,US push to get Iran talks started hits an early bump due to intense fighting in Lebanon,https://economictimes.indiatimes.com/news/international/world-news/us-push-to-get-iran-talks-started-hits-an-early-bump-due-to-intense-fighting-in-lebanon/articleshow/131861686.cms,AP,2026-06-19T15:03:57Z,Strait of Hormuz,High-stakes talks between the US and Iran have stalled as Tehran demands an end to Israeli strikes in Lebanon before negotiations can begin. Vice President Vance's planned trip to Switzerland was postponed amid escalating violence. President Trump expressed c…,The Times of India,Unknown,News,2026-06-20T19:39:56.897715Z
3b8c6ab63d96f5ddaa3edf93072da405,The Don Escapes to Camp David...,https://www.washingtonexaminer.com/news/white-house/4616145/trump-camp-david-pushback-against-iran-deal-grows/,washington examiner,2026-06-19T15:00:23Z,Strait of Hormuz,The Camp David meeting comes as Trump faces growing criticism from some Republicans over his administration’s agreement with Iran.,Washington Examiner,Unknown,News,2026-06-20T19:39:56.897752Z
69c9d85f186747892635134a8cd4b72d,Energy Sector Faces Long Recovery Despite U.S.-Iran Breakthrough,https://investorshub.advfn.com/market-news/article/30815/energy-sector-faces-long-recovery-despite-u-s-iran-breakthrough,Fiona Craig,2026-06-19T14:59:00Z,Strait of Hormuz,"Oil prices fell sharply after the United States and Iran unveiled a framework agreement aimed at ending their conflict and reopening the Strait of Hormuz, wi...",Advfn.com,USA,Market Report,2026-06-20T19:39:56.897770Z
0fc4f799c8ff76c009b7e270eb4286eb,"Shaky Iran-US ceasefire, Ebola cases surge, and the aid sector in crisis mode: The Cheat Sheet",https://www.thenewhumanitarian.org/news/2026/06/19/iran-us-ceasefire-ebola-cases-surge-aid-sector-crisis-cheat-sheet,,2026-06-19T14:55:39Z,Strait of Hormuz,A weekly read to keep you in the loop on humanitarian issues.,The New Humanitarian,Unknown,Market Report,2026-06-20T19:39:56.897797Z
368e164b553cc4eb56fbe7b1d6b7ff15,"Lebanon cease-fire agreed to, US official says after US-Iran talks in Switzerland get scrapped",https://freerepublic.com/focus/f-news/4384516/posts,Reuters via NY Post,2026-06-19T14:55:29Z,Strait of Hormuz,"Israel and Hezbollah agreed to a cease-fire in Lebanon on Friday, a US official said, after an escalation in fighting there jeopardized the chances of an interim agreement on ending the war in Iran turning into a lasting Middle East peace deal. US-Iran talks …",Freerepublic.com,Unknown,News,2026-06-20T19:39:56.897846Z
abdcec730a17fce532e21a83d3813f2c,Trump hit by Iran ultimatum that could destroy just signed peace deal: report,https://www.rawstory.com/trump-iran-2677064827/,Alexander Willis,2026-06-19T14:50:19Z,Strait of Hormuz,"Iran issued the Trump administration a fierce ultimatum that could collapse the tentative peace deal just a day after it was signed, Drop Site News reported
 Friday.The demand was related to Lebanon, which Israel invaded in March and has since killed nearly …",Raw Story,Unknown,Market Report,2026-06-20T19:39:56.897891Z
022fad3db03334e2e9a29b0ee2948c69,"Trump takes aim at critics of US-Iran MOU, says Iran ‘finished’",https://www.aljazeera.com/news/2026/6/19/trump-takes-aim-at-critics-of-us-iran-mou-says-iran-finished,Joseph Stepansky,2026-06-19T14:50:09Z,Strait of Hormuz,Trump says deal amounts to Iran's 'unconditional surrender'; Negotiations thrown into doubt as Vance delays trip.,Al Jazeera English,Unknown,News,2026-06-20T19:39:56.897927Z
92678e94830027550d759919151bb651,"Iran denies closure of Hormuz, IAEA inspection",https://biztoc.com/x/0c843c453f70e1d5,breakingthenews.net,2026-06-19T14:43:17Z,Strait of Hormuz,"Iranian Foreign Ministry Spokesman Esmail Baghaei denied on Friday that the Strait of Hormuz is closed, describing the claim as ""baseless.""Baghaei affirmed that Tehran took necessary measures to ensur...",Biztoc.com,Unknown,News,2026-06-20T19:39:56.897964Z
6281670724bf9234fb3bc28f8d3c5fc6,What Will the End of the Iran-US War Mean for Pakistan?,https://thediplomat.com/2026/06/what-will-the-end-of-the-iran-us-war-mean-for-pakistan/,Umair Jamal,2026-06-19T14:41:00Z,Strait of Hormuz,Pakistanis are hoping that their role in providing Trump with an offramp to end the war will lead to investment flows.,The Diplomat,Unknown,News,2026-06-20T19:39:56.897996Z
2920f9b9dd771a7fa7a2db7b1947bda0,Israel and Hezbollah agree ceasefire as US-Iran deal under strain,https://www.abc.net.au/news/2026-06-20/lebanon-israel-united-states-iran-deal/106821978,,2026-06-19T14:36:32Z,Strait of Hormuz,"Fighting escalated between Israel and Hezbollah in south Lebanon overnight, with reports of more than 18 people killed in Israeli strikes and four Israeli soldiers killed.",ABC News (AU),Unknown,Market Report,2026-06-20T19:39:56.898068Z
1c2d3fffa53d1510807c0f2a5a54af60,Bitcoin taps $63K on Juneteenth as July Fed rate-hike odds near 40%,https://cointelegraph.com/markets/bitcoin-taps-63k-on-juneteenth-as-july-fed-rate-hike-odds-near-40,William Suberg,2026-06-19T14:31:40Z,Strait of Hormuz,Bitcoin price action avoided volatility but failed to bounce from local lows after a hawkish Fed meeting and posturing over Strait of Hormuz control from Iran.,Cointelegraph,Unknown,News,2026-06-20T19:39:56.898100Z
a9acc6308d7ee503da6f25266a902cae,"Trump Delivers Profane Obama Tirade, Critics See The Jealousy",https://hiphopwired.com/3057642/trump-delivers-profane-obama-tirade-critics-see-the-jealousy/,Christopher Smith,2026-06-19T14:31:33Z,Strait of Hormuz,"President Donald Trump isn’t pleased with the growing number of critics who have deemed his deal with Iran to end hostilities as a step backward. When questioned, he took the moment to attack former President Barack Obama with a vulgar tirade.",Hip-Hop Wired,Unknown,News,2026-06-20T19:39:56.898146Z
9543e9dd7d9b5ad997e21568c2d90480,Iran declares the Strait of Hormuz closed again after US lifts blockade { that was quick },https://freerepublic.com/focus/f-news/4384511/posts,NY Post,2026-06-19T14:30:29Z,Strait of Hormuz,"WASHINGTON — Iran re-closed the Strait of Hormuz Friday instead of heading to Switzerland for nuclear negotiations, citing Israel’s refusal to pull forces out of southern Lebanon and US forces’ ongoing presence in the region. In a statement read over maritime…",Freerepublic.com,Unknown,News,2026-06-20T19:39:56.898196Z
69e90488d3549a483f308381c3cb4877,Middle East Tensions Hit Local Rice Balls,https://newsonjapan.com/article/149733.php,News On Japan,2026-06-19T14:30:00Z,Strait of Hormuz,"A rice ball chain based in Yokkaichi, Mie Prefecture, is feeling the effects of turmoil in the Middle East through higher costs and supply shortages for packaging film and other materials essential to selling onigiri. (News On Japan)",Newsonjapan.com,Japan,News,2026-06-20T19:39:56.898221Z
