article_id,title,link,creator,pubdate,category,description,source,country,article_type,scrape_timestamp
5237579b67ffe0e042029966fdbfe07f,CMB.TECH ANNOUNCES Q4 2025 RESULTS ON 26/02/2026,https://www.globenewswire.com/news-release/2026/02/12/3236898/0/en/CMB-TECH-ANNOUNCES-Q4-2025-RESULTS-ON-26-02-2026.html,CMB.TECH,2026-02-12T07:15:00Z,dry bulk shipping,"Antwerp, Feb. 12, 2026 (GLOBE NEWSWIRE) -- CMB.TECH NV (NYSE: CMBT & Euronext: CMBT) (“CMBT”, “CMB.TECH” or “the Company”) will release its fourth quarter 2025 earnings prior to market opening on Thursday 26 February 2026 and will host a conference call at 8 …",GlobeNewswire,Unknown,Market Report,2026-02-14T06:50:00.997986Z
68bd34a37e01bb8cc5010d32d8edc355,Danaos: Mega investments in ships – energy,https://www.naftemporiki.gr/english/2071637/danaos-mega-investments-in-ships-energy/,Γιάννα Βαρδαλαχάκη,2026-02-12T05:31:29Z,dry bulk shipping,"Danaos is further strengthening its footprint in shipping, while expanding its strategy in the energy sector and investing in the Alaska LNG project following an extensive shipbuilding investment program, which…
Danaos: Mega investments in ships – energy - Η …",Naftemporiki.gr,Unknown,News,2026-02-14T06:50:00.998054Z
093434717f09d3acdef739e3611c2dd1,"Mitsotakis–Erdogan and…President Maria, Vourliotis–Panagopoulos and the civil war in PASOK, the porters of Zoe and the blow to the banks",https://en.protothema.gr/2026/02/11/mitsotakis-erdogan-andpresident-maria-vourliotis-panagopoulos-and-the-civil-war-in-pasok-the-porters-of-zoe-and-the-blow-to-the-banks/,Newsroom,2026-02-11T08:54:01Z,dry bulk shipping,"The 10-Year Horizon Plans of Koustas & the Former Deputy Minister Who Left with the Hyundai i10 from the Lottery
The post Mitsotakis–Erdogan and…President Maria, Vourliotis–Panagopoulos and the civil war in PASOK, the porters of Zoe and the blow to the banks …",Protothema.gr,Unknown,News,2026-02-14T06:50:00.998112Z
98eed17e2ab8b9aecc58a9294b055e53,Pioneer Marine receives bulk carrier “Arctic Bay”,https://www.naftemporiki.gr/english/2071124/pioneer-marine-receives-bulk-carrier-arctic-bay/,Γιάννα Βαρδαλαχάκη,2026-02-11T05:42:57Z,dry bulk shipping,"Pioneer Marine received the 39,000 dwt bulk carrier “Arctic Bay”, which was built in 2015 at Jiangmen Nanyang Shipyards and is a sister ship to the recent additions “Ionian Bay”…
Pioneer Marine receives bulk carrier “Arctic Bay” - Η ΝΑΥΤΕΜΠΟΡΙΚΗ",Naftemporiki.gr,Unknown,News,2026-02-14T06:50:00.998161Z
1fa8e9eb1fd2bb5079186bd7e99447ca,5 EDC Pens That Actually Stay in Your Pocket,https://the-gadgeteer.com/2026/02/10/5-edc-pens-that-actually-stay-in-your-pocket/,Rei Padla,2026-02-11T04:00:34Z,dry bulk shipping,Most EDC enthusiasts can recite the steel composition of their pocket knife but can’t name the pen they’re carrying. They’ll debate lumen output for hours while using whatever promotional pen ended up in their bag after a trade show. That’s backward priority …,The Gadgeteer,Unknown,News,2026-02-14T06:50:00.998209Z
1b6fdc1fb4a675b2455b5af20191c04c,"The Malesina conspiracy, Alexis’s springtime party and the Karahalios–Kasselakis entanglements, National Bank heading for Allianz, while EFET is asleep",https://en.protothema.gr/2026/02/09/the-malesina-conspiracy-alexiss-springtime-party-and-the-karahalios-kasselakis-entanglements-national-bank-heading-for-allianz-while-efet-is-asleep/,Newsroom,2026-02-09T07:21:35Z,dry bulk shipping,"Papastavrou’s double trip to the US for LNG, the Vertical Corridor and hydrocarbons
The post The Malesina conspiracy, Alexis’s springtime party and the Karahalios–Kasselakis entanglements, National Bank heading for Allianz, while EFET is asleep appeared first…",Protothema.gr,Unknown,News,2026-02-14T06:50:00.998268Z
3ca4b1c9a38d696c16d9b7bd640e0d94,CMB.TECH FLEET UPDATE,https://www.globenewswire.com/news-release/2026/02/09/3234258/0/en/CMB-TECH-FLEET-UPDATE.html,CMB.TECH,2026-02-09T07:16:00Z,dry bulk shipping,"Antwerp, Feb. 09, 2026 (GLOBE NEWSWIRE) -- CMB.TECH NV (“CMBT”, “CMB.TECH” or “the Company”) (NYSE: CMBT, Euronext Brussels: CMBT and Euronext Oslo Børs: CMBTO) has sold two vessels, generating a capital gain of approximately 98.2 million USD in total. Eurona…",GlobeNewswire,Norway,News,2026-02-14T06:50:00.998308Z
ab02ec6c91ba3ce2cc55db0d9fe71111,"Indian-American executive honoured by UN agency, Bahrain Chamber for global maritime leadership",https://economictimes.indiatimes.com/industry/transportation/shipping-/-transport/indian-american-executive-honoured-by-un-agency-bahrain-chamber-for-global-maritime-leadership/articleshow/128099941.cms,PTI,2026-02-09T05:56:00Z,dry bulk shipping,"Indian-American maritime executive Dr. SV Anchan received the ACE Global Bridges 2026 Global Maritime Personality For Performance & Leadership Award from a UN agency and Bahrain's Chamber of Commerce. Anchan, a third-generation shipping leader, also made hist…",The Times of India,India,News,2026-02-14T06:50:00.998343Z
ee2c117f2e8037982d3e3e5d1329b748,Hyperbolic localized plasmons and twist-induced chirality in an anisotropic 2D material,https://www.nature.com/articles/s41467-026-69435-8,"Yaolong Li, Xu Shi, Yuxin Zhang, Yen-En Liu, Hong Yang, Guowei Lyu, Yasutaka Matsuo, Xiaoyong Hu, Qihuang Gong, Hiroaki Misawa",2026-02-13T00:00:00Z,bulk carrier,"Here, the authors report the nanofabrication and investigation of arrays of nanostructured MoOCl2 realizing both hyperbolic localized plasmon resonances and chiral optical responses.",Nature.com,Unknown,Market Report,2026-02-14T06:50:01.680397Z
d24176e788799cd74e91c21832e75bde,"The “calm waters” of Mitsotakis–Erdogan and the gift to Pierr, the secret letter of Harilaou Trikoupi, the Vardinogiannis–Kokkalis deal, and the raid by the Capital Market Commission",https://en.protothema.gr/2026/02/12/the-calm-waters-of-mitsotakis-erdogan-and-the-gift-to-pierr-the-secret-letter-of-harilaou-trikoupi-the-vardinogiannis-kokkalis-deal-and-the-raid-by-the-capital-mar/,Newsroom,2026-02-12T07:50:13Z,bulk carrier,"How a 190% return came from Coca-Cola 3E & Angeliki Frangou’s strategic positioning in VLCCs
The post The “calm waters” of Mitsotakis–Erdogan and the gift to Pierr, the secret letter of Harilaou Trikoupi, the Vardinogiannis–Kokkalis deal, and the raid by the …",Protothema.gr,Unknown,Market Report,2026-02-14T06:50:01.680663Z
1a94ba3c3916378b7cfe0e1e99ccdcbb,Phase-controlled molecular beam deposition unlocks flexible MgAgSb thermoelectrics with exceptional performance,https://www.nature.com/articles/s41467-026-69451-8,"Zhao Hu, Airan Li, Naoki Sato, Xinzhi Wu, Longquan Wang, Xinyuan Wang, Takashi Aizawa, Takao Mori",2026-02-12T00:00:00Z,bulk carrier,"This study presents a high-performance flexible thermoelectric film and device based on eco-friendly MgAgSb. Precise phase and composition control enable high power factor and output performance, highlighting its potential for flexible electronics.",Nature.com,Unknown,News,2026-02-14T06:50:01.680710Z
51673a32fc4af4fd083e58ae5b6288a9,Concentrating and directing energy flow in plasmonic heterostructures for stable and efficient light-driven methane dry reforming,https://www.nature.com/articles/s41467-026-69581-z,"Tingting Yin, Haoyang Yuan, Qilin Wang, Zehao Shen, Shuai Yin, Fangmu Wang, Erjun Kan, Wei Jiang, Bo Ouyang, Guigao Liu",2026-02-12T00:00:00Z,bulk carrier,"Methane dry reforming is a promising way to convert greenhouse gases into syngas but suffers from catalyst deactivation and coking. Here, the authors design a plasmonic heterostructure that can concentrate and direct energy flow, enabling stable and efficient…",Nature.com,Unknown,News,2026-02-14T06:50:01.680766Z
a66141bf4334780d72cdb89cfd4a06e2,"Breaking Point: A Million Jobs Suddenly Disappear, Foreclosures Rise 32 Percent, And Some Americans Are Now Facing $1,000 Power Bills",http://theeconomiccollapseblog.com/breaking-point-a-million-jobs-suddenly-disappear-foreclosures-rise-32-percent-and-some-americans-are-now-facing-1000-power-bills/,Michael,2026-02-11T20:49:23Z,bulk carrier,I feel quite exasperated right now. Everyone knows that the economic numbers that federal bureaucrats in Washington are feeding us each month are fraudulent. It has been that way for a very long time. The employment numbers are a perfect example of this. Ever…,Theeconomiccollapseblog.com,USA,News,2026-02-14T06:50:01.680799Z
5f1eab2daadb5d36badb6704cc7d86d5,Polesie/Verity report published,https://www.gov.uk/government/news/polesieverity-report-published,Marine Accident Investigation Branch,2026-02-11T10:00:02Z,bulk carrier,"Collision between a bulk carrier and a general cargo ship in the German Bight traffic separation scheme, resulting in the loss of five lives.",Www.gov.uk,Germany,Market Report,2026-02-14T06:50:01.680826Z
f6016f37ff8f1a52f05d4eedec73520c,Grote Industries asks FMCSA for rear lighting waiver,https://www.overdriveonline.com/regulations/article/15816984/grote-industries-asks-fmcsa-for-rear-lighting-waiver,Overdrive Staff,2026-02-11T09:44:24Z,bulk carrier,Lighting manufacturer Grote has petitioned FMCSA for a waiver to allow sensor-activated flashing rear auxiliary lights. Also: Bulk tanker fleet wants to install brake-activated flashing lights.,Overdriveonline.com,Unknown,News,2026-02-14T06:50:01.680878Z
f78c056e0569a4274cd52a526cb5d33e,A Multi-State Spectroscopic Approach to Carrier Dynamics in Thin-Film Topological Insulators,https://pubs.rsc.org/en/content/articlelanding/2026/tc/d5tc03686k,"Xianting Zhang, Siyao Li, Che-Wei Huang, Jung-Chun Andrew Huang, Chih Wei Luo, Chao-Kuei Lee, Hsiang-Chen Chui",2026-02-11T00:00:00Z,bulk carrier,"J. Mater. Chem. C, 2026, Accepted ManuscriptDOI: 10.1039/D5TC03686K, PaperXianting Zhang, Siyao Li, Che-Wei Huang, Jung-Chun Andrew Huang, Chih Wei Luo, Chao-Kuei Lee, Hsiang-Chen ChuiUnderstanding how to differentiate the dynamics of surface and bulk states …",Royal Society of Chemistry,Unknown,News,2026-02-14T06:50:01.680981Z
9cac3acf25b74abcf8b08ab0aec8774d,MapleTech Introduces Aspire Quick Start,https://www.globenewswire.com/news-release/2026/02/10/3235439/0/en/MapleTech-Introduces-Aspire-Quick-Start.html,Maple Technologies,2026-02-10T14:18:00Z,bulk carrier,Built in wizard streamlines risk intake for motor carrier insurance. Built in wizard streamlines risk intake for motor carrier insurance.,GlobeNewswire,Unknown,News,2026-02-14T06:50:01.681014Z
2b1c1a9eb347a19efe851d0d0516ce2f,"DOT puts 2,000 drivers, trucks out-of-service in 'Operation SafeDRIVE' blitz",https://www.overdriveonline.com/regulations/article/15816651/dot-puts-2000-truckers-outofservice-in-operation-safedrive-blitz,Alex Lockie,2026-02-09T18:21:08Z,bulk carrier,"With nearly 2,000 trucks and drivers placed out-of-service and 56 arrests for things like DUI and illegal presence in the country, DOT's latest enforcement blitz got results.",Overdriveonline.com,Unknown,News,2026-02-14T06:50:01.681050Z
6568f94a1a425e80bd145925b7554713,Iran War Watch: US Moves Towards Attack Footing Despite Questionable Odds of Success,https://www.nakedcapitalism.com/2026/02/iran-war-watch-us-moves-towards-attack-footing-despite-questionable-odds-of-success.html,Yves Smith,2026-02-09T12:50:00Z,bulk carrier,"On the Iran front, the US is taking steps that do not look like mere posturing. Many experts, including ones in Iran, think war is nigh.",Nakedcapitalism.com,Unknown,News,2026-02-14T06:50:01.681083Z
02af5104c1eedb6f71d6146119eb1c96,Shipping Corp shares rocket 14% after Q3 profit balloons 440%. Check details,https://economictimes.indiatimes.com/markets/us-stocks/news/shipping-corp-shares-rocket-14-after-q3-profit-balloons-440-check-details/articleshow/128104100.cms,ETMarkets.com,2026-02-09T07:51:49Z,bulk carrier,"Shipping Corporation of India shares surged up to 14% after the PSU posted a sharp 440% jump in Q3FY26 net profit, driven by strong tanker and bulk carrier performance. Revenue rose over 22%, while the board announced a second interim dividend. The company al…",The Times of India,India,News,2026-02-14T06:50:01.681110Z
e3727a231c5920e623a1b75d7478396c,Enhancing electrical conductivity by defects in metals,https://www.nature.com/articles/s41467-026-69357-5,"Xiaohui Zhang, Ding-Bang Xiong, Yi Zhang, Yufan Zheng, Yazhou Liu, Sujian Gao, Shiyu He, Yongfeng Geng, Meng Zhou, Zan Li, Kang Wang, Ruijuan Qi, Qiangsong Wang, Xiaoguo Song, Xiang-Xi Ye, Di Zhang",2026-02-09T00:00:00Z,bulk carrier,"Giant local stress was formed by introducing heterogeneous interfaces, thus suppressing electron-phonon coupling and reducing electron scattering. Consequently, a bulk electrical conductivity of &gt; 110 % IACS is obtained in copper at room temperature.",Nature.com,Unknown,News,2026-02-14T06:50:01.681150Z
2b1c03a77286e5bd8b0df7069915809d,Age-dependent efficiency of magnetic drug targeting in young and old patient-specific aortic models,https://www.nature.com/articles/s41598-026-39486-4,"Seyed Behzad Hosseini, Wala Almosawy, Rasoul Karimi Takrami, Negar Abdi, Saman Aminian",2026-02-09T00:00:00Z,bulk carrier,Scientific Reports - Age-dependent efficiency of magnetic drug targeting in young and old patient-specific aortic models,Nature.com,Unknown,Market Report,2026-02-14T06:50:01.681181Z
d33a1fd142bec8ccf0debc02a4285f3b,Strain-stabilized interfacial polarization tunes work function over 1 eV in RuO2/TiO2 heterostructures,https://www.nature.com/articles/s41467-026-69200-x,"Seung Gyo Jeong, Bonnie Y. X. Lin, Mengru Jin, In Hyeok Choi, Seungjun Lee, Zhifei Yang, Sreejith Nair, Rashmi Choudhary, Juhi Parikh, Anand Santhosh, Matthew Neurock, Kelsey A. Stoerzinger, Jong Seok Lee, Tony Low, Qing Tu, James M. LeBeau, Bharat Jalan",2026-02-09T00:00:00Z,bulk carrier,"This study shows that strain-stabilized interfacial polarization in metallic RuO2/TiO2 heterostructures modulates the work function by over 1 eV and the metallicity, establishing a new route to control the electronic properties of functional metals.",Nature.com,Unknown,News,2026-02-14T06:50:01.681241Z
7663a9da18fc60daeb79f507cd80522a,A microenvironment-determined risk continuum refines subtyping in meningioma and reveals determinants of machine learning-based tumor classification,https://www.nature.com/articles/s41588-025-02475-w,"Sybren L. N. Maas, Yiheng Tang, Eric Stutheit-Zhao, Ramin Rahmanzade, Christina Blume, Thomas Hielscher, Ferdinand Zettl, Salvatore Benfatto, Domenico Calafato, Martin Sill, Jasim Kada Benotmane, Yahaya A. Yabo, Felix Behling, Abigail Suwala, Helin Kardo, Michael Ritter, Matthieu Peyre, Roman Sankowski, Konstantin Okonechnikov, Philipp Sievers, Areeba Patel, David Reuss, Mirco J. Friedrich, Damian Stichel, Daniel Schrimpf, Thierry P. P. Van den Bosch, Katja Beck, Hans-Georg Wirsching, Gerhard Jungwirth, C. Oliver Hanemann, Katrin Lamszus, Nima Etminan, Andreas Unterberg, Christian Mawrin, Marc Remke, Olivier Ayrault, Peter Lichter, Guido Reifenberger, Michael Platten, Tim Kacprowski, Markus List, Josch K. Pauling, Jan Baumbach, Till Milde, Rachel Grossmann, Zvi Ram, Miriam Ratliff, Jan-Philipp Mallm, Marian C. Neidert, Eelke M. Bos, Marco Prinz, Michael Weller, Till Acker, Felix J. Hartmann, Matthias Preusser, Ghazaleh Tabatabai, Christel Herold-Mende, Sandro M. Krieg, David T. W. Jones, Stefan M. Pfister, Wolfgang Wick, Michel Kalamarides, Andreas von Deimling, Dieter Henrik Heiland, Volker Hovestadt, Moritz Gerstung, Matthias Schlesner, Felix Sahm",2026-02-09T00:00:00Z,bulk carrier,This paper uses multiomics to profile a large cohort of meningioma samples to highlight the role of the tumor microenvironment in driving the epigenetic changes underpinning tumor classification and prediction of outcome.,Nature.com,Unknown,Analysis/Opinion,2026-02-14T06:50:01.681280Z
36050f91d94a315b05e17d3cca7c58bd,"Full transcript of ""Face the Nation with Margaret Brennan,"" Feb. 8, 2026",https://www.cbsnews.com/news/face-the-nation-full-transcript-02-08-2026/,,2026-02-08T18:53:37Z,bulk carrier,"On this ""Face the Nation with Margaret Brennan"" broadcast, Sen. Mark Warner and Rep. Tony Gonzales join Margaret Brennan.",CBS News,Unknown,News,2026-02-14T06:50:01.681312Z
9f7820ae2759bb5ea4b69b960c98ea31,Best D-Ribose Supplements (2026),https://zacjohnson.com/best-d-ribose-supplements/,Zac Johnson,2026-02-07T18:49:35Z,bulk carrier,D-ribose is a naturally occurring sugar molecule that plays a critical role in producing ATP—the primary energy currency of every cell. Supplementing with,Zacjohnson.com,Unknown,News,2026-02-14T06:50:01.681352Z
127c13eb0b62dc5368dcafbc03d09469,I'm certain the pirates in strategy game Menace are laughing at my mistakes,https://www.rockpapershotgun.com/im-certain-the-pirates-in-strategy-game-menace-are-laughing-at-my-mistakes,Julian Benson,2026-02-07T14:30:00Z,bulk carrier,"My Menace campaign hasn't been a rousing success. In my first mission, I failed a string of optional objectives and saw one of my squads gunned down by a group of heavily-armed, jetpack-wearing space pirates. I got revenge by running them over with an APC. So…",Rock Paper Shotgun,Unknown,Market Report,2026-02-14T06:50:01.681395Z
1898a94ce888f7a02182a12d555c4c14,Orbital-resolved tuning of electronic thermal conductivity in monolayer h-B2O via doping in the diffusive regime,https://www.nature.com/articles/s41598-026-38967-w,"Farid Mohammadi, Kavoos Mirabbaszadeh, Houshyar Noshad",2026-02-07T00:00:00Z,bulk carrier,"The highly stable two-dimensional monolayer honeycomb borophene oxide (h-B2O) has attracted considerable interest due to its unique topological features and potential superconducting behavior. In this study, a tight-binding Hamiltonian is constructed by incor…",Nature.com,Unknown,News,2026-02-14T06:50:01.681446Z
374484521625b5f72a91753b742c76db,Global Ship Lease Declares Quarterly Dividend per Common Share for Fourth Quarter of 2025,https://www.globenewswire.com/news-release/2026/02/11/3236678/0/en/Global-Ship-Lease-Declares-Quarterly-Dividend-per-Common-Share-for-Fourth-Quarter-of-2025.html,Global Ship Lease Inc.,2026-02-11T21:15:00Z,panamax,"ATHENS, Greece, Feb. 11, 2026 (GLOBE NEWSWIRE) -- Global Ship Lease, Inc. (NYSE:GSL) (the “Company”), a containership owner and lessor, announced today that the Company’s Board of Directors has declared a dividend of $0.625 per Class A common share for the fo…",GlobeNewswire,Greece,News,2026-02-14T06:50:03.159375Z
2ba1c54761ac09b91a80cbea9a7bd318,"DP World Advances Posorja Berth Expansion, Unlocking 40% More Capacity",https://financialpost.com/globe-newswire/dp-world-advances-posorja-berth-expansion-unlocking-40-more-capacity,GlobeNewswire,2026-02-11T14:02:57Z,panamax,"800-meter quay expansion to lift terminal capacity to 1.4 million TEUs by end-2026, supporting larger vessels and trade growth for Ecuador GUAYAQUIL, Ecuador, Feb. 11, 2026 (GLOBE NEWSWIRE) — DP World is advancing a major berth expansion at the Port of Posorj…",Financial Post,Unknown,News,2026-02-14T06:50:03.159435Z
eb55e11bfff85bb5170e782eaacc6f90,Imperial Petroleum Announces $10 Million Share Repurchase Program,https://www.globenewswire.com/news-release/2026/02/09/3234631/0/en/Imperial-Petroleum-Announces-10-Million-Share-Repurchase-Program.html,Imperial Petroleum Inc.,2026-02-09T14:20:00Z,panamax,"ATHENS, Greece, Feb. 09, 2026 (GLOBE NEWSWIRE) -- Imperial Petroleum Inc. (Nasdaq: IMPP) (the “Company”) today announced that its Board of Directors has approved a share repurchase program and authorized the officers of the Company to repurchase, from time to…",GlobeNewswire,Greece,News,2026-02-14T06:50:03.159478Z
3d584aa60083dc787d888be09b4b9939,A new way to make steel could reduce America’s reliance on imports,https://news.mit.edu/2026/new-way-make-steel-could-reduce-americas-reliance-imports-0213,Zach Winn | MIT News,2026-02-13T05:00:00Z,iron ore,"Hertha Metals, founded by MIT alumna Laureen Meroueh, invented and demonstrated the first single-step steelmaking technology using natural gas and electricity to produce steel and high-purity iron for magnets cost-effectively.",Mit.edu,USA,News,2026-02-14T06:50:04.756039Z
24b9a1ed6c71ec30dc268afd8ef2b844,Friday essay: Australia’s ‘quarry noir’ mines our anxiety about our biggest industry,https://theconversation.com/friday-essay-australias-quarry-noir-mines-our-anxiety-about-our-biggest-industry-239523,"Meg Brayshaw, John Rowe Lecturer in Australian Literature, University of Sydney",2026-02-12T19:09:47Z,iron ore,Mining has driven Australia’s prosperity and way of life. It’s also environmentally and socially destructive. Our mining crime novels explore this tension.,The Conversation Africa,Australia,News,2026-02-14T06:50:04.756286Z
c8986c4209c7e181928e41d2a82511f8,"Metals & Mining Company Database 2026: 16,000+ Companies Including Key Personnel, Mines and Plants Details Across Base Metals, Steel, Coal, Industrial Minerals, and More",https://www.globenewswire.com/news-release/2026/02/12/3237437/28124/en/Metals-amp-Mining-Company-Database-2026-16-000-Companies-Including-Key-Personnel-Mines-and-Plants-Details-Across-Base-Metals-Steel-Coal-Industrial-Minerals-and-More.html,Research and Markets,2026-02-12T16:12:00Z,iron ore,"The Metals & Mining Companies Database offers key market opportunities by providing detailed profiles and rankings of over 16,000 global companies. This data enables strategic insights across base metals, steel, coal, industrial minerals, and more, facilitati…",GlobeNewswire,Global,Analysis/Opinion,2026-02-14T06:50:04.756341Z
608ae77b64a1f38a1139f27b09b8fab8,Polymers from earth can make cement more climate-friendly,https://theconversation.com/polymers-from-earth-can-make-cement-more-climate-friendly-270354,"Alcina Johnson Sudagar, Research Scientist in Chemistry, Washington University in St. Louis",2026-02-12T13:21:49Z,iron ore,"Cement is responsible for about 8% of global greenhouse gas emissions, and demand is growing as the population booms. Alternatives could help lower the impact.",The Conversation Africa,Global,News,2026-02-14T06:50:04.756378Z
d2f330108a1032a388431fc3add86172,Finnvera Group Report of the Board of Directors and Financial Statements 2025,https://www.globenewswire.com/news-release/2026/02/12/3236944/0/en/Finnvera-Group-Report-of-the-Board-of-Directors-and-Financial-Statements-2025.html,Finnvera,2026-02-12T09:15:00Z,iron ore,"Finnvera Group, Stock Exchange Release 12 February 2026  Report of the Board of Directors and Financial Statements 2025  The volume of granted export...",GlobeNewswire,Unknown,Market Report,2026-02-14T06:50:04.756410Z
784677a9aff748be8fc87fb862f8646c,China’s Emissions Fell Last Year in First Decline Since 2022,https://financialpost.com/pmn/business-pmn/chinas-emissions-fell-last-year-in-first-decline-since-2022,Bloomberg News,2026-02-12T00:34:16Z,iron ore,"China’s carbon dioxide emissions fell 0.3% in 2025, the first annual decline since Covid-era restrictions in 2022 — and more importantly, a reduction that’s happened even as energy demand growth remains strong.",Financial Post,China,News,2026-02-14T06:50:04.756432Z
b84bef3e24718df75ba81109de70ea65,Residents 'embarrassed' by WA town as buyback scheme ends,https://www.abc.net.au/news/2026-02-12/port-hedland-buyback-ends-leaving-uncertain-future/106050394,Mietta Adams,2026-02-11T21:32:40Z,iron ore,"As Port Hedland's controversial dust buyback scheme winds up, Pilbara Ports quietly walks away from major plans to build a training facility and accommodation, with development plans for the area still uncertain.",ABC News (AU),Australia,News,2026-02-14T06:50:04.756451Z
60ffaec497d51876a3ca5e5b79c46f96,"Live: Australian dollar rises above 71 US cents, ASX to open flat",https://www.abc.net.au/news/2026-02-12/asx-markets-business-live-news-feb12-2026/106334054,Samuel Yang,2026-02-11T20:45:49Z,iron ore,"Australian stocks are set to open flat after a lacklustre session on Wall Street, with major companies, including Origin Energy, AMP and Temple & Webster, releasing earning results today. Follow the latest updates in our live blog.",ABC News (AU),Australia,News,2026-02-14T06:50:04.756476Z
9ddf3f8e5825005a7590541c2609a124,Bougainville mine that sparked a civil war on rapid path to reopening,https://www.abc.net.au/news/2026-02-12/bougainville-signs-secretive-deal-to-reopen-panguna-mine/106331778,Marian Faa and Theckla Gunga,2026-02-11T18:52:41Z,iron ore,The Autonomous Bougainville Government signs a secretive deal to reopen a huge gold and copper mine that sparked a catastrophic civil war three decades ago.,ABC News (AU),Unknown,News,2026-02-14T06:50:04.756511Z
19b2b85971ab6faf9aeaae41807dcfe4,Designated person notification,https://www.globenewswire.com/news-release/2026/02/11/3236466/0/en/Designated-person-notification.html,ArcelorMittal S.A.,2026-02-11T15:35:00Z,iron ore,"11 February 2026, 16:30 CET  With reference to Article 19(3) of Regulation (EU) No 596/2014 of the European Parliament and of the Council of 16 April 2014...",GlobeNewswire,Unknown,News,2026-02-14T06:50:04.756542Z
c106045b06fc272b172fde19472dedee,Globex Discovers Rare Earth Mineralisation in Nevada,https://www.globenewswire.com/news-release/2026/02/11/3236321/0/en/Globex-Discovers-Rare-Earth-Mineralisation-in-Nevada.html,Entreprises Minières Globex Inc.,2026-02-11T14:00:00Z,iron ore,"TORONTO, Feb. 11, 2026 (GLOBE NEWSWIRE) -- GLOBEX MINING ENTERPRISES INC. (GMX – Toronto Stock Exchange, G1MN – Frankfurt, Stuttgart, Berlin, Munich, Tradegate, Lang & Schwarz, LS Exchange, TTMzero, Düsseldorf and Quotrix Düsseldorf Stock Exchanges and GLBXF …",GlobeNewswire,Unknown,News,2026-02-14T06:50:04.756590Z
