article_id,title,link,creator,pubdate,category,description,source,country,article_type,scrape_timestamp
dcdfcdc4ada03103ba3c3d0dfc0ef0ab,Kate Middleton Expresses Sadness Over Royal Navy Helicopter Crash That Killed Three Crew Members,https://www.ibtimes.com.au/princess-wales-mourns-navy-helicopter-crash-victims-1870076,Jason Taylor,2026-06-04T06:56:10Z,maritime transport,"The Princess of Wales expressed sorrow over a Royal Navy helicopter crash in Devon, which killed three service members. An investigation is underway, with tributes pouring in nationwide.",Ibtimes.com.au,Unknown,News,2026-06-07T13:57:47.040631Z
f19d45b1a1f4af7f067a17495a7499ab,"PM Modi in Gujarat on 5 June: Will inaugurate and lay foundation stone for National Highway Projects worth ₹12,421 crore",https://www.thehindubusinessline.com/news/national/pm-modi-in-gujarat-on-5-june-will-inaugurate-and-lay-foundation-stone-for-national-highway-projects-worth-12421-crore/article71059481.ece,ANI,2026-06-04T03:16:22Z,maritime transport,"PM Modi to inaugurate highway projects worth ₹12,421 crore in Gujarat, enhancing connectivity and boosting regional economic development.",BusinessLine,Unknown,News,2026-06-07T13:57:47.040722Z
f8411fdb9cb7a02bc53c8667d5c9053c,NLNG awards contracts for three new vessels,https://punchng.com/nlng-awards-contracts-for-three-new-vessels/,Punch Newspapers,2026-06-03T23:50:33Z,maritime transport,"NLNG subsidiary, Bonny Gas Transport, awards contracts for three new LNG vessels, enhancing fleet efficiency and sustainability. Discover more about NLNG v

Read More: https://punchng.com/nlng-awards-contracts-for-three-new-vessels/",The Punch,Unknown,News,2026-06-07T13:57:47.040763Z
40a9c6cf9f65b2a738128544785f2f78,Navier and JIH Global Investment to Deploy 100 Boats for Sustainable Transportation in the Maldives,https://www.prnewswire.com/news-releases/navier-and-jih-global-investment-to-deploy-100-boats-for-sustainable-transportation-in-the-maldives-302790511.html,,2026-06-03T16:51:00Z,maritime transport,"With the $100M deal, the Navier Network will connect airports, resorts, villas, and local islands within the Maldives and beyond through standardized fleet of electric hydrofoil vessels The software driven vessels will create a cleaner, quieter, and more scal…",PRNewswire,Global,News,2026-06-07T13:57:47.040820Z
a40f3b6fd87c1b534ba37bb33ac58c46,"Tube usage down by 41% during strike, TfL says",https://www.bbc.com/news/articles/c93x0dwx7gwo,,2026-06-03T16:43:56Z,maritime transport,"Members of the Rail, Maritime and Transport (RMT) Union are due to walk out again on Thursday from 00:01 BST.",BBC News,Unknown,News,2026-06-07T13:57:47.040850Z
ade0e85b113ccf489b07e9e230824c22,Iranians Have 'Become Poor' As War Shatters Already Reeling Economy,https://www.rferl.org/a/iran-economy-us-war-sanctions/33771852.html,"Fereshteh Ghazi, Mohammad Zarghami",2026-06-03T14:43:53Z,maritime transport,Families sharing single meals. Appliances sold to pay utility bills. Businesses gutted. Four Iranians inside the country describe an economy in freefall.,Radio Free Europe/ Radio Liberty,Unknown,News,2026-06-07T13:57:47.040886Z
2a7e758d61bde346cf67d3245f435e17,"Christodoulides from Astana: Kazakhstan’s stance on Cyprus is important, supports our territorial integrity",https://en.protothema.gr/2026/06/03/christodoulides-from-astana-kazakhstans-stance-on-cyprus-is-important-supports-our-territorial-integrity/,admin,2026-06-03T12:10:00Z,maritime transport,"The visit is of particular value because of Kazakhstan's position in Central Asia and its relations with Turkey.
The post Christodoulides from Astana: Kazakhstan’s stance on Cyprus is important, supports our territorial integrity appeared first on ProtoThema …",Protothema.gr,Turkey,News,2026-06-07T13:57:47.040955Z
9f5bf1b22269a5a21b120fdd10f53e20,What happened to Kuwait International Airport? #world,https://alltoc.com/world/what-happened-to-kuwait-international-airport,AllToc,2026-06-03T12:03:26Z,maritime transport,"Kuwait International Airport hit during Iran strike Kuwait said its international airport was struck by an Iranian missile and drone attack, injuring people and damaging airport infrastructure. The incident killed one person and wounded others, and it trigger…",Alltoc.com,Global,News,2026-06-07T13:57:47.041012Z
7ec5cbb0bfe3d6f611a29cae55b949fa,Iranians Have 'Become Poor' As War Shatters Already Reeling Economy,https://www.globalsecurity.org/wmd/library/news/iran/2026/06/iran-260603-rferl01.htm,John Pike,2026-06-03T12:00:00Z,maritime transport,Masud has been forced to sell off his household appliances in order to survive Iran's deepening economic crisis.,Globalsecurity.org,Unknown,News,2026-06-07T13:57:47.041044Z
89af89c37f970bc83db93e794a75aeac,Azerbaijan and Türkiye’s strategic position fuels Middle Corridor dev't – UND,https://www.trend.az/business/4194083.html,Trend.az,2026-06-03T11:05:11Z,maritime transport,"BAKU, Azerbaijan, June 3. The strategic location of Azerbaijan and Türkiye in the region creates significant opportunities for the development of the Middle Corridor and other international logistics…",Trend.az,Global,News,2026-06-07T13:57:47.041097Z
8c63bcac6dfab484610a6613c6e099ea,"UK–Ghana Growth Partnership to Drive Jobs, Investment and Skills",https://www.gov.uk/government/news/uk-ghana-growth-partnership-to-drive-jobs-investment-and-skills,"Foreign, Commonwealth & Development Office",2026-06-03T10:25:19Z,maritime transport,"UK–Ghana Growth Partnership (2026–2028) aims to boost jobs, trade, infrastructure and skills through major investments and private sector–led growth initiatives",Www.gov.uk,Unknown,News,2026-06-07T13:57:47.041142Z
94dd3791b9771cc4cb49290e63212ad9,Decarbonisation (including energy efficiency and alternative fuels) – UK Maritime Innovation Hub,https://www.gov.uk/guidance/decarbonisation-including-energy-efficiency-and-alternative-fuels-uk-maritime-innovation-hub,,2026-06-03T07:54:32Z,maritime transport,"Driving the transition to net zero maritime through evidence-led innovation, while improving performance and reducing operating costs.",Www.gov.uk,Unknown,News,2026-06-07T13:57:47.041186Z
068c8b183bbd7298b9212b8f37809fc6,"Freedom Ship: This mile-long $16 billion floating city will house 80,000 people and even have schools and a 15,000-seat stadium",https://economictimes.indiatimes.com/news/new-updates/freedom-ship-this-mile-long-16-billion-floating-city-will-house-80000-people-and-even-have-schools-and-a-15000-seat-stadium/articleshow/131478865.cms,Trending Desk,2026-06-03T07:37:34Z,maritime transport,"A proposed $16 billion floating city, the Freedom Ship, aims to house 80,000 people as a permanently mobile community circumnavigating the globe. It also plans to have a 15,000-seat stadium, schools, colleges, restaurants, malls and clubs, powered by nuclear …",The Times of India,Unknown,News,2026-06-07T13:57:47.041241Z
72a93f6d31069125433f62eae782de9d,"Iran war: Hostilities flare again, talks at a stalemate",https://economictimes.indiatimes.com/news/defence/iran-war-hostilities-flare-again-talks-at-a-stalemate/articleshow/131473658.cms,Reuters,2026-06-03T00:39:12Z,maritime transport,"With the Gulf region witnessing a surge in missile and drone strikes aimed at Kuwait, diplomatic efforts between Iran and the U.S. hit roadblocks. Israel's ongoing military operations in Lebanon add to the chaos, severely impacting shipping channels and obstr…",The Times of India,Unknown,News,2026-06-07T13:57:47.041308Z
23dee5df7f3118b6376734e2631a4949,India’s Oman Bet Looks Timely As Hormuz Crisis Deepens,https://oilprice.com/Energy/Energy-General/Indias-Oman-Bet-Looks-Timely-As-Hormuz-Crisis-Deepens.html,Alex Kimani,2026-06-02T23:00:00Z,maritime transport,"Late last year, when India and Oman officially signed the Comprehensive Economic Partnership Agreement (CEPA), there was no war with Iran cutting off the Strait of Hormuz, and the advanced timing of this now is turning out to be more fortuitous than initially…",OilPrice.com,India,News,2026-06-07T13:57:47.041337Z
36ea3bacbfd670121174b16334aea676,India’s Oman Bet Looks Timely As Hormuz Crisis Deepens,https://finance.yahoo.com/sectors/energy/articles/india-oman-bet-looks-timely-230000939.html,Alex Kimani,2026-06-02T23:00:00Z,maritime transport,India’s trade agreement with Oman has gained strategic importance amid disruptions in the Strait of Hormuz.,Yahoo Entertainment,India,News,2026-06-07T13:57:47.041357Z
bf9c567529f6b90d3211d6ee98fa242b,"Iran studying deal to halt war, as Trump says talks going on continuously",https://japantoday.com/category/world/iran-studying-deal-to-halt-war-as-trump-says-talks-going-on-continuously,,2026-06-02T21:41:05Z,maritime transport,"Iran is reviewing a proposed agreement with the U.S. to halt their war but has not communicated with Washington for a few days, Iranian media reported on Tuesday, though U.S. President Donald Trump said negotiations had been going on continuously. More than t…",Japan Today,Unknown,Analysis/Opinion,2026-06-07T13:57:47.041401Z
0e202081a53d787d4820b66de48841d0,Rescue operation under way after boat sinks in Carlingford Lough,https://www.irishtimes.com/ireland/2026/06/02/rescue-operation-under-way-after-boat-sinks-in-carlingford-lough/,,2026-06-02T21:02:15Z,maritime transport,One person has been recovered from vessel but search ongoing for second person,The Irish Times,Unknown,News,2026-06-07T13:57:47.041430Z
5a340d5ac243ca883faf6074919bde9e,'Difficult' day for passengers due to Tube strike,https://www.bbc.com/news/articles/clyp444zv1qo,,2026-06-02T17:23:27Z,maritime transport,Transport for London apologises as commuters face another planned walkout on Thursday.,BBC News,UK,News,2026-06-07T13:57:47.041458Z
fb5e62a49777323f0535a1d6ebaccbf1,Hatzidakis visits Open Cosmos Aegean where the Greek Hyperion GR satellites are manufactured,https://en.protothema.gr/2026/06/02/hatzidakis-visits-open-cosmos-aegean-where-the-greek-hyperion-gr-satellites-are-manufactured/,admin,2026-06-02T16:28:28Z,maritime transport,"The satellites being built in Pallini will support critical public interest applications such as natural disaster prevention and response and maritime surveillance
The post Hatzidakis visits Open Cosmos Aegean where the Greek Hyperion GR satellites are manufa…",Protothema.gr,Greece,News,2026-06-07T13:57:47.041511Z
f9e4c1c2982175be3e4a0816a2558f2a,It’s Time To Act Against China’s Maritime Tsunami And Rebuild America’s Shipyards,https://dailycaller.com/2026/06/02/opinion-china-america-us-shipbuilding-rob-maness/,Rob Maness,2026-06-02T16:07:03Z,maritime transport,The numbers do not lie and they are a national security emergency.,The Daily Caller,China,News,2026-06-07T13:57:47.041527Z
209fb6ef121a73617af613363874ec69,Navier Is Rolling Out 100 Electric Foiling Yachts in the Maldives,http://robbreport.com/motors/marine/navier-100-electric-foiling-yachts-maldives-1238276613/,Rachel Cormack,2026-06-02T14:00:00Z,maritime transport,"Navier plans to deploy 100 electric yachts across the Maldives over the next three years, enabling emissions-free travel throughout the archipelago.",Robb Report,Unknown,News,2026-06-07T13:57:47.041608Z
df3e094554d4795e632d927d982cc96d,Development of a Confined-Space Suitability Index (CSSI) using Least Absolute Shrinkage and Selection Operator (LASSO) regression: a pilot study for structured fitness-for-duty screening,https://journals.plos.org/plosone/article?id=10.1371/journal.pone.0350740,"InHo Lee, SangHee Hong, EunChul Jang, JuneHee Lee, JeongBeom Lee",2026-06-02T14:00:00Z,maritime transport,"Background Confined space work exposes workers to complex risks, including oxygen deficiency, hazardous gases, and physical strain, requiring structured criteria for fitness-for-duty screening. This study aimed to develop a Confined-Space Suitability Index (C…",Plos.org,Unknown,Market Report,2026-06-07T13:57:47.041663Z
246b937050782f823d96b9f326eae506,"Uzbekistan, Finland discuss co-op on digital transport and smart mobility",https://www.trend.az/business/it/4193558.html,Trend.az,2026-06-02T12:05:40Z,maritime transport,"BAKU, Azerbaijan, June 2. Uzbekistan’s Minister of Digital Technologies Sherzod Shermatov met with Kimmo Ylisiurunen, Head of the Transport Data Services Cluster at Finland’s Fintraffic, to discuss…",Trend.az,Unknown,News,2026-06-07T13:57:47.041835Z
3f0854d168f536a66d42315a380e7311,Increased transport costs mean less money for the lifesaving supplies children need,https://www.globalsecurity.org/military/library/news/2026/06/mil-260602-unicef01.htm,John Pike,2026-06-02T12:00:00Z,maritime transport,"This is a summary of what was said by the UNICEF Chief of Global Transport and Logistics, Jean-Cedric Meeus - to whom quoted text may be attributed - at today's press briefing at the Palais des Nations in Geneva",Globalsecurity.org,Global,News,2026-06-07T13:57:47.041875Z
f5c45c5134b4652c84a197eba1986476,UKHO reflects on successful participation at IHO Assembly 4,https://www.gov.uk/government/news/ukho-reflects-on-successful-participation-at-iho-assembly-4,UK Hydrographic Office,2026-06-02T10:40:42Z,maritime transport,"The UK Hydrographic Office's participation at the 4th International Hydrographic Organization Assembly (IHO), held in Monaco.",Www.gov.uk,Global,News,2026-06-07T13:57:47.041908Z
d802eeda104cfd4b69a3f9d954b9de82,Denmark’s Fayard Shipyard Remains Last EU Lifeline for Russia’s Yamal LNG Fleet as Sanctions Clock Ticks Down,https://gcaptain.com/denmarks-fayard-shipyard-remains-last-eu-lifeline-for-russias-yamal-lng-fleet-as-sanctions-clock-ticks-down/,Malte Humpert,2026-06-02T09:58:40Z,maritime transport,"The Danish shipyard Fayard is set to remain a critical service hub for Russia’s Arctic LNG trade through at least one more summer, even as European sanctions tighten and other Western shipyards withdraw from the business.",gcaptain.com,Russia,News,2026-06-07T13:57:47.041943Z
5bee17c180d091b446f62ee2aa31241e,Cedar Cove turns construction site as removal plans for grounded ship changes landscape,https://www.cbc.ca/news/canada/newfoundland-labrador/baltic-update-9.7219193,,2026-06-02T08:30:00Z,maritime transport,Dozens of workers are clearing land at a beach on Newfoundland's west coast where a massive cargo vessel ran aground more than a year ago.,CBC News,Unknown,News,2026-06-07T13:57:47.041979Z
5090105b53516446e9dd472dd702189a,Mitsotakis at Posidonia: Greek-owned shipping is a national and European strategic asset,https://www.naftemporiki.gr/english/2118185/mitsotakis-at-posidonia-greek-owned-shipping-is-a-national-and-european-strategic-asset/,Μιχάλης Ματσίγκος,2026-06-02T07:20:03Z,maritime transport,"“The Greek-owned shipping industry is a national and European strategic asset that must be safeguarded, particularly at a time when its strategic and geopolitical importance is being highlighted more clearly…
Mitsotakis at Posidonia: Greek-owned shipping is a…",Naftemporiki.gr,Greece,News,2026-06-07T13:57:47.042081Z
f4ac427ca103b947c75a7895b5a6d015,Tube strike chaos for millions as London Underground workers stage first 24-hour walkout in pouring rain,https://www.dailymail.com/news/article-15866509/Tube-strike-chaos-London-Underground-workers-rain-RMT-TfL.html,Mark Duell,2026-06-02T06:37:11Z,maritime transport,"Members of the Rail, Maritime and Transport union (RMT) walked out today and will strike again on Thursday after last ditch talks failed to resolve a dispute over the working week.",Dailymail.com,UK,News,2026-06-07T13:57:47.042121Z
7997545d6c295a05345a130f530ee4eb,Kikilias: Greece is the leading maritime power in the world,https://www.naftemporiki.gr/english/2118157/kikilias-greece-is-the-leading-maritime-power-in-the-world/,Γιάννα Βαρδαλαχάκη,2026-06-02T06:02:33Z,maritime transport,"Greece is the leading maritime power in the world, Minister of Maritime Affairs and Insular Policy, Vassilis Kikilias, said during his opening address at the 10th Capital Link Maritime Leaders…
Kikilias: Greece is the leading maritime power in the world - Η Ν…",Naftemporiki.gr,Greece,News,2026-06-07T13:57:47.042168Z
8527ed1801df22906adccb28163c0ff8,Chinese Ambassador to Naftemporiki: Piraeus becoming a world-class port; enhancing maritime cooperation,https://www.naftemporiki.gr/english/2118143/chinese-ambassador-to-naftemporiki-piraeus-becoming-a-world-class-port-enhancing-maritime-cooperation/,Αλεξία Σωτηρίου,2026-06-02T05:16:25Z,maritime transport,"Investments in the Port of Piraeus have exceeded 10 billion RMB over the last ten years that the port has been under the exclusive management of COSCO SHIPPING, while the…
Chinese Ambassador to Naftemporiki: Piraeus becoming a world-class port; enhancing mari…",Naftemporiki.gr,China,News,2026-06-07T13:57:47.042191Z
494ed1f1b7dca4d6d7c8889d77f04a44,The Strait of Hormuz: The Supply Chain Loop that broke the World,https://www.juancole.com/2026/06/strait-hormuz-supply.html,The Conversation,2026-06-02T04:04:29Z,maritime transport,"Understanding why the strait stayed open for so long, and why it’s not open now, requires thinkingin terms of loops",Juancole.com,Unknown,News,2026-06-07T13:57:47.042229Z
7a9327185030957cbde1a14396f8a944,"The Next Challenge Facing the US-Philippine Alliance, and How They Plan to Overcome It",https://thediplomat.com/2026/06/the-next-challenge-facing-the-us-philippine-alliance-and-how-they-plan-to-overcome-it/,Aaron-Matthew Lariosa,2026-06-02T02:32:00Z,maritime transport,This year's Balikatan exercise oriented itself more closely than ever to the Taiwan Strait -- and the possibility of a future conflict over the island.,The Diplomat,Unknown,News,2026-06-07T13:57:47.042269Z
38bbbb68622cbd72c9b13a6cb0adf957,YTO Express's Global Aviation Logistics Hub – YTO SKYHUB Launches First International Cargo Route,https://www.globenewswire.com/news-release/2026/06/02/3304815/0/en/YTO-Express-s-Global-Aviation-Logistics-Hub-YTO-SKYHUB-Launches-First-International-Cargo-Route.html,YTO Express,2026-06-02T01:35:00Z,maritime transport,"JIAXING, China, June 01, 2026 (GLOBE NEWSWIRE) -- Shortly after 11:00 on May 28, YTO Airlines flight YG9007 took off from the runway, heading directly to Dhaka, the capital of Bangladesh. This marked the inauguration of the first international cargo route at …",GlobeNewswire,China,News,2026-06-07T13:57:47.042322Z
561d95663b96613a1371bc1a338f4d63,London Tube workers go on two-day strike,https://www.dw.com/en/london-tube-workers-go-on-two-day-strike/a-77382746,Jenipher Camino Gonzalez,2026-06-01T21:42:00Z,maritime transport,"A strike in London's Tube will see the closure of two train lines and partial closure of two others, as the union demands better worker condition for workers.",DW (English),UK,News,2026-06-07T13:57:47.042360Z
3329c6bc067e9cbd63f85a45f148f055,Could Bab Al-Mandeb Be The Next Strait Of Hormuz? Iran Suggests Targeting New Front,https://www.forbes.com/sites/zacharyfolk/2026/06/01/could-bab-al-mandeb-be-the-next-strait-of-hormuz-iran-suggests-targeting-new-front/,"Zachary Folk, Forbes Staff, 
 Zachary Folk, Forbes Staff
 https://www.forbes.com/sites/zacharyfolk/",2026-06-01T17:41:26Z,maritime transport,"Iran has effectively closed the Strait of Hormuz, and shutting down the Bab al-Mandeb Strait could further disrupt oil markets.",Forbes,Unknown,Market Report,2026-06-07T13:57:47.042391Z
e11cf114b27dc66e7283e3fa468541ec,Myanmar pledges its territory won’t be used against India,https://www.rt.com/india/640822-myanmar-india-border-threat/,RT,2026-06-01T16:47:28Z,maritime transport,Meta descriptor: Myanmar pledges not to allow its territory to be used against India’s security interests as Modi and Min Aung Hlaing discuss trade and border issues.,RT,India,News,2026-06-07T13:57:47.042416Z
8ccc2d0bad162a296e84db7682a94c26,"Massport Opens America's First Remote Airport Terminal, Powered by SITA",https://www.prnewswire.com/news-releases/massport-opens-americas-first-remote-airport-terminal-powered-by-sita-302787251.html,,2026-06-01T15:25:00Z,maritime transport,"A new model for airport growth: check in, drop bags, and clear security 20 miles from the runway, on SITA's common-use platform. BOSTON, June 1, 2026 /PRNewswire/ -- Boston Logan passengers on select Delta Air Lines and JetBlue flights can check in, drop thei…",PRNewswire,USA,News,2026-06-07T13:57:47.042446Z
bd116d48c953c692a5ffe496c24e491e,Deterring Russia Beneath the Waves: Securing NATO’s Critical Undersea Infrastructure,https://warontherocks.com/deterring-russia-beneath-the-waves-securing-natos-critical-undersea-infrastructure/,"Samu Paukkunen, James Black",2026-06-01T07:15:28Z,maritime transport,"What would happen if you woke up one morning and the internet was gone — not from a software glitch, but because someone had simply cut the wire?Threats to critical undersea infrastructure are rapidly escalating. In 2023, the Balticonnector pipeline and sever…",War on the Rocks,Russia,News,2026-06-07T13:57:47.042480Z
0268beb7747d37db86f9712683bc5b10,Londoners brace for MORE Tube chaos this week as militant union workers set to walk out in two 24-hour strikes,https://www.dailymail.com/news/article-15863393/Tube-strike-London-Underground-travel-week.html,Mark Duell,2026-06-01T06:57:44Z,maritime transport,"Rail, Maritime and Transport union (RMT) members are planning industrial action for all of tomorrow and again on Thursday, threatening huge disruption to Tube services.",Dailymail.com,UK,News,2026-06-07T13:57:47.042521Z
9e737e43090937c7843ffddd7b02faf3,Project Sapphire: The Secret US Operation To Airlift Soviet Uranium Out Of Kazakhstan,https://www.globalsecurity.org/wmd/library/news/kazakh/2026/kazakh-260606-rferl01.htm,John Pike,2026-06-06T12:00:00Z,cargo shipping,Kazakhstan has offered to host Iran's enriched uranium in order to streamline a potential peace deal between Tehran and Washington. The offer comes more than 30 years after a massive haul of weapons-grade uranium was taken out of the Central Asian country and…,Globalsecurity.org,Unknown,News,2026-06-07T13:57:47.386720Z
d707f87904446cfff5c11740bbf471c5,Project Sapphire: The Secret US Operation To Airlift Soviet Uranium Out Of Kazakhstan,https://www.rferl.org/a/kazakhstan-iran-project-sapphire-enriched-uranium/33773568.html,Amos Chapple,2026-06-06T11:06:22Z,cargo shipping,Kazakhstan has offered to host Iran's enriched uranium in order to streamline a potential peace deal between Tehran and Washington. The offer comes more than 30 years after a massive haul of weapons-grade uranium was taken out of the Central Asian country and…,Radio Free Europe/ Radio Liberty,Unknown,News,2026-06-07T13:57:47.386767Z
d4758c830b3a69a057f61a116b151d4a,ICC Secretary General: The Hormuz clock that matters isn’t diplomatic — it’s agricultural,https://fortune.com/2026/06/06/hormuz-strait-closure-fertilizer-food-crisis-agriculture-john-denton/,John W.H. Denton AO,2026-06-06T07:00:00Z,cargo shipping,"The real clock on the Hormuz closure is agricultural — and by the time the food crisis is visible, the decisions that caused it will be six months old.",Fortune,Unknown,News,2026-06-07T13:57:47.386814Z
c4b673488a91bdbf7b6edbff8332d093,"Andhra Pradesh eyes key role in Arctic shipping and global trade corridors, says Lokesh",https://www.thehindubusinessline.com/economy/logistics/andhra-pradesh-eyes-key-role-in-arctic-shipping-and-global-trade-corridors-says-lokesh/article71068315.ece,PTI,2026-06-06T02:48:52Z,cargo shipping,Nara Lokesh highlighted Andhra Pradesh’s ports and coastline as a gateway to Arctic trade routes and discussed new aluminium investments with RUSAL.,BusinessLine,Global,News,2026-06-07T13:57:47.386859Z
6bb1f05079a799d28ebb4d97afcec412,A Shipwreck 'Almost Beyond Belief' Stunned Archaeologists in Norway With Its Cargo of Intact Porcelain Dishes and Luxury Goods,https://www.smithsonianmag.com/smart-news/a-shipwreck-almost-beyond-belief-stunned-archaeologists-in-norway-with-its-cargo-of-intact-porcelain-dishes-and-luxury-goods-180988910/,Sarah Kuta,2026-06-05T22:07:44Z,cargo shipping,"So far, archaeologists have recovered 40 artifacts from the discovery, an 18th-century shipwreck that likely will yield thousands more treasures",Smithsonian.com,Norway,News,2026-06-07T13:57:47.386935Z
3d3aa0a0be1c55d88dce4e559d8f591d,"US Forces See Nearly 1,000 Hormuz Crossings Since Ceasefire",https://financialpost.com/pmn/business-pmn/us-forces-see-nearly-1000-hormuz-crossings-since-ceasefire,Bloomberg News,2026-06-05T19:57:36Z,cargo shipping,"American forces have counted nearly 1,000 commercial vessel transits in and out of the Strait of Hormuz in the last two months, according to an official familiar with US Central Command operations, a figure that’s higher than private sector estimates that rel…",Financial Post,USA,News,2026-06-07T13:57:47.386966Z
828c6eba887a9ec2b57687aaff3bef33,Scientist explains what really goes down in the Bermuda Triangle — and why so many ships go missing there,https://nypost.com/2026/06/05/science/mystery-of-why-ships-go-missing-in-the-bermuda-triangle-solved/,Ben Cost,2026-06-05T18:49:17Z,cargo shipping,The Bermuda Triangle could be a magnet for disaster.,New York Post,Unknown,News,2026-06-07T13:57:47.387010Z
8a2da31728332d7384d41fe88597c15c,Hurley Men's Activation Cargo Shorts (Bone) $14.96 + Free Store Pick-Up at Nordstrom Rack or FS on $89+,https://slickdeals.net/f/19598295-hurley-men-s-activation-cargo-shorts-bone-14-96-free-store-pick-up-at-nordstrom-rack-or-fs-on-89,itsamazeling,2026-06-05T18:44:50Z,cargo shipping,"Nordstrom Rack [nordstromrack.com] has *Hurley Men's Activation Cargo Shorts (Bone)* for *$14.96*. Select free store pick-up at Nordstrom Rack, otherwise shipping is free on orders $89+",Slickdeals.net,Unknown,News,2026-06-07T13:57:47.387088Z
