article_id,title,link,creator,pubdate,category,description,source,country,article_type,scrape_timestamp
1aeb444ecb4f68225d2b7e6c2682586f,Diana Shipping Inc. Announces Time Charter Contracts for m/v DSI Pollux With Stone Shipping and m/v DSI Andromeda With Western Bulk,https://www.globenewswire.com/news-release/2025/12/04/3199901/10065/en/Diana-Shipping-Inc-Announces-Time-Charter-Contracts-for-m-v-DSI-Pollux-With-Stone-Shipping-and-m-v-DSI-Andromeda-With-Western-Bulk.html,Diana Shipping Inc. c/o Diana Shipping Services S.A.,2025-12-04T14:20:00Z,dry bulk shipping,"ATHENS, Greece, Dec. 04, 2025 (GLOBE NEWSWIRE) -- Diana Shipping Inc. (NYSE: DSX), (the “Company”), a global shipping company specializing in the ownership and bareboat charter-in of dry bulk vessels, today announced that, through a separate wholly-owned subs…",GlobeNewswire,Greece,News,2025-12-05T18:30:26.883488Z
9ff3f6cedcd20770578204931066f890,Star Bulk Carriers Corp. (SBLK): A Bull Case Theory,https://finance.yahoo.com/news/star-bulk-carriers-corp-sblk-135436144.html,Ricardo Pillai,2025-12-04T13:54:36Z,dry bulk shipping,"We came across a bullish thesis on Star Bulk Carriers Corp. on Valueinvestorsclub.com by rosie918. In this article, we will summarize the bulls’ thesis on...",Yahoo Entertainment,Unknown,News,2025-12-05T18:30:26.883593Z
1cf951ab282b6fe70760b5802d6b2023,"Commentary: The super-rich who move for tax, and then move again",https://www.channelnewsasia.com/commentary/switzerland-inheritance-tax-super-rich-residency-law-5531401,,2025-12-03T21:59:00Z,dry bulk shipping,"Swiss referendum on inheritance tax showed how readily some would consider their options for relocation, says Richard Milne for the Financial Times.",CNA,Unknown,Analysis/Opinion,2025-12-05T18:30:26.883651Z
372a44ef3872618b95087fc6604cce21,Nike Tech Fits That Go Harder Than They Should,https://www.dumblittleman.com/nike-tech/,Dumb Little Man,2025-12-03T03:50:06Z,dry bulk shipping,"Let's talk about Nike tech because wow, these looks go way harder than anyone logically expects. The Nike Tech tracksuit is definitely one of the standout fits that go harder than expected. And yes, I said it. Every time I slip into a Nike sportswear tech fle…",Dumblittleman.com,Unknown,News,2025-12-05T18:30:26.883763Z
acd1b5ebae5a06f9825bd6d655ac94b5,"No, you didn't miss out — here are 123 Cyber Monday sales and deals you can still shop",https://www.businessinsider.com/guides/deals/extended-cyber-monday-sales-deals-2025-12,"insider@insider.com (Lillian Brown,Jennifer Gonick)",2025-12-02T22:33:20Z,dry bulk shipping,"Some of the best Cyber Monday deals and sales are still live. We've rounded up discounts from Amazon, Walmart, and other retailers.",Business Insider,Unknown,News,2025-12-05T18:30:26.883838Z
c3ccf98bd92e9a86b4e230ba24b7b977,Pet Food Ingredients Market Size to Exceed USD 72.24 Billion by 2034 | Towards FnB,https://www.globenewswire.com/news-release/2025/12/02/3198244/0/en/Pet-Food-Ingredients-Market-Size-to-Exceed-USD-72-24-Billion-by-2034-Towards-FnB.html,Precedence Research,2025-12-02T16:00:00Z,dry bulk shipping,"According to Towards FnB, the global pet food ingredients market size is evaluated at USD 46.57 billion in 2025 and is anticipated to surge USD 72.24 billion by 2034, reflecting at a CAGR of 5% from 2025 to 2034. According to Towards FnB, the global pet food …",GlobeNewswire,Global,Market Report,2025-12-05T18:30:26.883920Z
15d3005f79cfb67ff3a15d34a1124d91,"Safe Bulkers, Inc. Announces a Ten Million Shares of Common Stock Repurchase Program",https://www.globenewswire.com/news-release/2025/12/01/3197424/0/en/Safe-Bulkers-Inc-Announces-a-Ten-Million-Shares-of-Common-Stock-Repurchase-Program.html,"Safe Bulkers, Inc.",2025-12-01T21:05:00Z,dry bulk shipping,"MONACO, Dec. 01, 2025 (GLOBE NEWSWIRE) -- Safe Bulkers, Inc. (the Company) (NYSE: SB), an international provider of marine drybulk transportation services, announced today that it has authorized a program under which it may from time to time in the future pur…",GlobeNewswire,Global,News,2025-12-05T18:30:26.884009Z
cc188873d843507857ea8357aed7507e,I've covered Cyber Monday for 6 years — these are the 319+ absolute best deals of 2025,https://www.nbcnews.com/select/shopping/best-cyber-monday-deals-live-2025-rcna245873,Zoe Malin,2025-12-01T14:01:06Z,dry bulk shipping,"Cyber Monday deals are live and you have less than 24 hours to save on AirPods, Dyson vacuums, Medicube skin care, Uggs and more.",NBC News,Unknown,News,2025-12-05T18:30:26.884093Z
42c1dea831e3bdd8cda0d9154bc34874,"165 Cyber Monday deals I'd buy, including some discounts lower than Black Friday",https://www.businessinsider.com/guides/deals/best-cyber-monday-deals-2025-b,"insider@insider.com (Brendan Griffiths,Sarah Saril,Steven Cohen)",2025-12-01T10:00:29Z,dry bulk shipping,"Many great deals from Black Friday have carried over, and while some have sold out, others have become even better for Cyber Monday.",Business Insider,Unknown,News,2025-12-05T18:30:26.884158Z
028deada266e8199a8c7b39c64313283,"Once they're gone, they're gone: These are the 293+ absolute best Cyber Monday 2025 deals",https://www.nbcnews.com/select/shopping/best-cyber-monday-deals-sales-2025-rcna245873,Zoe Malin,2025-12-01T07:47:22Z,dry bulk shipping,"Cyber Monday 2025 is your last chance for the year’s best deals. Shop sales from Apple, Amazon, Shark and more before popular products sell out.",NBC News,Unknown,News,2025-12-05T18:30:26.884228Z
f5ca812bdf3d380caa04f5929dee4dd9,"120 early Cyber Monday deals, vetted by expert deal trackers",https://www.businessinsider.com/guides/deals/best-cyber-monday-deals-2025,"insider@insider.com (Brendan Griffiths,Sarah Saril,Steven Cohen)",2025-11-29T17:14:01Z,dry bulk shipping,"Early Cyber Monday deals are already available, and our product experts are keeping track of all the top tech, style, home, and kitchen discounts.",Business Insider,Unknown,News,2025-12-05T18:30:26.884285Z
85f928a8293f95054c681f87fd3dbd4f,"Globus Maritime Limited Reports Financial Results for the Third Quarter and Nine-Month Period Ended September 30, 2025",https://www.globenewswire.com/news-release/2025/11/28/3196455/0/en/Globus-Maritime-Limited-Reports-Financial-Results-for-the-Third-Quarter-and-Nine-Month-Period-Ended-September-30-2025.html,Globus Maritime Limited,2025-11-28T19:00:00Z,dry bulk shipping,"GLYFADA, Greece, Nov. 28, 2025 (GLOBE NEWSWIRE) -- Globus Maritime Limited (“Globus”, the “Company”, “we”, or “our”) (NASDAQ: GLBS), a dry bulk shipping company, today reported its unaudited consolidated financial results for the third quarter and nine-month …",GlobeNewswire,Greece,Market Report,2025-12-05T18:30:26.884356Z
92803d752499baf631b05e607d0880af,Cell Therapy Packaging Market Trends and Companies Data 2025-35,https://www.globenewswire.com/news-release/2025/11/28/3196296/0/en/Cell-Therapy-Packaging-Market-Trends-and-Companies-Data-2025-35.html,Precedence Research,2025-11-28T14:00:00Z,dry bulk shipping,"Based on insights from Towards Packaging, the global cell therapy packaging market will likely grow from USD 419.57 million in 2025 to around USD 1274.31 million by 2034, expanding at a CAGR of 11.75% over the 2025-2034 period. Based on insights from Towards …",GlobeNewswire,Global,Analysis/Opinion,2025-12-05T18:30:26.884422Z
c907b54896f492a269faa9961965c437,Safe Bulkers: Intensive fleet upgrade,https://www.naftemporiki.gr/english/2039643/safe-bulkers-intensive-fleet-upgrade/,Αλεξία Σωτηρίου,2025-11-28T07:56:15Z,dry bulk shipping,"In a period of increased uncertainty for the international dry bulk market, Safe Bulkers manages to maintain a steady pace and operational consistency.
The US-listed shipping company announced its financial…
Safe Bulkers: Intensive fleet upgrade - Η ΝΑΥΤΕΜΠΟΡ…",Naftemporiki.gr,Global,Market Report,2025-12-05T18:30:26.884492Z
936fed59202b5c54a90a922764ea8981,"How all of Alexis’ nightingales got back together (did you miss them?), what M.M. says and what PASOK says with the “Democratic Forces,” Nikitas and the… rose to the flower",https://en.protothema.gr/2025/12/04/how-all-of-alexis-nightingales-got-back-together-did-you-miss-them-what-m-m-says-and-what-pasok-says-with-the-democratic-forces-nikitas-and-the-rose-to-the-fl/,admin,2025-12-04T11:56:16Z,bulk carrier,"///
The post How all of Alexis’ nightingales got back together (did you miss them?), what M.M. says and what PASOK says with the “Democratic Forces,” Nikitas and the… rose to the flower appeared first on ProtoThema English.",Protothema.gr,Unknown,News,2025-12-05T18:30:27.569279Z
482686a705b1ade7f8d5ab7acef40e53,Nutraceutical Excipient Market Size to Exceed USD 9.42 Billion by 2034 | Towards FnB,https://www.globenewswire.com/news-release/2025/12/04/3199586/0/en/Nutraceutical-Excipient-Market-Size-to-Exceed-USD-9-42-Billion-by-2034-Towards-FnB.html,Precedence Research,2025-12-04T11:01:00Z,bulk carrier,"According to Towards FnB, the global nutraceutical excipient market size is evaluated at USD 4.87 billion in 2025 and is anticipated to surge USD 9.42 billion by 2034, expanding at a CAGR of 7.65% from 2025 to 2034. This surge is driven by the rising consumer…",GlobeNewswire,Global,Market Report,2025-12-05T18:30:27.569338Z
37a231272ffe011f43605bb62b14e2df,Will Texas Tech football or BYU win the Big 12 Championship? Our prediction,https://www.lubbockonline.com/story/sports/college/red-raiders/2025/12/04/texas-tech-football-scouting-report-score-prediction-byu-big-12-conference-championship-cfp/87508462007/,Lubbock Avalanche-Journal,2025-12-04T10:04:01Z,bulk carrier,Will Texas Tech football get another win over BYU and win the Big 12 title? Or do the Cougars get revenge? Here's our prediction.,LubbockOnline.com,Unknown,Analysis/Opinion,2025-12-05T18:30:27.569369Z
61a5367aa7a86ff57b737f217a10f79d,Paints and Coatings Market Size to Hit USD 348.04 Bn by 2034,https://www.globenewswire.com/news-release/2025/12/04/3199549/0/en/Paints-and-Coatings-Market-Size-to-Hit-USD-348-04-Bn-by-2034.html,Precedence Research,2025-12-04T09:30:00Z,bulk carrier,"The paints and coatings market size is calculated at USD 222.24 bn in 2025 and is expected to reach USD 348.04 bn by 2034, growing at a CAGR of 5.11%.......",GlobeNewswire,Unknown,Market Report,2025-12-05T18:30:27.569401Z
978e7346eac3eae70c8a7d00a0b30d1f,Greek shipowners choose modern second-hand ships,https://www.naftemporiki.gr/english/2042055/greek-shipowners-choose-modern-second-hand-ships/,Γιάννα Βαρδαλαχάκη,2025-12-04T06:41:52Z,bulk carrier,"Greek shipowners used the opportunities offered by the second-hand market to renew their bulk carrier fleets in 2025.
The limited availability of berths in Asian shipyards, the high cost of…
Greek shipowners choose modern second-hand ships - Η ΝΑΥΤΕΜΠΟΡΙΚΗ",Naftemporiki.gr,Greece,Market Report,2025-12-05T18:30:27.569438Z
d355b816099faa6914cc103f5c21404d,Yemen’s Houthis release 9 mariners held since July ship attack,https://www.aljazeera.com/news/2025/12/3/yemens-houthis-release-9-mariners-held-since-july-ship-attack,Al Jazeera,2025-12-03T17:49:35Z,bulk carrier,The Philippines says it expected nine Filipino mariners held by the Houthis since July attack to be released in Yemen.,Al Jazeera English,Unknown,News,2025-12-05T18:30:27.569475Z
053212d0e4e057d1897af3c99cd1bba3,Trends in North America Automotive Thermoformed Plastic Parts Packaging Market - 2035,https://www.globenewswire.com/news-release/2025/12/03/3199130/0/en/Trends-in-North-America-Automotive-Thermoformed-Plastic-Parts-Packaging-Market-2035.html,Precedence Research,2025-12-03T16:00:00Z,bulk carrier,"As reported by Towards Packaging experts, the global North America automotive thermoformed plastic parts packaging market is anticipated to rise from USD 2.69 billion in 2026 to approximately USD 3.61 billion by 2034, with a CAGR of 3.75% from 2025 to 2034. A…",GlobeNewswire,USA,Market Report,2025-12-05T18:30:27.569498Z
76779af8fb7653dced99d76e50566558,Yemen's Houthis release mariners held since July ship attack,https://abcnews.go.com/International/wireStory/yemens-houthis-release-mariners-held-july-ship-attack-128074034,JON GAMBRELL Associated Press,2025-12-03T15:57:46Z,bulk carrier,Yemen’s Houthi rebels say they have released mariners they have held since an attack in July on the ship Eternity C in the Red Sea,ABC News,Unknown,News,2025-12-05T18:30:27.569537Z
8d31c3d6b046f35ea3addd87a629e472,"IndiGo flight operations disrupted due to crew shortage, tech-related issues, congestion at airports",https://indianexpress.com/article/business/indigo-flight-operations-disrupted-crew-shortage-tech-issues-10400336/,Sukalp Sharma,2025-12-03T12:27:01Z,bulk carrier,The scale of disruption turned worse on Tuesday and Wednesday with widespread delays and dozens of cancellations across the IndiGo network.,The Indian Express,Unknown,News,2025-12-05T18:30:27.569573Z
4e29a0ae865a57134ed434c67135ec99,Noninvasive subterahertz glucose monitoring using a communication inspired eye diagram,https://www.nature.com/articles/s41598-025-30743-6,"Wonkyoung Lee, Eon Sang Kim, Sooyeon Kim, Heuk Park, Joon Ki Lee, Eunkyeong Baek, Chang Hee Jung, Seung-Hyun Cho",2025-12-03T00:00:00Z,bulk carrier,Scientific Reports - Noninvasive subterahertz glucose monitoring using a communication inspired eye diagram,Nature.com,Unknown,Market Report,2025-12-05T18:30:27.569608Z
36c5724218497b0356a5f72039977f2f,MIT researchers demonstrate ship hull modifications to cut fuel use,https://news.mit.edu/2025/mit-researchers-demonstrate-ship-hull-modifications-cut-fuel-use-1202,Lily Keyes | MIT Sea Grant,2025-12-02T19:00:00Z,bulk carrier,"MIT Sea Grant researchers have demonstrated that wedge-shaped vortex generators attached to a ship’s hull can reduce drag by up to 7.5 percent, which reduces overall ship emissions and fuel expenses.",Mit.edu,Unknown,News,2025-12-05T18:30:27.569653Z
420c2909f0f6aaffe90a6b327ad34260,10 changes to look for when the iPhone 18 Pro Max arrives in 2026,https://www.phonearena.com/news/10-changes-to-look-for-when-the-iphone-18-pro-max-arrives-in-2026_id176280,Tsveta Ermenkova,2025-12-02T15:23:15Z,bulk carrier,"From hardware to design tweaks, here’s what early reports say Apple is exploring.",PhoneArena,Unknown,Market Report,2025-12-05T18:30:27.569699Z
37b8025e3a5b4d5c4b0d9e7017aeca0a,Introducing Galaxy Z TriFold: The Shape of What’s Next in Mobile Innovation,https://news.samsung.com/in/introducing-galaxy-z-trifold-the-shape-of-whats-next-in-mobile-innovation,,2025-12-02T04:09:04Z,bulk carrier,"Samsung Electronics today announced the launch of Galaxy Z TriFold, further expanding Samsung’s leadership in new form factors for the mobile AI era. Built on",Samsung.com,Unknown,News,2025-12-05T18:30:27.569743Z
9692d354af9220b528e4132eba4e8f94,Introducing Galaxy Z TriFold: The Shape of What’s Next in Mobile Innovation,https://news.samsung.com/global/introducing-galaxy-z-trifold-the-shape-of-whats-next-in-mobile-innovation,Samsung Newsroom,2025-12-02T01:06:23Z,bulk carrier,"Samsung Electronics today announced the launch of Galaxy Z TriFold, further expanding Samsung’s leadership in new form factors for the mobile AI era. Built on a decade of foldable category innovation, Galaxy Z TriFold showcases engineering mastery with its mo…",Samsung.com,Unknown,News,2025-12-05T18:30:27.569789Z
b458e66de74096acc2a9218b8eed28e4,Specialty Fats And Oils Market Set to Surpass US$ 31.69 Billion By 2033 | Astute Analytica,https://www.globenewswire.com/news-release/2025/12/01/3197271/0/en/Specialty-Fats-And-Oils-Market-Set-to-Surpass-US-31-69-Billion-By-2033-Astute-Analytica.html,AstuteAnalytica India Pvt. Ltd.,2025-12-01T16:30:00Z,bulk carrier,"Manufacturers actively secure supply chains for cocoa butter equivalents to mitigate volatility. Investments in Asian infrastructure and European foodservice expansion define the current landscape, ensuring offline industrial channels effectively meet surging…",GlobeNewswire,Brazil,Market Report,2025-12-05T18:30:27.569811Z
98d21c3c14f16afbe393acd1e79fe050,Europe Glass Prefilled Syringes and Glass Vials Packaging Equipment Market Trends 2035,https://www.globenewswire.com/news-release/2025/12/01/3197244/0/en/Europe-Glass-Prefilled-Syringes-and-Glass-Vials-Packaging-Equipment-Market-Trends-2035.html,Precedence Research,2025-12-01T16:00:00Z,bulk carrier,"As detailed in the latest report by Towards Packaging, the global Europe glass prefilled syringes and glass vials packaging equipment market is forecast to grow from USD 251.64 billion in 2026 to about USD 389.13 billion by 2034, at a CAGR of 5.6% between 202…",GlobeNewswire,Global,Analysis/Opinion,2025-12-05T18:30:27.569851Z
deacfc51bdcc2bc5e18ebf19a506f228,"China's giant shipbuilder CSSC unveils plans for cruise, deep-sea, nuclear-powered vessels",https://finance.yahoo.com/news/chinas-giant-shipbuilder-cssc-unveils-093000890.html,South China Morning Post,2025-12-01T09:30:00Z,bulk carrier,"China State Ship­building Corp (CSSC), the world's largest shipbuilding conglomerate controlling one-third of the global market, has pledged to build more...",Yahoo Entertainment,China,Market Report,2025-12-05T18:30:27.569864Z
d2b2b80cf5618ef707953b18cee2e47a,"Run, don’t crawl: 60+ best Cyber Monday baby deals, per a toddler mom",https://nypost.com/shopping/best-cyber-monday-baby-deals-sales-2025/,Miska Salemann,2025-12-01T09:00:00Z,bulk carrier,Save your tantrum. Cyber Monday baby deals just dropped.,New York Post,Unknown,News,2025-12-05T18:30:27.569896Z
667517b0bca4573875f7c0830ed815d4,"Linux 6.18 release – Main changes, Arm, RISC-V, and MIPS architectures",https://www.cnx-software.com/2025/12/01/linux-6-18-release-main-changes-arm-risc-v-and-mips-architectures/,Jean-Luc Aufranc (CNXSoft),2025-12-01T06:32:55Z,bulk carrier,"Linus Torvalds has just announced the release of Linux 6.18 on the Linux Kernel Mailing List (LKML), which will likely become the next LTS kernel: So I'll have to admit that I'd have been happier with slightly less bugfixing noise in this last week of the rel…",CNX Software,Unknown,News,2025-12-05T18:30:27.569944Z
800f48a01d85f35ce514aba0e249a159,Why Reciprocal Insurance Exchanges Are Back in Fashion,https://www.carriermanagement.com/features/2025/11/21/281723.htm,Susanne Sclafane,2025-12-01T06:03:56Z,bulk carrier,"Reciprocal insurance exchanges have been increasingly popular in recent years, with third-party investor interest in the fee-for-service businesses that manage RIEs and waning property insurance capacity in catastrophe-prone regions supporting the resurgence.…",Carriermanagement.com,Unknown,News,2025-12-05T18:30:27.569996Z
8f8ebcc9b0a421d530d2fc8c69904ba1,Kyren Williams leaves game after worrying injury scare,https://rollingout.com/2025/11/30/kyren-williams-leaves-worrying-injury/,Tega Egwabor,2025-11-30T19:55:47Z,bulk carrier,"Los Angeles Rams running back Kyren Williams exited Sunday’s game against the Carolina Panthers in the second quarter with an injury, creating concern about his availability for the remainder of the contest. The team’s lead ball carrier headed to the locker r…",Rolling Out,Unknown,News,2025-12-05T18:30:27.570045Z
612bdb38009c37e61995584c44fe3182,Clueless Climate Hypocrites Block Major Coal Port,https://wattsupwiththat.com/2025/11/30/clueless-climate-hypocrites-block-major-coal-port-with-plastic-kayaks/,Eric Worrall,2025-11-30T18:00:00Z,bulk carrier,"Another year, another bunch of ignorant climate protestors.",Wattsupwiththat.com,Unknown,News,2025-12-05T18:30:27.570073Z
d5b145474f278e55e01428cfe3f7cdcb,"The best Cyber Monday Google Pixel 10 deal that nobody wants to talk about - score over 50% OFF the phone AND a year of wireless, just for kicks",https://www.androidcentral.com/phones/google-pixel/mint-mobile-cyber-monday-google-pixel-10-deal,"patrick.farmer@futurenet.com (Patrick Farmer) , Patrick Farmer",2025-11-30T17:36:04Z,bulk carrier,Mint Mobile is running a Cyber Monday promotion that drops over 50% off the Google Pixel 10 AND gives you a huge discount on wireless.,Android Central,Unknown,News,2025-12-05T18:30:27.570110Z
7a150a1fe05ee379d3bd055fc3a4da0f,"49ers vs. Browns prediction: NFL Week 13 player props, picks, odds",https://nypost.com/2025/11/30/betting/49ers-vs-browns-prediction-nfl-week-13-player-props-picks-odds/,Dylan Svoboda,2025-11-30T12:15:00Z,bulk carrier,The Browns will welcome the 49ers to Cleveland on Saturday.,New York Post,Unknown,Analysis/Opinion,2025-12-05T18:30:27.570133Z
1b2df4d50f90008a37d862216bfc777a,Protesters arrested for blocking world's largest coal port,https://www.abc.net.au/news/2025-11-30/protesters-arrested-attempting-block-worlds-largest-coal-port/106083224,Courtney Yeandle and Nakita Jager,2025-11-30T05:41:56Z,bulk carrier,Police arrest more than 30 people in Newcastle Harbour for alleged marine-related offences during an anti-fossil fuel protest.,ABC News (AU),Australia,News,2025-12-05T18:30:27.570149Z
91ec62b0ab74b6786b9b4bb83b039624,Guinea’s giant iron ore project finally comes to life,https://www.sundaytimes.timeslive.co.za/business/news/2025-11-29-guineas-giant-iron-ore-project-finally-comes-to-life/,Caiphus Kgosana,2025-11-29T04:31:35Z,bulk carrier,Ambitious R341bn Simandou project set to transform West African nation’s economy,TimesLIVE,Unknown,News,2025-12-05T18:30:27.570182Z
06d63037d80cb9f0df1861f51c9fb41b,Las Vegas Grand Prix Delivers Result No One Could Have Predicted,https://www.forbes.com/sites/robreed/2025/11/28/las-vegas-grand-prix-delivers-result-no-one-could-have-predicted/,"Rob Reed, Contributor, 
 Rob Reed, Contributor
 https://www.forbes.com/sites/robreed/",2025-11-28T17:34:10Z,bulk carrier,"The Las Vegas Grand Prix is a party from start to finish: watch parties, clubs, after parties and private suite parties. But you don't actually need to attend the race",Forbes,Unknown,News,2025-12-05T18:30:27.570216Z
64c3030322180abbfa8e66963987c38f,Habs Seek to Extend Winning Streak vs. Vegas Golden Knights,https://sportsnaut.com/nhl/montreal-canadiens/montreal-canadiens-preview-vegas-texier-habs-debut/,Marc Dumont,2025-11-28T17:11:33Z,bulk carrier,"The Montreal Canadiens (12-7-3) will take on the Vegas Golden Knights (10-5-8), with the puck drop scheduled for 4:00 pm",Sportsnaut,Unknown,News,2025-12-05T18:30:27.570244Z
371deeb152b8dc2fc8c8f948d968f4ab,The $5 bill challenge: A low-effort way to grow your savings,https://finance.yahoo.com/personal-finance/banking/article/5-bill-challenge-140018194.html,Ivana Pino,2025-11-28T14:00:18Z,bulk carrier,"Learn how the $5 bill challenge helps you save money effortlessly. See how it works, how much you can save, and tips to make this simple savings hack...",Yahoo Entertainment,Unknown,News,2025-12-05T18:30:27.570276Z
ecbba3b3a2ee27a82020b540e73ca854,Diapers and discounts! The 60+ best Black Friday baby deals are here,https://nypost.com/shopping/best-black-friday-baby-deals-sales-2025/,Miska Salemann,2025-11-28T12:30:00Z,bulk carrier,Chase these deals like it's your toddler running down the snack isle.,New York Post,Unknown,News,2025-12-05T18:30:27.570305Z
0240453b7c59e8291f2a02230d97616d,India plans more incentives for aircraft leasing in GIFT City,https://economictimes.indiatimes.com/industry/transportation/airlines-/-aviation/india-plans-more-incentives-for-aircraft-leasing-in-gift-city/articleshow/125631361.cms,Bloomberg,2025-11-28T06:46:47Z,bulk carrier,"India plans to extend the tax holiday for aircraft leasing firms in GIFT City to 15 years, aiming to capture a larger share of the global market. This move seeks to make the financial hub more attractive to lessors, boosting India's presence in the $187 billi…",The Times of India,India,Market Report,2025-12-05T18:30:27.570327Z
79d91292446007eb7f888e65512a3134,Why the Samsung Galaxy S25 Ultra at its Black Friday price is basically unbeatable,https://www.zdnet.com/article/why-the-samsung-galaxy-s25-ultra-at-its-black-friday-price-is-basically-unbeatable/,Kerry Wan,2025-11-28T02:58:00Z,bulk carrier,"The slim design, enhanced processor, and Galaxy AI features make this year's Ultra flagship the best one yet. Right now, it's $400 off for Black Friday.",ZDNet,Unknown,News,2025-12-05T18:30:27.570360Z
76c8aaa2a71322986c6d9d544a8beb00,"M.M gathers the blockades on the national highways, the London business deals, the MPs who… go to Tsipras’ book launch, Piraeus Bank “gets along well” with Euroxx ///",https://en.protothema.gr/2025/12/02/m-m-gathers-the-blockades-on-the-national-highways-the-london-business-deals-the-mps-who-go-to-tsipras-book-launch-piraeus-bank-gets-along-well-with-euroxx/,admin,2025-12-02T11:47:02Z,panamax,"///
The post M.M gathers the blockades on the national highways, the London business deals, the MPs who… go to Tsipras’ book launch, Piraeus Bank “gets along well” with Euroxx /// appeared first on ProtoThema English.",Protothema.gr,Greece,News,2025-12-05T18:30:28.308744Z
e542a9a1809d1a3143a7364d6e36a7fa,Oil Tanker Rates Skyrocket by 467% Amid Shipping Chaos,https://oilprice.com/Latest-Energy-News/World-News/Oil-Tanker-Rates-Skyrocket-by-467-Amid-Shipping-Chaos.html,Charles Kennedy,2025-12-04T16:30:00Z,iron ore,"The daily rates for chartering a vessel to transport commodities have surged this year, with oil tanker rates skyrocketing by 467%, as shippers of a growing commodity supply are grappling with a series of route disruptions and sanctions.   Despite the typical…",OilPrice.com,Unknown,Market Report,2025-12-05T18:30:30.118007Z
