article_id,title,link,creator,pubdate,category,description,source,country,article_type,scrape_timestamp
bdfb6c55a448f802ff41010a0061e683,"On Iran, China Cares About the Region More Than the Regime",http://foreignpolicy.com/2026/03/05/iran-war-china-middle-east-us-intervention-diplomacy/,Aaron Glasserman,2026-03-05T10:00:53Z,Panama Canal,Beijing won’t risk its broader Middle East interests to save the Islamic Republic.,Foreign Policy,China,News,2026-03-07T18:37:44.300610Z
a31c65f7e17bf08788f3e7dceb9c93a7,Robert Downey Jr. Christens New Disney Cruise Ship in Singapore,https://ohnotheydidnt.livejournal.com/132018146.html,squirrels_oh_no,2026-03-05T05:45:47Z,Panama Canal,"Robert Downey Jr. is officially the Godparent of Disney's newest ship, Disney Adventure. Disney Adventure will sail year-round from Singapore. The ship is designed to cater to Asian audiences, and was originally constructed for as the Global Dream for Genting…",Livejournal.com,Singapore,News,2026-03-07T18:37:44.300644Z
2a2071b3b6fc5dbc9ca67c9bcf933264,"CDT’s “404 Deleted Content Archive” Summary for January 2026, Part Three",https://chinadigitaltimes.net/2026/03/cdts-404-deleted-content-archive-summary-for-january-2026-part-three/,Cindy Carter,2026-03-04T22:42:51Z,Panama Canal,"CDT presents a monthly series of censored content that has been added to our “404 Deleted Content Archive.” Each month, we publish a summary of content blocked or deleted (often yielding the message “404: content not found”) from Chinese platforms such as WeC…",Chinadigitaltimes.net,China,Market Report,2026-03-07T18:37:44.300665Z
f3182503ce0f5bd9eaedc6a076457781,"What Happens Next in Iran? Decapitation, Quagmire, or WWIII?, by Brandon Smith >",https://survivalblog.com/2026/03/05/happens-next-iran-decapitation-quagmire-wwiii-brandon-smith/,SurvivalBlog Contributor,2026-03-04T15:33:58Z,Panama Canal,"Before I begin this analysis of the situation in the Middle East and its consequences, I want to warn people that this examination is going to be largely secular and nuanced; which means people on both sides of the divide are going to be perturbed and moan ab…",Survivalblog.com,Unknown,Analysis/Opinion,2026-03-07T18:37:44.300706Z
cd97ef0df1b8874166c1408569855019,An Unlawful War,https://www.thenation.com/?post_type=article&p=588730,Richard Falk,2026-03-04T10:00:00Z,Panama Canal,"Richard Falk



The precedent being set by the US in launching this war of aggression against Iran will long live in infamy.




The post An Unlawful War appeared first on The Nation.",Thenation.com,Unknown,News,2026-03-07T18:37:44.300752Z
a886c049c1dfeceeae54a8e05eb394f5,Victor Davis Hanson: Another Iran Quagmire Might Mean Big Losses for Republicans in the Midterms,https://www.dailysignal.com/2026/03/03/victor-davis-hanson-another-iran-quagmire-might-mean-big-losses-for-republicans-in-the-midterms/,Victor Davis Hanson,2026-03-03T21:00:00Z,Panama Canal,"Editor’s note: This is a lightly edited transcript of today’s video from Daily Signal Senior Contributor Victor Davis Hanson. Subscribe to our YouTube channel to see... Read More
The post Victor Davis Hanson: Another Iran Quagmire Might Mean Big Losses for Re…",Daily Signal,Unknown,Market Report,2026-03-07T18:37:44.300829Z
4b043f2b8c6c386ae42f9ffdcc247d71,Quote of the Day by Theodore Roosevelt: 'Believe you can and you're halfway there...'—Inspiring quotes by the 26th U.S. President,https://economictimes.indiatimes.com/news/international/us/quote-of-the-day-by-theodore-roosevelt-believe-you-can-and-youre-halfway-there-inspiring-quotes-by-the-26th-u-s-president/articleshow/128979631.cms,Global Desk,2026-03-03T17:33:04Z,Panama Canal,"Theodore Roosevelt's enduring quote, ""Believe you can and you're halfway there,"" highlights the power of internal conviction. His life, marked by overcoming physical frailty and leading through significant challenges, exemplifies how belief fuels action and t…",The Times of India,Unknown,News,2026-03-07T18:37:44.300884Z
7738d63e9bc1525d9dd56811e2c3a669,US-led regime changes yield mixed results,https://www.dw.com/en/us-led-regime-changes-yield-mixed-results/a-76200309,David Ehl,2026-03-03T17:03:00Z,Panama Canal,"Various US presidents have sent military forces to remove unpopular rulers abroad. Their track record is mixed. Initially, Trump claimed that regime-change was a goal in the current Iran war, too.",DW (English),Unknown,News,2026-03-07T18:37:44.300920Z
29b13a937de479fb06ef8815d1110822,"Trump, Tehran and the long shadow of Washington's checkered history of regime change operations",https://www.dw.com/en/the-checkered-history-of-us-regime-change-operations/a-76200309,David Ehl,2026-03-03T17:03:00Z,Panama Canal,"Various US presidents have sent military forces to remove unpopular rulers abroad. Their track record is mixed. Initially, Trump claimed that regime-change was a goal in the current Iran war, too. At the beginning of the current war with Iran, US President Do…",DW (English),Unknown,News,2026-03-07T18:37:44.301016Z
ef645892edef20ad2ca81d4a0166acd9,"China set to suffer from turmoil in the Middle East, but it stands to benefit long term",https://theconversation.com/china-set-to-suffer-from-turmoil-in-the-middle-east-but-it-stands-to-benefit-long-term-277295,"Tom Harper, Lecturer in International Relations, University of East London",2026-03-03T16:48:30Z,Panama Canal,"The war in Iran is likely to lead to several issues for China, but it also presents Beijing with opportunities.",The Conversation Africa,China,News,2026-03-07T18:37:44.301031Z
87b3145a0a1faa6e00c62cca8104f92f,This Disney Cruise Ship Abandoned Los Angeles for This Foreign City,https://insidethemagic.net/2026/03/this-disney-cruise-ship-abandoned-los-angeles-for-this-foreign-city-el1/,Erica Lauren,2026-03-03T16:15:23Z,Panama Canal,"The Disney Adventure arrived in its permanent homeport of Singapore on March 3, 2026, after a two-month global journey that included transiting the Panama Canal and stops in Los Angeles and Tokyo. This marks the Disney Cruise Line’s first entry into Asian mar…",Inside the Magic,Singapore,News,2026-03-07T18:37:44.301066Z
6fa054edb87be65618021852e66441f6,Teammate Connections During World Baseball Classic Pool Play,https://blogs.fangraphs.com/teammate-connections-during-world-baseball-classic-pool-play/,Davy Andrews,2026-03-03T16:00:59Z,Panama Canal,There are too many of them. I have lost my mind.,Fangraphs.com,Unknown,News,2026-03-07T18:37:44.301091Z
268623895517b4abeb67fc4d2754bbcf,Trump promised the MAGA base no new wars. Then he went to war with Iran,https://www.npr.org/2026/03/03/nx-s1-5732601/trump-maga-iran-war-israel,Stephen Fowler,2026-03-03T10:00:00Z,Panama Canal,"President Trump promised his ""Make America Great Again"" voters an ""America First"" foreign policy. With the war in Iran, he's testing MAGA world's willingness to be flexible on one of its core beliefs.",NPR,USA,News,2026-03-07T18:37:44.301112Z
0c7eca38ba885da6bc0579766a1bec52,Why Are There Almost No Mosquitoes at Disney World? The Science Behind It,https://economictimes.indiatimes.com/news/international/us/why-are-there-almost-no-mosquitoes-at-disney-world-the-science-behind-it/articleshow/128963476.cms,Global Desk,2026-03-03T09:35:14Z,Panama Canal,"Walt Disney World employs a sophisticated environmental engineering strategy to combat mosquitoes, focusing on preventing breeding by managing standing water through extensive drainage systems and aerated water features. This integrated pest management approa…",The Times of India,Unknown,News,2026-03-07T18:37:44.301163Z
834c2111397ec9c8239824d34117ba97,"BlackRock-backed group seeks to close CK Hutchison ports deal without Panama assets, FT reports",https://www.channelnewsasia.com/business/blackrock-backed-group-seeks-close-ck-hutchison-ports-deal-without-panama-assets-ft-reports-5966286,,2026-03-03T05:49:29Z,Panama Canal,"March 3 : A BlackRock-backed consortium is pushing to complete its acquisition of CK Hutchison's global ports business without two terminals in Panama, after authorities seized the assets, Financial Times reported on Tuesday.Swiss-Italian shipping firm Medite…",CNA,Panama,Market Report,2026-03-07T18:37:44.301203Z
ce649ace66a3b2a5c8441ebae319390f,Trump hit Iran — but he’s really got China in his crosshairs,https://nypost.com/2026/03/02/opinion/trump-hit-iran-but-hes-really-got-china-in-his-crosshairs/,Steven W. Mosher,2026-03-03T01:39:24Z,Panama Canal,"The death of Iran's ayatollah is only the latest in a series of recent geopolitical setbacks for China, America’s chief adversary.",New York Post,China,News,2026-03-07T18:37:44.301221Z
f961813108c5575d668c18b17d2d58b6,Panama seeks new backing to reinforce canal neutrality,https://consent.yahoo.com/v2/collectConsent?sessionId=1_cc-session_3c3fe206-d5a6-4d1e-ba23-555f7a7a43f7,,2026-03-02T17:22:11Z,Panama Canal,,Yahoo Entertainment,Panama,News,2026-03-07T18:37:44.301241Z
c3e840369d30dc374c73a0f93557238c,Cuba Is Next,https://www.theatlantic.com/national-security/2026/03/cuba-trump-iran-venezuela/686203/,Vivian Salama,2026-03-01T22:39:40Z,Panama Canal,Trump’s campaign to take out long-standing U.S. irritants looks back to the Caribbean.,The Atlantic,Unknown,News,2026-03-07T18:37:44.301283Z
fc438a3716c3b2004a3f4592655d2b75,Why Trump has suddenly developed a taste for attacking other countries,https://www.abc.net.au/news/2026-03-01/trump-iran-taste-for-attacking-other-countries/106402042,John Barron,2026-03-01T01:32:43Z,Panama Canal,"Trump once proclaimed: ""I am especially proud to be the first president in decades who has started no new wars."" Now things have changed.",ABC News (AU),Unknown,News,2026-03-07T18:37:44.301324Z
5700bd03f26881eace8668d6aaae0ea7,Victor Davis Hanson: Trump’s Cost-Benefit Analysis for Striking Iran,https://www.dailysignal.com/2026/02/28/victor-davis-hanson-trumps-cost-benefit-analysis-for-striking-iran/,Victor Davis Hanson,2026-02-28T17:07:47Z,Panama Canal,"Editor’s note: This is a lightly edited transcript of a segment from today’s edition of “Victor Davis Hanson: In His Own Words” with Daily Signal... Read More
The post Victor Davis Hanson: Trump’s Cost-Benefit Analysis for Striking Iran appeared first on The …",Daily Signal,Unknown,Analysis/Opinion,2026-03-07T18:37:44.301382Z
c9187ca7b80fcd920a496b7d466f8147,Israeli strikes target Iran and Lebanon as US warns of bombardment ‘surge’,https://www.irishtimes.com/world/middle-east/2026/03/06/israeli-strikes-target-iran-and-lebanon-as-us-warns-of-bombardment-surge/,Mark Weiss,2026-03-06T07:10:53Z,Black Sea shipping,Motorists jam roads trying to flee or seek shelter in southern suburbs of Beirut as Israel launches a series of air strikes,The Irish Times,Unknown,News,2026-03-07T18:37:44.776860Z
d0584d4e18f49aa6c1c605e8782eb5b0,Calm before the storm? Oil's muted reaction to Iran,https://www.abc.net.au/news/2026-03-06/oil-reaction-trump-attack-on-iran/106424164,Ian Verrender,2026-03-06T03:20:50Z,Black Sea shipping,"For all the chaos, the terror and the loss of life in the past week following America's war on Iran, oil prices have managed to maintain a semblance of stability.",ABC News (AU),USA,Market Report,2026-03-07T18:37:44.776922Z
45902f9571e66a5b61beabdc572ac2ee,Rising energy prices from Iran war could help Russia pay for fighting in Ukraine,https://japantoday.com/category/world/rising-energy-prices-from-the-iran-war-could-help-russia-pay-for-fighting-in-ukraine,,2026-03-04T21:31:52Z,Black Sea shipping,"The Iran war's disruption of Middle East oil and gas supplies and soaring prices are strengthening Russia's ability to profit from its energy exports, a pillar of the Kremlin's budget and a key to paying for its own war in Ukraine. Prices for Russia's oil exp…",Japan Today,Russia,Market Report,2026-03-07T18:37:44.777081Z
6d374e609ae23eaafd23be556feedc24,Rising energy prices from the Iran war could help Russia pay for fighting in Ukraine,https://abcnews.com/US/wireStory/rising-energy-prices-iran-war-russia-pay-fighting-130756152,DAVID MCHUGH AP business writer,2026-03-04T16:11:37Z,Black Sea shipping,Oil and gas prices are soaring after the Iran war choked off tanker supplies from the Middle East,Abcnews.com,Russia,Market Report,2026-03-07T18:37:44.777098Z
3b0988a289afbb03d78ef678b0692077,Russian Oil Remains Cheap,https://www.rigzone.com/news/wire/russian_oil_remains_cheap-04-mar-2026-183126-article/,Bloomberg News,2026-03-04T14:55:18Z,Black Sea shipping,Russia's flagship crude blend is still trading at deep discounts despite a global oil rally.,Rigzone,Russia,Market Report,2026-03-07T18:37:44.777113Z
b28efbf6570aa85cf3fe66c63950ce91,Show HN: Captain's Log – Your ship sinks when you stop committing,https://github.com/JungHoonGhae/captains-log,lucasghae,2026-03-04T13:54:33Z,Black Sea shipping,"A pirate-themed macOS menu bar app that gamifies dev velocity. Water rises over 8 hours of inactivity — your ship sinks, your captain drowns. Any commit resets it. Built with Swift/SwiftUI, available via Homebrew.

Comments URL: https://news.ycombinator.com/i…",Github.com,Unknown,Analysis/Opinion,2026-03-07T18:37:44.777152Z
d12a58d84f5f8d207b9cc641ee7130b6,Russian Oil Remains Cheap Even as War Threatens Global Supplies,https://financialpost.com/pmn/business-pmn/russian-oil-remains-cheap-even-as-war-threatens-global-supplies,Bloomberg News,2026-03-04T13:39:12Z,Black Sea shipping,Russia’s flagship crude blend is still trading at deep discounts despite a global oil rally driven by the growing escalation in the Middle East.,Financial Post,Russia,Market Report,2026-03-07T18:37:44.777251Z
ac9ab2d371cdbb9b63fa3b6677ad0fed,US Consulate vicinity in Dubai targeted in drone strike; thick smoke seen near compound,https://economictimes.indiatimes.com/news/international/world-news/us-consulate-vicinity-in-dubai-targeted-in-drone-strike-thick-smoke-seen-near-compound/articleshow/129007640.cms,ET Online,2026-03-04T05:19:45Z,Black Sea shipping,"A drone struck a parking area near the US Consulate in Dubai, causing a fire that was quickly extinguished. The UAE reported intercepting numerous missiles and drones amid escalating regional conflict. The nation reiterated its neutrality while asserting its …",The Times of India,Unknown,Market Report,2026-03-07T18:37:44.777332Z
aee29c1999facf3413c3b262dd89f349,AAPI art and culture are in the spotlight at the upcoming San Francisco Art Fair.,https://www.7x7.com/2026-sf-art-fair-2675549490.html,Emily Wilson,2026-03-03T18:57:45Z,Black Sea shipping,"When Kelly Freeman became director of the San Francisco Art Fair three years ago, the event’s focus was the strength of San Francisco and its arts scene. Last year, the fair spotlighted the East Bay. This year, the 14th edition of the fair—which will be held …",7x7.com,Unknown,News,2026-03-07T18:37:44.777379Z
f8e9a85009324983f683630e12bc72a8,Live Updates: Trump says Iran war could last weeks,https://www.pbs.org/newshour/world/live-updates-trump-says-iran-war-could-last-weeks,Associated Press,2026-03-03T15:07:12Z,Black Sea shipping,"As the war in the Middle East intensifies, President Donald Trump said the U.S. has ""the capability to go far longer"" than its projected four-to-five-week time frame for its military operations against Iran.",PBS,Unknown,News,2026-03-07T18:37:44.777413Z
cf83fc9dda07fa4fe0935fe89719e282,Prabowo’s Peacemaker Campaign Now Extends to Iran,http://foreignpolicy.com/2026/03/03/prabowo-indonesia-southeast-asia-iran-strikes/,Joseph Rachman,2026-03-03T06:00:30Z,Black Sea shipping,Indonesia’s president offers to facilitate negotiations after U.S. and Israeli strikes.,Foreign Policy,Indonesia,News,2026-03-07T18:37:44.777532Z
a776ede13994844ba7042e2585d5611a,How Many Hormuz Warnings Does Europe Need?,https://oilprice.com/Energy/Energy-General/How-Many-Hormuz-Warnings-Does-Europe-Need.html,Leon Stille,2026-03-02T19:00:00Z,Black Sea shipping,"The Strait of Hormuz is back in the headlines. Again. Roughly a fifth of globally traded oil passes through that narrow maritime corridor between Oman and Iran. And once more, geopolitical tensions in the Middle East have turned this chokepoint into a pressur…",OilPrice.com,Global,News,2026-03-07T18:37:44.777595Z
89f9dffd14ec60e9c4b5c54710b0c55a,Exploding drone boats have entered the Iran fight. Oman says one hit a tanker in a fatal blow.,https://www.businessinsider.com/drone-boats-iran-fight-oman-says-one-hit-tanker-fatal-2026-3,Sinéad Baker,2026-03-02T16:25:49Z,Black Sea shipping,"Vessels were already coming under fire in the fight with Iran, and now Oman said drone boats are adding to the risks in strategic waters.",Business Insider,Unknown,News,2026-03-07T18:37:44.777630Z
6c4eea9ff3e74fcf73c0f9b089aefa15,No insurance companies to get marine hull war risk reinsurance support from GIC Re for certain high-risk zones,https://www.thehindubusinessline.com/money-and-banking/no-insurance-companies-to-get-marine-hull-war-risk-reinsurance-support-from-gic-re-for-certain-high-risk-zones/article70696442.ece,Mithun Dasgupta,2026-03-02T15:22:18Z,Black Sea shipping,The reinsurance company said it will cease to cover the marine hull war risks for certain high-risk zones from 1900 hours IST on March 3,BusinessLine,Unknown,News,2026-03-07T18:37:44.777666Z
71fea55cdb8a63e4b826d25ebef12ad1,"Blood gas and lactate analysis in nesting loggerhead (Caretta caretta) and green (Chelonia mydas) sea turtles from southeastern Florida, USA",https://journals.plos.org/plosone/article?id=10.1371/journal.pone.0343737,"Faye E. Giebink, Justin R. Perrault, Madison Toonder, Sarah E. Hirsch, Derek M. Aoki, Craig A. Harms, Charles J. Innis, Nicole I. Stacy",2026-03-02T14:00:00Z,Black Sea shipping,High-energy demands and transition to a catabolic state pose physiological challenges for sea turtles during the nesting season. The objectives of this study were to assess venous blood gas analytes and lactate in loggerhead (Caretta caretta) and green turtle…,Plos.org,Unknown,Analysis/Opinion,2026-03-07T18:37:44.777740Z
3ee9dfd329901143e0d83a41ef6c5ed1,You Don't Have To,https://www.scottsmitelli.com/articles/you-dont-have-to/,Scott Smitelli,2026-03-01T21:47:13Z,Black Sea shipping,"""In the year 5555, your arms are hangin' limp at your sides, your legs got nothing to do, some machine doin' that for you."" Zager and Evans sang these words in 1969. Now, thirty-five centuries ahead of schedule, it's never been easier to tell the world ""I did…",Scottsmitelli.com,Unknown,News,2026-03-07T18:37:44.777787Z
3e9e625fe1704c7666601d516265eeea,"Dubai's image as a safe, tax-free haven is rocked by blasts from Iranian airstrikes",https://www.seattlepi.com/business/dubai-s-image-as-a-safe-tax-free-haven-is-rocked-a21949128,"By BRIAN MELLEY, Associated Press",2026-03-01T20:36:07Z,Black Sea shipping,"Iranian missiles and drones have hit the United Arab Emirates, shaking Dubai’s image as a safe, tax-free haven for foreigners. Officials say debris from intercepted weapons sparked fires at major landmarks. A person was killed at Abu Dhabi’s airport, and seve…",seattlepi.com,Unknown,Market Report,2026-03-07T18:37:44.777881Z
22c97d1972b1481bf8e5cbfcb5ce64b0,"Those Who Left History by Wanxiang Fengnian, translated by Stella Jiayue Zhu",https://clarkesworldmagazine.com/fengnian_03_26/,Wanxiang Fengnian and Stella Jiayue Zhu,2026-03-01T19:46:00Z,Black Sea shipping,"From his exclusive residence, Zhou Xiaoliang’s diary: I know you will never read this, but I have to pretend I am writing for you. Or else what’s left to do? […]",Clarkesworldmagazine.com,Unknown,News,2026-03-07T18:37:44.777920Z
79e09da20ae47f890226bb7111468346,GIC Re withdraws marine hull war cover in high-risk regions,https://economictimes.indiatimes.com/industry/transportation/shipping-/-transport/gic-re-withdraws-marine-hull-war-cover-in-high-risk-regions/articleshow/128931812.cms,Shilpy Sinha,2026-03-01T19:27:37Z,Black Sea shipping,"State-owned GIC Re will withdraw Marine Hull War Risk cover from several high-risk regions starting in early March, including the Persian Gulf, Black Sea, and Red Sea, amid rising geopolitical tensions. Ship owners should review their insurance arrangements, …",The Times of India,Unknown,Analysis/Opinion,2026-03-07T18:37:44.777961Z
8c1ea53317a0e143e6f1828eb2c32d11,GIC Re withdraws marine hull war cover in high-risk regions,https://economictimes.indiatimes.com/industry/transportation/shipping-/-transport/gic-re-withdraws-marine-hull-war-cover-in-high-risk-regions/articleshow/128925966.cms,Shilpy Sinha,2026-03-01T19:27:37Z,Black Sea shipping,"State-owned GIC Re will withdraw Marine Hull War Risk cover from several high-risk regions starting in early March, including the Persian Gulf, Black Sea, and Red Sea, amid rising geopolitical tensions. Ship owners should review their insurance arrangements, …",The Times of India,Unknown,Analysis/Opinion,2026-03-07T18:37:44.777992Z
c403101596056f4b30e6989441640437,Oil Market’s ‘Worst Fears’ Are Here as Gulf Conflict Hits Hormuz,https://financialpost.com/pmn/business-pmn/oil-markets-worst-fears-are-here-as-gulf-conflict-hits-hormuz,Bloomberg News,2026-03-01T18:43:54Z,Black Sea shipping,The oil market’s nightmare scenario came true this weekend. Now the race is on to deal with it.,Financial Post,Unknown,Market Report,2026-03-07T18:37:44.778028Z
28ae3849b382c3b5e3467ff59ccb1318,"3 U.S. military service members killed, 5 wounded in Iran operation, Central Command says",https://fortune.com/2026/03/01/3-american-military-service-members-killed-iran-strike-central-command/,The Associated Press,2026-03-01T15:46:48Z,Black Sea shipping,"Israel claimed that its strikes had killed 40 top Iranian military officials, including the chief of staff for the armed forces, Abdolrahim Mousavi.",Fortune,Unknown,News,2026-03-07T18:37:44.778062Z
d6a1ed7612de604c7352a5485621a82d,"CBSE's Class 10, 12 Board exams in Bahrain, Iran, Kuwait, Oman, Qatar, S Arabia, UAE postponed",https://timesofindia.indiatimes.com/education/cbses-class-10-12-board-exams-in-bahrain-iran-kuwait-oman-qatar-s-arabia-uae-postponed/articleshow/128919716.cms,ANI,2026-03-01T15:26:48Z,Black Sea shipping,"In an official circular issued, the Board informed that examinations slated for Monday, March 2, for both Class X and Class XII students in Bahrain, Iran, Kuwait, Oman, Qatar, Saudi Arabia and the United Arab Emirates (UAE) stand postponed. Revised dates will…",The Times of India,Unknown,Market Report,2026-03-07T18:37:44.778108Z
00a1c95cd999ac69d7e070dc290a5b67,Sly Saudi-Israel alliance set up US attack on Iran,https://timesofindia.indiatimes.com/world/us/sly-saudi-israel-alliance-set-up-us-attack-on-iran/articleshow/128916919.cms,Chidanand Rajghatta,2026-03-01T15:26:44Z,Black Sea shipping,"Saudi Arabia and Israel have quietly converged, driven by shared concerns over Iran's regional influence. Despite public diplomacy, Saudi Crown Prince Mohammed bin Salman reportedly urged a US strike, warning of a stronger Iran if action was delayed. This ali…",The Times of India,Unknown,Market Report,2026-03-07T18:37:44.778153Z
68bce0267418d54a5a7074eec079e144,Lunar Eclipse 2026: What every student should know about the March 3 Blood Moon,https://timesofindia.indiatimes.com/education/learning-with-toi/lunar-eclipse-2026-what-every-student-should-know-about-the-march-3-blood-moon/articleshow/128919324.cms,TOI Education,2026-03-01T15:17:15Z,Black Sea shipping,"On March 3, 2026, India will witness a total lunar eclipse coinciding with Holi. This celestial event, where Earth's shadow turns the Moon red, offers students a unique opportunity to explore astronomy, physics, and the intersection of science and culture. Ob…",The Times of India,India,News,2026-03-07T18:37:44.778180Z
fc3d18e44056296fc56cda07065f16c0,Curtorim gram sabha opposes housing project over Maina lake threat,https://timesofindia.indiatimes.com/city/goa/curtorim-gram-sabha-opposes-housing-project-over-maina-lake-threat/articleshow/128919680.cms,Times News Network,2026-03-01T15:16:01Z,Black Sea shipping,Margao: Curtorim gram sabha on Sunday passed a resolution opposing a proposed mega construction project in the village. The members said that the proj.,The Times of India,Unknown,News,2026-03-07T18:37:44.778219Z
538f1de750fea9d200a7c95e16d8a9f7,Weekly Update 01-Mar-2026,https://blog.nikonians.org/archives/2026/03/news_update_weekly_2026_03_01_236.html,,2026-03-01T04:40:02Z,Black Sea shipping,This weeks Editor's Choice images and top discussions at Nikonians - 01 March 2026,Nikonians.org,Unknown,Market Report,2026-03-07T18:37:44.778242Z
a2865536d35bb75e9dfa8deabde021a9,Iran war: Is the tourism boom in the Middle East over?,https://www.dw.com/en/iran-war-is-the-tourism-boom-in-the-middle-east-over/a-76245480,Jonas Martiny,2026-03-06T13:30:00Z,Red Sea shipping,The tourism industry on the Arabian Peninsula has experienced remarkable growth in recent years. But the conflict with Iran is now slowing that momentum.,DW (English),Unknown,News,2026-03-07T18:37:45.301654Z
706f8f2c62bdf9f3754e9aba2c5175ea,US-Israel war on Iran could end Middle East tourism boom,https://www.dw.com/en/us-israel-war-on-iran-could-end-middle-east-tourism-boom/a-76245480,Jonas Martiny,2026-03-06T13:30:00Z,Red Sea shipping,The tourism industry on the Arabian Peninsula has experienced remarkable growth in recent years. But the US-Israeli war and Iran's retaliatory strikes across Gulf state borders is now slowing that momentum. The US-Israeli war with Iran is affecting the touris…,DW (English),Unknown,News,2026-03-07T18:37:45.301705Z
c724dd9e23b85d5e5254f2c91834aa82,Will the Houthis join Iran’s war?,https://www.aljazeera.com/opinions/2026/3/6/will-the-houthis-join-irans-war,Ahmed al-Shalafi,2026-03-06T09:12:59Z,Red Sea shipping,"As the regional conflict escalates, Abdel-Malik al-Houthi faces a strategic choice: intervene or stay out.",Al Jazeera English,Unknown,News,2026-03-07T18:37:45.301826Z
