article_id,title,link,creator,pubdate,category,description,source,country,article_type,scrape_timestamp
7be586412a04531e14a5f2db7e8b4528,U.S. Officially Ends Maritime Blockade of Iran,https://gcaptain.com/u-s-officially-ends-maritime-blockade-of-iran/,Mike Schuler,2026-06-18T17:09:49Z,maritime transport,"The United States has formally ended its maritime blockade of Iran, with U.S. Central Command announcing Wednesday that all enforcement operations targeting vessels entering or leaving Iranian ports have ceased....",gcaptain.com,USA,News,2026-06-24T09:34:03.843250Z
40c648f3b9d0e7ea52723c753911d563,"Japan is launching a world-first Hydrogen power engine, and it could change energy forever",https://economictimes.indiatimes.com/news/international/us/japan-is-launching-a-world-first-hydrogen-power-engine-and-it-could-change-energy-forever/articleshow/131835861.cms,Piyush Shukla,2026-06-18T16:54:27Z,maritime transport,"Japan's latest energy breakthrough could make the path to cleaner power much easier than many expected. Instead of replacing existing systems, this new hydrogen engine works with current infrastructure while reducing carbon emissions. The innovation shows how…",The Times of India,Japan,News,2026-06-24T09:34:03.843286Z
62e9e4f8ab6adeb5841c1259643fe05e,"Underwater Concrete Foam Market to Reach USD 2.18 Billion by 2033, Expanding at 9.5% CAGR Amid Rising Marine Infrastructure Demand, Reports Verified Market Research®",https://www.prnewswire.com/news-releases/underwater-concrete-foam-market-to-reach-usd-2-18-billion-by-2033--expanding-at-9-5-cagr-amid-rising-marine-infrastructure-demand-reports-verified-market-research-302804547.html,,2026-06-18T16:50:00Z,maritime transport,"The global Underwater Concrete Foam Market is gaining momentum as marine construction, hydraulic structures, bridge piers and foundations, and ports and harbors projects increasingly turn to engineered foam-based concrete systems for reliable underwater place…",PRNewswire,Global,Market Report,2026-06-24T09:34:03.843341Z
f22a591207a52eb7f3b3ee75b2f13aaf,Strait of Hormuz: German military prepares for possible deployment,https://www.dw.com/en/strait-of-hormuz-german-military-prepares-for-possible-deployment/a-77613999,Nina Werkhäuser,2026-06-18T15:27:00Z,maritime transport,"Following the tentative deal with the US, Iran is planning to reopen the Strait of Hormuz. The German Bundeswehr is planning to assist with the mine-clearing.",DW (English),Germany,News,2026-06-24T09:34:03.843373Z
6da752a6de8aef006a68641af0f11dd4,"US gas prices now average less than $4, but still 25% higher than last year",https://www.news4jax.com/business/2026/06/18/us-gas-prices-dip-below-4-for-the-first-time-since-march/,Michelle Chapman,2026-06-18T12:23:46Z,maritime transport,"U.S. gas prices have fallen to just below $4 a gallon on average, bringing some relief to drivers who have seen soaring costs amid Washington’s war with Iran.",WJXT News4JAX,Unknown,Market Report,2026-06-24T09:34:03.843496Z
526e3beb29f3e173cb1e3abb9df640ca,"Day 1,576 of WW3. Federov say UAF can isolate Crimea by cutting orc logistics. EU Council makes diplomatic overtures to Moscow, and Netherlands punches above its weight with a half-billion Euro aid package. This is your Thursday Ukraine war thread [News]",https://www.fark.com/comments/14103224/Day-1576-of-WW3-Federov-say-UAF-can-isolate-Crimea-by-cutting-orc-logistics-EU-Council-makes-diplomatic-overtures-to-Moscow-Netherlands-punches-above-its-weight-with-a-half-billion-Euro-aid-package-This-is-your-Thursday-Ukraine-war-thread,,2026-06-18T12:00:00Z,maritime transport,"Day 1,576 of WW3. Federov say UAF can isolate Crimea by cutting orc logistics. EU Council makes diplomatic overtures to Moscow, and Netherlands punches above its weight with a half-billion Euro aid package. This is your Thursday Ukraine war thread",Fark.com,Ukraine,News,2026-06-24T09:34:03.843528Z
68bcf9ac59e2015aebeb3c150e9c32fe,How US-Iran peace deal will affect our cost of living,https://theweek.com/personal-finance/how-us-iran-peace-deal-will-affect-our-cost-of-living,"Will Barker, The Week UK",2026-06-18T11:43:47Z,maritime transport,Oil prices have already fallen sharply from peak but effects from Gulf conflict could be felt for months to come,The Week Magazine,Unknown,Market Report,2026-06-24T09:34:03.843558Z
cb5f8a1bbbd479ec729391830bf7a712,Volos Port Authority participates in Cyber Europe 2026,https://www.naftemporiki.gr/english/2125947/volos-port-authority-participates-in-cyber-europe-2026/,Πέτρος Στεφανής,2026-06-18T11:40:57Z,maritime transport,"Volos Port Authority successfully participated in Cyber Europe 2026, Europe’s largest cyber crisis simulation exercise, further strengthening its operational readiness against evolving digital threats.
The exercise, organised by the European…
Volos Port Autho…",Naftemporiki.gr,Unknown,News,2026-06-24T09:34:03.843606Z
f1fa63136dc9c27ec4f08e506190b62b,"Russia, ASEAN Plan to Deepen Cooperation in Key Sectors, Including Energy - Declaration",https://sputnikglobe.com/20260618/russia-asean-plan-to-deepen-cooperation-in-key-sectors-including-energy---declaration-1124327731.html,Sputnik International,2026-06-18T10:47:05Z,maritime transport,"MOSCOW (Sputnik) - Russia and ASEAN countries intend to deepen cooperation in key sectors, including energy and food security, according to the Kazan declaration following the Russia-ASEAN summit on Thursday.",Sputnikglobe.com,Russia,News,2026-06-24T09:34:03.843631Z
081d9ddae62daceb0686c53fcc3577b0,Fragmented Trade and the Failure of Sanctioned Oil Isolation,https://thediplomat.com/2026/06/fragmented-trade-and-the-failure-of-sanctioned-oil-isolation/,Marcus Johannes,2026-06-18T10:21:00Z,maritime transport,The geopolitics behind how sanctioned oil continues moving through parallel trading networks despite efforts to curb its flow and what this means for global trading hubs like Singapore,The Diplomat,Singapore,Market Report,2026-06-24T09:34:03.843669Z
55240307f42ff891c937496da206b1f6,Three Saudi-Flagged Vessels Transit Strait of Hormuz after Washington-Tehran Agreement,https://english.aawsat.com/business/5285587-three-saudi-flagged-vessels-transit-strait-hormuz-after-washington-tehran,Asharq Al Awsat,2026-06-18T09:50:24Z,maritime transport,"Three Saudi-flagged supertankers transited the Strait of Hormuz on Thursday, according to ship-tracking data, just hours after US President Donald Trump signed a temporary agreement with Iran aimed at ending the conflict and reopening the vital shipping route…",Aawsat.com,Unknown,News,2026-06-24T09:34:03.843721Z
10e647021ac938e9e18d71169e7f22ff,"$300 billion, sanctions relief, Hormuz reopening: Who gets what in the US-Iran peace deal?",https://economictimes.indiatimes.com/news/defence/300-billion-sanctions-relief-hormuz-reopening-who-gets-what-in-the-us-iran-peace-deal/articleshow/131821489.cms,ET Online,2026-06-18T07:16:33Z,maritime transport,"US-Iran Peace MoU: The US and Iran have signed a preliminary 14-point memorandum of understanding, outlining plans for sanctions relief, economic cooperation, and de-escalation of military tensions. The agreement includes provisions for releasing frozen asset…",The Times of India,Unknown,News,2026-06-24T09:34:03.843774Z
5c7b22a8d10d15d4e0830f4465b1f317,ALSTOM S.A: Alstom-led consortium signed €690 million to modernise Egypt’s strategic rail corridors,https://www.globenewswire.com/news-release/2026/06/18/3313931/0/en/ALSTOM-S-A-Alstom-led-consortium-signed-690-million-to-modernise-Egypt-s-strategic-rail-corridors.html,ALSTOM SA,2026-06-18T06:00:00Z,maritime transport,"18 June 2026 – Alstom, leading a consortium with Rowad Modern Engineering and Concrete Plus, has signed four landmark contracts with Egyptian National Railways (ENR) to modernise Egypt’s strategic railway corridors, covering the 6th of October–Alexandria corr…",GlobeNewswire,Egypt,News,2026-06-24T09:34:03.843821Z
215ed54ffd674e00c5b47510b3707f29,Thailand revives $30 billion coast-to-coast corridor to rival Malacca Strait,https://economictimes.indiatimes.com/news/international/world-news/thailand-revives-30-billion-coast-to-coast-corridor-to-rival-malacca-strait/articleshow/131817297.cms,Reuters,2026-06-18T04:32:39Z,maritime transport,"Thailand plans a massive ""Land Bridge"" to connect the Andaman Sea and the Gulf of Thailand. This project aims to offer a new shipping route, bypassing the busy Strait of Malacca. The government believes it will cut costs and transit times. However, the projec…",The Times of India,Unknown,News,2026-06-24T09:34:03.843870Z
a66236386643e5f5a845f5824a1cc1c6,Thailand revives $30 billion coast-to-coast corridor to rival Malacca Strait,https://economictimes.indiatimes.com/news/international/world-news/thailand-revives-30-billion-coast-to-coast-corridor-to-rival-malacca-straitphuket-airport-launches-e-gates-for-faster-immigration-clearanceread-more-athttps/economictimes-indiatimes-com/nri/visit/phuket-airport-launches-e-gates-for-faster-immigration-clearance/articleshow/131735311-cmsutm_sourcecontentofinterestutm_mediumtextutm_campaigncppst/articleshow/131817297.cms,Reuters,2026-06-18T04:32:39Z,maritime transport,"Thailand plans a massive ""Land Bridge"" to connect the Andaman Sea and the Gulf of Thailand. This project aims to offer a new shipping route, bypassing the busy Strait of Malacca. The government believes it will cut costs and transit times. However, the projec…",The Times of India,Unknown,News,2026-06-24T09:34:03.843908Z
28d9d8862300281540b7fd03a4e4b9b6,"India, US 'very close' to inking a trade deal, says Trump after meet with Modi",https://economictimes.indiatimes.com/news/economy/foreign-trade/india-us-very-close-to-inking-a-trade-deal-says-trump-after-meet-with-modi/articleshow/131815076.cms,Dipanjan Roy Chaudhury,2026-06-18T00:56:18Z,maritime transport,"US President Donald Trump stated that India and the US are very close to finalizing a trade deal, following a meeting with Prime Minister Narendra Modi on the sidelines of the G7 summit. Modi raised concerns about the safety of Indian seafarers in the Gulf, e…",The Times of India,India,News,2026-06-24T09:34:03.843933Z
8e91e71a13146674371268e50c891f96,The 'Italian Alcatraz' that transformed into a stunning national park,https://www.nationalgeographic.com/travel/article/asinara-national-park,@NatGeoTravel,2026-06-18T00:00:00Z,maritime transport,"For more than a century, Asinara was a land of exiles, war prisoners, and mafia bosses. Today, it is a Mediterranean sanctuary where nature has finally reclaimed its borders.",National Geographic,Unknown,News,2026-06-24T09:34:03.843970Z
4016ef2c8b2cbd17ccdbb1145e43f007,97 Most Loved Photos on Street Art Utopia Right Now,https://streetartutopia.com/2026/06/18/97-most-loved-photos-on-street-art-utopia-19-jun/,Vidar,2026-06-17T22:01:00Z,maritime transport,"A fresh snapshot from the ongoing Top Images page This post turns the live Top Images leaderboard into an edited collection, with artwork details, context, and artist links where available. If the same artwork appeared more than once, it appears only once her…",Streetartutopia.com,Unknown,News,2026-06-24T09:34:03.844017Z
7f38785df525ed61814e8be0a0ac129a,Russia wants to reset Persian Gulf security – Can it?,https://www.rt.com/news/641749-russia-gulf-security-reset/,RT,2026-06-17T19:56:13Z,maritime transport,Moscow’s plan for the region pushes for small steps in practical de-escalation and the building of trust. But is the Gulf ready? Read Full Article at RT.com,RT,Russia,News,2026-06-24T09:34:03.844092Z
dc94f702282b85c53c925edc1ec89646,"At G7, PM Modi warns against misuse of AI",https://economictimes.indiatimes.com/news/india/at-g7-pm-modi-warns-against-misuse-of-ai/articleshow/131807532.cms,PTI,2026-06-17T17:11:45Z,maritime transport,Prime Minister Narendra Modi cautioned world leaders at the G7 summit about the dangers of artificial intelligence. He stressed the need for global collaboration to combat deepfakes and misinformation. Modi advocated for AI to be a tool for learning and empow…,The Times of India,Global,News,2026-06-24T09:34:03.844138Z
3778abf476f656664bc22a8f680c0612,First consumer wing-in-ground effect aircraft takes flight,https://newatlas.com/aircraft/navee-wig-plane-boat-consumer-wavefly-5x/,Omar Kardoudi,2026-06-17T16:57:22Z,maritime transport,"Navee – a Chinese mobility brand that's probably best known for e-scooters like the ST3 Pro and UT5 Ultra X and electric dirt bikes such as the Storm X Pro, but also has golf carts and exoskeletons in its ecosystem – just adapted one of the Cold War's strange…",New Atlas,China,News,2026-06-24T09:34:03.844158Z
b5adcdcf50c450fed0177bb0024a0e28,"India-US Relations: Too Important to Fail, Too Complicated to Trust",https://thediplomat.com/2026/06/india-us-relations-too-important-to-fail-too-complicated-to-trust/,Vinay Kaura,2026-06-17T14:10:00Z,maritime transport,"The killing of Indian sailors by the U.S. military adds to the web of complications, but the structural foundations haven't changed.",The Diplomat,India,News,2026-06-24T09:34:03.844175Z
7dcc3735fe1c2390cc7767bfed4473aa,Deep Tech Firm Makes the Oceans Transparent,https://www.prnewswire.com/news-releases/deep-tech-firm-makes-the-oceans-transparent-302803063.html,,2026-06-17T12:14:00Z,maritime transport,"BMRT's Generation 2 Platform Demonstrates Maritime, Underwater, and Long-Range Detection Capabilities Including a Previously Undisclosed 970-Mile U-235 Event STUART, Fla., June 17, 2026 /PRNewswire/ -- Base Molecular Resonance™ Technologies (""BMRT"") today ann…",PRNewswire,Unknown,Market Report,2026-06-24T09:34:03.844216Z
c775f29d444a8453a0cc65680d17aa85,F1 reports 35% CO2 reduction ahead of 2030 targets,https://www.autosport.com/f1/news/f1-reports-35-co2-reduction-ahead-of-2030-targets/10830967/,Filip Cleeren,2026-06-17T09:06:39Z,maritime transport,"Formula 1 says it reduced its carbon emissions by 12% in 2025 and by 35% over the past eight years, keeping it on track to achieve a 50% reduction by 2030.F1 set the goal of becoming ""Net Zero"" by 2030, which it claims would be delivered through a 50% reducti…",autosport.com,Unknown,Market Report,2026-06-24T09:34:03.844292Z
04470d04be9b39052f2b20605a11ff09,"Oil prices continue slide amid hopes for peace, opening of Strait of Hormuz",https://www.aljazeera.com/economy/2026/6/17/oil-prices-continue-slide-amid-hopes-for-peace-opening-of-strait-of-hormuz,John Power,2026-06-17T07:44:52Z,maritime transport,"Brent crude drops to lowest price since early March, before signing of framework deal to end US-Israel war on Iran.",Al Jazeera English,Unknown,Market Report,2026-06-24T09:34:03.844320Z
87c33a12cc40ec5f0e7abb0fb9e8e433,PPA president Han Chao visits the School of Naval Architecture and Marine Engineering,https://www.naftemporiki.gr/english/2125216/ppa-president-han-chao-visits-the-school-of-naval-architecture-and-marine-engineering/,Μιχάλης Ματσίγκος,2026-06-17T07:11:12Z,maritime transport,"The School of Naval Architecture and Marine Engineering at the National Technical University of Athens (NTUA) hosted a delegation from Piraeus Port Authority (PPA), led by Chairman Han Chao and…
PPA president Han Chao visits the School of Naval Architecture a…",Naftemporiki.gr,Greece,News,2026-06-24T09:34:03.844366Z
c30ea5eaacb73c9444397015c7774ba0,"Kikilias stresses close links between shipping, society and trade",https://www.naftemporiki.gr/english/2125212/kikilias-stresses-close-links-between-shipping-society-and-trade/,Ελίζα Καραγιώργη,2026-06-17T06:56:31Z,maritime transport,"Greek shipping’s challenges and prospects as well as Greece’s role in the evolving global landscape were at the centre of discussions during a meeting of the Board of Directors of…
Kikilias stresses close links between shipping, society and trade - Η ΝΑΥΤΕΜΠΟ…",Naftemporiki.gr,Greece,News,2026-06-24T09:34:03.844410Z
cb332ecb180fd9e898d5c67c85792bdb,Leaders’ declaration on the fight against drug trafficking,https://www.gov.uk/government/news/leaders-declaration-on-the-fight-against-drug-trafficking,"Prime Minister's Office, 10 Downing Street",2026-06-17T06:26:58Z,maritime transport,Leaders’ declaration on the fight against drug trafficking.,Www.gov.uk,Unknown,News,2026-06-24T09:34:03.844441Z
7135dba75f0d47397ef11e655b50baa5,"New rulebook on how landowners can defend coast from rising seas launched, to be mandatory from 2028",https://www.channelnewsasia.com/singapore/coastal-protection-law-singapore-landowner-requirements-code-practice-pub-6186926,,2026-06-17T05:00:14Z,maritime transport,The introduction of the code of practice comes months after parliament passed laws to hold coastal landowners responsible for implementing coastal protection measures.,CNA,Unknown,News,2026-06-24T09:34:03.844478Z
1922a6008e313e23bc6c7b49888b0a01,Nigeria faces critical ocean governance test ahead of Kenya summit,https://punchng.com/nigeria-faces-critical-ocean-governance-test-ahead-of-kenya-summit/,Punch Newspapers,2026-06-17T00:06:14Z,maritime transport,"Nigeria’s blue economy ambitions face challenges from weak ocean governance, coastal degradation, and climate impacts. Learn what Nigeria must do to achiev

Read More: https://punchng.com/nigeria-faces-critical-ocean-governance-test-ahead-of-kenya-summit/",The Punch,Unknown,News,2026-06-24T09:34:03.844526Z
191b73f673d4b899d9b044331885b1c7,"Pudolla 9"" Men's Hiking Cargo Shorts for $15 + free shipping w/ Prime",https://www.dealnews.com/Pudolla-9-Mens-Hiking-Cargo-Shorts-for-15-free-shipping-w-Prime/21850973.html,,2026-06-23T09:14:36Z,cargo shipping,"Pudolla's hiking cargo shorts come with multiple pockets and a 9"" inseam, which suits people who want functional outdoor shorts without paying a premium price. At $15, that's $13 off the $28 list price. Apply coupon code ""IQ7V55VI"" for a savings of $13. Buy N…",Dealnews.com,Unknown,News,2026-06-24T09:34:04.443307Z
ba672e38fb65d5deb2378071415290b7,Activists Target U.S. Ports Where Weapons Leave for Israel,http://prospect.org/2026/06/23/activists-target-us-ports-weapons-leave-for-israel-palestine-gaza-war-labor-truckers/,Colleen Shaddox,2026-06-23T09:10:00Z,cargo shipping,"A growing series of labor actions seeks to physically disrupt arms shipments and make it harder for military commerce to move forward.
The post Activists Target U.S. Ports Where Weapons Leave for Israel appeared first on The American Prospect.",The American Prospect,USA,News,2026-06-24T09:34:04.443345Z
df4a57b1ecac7bfe1f4f48faad2b2c2d,"U.S. issues sweeping Iran oil sanctions waivers, unlocking billions in revenue for Tehran",https://www.cnbc.com/2026/06/23/us-iran-oil-sanction-relief-strait-of-hormuz-peace-deal-.html,Anniek Bao,2026-06-23T08:10:24Z,cargo shipping,"The U.S. issued a sweeping rollback of sanctions on Iranian oil, offering Tehran an economic lifeline as negotiations toward a peace deal proceed.",CNBC,Unknown,News,2026-06-24T09:34:04.443384Z
3a557153c3aa3c1a48b219fb0107cd00,"Olive oil flavoured with oregano was recovered from clay jars sealed inside a Greek merchant ship that sank in the Aegean roughly 2,400 years ago during the lifetime of Socrates — meaning the salad dressing sitting on a table at your nearest Mediterranean uses roughly the same recipe",https://spacedaily.com/d-olive-oil-flavoured-with-oregano-was-recovered-from-clay-jars-sealed-inside-a-greek-merchant-ship-that-sank-in-the-aegean-roughly-2400-years-ago-during-the-lifetime-of-socrates-meaning-the/,Space Daily Editorial Team,2026-06-23T06:45:48Z,cargo shipping,"The Greek merchant ship that sank off the coast of Chios in approximately the fourth century BC was carrying, by the most likely reconstruction of the events of its final voyage, the standard mixed cargo of a moderately wealthy commercial vessel of the late C…",Space Daily,Greece,Market Report,2026-06-24T09:34:04.443443Z
84c59021cc5555925cf58c13408e7f4f,The Strait of Hormuz's future is unsettled even as more ships venture through,https://economictimes.indiatimes.com/news/international/world-news/the-strait-of-hormuzs-future-is-unsettled-even-as-more-ships-venture-through/articleshow/131926865.cms,AP,2026-06-23T05:55:24Z,cargo shipping,"Ship traffic is slowly resuming in the Strait of Hormuz following an interim deal between Iran and the U.S., but lingering questions about tolls and control threaten lasting peace. Despite Iran's recent declaration of closure, maritime data shows continued pa…",The Times of India,Unknown,News,2026-06-24T09:34:04.443496Z
4c38d41a32c1b44428fca1610553cdbc,Foreign ministry says closely monitoring crew injured in Black Sea drone attack,https://www.hurriyetdailynews.com/foreign-ministry-says-closely-monitoring-crew-injured-in-black-sea-drone-attack-223580,hurriyetdailynews.com,2026-06-23T04:44:05Z,cargo shipping,Türkiye has said it is closely monitoring the condition of two Turkish crew members injured after a Turkish-owned cargo ship was hit by a drone off Ukraine’s Chornomorsk port.,Hurriyet Daily News,Ukraine,News,2026-06-24T09:34:04.443570Z
4d84dd3216b0872464078fe2b395b2f5,"Half-Open, Half-Closed Strait of Hormuz Baffles Oil Markets",https://oilprice.com/Energy/Crude-Oil/Half-Open-Half-Closed-Strait-of-Hormuz-Baffles-Oil-Markets.html,Tsvetana Paraskova,2026-06-22T23:00:00Z,cargo shipping,Oil prices have continued to whipsaw since the U.S. and Iran announced last week signed a deal to make a deal as traffic through the Strait of Hormuz is anything but straight and not expected to normalize within days. Contradictory messaging from Iran and the…,OilPrice.com,Unknown,Market Report,2026-06-24T09:34:04.443633Z
d320919e1ff5f5f4d79aac914c4fdc71,UPS adds 27 cold transfer facilities for pharmaceutical shipping,https://finance.yahoo.com/healthcare/articles/ups-adds-27-cold-transfer-215336161.html,Eric Kulisch,2026-06-22T21:53:36Z,cargo shipping,UPS has invested $48 million in chilled trucking facilities optimized for speed and short-term storage. The post UPS adds 27 cold transfer facilities for pha...,Yahoo Entertainment,Unknown,News,2026-06-24T09:34:04.443794Z
a1a429af8a47174434433c7d2e2ed4f3,DHL Express and Hong Kong-based Designer Eric Wong Reimagine Retired Uniforms for New Line,http://wwd.com/pop-culture/culture-news/dhl-express-hong-kong-designer-eric-wong-old-uniforms-collaboration-1239024235/,Rosemaryfeitelberg,2026-06-22T21:37:23Z,cargo shipping,The door-to-door courier and logistics company is also supporting sustainable-minded designers through the collaboration.,WWD,Unknown,News,2026-06-24T09:34:04.443830Z
0bd9561be48ece79370c240003145624,Inside the quiet insurance racket Iran is running in the Strait of Hormuz — and how it will devastate Western shipping,https://nypost.com/2026/06/22/business/inside-the-quiet-insurance-racket-iran-is-running-in-the-strait-of-hormuz/,James Franey,2026-06-22T21:03:36Z,cargo shipping,"As high-stakes negotiations to end the Iran war continue in Switzerland, the maritime industry’s message to the White House is clear: Don’t allow Iran to formalize its tolling racket over the Strait of Hormuz. Iran wants all commercial shipping vessels to reg…",New York Post,Unknown,News,2026-06-24T09:34:04.443890Z
e24c13022c45579ebacff517e06b4750,Oakley Independence Day Sale: Up to 60% off + free shipping w/ $50,https://www.dealnews.com/Oakley-Independence-Day-Sale-Up-to-60-off-free-shipping-w-50/21849469.html,,2026-06-22T20:20:32Z,cargo shipping,"Click the ""sale"" tab to find apparel and shoes marked up to 60% off, sunglasses marked up to 50% off, prescription lenses marked up to 40% off, and more.  Shipping is free for orders of $50 or more.  We've pictured the Oakley Men's B1B Cargo Hybrid Shorts for…",Dealnews.com,Unknown,News,2026-06-24T09:34:04.443976Z
5b1bcd4a2d95d3738ed392c992d03750,How Did 320kg Of Meth Leave Ghana Undetected?,https://thechronicle.com.gh/how-did-320kg-of-meth-leave-ghana-undetected/,admin,2026-06-22T18:55:16Z,cargo shipping,"News emerging from Australia over the weekend should concern every Ghanaian who cares about the country’s international reputation and national security. According to Marine Insight and the BBC , Australian authorities have intercepted a 320-kilogram shipment…",Thechronicle.com.gh,Australia,Analysis/Opinion,2026-06-24T09:34:04.443991Z
2fef08b314e21cf873aaa3ef5d684568,32 Degrees Prime Deals Sale: Clothing from $3.99!,https://moneysavingmom.com/32-degrees-prime-deals-sale-deal/,Gretchen,2026-06-22T17:10:29Z,cargo shipping,"Wow! Don’t miss these hot deals at 32 Degrees this week! For a limited time, 32 Degrees is having a Prime Deals Sale and you can score huge savings on men’s and women’s clothing! Plus, get free shipping on orders $24 or more when you use promo code SHIP24 at …",Moneysavingmom.com,Unknown,News,2026-06-24T09:34:04.444078Z
5af5dc66ed735b2fae5ffdf37f52ca1b,15-Cu. Ft. Car Rooftop Cargo Carrier for $44 + free shipping,https://www.dealnews.com/15-Cu-Ft-Car-Rooftop-Cargo-Carrier-for-44-free-shipping/21849381.html,,2026-06-22T15:40:55Z,cargo shipping,"At Amazon, get this 15-Cu. Ft. Car Rooftop Cargo Carrier for $44. It's the best price that Amazon has charged for this cargo carrier. The 15 cu. ft. capacity bag is made from 700D PVC fabric with a sealed waterproof zipper and heat-sealed welding, and works w…",Dealnews.com,Unknown,News,2026-06-24T09:34:04.444168Z
9b817e42da3765a85162da19e730c32d,India’s Desh Vibhor in Persian Gulf resumes voyage to Hormuz after U-turn,https://www.bloomberg.com/news/articles/2026-06-19/oil-supertanker-turns-back-on-voyage-out-of-the-persian-gulf,Bloomberg,2026-06-22T14:07:11Z,cargo shipping,"The Shipping Corporation of India’s tanker Desh Vibhor has resumed its journey through the Strait of Hormuz, marking a pivotal moment for global oil trade stability",Bloomberg,India,News,2026-06-24T09:34:04.444193Z
