article_id,title,link,creator,pubdate,category,description,source,country,article_type,scrape_timestamp
d1a4432a9392716b57d3f56b4bd9b34e,"In a world of political tantrums, Türkiye and Russia speak like adults",https://www.rt.com/news/641906-turkiye-russia-hakan-adults/,RT,2026-06-20T16:47:59Z,grain exports,"Hakan Fidan’s Russia trip showed Ankara still sees Moscow as essential to any serious Black Sea, Ukraine and regional security settlement Read Full Article at RT.com",RT,Russia,News,2026-06-24T09:33:58.965255Z
5e80ac0a4e40167c60394482109c40a2,'It's Come To This': Gas Shortages Hit Russia As Ukraine Hits Refineries,https://www.rferl.org/a/russia-gasoline-fuel-crisis-refinery-attacks-ukraine/33784529.html,"RFE/RL's Russian Service, Current Time, Steve Gutterman",2026-06-19T14:19:30Z,grain exports,"Pulling up at a gas station with no fuel for sale, a Russian woman is aghast: “What’s going on in this country?” What’s going on is that in the fifth year of the full-scale invasion, Ukraine is fighting back with strikes on oil refineries, part of a bid to br…",Radio Free Europe/ Radio Liberty,Russia,News,2026-06-24T09:33:58.965287Z
0fa398f0ddbad3b2996dc45db1b7626e,"Facing African hurdles, Indian rice exports value down 10% in FY26",https://www.thehindubusinessline.com/economy/agri-business/facing-african-hurdles-indian-rice-exports-value-down-10-in-fy26/article71122372.ece,Subramani Ra Mancombu,2026-06-19T13:38:47Z,grain exports,"Indian rice exports value declines 10% in FY26 due to African market challenges, despite a 6.5% volume increase.",BusinessLine,India,Market Report,2026-06-24T09:33:58.965302Z
4e2681e86cece36e5717e48d7ad94490,'It's Come To This': Gas Shortages Hit Russia As Ukraine Hits Refineries,https://www.globalsecurity.org/wmd/library/news/ukraine/2026/06/ukraine-260619-rferl02.htm,John Pike,2026-06-19T12:00:00Z,grain exports,"In southeastern Russia, Daniil's motorboat rental business is in trouble. Restrictions on fuel sales mean his fleet in the Rostov and Krasnodar regions is idle, he said in a social media post: ""At every gas station, they tell me to f*** off.""",Globalsecurity.org,Russia,News,2026-06-24T09:33:58.965327Z
acf421a22330894c8942ae659a58b84e,Ample world inventories may soften El Nino food supply shock,https://economictimes.indiatimes.com/news/economy/agriculture/ample-world-inventories-may-soften-el-nino-food-supply-shock/articleshow/131846461.cms,Reuters,2026-06-19T04:11:35Z,grain exports,"A potential super El Niño is expected to disrupt global weather patterns and threaten agricultural output in the coming months, but large existing food inventories and strong harvests in key producing regions may soften the impact.",The Times of India,Global,News,2026-06-24T09:33:58.965370Z
28922184f2910054ce1883553ded0827,"Roto Riteup: June 18, 2026",https://fantasy.fangraphs.com/roto-riteup-june-18-2026/,Vlad Sedler,2026-06-18T07:11:08Z,grain exports,"Roto Riteup time, let's rock!
Source",Fangraphs.com,Unknown,News,2026-06-24T09:33:58.965391Z
aabb61e3d6956fc8793039f1048fbfe8,Farm Equipment Market worth $181.67 billion by 2033 | MarketsandMarkets™,https://www.prnewswire.com/news-releases/farm-equipment-market-worth-181-67-billion-by-2033--marketsandmarkets-302803016.html,,2026-06-17T11:12:00Z,grain exports,"DELRAY BEACH, Fla., June 17, 2026 /PRNewswire/ -- According to MarketsandMarkets™, the Farm Equipment Market is projected to grow from USD 133.48 billion in 2026 to USD 181.67 billion by 2033, at a CAGR of 4.5%. Browse 231 market data Tables and 370 Figures s…",PRNewswire,Unknown,Market Report,2026-06-24T09:33:58.965491Z
432634932adabe889f8bb9ac02656a7b,Nepal’s imports approach Rs 1.9 trillion in 11 months as trade deficit widens,https://english.khabarhub.com/2026/22/555024/,Khabarhub,2026-06-22T09:45:10Z,soybean exports,"KATHMANDU: Nepal imported goods worth nearly Rs 1.9 trillion during the first 11 months of the current fiscal year, according to the latest data released by the Department of Customs on Monday. The department reported that merchandise imports totaled Rs 1.894…",Khabarhub.com,Unknown,Market Report,2026-06-24T09:33:59.351441Z
6436be1a0ca38f6ec335f4a1de7184e4,Japanese natto disgusts and delights the world,https://japantoday.com/category/national/slimy-beans-japanese-natto-disgusts-and-delights-the-world,,2026-06-22T07:35:03Z,soybean exports,"Sticky, translucent strings dangle from Wesley Smith's chopsticks as the American tourist relishes his natto, the loved-and-hated Japanese fermented soybean superfood going global one mouthful at a time. The latest trade statistics show Japan's exports of the…",Japan Today,USA,News,2026-06-24T09:33:59.351479Z
c7a06e3b6462fa2c48199c3335534963,Rural America’s farms are already being crushed by an economic crisis. They now face the risk of a ‘mini-Dust Bowl’ as a rare Super El Niño looms,https://fortune.com/2026/06/21/rural-america-farm-economy-crisis-drought-mini-dust-bowl-super-el-nino/,Jason Ma,2026-06-21T17:48:02Z,soybean exports,AccuWeather warned on Friday that conditions are in place for a multi-year drought that could threaten crop yields and the water supply.,Fortune,USA,News,2026-06-24T09:33:59.351511Z
781c6d163a76543e5809f43672d7c10f,"Ground beef is up 20% since last year. A parasite, a drought and a July 1 trade deadline could push it higher",https://fortune.com/2026/06/21/us-cattle-herd-usmca-beef-prices-screwworm-trump-tariffs/,"Andrew Muhammad, Charles Martinez, The Conversation",2026-06-21T15:14:06Z,soybean exports,The U.S. cattle herd is at its lowest point since the 1950s. Trump's USMCA threat could make the beef price crisis permanent.,Fortune,Unknown,News,2026-06-24T09:33:59.351548Z
74662469fe577186321fc008000a8917,A stock trader’s guide to navigating a rare ‘Super El Niño’,https://fortune.com/2026/06/21/stock-investing-rare-super-el-nino-energy-agriculture-mining-insurance/,Bloomberg,2026-06-21T14:51:11Z,soybean exports,"The impact is already being felt across various regions, from a delayed start to the Indian monsoon to a temporary halt to Peru’s fishing season.",Fortune,India,News,2026-06-24T09:33:59.351573Z
d40eae78c9babcae2cbfa088b2854dd6,"India, US to hold ministerial-level talks on bilateral trade pact this week",https://economictimes.indiatimes.com/news/economy/foreign-trade/india-us-to-hold-ministerial-level-talks-on-bilateral-trade-pact-this-week/articleshow/131889128.cms,PTI,2026-06-21T10:26:25Z,soybean exports,"In a significant development, India and the US are set to conclude the first phase of their trade agreement this week. Commerce Minister Piyush Goyal is scheduled to meet US Trade Representative Jamieson Greer, with discussions geared towards finalizing an in…",The Times of India,India,News,2026-06-24T09:33:59.351603Z
9a6c83aad0a561ec59956f3d8308ff55,"Africa, Asia Increase Food Imports From Russia Amid Looming El Nino Concerns",https://sputnikglobe.com/20260621/africa-asia-increase-food-imports-from-russia-amid-looming-el-nino-concerns-1124338063.html,Sputnik International,2026-06-21T09:21:49Z,soybean exports,"MOSCOW (Sputnik) - Countries across Asia, Africa and the Middle East are increasing imports of Russian food products amid uncertainty surrounding the Strait of Hormuz and concerns over the approaching El Nino climate phenomenon, Russia’s state-owned Rosselkho…",Sputnikglobe.com,Russia,News,2026-06-24T09:33:59.351636Z
cefc718b054318d771311d9e649eb6e8,A stock trader’s guide to navigating rare ‘Super El Niño’,https://economictimes.indiatimes.com/markets/stocks/news/a-stock-traders-guide-to-navigating-a-rare-super-el-nio/articleshow/131886138.cms,Bloomberg,2026-06-21T04:52:30Z,soybean exports,"As fears over the Iran conflict ease, investors are turning their attention to climate risk, with a potential “Super El Niño” emerging as a key market variable. From agriculture and energy to insurance and financials, the weather event could reshape sector ou…",The Times of India,Unknown,Market Report,2026-06-24T09:33:59.351709Z
8a5e5140755462e3cd36e8c4120ab145,Beyond the harvest: Indonesia's quest for lasting food security,https://en.antaranews.com/news/419857/beyond-the-harvest-indonesias-quest-for-lasting-food-security,"Aditya Ramadhan, Tegar Nurfitra",2026-06-20T12:13:23Z,soybean exports,"Seven days into 2026, President Prabowo Subianto announced that Indonesia had officially entered a new era of food security, signaling its self-reliance to ...",Antaranews.com,Indonesia,News,2026-06-24T09:33:59.351739Z
218ed637faabc4ea366fb34b566dd659,India must improve oilseed yields to reduce imports: SEA chief,https://www.thehindubusinessline.com/economy/agri-business/india-must-improve-oilseed-yields-to-reduce-imports-sea-chief/article71112539.ece,BL Mangaluru Bureau,2026-06-17T08:16:55Z,soybean exports,"It should tap the potential of cottonseed oil, ricebran oil, and other alternatives, if it aims to reduce imports in the coming years, says Sanjeev Asthana",BusinessLine,India,News,2026-06-24T09:33:59.351817Z
9cae46b0ecf913d26c87e4920b3efd5d,Iran Says $12 Billion to Be Unfrozen Ahead of Rubio’s Gulf Tour,https://financialpost.com/pmn/business-pmn/iran-says-12-billion-to-be-unfrozen-ahead-of-rubios-gulf-tour,Bloomberg News,2026-06-23T08:54:52Z,wheat exports,"Iran said $12 billion of its frozen funds were set to be released as part of ongoing talks with the US, with the two sides broadly signaling progress in negotiations to formally end their war.",Financial Post,Unknown,News,2026-06-24T09:33:59.762525Z
4862949d94cc5d7c16ac2be202f7653c,US waives Iran sanctions as oil prices drop after progress on talks,https://www.irishtimes.com/world/middle-east/2026/06/23/us-waives-iran-sanctions-as-oil-prices-drop-after-progress-on-talks/,"Humeyra Pamuk, Dave Graham, Nandita Bose",2026-06-23T06:42:57Z,wheat exports,"‘We laid a very good foundation for a successful final deal,’ Vance says",The Irish Times,Unknown,Market Report,2026-06-24T09:33:59.762564Z
5925aba6dcf4c5b7527918f5df7db4b3,Economic Digest: A Snapshot of Nepal’s Business News,https://english.khabarhub.com/2026/23/555123/,Khabarhub,2026-06-23T02:15:04Z,wheat exports,"KATHMANDU: Economic Digest presents a brief yet comprehensive roundup of major business developments in Nepal, delivered in clear and accessible summaries. Nepal’s economy is showing a mixed picture of resilience and structural challenges. While import growth…",Khabarhub.com,Unknown,News,2026-06-24T09:33:59.762639Z
908e4a1242352620e340f05100a7b74e,Optimism after first talks as U.S. waives Iran sanctions and Lebanon fighting abates,https://japantoday.com/category/world/optimism-after-first-talks-as-us-waives-iran-sanctions-and-lebanon-fighting-abates,,2026-06-22T21:27:15Z,wheat exports,"The United States waived sanctions on Iran for 60 days from Monday after the first talks under a nascent peace deal, and officials reported calm in Lebanon after fighting that had prompted Iran to declare the ‌Strait of Hormuz closed. After a weekend that had…",Japan Today,USA,Market Report,2026-06-24T09:33:59.762697Z
ec34405883708ee951a9699c96a5fbb1,"Trump: If Iran doesn’t behave, I’ll do what I have to do",https://www.israelnationalnews.com/news/429040,Elad Benari,2026-06-22T21:08:14Z,wheat exports,"President Trump warns Iran that he will take necessary action if they violate their agreement, while expressing confidence he can resolve disputes over Lebanon with Prime Minister Netanyahu.",Israelnationalnews.com,Unknown,News,2026-06-24T09:33:59.762741Z
a6dcfc6378941b71d4b7a12d1fd023dc,Today’s News in a Nutshell,https://english.khabarhub.com/2026/22/555027/,Khabarhub,2026-06-22T16:15:26Z,wheat exports,"KATHMANDU: Khabarhub brings you a glimpse of major developments of the day in Nepal, including politics, business/economy, sports, entertainment, and more. Arzu Rana Deuba among 18 named as CIAA files major corruption case The Commission for the Investigation…",Khabarhub.com,Unknown,News,2026-06-24T09:33:59.762788Z
715f0ef616884aa89ebcd63294a09c39,US suspends sanctions on Iranian oil until August 21 amid negotiations to end West Asia war,https://economictimes.indiatimes.com/industry/energy/oil-gas/us-suspends-sanctions-on-iranian-oil-until-august-21-amid-negotiations-to-end-west-asia-war/articleshow/131911561.cms,ET Online,2026-06-22T13:51:43Z,wheat exports,"Washington has granted Iran a 60-day waiver on oil sanctions, permitting the nation to produce, export, and sell its crude until August 21. This move, part of an interim deal to de-escalate tensions, offers significant relief to Iran's energy sector. The deci…",The Times of India,Unknown,News,2026-06-24T09:33:59.762842Z
807924401332f41d326512aaeee85fff,US government negotiates ‘classic Trump deal’ in Switzerland to unfreeze Iranian assets for American farmers,https://cryptobriefing.com/us-iran-trump-deal-switzerland-frozen-assets/,Editorial Team,2026-06-22T12:50:50Z,wheat exports,"The deal could reshape US-Iran relations, boost American agriculture, and impact global oil markets, but hinges on complex compliance steps.
The post US government negotiates ‘classic Trump deal’ in Switzerland to unfreeze Iranian assets for American farmers …",Crypto Briefing,USA,Market Report,2026-06-24T09:33:59.762914Z
7d68665383e4432d91415cb77b631a4e,"Indonesia's first 47,250-tonne urea shipment reaches Australia",https://en.antaranews.com/news/419983/indonesias-first-47250-tonne-urea-shipment-reaches-australia,"Indra Arief, Tegar Nurfitra",2026-06-22T08:42:25Z,wheat exports,"State fertilizer producer PT Pupuk Indonesia has begun exporting urea fertilizer to Australia under a government-to-government agreement, with the initial ...",Antaranews.com,Australia,News,2026-06-24T09:33:59.762932Z
8d1513031fe65e05542e66948c7c388f,"India’s agri export promotion shifting to value added products, niche markets",https://www.thehindubusinessline.com/economy/agri-business/indias-agri-export-promotion-shifting-to-value-added-products-niche-markets/article71118168.ece,BL New Delhi Bureau,2026-06-18T15:28:03Z,wheat exports,"India's agri exports are diversifying, focusing on value-added products and niche markets for global competitiveness.",BusinessLine,India,Market Report,2026-06-24T09:33:59.763132Z
2d3712448f7bccca472cb4972f3dcc64,Singapore’s Core Inflation Steady at 1.4% Despite Oil Crunch,https://financialpost.com/pmn/business-pmn/singapores-core-inflation-steady-at-1-4-despite-oil-crunch,Bloomberg News,2026-06-23T09:20:28Z,fertilizer exports,"Singapore’s core inflation rate was unchanged last month, even as the Middle East conflict had pushed up global prices of energy and fertilizer.",Financial Post,Singapore,Market Report,2026-06-24T09:34:00.191915Z
b63641704dfc5e2a5219bb1c65d675f8,US-Iran talks make significant progress in Switzerland; Hormuz channel set up to avert incidents,https://economictimes.indiatimes.com/news/international/world-news/us-iran-talks-make-significant-progress-in-switzerland-hormuz-channel-set-up-to-avert-incidents/articleshow/131918639.cms,Dipanjan Roy Chaudhury,2026-06-22T18:52:10Z,fertilizer exports,"Iran and the US have made significant headway in talks mediated by Qatar, aiming to end a protracted conflict. A new framework is being finalized for technical discussions on Iranian oil exports and reconstruction. Progress includes establishing a mechanism f…",The Times of India,Unknown,News,2026-06-24T09:34:00.191987Z
d9f450ee207d335d89d09257ce132ea3,What the Iran War Taught the World About Food Security,https://www.project-syndicate.org/commentary/iran-war-exposed-global-agriculture-lack-of-resilience-by-maximo-torero-2026-06,Maximo Torero,2026-06-22T12:47:41Z,fertilizer exports,Perhaps the most unsettling lesson from the closure of the Strait of Hormuz is the gap between what we knew and how we prepared. Countries should use whatever easing of immediate pressures occurs to strengthen resilience before the next shock arrives.,Project Syndicate,Unknown,News,2026-06-24T09:34:00.192030Z
6ff753e6842280f41dea2380520af110,"Indonesia in talks with India, Bangladesh on fertilizer exports",https://en.antaranews.com/news/420003/indonesia-in-talks-with-india-bangladesh-on-fertilizer-exports,"Indra Arief, Tegar Nurfitra",2026-06-22T12:11:54Z,fertilizer exports,"Indonesia is in talks with several countries interested in importing its urea fertilizer to secure stocks amid global supply chain disruptions, according to ...",Antaranews.com,India,News,2026-06-24T09:34:00.192052Z
9b99cc9dcd26c3e57e4de25843905573,Links 6/20/2026,https://www.nakedcapitalism.com/2026/06/links-6-20-2026.html,Yves Smith,2026-06-20T10:59:59Z,fertilizer exports,"Our boxy daily links: Skepicism virtues, Trump asks for God to smith him, tanker owners hold back from Hormuz companies hostage to AI costs? compound drought crop harm, China worries over Japan nuclear deterrence, Zelensky threatens Belarus, Cuba rationing co…",Nakedcapitalism.com,China,Market Report,2026-06-24T09:34:00.192286Z
0817883b53a0eb542dbe402469d1b110,Putin Urges ASEAN to Expand Trade in National Currencies at Kazan Summit,https://www.naturalnews.com/2026-06-20-putin-urges-asean-expand-trade-in-national-currencies.html,Coco Somers,2026-06-20T06:00:00Z,fertilizer exports,"Russian President Vladimir Putin on Thursday called for increased trade between Russia and the Association of Southeast Asian Nations (ASEAN) using national currencies, according to remarks made at the conclusion of the two-day Russia-ASEAN summit in Kazan, R…",Naturalnews.com,Russia,News,2026-06-24T09:34:00.192318Z
62b524863a225b6de39edbc0b7a7e24a,How low will gas prices fall?,https://www.thestreet.com/economy/how-low-will-gas-prices-fall,Charley Blaine,2026-06-19T17:47:00Z,fertilizer exports,"Driving into a gas station to fill your car's gas tank is becoming less painful by the day, But not painless. Not yet anyway. Gas prices have fallen below $4...",TheStreet,Unknown,Market Report,2026-06-24T09:34:00.192346Z
18b1324c0b1472eefa71e0be1c4a3cc3,"RBI MPC member Nagesh Kumar flags import dependence, Gulf remittances, El Nino risks in minutes",https://economictimes.indiatimes.com/news/economy/indicators/rbi-mpc-member-nagesh-kumar-flags-import-dependence-gulf-remittances-el-nino-risks-in-minutes/articleshow/131858587.cms,ET Online,2026-06-19T12:07:11Z,fertilizer exports,"India faces significant economic risks from the West Asia conflict, including potential disruptions to oil and fertilizer imports via the Strait of Hormuz and reduced remittances from the Gulf. El Niño-induced monsoon failures also pose a threat to agricultur…",The Times of India,India,News,2026-06-24T09:34:00.192373Z
48a2e9a9dede4c4f4a07c10c3938def4,Senator Cotton warns Iran deal could hand billions to terrorist regime,https://www.israelnationalnews.com/news/428873,Elad Benari,2026-06-19T02:23:19Z,fertilizer exports,"In a Fox News interview, Senator Tom Cotton praises Trump's pressure campaign on Iran, but warns that the new Iran MoU risks squandering vital US leverage.",Israelnationalnews.com,Unknown,Analysis/Opinion,2026-06-24T09:34:00.192402Z
648a2f1bd56370a1ee42bf19bde9b25e,What The U.S.-Iran MOU Really Means For Your Grocery Bill,https://www.forbes.com/sites/phillempert/2026/06/18/what-the-us-iran-mou-really-means-for-your-grocery-bill/,"Phil Lempert, Contributor, 
 Phil Lempert, Contributor
 https://www.forbes.com/sites/phillempert/",2026-06-18T20:30:08Z,fertilizer exports,The U.S.-Iran peace deal won't lower your grocery bill anytime soon. Here's what the MOU really means for food prices and what is missing.,Forbes,Unknown,Market Report,2026-06-24T09:34:00.192430Z
6fb57ad53e59740ba5c915e12c5ef92c,Putin calls for national currency settlements at Asian leaders’ summit,https://www.rt.com/russia/641778-putin-asean-statement/,RT,2026-06-18T13:24:09Z,fertilizer exports,Vladimir Putin has urged Russia and ASEAN nations to increase trade in national currencies and said Moscow would continue supplying the group with food and energy,RT,Russia,News,2026-06-24T09:34:00.192455Z
9ecc9d271141fd8a4a34043e553b79d4,Worst Case Scenario – Rejected,https://dailyreckoning.com/worst-case-scenario-rejected/,Adam Sharp,2026-06-17T22:00:13Z,fertilizer exports,"This post Worst Case Scenario – Rejected appeared first on Daily Reckoning.
An autopsy of the Iran war and energy crisis...
The post Worst Case Scenario – Rejected appeared first on Daily Reckoning.",Dailyreckoning.com,Unknown,Market Report,2026-06-24T09:34:00.192494Z
794b486c90526b1d79ea6652b7ece0b7,Here's how much the the Iran war cost -- and how its effects will linger,https://www.npr.org/2026/06/17/nx-s1-5860739/iran-war-cost-oil-military-trade,Scott Horsley,2026-06-17T21:23:54Z,fertilizer exports,"More than three months after the U.S. and Israel launched their war on Iran, the costs and aftereffects are felt around the world.",NPR,Unknown,News,2026-06-24T09:34:00.192525Z
26a5de5b5c7e93297367ae52d7824494,Texas Beef Industry Profits Eaten Away by Threat of Screwworm,https://www.insurancejournal.com/news/southcentral/2026/06/17/874033.htm,Admin,2026-06-17T07:00:14Z,fertilizer exports,"James Henderson was a teenager in 1971 when he had to treat animals for a type of white maggot that ate livestock from the inside out — the New World screwworm. “It’s a horrible parasite, and it will eat that …",Insurance Journal,Unknown,News,2026-06-24T09:34:00.192612Z
3d38bb5620550f8428802d9fc627ace1,Guinea bans exports of raw gold to boost local refining,https://www.bbc.co.uk/news/articles/cjegydvzpzqo,https://www.facebook.com/bbcnews,2026-06-22T13:41:22Z,bauxite,The prohibition is intended to boost the country's economy by refining gold domestically.,BBC News,Unknown,News,2026-06-24T09:34:00.600237Z
739f400a7b5fc2c5bc10cd37173eb830,High Court quashes planning permission for Aughinish Alumina to extends its waste area,https://www.irishtimes.com/business/2026/06/22/high-court-quashes-planning-permission-for-aughinish-alumina-to-extends-its-waste-area/,,2026-06-22T11:21:05Z,bauxite,An Coimisiún Pleanala had signed off on Russian-owned firm’s proposals previously,The Irish Times,Russia,News,2026-06-24T09:34:00.600262Z
6201c8cc18c56efe1cc80cad1a059c02,High Court quashes green light for Aughinish extension,https://www.rte.ie/news/business/2026/0622/1579674-high-court-quashes-green-light-for-aughinish-extension/,RTÉ News,2026-06-22T10:43:44Z,bauxite,The High Court has quashed a decision by An Coimisiún Pleanála (ACP) which gave the go-ahead to Aughinish Alumina refinery in Co Limerick to extend its Bauxite Residue Waste Area (BDRA) by 8 million cubic metres.,RTE,Unknown,News,2026-06-24T09:34:00.600303Z
1f83ab4371b124dcad7047eafcdfe42c,Dimethylformamide Market Size to Hit USD 4.54 Billion by 2035 as Pharmaceutical and Industrial Demand Expands | SNS Insider,https://www.globenewswire.com/news-release/2026/06/20/3314926/0/en/Dimethylformamide-Market-Size-to-Hit-USD-4-54-Billion-by-2035-as-Pharmaceutical-and-Industrial-Demand-Expands-SNS-Insider.html,SNS Insider pvt ltd,2026-06-20T09:30:00Z,bauxite,"U.S. Market Projected to Reach USD 1.19 Billion by 2035, While Europe Advances Toward USD 0.94 Billion Amid Pharmaceutical Growth and REACH Compliance Requirements U.S. Market Projected to Reach USD 1.19 Billion by 2035, While Europe Advances Toward USD 0.94 …",GlobeNewswire,Unknown,Market Report,2026-06-24T09:34:00.600401Z
f00315151be83936c021b080771a3f7f,Duty tweaking required to boost domestic aluminium-based manufacturing: GTRI,https://www.thehindubusinessline.com/economy/duty-tweaking-required-to-boost-domestic-aluminium-based-manufacturing-gtri/article71117461.ece,PTI,2026-06-18T11:30:14Z,bauxite,"It said that India’s tariff policies have created some major distortions in the aluminium value chain - encouraging metal exports, inflating raw material costs for manufacturers and increasing dependence on imported finished products",BusinessLine,India,News,2026-06-24T09:34:00.600601Z
007a0ec4f7eb961f2e33689ba2bf69be,Duty tweaking required to boost domestic aluminium-based manufacturing: GTRI,https://economictimes.indiatimes.com/industry/indl-goods/svs/metals-mining/duty-tweaking-required-to-boost-domestic-aluminium-based-manufacturing-gtri/articleshow/131827916.cms,PTI,2026-06-18T11:04:27Z,bauxite,India's aluminium sector faces policy distortions. A think tank proposes removing import duties on raw aluminium and adding export duties on the metal. This aims to encourage domestic production of higher-value aluminium products. The goal is to reduce relian…,The Times of India,India,News,2026-06-24T09:34:00.600627Z
57b7e77e8e5a426fd7a2a3ffe8a0d4ab,"Wayne Jobson Joins Tim Levy on Echoes Across Time to Discuss Storytelling, Reggae Legacy, and a Life Behind the Music",https://www.globenewswire.com/news-release/2026/06/18/3313886/0/en/Wayne-Jobson-Joins-Tim-Levy-on-Echoes-Across-Time-to-Discuss-Storytelling-Reggae-Legacy-and-a-Life-Behind-the-Music.html,Echoes Across Time by Tim Levy,2026-06-18T00:42:00Z,bauxite,"On Echoes Across Time, the Grammy-winning producer discusses working with Bob Marley, No Doubt, and Hollywood while revealing the lessons that shaped his extraordinary career. On Echoes Across Time, the Grammy-winning producer discusses working with Bob Marle…",GlobeNewswire,Unknown,News,2026-06-24T09:34:00.600743Z
a370012f22f1c26edccc3ff9263b479e,How downstreaming is rewriting Indonesia's economic destiny,https://en.antaranews.com/news/419479/how-downstreaming-is-rewriting-indonesias-economic-destiny,"Hanni Sofia, Yashinta Difa",2026-06-17T13:55:51Z,bauxite,"For decades, the story of the Indonesian economy followed a predictable, frustrating script.

Deep within the archipelago&rsquo;s soil lay some of the ...",Antaranews.com,Indonesia,News,2026-06-24T09:34:00.600803Z
