article_id,title,link,creator,pubdate,category,description,source,country,article_type,scrape_timestamp
78dd49480a0839c3e7618bfa37e9bcfc,Tracking the sanctioned oil tanker's attempt to escape seizure by the US,https://news.sky.com/story/tracking-the-sanctioned-oil-tankers-attempt-to-escape-seizure-by-the-us-13491637,"Freya Gibson, Annoa Abekah-Mensah, Ben van der Merwe and Lydia Morrish, Data and Forensics",2026-01-07T16:53:00Z,maritime transport,The US-sanctioned Marinera oil tanker undertook multiple efforts to hide its identity before its seizure off the coast of Iceland.,Sky.com,Unknown,News,2026-01-13T12:53:00.314975Z
e27560f67f7d00c63e3fbdab625d0c26,Russia accuses US of ‘outright piracy’ after seizure of Venezuela oil tanker in UK-backed operation,https://www.independent.ie/world-news/north-america/russia-accuses-us-of-outright-piracy-after-seizure-of-venezuela-oil-tanker-in-uk-backed-operation/a59309008.html,Idrees Ali and Phil Stewart,2026-01-07T16:44:00Z,maritime transport,"Russia has described the US seizure of a Russian-flagged oil tanker in the Atlantic was a violation of maritime law, and a senior lawmaker described it as ""outright piracy"".",Independent.ie,Russia,News,2026-01-13T12:53:00.315009Z
bc5889903eab00bc5f0bdd5af4eda1a0,US military breached UN maritime convention – Russia,https://www.rt.com/russia/630704-us-military-maritime-law/,RT,2026-01-07T16:00:07Z,maritime transport,The Russian-flagged vessel was captured in the North Atlantic for alleged “violations of US sanctions” Read Full Article at RT.com,RT,Russia,News,2026-01-13T12:53:00.315041Z
ac3dc4d4db97bb0afd0a8048d863d0b6,US forces seize Venezuela-linked Russian oil tanker in the Atlantic,https://www.independent.ie/world-news/north-america/us-forces-seize-venezuela-linked-russian-oil-tanker-in-the-atlantic/a59309008.html,Idrees Ali and Phil Stewart,2026-01-07T15:46:28Z,maritime transport,"The U.S. seized a Russian-flagged oil tanker that was being shadowed by a Russian submarine on Wednesday, after pursuing it for more than two weeks across the Atlantic as part of Washington's efforts to block Venezuelan oil exports, U.S. officials said.",Independent.ie,Russia,News,2026-01-13T12:53:00.315072Z
1997c787f5bfd5e7f902415011a26cb8,US seizes 2 sanctioned oil tankers linked to Venezuela in North Atlantic and Caribbean,https://www.wpxi.com/news/local/us-seizes-2-sanctioned-oil-tankers-linked-venezuela-north-atlantic-caribbean/Z6L2BC2XXRGDRE3N4MCYWKHHNQ/,Associated Press,2026-01-07T15:30:39Z,maritime transport,"The United States has seized two sanctioned oil tankers linked to Venezuela in back-to-back actions in the North Atlantic and the Caribbean, officials said Wednesday.",WPXI Pittsburgh,USA,News,2026-01-13T12:53:00.315098Z
464e4724bb8d23e30e14b131511b03f3,American commandos seize Venezuelan tanker after two-week chase in area with Russian warships,https://en.protothema.gr/2026/01/07/american-commandos-seize-venezuelan-tanker-after-two-week-chase-in-area-with-russian-warships/,Newsroom,2026-01-07T14:53:33Z,maritime transport,"The oil tanker was sailing under a Russian flag and was seized by US armed forces. The operation came after a two-week pursuit in the Atlantic, amid reports of Russian military presence in the wider area
The post American commandos seize Venezuelan tanker aft…",Protothema.gr,USA,Market Report,2026-01-13T12:53:00.315132Z
7fcaa17a8f42bdeb7f550cd7cd756e06,"German emissions cuts slow, North Sea has warmest year on record",https://www.digitaljournal.com/world/german-emissions-cuts-slow-north-sea-has-warmest-year-on-record/article,AFP,2026-01-07T14:27:32Z,maritime transport,"Germany’s greenhouse gas emission cuts slowed sharply in 2025 as the North Sea experienced its warmest year on record, piling pressure Wednesday on the conservative-led government to boost climate protection efforts. Emissions in Europe’s largest economy fell…",Digital Journal,Germany,News,2026-01-13T12:53:00.315195Z
a30858feb5c9ccca80c5454c2704c8a2,US launches high-stakes operation to seize Venezuela-linked oil tanker after Atlantic pursuit-here's what this means for Russia and global oil,https://economictimes.indiatimes.com/news/international/us/us-launches-high-stakes-operation-to-seize-venezuela-linked-oil-tanker-after-atlantic-pursuit-heres-what-this-means-for-russia-and-global-oil/articleshow/126396195.cms,Global Desk,2026-01-07T14:02:24Z,maritime transport,America is trying to seize a oil tanker linked to Venezuela. The vessel has been tracked across the Atlantic for two weeks. It was previously sanctioned for transporting illicit oil. The tanker evaded US forces near Venezuela last month. This operation could …,The Times of India,USA,News,2026-01-13T12:53:00.315238Z
892eef8e3b977ba67faede25457a9d8f,"US forces board Venezuela-linked sanctioned oil tanker in North Atlantic, US official says",https://www.news4jax.com/news/politics/2026/01/07/us-forces-board-venezuela-linked-sanctioned-oil-tanker-in-north-atlantic-us-official-says/,Konstantin Toropin,2026-01-07T13:56:20Z,maritime transport,President Donald Trump's administration says it's “selectively” removing sanctions to enable the shipping and sale of Venezuelan oil to markets worldwide after it seized two more tankers.,WJXT News4JAX,Global,Market Report,2026-01-13T12:53:00.315289Z
e4cfb59a331b7f7eebc9bdc7a4047e0b,How the Thailand-Cambodia Border Conflict Is Creating Ripple Effects Across Global Manufacturing Supply Chains,https://logisticsviewpoints.com/2026/01/07/how-the-thailand-cambodia-border-conflict-is-creating-ripple-effects-across-global-manufacturing-supply-chains/,Rita Liu,2026-01-07T13:32:21Z,maritime transport,"How the Conflict Disrupted Cross-Border Manufacturing and Logistics The recent escalation of the Thailand-Cambodia border conflict has disrupted a critical land-based supply chain artery in the Indochina Peninsula. The Poipet–Aranyaprathet border crossing, a …",Logisticsviewpoints.com,China,News,2026-01-13T12:53:00.315318Z
165f1e19e14d40e0640df1f81f3d4a78,North Sea sees warmest year on record as German emissions cuts slow,https://www.thelocal.de/20260107/north-sea-sees-warmest-year-on-record-as-german-emissions-cuts-slow,AFP,2026-01-07T13:26:50Z,maritime transport,"Germany’s greenhouse gas emission cuts slowed sharply in 2025 as the North Sea experienced its warmest year on record, piling pressure Wednesday on the conservative-led government to boost climate protection efforts.",The Local Germany,Germany,News,2026-01-13T12:53:00.315368Z
df51bbde620f045d1e3193142703dc53,Transport Ministry announces phased review and modernisation of maritime laws,https://www.thestar.com.my/news/nation/2026/01/07/transport-ministry-announces-phased-review-and-modernisation-of-maritime-laws,The Star Online,2026-01-07T13:26:00Z,maritime transport,"PUTRAJAYA: The Transport Ministry has announced a phased review and modernisation of Malaysia's maritime legislation, with the entire process scheduled for completion by the end of 2026. Read full story",The Star Online,Unknown,Analysis/Opinion,2026-01-13T12:53:00.315403Z
b09ff2a28c902a88957296c7ba7927cb,"U.S. carrying out operation to seize Venezuela-linked oil tanker, sources say",https://www.cbsnews.com/news/us-operation-seize-venezuela-linked-oil-tanker-marinera/,"Eleanor  Watson, James  LaPorta",2026-01-07T13:25:16Z,maritime transport,"The U.S. is carrying out an operation to seize the Marinera, a Venezuela-linked oil tanker formerly known as Bella-1, according to sources.",CBS News,Unknown,News,2026-01-13T12:53:00.315441Z
5ea589b5a57e99e3f603bfc72ef85969,U.S. launches operation to seize Russia-flagged oil tanker linked to Venezuela,https://www.nbcnews.com/world/venezuela/us-seize-russia-flagged-oil-tanker-bella1-marinera-venezuela-rcna252738,"Courtney Kube, Yuliya Talmazan, Caroline Radnofsky, Larissa Gao, Sara Mhaidli, Matthew Mulligan",2026-01-07T13:24:28Z,maritime transport,"The United States launched an operation Wednesday to seize a Russian-flagged oil tanker in the Atlantic, two U.S. officials told NBC News, following a dramatic weekslong chase on the high seas",NBC News,USA,News,2026-01-13T12:53:00.315464Z
b4bb7d76d9008552e9a9b1380bba637f,Customs: Fitburg vessel did not violate sanctions,https://yle.fi/a/74-20202946,,2026-01-07T12:05:04Z,maritime transport,Two Finnish state authorities have concluded that there is no reason to detain the vessel suspected in the New Year's cable incident.,YLE News,Unknown,News,2026-01-13T12:53:00.315502Z
491019ab41717f9d1a7ba4e1ee452480,LISTED: All the new laws coming into force in Sweden at the start of 2026,https://www.thelocal.se/20260107/listed-all-the-new-laws-coming-into-force-in-sweden-at-the-start-of-2026,Richard Orange,2026-01-07T09:31:28Z,maritime transport,"Stricter rules on Swedish for Immigrants (SFI), study grants for Ukrainians, and an electric car subsidy. Here's our complete list of all the new laws coming into force in Sweden at the start of 2026.",The Local Sweden,Ukraine,News,2026-01-13T12:53:00.315528Z
b1ee7ed5ce47a74a08c350a5cb31e1d1,Tanker Pursuit Continues as Russia Reportedly Sends in Submarine,https://theaviationist.com/2026/01/07/tanker-saga-updates/,Kai Greet,2026-01-07T04:41:10Z,maritime transport,"The Marinera continues heading through the Atlantic while watched by ISR aircraft and a USCG cutter.  Meanwhile, special forces personnel train at Fairford, and a U.S. official tells WSJ that a Russian sub is lurking. Footage released to Russian state-owned n…",Theaviationist.com,Russia,Market Report,2026-01-13T12:53:00.315561Z
210616c231266cd9d8800e3c7a67f730,How to explore the tropical side of Japan in Okinawa,https://www.nationalgeographic.com/travel/article/how-to-best-explore-tropical-okinawa-japan,@NatGeoTravel,2026-01-07T00:00:00Z,maritime transport,"With its laid-back seafaring culture and unique wildlife, the Yaeyama archipelago in Japan’s far southern Okinawa prefecture reveals a different side to Japan.",National Geographic,Japan,News,2026-01-13T12:53:00.315592Z
7ad5de33aaf1eef1bc17839fad36f3c6,Family marks Hosa Okunbo’s 68th birthday posthumously,https://punchng.com/family-marks-hosa-okunbos-68th-birthday-posthumously/,Punch Newspapers,2026-01-06T23:20:10Z,maritime transport,"The family of the late Captain Idahosa ‘Hosa’ Okunbo marks his 68th birthday, reflecting on his enduring legacy as a visionary leader and philanthropist.

Read More: https://punchng.com/family-marks-hosa-okunbos-68th-birthday-posthumously/",The Punch,Unknown,News,2026-01-13T12:53:00.315643Z
b5477ef818262276a9762013de4fb8c6,"Archaeologists just found the largest and most advanced Medieval cargo ship ever...At 91 feet long and 300 tons, the Svælget 2 is the largest medieval cog ever found.",https://freerepublic.com/focus/f-chat/4360739/posts,Interesting Engineering,2026-01-06T20:59:30Z,maritime transport,"The Viking Ship Museum in Denmark recently announced an unprecedented discovery in the Øresund Strait: the world’s largest and most advanced medieval cargo ship ever found. Hailed as “a milestone in maritime archaeology,” the discovery occurred while divers w…",Freerepublic.com,Unknown,News,2026-01-13T12:53:00.315721Z
625118a8d3f873fee1a899bd9b3cb351,"US may intercept and seize oil tanker sailing near UK, reports say",https://www.bbc.com/news/articles/c7v0deypjl4o,,2026-01-06T19:47:29Z,maritime transport,US officials have a warrant to seize the Russian-flagged ship accused of breaking sanctions.,BBC News,Russia,Market Report,2026-01-13T12:53:00.315740Z
e570443f3a4582a226bff8f633b983e9,Sustainable Fuel Market Volume to Worth 3.80 Million Tons by 2035,https://www.globenewswire.com/news-release/2026/01/06/3213782/0/en/Sustainable-Fuel-Market-Volume-to-Worth-3-80-Million-Tons-by-2035.html,Precedence Research,2026-01-06T14:46:00Z,maritime transport,"The global sustainable fuel market volume is expected to grow from 1.20 million tons in 2026 to 3.80 million tons in 2035, growing at a CAGR of 14.12% from",GlobeNewswire,Global,Market Report,2026-01-13T12:53:00.315773Z
795f62e882f8eb69b59030e5743581c4,Trump is likely gambling he could get away with Greenland land grab as NATO needs US more than he needs it,https://news.sky.com/story/trump-is-likely-gambling-he-could-get-away-with-greenland-land-grab-as-nato-needs-us-more-than-he-needs-it-13491116,Deborah Haynes,2026-01-06T13:40:00Z,maritime transport,"It is becoming increasingly clear that Donald Trump is serious about taking Greenland from Denmark, a NATO ally, despite warnings that such a move would destroy the alliance.",Sky.com,Unknown,News,2026-01-13T12:53:00.315816Z
de45a36653327384d7affb1c0e6dbfbc,Trump is likely gambling he could get away with Greenland grab as NATO needs US more than he needs it,https://news.sky.com/story/trump-is-likely-gambling-he-could-get-away-with-greenland-grab-as-nato-needs-us-more-than-he-needs-it-13491116,Deborah Haynes,2026-01-06T13:40:00Z,maritime transport,"It is becoming increasingly clear that Donald Trump is serious about taking Greenland from Denmark, a NATO ally, despite warnings that such a move would destroy the alliance.",Sky.com,Unknown,News,2026-01-13T12:53:00.315853Z
0b4c81a35814b2fcf6016d712088fee1,"As the U.S. targets sanctioned Venezuelan oil, more of Russia's growing shadow fleet could be swept up, too",https://www.cbc.ca/news/world/tankers-venezuela-seizure-9.7036919,,2026-01-06T12:51:48Z,maritime transport,"As the U.S. ramps up pressure on ships transporting Venezuelan oil, it also seized a Russian-flagged tanker. Experts predict more seizures in the days ahead.",CBC News,Russia,News,2026-01-13T12:53:00.315878Z
5ad63bb531c8716bafbdaff2183d6ec1,Navy's BRP Alberto Navarette secures northeastern Mindanao coast,https://www.globalsecurity.org/military/library/news/2026/01/mil-260105-pna05.htm,John Pike,2026-01-06T10:15:05Z,maritime transport,"The Philippine Navy (PN) announced Sunday night that one of its patrol vessels, BRP Alberto Navarette (PC-394), conducted a maritime patrol along the northeastern coast of Mindanao from Jan. 2 to 3.",Globalsecurity.org,Unknown,News,2026-01-13T12:53:00.315920Z
a0cd09ef74d730daa936c24937f22680,Containing the Threat of Containerized Missiles,https://warontherocks.com/2026/01/containing-the-threat-of-containerized-missiles/,Zane Tremmel,2026-01-06T08:30:35Z,maritime transport,"In any war over Taiwan, American commanders will face a problem that barely existed a decade ago: China can hide lethal military systems inside standard commercial shipping containers. These “containerized” missile launchers are modern renditions of an old U.…",War on the Rocks,China,News,2026-01-13T12:53:00.315946Z
5b51def0d11e1cb9f974acec6e9de6a0,Fav tech museums – Aresluna,https://aresluna.org/fav-tech-museums/,acb,2026-01-06T05:47:01Z,maritime transport,A photo essay of 20-something best tech museums I’ve been to… and three bad ones,Aresluna.org,Unknown,News,2026-01-13T12:53:00.315981Z
2eebc84dae58789a2bfc86903a03481a,Abbas demands safety enforcement after Yobe boat tragedy,https://punchng.com/abbas-demands-safety-enforcement-after-yobe-boat-tragedy/,Punch Newspapers,2026-01-06T02:38:05Z,maritime transport,"Speaker Abbas mourns victims of the Yobe boat tragedy, calling for stricter safety regulations and enforcement to prevent future waterway accidents.

Read More: https://punchng.com/abbas-demands-safety-enforcement-after-yobe-boat-tragedy/",The Punch,Unknown,News,2026-01-13T12:53:00.316024Z
bf2652c92e56ce00480383df28265052,The Saga of the Bella 1 and the Mysterious U.S. Special Forces Movements,https://theaviationist.com/2026/01/06/the-saga-of-bella-1-and-us-sf-movements/,Kai Greet,2026-01-06T02:17:50Z,maritime transport,"As rumors swirl over the deployment of 160th SOAR aircraft to the UK as the sanctioned tanker Bella 1, or Marinera, approaches the GIUK gap, let’s look at what we do and don’t know about the bizarre situation. While the world watched the U.S. stage an impress…",Theaviationist.com,Unknown,News,2026-01-13T12:53:00.316081Z
0c77f3946c9f5fa2dba84f246050a16c,Trading houses beat US majors to first deals for Venezuelan oil,https://ca.finance.yahoo.com/news/trading-houses-beat-us-majors-115729637.html,"By Dmitry Zhdannikov, Marianna Parraga and Shariq Khan",2026-01-12T11:57:29Z,cargo shipping,"By Dmitry Zhdannikov, Marianna Parraga and Shariq Khan LONDON, Jan 12 (Reuters) - Global oil trading houses have emerged as early winners in the race to...",Yahoo Entertainment,UK,Market Report,2026-01-13T12:53:00.845154Z
d4b80ccfd9ba6b04688d612187e6acbd,"Blue Dart records 14,000 tonnes in a single day as tier-2 cities drive growth",https://www.thehindubusinessline.com/markets/stock-markets/blue-dart-records-14000-tonnes-in-a-single-day-as-tier-2-cities-drive-growth/article70501028.ece,BL Mumbai Bureau,2026-01-12T11:03:46Z,cargo shipping,"Company records 60% surge in shipments from Tier-2 cities, driven by growth of small and medium enterprises in these cities, direct-to-consumer brands, and digital adoption in smaller cities",BusinessLine,Unknown,News,2026-01-13T12:53:00.845506Z
8dd7191a1d8be45d7c3d20c9623440df,"Cold Chain Tracking and Monitoring Market Report 2025-2029: Reducing Food Wastage, Enhancing Supply Chain Efficiency, and Meeting Regulatory Demands Bolster Growth",https://www.globenewswire.com/news-release/2026/01/12/3216620/28124/en/Cold-Chain-Tracking-and-Monitoring-Market-Report-2025-2029-Reducing-Food-Wastage-Enhancing-Supply-Chain-Efficiency-and-Meeting-Regulatory-Demands-Bolster-Growth.html,Research and Markets,2026-01-12T10:04:00Z,cargo shipping,"The Cold Chain Tracking and Monitoring Market offers opportunities through rapid adoption of real-time tracking solutions for refrigerated cargo. Key growth drivers include reducing food wastage, enhancing supply chain efficiency, and meeting regulatory deman…",GlobeNewswire,Unknown,Market Report,2026-01-13T12:53:00.845598Z
321a572a0075cf21fd05fef1c0115a3b,Mode of One Men's Pull-On Cargo Pants for $15 + free shipping w/ $25,https://www.dealnews.com/Mode-of-One-Mens-Pull-On-Cargo-Pants-for-15-free-shipping-w-25/21801789.html,,2026-01-12T02:39:39Z,cargo shipping,Save 75% off the list price. Star Rewards members get free shipping with orders of $25 or more (it's free to join). Pickup is also available. Buy Now at Macy's,Dealnews.com,Unknown,News,2026-01-13T12:53:00.845658Z
b494b09147313fcc22766a3c441ca265,Firm expands terminal operations to South-East,https://punchng.com/firm-expands-terminal-operations-to-south-east/,Punch Newspapers,2026-01-12T01:05:42Z,cargo shipping,"Blue Diamond Group expands its Uzotex Bonded Terminal operations, opening a new facility in Imo State to boost logistics and ease trade in the South-East.

Read More: https://punchng.com/firm-expands-terminal-operations-to-south-east/",The Punch,Unknown,News,2026-01-13T12:53:00.845745Z
15305594c074fd1184b2bbd0938c83d1,"Trump says no more Venezuelan oil or money to go to Cuba, demands ‘deal’",https://www.aljazeera.com/news/2026/1/11/trump-says-no-more-venezuelan-oil-or-money-to-go-to-cuba-and-demands-deal,Al Jazeera Staff,2026-01-11T17:22:04Z,cargo shipping,"Venezuela is Cuba's biggest oil supplier, but no shipments have departed Venezuelan ports since Maduro's abduction.",Al Jazeera English,Unknown,News,2026-01-13T12:53:00.845904Z
53cd5ae94178b6286ab26d42030d6451,Shipping container transformed into unique space-saving home,https://newatlas.com/tiny-houses/teeny-tiny-haus-last-stand-tx/,Adam Williams,2026-01-11T15:03:00Z,cargo shipping,"It's amazing how much mileage architects manage to get from the humble shipping container, with notable designs ranging from large apartment buildings and offices, to tiny houses. This example of the latter skillfully squeezes a comfortable home for two into …",New Atlas,Unknown,News,2026-01-13T12:53:00.845990Z
366a54869ebfed42e2d0056d4fe47957,Ozark Trail Men's Zip-Off Convertible Cargo Pants from $11.43 + Free S&H w/ Walmart+ or on $35+,https://slickdeals.net/f/19083829-ozark-trail-men-s-zip-off-convertible-cargo-pants-from-11-43-free-s-h-w-walmart-or-on-35,niki4h,2026-01-10T20:24:16Z,cargo shipping,"Walmart [walmart.com] has *Ozark Trail Men's Zip-Off Convertible Cargo Pants *(64% Cotton, 33% Nylon, & 3% Spandex) from *$11.43*. Shipping is free w/ Walmart+ (free trial available [walmart.com]) or...",Slickdeals.net,Unknown,News,2026-01-13T12:53:00.846198Z
6c8379488b4abc5e7e1e40db12826be2,Are Authorities Closing In on Olympian Turned Drug Kingpin Ryan Wedding?,http://www.rollingstone.com/culture/culture-features/ryan-wedding-olympic-athlete-drug-dealer-most-wanted-update-1235493974/,Maria Fontoura,2026-01-10T13:00:00Z,cargo shipping,Developments in the hunt for the alleged leader of an international trafficking network — including new murder charges — suggest his days on the run may be numbered,Rolling Stone,Global,News,2026-01-13T12:53:00.846272Z
3fe796b462b0580bce04b16659de2499,"Caspian Sea’s Decline Hits Economy, Infrastructure and Health - The Astana Times",https://astanatimes.com/2026/01/caspian-seas-decline-hits-economy-infrastructure-and-health/,Fatima Kemelova,2026-01-10T05:33:00Z,cargo shipping,"Caspian Sea’s Decline Hits Economy, Infrastructure and Health - The Astana Timesastanatimes.com",Astanatimes.com,Unknown,News,2026-01-13T12:53:00.846340Z
81ce69de16a677edaa86b523d28c9e44,"Baggu's New Year's sale has deals on viral lunch bags, purses, and travel bags we love",https://www.businessinsider.com/guides/deals/baggu-sale-deals-2026-1,insider@insider.com (Jennifer Gonick),2026-01-09T21:23:50Z,cargo shipping,Baggu's thoughtful designs and fun colors and patterns never disappoint. These are the best Baggu deals we found from the brand's current sale.,Business Insider,Unknown,News,2026-01-13T12:53:00.846435Z
688adedde0a714b6ec549d5894e239bf,"Tesla launches ‘Standard’ Model Y Long Range in Europe, and non-Long Range in Canada",http://electrek.co/2026/01/09/tesla-launches-standard-model-y-long-range-in-europe-non-long-range-canada/,Fred Lambert,2026-01-09T18:25:02Z,cargo shipping,"Tesla has launched a new “Standard” Model Y Long Range in Europe and a non-long range version in Canada, bringing another more affordable version of its best-selling electric SUV to these markets.



The simultaneous launch in the two markets separated by an …",Electrek,Unknown,Market Report,2026-01-13T12:53:00.846583Z
7cc6af6d29d40a67717eaa3ff9105df0,US aims to assert its control over Venezuelan oil with tanker seizures and global sales,https://www.pbs.org/newshour/politics/us-aims-to-assert-its-control-over-venezuelan-oil-with-tanker-seizures-and-global-sales,"Konstantin Toropin, Associated Press, Josh Boak, Associated Press, Jill Lawless, Associated Press, Michael Biesecker, Associated Press",2026-01-08T16:58:08Z,cargo shipping,The Trump administration intends to control the distribution of Venezuela's oil products globally following its ouster of President Nicolás Maduro in a surprise nighttime raid.,PBS,Global,News,2026-01-13T12:53:00.846956Z
9257f04b343160522362da46486fe03d,U.S. tanker seizures put pressure on Russian 'shadow fleet' and Putin's economy,https://www.nbcnews.com/world/russia/us-tanker-seizures-russia-shadow-fleet-putin-economy-oil-venezuela-rcna252963,Yuliya Talmazan,2026-01-08T16:30:04Z,cargo shipping,The U.S. seizure of a Russian-flagged oil tanker threatened new pressure on the “shadow fleet” that has helped prop up President Vladimir Putin’s economy,NBC News,Russia,News,2026-01-13T12:53:00.846996Z
fdd8409c3da3c22cc3d940fadf45e6a8,All the tech and gadgets announced at CES 2026,https://slashdot.org/firehose.pl?op=view&amp;id=180548515,feedfeeder,2026-01-08T16:12:09Z,cargo shipping,"It's the first week of a new year and there's no time for the tech world to slowly ease back into things following the holidays. That's because CES 2026 is in full swing, with all manner of companies descending on Las Vegas to reveal their latest innovations …",Slashdot.org,Unknown,News,2026-01-13T12:53:00.847070Z
d2ad6538112f4a115ccdab08509fa26e,How EU Ports Facilitated Billions in Kremlin Gas Revenue,https://oilprice.com/Energy/Natural-Gas/How-EU-Ports-Facilitated-Billions-in-Kremlin-Gas-Revenue.html,Michael Kern,2026-01-08T15:00:00Z,cargo shipping,"Despite the European Union’s public commitment to sever energy ties with Moscow, new data reveals that the bloc’s ports remained the biggest buyer for Russia’s flagship Arctic liquefied natural gas (LNG) project throughout 2025.  An analysis of Kpler vessel-t…",OilPrice.com,Russia,Analysis/Opinion,2026-01-13T12:53:00.847102Z
8aca2ff2f792ef1c37031b473939c000,Show HN: GPT Packer conversational container packing with 3D load plans,https://gptpacker.com/,reverseblade2,2026-01-08T14:07:49Z,cargo shipping,"GPT Packer is a container and pallet packing tool that works through a conversation instead of rigid forms.In real logistics scenarios, users often start with incomplete information (for example, pallet footprint is known but height isn’t). Most tools either …",Gptpacker.com,Unknown,News,2026-01-13T12:53:00.847226Z
3602177510f06563553cdc7ab6c8ca54,Apapa Customs reports N2.93tn revenue in 2025,https://punchng.com/apapa-customs-reports-n2-93tn-revenue-in-2025/,Punch Newspapers,2026-01-07T23:40:28Z,cargo shipping,"Nigeria’s Apapa Customs reports a record-breaking N2.93tn revenue in 2025, a 24.3% increase. Learn about the key drivers behind this significant growth.

Read More: https://punchng.com/apapa-customs-reports-n2-93tn-revenue-in-2025/",The Punch,Unknown,Market Report,2026-01-13T12:53:00.847455Z
