article_id,title,link,creator,pubdate,category,description,source,country,article_type,scrape_timestamp
483fde39fed01e3334c081052e8583f2,Canada Dry Ginger Ale Soda 12-oz. Can 12-Pack + free shipping w/ Prime,https://www.dealnews.com/Canada-Dry-Ginger-Ale-Soda-12-oz-Can-12-Pack-free-shipping-w-Prime/21826756.html,,2026-05-08T09:12:24Z,dry bulk shipping,Amazon is currently offering this Canada Dry Ginger Ale Soda 12-oz. Can 12-Pack for $4.75 via Subscribe & Save. That works out to about 42 cents per can. Prime members receive free shipping. Shop Now at Amazon,Dealnews.com,Unknown,News,2026-05-09T13:22:34.338982Z
392866cbc7c8a0adf317e8c22f674742,"The blue stroll, Adonis, the zen Voridis and Nikos D. (‘I’m away on business…’), Androulakis and the bankers, the shipowners’ new deals",https://en.protothema.gr/2026/05/08/the-blue-stroll-adonis-the-zen-voridis-and-nikos-d-im-away-on-business-androulakis-and-the-bankers-the-shipowners-new-deals/,Newsroom,2026-05-08T09:01:00Z,dry bulk shipping,"The parallel universe of the markets & how Intrum’s capital increase is explained
The post The blue stroll, Adonis, the zen Voridis and Nikos D. (‘I’m away on business…’), Androulakis and the bankers, the shipowners’ new deals appeared first on ProtoThema Eng…",Protothema.gr,Unknown,Market Report,2026-05-09T13:22:34.339218Z
50882e50d8a239bcaee8c7e9d2a7ba0a,Genco Shipping & Trading Limited Issues Statement Regarding Diana’s Unsubstantiated Assertions,https://www.globenewswire.com/news-release/2026/05/08/3290778/37397/en/Genco-Shipping-Trading-Limited-Issues-Statement-Regarding-Diana-s-Unsubstantiated-Assertions.html,Genco Shipping & Trading Limited,2026-05-08T00:23:00Z,dry bulk shipping,"NEW YORK, May 07, 2026 (GLOBE NEWSWIRE) -- Genco Shipping & Trading Limited (NYSE:GNK) (“Genco” or the “Company”), the largest U.S. headquartered drybulk shipowner focused on the global transportation of commodities, issued the following statement:",GlobeNewswire,Global,Market Report,2026-05-09T13:22:34.339318Z
1790955dc8127861db0cfafa15e6f114,Genco Shipping & Trading Limited Files Definitive Proxy Materials and Mails Letter to Shareholders,https://www.globenewswire.com/news-release/2026/05/07/3289749/37397/en/Genco-Shipping-Trading-Limited-Files-Definitive-Proxy-Materials-and-Mails-Letter-to-Shareholders.html,Genco Shipping & Trading Limited,2026-05-07T10:30:00Z,dry bulk shipping,Urges Shareholders to Vote “FOR” the Reelection of Genco’s Highly Qualified and Experienced Board on the WHITE Proxy Card Today – and “WITHHOLD” on Diana’s Nominees,GlobeNewswire,Unknown,Market Report,2026-05-09T13:22:34.339366Z
4945923b91422297ddfd91c273b303e6,Dry-Bulk Shipping Rates Hit Two-Year High on Capesize Demand,https://financialpost.com/pmn/business-pmn/dry-bulk-shipping-rates-hit-two-year-high-on-capesize-demand,Bloomberg News,2026-05-07T04:13:10Z,dry bulk shipping,"A key measure of bulk-shipping rates jumped to the highest level since December 2023, driven by rising demand for Capesize vessels along with tightening supply of ships that haul bulk commodities.",Financial Post,Unknown,Market Report,2026-05-09T13:22:34.339406Z
8d26e4d3c372d092da2f5f3a333f343f,Genco Shipping & Trading Limited Announces Q1 2026 Financial Results,https://www.globenewswire.com/news-release/2026/05/06/3289409/37397/en/Genco-Shipping-Trading-Limited-Announces-Q1-2026-Financial-Results.html,Genco Shipping & Trading Limited,2026-05-06T20:17:00Z,dry bulk shipping,"Declares Dividend of $0.35 per Share for Q1 2026, Marking 133% Increase Year-Over-Year and 27th Consecutive Quarterly Dividend  Expects Significantly...",GlobeNewswire,Unknown,Market Report,2026-05-09T13:22:34.339442Z
f1f1d5634ee134a638e8df3d5200ab3a,Velos Shipping maintains strong growth trajectory; new ascquisition of vessel,https://www.naftemporiki.gr/english/2106842/velos-shipping-maintains-strong-growth-trajectory-new-ascquisition-of-vessel/,Γιάννα Βαρδαλαχάκη,2026-05-06T07:04:18Z,dry bulk shipping,"Velos Shipping continues its steady growth trajectory, expanding its fleet to 20 vessels following a new acquisition in the second-hand market.
According to shipbroking sources, the company controlled by Paschalis…
Velos Shipping maintains strong growth traje…",Naftemporiki.gr,Unknown,Market Report,2026-05-09T13:22:34.339488Z
c4624c18d3f40ee0fb11a73cfbad4b20,Minerva Bunkering Expands West Africa Presence with New Mauritania Operation,https://www.prnewswire.com/news-releases/minerva-bunkering-expands-west-africa-presence-with-new-mauritania-operation-302763531.html,,2026-05-06T07:00:00Z,dry bulk shipping,"GENEVA, May 6, 2026 /PRNewswire/ -- Minerva Bunkering has launched a new bunkering service in Mauritania after being awarded a license by the National Hydrocarbons Commission (CNHY), marking a further step in the company's expansion into West Africa. The new …",PRNewswire,Unknown,News,2026-05-09T13:22:34.339547Z
d1e2817b4a7ec81e53c54d499bbd5629,The Donald Can’t Reopen the Strait,https://original.antiwar.com/david_stockman/2026/05/05/the-donald-cant-reopen-the-strait/,David Stockman,2026-05-06T00:00:10Z,dry bulk shipping,"We noted in Part 1 that when confronted with the failure of 44 days of bombing Iran “back-to-the-stone-age”and, also, thankfully, being reluctant to send American boots into a Gallipoli-scale slaughter on the ground, the Donald turned to his goofy Secy of Tre…",Antiwar.com,USA,News,2026-05-09T13:22:34.339578Z
91c02931a94d518b9a1de58633f736e4,Surveillance on California dairy farms reveals multiple possible sources of H5N1 influenza virus transmission,https://journals.plos.org/plosbiology/article?id=10.1371/journal.pbio.3003761,"A. J. Campbell, Meredith Shephard, Abigail P. Paulos, Matthew D. Pauly, Michelle N. Vu, Chloe Stenkamp-Strahm, Kaitlyn Bushfield, Betsy Hunter-Binns, Orlando Sablon, Emily E. Bendall, William J. Fitzimmons, Kayla Brizuela, Grace E. Quirk, Nirmal Kumar, Brian McCluskey, Nishit Shetty, Linsey C. Marr, Jenna J. Guthmiller, Jefferson J. S. Santos, Scott E. Hensley, Edith S. Marshall, Kevin Abernathy, Adam S. Lauring, Blaine T. Melody, Marlene K. Wolfe, Jason Lombard, Seema S. Lakdawala",2026-05-05T14:00:00Z,dry bulk shipping,"The precise modes of H5N1 transmission between cattle on farms remain unknown. Through surveillance of multiple dairy farms in California, we detected infectious virus in air samples from milking parlors and in farm waste streams. Viral RNA was also found in …",Plos.org,Unknown,News,2026-05-09T13:22:34.339632Z
a6fce879bd867e57b0c0d69542eb4b09,Jetterix Pressure Nozzle Re-Invesitigated In 2026,https://www.globenewswire.com/news-release/2026/05/05/3287564/0/en/Jetterix-Pressure-Nozzle-Re-Invesitigated-In-2026.html,Jetterix,2026-05-05T11:48:00Z,dry bulk shipping,"Los Angeles, CA, May 05, 2026 (GLOBE NEWSWIRE) -- Even in 2026, keeping the exterior of your home clean is one of those tasks that can quickly turn from manageable to frustrating. Over time Driveways accumulate oil stains, patios collect algae and grime, fenc…",GlobeNewswire,Unknown,News,2026-05-09T13:22:34.339679Z
f91ca2ff4f7cccb71120103bef6ec21f,United Overseas Group: Aiming at closer ties with Japan,https://www.naftemporiki.gr/english/2106457/united-overseas-group-aiming-at-closer-ties-with-japan/,Γιάννα Βαρδαλαχάκη,2026-05-05T10:49:48Z,dry bulk shipping,"Japan plays a significant role in United Overseas Group’s (UOG) strategy, as shipowner Peter Georgiopoulos noted in remarks to local media.
Following the acquisition of part of the dry bulk…
United Overseas Group: Aiming at closer ties with Japan - Η ΝΑΥΤΕΜΠΟ…",Naftemporiki.gr,Japan,News,2026-05-09T13:22:34.339713Z
07b623d312b77f731b3baf8bd2aa5167,Genco Shipping & Trading to Review Diana Shipping’s Unsolicited Tender Offer,https://www.globenewswire.com/news-release/2026/05/04/3287035/37397/en/Genco-Shipping-Trading-to-Review-Diana-Shipping-s-Unsolicited-Tender-Offer.html,Genco Shipping & Trading Limited,2026-05-04T17:12:00Z,dry bulk shipping,Offer Price Remains Unchanged from Prior Inadequate Proposal That the Genco Board of Directors Unanimously Rejected  Shareholders Do Not Need to Take...,GlobeNewswire,Unknown,Analysis/Opinion,2026-05-09T13:22:34.339747Z
cd76a1bd0966cb62c24f2a60f83b9553,What to Know About Misoprostol-Only Abortion,http://www.thecut.com/2026/05/how-misoprostol-only-abortion-works-and-what-to-expect.html,Andrea González-Ramírez,2026-05-04T16:30:00Z,dry bulk shipping,"Even if telehealth restrictions for mifepristone are ultimately reinstated, a safe, albeit less effective, medication-abortion option remains available for patients thanks to the second drug in the regimen: misoprostol.",The Cut,Unknown,News,2026-05-09T13:22:34.339786Z
c0f518bf719b17730840cb319fd41554,"Star Bulk Announces Date for the Release of First Quarter Ended March 31, 2026, Results, Conference Call, and Webcast",https://www.globenewswire.com/news-release/2026/05/04/3286919/0/en/Star-Bulk-Announces-Date-for-the-Release-of-First-Quarter-Ended-March-31-2026-Results-Conference-Call-and-Webcast.html,Star Bulk Carriers Corp.,2026-05-04T15:30:00Z,dry bulk shipping,"ATHENS, Greece, May 04, 2026 (GLOBE NEWSWIRE) -- Star Bulk Carriers Corp. (the ""Company"" or ""Star Bulk"") (Nasdaq: SBLK), today announced that it will release its results for the first quarter ended March 31, 2026, after the market closes in New York on Wednes…",GlobeNewswire,Greece,Market Report,2026-05-09T13:22:34.339830Z
26cdca08edcdc3556fbccb69748df712,"The thoughts of K.M., the meetings at M.M. and September 27 as a possible election date, the meetings with MPs and the preliminary investigation that will not take place – Alexis is better at swearing…",https://en.protothema.gr/2026/05/04/the-thoughts-of-k-m-the-meetings-at-m-m-and-september-27-as-a-possible-election-date-the-meetings-with-mps-and-the-preliminary-investigation-that-will-not-take-place-alexis-is-better-at-swearing/,Newsroom,2026-05-04T12:06:00Z,dry bulk shipping,"The revenge of software companies & the US public debt that is rising by $87,000 per second
The post The thoughts of K.M., the meetings at M.M. and September 27 as a possible election date, the meetings with MPs and the preliminary investigation that will not…",Protothema.gr,Unknown,News,2026-05-09T13:22:34.339892Z
d1bd0ddca1cdc3e23a71833021fa576e,Diana Shipping Inc. Launches Tender Offer to Acquire All Outstanding Shares of Genco Shipping & Trading for $23.50 Per Share in Cash,https://www.globenewswire.com/news-release/2026/05/04/3286609/10065/en/Diana-Shipping-Inc-Launches-Tender-Offer-to-Acquire-All-Outstanding-Shares-of-Genco-Shipping-Trading-for-23-50-Per-Share-in-Cash.html,Diana Shipping Inc. c/o Diana Shipping Services S.A.,2026-05-04T11:37:00Z,dry bulk shipping,"Brings Offer Directly to Genco Shareholders After Genco Board's Five-Month Refusal to Engage on Fully Financed, All-Cash Proposals, Denying Shareholders the Opportunity to Realize Meaningful, Immediate Value",GlobeNewswire,Unknown,Market Report,2026-05-09T13:22:34.339931Z
1afcc1372a6cb2ab7f662cceb5574df7,Australia Fuel Crisis May 2026: Supplies Improve to 46 Days of Petrol But Diesel Shortages Persist,https://www.ibtimes.com.au/australia-fuel-crisis-may-2026-supplies-improve-46-days-petrol-diesel-shortages-persist-1868052,Tony Jackson,2026-05-03T04:17:39Z,dry bulk shipping,"SYDNEY — Australia's fuel supply situation showed signs of stabilization Sunday as the nation held about 46 days' worth of petrol reserves amid ongoing global disruptions, though diesel shortages at service stations and elevated prices continued pressuring ho…",Ibtimes.com.au,Australia,Market Report,2026-05-09T13:22:34.339950Z
13426a27d5171b55be13ad97a8435444,SafeCard Claims Evaluated: Cardian The Safe RFID Blocking Card for Instant Personal Wallet Protection,https://www.globenewswire.com/news-release/2026/05/08/3290788/0/en/SafeCard-Claims-Evaluated-Cardian-The-Safe-RFID-Blocking-Card-for-Instant-Personal-Wallet-Protection.html,Cardian,2026-05-08T01:32:00Z,bulk carrier,"RFID skimming concerns evaluated: Cardian The Safe Card's passive blocking design, no-battery wallet fit, and 30-day terms explained....",GlobeNewswire,Unknown,News,2026-05-09T13:22:35.366037Z
d7ef8ee4594fada99c3820678cd40bfc,I Want to Live Like Costco People,https://tastecooking.com/i-want-to-live-like-costco-people/,Jordan Michelman,2026-05-07T15:19:27Z,bulk carrier,Some of us are crying in H Mart; some of us are mourning in Costco.,Tastecooking.com,Unknown,News,2026-05-09T13:22:35.366279Z
f0d514f46a46c06285637ffd8eaf1d1d,Algoma Central Corporation Reports Financial Results for the 2026 First Quarter,https://financialpost.com/pmn/business-wire-news-releases-pmn/algoma-central-corporation-reports-financial-results-for-the-2026-first-quarter,Business Wire,2026-05-07T13:12:12Z,bulk carrier,"Focused fleet growth, strategic opportunities, and built-in adaptability across domestic and international operations drove a resilient first quarter ST. CATHARINES, Ontario — Algoma Central Corporation (TSX: ALC) (“Algoma”, the “Company”) today reported its …",Financial Post,Global,Market Report,2026-05-09T13:22:35.366346Z
560a5b2b3447c234611bde1215709384,Your trusted advocate or your rebellious Frankenstein: how you deploy agentic AI determines which one you get,https://fortune.com/2026/05/07/agentic-ai-customer-proximity-framework-ceos-yale-celi-sonnenfeld/,"Jeffrey Sonnenfeld, Stephen Henriques, Yevheniia Podurets, Jasmine Garry",2026-05-07T12:00:00Z,bulk carrier,Yale's Chief Executive Leadership Institute analyzed agentic AI across 13 industries: the most dangerous decision isn't whether to deploy AI — it's where.,Fortune,Unknown,News,2026-05-09T13:22:35.366392Z
ef20de17e674c562dc5316738caa768f,Greek shipowners: Shipbuilding activity returns to 2007 levels,https://www.naftemporiki.gr/english/2107371/greek-shipowners-shipbuilding-activity-returns-to-2007-levels/,Γιάννα Βαρδαλαχάκη,2026-05-07T05:20:42Z,bulk carrier,"Greek shipowners’ newbuilding orders are moving at levels reminiscent of the pre-crisis boom of 2007, as a remarkable acceleration across all major vessel segments was recorded in the first quarter…
Greek shipowners: Shipbuilding activity returns to 2007 leve…",Naftemporiki.gr,Greece,News,2026-05-09T13:22:35.366438Z
c0ffdc619b76ccf434d04bb91740cfdc,These airlines have cut the most flights this summer as jet fuel prices skyrocket,https://www.businessinsider.com/airlines-cutting-most-flights-summer-chart-graph-spirit-united-2026-5,Pete Syme,2026-05-06T15:35:03Z,bulk carrier,"Over a 10-day period, airlines removed over 75,000 flights from their summer schedules. Spirit Airlines and United Airlines canceled the most flights.",Business Insider,Unknown,Market Report,2026-05-09T13:22:35.366469Z
45d40f4feeab9bd3a767151d5368c2bd,Show HN: KubeRiva OMS – Open-source AI-native order management system,https://github.com/KubeRiva/OMS,kirankls2025,2026-05-06T15:25:01Z,bulk carrier,"Open-source AI-native OMS: multi-tenant, 7 intelligent sourcing strategies, Shopify + Amazon connectors. Self-host what enterprise SaaS charges $200k/year for. - KubeRiva/OMS",Github.com,Unknown,News,2026-05-09T13:22:35.366517Z
09542ad3d53fd8b99ad1a04bf6603dfe,"You may not have flown Spirit Airlines, but your wallet will likely feel its absence",https://thepointsguy.com/news/spirit-airlines-collapse-airfare-impact/,Sean Cudahy,2026-05-06T13:30:04Z,bulk carrier,"Spirit Airlines collapsed over the weekend. Now, concerns are rising about what will happen to airfare in its wake.",The Points Guy,Unknown,News,2026-05-09T13:22:35.366551Z
1e7bbdad9adf243d9dc480955f383b26,Bio-Techne Releases Third Quarter Fiscal 2026 Results,https://www.prnewswire.com/news-releases/bio-techne-releases-third-quarter-fiscal-2026-results-302763516.html,,2026-05-06T10:30:00Z,bulk carrier,"MINNEAPOLIS, May 6, 2026 /PRNewswire/ -- Bio-Techne Corporation (NASDAQ: TECH) today reported its financial results for the third quarter ending March 31, 2026. Third Quarter FY2026 Highlights Reported and organic revenue declined 2% to $311.4M, negatively im…",PRNewswire,Unknown,Market Report,2026-05-09T13:22:35.366594Z
b4d0b9c792ffa6098e560a6194ed6c30,French container ship attacked in Strait of Hormuz,https://www.politico.eu/article/eu-france-container-ship-attacked-strait-of-hormuz/,Martina Sapio,2026-05-06T10:14:59Z,bulk carrier,The strike underscores the fragile security situation in the strait as U.S.-Iran ceasefire wobbles.,POLITICO.eu,Unknown,News,2026-05-09T13:22:35.366623Z
298d376eda7bee92eddb6852c8af186e,Insights into the clustering and reuse of phone numbers in scam emails,https://blog.talosintelligence.com/insights-into-the-clustering-and-reuse-of-phone-numbers-in-scam-emails/,Omid Mirzaei,2026-05-06T10:00:12Z,bulk carrier,"Talos has recently started to collect and gather intelligence around phone numbers within emails as an additional indicator of compromise (IOC). In this blog, we discuss new insights into in-the-wild phone number reuse in scam emails.",Talosintelligence.com,Unknown,Analysis/Opinion,2026-05-09T13:22:35.366659Z
a370105553f2ca7914a5dfccf20f8030,Trump says US to pause operation to escort ships through Strait of Hormuz,https://www.irishtimes.com/world/middle-east/2026/05/06/iran-war-live-strait-of-hormuz-oil-prices-donald-trump/,Katie Mellett,2026-05-06T05:25:34Z,bulk carrier,US president escorts were being halted because ‘great progress’ has been made towards a peace deal with Iran,The Irish Times,Unknown,News,2026-05-09T13:22:35.366694Z
d19acc6657be0291cd4c56f8550a1978,USA Says Iran Ceasefire Still in Place,https://www.rigzone.com/news/wire/usa_says_iran_ceasefire_still_in_place-05-may-2026-183614-article/,"Eltaf Najafizada, Omar Tamo",2026-05-05T14:25:58Z,bulk carrier,The U.S. played down the prospect of a return to active war with Iran.,Rigzone,Unknown,News,2026-05-09T13:22:35.366719Z
aca6c90897de1873b3a96671196428dd,"An orthoflavivirus inhibitor targeting multifunctional NS2A protein, a previously unidentified target",https://journals.plos.org/plospathogens/article?id=10.1371/journal.ppat.1014190,"Doortje Borrenberghs, Kitti Wing Ki Chan, Sven Van Brandt, Steffen Jaensch, Milly Ming Ju Choy, Peggy Geluykens, Asmae El Bouayadi, Dax Lauwers, Pradeep Bist, Bart Stoops, Jeroen Van de Ven, Peter Vermeulen, Sarah Megens, Kim Thys, Daniëlle Peeters, Suzanne J. F. Kaptein, Johan Neyts, Subhash G. Vasudevan, Anil Koul, Olivia Goethals",2026-05-05T14:00:00Z,bulk carrier,"Author summary Orthoflaviviruses, including Dengue, West Nile and ZIKV, cause significant global disease yet lack broadly effective antiviral drugs. To address this unmet need, we used a cell-based high-content screening approach to discover a novel class of …",Plos.org,Global,News,2026-05-09T13:22:35.366770Z
226123d0ae27f5e4b0820b1f7493ece8,Construction of indicator system and comprehensive evaluation of high-quality development of cultural tourism integration in revolutionary base areas,https://journals.plos.org/plosone/article?id=10.1371/journal.pone.0347333,"Ping Li, Chunxiao Xu, Huiting Liang",2026-05-05T14:00:00Z,bulk carrier,Clarifying the conceptual framework of high-quality development in cultural-tourism integration and establishing a corresponding evaluation system suitable for county-level regions in revolutionary base areas are crucial for revitalizing these regions in the …,Plos.org,Unknown,News,2026-05-09T13:22:35.366825Z
96a6e06230547c811ab749f9fe1a7b45,U.S.-Iran ceasefire holds after Hormuz clashes and UAE strikes,https://financialpost.com/news/us-iran-ceasefire-hormuz-clashes-uae-strikes,Bloomberg News,2026-05-05T11:54:38Z,bulk carrier,The fragile U.S.-Iran ceasefire held Tuesday after a day of clashes involving shipping in the Strait of Hormuz. Read more.,Financial Post,Unknown,News,2026-05-09T13:22:35.366856Z
7b963bc173189a327653e6946063f52c,US attempt to open Strait of Hormuz tests ceasefire with Iran,https://apnews.com/article/iran-us-war-ceasefire-negotiations-strait-hormuz-b8a77d16945085e5a5039032a55b3a90,Adam Schreck,2026-05-05T10:19:45Z,bulk carrier,"U.S. President Donald Trump said on Tuesday evening that he has paused the U.S. effort to guide stranded vessels out of the Strait of Hormuz to finalize an Iran deal, but that the American forces’ blockade of the Iranian ports would remain in place. Trump ann…",Associated Press,USA,News,2026-05-09T13:22:35.366889Z
f28943105d13ea02f6e15108399697b9,US and Iran Trade Fire; Secret Service Shoots Man Near White House,https://omny.fm/shows/bloomberg-daybreak/us-and-iran-trade-fire-secret-service-shoots-man-near-white-house,Bloomberg,2026-05-05T09:45:14Z,bulk carrier,"Today's top stories, with context, in just 15 minutes.On today's podcast:1) The fragile US-Iran ceasefire held Tuesday morning after a day of clashes involving shipping in the Strait of Hormuz and missile attacks against the United Arab Emirates. The violence…",Omny.fm,Unknown,Market Report,2026-05-09T13:22:35.366932Z
ffe9bb299e53815a35fc94c9e6da9328,Explosion Rocks South Korean Cargo Ship in Strait of Hormuz,https://oilprice.com/Latest-Energy-News/World-News/Explosion-Rocks-South-Korean-Cargo-Ship-in-Strait-of-Hormuz.html,Tsvetana Paraskova,2026-05-05T09:30:00Z,bulk carrier,"South Korean authorities are investigating the cause of a fire on a vessel in the Strait of Hormuz after an explosion occurred on the Korea-operated cargo ship HMM Namu on Monday.   On Tuesday, South Korea’s presidential office convened a meeting to discuss i…",OilPrice.com,South Korea,News,2026-05-09T13:22:35.366967Z
255857f8daa7775d2bf7364494b0d498,Shipping Freeze Deepens in Strait of Hormuz,https://www.rigzone.com/news/wire/shipping_freeze_deepens_in_strait_of_hormuz-04-may-2026-183604-article/,"Prejula Prem, Julian Lee",2026-05-04T21:00:00Z,bulk carrier,Traffic through the Strait of Hormuz remained largely frozen amid increasing tensions.,Rigzone,Unknown,News,2026-05-09T13:22:35.366996Z
a001815dccd1f87290bfe1b11fb70dac,Trump Says Iran Attacked South Korean Ship in the Strait of Hormuz,https://www.breitbart.com/middle-east/2026/05/04/trump-says-iran-attacked-south-korean-ship-in-the-strait-of-hormuz/,John Hayward,2026-05-04T19:45:02Z,bulk carrier,"A South Korean cargo ship called HMM Namu reported a fire and explosion on Monday near the Strait of Hormuz.
The post Trump Says Iran Attacked South Korean Ship in the Strait of Hormuz appeared first on Breitbart.",Breitbart News,South Korea,Market Report,2026-05-09T13:22:35.367021Z
178a8583d3faa9ff9802b54cbcd3c1ee,Oil rises on signs of heightened tensions in Strait of Hormuz,https://www.thehindubusinessline.com/markets/commodities/oil-rises-on-signs-of-heightened-tensions-in-strait-of-hormuz/article70939850.ece,Bloomberg,2026-05-04T16:32:49Z,bulk carrier,"Brent spiked more than 5% to trade above $114 a barrel, before paring some of the gain as prices fluctuated sharply",BusinessLine,Unknown,Market Report,2026-05-09T13:22:35.367048Z
3afc248d0b36d54a21f812cdbc4acdd9,Trump’s ‘Project Freedom’: Can US navy ‘guide’ stuck ships out of Hormuz?,https://www.aljazeera.com/news/2026/5/4/trumps-project-freedom-can-us-navy-guide-stuck-ships-out-of-hormuz,Caolán Magee,2026-05-04T13:10:17Z,bulk carrier,"Trump says US navy will free up ships stranded in the Gulf, but it remains unclear how the campaign will be implemented.",Al Jazeera English,Unknown,News,2026-05-09T13:22:35.367084Z
a9cea43092b51baa621d7229d693b599,Uncertainty continues over safety in the Strait of Hormuz,https://www.globalsecurity.org/wmd/library/news/iran/2026/05/iran-260504-unnews01.htm,John Pike,2026-05-04T12:00:00Z,bulk carrier,"Amid claims and counter-claims of strikes and confrontations in the crucial Strait of Hormuz between Iran and the United States, UN maritime officials continue to urge vessels to exercise ""maximum caution"".",Globalsecurity.org,USA,News,2026-05-09T13:22:35.367104Z
f4bf82dc69e0274ea3ea3d7b3759b005,"Attack on Greek-owned bulk carrier west of Sirik, Iran",https://en.protothema.gr/2026/05/04/attack-on-greek-owned-bulk-carrier-west-of-sirik-iran/,admin,2026-05-04T10:30:00Z,bulk carrier,"After the incident, the vessel reportedly changed course and is now sailing off Fujairah
The post Attack on Greek-owned bulk carrier west of Sirik, Iran appeared first on ProtoThema English.",Protothema.gr,Greece,Market Report,2026-05-09T13:22:35.367133Z
972be75a7d6e0c79bba8b115cc0f5ec8,World stocks gain as oil prices climb amid new Gulf proposals,https://www.irishtimes.com/business/markets/2026/05/04/world-stocks-gain-as-oil-prices-climb-amid-new-gulf-proposals/,,2026-05-04T10:14:08Z,bulk carrier,Week ahead packed with earnings and economic data,The Irish Times,Unknown,Market Report,2026-05-09T13:22:35.367156Z
bca4c09fc847102cf5bd87304dd80e61,Strait of Hormuz Crisis: US Launches 'Project Freedom' Escorts as Iran Warns of Ceasefire Breach Amid Attacks,https://www.ibtimes.com.au/strait-hormuz-crisis-us-launches-project-freedom-escorts-iran-warns-ceasefire-breach-amid-1868108,Tony Jackson,2026-05-04T06:47:32Z,bulk carrier,"DUBAI, United Arab Emirates — The Strait of Hormuz, the world's most critical oil chokepoint, remained highly volatile Monday as President Donald Trump announced the start of a U.S.-led escort mission dubbed ""Project Freedom"" to guide hundreds of stranded com…",Ibtimes.com.au,Unknown,Market Report,2026-05-09T13:22:35.367202Z
917ff37f89d3057168cd970baa97808c,"Stocks gain in Asia, oil flat amid new Gulf proposals",https://www.thehindubusinessline.com/markets/stock-markets/stocks-gain-in-asia-oil-flat-amid-new-gulf-proposals/article70937345.ece,Reuters,2026-05-04T04:42:30Z,bulk carrier,"Japanese yen suddenly jumped in Asian trading, with the
dollar falling as much as 0.9% ⁠to 155.7 yen before
paring some of the losses",BusinessLine,Japan,Market Report,2026-05-09T13:22:35.367226Z
