article_id,title,link,creator,pubdate,category,description,source,country,article_type,scrape_timestamp
f71398041888bfc0fba9225ec3ac7f25,‘Foreign fleets maintain dominance in Nigeria’s maritime support industry’,https://punchng.com/foreign-fleets-maintain-dominance-in-nigerias-maritime-support-industry/,Punch Newspapers,2026-07-16T00:38:40Z,maritime transport,"Foreign fleets still dominate Nigeria’s maritime support industry, despite being Africa’s largest oil and gas producer. Discover how this impacts the econo

Read More: https://punchng.com/foreign-fleets-maintain-dominance-in-nigerias-maritime-support-industry/",The Punch,Unknown,News,2026-07-21T08:31:55.978313Z
552b41a188391f7ae46e85d9d22e0fe0,Agents seek Maritime Fund support for fleet renewal,https://punchng.com/agents-seek-maritime-fund-support-for-fleet-renewal/,Punch Newspapers,2026-07-16T00:21:15Z,maritime transport,"Licensed customs agents urge President Tinubu to use the Maritime Fund for revolving loans, helping indigenous transporters renew their fleets and replace

Read More: https://punchng.com/agents-seek-maritime-fund-support-for-fleet-renewal/",The Punch,Unknown,News,2026-07-21T08:31:55.978353Z
cb990943acfbc50750429c623973f377,Eno’s aide hails Oron jetty investment in A’Íbom,https://punchng.com/enos-aide-hails-oron-jetty-investment-in-aibom/,Punch Newspapers,2026-07-16T00:05:08Z,maritime transport,"Akwa Ibom’s Oron jetty redevelopment and new luxury ferries will stimulate tourism and unlock investment opportunities, enhancing connectivity and economic

Read More: https://punchng.com/enos-aide-hails-oron-jetty-investment-in-aibom/",The Punch,Unknown,News,2026-07-21T08:31:55.978399Z
6e3a9e5707576f2da2744fa65a72ac8d,Plan to relocate Ibaka Deep Seaport from its natural harbour,https://punchng.com/plan-to-relocate-ibaka-deep-seaport-from-its-natural-harbour/,Punch Newspapers,2026-07-15T23:55:38Z,maritime transport,"Explore the controversial plan to relocate the Ibaka Deep Seaport from its naturally deep harbour in Akwa Ibom, raising concerns among stakeholders. Learn

Read More: https://punchng.com/plan-to-relocate-ibaka-deep-seaport-from-its-natural-harbour/",The Punch,Unknown,News,2026-07-21T08:31:55.978439Z
1728714a5a5fef77664ca78633680d1f,"Wednesday, July 15. Russia’s War On Ukraine: News And Information From Ukraine",https://www.forbes.com/sites/katyasoldak/2026/07/15/wednesday-july-15-russias-war-on-ukraine-news-and-information-from-ukraine/,"Katya Soldak, Forbes Staff, Forbes Ukraine, Contributor, 
 Katya Soldak, Forbes Staff
 https://www.forbes.com/sites/katyasoldak/
 , 
 Forbes Ukraine, Contributor
 https://www.forbes.com/sites/forbes-ukraine/",2026-07-15T23:39:17Z,maritime transport,Dispatches from Ukraine. Day 1603.,Forbes,Russia,News,2026-07-21T08:31:55.978459Z
50d976385268d47561e2dc97672c7ac6,Greece seen opposing Russian LNG transport ban,https://biztoc.com/x/dbf0205c7ff1957c,breakingthenews.net,2026-07-15T23:28:23Z,maritime transport,"Greece rejected a new European Union sanctions package targeting Russian liquefied natural gas (LNG) exports because of concerns over the impact on Greek maritime transportation company Dynagas, which...",Biztoc.com,Russia,News,2026-07-21T08:31:55.978482Z
b5bdf63ced636a5abbb133783563a73a,Why Canada should pay attention to Iridium’s new anti-spoofing navigation chip,https://www.digitaljournal.com/article/why-canada-should-pay-attention-to-iridiums-new-anti-spoofing-navigation-chip/,Dr. Tim Sandle,2026-07-15T20:29:38Z,maritime transport,"Whether the new ASIC becomes widely adopted remains to be seen. However, the launch highlights an important shift occurring across the navigation sector: trusted positioning and timing are moving from being taken-for-granted utilities to recognised elements o…",Digital Journal,Unknown,News,2026-07-21T08:31:55.978532Z
ef385596a1f7821ae931733f0e7fc2a2,White House Weighs Jones Act Waiver Extension As Hormuz Conflict Reignites,https://gcaptain.com/white-house-weighs-jones-act-waiver-extension-as-hormuz-conflict-reignites/,Reuters,2026-07-15T17:11:13Z,maritime transport,"The White House is weighing another extension of waivers allowing foreign ships to transport goods between U.S. ports as renewed conflict with Iran raises concerns about energy prices and supply disruptions, two sources familiar with the discussions said on W…",gcaptain.com,Unknown,Market Report,2026-07-21T08:31:55.978575Z
bf957664648f165d559dd9ac1c5b721d,Russia’s Wartime Support for Iran,https://freerepublic.com/focus/f-chat/4388062/posts,Middle East Institute,2026-07-15T15:53:22Z,maritime transport,"Although Russia has not directly intervened in the US-Israeli war with Iran, the conflict has underscored the nature and extent of its strategic partnership with the Islamic Republic. Moscow has provided Tehran with satellite targeting data for strikes on US …",Freerepublic.com,Russia,News,2026-07-21T08:31:55.978623Z
9d11631d724284178c48b8b04fca252f,Golf Cart Market Accelerates Electric Mobility Adoption Across Commercial Transport | CAGR 5.4% | Persistence Market Research,https://www.prnewswire.com/news-releases/golf-cart-market-accelerates-electric-mobility-adoption-across-commercial-transport--cagr-5-4--persistence-market-research-302826423.html,,2026-07-15T14:15:00Z,maritime transport,"LONDON, July 15, 2026 /PRNewswire/ -- The global golf cart market is growing steadily, expected to be valued at US$ 3.4 billion in 2026 and projected to reach US$ 4.9 billion by 2033, with a CAGR of 5.4% during the forecast period. Growth is supported by the …",PRNewswire,UK,Analysis/Opinion,2026-07-21T08:31:55.978666Z
a9719c4ad710b88425cd35f5f9dd0ce1,Has Labour's Electric Car Grant sparked an increase in EV sales in its first year?,https://www.dailymail.com/money/electriccars/article-15978763/Labours-Electric-Car-Grant-EV-sales.html,Freda Lewis-Stempel,2026-07-15T12:26:31Z,maritime transport,"The grants - which offer car buyers between £1,500 and £3,750 off new EVs under £37,000 - was launched a year ago today. But is the incentive scheme working?",Dailymail.com,Unknown,News,2026-07-21T08:31:55.978702Z
7b5b34e841665f195240ca22eace1682,India and Russia to fast-track Arctic route shipping,https://www.rt.com/india/643082-india-russia-arctic-route/,RT,2026-07-15T10:56:12Z,maritime transport,Russia has authorized Rosatom to sign an agreement with India to expand cooperation on Arctic cargo transport via the Northern Sea Route,RT,India,News,2026-07-21T08:31:55.978719Z
4011fd836d1e1e5a6b6af4d76872eb5f,The Greek shipowners facing the “invisible” risks of Hormuz – The new wartime reality is changing the rules of navigation,https://en.protothema.gr/2026/07/15/the-greek-shipowners-facing-the-invisible-risks-of-hormuz-the-new-wartime-reality-is-changing-the-rules-of-navigation/,Newsroom,2026-07-15T10:15:00Z,maritime transport,"The US–Iran escalation is turning every voyage through the Persian Gulf into a risk-management exercise - IMO warning on the Strait of Hormuz: “Remain extremely dangerous, avoid transits”
The post The Greek shipowners facing the “invisible” risks of Hormuz – …",Protothema.gr,Greece,News,2026-07-21T08:31:55.978768Z
5f23f72f55236c2f855136eaa842cb1e,Climate-resilient ports: India drafts indigenous code for breakwater construction,https://www.livemint.com/industry/infrastructure/climate-resilient-ports-india-breakwater-design-standards-11784092094826.html,Dhirendra Kumar,2026-07-15T06:47:09Z,maritime transport,The proposed code seeks to establish a uniform engineering framework for designing breakwaters while reducing India's dependence on foreign engineering manuals.,Livemint,India,News,2026-07-21T08:31:55.978788Z
084570351961bd21c42c22eda992d95a,"The Middle East at the Crossroads of Global Power, Energy and Nuclear Risk",https://www.lewrockwell.com/2026/07/no_author/the-middle-east-at-the-crossroads-of-global-power-energy-and-nuclear-risk/,No Author,2026-07-15T04:01:00Z,maritime transport,"Some news stories disappear before the coffee gets cold. Others refuse to leave, quietly growing in the background while the public moves on to the next headline. The recent military confrontation involving the United States and Iran belongs to the second cat…",Lewrockwell.com,USA,News,2026-07-21T08:31:55.978815Z
e39440316741ec7454a2205c5541bc9f,"Security Council extends Red Sea mandate, US envoy blasts Iran-backed Houthi attacks",https://www.israelnationalnews.com/news/430176,Israel National News,2026-07-14T23:23:18Z,maritime transport,UN Security Council extends its Red Sea reporting mandate as US Ambassador Mike Waltz warns that UN resolutions face collapse without enforcement against Houthi strikes.,Israelnationalnews.com,Unknown,Market Report,2026-07-21T08:31:55.978849Z
58b8b130fa600d98940c02afd222a62b,U.S. Navy Sea Drones Make Combat Debut in Operations Near Hormuz,https://gcaptain.com/u-s-navy-sea-drones-make-combat-debut-in-operations-near-hormuz/,Mike Schuler,2026-07-14T20:50:28Z,maritime transport,"The U.S. military has employed autonomous maritime systems in combat for the first time, with U.S. Central Command confirming that unmanned surface vessels participated in strikes against Iranian naval infrastructure...",gcaptain.com,Unknown,News,2026-07-21T08:31:55.978888Z
d59ec77fc95beaaee845dc0ef9846e64,"Trump proposes 20% charge on cargo passing through Strait of Hormuz, risking global energy price shock",https://cryptobriefing.com/trump-strait-of-hormuz-cargo-charge/,Editorial Team,2026-07-14T20:07:26Z,maritime transport,"Trump's proposal could destabilize global energy markets, prompting a shift towards alternative energy and straining international relations.
The post Trump proposes 20% charge on cargo passing through Strait of Hormuz, risking global energy price shock appea…",Crypto Briefing,Global,Market Report,2026-07-21T08:31:55.978930Z
a2936da3f1dce3312834612d71b38e7d,Emergency UN Security Council meeting on Iranian flights to Yemen – Call for de-escalation,https://en.protothema.gr/2026/07/14/emergency-un-security-council-meeting-on-iranian-flights-to-yemen-call-for-de-escalation/,admin,2026-07-14T19:32:07Z,maritime transport,"Athens calls for full respect for Yemen’s sovereignty and airspace – The UN Security Council extends the reporting requirement on Houthi attacks in the Red Sea – Greece and the United States jointly drafted the resolution
The post Emergency UN Security Counci…",Protothema.gr,USA,Market Report,2026-07-21T08:31:55.978960Z
ffae6d5234bccd496b7b314937e84bf4,Iran threatens to halt Gulf oil exports amid US military presence,https://cryptobriefing.com/iran-threatens-to-halt-gulf-oil-exports-amid-us-military-presence/,Estefano Gomez,2026-07-14T18:53:43Z,maritime transport,"Heightened geopolitical tensions could lead to significant disruptions in global oil supply, impacting crude prices and market stability.
The post Iran threatens to halt Gulf oil exports amid US military presence appeared first on Crypto Briefing.",Crypto Briefing,Global,Market Report,2026-07-21T08:31:55.978996Z
56b6e1db3adf15e8f821bf8ca32ce199,Belgium Places First Order of Polaris MRZR D Tactical Off-Road Vehicles Through NATO Contract,https://soldiersystems.net/2026/07/14/belgium-places-first-order-of-polaris-mrzr-d-tactical-off-road-vehicles-through-nato-contract/,Eric G,2026-07-14T18:00:00Z,maritime transport,"MINNEAPOLIS – July 13, 2026 – Polaris Government and Defense, a division of Polaris Inc. (NYSE: PII), has secured an order for MRZR D4 vehicles from the Belgium Ministry of Defence, leveraging the NATO Support and Procurement Agency (NSPA) framework contract.…",Soldiersystems.net,Unknown,News,2026-07-21T08:31:55.979043Z
c938abdd1387a0e20ed62996366d93c2,World-first: Sea drone deploys gun-mounted robot in amphibious military attack,https://freerepublic.com/focus/f-news/4387930/posts,Interesting Engineering,2026-07-14T17:19:52Z,maritime transport,"Ukraine has carried out what it described as the first known fully robotic amphibious assault, using a naval drone to transport an armed ground robot into Russian-occupied territory. The operation was announced on Monday by Ukraine’s 123rd Separate Territoria…",Freerepublic.com,Russia,News,2026-07-21T08:31:55.979076Z
4b42b4626c448c65a9b15dd27be0145f,"Refiners, Not Consumers, Are Biggest Winners From Jones Act Waiver, OSG CEO Says",https://gcaptain.com/refiners-not-consumers-are-biggest-winners-from-jones-act-waiver-osg-ceo-says/,Mike Schuler,2026-07-14T17:01:01Z,maritime transport,"The Trump administration’s emergency Jones Act waiver has delivered a windfall to U.S. refiners while doing little to lower fuel prices for consumers, according to a new analysis from the...",gcaptain.com,Unknown,Analysis/Opinion,2026-07-21T08:31:55.979111Z
9a587608a3cccc925236a89b75691b9c,Red Sea Shipping Faces Renewed Risk as Iran Signals Pressure Beyond Hormuz,https://gcaptain.com/red-sea-shipping-faces-renewed-risk-as-iran-signals-pressure-beyond-hormuz/,Reuters,2026-07-14T15:38:01Z,maritime transport,"By Samia Nakhoul BEIRUT, July 14 (Reuters) – Having choked off shipping through the Strait of Hormuz, Iran is now signaling it could play its most dangerous card yet: using Yemen’s Houthi...",gcaptain.com,Unknown,News,2026-07-21T08:31:55.979151Z
3c6a57691fa14e2bb5e751b4650613b8,"[Latest] Point-Of-Care Molecular Diagnostics Market to Grow Rapidly, Hitting US$ 17.94 Bn by 2034 at 8.70% CAGR, due to Growing Clinical Need for Rapid, Decentralized Genetic Testing for Infectious Disease Decisions, says ZMR",https://www.globenewswire.com/news-release/2026/07/14/3327124/0/en/Latest-Point-Of-Care-Molecular-Diagnostics-Market-to-Grow-Rapidly-Hitting-US-17-94-Bn-by-2034-at-8-70-CAGR-due-to-Growing-Clinical-Need-for-Rapid-Decentralized-Genetic-Testing-for-.html,Zion Market Research,2026-07-14T15:32:00Z,maritime transport,"Point-of-care molecular diagnostics market size is projected to reach USD 17.94 Bn by 2034 from its value of USD 8.46 billion in 2024, at a CAGR of 8.70%...",GlobeNewswire,Unknown,Market Report,2026-07-21T08:31:55.979189Z
b892c69808898dbff995954196e62fe1,"Trump announces US blockade on Iranian shipping, replaces tariff with investment deals",https://cryptobriefing.com/trump-announces-us-blockade-on-iranian-shipping-replaces-tariff-with-investment/,Estefano Gomez,2026-07-14T15:20:39Z,maritime transport,"The US blockade on Iranian shipping may escalate regional tensions, impacting global oil markets and influencing diplomatic relations.
The post Trump announces US blockade on Iranian shipping, replaces tariff with investment deals appeared first on Crypto Bri…",Crypto Briefing,Global,Market Report,2026-07-21T08:31:55.979233Z
76f2c3987500e2ee2c319d813417e696,TOTE Wins $2.2 Billion Contract to Manage U.S. Navy Medium Landing Ship Program,https://gcaptain.com/tote-wins-2-2-billion-contract-to-manage-u-s-navy-medium-landing-ship-program/,Mike Schuler,2026-07-14T14:19:00Z,maritime transport,"TOTE Services has been selected to oversee construction of the U.S. Navy and Marine Corps’ new Medium Landing Ship (LSM) fleet under a contract valued at up to $2.2 billion,...",gcaptain.com,Unknown,News,2026-07-21T08:31:55.979294Z
03e6b06835319d15304f585c35ff1e1e,Russian Forces Begin Isolating Ukrainian Maritime Logistics and Southern Supply Routes - Expert,https://sputnikglobe.com/20260714/russian-forces-begin-isolating-ukrainian-maritime-logistics-and-southern-supply-routes---expert-1124443944.html,Sputnik International,2026-07-14T12:49:25Z,maritime transport,"Building on the strategy successfully tested during the capture of Konstantinovka, Russian forces are now isolating the Odessa region - using drone and missile strikes to cut off fuel and military supplies to the front, military expert and retired colonel Ana…",Sputnikglobe.com,Russia,News,2026-07-21T08:31:55.979326Z
087a76af7170b75b5e5a626022ee7262,That one time Israel tried to help Gaza,https://www.israelnationalnews.com/news/430144,Sheri Oz,2026-07-14T12:39:36Z,maritime transport,"How the Gazans never missed an opportunity to miss an opportunity. And how the “open-air prison"" fiction leaves out the crucial facts about an opportunity for Gaza's normalization that Israel wished to implement but that Gazans did not allow to come to fruiti…",Israelnationalnews.com,Unknown,News,2026-07-21T08:31:55.979372Z
d87d78099335c25b0f4208d85d19112f,Joint Navy and Fisheries operation targets fishery compliance from the Far North to the East Cape,https://www.globalsecurity.org/military/library/news/2026/07/mil-260714-nzdf01.htm,John Pike,2026-07-14T12:00:00Z,maritime transport,A joint fisheries operation across a significant area of ocean from Cape Reinga to the East Cape has shown New Zealand-based commercial fishing operators are largely following the rules.,Globalsecurity.org,Unknown,News,2026-07-21T08:31:55.979410Z
ab8a51cd9d37627102faa33fb9f08220,Bombardier Defense to provide the Global 6500 aircraft for a second special mission program in South Korea,https://www.globenewswire.com/news-release/2026/07/14/3326731/0/en/Bombardier-Defense-to-provide-the-Global-6500-aircraft-for-a-second-special-mission-program-in-South-Korea.html,Bombardier Inc.,2026-07-14T11:30:00Z,maritime transport,"MONTREAL, July 14, 2026 (GLOBE NEWSWIRE) -- Bombardier Defense is proud to announce that its Global 6500 aircraft will support South Korea’s Electronic Warfare (EW) program. The Global 6500 aircraft was already selected to be the platform for the country’s Ai…",GlobeNewswire,South Korea,News,2026-07-21T08:31:55.979446Z
a450c9d3b25588fb488ee138ad0dde14,Seanergy Maritime’s bond begins trading on Euronext Athens after raising 95.6 million euros,https://www.naftemporiki.gr/english/2137443/seanergy-maritimes-bond-begins-trading-on-euronext-athens-after-raising-95-6-million-euros/,Μιχάλης Ματσίγκος,2026-07-14T11:12:21Z,maritime transport,"Seanergy Maritime Holdings’ corporate bond began trading on Euronext Athens on Tuesday, with Chairman and Chief Executive Officer Stamatis Tsantanis ringing the traditional opening bell ceremony.
The Greek shipping company…
Seanergy Maritime’s bond begins tra…",Naftemporiki.gr,Greece,Market Report,2026-07-21T08:31:55.979489Z
9d3323880edcb6577535abd1b90fb4ad,Safe removal of masts from historic WWII shipwreck carrying wartime explosives begins,https://www.gov.uk/government/news/safe-removal-of-masts-from-historic-wwii-shipwreck-carrying-wartime-explosives-begins,Department for Transport,2026-07-14T10:24:26Z,maritime transport,The operation involves constructing an underwater platform to allow specialist maritime engineers to safely cut the 3 masts of the shipwreck.,Www.gov.uk,Unknown,News,2026-07-21T08:31:55.979522Z
faff21d6ee03d4a4641004a5be85edb9,"Moment giant 'tsunami cloud' slams into French beach with sudden howling gale sending tourists running for their lives - as Europe records 10,000 heatwave deaths",https://www.dailymail.com/news/article-15975721/Moment-giant-tsunami-cloud-slams-French-beach-sudden-howling-gale-sending-tourists-running-lives-Europe-records-10-000-heatwave-deaths.html,Imogen Garfinkel,2026-07-14T09:06:08Z,maritime transport,"This is the terrifying moment a freak wall of cloud slammed into a French beach, with a sudden howling gale sending tourists running for their lives.",Dailymail.com,Unknown,News,2026-07-21T08:31:55.979561Z
052768e7cbe559fc5b632aa4d84dd899,Masts to be removed from bomb-laden shipwreck,https://www.bbc.com/news/articles/c5yz1e3gv40o?xtor=AL-72-%5Bpartner%5D-%5Byahoo.north.america%5D-%5Bheadline%5D-%5Bnews%5D-%5Bbizdev%5D-%5Bisapi%5D,Phil Harrison - in Sheerness; Tanya Gupta - South East,2026-07-14T09:05:40Z,maritime transport,"Engineers will begin a £9.5m operation on the WW2 wreck which holds 1,400 tonnes of explosives.",BBC News,Unknown,News,2026-07-21T08:31:55.979604Z
6571e91367ee46417d6a2713665d4b3a,Lula condemns US-Iran Hormuz toll scheme as ‘piracy’ amid 2026 crisis,https://cryptobriefing.com/lula-condemns-us-iran-hormuz-toll-scheme-as-piracy-amid-2026-crisis/,Estefano Gomez,2026-07-14T08:46:55Z,maritime transport,"Lula's stance may intensify geopolitical tensions, influencing Iran's toll decisions and impacting global oil transport and market dynamics.
The post Lula condemns US-Iran Hormuz toll scheme as ‘piracy’ amid 2026 crisis appeared first on Crypto Briefing.",Crypto Briefing,Global,Market Report,2026-07-21T08:31:55.979648Z
348deb063f71fa6354e87c7855a6be66,Container cargo shipping service between India and Sri Lanka in September,https://english.gossiplankanews.com/2026/07/container-cargo-shipping-service.html,noreply@blogger.com (Unknown),2026-07-14T08:35:29Z,maritime transport,A new container shipping service connecting Karaikal in India and Kankesanthurai (KKS) as well as Trincomalee in Sri Lanka is scheduled to commence in late August or early September 2026. IndSri Ferry Services Lanka Pvt.Ltd. will act as the Sri Lankan agent f…,Gossiplankanews.com,India,News,2026-07-21T08:31:55.979679Z
bce12ba7604d0a83ce3d8f6b963a96d7,RI and Saudi Arabia expand cooperation in transport sector,https://en.antaranews.com/news/422585/ri-and-saudi-arabia-expand-cooperation-in-transport-sector,"Harianto, Kenzu",2026-07-14T05:08:56Z,maritime transport,"Indonesia and Saudi Arabia are committed to expand their cooperation in the transport sector by strengthening their partnership in the fields of aviation, ...",Antaranews.com,Indonesia,News,2026-07-21T08:31:55.979705Z
61daccd8894aad5f39fa4503209efb78,Yemen on high alert after strike blocks Iran flight,https://economictimes.indiatimes.com/news/international/global-trends/yemen-on-high-alert-after-strike-blocks-iran-flight/articleshow/132378907.cms,ANI,2026-07-14T02:11:20Z,maritime transport,Yemen's government has heightened military readiness following an airport incident. The Houthis reportedly disabled the runway to prevent an unauthorized Iranian flight. Yemen's president accused the Houthis of undermining peace and stability efforts. Regiona…,The Times of India,Unknown,Market Report,2026-07-21T08:31:55.979751Z
43e95aae9e4fab8006327081d8088b3b,Gas prices hit $4 again after oil soars more than 15% in a week,https://www.nbcnews.com/business/energy/gas-prices-hit-4-dollars-renewed-iran-russia-tensions-rcna588055,Steve Kopack,2026-07-20T07:47:10Z,cargo shipping,The national average price for regular gasoline hit $4 per gallon again Monday as the renewed conflict with Iran and Ukraine-Russia attacks rattle energy markets.,NBC News,Russia,Market Report,2026-07-21T08:31:56.528414Z
4b1abded0972435cb9ddcca3af2440c0,"India-UK trade deal: More British brands are coming to India, but here's why your shopping bill may not fall anytime soon",https://economictimes.indiatimes.com/industry/cons-products/fmcg/india-uk-trade-deal-more-british-brands-are-coming-to-india-but-heres-why-your-shopping-bill-may-not-fall-anytime-soon/articleshow/132508053.cms,ET Online,2026-07-20T06:38:54Z,cargo shipping,"India-UK CETA is expected to bring more British brands to India, though immediate price cuts remain unlikely due to a weaker rupee and higher shipping costs. Some brands, including Lush, have paused planned price hikes and introduced selective discounts, whil…",The Times of India,India,News,2026-07-21T08:31:56.528662Z
8af787349af899c0ca1bdfdce9a62788,"Few tankers enter Hormuz to load oil as US-Iran conflict intensifies, LNG floating storage rises",https://www.thehindubusinessline.com/news/world/few-tankers-enter-hormuz-to-load-oil-as-us-iran-conflict-intensifies-lng-floating-storage-rises/article71243682.ece,Reuters,2026-07-20T02:38:13Z,cargo shipping,"The number of ships transiting the Strait of ⁠Hormuz stayed low during the weekend as the United States and Iran intensified attacks in the Middle East, shipping data showed on Monday.",BusinessLine,USA,News,2026-07-21T08:31:56.528759Z
4742e296ef2e47ecd83fb2686fbda490,Baby Trend Navigator PRO 2-In-1 Stroller Wagon For $120 Shipped From Amazon After $110 Price Drop!,https://www.dansdeals.com/shopping-deals/amazon/baby-trend-navigator-pro-2-in-1-stroller-wagon-for-120-shipped-from-amazon-after-110-price-drop/,JJ,2026-07-19T13:01:56Z,cargo shipping,Baby Trend Navigator PRO 2-In-1 Stroller Wagon For $120 Shipped From Amazon This was selling for $239.99 yesterday and is now the lowest price ever from Amazon. Super large cargo space with built-in seating for two and includes two 3-point safety harness belt…,Dansdeals.com,Unknown,News,2026-07-21T08:31:56.528987Z
28f29ecf2287c2a72b38c5c2af9859fe,Strait of Hormuz Update: US Blockade Holds as Renewed Fighting Sends Oil Prices Surging Sharply This Week,https://www.ibtimes.com.au/us-iran-ceasefire-collapse-strait-hormuz-crisis-1872556,Anthony Will,2026-07-19T10:21:57Z,cargo shipping,"The collapse of a US-Iran ceasefire has reignited conflict in the Strait of Hormuz, disrupting global oil markets and maritime traffic as both nations resume military actions.",Ibtimes.com.au,Global,Market Report,2026-07-21T08:31:56.529021Z
dec1664096f54ff683cb08316fe37498,"UP Police Constable result 2026 likely by July-end as DV, PST schedule draws closer",https://timesofindia.indiatimes.com/education/news/up-police-constable-result-2026-likely-by-july-end-as-dv-pst-schedule-draws-closer/articleshow/132492090.cms,TOI Education,2026-07-19T09:08:44Z,cargo shipping,"The UP Police Constable written examination result is expected to be announced in the last week of July 2026, ahead of the Document Verification and Physical Standard Test scheduled to begin around August 17. The recruitment drive aims to fill 32,679 vacancie…",The Times of India,Unknown,News,2026-07-21T08:31:56.529068Z
