article_id,title,link,creator,pubdate,category,description,source,country,article_type,scrape_timestamp
471f9eff4458b64a1e638952ab07aad3,The Global Power Sector Faces a Reckoning in 2026,https://oilprice.com/Energy/Energy-General/The-Global-Power-Sector-Faces-a-Reckoning-in-2026.html,OilPrice.com,2026-02-03T17:00:00Z,coal demand,"The global power sector is at a turning point in 2026. Electricity demand growth continues to accelerate, driven by an electrification push across all sectors and booming demand from data centers and transportation. At the same time, renewable energy capacity…",OilPrice.com,Global,News,2026-02-07T18:38:41.638588Z
b2f2906edbd08ccf8bc1b4628df167fe,India has secured a better trade deal with the US than competitors: Goyal,https://www.thehindubusinessline.com/economy/india-has-secured-a-better-trade-deal-with-the-us-than-competitors-goyal/article70588533.ece,Amiti Sen,2026-02-03T16:03:55Z,coal demand,"India secures a favorable trade deal with the US, reducing tariffs to 18%, boosting exporters and stock market confidence.",BusinessLine,India,Market Report,2026-02-07T18:38:41.638602Z
a2aca7d660b29868eba8c284dfddfddd,"Politics, Not Barrels, Are Driving Oil Again",https://finance.yahoo.com/news/politics-not-barrels-driving-oil-154000680.html,Tom Kool,2026-02-03T15:40:00Z,coal demand,"Oil markets remain hostage to Trump-driven uncertainty, as mixed signals on India’s stance toward Russian crude reach the market.",Yahoo Entertainment,India,Market Report,2026-02-07T18:38:41.638618Z
32e99cd84bd62eeacdcc26f6d222e1d9,"Politics, Not Barrels, Are Driving Oil Again",https://oilprice.com/Energy/Energy-General/Politics-Not-Barrels-Are-Driving-Oil-Again.html,Tom Kool,2026-02-03T15:40:00Z,coal demand,"Oil markets remain hostage to Trump-driven uncertainty, as mixed signals on India’s stance toward Russian crude collide with renewed speculation around U.S.–Iran nuclear talks. Could Oil Be Back in Vogue? - 2026 was dubbed the year of oversupply, however Janu…",OilPrice.com,India,Market Report,2026-02-07T18:38:41.638636Z
ecaadc5ab653f97216d4f6846b6f2224,"As rooftop solar overtakes coal, more batteries are powering the night shift",https://www.smh.com.au/business/the-economy/as-rooftop-solar-overtakes-coal-more-batteries-are-powering-the-night-shift-20260203-p5nz40.html,Nick Toscano,2026-02-03T13:33:47Z,coal demand,"Australia’s love affair with home-grown renewable energy is driving booming battery sales, and it’s reshaping the electricity grid.",The Sydney Morning Herald,Australia,News,2026-02-07T18:38:41.638655Z
292ec05dccee4197f1392714046bec0c,Subsidies the fuel as household battery demand 'straps on a rocket',https://www.abc.net.au/news/2026-02-04/subsidies-the-fuel-as-battery-demand-straps-on-a-rocket/106300776,Daniel Mercer and Isabel Moussalli,2026-02-03T13:29:51Z,coal demand,"Even as Australia appears to have passed the peak of solar uptake, demand for batteries is seemingly headed into orbit.",ABC News (AU),Australia,News,2026-02-07T18:38:41.638670Z
c8717d46370320b765715a41dba06511,India's oil shake-up: Can Venezuela really replace Russia?,https://www.dw.com/en/indias-oil-shake-up-can-venezuela-really-replace-russia/a-75778325,Nik Martin,2026-02-03T13:22:00Z,coal demand,Donald Trump says India has agreed to replace Russian oil with US supplies — and maybe even Venezuela. DW asks whether the Latin American producer can realistically meet New Delhi's needs.,DW (English),India,News,2026-02-07T18:38:41.638690Z
9a98464b8fc5f340e604b22b4e323e71,Power On: What PA's Battle Over Energy Industry Can Teach,https://www.realclearinvestigations.com/articles/2026/02/03/power_on_what_pas_battle_over_climate_change_can_teach_the_nation_1162501.html,"Oliver Bateman, RCI",2026-02-03T12:38:06Z,coal demand,"The Republican leader of Pennsylvania's state Senate saluted his allies in labor earlier this month after their successful, years-long effort to defeat what they saw as a job-killing climate initiativ",Realclearinvestigations.com,Unknown,News,2026-02-07T18:38:41.638727Z
d61c9ba063e49c88504e25909e1b70c3,"Trump’s trade tweet hands India tariff relief, but at a strategic cost",https://economictimes.indiatimes.com/markets/stocks/news/trumps-trade-tweet-hands-india-tariff-relief-but-at-a-strategic-cost/articleshow/127885724.cms,Dhananjay Sinha,2026-02-03T12:18:17Z,coal demand,"The India-US trade truce calms markets with tariff relief, but Trump’s terms suggest steep concessions for India on energy, imports and geopolitics. Unclear safeguards, leverage-linked tariffs and silence on services raise concerns over an imbalanced, America…",The Times of India,India,Market Report,2026-02-07T18:38:41.638751Z
a2c6da8effb41b7419f082ed570a6117,BlackRock’s GIP Teams Up With EQT in Bid to Acquire Power Firm AES,https://financialpost.com/pmn/business-pmn/blackrocks-gip-teams-up-with-eqt-in-bid-to-acquire-power-firm-aes,Bloomberg News,2026-02-03T12:07:34Z,coal demand,"BlackRock Inc.’s Global Infrastructure Partners has teamed up with EQT AB in its bid to acquire power company AES Corp., according to people familiar with the matter.",Financial Post,Global,News,2026-02-07T18:38:41.638790Z
5c5c1a2d8452e916f8e9391c085b65c3,China to See Solar Capacity Outstrip Coal Capacity This Year,https://e360.yale.edu/digest/china-solar-coal-2026,,2026-02-03T12:07:00Z,coal demand,"This year China will see its solar capacity outstrip its coal capacity for the first time, according to an industry group.Read more on E360 →",Yale.edu,China,News,2026-02-07T18:38:41.638806Z
5185cf6580600e33780d58a923ea5db0,Bharat Coking Coal Q3 Results: Revenue drops 25% YoY; Coal India arm slips into losses to Rs 23 crore,https://economictimes.indiatimes.com/markets/stocks/earnings/bharat-coking-coal-q3-results-revenue-drops-25-yoy-coal-india-arm-slips-into-losses-to-rs-23-crore/articleshow/127884986.cms,Shivendra Kumar,2026-02-03T11:46:03Z,coal demand,"Bharat Coking Coal posted a Q3FY26 net loss as revenue fell sharply year-on-year. Sequential improvement, lower expenses and post-IPO interest offered some relief, though shares slipped on weak earnings despite broader market strength after strong listing and…",The Times of India,India,Market Report,2026-02-07T18:38:41.638827Z
6a8f169bca2c501690240ab2de6bc2e5,"Modi Appears to Cave to Trump, Agrees to Buy Venezuela Oil in Place of Russia’s, End Tariffs on US Agriculture",https://www.nakedcapitalism.com/2026/02/modi-appears-to-cave-to-trump-agrees-to-buy-venezuela-oil-in-place-of-russias-end-tariffs-on-us-agriculture.html,Yves Smith,2026-02-03T11:40:25Z,coal demand,"What was Modi thinking? Even though Trump is surely exaggerating what his deal amounts to, it looks like a big climbdown for India.",Nakedcapitalism.com,India,News,2026-02-07T18:38:41.638851Z
7d6803d44f1e26c75a3dac8f0fa050e0,US-India trade deal: What we know so far,https://www.rt.com/india/631899-us-india-trade-deal-what/,RT,2026-02-03T11:24:08Z,coal demand,"The US has announced a reduced tariff of 18% for India, nearly a year after imposing 50% rate Read Full Article at RT.com",RT,India,News,2026-02-07T18:38:41.638867Z
eb1732ad048c508762972f5b7af88237,Why China is building so many coal plants despite its solar and wind boom,https://abcnews.go.com/Business/wireStory/china-building-coal-plants-despite-solar-wind-boom-129805104,KEN MORITSUGU Associated Press,2026-02-03T10:53:50Z,coal demand,"China has significantly increased its coal power capacity, reviving concerns about its climate-changing carbon emissions",ABC News,China,News,2026-02-07T18:38:41.638881Z
c07f3313fdff46eda4db2f06495c7262,Microbes could extract the metal needed for cleantech,https://www.technologyreview.com/2026/02/03/1132047/microbes-extract-metal-cleantech/,Matt Blois,2026-02-03T10:00:00Z,coal demand,"In a pine forest on Michigan’s Upper Peninsula, the only active nickel mine in the US is nearing the end of its life. At a time when carmakers want the metal for electric-vehicle batteries, nickel concentration at Eagle Mine is falling and could soon drop too…",MIT Technology Review,Unknown,News,2026-02-07T18:38:41.638927Z
6dca3e74fae5ca23cb8ff9e97c071a93,Japan’s unprecedented project could test the limits of deep-sea mining,https://grist.org/international/japans-unprecedented-project-could-test-the-limits-of-deep-sea-mining/,Rachel Ramirez,2026-02-03T09:45:00Z,coal demand,"Japan is spending five weeks mining the sea floor. It is a technological milestone — and a stress test for how nations balance geopolitics, clean energy demand, and environmental risk.",Grist,Japan,News,2026-02-07T18:38:41.638958Z
e1178dcd33c24115c520c2e5b455ff21,A new technology could unlock lithium in Western Canada. It's softer on the environment too,https://www.cbc.ca/news/science/lithium-alberta-mining-brines-9.7068876,,2026-02-03T09:00:00Z,coal demand,"As demand — and competition — for critical minerals used in clean technologies heats up around the world, mining startups are flocking to the heart of Canada’s oil and gas industry to tap into a key battery metal: lithium.",CBC News,Unknown,News,2026-02-07T18:38:41.639003Z
b24b43ae4bbceedf30e91eadc43a0c54,Why China is building so many coal plants despite its solar and wind boom,https://abcnews.go.com/International/wireStory/china-building-coal-plants-despite-solar-wind-boom-129805102,KEN MORITSUGU Associated Press,2026-02-03T08:19:00Z,coal demand,"China has significantly increased its coal power capacity, reviving concerns about its climate-changing carbon emissions",ABC News,China,News,2026-02-07T18:38:41.639015Z
7f7df32baae99210b884c2ca63b2a411,Why China is building so many coal plants despite its solar and wind boom,https://www.clickondetroit.com/business/2026/02/03/why-china-is-building-so-many-coal-plants-despite-its-solar-and-wind-boom/,Ken Moritsugu,2026-02-03T07:53:37Z,coal demand,"China has significantly increased its coal power capacity, reviving concerns about its climate-changing carbon emissions.",WDIV ClickOnDetroit,China,News,2026-02-07T18:38:41.639026Z
a45334453980753c8e71c043f19fc9fe,Report says new coal plant construction surged in China in 2025,https://apnews.com/article/china-coal-solar-climate-carbon-emissions-242abe76eb69f5a362e977de74ff3254,Ken Moritsugu,2026-02-03T07:42:49Z,coal demand,"China has significantly increased its coal power capacity, reviving concerns about its climate-changing carbon emissions. A joint report by two research groups shows that more than 50 large coal units, or boilers combined with turbines, were commissioned in 2…",Associated Press,China,Market Report,2026-02-07T18:38:41.639042Z
a50e4db90eac8de18990622033c46cc1,‘PM Modi has completely surrendered’: Opposition to corner Govt in Parliament over India-US trade deal,https://indianexpress.com/article/india/pm-modi-has-completely-surrendered-opposition-to-corner-govt-in-parliament-over-india-us-trade-deal-10510549/,Asad Rehman,2026-02-03T06:01:54Z,coal demand,The Congress will demand in both Houses that the text of the trade deals with the US and the EU should be tabled in Parliament.,The Indian Express,India,News,2026-02-07T18:38:41.639067Z
d19a524f268600920a11ccb72ba498ba,India's immediate end of Russian oil after US trade deal to be a big disruption: Moody's,https://economictimes.indiatimes.com/news/economy/foreign-trade/indias-immediate-end-of-russian-oil-after-us-trade-deal-to-be-a-big-disruption-moodys/articleshow/127877100.cms,ET Online,2026-02-03T05:59:53Z,coal demand,"India-US trade deal: India will not immediately halt Russian oil imports despite a new trade deal with the US. Moody's Ratings notes this could disrupt economic growth and increase inflation. However, reduced US tariffs will boost Indian exports, especially t…",The Times of India,India,News,2026-02-07T18:38:41.639106Z
557ef65f09b5f9a691b92c6ba40654a8,"Renewables over 50%, wholesale prices down – is the energy transition… succeeding?",https://theconversation.com/renewables-over-50-wholesale-prices-down-is-the-energy-transition-succeeding-274616,"Tony Wood, Program Director, Energy, Grattan Institute",2026-02-03T05:32:36Z,coal demand,It wasn’t so long ago pundits claimed Australia’s grid couldn’t run on higher than 20% renewables. Now it’s 50%.,The Conversation Africa,Australia,Market Report,2026-02-07T18:38:41.639124Z
3045be529c7564442583cc71a6daa8b8,China’s Solar Power Capacity on Course to Surpass Coal This Year,https://financialpost.com/pmn/business-pmn/chinas-solar-power-capacity-on-course-to-surpass-coal-this-year,Bloomberg News,2026-02-03T03:42:46Z,coal demand,"China’s solar generating capacity is expected to surpass coal for the first time this year, according to the country’s top electricity industry group, marking a milestone in the country’s long-standing effort to build a cleaner power system.",Financial Post,China,News,2026-02-07T18:38:41.639145Z
6628ff7dae35aa097843513c874328d3,"Up 13% in a month, 4 reasons to buy New Hope shares today",https://www.fool.com.au/2026/02/03/up-13-in-a-month-4-reasons-to-buy-new-hope-shares-today/,Bernd Struben,2026-02-03T03:16:39Z,coal demand,"A leading investment expert is bullish on the outlook for New Hope shares and dividends.
The post Up 13% in a month, 4 reasons to buy New Hope shares today appeared first on The Motley Fool Australia.",Motley Fool Australia,Australia,Analysis/Opinion,2026-02-07T18:38:41.639155Z
d4672e2b32161af8868924922af7f25c,"Stocks To Watch Today: Infosys, PB Fintech, Tata Power, Coal India And More",https://www.ndtvprofit.com/markets/stocks-to-watch-today-infosys-pb-fintech-tata-power-coal-india-and-more-10935131,NDTV Profit Research,2026-02-03T01:20:47Z,coal demand,Key stocks to watch heading into trade today on Tuesday.,Ndtvprofit.com,India,News,2026-02-07T18:38:41.639170Z
c46b4d976eb3fab01f0f508953d81893,"China Sees Record Coal Plant Bids Even as Usage Declines, Report Finds",https://financialpost.com/pmn/business-pmn/china-sees-record-coal-plant-bids-even-as-usage-declines-report-finds,Bloomberg News,2026-02-03T00:22:55Z,coal demand,China fielded a record number of proposals for new coal-fired power plants last year — even as generation from fossil fuels fell amid a surge of clean energy.,Financial Post,China,Market Report,2026-02-07T18:38:41.639184Z
95f7388ea8ff95e280af199c730468c0,PIMCO Closed-End Funds Declare Monthly Common Share Distributions,https://www.globenewswire.com/news-release/2026/02/02/3230667/220/en/PIMCO-Closed-End-Funds-Declare-Monthly-Common-Share-Distributions.html,PIMCO Account Management,2026-02-02T22:32:00Z,coal demand,"NEW YORK, Feb. 02, 2026 (GLOBE NEWSWIRE) -- The Boards of Trustees/Directors of the PIMCO closed-end funds below (each, a “Fund” and, collectively, the “Funds”) have declared a monthly distribution for each Fund’s common shares as summarized below.",GlobeNewswire,Unknown,Market Report,2026-02-07T18:38:41.639224Z
79ed8554a1390e6bf2f16e9d1e0d9a2d,Ontario’s Nuclear Rate Shock Reveals a Deeper Affordability Problem,https://cleantechnica.com/2026/02/02/ontarios-nuclear-rate-shock-reveals-a-deeper-affordability-problem/,Michael Barnard,2026-02-02T22:12:31Z,coal demand,"Ontario Power Generation (OPG) has asked the Ontario Energy Board to approve a sharp increase in regulated nuclear payment amounts, including a year over year jump of more than 40% in 2027. The weighted average regulated payment amount rises from about $78/MW…",CleanTechnica,Unknown,News,2026-02-07T18:38:41.639273Z
646b1dd2071c168a159e9071bef5c6af,The Net Zero Paradox No One Admits,https://oilprice.com/Energy/Energy-General/The-Net-Zero-Paradox-No-One-Admits.html,Irina Slav,2026-02-02T22:00:00Z,coal demand,"Western countries have led the push for net-zero economies for over a decade. Even though it’s China that is the biggest builder of wind and solar, and EVs, and the biggest investor in transition technology, it is Europe, the UK, and Australia that are pushin…",OilPrice.com,China,News,2026-02-07T18:38:41.639293Z
66907a62c33c915c7be3193800641478,cycdp added to PyPI,https://pypi.org/project/cycdp/,shakfu@users.noreply.github.com,2026-02-05T18:35:13Z,grain exports,Cython bindings for the CDP audio processing library,Pypi.org,Unknown,News,2026-02-07T18:38:42.157392Z
9ad757d3b0cbbc56c5c685d06015c470,India to add more trade muscle as it inks FTA terms with GCC,https://economictimes.indiatimes.com/news/economy/foreign-trade/india-to-add-more-trade-muscle-as-it-inks-fta-terms-with-gcc/articleshow/127949005.cms,,2026-02-05T18:03:27Z,grain exports,"Saudi Arabia, the UAE, Qatar, Kuwait, Oman and Bahrain are members of the GCC. The terms of reference (ToR) outline the scope and modalities of a proposed trade pact.",The Times of India,India,News,2026-02-07T18:38:42.157445Z
7864750b7b08f7d0a5f91772c71756d1,Self-Organization and the Promise of a Circular Amazonian Socio-Bioeconomy,https://www.resilience.org/stories/2026-02-05/self-organization-and-the-promise-of-a-circular-amazonian-socio-bioeconomy/,Daniel Henryk Rasolt,2026-02-05T10:19:45Z,grain exports,"Data-driven models of self-organization and critical collective phenomena in the natural world and within traditional Indigenous sociocultural structures, along with adaptive context-based frameworks, can help guide the transboundary development of a decentra…",Resilience,Unknown,News,2026-02-07T18:38:42.157693Z
e21059575292e296e69cac933a6016aa,"As premium whiskies come of age, Amrut aims for ₹800 cr sales by 2030",https://www.livemint.com/companies/indian-whisky-single-malt-distiller-amrut-revenue-aim-alcohol-11770092092393.html,Varuni Khosla,2026-02-04T03:30:35Z,grain exports,Amrut expanded its distillation capacity in the past year and is doubling down on premium and luxury whiskies as single and pure malts drive the firm's topline growth.,Livemint,Unknown,News,2026-02-07T18:38:42.157781Z
1d188240d1f77edd0aac4ecde10e4a5f,Kazakhstan's grain exports up 21 pct since start of current marketing year,https://www.thestar.com.my/news/world/2026/02/04/kazakhstan039s-grain-exports-up-21-pct-since-start-of-current-marketing-year,Gou Hongjing,2026-02-03T18:10:00Z,grain exports,"ALMATY, Feb. 3 (Xinhua) -- Kazakhstan has exported 5.8 million tonnes of grain since the start of the current marketing year in September 2025, up 1 million tonnes, or 21 percent, from the same period last year, the Ministry of Agriculture reported Tuesday. R…",The Star Online,Unknown,Market Report,2026-02-07T18:38:42.157824Z
5d318960af84b45ab2009f2d45ef2aed,Starch Derivatives Market Size to Worth USD 148.33 Billion by 2035 | Towards FnB,https://www.globenewswire.com/news-release/2026/02/03/3231254/0/en/Starch-Derivatives-Market-Size-to-Worth-USD-148-33-Billion-by-2035-Towards-FnB.html,Precedence Research,2026-02-03T15:00:00Z,grain exports,"According to Towards FnB, the global starch derivatives market size is calculated at USD 94.80 billion in 2026 and is expected to reach USD 148.33 billion by 2035, registering a CAGR of 5.1% during the 2026 to 2035 forecast period. This growth is reflective o…",GlobeNewswire,Global,Analysis/Opinion,2026-02-07T18:38:42.157864Z
a1dc17ff6151f8d9a901b0b96fef8380,India–US trade deal: The elephant in the room everyone is watching,https://economictimes.indiatimes.com/news/economy/foreign-trade/indiaus-trade-deal-the-elephant-in-the-room-everyone-is-watching/articleshow/127879546.cms,ET Online,2026-02-03T07:48:27Z,grain exports,"India-US trade deal has put agriculture in the spotlight. While US officials highlight significant agricultural exports, Indian officials emphasize broader opportunities. Details remain scarce, particularly regarding specific agricultural products and quantit…",The Times of India,India,News,2026-02-07T18:38:42.157892Z
8b6995bda82f3c551a53083117527123,India–US trade deal: The elephant in the room everyone is watching,https://economictimes.indiatimes.com/news/economy/foreign-trade/indiaus-trade-deal-the-elephant-in-the-room-everyone-is-watching/articleshow/127879844.cms,ET Online,2026-02-03T07:48:27Z,grain exports,"India-US trade deal has put agriculture in the spotlight. While US officials highlight significant agricultural exports, Indian officials emphasize broader opportunities. Details remain scarce, particularly regarding specific agricultural products and quantit…",The Times of India,India,News,2026-02-07T18:38:42.157913Z
77162949d98d08ac6e9340c4ce3c0158,Michael Hudson and Vijay Prashad: How Hyper-Imperialism Shapes Global Conflict,https://www.nakedcapitalism.com/2026/02/michael-hudson-and-vijay-prashad-how-hyper-imperialism-shapes-global-conflict.html,Yves Smith,2026-02-02T14:55:21Z,grain exports,A rich discussion of how industrial capitalism evolved into imperialism and how its impulses and contradictions are creating more fractures.,Nakedcapitalism.com,Global,News,2026-02-07T18:38:42.157947Z
4d21eda668f340c8ae836659926eb31f,Russia-Sri Lanka Bilateral Ties. Participation in the Vladivostok-Chennai Maritime Corridor (VCMC)?,https://www.globalresearch.ca/sri-lanka-russia-bilateral-ties/5914400,Andrew Korybko,2026-02-02T14:12:42Z,grain exports,"Sri Lanka appears to be following neighboring India’s lead in wanting to scale real-sector trade across the Vladivostok-Chennai Maritime Corridor, expand energy cooperation, and host more military drills.

To read this article in the following languages, clic…",Globalresearch.ca,India,News,2026-02-07T18:38:42.157976Z
992be7a1a4891107265ee2178dfda610,Farmers consider leaving staple crops to rot following unexpected crisis: 'What am I supposed to do with 2.2 million pounds of [this]?',https://finance.yahoo.com/news/farmers-consider-leaving-staple-crops-233000127.html,Noah Jampol,2026-02-01T23:30:00Z,grain exports,"The financial prospects for farming remain bleak, and the appeal for newcomers to come in is waning.",Yahoo Entertainment,Unknown,News,2026-02-07T18:38:42.158018Z
768e9efe857bb10e59773aab47a38d8a,"Energy, exergy, and environmental performance of a solar dryer for orange slices across tray levels and thicknesses",https://www.nature.com/articles/s41598-025-23535-5,"Abdallah Elshawadfy Elwakeel, Awad Ali Tayoush Oraiath, Wajdi Aissa Mohammed Abdurraziq, András Székács, Omar Saeed, Mohamed Hamdy Eid, Mohammad S. AL-Harbi, Atef Fathy Ahmed, Aml Abubakr Tantawy",2026-01-31T00:00:00Z,grain exports,"This research introduces the development of an automated forced and natural solar dryer (AFNSD) equipped with a photovoltaic-powered IoT technology, temperature-responsive control system that seamlessly alternates between natural and forced convection to impr…",Nature.com,Unknown,News,2026-02-07T18:38:42.158071Z
b44c521428841ef7058506af00a3d850,"SOPA opposes GM soyameal imports, says domestic supplies are adequate",https://www.thehindubusinessline.com/economy/agri-business/sopa-opposes-gm-soyameal-imports-says-domestic-supplies-are-adequate/article70596447.ece,Our Bureau,2026-02-05T16:44:59Z,soybean exports,SOPA is sounding the alarm that these imports could undermine our local agriculture and worsen the trade deficit—something we can all get behind as we support homegrown farmers,BusinessLine,Unknown,News,2026-02-07T18:38:42.622693Z
44803516015a9850e04e92199a4d0409,Agriculture Experts Warn of 'Widespread Collapse' in US Farms Thanks to Trump Policies,https://www.commondreams.org/news/trump-tariffs-us-farmers,Brad Reed,2026-02-04T18:18:50Z,soybean exports,"A large group of agriculture experts warned that US farms are taking a financial beating thanks to President Donald Trump's global trade war.In a letter sent to the chairs and ranking members of the House and Senate Agriculture Committees on Tuesday, the expe…",Common Dreams,Global,News,2026-02-07T18:38:42.622758Z
689ff0777a3f22cc5ce37a0334b159ae,Economic Digest: Nepal’s Business News in a snap,https://english.khabarhub.com/2026/04/533717/,Khabarhub,2026-02-04T02:15:31Z,soybean exports,"KATHMANDU: Economic Digest offers a concise yet comprehensive overview of significant business happenings in Nepal, presented in easily digestible summaries. The latest economic indicators present a mixed picture of Nepal’s economy, marked by strong external …",Khabarhub.com,Unknown,Analysis/Opinion,2026-02-07T18:38:42.622801Z
385a606049575709fa3c1ec3c95a690d,"US said to have accepted India’s position on GM crops in lieu of concession on apples, nuts",https://www.thehindubusinessline.com/economy/agri-business/us-said-to-have-accepted-indias-position-on-gm-crops-in-lieu-of-concession-on-apples-nuts/article70588101.ece,Prabhudatta  Mishra,2026-02-03T15:37:16Z,soybean exports,"Along with the Commerce Minister Piyush Goyal’s assertion on no compromise on sensitive sectors, businessline has reliably learnt that the redline on GM soya and maize has not been crossed",BusinessLine,India,News,2026-02-07T18:38:42.622830Z
bfccc8539f50ff4a3fd24d0acfd4812e,Trump aide claims deal would pump American farm goods in India,https://economictimes.indiatimes.com/news/economy/foreign-trade/trump-aide-claims-deal-would-pump-american-farm-goods-in-india/articleshow/127875750.cms,ANI,2026-02-03T04:18:44Z,soybean exports,A new trade deal between the United States and India is set to boost American farm exports. US Secretary of Agriculture Brooke Rollins stated the agreement will open India's large market to US agricultural products. This move is expected to increase prices an…,The Times of India,India,Market Report,2026-02-07T18:38:42.622870Z
