article_id,title,link,creator,pubdate,category,description,source,country,article_type,scrape_timestamp
81fbef73fcd6fbec725ffe24fe1f050a,OTR Solutions Acquires Key AI Technology to Advance Document Automation and Fraud Prevention Capabilities in Transportation and Logistics,https://www.globenewswire.com/news-release/2026/02/11/3236398/0/en/OTR-Solutions-Acquires-Key-AI-Technology-to-Advance-Document-Automation-and-Fraud-Prevention-Capabilities-in-Transportation-and-Logistics.html,OTR Solutions,2026-02-11T14:33:00Z,freight rates,"ROSWELL, Ga., Feb. 11, 2026 (GLOBE NEWSWIRE) -- OTR Solutions, the leader in logistics-focused financial technology and back-office solutions, today announced the acquisition of Peruse Technology, Inc., an AI-powered document audit automation technology purpo…",GlobeNewswire,Unknown,News,2026-02-14T06:50:10.113956Z
f8a49fd85de83be183340dda51b84675,"Benzene Market Size to Surpass USD 73.69 Billion by 2035 | Global Price Benchmarks Drive Regional Divergence and Volatility, Says Astute Analytica",https://www.globenewswire.com/news-release/2026/02/11/3236093/0/en/Benzene-Market-Size-to-Surpass-USD-73-69-Billion-by-2035-Global-Price-Benchmarks-Drive-Regional-Divergence-and-Volatility-Says-Astute-Analytica.html,AstuteAnalytica India Pvt. Ltd.,2026-02-11T11:32:00Z,freight rates,"The market is strongly positioned with robust growth fueled by expanding petrochemical demand, strategic investments in Asia-Pacific, and innovations in downstream applications. Despite crude oil volatility and regulations, steady regional expansions ensure r…",GlobeNewswire,Global,Market Report,2026-02-14T06:50:10.114038Z
e52b6e55b00a587d3cd5e246a403a1fe,"Eicher Motor target price raised up to Rs 8,800. What Jefferies, CLSA, other brokerages say",https://economictimes.indiatimes.com/markets/stocks/news/eicher-motor-target-price-raised-up-to-rs-8800-what-jefferies-clsa-other-brokerages-say/articleshow/128192305.cms,Veer Sharma,2026-02-11T06:35:47Z,freight rates,"Eicher Motors shares jumped after the company reported strong Q3 results, with net profit rising 21% year-on-year to Rs 1,420 crore and revenue growing 23%. Brokerages also raised price targets, seeing potential upside in the stock.",The Times of India,Unknown,Market Report,2026-02-14T06:50:10.114119Z
886ed5f2e15014947911c5657f2a1654,"When exports wilt, India’s rose market finds new bloom at home",https://www.thehindubusinessline.com/economy/agri-business/when-exports-wilt-indias-rose-market-finds-new-bloom-at-home/article70616380.ece,Aishwarya  Kumar & Tejaswini  S,2026-02-11T04:58:55Z,freight rates,"India's rose market thrives domestically amid soaring export costs and reduced international competitiveness, especially ahead of Valentine's Week.",BusinessLine,Brazil,Market Report,2026-02-14T06:50:10.114136Z
204f4a74940fa64109fad4a67bc71f04,"Falling Freight Rates Undercut Hapag-Lloyd Earnings, Overshadow Volume Gains",https://consent.yahoo.com/v2/collectConsent?sessionId=1_cc-session_a856a0de-d457-443b-9984-0243a7a8821c,,2026-02-10T23:07:45Z,freight rates,,Yahoo Entertainment,Unknown,Market Report,2026-02-14T06:50:10.114157Z
ec0b6fb99ab1c5bc81fb7b03b024a536,Andrew Peller Limited Reports Financial Results for Third Quarter of Fiscal 2026,https://www.globenewswire.com/news-release/2026/02/10/3235831/0/en/Andrew-Peller-Limited-Reports-Financial-Results-for-Third-Quarter-of-Fiscal-2026.html,Andrew Peller Limited,2026-02-10T22:00:00Z,freight rates,"GRIMSBY, Ontario, Feb. 10, 2026 (GLOBE NEWSWIRE) -- Andrew Peller Limited (TSX: ADW.A / ADW.B) (“APL” or the “Company”) today announced results for the three and nine months ended December 31, 2025. All amounts are expressed in Canadian dollars unless otherwi…",GlobeNewswire,Unknown,Market Report,2026-02-14T06:50:10.114286Z
c680ab284aa35a30adf45a1dc36940fe,George Bradshaw address 2026,https://www.gov.uk/government/speeches/george-bradshaw-address-2026,Department for Transport,2026-02-10T21:22:59Z,freight rates,"The Transport Secretary sets out her vision for a reformed railway that's run by the public, for the public.",Www.gov.uk,Unknown,News,2026-02-14T06:50:10.114351Z
7c6f0ae12656a47995b1547b4511eb60,Why Credit Is Quietly Deciding Who Survives in Trucking,https://finance.yahoo.com/news/why-credit-quietly-deciding-survives-193413168.html,Adam Wingfield,2026-02-10T19:34:13Z,freight rates,"For most owner-operators and small carriers, the conversation about survival usually starts with rates. Fuel prices come next. Then brokers. Then regulations...",Yahoo Entertainment,Unknown,Market Report,2026-02-14T06:50:10.114380Z
afaa817a8d2c2165460e32e352e89c4d,"Tesla is quoting $290,000 for its 500-miles electric semi truck",http://electrek.co/2026/02/10/tesla-quoting-price-500-miles-electric-semi-truck/,Fred Lambert,2026-02-10T16:19:03Z,freight rates,"Tesla is quoting customers $290,000 for the 500-mile Long Range version of the Tesla Semi, Electrek has learned. The pricing is consistent with data from California’s HVIP voucher program, finally giving us clarity on what the production electric truck will c…",Electrek,Unknown,News,2026-02-14T06:50:10.114426Z
bff9f223674580d48a6f010ed346d46e,Earnings season: The moment of truth for corporate New Zealand – Generate Wealth Weekly,https://www.nzherald.co.nz/business/personal-finance/investment/earnings-season-the-moment-of-truth-for-corporate-new-zealand-generate-wealth-weekly/TXKH4YFAZNAIXJ7VXNNF7YHNUQ/,Greg Smith,2026-02-10T16:00:00Z,freight rates,OPINION: Why this earnings season matters more than the numbers.,New Zealand Herald,Unknown,Analysis/Opinion,2026-02-14T06:50:10.114455Z
651f99f6afdd9d1e953c1f7f17a98e4d,Red Sea torpedoes Hapag-Lloyd rates,https://finance.yahoo.com/news/red-sea-torpedoes-hapag-lloyd-155900750.html,Stuart Chirls,2026-02-10T15:59:00Z,freight rates,Hapag-Lloyd container volumes increased on robust trade growth but diverted voyages away from the Red Sea hurt average freight rates. The post Red Sea...,Yahoo Entertainment,Unknown,Market Report,2026-02-14T06:50:10.114483Z
bf7ec7d8c336f60b9854a49728687e19,"India Full-Truck-Load (FTL) Industry Report 2026: Expansion of Dedicated Freight Corridors, Surge in Organized Retail and E-Commerce Shipments Driving Growth - Growth Forecasts 2025-2031",https://www.globenewswire.com/news-release/2026/02/09/3234650/28124/en/India-Full-Truck-Load-FTL-Industry-Report-2026-Expansion-of-Dedicated-Freight-Corridors-Surge-in-Organized-Retail-and-E-Commerce-Shipments-Driving-Growth-Growth-Forecasts-2025-2031.html,Research and Markets,2026-02-09T14:43:00Z,freight rates,"The India Full-Truck-Load (FTL) market is poised for growth, driven by burgeoning organized retail, infrastructure modernization, and e-commerce logistics. Opportunities arise from logistic innovations, such as dedicated freight corridors, hub-and-spoke wareh…",GlobeNewswire,India,Analysis/Opinion,2026-02-14T06:50:10.114671Z
5f94b1ae243ed09c9b6e98bf62dcad7d,SemiCab Demonstrates More Than 70% Reduction in Empty Trucking Miles Across Live Freight Networks,https://www.globenewswire.com/news-release/2026/02/09/3234643/0/en/SemiCab-Demonstrates-More-Than-70-Reduction-in-Empty-Trucking-Miles-Across-Live-Freight-Networks.html,"Algorhythm Holdings, Inc.",2026-02-09T14:30:00Z,freight rates,"Fort Lauderdale, FL, Feb. 09, 2026 (GLOBE NEWSWIRE) -- Algorhythm Holdings, Inc. (“Algorhythm”) (NASDAQ: RIME) – a leading AI technology company, today announced that it has published a whitepaper demonstrating that its SemiCab platform reduces empty freight …",GlobeNewswire,Unknown,Market Report,2026-02-14T06:50:10.114714Z
c295dc64c43e0a60a6cee92dd8e0a5e0,Tesla reveals final Semi specs with two trims ahead of customer deliveries,http://electrek.co/2026/02/09/tesla-reveals-final-semi-specs-with-two-trims-ahead-of-customer-deliveries/,Fred Lambert,2026-02-09T13:19:42Z,freight rates,"Tesla has quietly updated its official Semi website with final specifications for the production version of its all-electric Class 8 truck, confirming two trim levels — Standard Range and Long Range — as customer deliveries approach.



 more…",Electrek,Unknown,News,2026-02-14T06:50:10.114790Z
2b239d7ad00d8516d3c81255ff9716a5,"Air Freight Industry Report 2026 - Market Share Analysis, Industry Trends & Statistics, Growth Forecasts 2025-2031",https://www.globenewswire.com/news-release/2026/02/09/3234437/28124/en/Air-Freight-Industry-Report-2026-Market-Share-Analysis-Industry-Trends-Statistics-Growth-Forecasts-2025-2031.html,Research and Markets,2026-02-09T12:44:00Z,freight rates,"The air freight market offers opportunities from expanding cross-border e-commerce, growing pharmaceutical cold-chain needs, and supply-chain demands for high-tech electronics. Digitalization and sustainability trends drive competitive differentiation, while …",GlobeNewswire,Unknown,Analysis/Opinion,2026-02-14T06:50:10.114831Z
4c524e7ccfa95d7ce278654998e9abcf,GSTAT finds Wai Wai noodles maker guilty of GST profiteering,https://economictimes.indiatimes.com/industry/cons-products/food/gstat-finds-wai-wai-noodles-maker-guilty-of-gst-profiteering/articleshow/128100485.cms,Anuradha Shukla,2026-02-09T06:22:24Z,freight rates,The Goods and Services Tax Appellate Tribunal has ordered instant noodle maker CG Foods to deposit over ₹90 lakh into the Consumer Welfare Fund. The tribunal found the company profiteered by not passing on a GST rate cut benefit to consumers. CG Foods increas…,The Times of India,Unknown,News,2026-02-14T06:50:10.114923Z
e08029fb9c8f667a5cad223bb44fe952,Retread Tires Market to Reach USD 13.50 Billion by 2032 as Fleets Push Cost Savings and Sustainability - Credence Research,https://www.prnewswire.co.uk/news-releases/retread-tires-market-to-reach-usd-13-50-billion-by-2032-as-fleets-push-cost-savings-and-sustainability--credence-research-302681873.html,,2026-02-09T03:30:00Z,freight rates,"LONDON, Feb. 9, 2026 /PRNewswire/ -- Credence Research Inc. announces the release of its latest study on the Global Retread Tires Market, which was valued at USD 9,600.00 million in 2018, reached USD 10,333.98 million in 2024, and is projected to hit USD 13,4…",PR Newswire UK,UK,Market Report,2026-02-14T06:50:10.115008Z
dbe4ada0f25110c288cc14048901ddea,Truck financing on level ground,https://www.thehindubusinessline.com/economy/logistics/truck-financing-on-level-ground/article70607640.ece,Manish Kothari,2026-02-08T13:21:40Z,freight rates,"Explore how GST reforms are transforming India's trucking industry, fostering competition and leveling the playing field for small operators.",BusinessLine,India,News,2026-02-14T06:50:10.115026Z
f1b6fd584c5d63065343dcbc95dce0fc,Can AI Help Students Navigate the Career Chaos It’s Creating?,https://www.edsurge.com/news/2026-02-12-can-ai-help-students-navigate-the-career-chaos-it-s-creating,Daniel Mollenkamp,2026-02-12T14:00:00Z,charter rates,College and career counseling is tough these days. Some schools are banking on the idea that AI can help.,Edsurge.com,Unknown,News,2026-02-14T06:50:10.484576Z
e0d7d133bfab5bcc161f874a4057a49a,Stefano Gabbana’s Glamorous 213-Foot Superyacht Is Up for Sale and Charter,http://robbreport.com/motors/marine/stefano-gabbana-superyacht-charter-sale-1237563815/,Rachel Cormack,2026-02-12T12:30:00Z,charter rates,"Stefano Gabbana’s glamorous superyacht ""Regina D’Italia"" has just joined the charter market for the first time. The 213-footer is also up for sale.",Robb Report,Unknown,Market Report,2026-02-14T06:50:10.484618Z
ba71f3a7b38212093087a75f330992d8,Daily Press Briefing by the Office of the Spokesperson for the Secretary-General,https://press.un.org/en/2026/db260211.doc.htm,United Nations,2026-02-11T22:08:11Z,charter rates,"The Democratic Republic of the Congo is experiencing its worst cholera outbreak in 25 years, with over 1,300 suspected cases and 35 deaths reported since 1 January. On Monday, $750,000 was allocated from the Central Emergency Response Fund for UN healthcare p…",UN News,Unknown,Market Report,2026-02-14T06:50:10.484750Z
3f5b371904ac29026c253e2f056975c0,National Bank Holdings Corporation Announces Closing of Subordinated Notes Offering,https://www.globenewswire.com/news-release/2026/02/11/3236671/0/en/National-Bank-Holdings-Corporation-Announces-Closing-of-Subordinated-Notes-Offering.html,National Bank Holdings Corporation,2026-02-11T21:10:00Z,charter rates,"DENVER, Feb. 11, 2026 (GLOBE NEWSWIRE) -- National Bank Holdings Corporation (NYSE: NBHC, “NBHC”) (the “Company”), the holding company for NBH Bank (the “Bank”), today announced the closing of a public offering of $150.0 million aggregate principal amount of …",GlobeNewswire,Unknown,News,2026-02-14T06:50:10.484797Z
c4d985e5726c30237996d109541c6504,"“I am Steadfast” On Affirm, (AFRM) Says Jim Cramer",https://finance.yahoo.com/news/am-steadfast-affirm-afrm-says-165004068.html,Ramish Cheema,2026-02-11T16:50:04Z,charter rates,"We recently published 9 Stocks Jim Cramer Talked About. Affirm Holdings, Inc. (NASDAQ:AFRM) is one of the stocks that Jim Cramer talked about. Affirm...",Yahoo Entertainment,Unknown,News,2026-02-14T06:50:10.484913Z
4ed8f8517c39da3f668cca8444e6ef17,"Costs of Device-Reliant Parenting: Kids Deficient in Empathy and Storytelling Skills, Can’t Read, Show Declining Cognitive Performance",https://www.nakedcapitalism.com/2026/02/costs-of-device-reliant-parenting-kids-deficient-in-empathy-and-storytelling-skills-cant-read-show-declining-cognitive-performance.html,Yves Smith,2026-02-11T14:58:48Z,charter rates,Another disconcerting report on the harm done to kids by device and tech heavy parenting,Nakedcapitalism.com,Unknown,Market Report,2026-02-14T06:50:10.484954Z
1c1f27e7146c180f0710b9167187363d,The Bank of Big Medicine,http://prospect.org/2026/02/11/bank-medicine-health-insurers-united-health-optum-financial/,Olivia Webb Kosloff and Emma Freer,2026-02-11T10:00:00Z,charter rates,"Health insurers and providers are using industrial loan companies and other tactics to make money from financial engineering rather than patient care.
The post The Bank of Big Medicine appeared first on The American Prospect.",The American Prospect,USA,News,2026-02-14T06:50:10.485015Z
f66117664f6769225c8539d74dc96398,Coming soon to Zambia’s Kingdom,https://www.aluxurytravelblog.com/2026/02/11/coming-soon-to-zambias-kingdom/,Claire Roadley,2026-02-11T00:53:55Z,charter rates,"South Luangwa National Park in Zambia is widely regarded as one of Africa’s finest wildlife sanctuaries, combining exceptional game...
The post Coming soon to Zambia’s Kingdom appeared first on A Luxury Travel Blog.",Aluxurytravelblog.com,Unknown,News,2026-02-14T06:50:10.485059Z
a0a6bda3c02989dfcbb239be09f217bf,HansJet Members Exempt from UK’s 50% Private Jet Tax Increase as PC-12 Fleet Falls Below Weight Threshold,https://www.globenewswire.com/news-release/2026/02/10/3235658/0/en/HansJet-Members-Exempt-from-UK-s-50-Private-Jet-Tax-Increase-as-PC-12-Fleet-Falls-Below-Weight-Threshold.html,HansJet,2026-02-10T17:01:00Z,charter rates,"Turboprop operator’s 4.7-tonne aircraft avoid April 2026 surcharge while heavier jets face up to £1,141 per passenger Turboprop operator’s 4.7-tonne aircraft avoid April 2026 surcharge while heavier jets face up to £1,141 per passenger",GlobeNewswire,Unknown,News,2026-02-14T06:50:10.485127Z
f420eb04f195a113c686d7cab40d0191,Nancy Bailey: Will School Choice Kill School Sports?,https://dianeravitch.net/2026/02/10/nancy-bailey-will-school-choice-kill-school-sports/,dianeravitch,2026-02-10T15:00:00Z,charter rates,"Nancy Bailey is a retired educator and a dedicated ally of public schools. She understands the importance of public schools as the heart of communities, which bring parents together and teach citizenship. In many communities, Friday night lights are an import…",Dianeravitch.net,Unknown,News,2026-02-14T06:50:10.485246Z
253adda06960bd5e2581aa3a602243ec,Here’s the next bid to undermine excellence in New York’s schools,https://nypost.com/2026/02/09/opinion/heres-the-next-bid-to-undermine-excellence-in-new-yorks-schools/,Post Editorial Board,2026-02-10T00:05:55Z,charter rates,"As New York’s charter schools continue to deliver far better results for their students than traditional public schools, the special interests that feed off the regular system relentlessly work to kneecap the competition; the most likely next assault will be …",New York Post,Unknown,News,2026-02-14T06:50:10.485344Z
dbaf8b4931892bea646603b336634af6,Ireland found in breach of European treaty over lack of Defence Forces overtime,https://www.irishtimes.com/ireland/2026/02/09/ireland-found-in-breach-of-european-treaty-over-lack-of-defence-forces-overtime/,Emmet Malone,2026-02-09T19:46:36Z,charter rates,Officer representatives say efforts to address additional pay with Government ‘refused point blank’,The Irish Times,Unknown,News,2026-02-14T06:50:10.485379Z
360279f5cd5c63991c03254e2818370c,Herefordshire farmer begins 142-mile walk to London for mental health support,https://www.gbnews.com/news/herefordshire-farmer-walk-london-support,Oliver Partridge,2026-02-09T17:35:58Z,charter rates,"A farmer and mental health activist has started his 142-mile walk from Herefordshire to London to raise awareness for the struggles faced by the farming community.Sam Stables, co-founder of mental health awareness group We Are Farming Minds, set off from Ross…",Gbnews.com,UK,News,2026-02-14T06:50:10.485426Z
ba1deaba34ecf86343a56a9ad4aa3538,The Kind of Schools That We Need Right Now,https://dianeravitch.net/2026/02/09/what-kind-of-schools-do-we-need-right-now/,dianeravitch,2026-02-09T16:00:00Z,charter rates,Some years back–actually it was 2019–I read an article that gladdened my heart. It was written in The Atlantic by gazillionaire Nick Hanauer. It was titled “Better Schools Won’t Fix America.” Nick is an interesting guy. He is an entrepreneur in Seattle. He wo…,Dianeravitch.net,USA,News,2026-02-14T06:50:10.485454Z
d95abe224c57a89a4a2eddb4da972599,Analyst Report: Flex Ltd,https://finance.yahoo.com/research/reports/ARGUS_2975_AnalystReport_1770639492000/,,2026-02-09T12:18:12Z,charter rates,"At Yahoo Finance, you get free stock quotes, up-to-date news, portfolio management resources, international market data, social interaction and mortgage rates that help you manage your financial life.",Yahoo Entertainment,Global,Market Report,2026-02-14T06:50:10.485486Z
dcc82a764642e50e4d4d0e1f30121df1,BBC bumps telly tax to £180 as Netflix lurks with cheaper tiers,https://www.theregister.com/2026/02/09/bbc_tv_licensing_hike/,Carly Page,2026-02-09T11:40:21Z,charter rates,"UK's pay-to-watch license fee gets inflation-linked hike amid funding debate
Brits will soon pay more to legally watch the BBC's output than to subscribe to some of the world's biggest streaming services, after the UK government confirmed the TV license fee w…",Theregister.com,Unknown,News,2026-02-14T06:50:10.485532Z
05e04f8c752b95a92d2dda488e5b7788,This European country is betting its economy on a geopolitical turn,https://www.rt.com/russia/632136-this-european-country-is-betting/,RT,2026-02-08T16:08:23Z,charter rates,"With withdrawal from the CIS underway, Moldova faces economic and political pressures amid unresolved questions about its place in Europe Read Full Article at RT.com",RT,Unknown,News,2026-02-14T06:50:10.485660Z
94617905e8996ba0e38bf4f810f8af9d,India-US trade deal brings relief—with strings attached,https://www.livemint.com/opinion/columns/india-us-trade-deal-relief-demands-geopolitical-implications-11770536193019.html,Elizabeth Roche,2026-02-08T10:43:55Z,charter rates,"While there is relief that a trade deal has been struck between India and the US, New Delhi will have to accommodate Washington’s expectations on many fronts, especially energy.",Livemint,India,News,2026-02-14T06:50:10.485712Z
0e65e0d906291e8550eb07be3e4a79c5,Software Factories and the Agentic Moment,https://factory.strongdm.ai/,mellosouls,2026-02-07T15:05:56Z,charter rates,"StrongDM's field notes on non-interactive agentic development: specs + scenarios, validation harnesses, feedback loops, and the supporting components.",Strongdm.ai,Unknown,News,2026-02-14T06:50:10.485744Z
363b8895db53fabe76bf04956269e7f6,"In governor's race, Rodriguez proposes state-run health insurance option; says police should honor ICE detainers",https://cbs58.com/news/in-governors-race-rodriguez-proposes-state-run-health-insurance-option-says-police-should-honor-ice-detainers,A.j. Bayatpour,2026-02-07T02:32:12Z,charter rates,MILWAUKEE (CBS 58) -- The state of the race to be Wisconsin's next governor is a tale of two completely different primary races. Seven Democrats are vying to be the party's nominee as they push to keep,WDJT,Unknown,News,2026-02-14T06:50:10.485782Z
38ff8f11e283863efe1d0346002da2e6,Igoumenitsa Port plans three OPS installations via HEDNO,https://www.naftemporiki.gr/english/2072235/igoumenitsa-port-plans-three-ops-installations-via-hedno/,Αλεξία Σωτηρίου,2026-02-13T06:34:38Z,maritime transport,"A project of high strategic importance for the country and the energy transition of maritime transport begins to be implemented with the study, procurement, installation, testing and commissioning of three…
Igoumenitsa Port plans three OPS installations via H…",Naftemporiki.gr,Unknown,News,2026-02-14T06:50:11.510344Z
3c611b2d0a7c9e147a7ddc49d84059c1,Turkish warships deployed off Somalia ahead of deepwater drilling,https://www.hurriyetdailynews.com/turkish-warships-deployed-off-somalia-ahead-of-deepwater-drilling-218901,hurriyetdailynews.com,2026-02-13T06:05:54Z,maritime transport,"Türkiye has dispatched a naval task force to the Gulf of Aden and Somali waters to provide logistical support and help secure upcoming offshore energy operations, as Ankara prepares to launch its first overseas deepwater drilling mission.",Hurriyet Daily News,Turkey,News,2026-02-14T06:50:11.510395Z
c882fc177fbd784deb3d858db70a790a,"Global Times: From fisheries to clean energy, Ningbo's marine economy charts high-quality devt",https://www.globenewswire.com/news-release/2026/02/13/3237805/0/en/Global-Times-From-fisheries-to-clean-energy-Ningbo-s-marine-economy-charts-high-quality-devt.html,Global Times,2026-02-13T00:44:00Z,maritime transport,"Ningbo boosts its marine economy with smart aquaculture, mega ports and offshore wind, driving green growth. for future. Ningbo boosts its marine economy with smart aquaculture, mega ports and offshore wind, driving green growth. for future.",GlobeNewswire,Global,News,2026-02-14T06:50:11.510439Z
4e32ecbb69517cc94997b5bd86b82786,"MoD inks deal with HAL for 8 Dornier aircraft at cost of ₹2,312 crore",https://www.thehindubusinessline.com/companies/mod-inks-deal-with-hal-for-8-dornier-aircraft-at-cost-of-2312-crore/article70624579.ece,BL New Delhi Bureau,2026-02-12T13:55:15Z,maritime transport,"MoD signs ₹2,312 crore deal with HAL for 8 Dornier aircraft, boosting Indian Coast Guard's fleet to 100 by 2030.",BusinessLine,India,News,2026-02-14T06:50:11.510469Z
bc0e2e0bc2c13b4bc07f39fbf71a80b7,"Ministry of Defence inks Rs 2,312 crore contract with HAL for eight Dornier 228 Aircraft under Buy (Indian) category",https://economictimes.indiatimes.com/news/defence/ministry-of-defence-inks-rs-2312-crore-contract-with-hal-for-eight-dornier-228-aircraft-under-buy-indian-category/articleshow/128258953.cms,ANI,2026-02-12T12:47:12Z,maritime transport,"The Ministry of Defence has signed a contract with Hindustan Aeronautics Limited (HAL), Transport Aircraft Division, Kanpur, for the acquisition of eight Dornier 228 Aircraft along with Operational Role Equipment for the Indian Coast Guard (ICG) at a cost of …",The Times of India,India,News,2026-02-14T06:50:11.510499Z
2d4efe614f54213e47be9855dfdc00f5,Deaths of 31 people in UK’s worst small boat disaster caused by government’s ‘systemic failure' – the Cranston inquiry conclusions explained,https://theconversation.com/deaths-of-31-people-in-uks-worst-small-boat-disaster-caused-by-governments-systemic-failure-the-cranston-inquiry-conclusions-explained-274920,"Travis Van Isacker, Senior Research Associate, School of Sociology, Politics and International Studies, University of Bristol",2026-02-12T12:35:13Z,maritime transport,An independent inquiry found ‘systemic’ failures that led to the deadliest Channel crossing.,The Conversation Africa,Unknown,News,2026-02-14T06:50:11.510543Z
46857f6072e4c1c1b8936a33fa454935,Türkiye targets trade growth with transport expansion,https://www.hurriyetdailynews.com/turkiye-targets-trade-growth-with-transport-expansion-218876,hurriyetdailynews.com,2026-02-12T11:05:00Z,maritime transport,"The Transport and Infrastructure Ministry plans to continue developing the nation’s transport network and achieve new records in trade, according to its 2026 program.",Hurriyet Daily News,Unknown,News,2026-02-14T06:50:11.510589Z
5cd73ea7b7f6360c3dd5b1164cc5109d,Commission presents action plan to counter drone threats,https://www.globalsecurity.org/military/library/news/2026/02/mil-260211-european-commission02.htm,John Pike,2026-02-12T10:21:55Z,maritime transport,"The European Commission today presented its Action Plan to counter the increasing threats posed by drones to EU security. In recent years, the EU has faced growing and multi-faceted challenges relating to drones and meteorological balloons, including hostile …",Globalsecurity.org,Unknown,News,2026-02-14T06:50:11.510640Z
