article_id,title,link,creator,pubdate,category,description,source,country,article_type,scrape_timestamp
180f4cc020276388605a59bd79d9d408,The LNG Detour: What Scotland’s New Ferry Teaches US,https://cleantechnica.com/2025/09/28/the-lng-detour-what-scotlands-new-ferry-teaches-us/,Michael Barnard,2025-09-29T00:03:07Z,shipping rates,"Scotland’s Glen Sannox was launched with fanfare as the country’s first “green” ferry, meant to reduce the impact of crossings between the mainland and Arran. It was designed as a dual-fuel vessel, running on either marine diesel or liquefied natural gas, wit…",CleanTechnica,Unknown,News,2025-10-06T06:32:11.242546Z
f672582f274b7ebadaaf01ddbd9bebb5,Arctic Sea Route access reshapes global shipping carbon emissions,https://www.nature.com/articles/s41467-025-64437-4,"Pengjun Zhao, Yunlin Li, Caixia Zhang, Tingting Kang, Zhangyuan He, Guangyu Huang, Shiyi Zhang, Xianghao Zhang, Yuanquan Xu, Weiya Kong",2025-09-29T00:00:00Z,shipping rates,Arctic Sea Route access will raise global shipping CO2 by 8.2% by 2100 and worsen regional inequities. IMO 2023 strategy and Green Corridor plans fall short; only a net-zero pathway with stricter fuels and phased rollout eliminates ASR emissions.,Nature.com,Global,News,2025-10-06T06:32:11.242585Z
7b9a78aa3f153d3895887b50a6893e26,"Mizuho Securities Raises PT on Uber from $98.45 to $130, Keeps Its Outperform Rating",https://finance.yahoo.com/news/mizuho-securities-raises-pt-uber-195614049.html,Ali Hassan,2025-10-03T19:56:14Z,freight rates,"Uber Technologies, Inc. (NYSE:UBER) is one of the Top 10 Long-Term Stocks to Invest In According to David Tepper. On September 30, Mizuho Securities raised...",Yahoo Entertainment,Unknown,News,2025-10-06T06:32:11.654544Z
35efbfe70f112964c00fe0b827cdbd9b,Growth Minded – Inside Amazon RelayCon 2025 and the Small Carrier Surge,https://finance.yahoo.com/news/growth-minded-inside-amazon-relaycon-193723948.html,Adam Wingfield,2025-10-03T19:37:23Z,freight rates,Over 8 out of 10 attendees walked into Amazon RelayCon 2025 looking to grow — not survive — and the event made one thing clear: for the right type of small...,Yahoo Entertainment,Unknown,News,2025-10-06T06:32:11.654819Z
9839146fb34a298640b95be53f84f5b1,How Small Carriers Can Break Out of the Load Board Cycle With Five Key Differentiator,https://finance.yahoo.com/news/small-carriers-break-load-board-190036577.html,Adam Wingfield,2025-10-03T19:00:36Z,freight rates,Every small carrier says they’re “reliable.” Every one says they’re “family-owned.” And all of them promise they “treat customers like partners.” Those...,Yahoo Entertainment,Unknown,News,2025-10-06T06:32:11.654864Z
be883dc0390e11bd7daa408c56dd3fcf,"Trucking industry facing ‘horrible’ rates, tariffs, Werner CEO says",https://finance.yahoo.com/news/trucking-industry-facing-horrible-rates-175016580.html,Noi Mahoney,2025-10-03T17:50:16Z,freight rates,"Derek Leathers, chairman and CEO of Werner Enterprises, said regulatory pressures and tariff uncertainty are straining the trucking industry. The post...",Yahoo Entertainment,Unknown,Market Report,2025-10-06T06:32:11.654901Z
cf98931be27ed2b47acdc09bff9a5ce6,"Turnage, TFX, Oberman, Clifford Hay advance to Small Fleet Champ final round",https://www.overdriveonline.com/small-fleet-champ/article/15768558/four-trucking-companies-advance-to-small-fleet-champ-final-round,Todd Dills,2025-10-03T16:08:21Z,freight rates,"Hats off Turnage & Sons LLC, Thomasville Furniture Xpress, Oberman Logistics and Clifford Hay Inc. -- all mastering the fine arts of trucking-biz management in myriad ways. Two champs will be named -- and all recognized -- at NASTC's annual conference Oct. 23…",Overdriveonline.com,Unknown,News,2025-10-06T06:32:11.654950Z
db303bbbba44e7c2abe4b5c53b5e3ea8,The Hidden Cost of Running Cheap Freight – It’s More Than Just the Rate Per Mile,https://finance.yahoo.com/news/hidden-cost-running-cheap-freight-203140817.html,Adam Wingfield,2025-10-02T20:31:40Z,freight rates,"Every small carrier has been there — staring at a weak load board, wondering if hauling a $1.35-a-mile load is better than running empty. On paper it looks...",Yahoo Entertainment,Unknown,News,2025-10-06T06:32:11.655092Z
bb41e8460fa19159e4a59abb214b63ca,Echo Global keeps Moody’s B3 rating in tough market,https://finance.yahoo.com/news/echo-global-keeps-moody-b3-162036246.html,John Kingston,2025-10-02T16:20:36Z,freight rates,Echo Global B3 rating by Moody’s highlights steady earnings despite challenges in a soft freight market. The post Echo Global keeps Moody’s B3 rating in...,Yahoo Entertainment,Global,Market Report,2025-10-06T06:32:11.655127Z
60136a3e0eccb970a766e660090628a6,Electric Trucks and Buses: A Challenge and Opportunity for Rural Co-Ops,https://blogs.edf.org/energyexchange/2025/10/02/electric-trucks-and-buses-a-challenge-and-opportunity-for-rural-co-ops/,EDF Blogs,2025-10-02T15:05:17Z,freight rates,"By Dakoury Godo-Solo, Environmental Defense Fund and Lidiya Kassahun and Margarita Parra, Clean Energy Works Rural electric co-ops face both challenges and opportunities as electric trucks and buses drive new demand. Proactive planning is essential to avoid c…",Environmental Defense Fund,Unknown,News,2025-10-06T06:32:11.655177Z
332cc48d0b7e5ddd8e9f6502a9f7afb9,Trump’s Imminent War(s) and Economic Damage as His Legitimacy Crumbles,https://www.nakedcapitalism.com/2025/10/trumps-imminent-wars-and-economic-damage-as-his-legitimacy-crumbles.html,Yves Smith,2025-10-02T13:55:45Z,freight rates,Trump may be launching not just one but two wars right after he and Hegseth proudly exhibited their nakedness before the military top brass.,Nakedcapitalism.com,Unknown,News,2025-10-06T06:32:11.655215Z
37841412e965cb02b40a66ded282d6b9,"Resisting Oil and Gas, For Health’s Sake (Blog)",https://ssir.org/articles/entry/oil-and-gas-health,SSIR,2025-10-02T12:00:00Z,freight rates,"As regulatory rollbacks invite polluters to poison air, soil, and water, funders and advocates can respond by rallying around community-led solutions that prioritize health over corporate gain.",Ssir.org,Unknown,News,2025-10-06T06:32:11.655256Z
e3ed10545f72ef8bc021ab85597d7beb,ATBS: how a driver can make it in a tough trucking market,https://finance.yahoo.com/news/atbs-driver-tough-trucking-market-110000334.html,John Kingston,2025-10-02T11:00:00Z,freight rates,"ATBS trucking review: In a tough trucking market, drivers find success by optimizing routes and costs. The post ATBS: how a driver can make it in a tough...",Yahoo Entertainment,Unknown,Analysis/Opinion,2025-10-06T06:32:11.655284Z
600d3abb1edd15c3714b9bb89361eb2c,Used-truck market volumes outperformed expectations in August,https://www.overdriveonline.com/equipment/article/15768519/usedtruck-sales-better-than-expected-in-august,Overdrive Staff,2025-10-02T08:12:07Z,freight rates,"According to ACT Research, used Class 8 retail truck sales increased 11% in August over July's numbers, while prices fell. Also: DAT aims at carriers with new features; one-day CMV enforcement operation leads to arrests, OOS orders.",Overdriveonline.com,Unknown,Market Report,2025-10-06T06:32:11.655317Z
b53eaa3ca1d968f9fc1eadad143a6d69,Warp Launches Self-Serve Portal for Instant Freight Quotes Across All Modes,https://www.globenewswire.com/news-release/2025/10/01/3159857/0/en/Warp-Launches-Self-Serve-Portal-for-Instant-Freight-Quotes-Across-All-Modes.html,Warp,2025-10-01T18:00:00Z,freight rates,"The first platform to provide real-time quotes and booking for fleet-agnostic LTL and FTL shipments, in one place. The first platform to provide real-time quotes and booking for fleet-agnostic LTL and FTL shipments, in one place.",GlobeNewswire,Unknown,News,2025-10-06T06:32:11.655439Z
1f4977f285cdac8498aba5372db19f92,BNSF to shippers: Speak up about UP-NS merger,https://finance.yahoo.com/news/bnsf-shippers-speak-ns-merger-124310246.html,Trains.com Staff,2025-10-01T12:43:10Z,freight rates,"BNSF Railway states that Union Pacific's deal to acquire Norfolk Southern will hurt rail competition, increase rates, reduce service, and likely lead to...",Yahoo Entertainment,USA,Market Report,2025-10-06T06:32:11.655490Z
186056104ec2389f22cba3f0856aba7c,KNBS Reports Number Of SGR Passengers Increased In 2025 Quarter 2,https://thekenyatimes.com/business/number-of-sgr-passengers-increases-for-first-time-since-50-fare-hike/,Jason Ndunyu,2025-10-01T08:41:42Z,freight rates,This marks the first time the number of SGR passengers have increased since Kenya Railways introduced a 50 per cent fare hike introduced at the start of 2024.,Thekenyatimes.com,Unknown,Market Report,2025-10-06T06:32:11.655521Z
efe26758144902f731640b34a83ab457,"Goldman Sachs Group Inc. Takes $73,000 Position in Freightos Limited $CRGO",https://www.etfdailynews.com/2025/10/01/goldman-sachs-group-inc-takes-73000-position-in-freightos-limited-crgo/,MarketBeat News,2025-10-01T07:07:03Z,freight rates,"Goldman Sachs Group Inc. bought a new stake in Freightos Limited (NASDAQ:CRGO – Free Report) in the first quarter, HoldingsChannel reports. The firm bought 30,458 shares of the company’s stock, valued at approximately $73,000. Separately, Jane Street Group LL…",ETF Daily News,Unknown,Market Report,2025-10-06T06:32:11.655565Z
7ebe188f8ef9c43bee5948cd7c1ef8a3,Global Crude Exports Set To Hit All-Time High In October,https://finance.yahoo.com/news/global-crude-exports-set-hit-000000022.html,Alex Kimani,2025-10-01T00:00:00Z,freight rates,"Global crude exports set new highs, reaching 40.4 mb/d in September, driven by Saudi Arabia, Iraq, Brazil, and Guyana.",Yahoo Entertainment,Brazil,News,2025-10-06T06:32:11.655650Z
afb599494d7acb8eb40d38f5dd9b26e1,Global Crude Exports Set To Hit All-Time High In October,https://oilprice.com/Energy/Crude-Oil/Global-Crude-Exports-Set-To-Hit-All-Time-High-In-October.html,Alex Kimani,2025-10-01T00:00:00Z,freight rates,"Previously, we reported that U.S. oil production has maintained its upward trajectory in the current year even as oil prices have remained depressed. According to data from the Energy Information Administration (EIA), U.S. crude oil production hit an all-time…",OilPrice.com,Global,Market Report,2025-10-06T06:32:11.655692Z
c3853300534655f87ca83b32249443bd,Can You Guess The Number One Challenge That Americans Believe They Are Facing In 2025?,https://www.activistpost.com/can-you-guess-the-number-one-challenge-that-americans-believe-they-are-facing-in-2025/,Editor,2025-09-30T14:00:00Z,freight rates,"We sure have seen a lot of really crazy things happen so far this year. But in the minds of most Americans, there is one crisis that far outweighs everything else. As I have been documenting for years, our standard of living has been collapsing as the cost of…",Activistpost.com,USA,News,2025-10-06T06:32:11.655801Z
79b2e6a0cdeb1f4c3e521b971b8c5c07,Crash-victims advocates call for truck-safety reforms in D.C.,https://www.overdriveonline.com/life/article/15768251/crashvictims-advocate-calls-for-reforms-in-dc,Overdrive Staff,2025-09-30T08:32:53Z,freight rates,"A new report from the crash-victims adovcacy group the Truck Safety Coalition highlighted states with the highest crash fatality rates per unit of population there, in bid to influence lawmakers on AEBs, new entrant testing, more.",Overdriveonline.com,Unknown,Market Report,2025-10-06T06:32:11.655867Z
12714df03ad376aac81c56aa3665ab5b,Diversification key to weathering down market for Hallahan Transport,https://www.overdriveonline.com/small-fleet-champ/article/15754173/hallahan-transport-finds-longterm-success-with-diversification,Matt Cole,2025-09-30T07:30:52Z,freight rates,Diversification has been the name of the game for 10-truck step deck and milk tanker-hauler Hallahan Transport during the challenging trucking market conditions seen in the last several years.,Overdriveonline.com,Unknown,Market Report,2025-10-06T06:32:11.655899Z
74f4efebdae85c6de841d2906f0561d6,Did DOT Secretary Duffy just kill trucking's 'driver shortage' narrative once and for all?,https://www.overdriveonline.com/business/article/15768125/dots-move-against-nondomiciled-cdl-holders-and-the-driver-shortage,Alex Lockie,2025-09-30T06:54:18Z,freight rates,"Did DOT Secretary Duffy just kill the ""driver shortage"" narrative? With 200,000 non-domiciled drivers set to exit trucking, not even the American Trucking Associations is worried about a ""shortage.""",Overdriveonline.com,USA,News,2025-10-06T06:32:11.655921Z
d1f5779b4d54ab5004ba7dd80d50bb08,Glenveagh looks to 2028 for Dublin office market recovery,https://www.irishtimes.com/business/2025/09/30/glenveagh-looks-to-2028-for-dublin-office-market-recovery/,Richard Cantillon,2025-09-30T05:00:00Z,freight rates,Home builder CEO suggests it will be 2028 before group sells The Freight Building,The Irish Times,Unknown,Market Report,2025-10-06T06:32:11.655944Z
9047d481892d3d1109892765d02a86aa,Tesla V4 Supercharging for Fast 1.2 MW Tesla Semi and 500 Kilowatt EV Charging,https://www.nextbigfuture.com/2025/09/tesla-v4-supercharging-for-fast-1-2-mw-tesla-semi-and-500-kilowatt-ev-charging.html,Brian Wang,2025-09-29T21:13:36Z,freight rates,"The First Tesla V4 cabinet Supercharger are now live. They have 0.5 MW, 3X power density and 2X stalls per cabinet. It takes AC power in and uses 16 trays of power electronics and gives DC power out. This is the tech that will make 1.2MW charging for Semi, an…",Next Big Future,Unknown,News,2025-10-06T06:32:11.656032Z
148edba0c5ed9167591a86540d0d9485,EU and NATO Consider Denying Russia Baltic Access,https://oilprice.com/Energy/Energy-General/EU-and-NATO-Consider-Denying-Russia-Baltic-Access.html,Cyril Widdershoven,2025-09-29T18:30:00Z,freight rates,"The northern European countries are currently embroiled in a Russian hybrid warfare attempt, a situation that demands immediate and decisive attention. Denmark, a member of both the EU and NATO, is set to host a European Union Summit in Copenhagen this week, …",OilPrice.com,Russia,News,2025-10-06T06:32:11.656063Z
28a6579da50c38b882ef3a2a101c31f1,Making a dream come true: Trucker of the Month John Treadway,https://www.overdriveonline.com/trucker-of-the-year/article/15767883/truckingbiz-success-is-realized-dream-for-trucker-of-the-month,Matt Cole,2025-09-29T15:27:49Z,freight rates,"John Treadway always wanted to have a truck that was recognizable in his community. After years as a successful owner-operator, he's made that vision a reality.",Overdriveonline.com,Unknown,News,2025-10-06T06:32:11.656095Z
e993faa5f4c101145d0ac6c6883f8a5f,Energy crisis looms for US warehouses,https://finance.yahoo.com/news/energy-crisis-looms-us-warehouses-151343052.html,Todd Maiden,2025-09-29T15:13:43Z,freight rates,AI adoption and data center buildouts have warehouse tenants fretting over energy infrastructure. The post Energy crisis looms for US warehouses appeared...,Yahoo Entertainment,Unknown,News,2025-10-06T06:32:11.656127Z
4d5ae9dd863c6ab63470ca80ad042d34,Saudi Arabia expected to lift November crude prices to Asia,https://finance.yahoo.com/news/saudi-arabia-expected-lift-november-093527517.html,Siyi Liu,2025-09-29T09:35:27Z,freight rates,"Saudi Arabia, the world's biggest oil exporter, is expected to lift November crude oil prices for Asian buyers to track gains in Middle East benchmarks...",Yahoo Entertainment,Unknown,Market Report,2025-10-06T06:32:11.656157Z
01f92e5ae9bd1e4ff6a5c8e224aad99b,Approve the first transcontinental railroad for freight,https://www.americanthinker.com/blog/2025/09/approve_the_first_transcontinental_railroad_for_freight.html,,2025-09-29T04:00:00Z,freight rates,"Regulators love to say they’re protecting consumers. But too often, “protection” really means blocking innovation that would improve efficiency, save money, and strengthen the economy. That is what is at stake as the Surface Transpo...",Americanthinker.com,Unknown,News,2025-10-06T06:32:11.656201Z
81a27f08994327d65400d458a82b1fdd,"Politics, AI, and Stress: Why Teaching in Philly Has Never Been Harder",https://www.phillymag.com/news/2025/10/03/teachers-challenges-philadelphia/,Laura Swartz,2025-10-03T22:32:43Z,charter rates,"Political tension, pandemic learning loss, cell phones everywhere, and the AI takeover of everything. All that before the morning bell even rings. Welcome to teaching in 2025.",phillymag.com,Unknown,News,2025-10-06T06:32:12.103177Z
7318b38db722bbc57972542bece48ea1,How Larry Arnn Transformed Hillsdale College Over 25 Years,https://www.dailysignal.com/2025/10/02/how-larry-arnn-transformed-hillsdale-college-over-25-years/,Ty Ruddy,2025-10-02T19:30:00Z,charter rates,"Over the past 25 years, Larry Arnn has transformed Hillsdale College from a respected liberal arts institution into a nationally recognized force in higher education.... Read More
The post How Larry Arnn Transformed Hillsdale College Over 25 Years appeared fi…",Daily Signal,Unknown,News,2025-10-06T06:32:12.103406Z
2a664a2b66c3674d1599afffdb27675d,Parents' voice? Students first? Here's what voters want from their school trustee,https://www.cbc.ca/news/canada/calgary/parents-trustees-what-matters-1.7642875,,2025-10-02T10:00:00Z,charter rates,"School trustees are the ones who pass the budget, decide to launch or cancel programs, and write policy to guide district superintendents through difficult, value-laden challenges. On Oct. 20, Calgarians will go to the polls to elect them.",CBC News,Unknown,News,2025-10-06T06:32:12.103449Z
613884323429bdce1ab94d9f262ba872,Tracking recession red flags in Miami,https://therealdeal.com/magazine/october-2025/head-in-the-sand/,Katherine Kallergis,2025-10-01T15:00:00Z,charter rates,"Live by the beach long enough, and you start to ignore the red and yellow flags that come and go with the tides. Those playing in the sandbox that is South Florida’s real estate market today find the signs of danger almost invisible, and talk in the region st…",The Real Deal,Unknown,Market Report,2025-10-06T06:32:12.103530Z
ba528faae46b4144f385d3e9988441fc,Building Your ROI Measurement System For L&D,https://elearningindustry.com/building-your-roi-measurement-system-for-ld,Joel Ippel,2025-10-01T09:00:17Z,charter rates,"The difference between organizations that successfully measure ROI and those that struggle isn't access to better data or more sophisticated tools—it's having a systematic approach that evolves with their needs.
This post was first published on eLearning Indu…",Elearningindustry.com,Unknown,News,2025-10-06T06:32:12.103624Z
6c73a08c5ba0962a03d2e21ef4b86c1e,Morrison & Foerster Discusses Shareholder Proposals During the 2025 Proxy Season,https://clsbluesky.law.columbia.edu/2025/10/01/morrison-foerster-discusses-shareholder-proposals-during-the-2025-proxy-season/,"Ryan J. Adams, Scott Lesmes and Sydney E. Stancik",2025-10-01T04:01:55Z,charter rates,"During each annual proxy “season,” companies receive and respond to shareholder proposals and often attempt to exclude these proposals from their proxy statements through no-action requests submitted to the U.S. Securities and Exchange Commission’s (SEC) Divi…",Columbia.edu,Unknown,News,2025-10-06T06:32:12.103674Z
048e42ad0884a451110cadfa21723c17,Illiteracy is a policy choice,https://www.isegoria.net/2025/09/illiteracy-is-a-policy-choice/,Isegoria,2025-09-30T14:47:40Z,charter rates,"This month, the Department of Education released its latest edition of the National Assessment of Educational Progress, the Nation’s Report Card: Nationwide, reading scores for fourth graders peaked back in 2015, and while the especially ugly 2022 outcomes we…",Isegoria.net,Unknown,Market Report,2025-10-06T06:32:12.103775Z
5b20e226c81ee4cd9719db61824cfa01,"In YouTube TV Carriage Battles, Media Companies Say Tech Giant Is After Their Streaming Lunch Money",http://deadline.com/2025/09/youtube-tv-streaming-deals-1236557290/,Dade Hayes,2025-09-30T14:15:00Z,charter rates,"Having rapidly grown from startup to dominant pay-TV operator, YouTube TV now appears to be looking to level up again by incorporating partners’ streaming programming directly into its user interface. This drive to “ingest” content, as opposed to merely “inte…",Deadline,Unknown,News,2025-10-06T06:32:12.103826Z
bcb5d04fe9cf66a62d879537729a3c72,Why Index Fund Giant Vanguard Is Pushing Actively Managed Bond Funds,https://www.forbes.com/sites/hanktucker/2025/09/30/why-index-fund-giant-vanguard-is-pushing-actively-managed-bond-funds/,"Hank Tucker, Forbes Staff, 
 Hank Tucker, Forbes Staff
 https://www.forbes.com/sites/hanktucker/",2025-09-30T10:30:00Z,charter rates,The $11 trillion in assets manager has shifted its recommended allocations to 70% fixed income. It now has more than $1 trillion in funds committed to bonds.,Forbes,Unknown,Market Report,2025-10-06T06:32:12.103886Z
e1ac4655fb0d7001ad3a6e4c1503372b,Fidelity Dividend ETF for Rising Rates $FDRR Holdings Raised by CX Institutional,https://www.etfdailynews.com/2025/09/30/fidelity-dividend-etf-for-rising-rates-fdrr-holdings-raised-by-cx-institutional/,MarketBeat News,2025-09-30T07:54:51Z,charter rates,"CX Institutional raised its position in shares of Fidelity Dividend ETF for Rising Rates (NYSEARCA:FDRR – Free Report) by 32.4% in the second quarter, according to its most recent disclosure with the Securities and Exchange Commission. The institutional inves…",ETF Daily News,Unknown,Market Report,2025-10-06T06:32:12.103929Z
1049d599fb5b624fe4aa381113a89b54,"GHA Discovery D$5 App Booking Bonus Extended Through December 31, 2025",https://loyaltylobby.com/2025/09/29/gha-discovery-d5-app-booking-bonus-extended-through-december-31-2025/,John Ollila,2025-09-30T03:24:04Z,charter rates,"Global Hotel Alliance (GHA) continues to offer an app booking bonus, which has been extended for an additional three months through December 31. GHA Discovery members who book using their app and stay between January 1 and December 31, 2025, will earn this bo…",Loyaltylobby.com,Global,News,2025-10-06T06:32:12.103974Z
75dec207a6c6f2a45979725f3c1eff50,NBC says Google ‘wants to control what we watch’ as YouTube TV deal expires tomorrow,http://9to5google.com/2025/09/29/nbc-says-google-wants-to-control-what-we-watch-as-youtube-tv-deal-expires-tomorrow/,Ben Schoon,2025-09-29T15:15:00Z,charter rates,"Negotiations between YouTube TV and NBC seem to be getting heated. With the current deal set to expire tomorrow, YouTube TV is offering its subscribers a $10 credit if channels go dark, while NBC says that Google “wants to control what we watch.”



 more…",9to5google.com,Unknown,News,2025-10-06T06:32:12.104035Z
d5c750b68f0c86a47c2744f8fdaf2bc7,Will AI make cheaper personalized insurance premiums possible? Here’s why it’s a slippery slope,https://theconversation.com/will-ai-make-cheaper-personalized-insurance-premiums-possible-heres-why-its-a-slippery-slope-262787,"Arthur Charpentier, Professeur de mathématiques, Université du Québec à Montréal (UQAM); Université de Rennes 1 - Université de Rennes",2025-09-29T12:20:25Z,charter rates,"In this age of algorithms, personalized insurance is encountering legal limits, especially the ban on discrimination. Can we balance accurate pricing, solidarity, and fairness?",The Conversation Africa,Unknown,News,2025-10-06T06:32:12.104122Z
43ca20efe90e0ae7bab7e73de5261646,Investors fall victim to alleged $112M retail Ponzi scheme: Trial Balance,https://www.cfo.com/news/retailers-investors-fall-victim-alleged-ponzi-scheme-tai-lopez-alex-mehr-fraud-sec-trial-balance-/761287/,Lauren Muskett and Adam Zaki,2025-09-29T10:00:00Z,charter rates,"RadioShack​​​​​, Dressbarn and Pier 1 Imports are among eight companies tied up in the alleged fraud, the SEC says.",CFO Magazine,Unknown,News,2025-10-06T06:32:12.104204Z
dcc9333e1301e73132c7d8240969c601,Weekly Climate and Energy News Roundup #659,https://wattsupwiththat.com/2025/09/29/weekly-climate-and-energy-news-roundup-659/,Guest Blogger,2025-09-29T09:00:00Z,charter rates,"Quote of the Week: “Experiment is the only means of knowledge at our disposal. Everything else is poetry, imagination.”— Max Planck",Wattsupwiththat.com,Unknown,Market Report,2025-10-06T06:32:12.104262Z
4e613db4c339a275306f46ac973b7989,Hong Kong shipper Wah Kwong joins push for greener energy at ports,https://biztoc.com/x/b89ab2440d4ef926,scmp.com,2025-10-05T03:38:35Z,maritime transport,"Hong Kong shipping firm Wah Kwong Maritime Transport has teamed up with a European partner to build shoreside power-supply projects in China and North Asia to capture opportunities from tightening emission regulations at ports.
Wah Kwong last month formed a 5…",Biztoc.com,China,News,2025-10-06T06:32:12.815277Z
9726c5f1e9e6b5e396168b167f522dcd,"Shipping sector facing critical shortage of local workforce, says Transport Minister",https://www.thestar.com.my/news/nation/2025/10/04/shipping-sector-facing-critical-shortage-of-local-workforce-says-transport-minister,The Star Online,2025-10-04T08:25:00Z,maritime transport,"ALOR GAJAH: The shipping sector is facing a critical shortage of local professionals and other key maritime personnel, which needs to be addressed immediately, said the Transport Minister. Read full story",The Star Online,Unknown,News,2025-10-06T06:32:12.815329Z
33028e9bec9111c86f193d0ff6505222,Pressure mounts on Meloni’s gov’t as Gaza protests paralyse Italy,https://www.aljazeera.com/news/2025/10/3/pressure-mounts-on-italian-govt-over-gaza-after-strike-paralyses-nation,Al Jazeera,2025-10-03T19:32:18Z,maritime transport,"Union says more than two million took to the streets Friday, with massive turnout expected tomorrow for Rome protests.",Al Jazeera English,Unknown,News,2025-10-06T06:32:12.815369Z
