article_id,title,link,creator,pubdate,category,description,source,country,article_type,scrape_timestamp
68ad83f27a7cd840bd84174b4cf02ed4,Oil settles lower as investors brace for possible OPEC+ output hike,https://sg.finance.yahoo.com/news/oil-settles-lower-investors-brace-222011619.html,By Georgina McCartney,2025-09-30T22:20:11Z,Suez Canal,HOUSTON (Reuters) -Oil prices settled lower on Tuesday as investors braced for a supply surplus due to potential OPEC+ plans for a larger output hike next...,Yahoo Entertainment,Unknown,Market Report,2025-10-06T06:32:14.603808Z
be94cfb38cfe29a488057c5c7f9a67e8,"IMEC, Italy and India: A corridor linking the Mediterranean and the Indo-Pacific",https://economictimes.indiatimes.com/news/economy/foreign-trade/imec-italy-and-india-a-corridor-linking-the-mediterranean-and-the-indo-pacific/articleshow/124238834.cms,Dipanjan Roy Chaudhury,2025-09-30T15:49:58Z,Suez Canal,"The Indo-Mediterranean Corridor is central to global connectivity. Italian and Indian officials discussed its prospects in Rome. This initiative connects trade, security, and diplomacy. The corridor strengthens Middle Eastern stability and enhances Asia-Europ…",The Times of India,India,News,2025-10-06T06:32:14.603837Z
a5b47aa885b2c08132bac0cb8e90e1dd,Historic crossing of Captain Nikos through the Suez Canal,https://en.protothema.gr/2025/09/30/historic-crossing-of-captain-nikos-through-the-suez-canal/,admin,2025-09-30T09:34:00Z,Suez Canal,"The maiden transit of the vessel through the Suez Canal was not just another maritime event; it was a symbolic and emotional meeting of two Group companies at one of the most strategic points in global shipping geography
The post Historic crossing of Captain …",Protothema.gr,Egypt,News,2025-10-06T06:32:14.603876Z
eb4b3222544ed9aef46844580f12353d,Geolocation and Starlink,https://www.potaroo.net/ispcol/2025-09/starlinkgeo.html,,2025-09-29T23:00:00Z,Suez Canal,"""Where are you?"" is not an easy question to answer on the Internet. The Internet did not adopt a geographic address plan which means that you are going to need a lot of additional information if you want to map an IP address into a location at the level of a …",Potaroo.net,Unknown,News,2025-10-06T06:32:14.603920Z
cb6c0d9c72e4491f3153a0cb58cb083d,Arctic LNG 2: How China Revived Russia’s Frozen Gas,https://oilprice.com/Energy/Natural-Gas/Arctic-LNG-2-How-China-Revived-Russias-Frozen-Gas.html,Natalia Katona,2025-09-29T22:00:00Z,Suez Canal,"Russia’s Arctic LNG 2 project is rapidly transforming from a sanctioned stalemate into a strategic lifeline for China’s energy security. Despite years of delays, Western sanctions, and logistical hurdles, the venture has begun delivering liquefied natural gas…",OilPrice.com,China,News,2025-10-06T06:32:14.603942Z
8597fd403172a3424e0b24dc5fa2a46a,U.S. Navy Decommissions Avenger-class Mine Countermeasures Ships in Bahrain,https://www.globalsecurity.org/military/library/news/2025/09/mil-250925-usn01.htm,John Pike,2025-09-29T02:00:05Z,Suez Canal,"After nearly 40 years of active service, three recently decommissioned U.S. Navy Avenger-class mine countermeasures ships and their crews were recognized in conjunction with a final decommissioning ceremony for USS Devastator (MCM 6) on board Naval Support Ac…",Globalsecurity.org,Unknown,News,2025-10-06T06:32:14.604033Z
e9f07dbd9f7ec2bc5fc4859d91f730c2,"How to watch Arsenal vs West Ham: live stream Premier League 2025/26 game, TV channels, preview",https://www.techradar.com/how-to-watch/football/arsenal-vs-west-ham-premier-league-2025-26,Adrian Back,2025-10-04T12:00:00Z,Panama Canal,"All the ways to watch Arsenal vs West Ham live streams online and from anywhere, as the Hammers seek a third straight win over the Gunners at the Emirates.",TechRadar,Unknown,Analysis/Opinion,2025-10-06T06:32:14.998156Z
4d409bc3d42e39b249a15e63b8cb4556,"Science news this week: Famed primatologist Jane Goodall dies, Iran sinks at an alarming rate, and scientists create human egg cells from skin",https://www.livescience.com/animals/science-news-this-week-famed-primatologist-jane-goodall-dies-iran-sinks-at-an-alarming-rate-and-scientists-create-human-egg-cells-from-skin,"ben.turner@futurenet.com (Ben Turner) , Ben Turner",2025-10-04T11:00:00Z,Panama Canal,"Oct. 4, 2025: Our weekly roundup of the latest science in the news, as well as a few fascinating articles to keep you entertained over the weekend.",Live Science,Unknown,Market Report,2025-10-06T06:32:14.998196Z
fa60ce76dea464ef0b75465a9df9c7d0,"How to watch Australia vs New Zealand: FREE Rugby Championship 2025 streams, TV schedule, preview",https://www.techradar.com/how-to-watch/rugby/australia-vs-new-zealand-rugby-championship-2025-free,Adrian Back,2025-10-04T07:45:00Z,Panama Canal,"Here's how to watch Australia vs New Zealand live streams online, with the All Blacks and the Wallabies still in with a chance of winning the Rugby Championship.",TechRadar,Australia,Analysis/Opinion,2025-10-06T06:32:14.998208Z
832cac81aae6b5b729ce4615ec0ed16c,Wealth Enhancement Advisory Services LLC Increases Position in Norwegian Cruise Line Holdings Ltd. $NCLH,https://www.etfdailynews.com/2025/10/04/wealth-enhancement-advisory-services-llc-increases-position-in-norwegian-cruise-line-holdings-ltd-nclh/,MarketBeat News,2025-10-04T07:10:51Z,Panama Canal,"Wealth Enhancement Advisory Services LLC raised its position in Norwegian Cruise Line Holdings Ltd. (NYSE:NCLH – Free Report) by 17.9% during the second quarter, HoldingsChannel reports. The firm owned 34,444 shares of the company’s stock after buying an addi…",ETF Daily News,Norway,Market Report,2025-10-06T06:32:14.998252Z
7f038db26f83d0394cde447e2ac676c8,Sam Bankman-Fried and the Multibillion-Dollar Drama Over FTX’s Ruins,https://www.motherjones.com/politics/2025/10/ftx-sam-bankman-fried-crypto-bankruptcy-sullivan-cromwell-fraud/,"Artis Curiskis, Jonathan Jones, Sophie Bridges, and Daniel Schulman",2025-10-03T16:30:00Z,Panama Canal,"Sam Bankman-Fried nervously sheds his dark brown prison jumpsuit to reveal athletic shorts and a loose-fitting gray T-shirt. “There’s this extremely dumb cat and mouse game where, for reasons no one has ever bothered to articulate, between the hours of like 6…",Mother Jones,Unknown,News,2025-10-06T06:32:14.998303Z
0c0fa250e59cb9560266ae442f9bb0d6,Review: Earth Shapers,https://www.maproomblog.com/2025/10/review-earth-shapers/,Jonathan Crowe,2025-10-03T12:22:18Z,Panama Canal,"The title of this book does not quite capture what Maxim Samson is doing. Earth Shapers: How We Mapped and Mastered the World, from the Panama Canal to the Baltic Way isn’t really about shaping the earth,… More",Maproomblog.com,Panama,Analysis/Opinion,2025-10-06T06:32:14.998330Z
0146a4c41396d234f3467bbc168d6ad8,Norwegian Cruise Line Holdings Ltd. $NCLH Shares Sold by Signaturefd LLC,https://www.etfdailynews.com/2025/10/03/norwegian-cruise-line-holdings-ltd-nclh-shares-sold-by-signaturefd-llc/,MarketBeat News,2025-10-03T08:39:09Z,Panama Canal,"Signaturefd LLC cut its position in Norwegian Cruise Line Holdings Ltd. (NYSE:NCLH – Free Report) by 6.3% during the second quarter, Holdings Channel reports. The firm owned 9,724 shares of the company’s stock after selling 657 shares during the period. Signa…",ETF Daily News,Norway,Market Report,2025-10-06T06:32:14.998370Z
729df31534072e06a39d50b9060373e4,NEWS: Royal Caribbean Hit With Another Norovirus Outbreak,https://allears.net/2025/10/02/royal-caribbean-hit-with-another-norovirus-outbreak/,Robin Burks,2025-10-02T18:03:11Z,Panama Canal,"Royal Caribbean has had another norovirus outbreak.
The post NEWS: Royal Caribbean Hit With Another Norovirus Outbreak appeared first on AllEars.Net.",allears.net,Unknown,News,2025-10-06T06:32:14.998409Z
43cb636d44aece6cf9d92c1db8860e99,"How to watch Conference League 2025/26: live stream options, TV channels, free streams",https://www.techradar.com/how-to-watch/football/conference-league-2025-26-live-free,Adam Marshall,2025-10-02T13:00:00Z,Panama Canal,"All the ways to watch Conference League 2025/26 live streams online and from anywhere, as 36 clubs seek European glory in UEFA's third competition.",TechRadar,Unknown,News,2025-10-06T06:32:14.998480Z
f15606e5593aa058e920cad051806ce5,"Exclusive-China’s banks lend to Saudi gas project while its funds sit out of BlackRock-led deal, sources say",https://finance.yahoo.com/news/exclusive-china-banks-lend-saudi-123028339.html,By Hadeel Al Sayegh,2025-10-02T12:30:28Z,Panama Canal,"DUBAI (Reuters) -China’s biggest state banks are lending billions to Aramco’s Jafurah gas project, though its funds have passed on the opportunity to invest ...",Yahoo Entertainment,China,News,2025-10-06T06:32:14.998502Z
1bff8eb18e9aa85b6872d2dfef765ab4,"The Panama Canal needs a staggering amount of water to operate. Climate change could threaten that, study warns",https://www.livescience.com/planet-earth/climate-change/the-panama-canal-needs-a-staggering-amount-of-water-to-operate-climate-change-could-threaten-that-study-warns,Corey Kane,2025-10-02T09:34:57Z,Panama Canal,"The vital commercial artery depends on a supply of fresh water to move ships between the two oceans. Drought conditions that were once rare could become common by the end of the century, greatly impacting the canal’s operation.",Live Science,Panama,News,2025-10-06T06:32:14.998543Z
833b57a411512ff845fd057c9f0977d6,"V Square Quantitative Management LLC Has $257,000 Holdings in Norwegian Cruise Line Holdings Ltd. $NCLH",https://www.etfdailynews.com/2025/10/02/v-square-quantitative-management-llc-has-257000-holdings-in-norwegian-cruise-line-holdings-ltd-nclh/,MarketBeat News,2025-10-02T07:58:54Z,Panama Canal,"V Square Quantitative Management LLC boosted its stake in Norwegian Cruise Line Holdings Ltd. (NYSE:NCLH – Free Report) by 10.8% during the 2nd quarter, according to the company in its most recent filing with the Securities and Exchange Commission (SEC). The …",ETF Daily News,Norway,Market Report,2025-10-06T06:32:14.998586Z
44893a6af31dec3d9e4173717ee0be02,"Cruise Chaos: 71 Sick As Norovirus Spreads On Royal Caribbean — Passengers Panic Over Lockdown, Who's To Blame?",https://www.ibtimes.com/cruise-chaos-71-sick-norovirus-spreads-royal-caribbean-passengers-panic-over-lockdown-whos-3784991,Crisnel,2025-10-01T12:05:33Z,Panama Canal,Panic at sea as 71 passengers fall sick with norovirus on Royal Caribbean's Serenade of the Seas — outbreak sparks lockdown fears and questions over who's really to blame.,International Business Times,Unknown,News,2025-10-06T06:32:14.998632Z
eea1905ca1857ac94f89f01db4ad4e40,Copa Airlines Turns One Trip Into Two With Its Panama Stopover Program,https://www.forbes.com/sites/carleyrojasavila/2025/09/30/copa-airlines-turns-one-trip-into-two-with-its-panama-stopover-program/,"Carley Rojas Ávila, Contributor, 
 Carley Rojas Ávila, Contributor
 https://www.forbes.com/sites/carleyrojasavila/",2025-10-01T03:51:24Z,Panama Canal,"Stopovers programs can successfully to grow tourism around the world. Now, Copa Airlines leverages its unmatched connectivity in the Americas to do the same for Panama.",Forbes,USA,News,2025-10-06T06:32:14.998653Z
0e2a99e2e77458cc60d721670ba8f98b,"How to watch Galatasaray vs Liverpool: live Champions League 2025/26 game, free streams",https://www.techradar.com/how-to-watch/football/galatasaray-vs-liverpool-champions-league-2025-26-free,Adrian Back,2025-09-30T16:30:00Z,Panama Canal,"All the ways to watch Galatasaray vs Liverpool live streams online and on TV from anywhere, as the Reds look to bounce back from their league defeat.",TechRadar,Unknown,News,2025-10-06T06:32:14.998689Z
8c0b63f0d500be0abaf58849aa0c6b01,"How to watch Chelsea vs Benfica: live Champions League 2025/26 game, free streams",https://www.techradar.com/how-to-watch/football/chelsea-vs-benfica-champions-league-2025-26-free,Greg Lea,2025-09-30T16:30:00Z,Panama Canal,"All the ways to watch Chelsea vs Benfica live streams online and on TV from anywhere, as both teams get their Champions League campaigns underway.",TechRadar,Unknown,News,2025-10-06T06:32:14.998721Z
74c151d8ed48506a907ae86fb708cef1,Fantagraphics To Publish John Vasquez Mejias' Lolita Lebrón Woodcut,https://bleedingcool.com/comics/fantagraphics-to-publish-john-vasquez-mejias-lolita-lebron-woodcut/,Rich Johnston,2025-09-30T10:57:03Z,Panama Canal,"John Vasquez Mejias' has sold the North American publishing rights to his upcoming woodcut graphic novel Lolita Lebrón-Puerto Rican Revolutionary, the sequel to his 2024 book Puerto Rican War: A Graphic History about the Puerto Rican nationalist ""whose fight …",Bleeding Cool News,USA,News,2025-10-06T06:32:14.998751Z
eb42c12335bcdeb2293bf10251430fe6,16-night luxury full-board cruise around Central America & Caribbean with LA overnight ️,https://www.holidaypirates.com/cruises/16-night-luxury-full-board-cruise-around-central-america-and-caribbean-with-LA-overnight,Grace,2025-09-30T09:40:58Z,Panama Canal,"Mateys, check out this epic holiday from Value Added Travel that gets you a 4-star overnight stay in Los Angeles, then a 16-night full-board cruise around Central America and the Caribbean with up to 44% off the normal price.With a saving of up to £720, this …",Holidaypirates.com,USA,News,2025-10-06T06:32:14.998781Z
abf239eb17b17153854c097f61dc45f4,MICHAEL LUCCI: Legal Leaders Wanted To Save Critical Infrastructure,https://dailycaller.com/2025/09/30/opinion-legal-leaders-wanted-to-save-critical-infrastructure-michael-lucci/,Michael Lucci,2025-09-30T05:26:23Z,Panama Canal,Chinese surveillance cameras contain a secret functionality that allows China’s military to take over the networks to which the cameras are connected.,The Daily Caller,China,News,2025-10-06T06:32:14.998799Z
73d5ba62e0ca5bb5dcc40d3b27b2fa97,Panama Canal Offers Shippers More Flexible Booking System,https://biztoc.com/x/ef54ac5a5a2d6b65,bloomberg.com,2025-09-29T23:27:55Z,Panama Canal,,Biztoc.com,Panama,News,2025-10-06T06:32:14.998818Z
b101313e28293eb73b700185e07f21d6,Top Leisure Stocks To Consider – September 27th,https://www.etfdailynews.com/2025/09/29/top-leisure-stocks-to-consider-september-27th/,MarketBeat News,2025-09-29T05:05:12Z,Panama Canal,"Carnival, Royal Caribbean Cruises, Airbnb, Norwegian Cruise Line, Caesars Entertainment, Trip.com Group, and Pool are the seven Leisure stocks to watch today, according to MarketBeat’s stock screener tool. Leisure stocks are shares of publicly traded companie…",ETF Daily News,Norway,Market Report,2025-10-06T06:32:14.998856Z
230a786342fa953591fb4ea5207c2063,Weekly Update 05-Oct-2025,https://blog.nikonians.org/archives/2025/10/news_update_weekly_2025_10_05_194.html,,2025-10-05T03:53:38Z,Black Sea shipping,This weeks Editor's Choice images and top discussions at Nikonians - 05 October 2025,Nikonians.org,Unknown,Market Report,2025-10-06T06:32:15.359618Z
65fcead2c727bc394ed9adf778a5c084,'Shadow economies' are growing. Military planners and operators must take them into account,https://www.defenseone.com/ideas/2025/10/shadow-economies-are-growing-military-planners-and-operators-must-take-them-account/408560/,Maj. Benjamin Backsmeier,2025-10-02T17:21:41Z,Black Sea shipping,"Black markets prolong wars, defang sanctions, fray alliances, and help rogue governments and groups survive and thrive.",Defense One,Unknown,Market Report,2025-10-06T06:32:15.360005Z
8ad47779c912ec82a65eac5268548b8c,Undersea cable attacks drive sea drone development — Stark's Vanta unmanned vessels could be an affordable solution to protecting vital infrastructure,https://www.tomshardware.com/tech-industry/undersea-cable-attacks-drive-sea-drone-development-starks-vanta-unmanned-vessels-could-be-an-affordable-solution-to-protecting-vital-infrastructure,Mark Tyson,2025-10-02T11:10:54Z,Black Sea shipping,Anglo-German autonomous systems specialist Stark has demonstrated its first unmanned surface vessels (USVs) - sea drones.,Tom's Hardware UK,Germany,News,2025-10-06T06:32:15.360090Z
9fc0522a557ea557469e6399914dec39,These AR Binoculars Helped Me Unplug and Bathe in a Sea of Stars,https://gizmodo.com/unistellar-envision-binoculars-augmented-reality-2000665716,Kyle Barr,2025-10-01T14:00:17Z,Black Sea shipping,Unistellar's Envision binoculars will help you identify nearby mountains and distant stars.,Gizmodo.com,Unknown,News,2025-10-06T06:32:15.360167Z
b048c9dbdf559f1ce318bfa134831a9f,A secret no more: Russia and North Korea's battle against Ukraine is celebrated in Moscow exhibit,https://www.japantimes.co.jp/news/2025/09/30/asia-pacific/russia-north-korea-art-exhibit/,Andrew Osborn,2025-09-30T11:13:00Z,Black Sea shipping,"For months, Russia and North Korea sought to keep secret the role Pyongyang's soldiers played in helping Moscow push Ukrainians out of Kursk in western Russia.",The Japan Times,Russia,News,2025-10-06T06:32:15.360191Z
5bd9141d504199ccc6af733c35f480d8,A secret no more: Russia and N. Korea's battle against Ukraine is celebrated in Moscow exhibit,https://www.thestar.com.my/news/world/2025/09/30/a-secret-no-more-russia-and-n-korea039s-battle-against-ukraine-is-celebrated-in-moscow-exhibit,Andrew Osborn,2025-09-30T10:57:00Z,Black Sea shipping,"MOSCOW (Reuters) -Smiling Russian and North Korean troops shown holding the two countries' flags as they celebrate their victory over Ukrainian forces in Russia's Kursk region, and a painting of Pyongyang's troops engaged in a firefight against Ukrainian forc…",The Star Online,Russia,News,2025-10-06T06:32:15.360225Z
f161a78270fcdb46e1a7b8d94835b70b,A secret no more: Russia and N. Korea's battle against Ukraine is celebrated in Moscow exhibit,https://ca.news.yahoo.com/secret-no-more-russia-n-105257531.html,By Andrew Osborn,2025-09-30T10:52:57Z,Black Sea shipping,MOSCOW (Reuters) -Smiling Russian and North Korean troops shown holding the two countries' flags as they celebrate their victory over Ukrainian forces in...,Yahoo Entertainment,Russia,News,2025-10-06T06:32:15.360247Z
6645d4540df4ca90b5672865170dacd4,"10 Best Bets for $75 or Less – Caps, Quarter Zips, & Goodfellow Clearance Picks",https://dappered.com/2025/09/10-best-bets-for-75-or-less-caps-quarter-zips-goodfellow-clearance-picks/,Joe,2025-09-29T17:42:20Z,Black Sea shipping,Plus a super stylish movie that's not an Ocean's movie... yet totally is.,Dappered.com,Unknown,News,2025-10-06T06:32:15.360280Z
aeb9a17284a396f1e8c8170359756bb0,Crude Oil Prices Plunge Over 3% as OPEC+ Signals More Supply,https://oilprice.com/Latest-Energy-News/World-News/Crude-Oil-Prices-Plunge-Over-3-as-OPEC-Signals-More-Supply.html,Tom Kool,2025-09-29T16:59:05Z,Black Sea shipping,"Crude futures slumped on Monday, extending their biggest single-day slide in weeks as OPEC+ signaled it may press ahead with another round of output increases despite production shortfalls across the group. By 12:48 p.m. ET, benchmark contracts were down more…",OilPrice.com,Unknown,Market Report,2025-10-06T06:32:15.360321Z
b7fa67b79ec819c3b77b6059eddedc0e,3 Culinary Destinations Loved By Gourmet Travelers In The Know,https://www.forbes.com/sites/rebeccahughes/2025/09/29/3-culinary-destinations-loved-by-gourmet-travelers-in-the-know/,"Rebecca Ann Hughes, Contributor, 
 Rebecca Ann Hughes, Contributor
 https://www.forbes.com/sites/rebeccahughes/",2025-09-29T13:00:04Z,Black Sea shipping,"According to experts, foodie travelers don’t just want great restaurants anymore—they want an experience that gives them a true insight into a destination.",Forbes,Unknown,Analysis/Opinion,2025-10-06T06:32:15.360411Z
71d30cf14dee2454988b862e609d05ca,Royal Navy Re-Armed: Sea Venom Anti-Ship Missile Achieves IOC and Naval Strike Missile is Test Fired,https://theaviationist.com/2025/10/04/sea-venom-ioc-naval-strike-missile-test-fire/,James Gray,2025-10-04T18:02:14Z,Red Sea shipping,"The Royal Navy is becoming more lethal as September brings new developments in the deployment of two of its vital anti-ship missiles. The Sea Venom light anti-ship missile, carried by the Wildcat HMA2, and the ship-borne heavy anti-ship Naval Strike Missile (…",Theaviationist.com,Unknown,News,2025-10-06T06:32:15.789505Z
b6d77e6f3ccab6d7ca977c0e140c4356,Iranian president says Tehran does not seek nuclear weapons,https://freerepublic.com/focus/f-chat/4344327/posts,Reuters News Wire,2025-10-04T17:14:24Z,Red Sea shipping,"DUBAI, June 16 (Reuters) - Iran does not intend to develop nuclear weapons but will pursue its right to nuclear energy and research, President Masoud Pezeshkian said on Monday, reiterating Supreme Leader Ayatollah Ali Khamenei's religious edict against weapon…",Freerepublic.com,Unknown,News,2025-10-06T06:32:15.789554Z
ef7a8b820d7adac4b95a58776d68bed0,Israel and Iran on the brink: Preventing the next war,https://www.iss.europa.eu/publications/briefs/israel-and-iran-brink-preventing-next-war,fanny.pollet@iss.europa.eu,2025-10-03T06:54:45Z,Red Sea shipping,"Israel and Iran on the brink: Preventing the next war
fanny.pollet@i…
Fri, 10/03/2025 - 09:54


 10 minutes
 
 The 12-day war of June 2025 marks a watershed moment: Israel, Iran and the United States demonstrated unprecedented willingness to engage in direct …",Europa.eu,USA,News,2025-10-06T06:32:15.789777Z
2a1fe9d3b608c37008091866d71c0918,U.S. Gulf Coast Fuel Oil Imports Hit 25-Year High As Sanctions Change Flows,https://oilprice.com/Latest-Energy-News/World-News/US-Gulf-Coast-Fuel-Oil-Imports-Hit-25-Year-High-As-Sanctions-Change-Flows.html,Charles Kennedy,2025-10-02T16:30:00Z,Red Sea shipping,"Fuel oil imports into the U.S. Gulf Coast surged in September to the highest level in a quarter century, reflecting the impact of sanctions constraining Venezuelan and Russian crude exports and forcing refiners to improvise with alternative feedstocks. Ship-t…",OilPrice.com,Russia,News,2025-10-06T06:32:15.789851Z
85f197505772c27c5e78361354c104dc,Analysis-Fuel oil demand defies forecasts due to Red Sea disruptions and shadow fleet expansion,https://biztoc.com/x/ac26e275416f73d7,finance.yahoo.com,2025-10-02T14:36:52Z,Red Sea shipping,"By Enes Tunagur
LONDON (Reuters) -Fuel oil used in ships and power plants is seeing unexpected demand, with efforts to curb its use more than offset by an expanding shadow fleet of oil tankers serving Russia and others, and longer shipping routes as vessels a…",Biztoc.com,Russia,Analysis/Opinion,2025-10-06T06:32:15.789920Z
49bfd4cbd153068db429c0995081df4b,Sanctions and Houthi Threat Boost Fuel Oil Demand,https://oilprice.com/Latest-Energy-News/World-News/Sanctions-and-Houthi-Threat-Boost-Fuel-Oil-Demand.html,Tsvetana Paraskova,2025-10-02T09:44:36Z,Red Sea shipping,"Contrary to earlier expectations, global demand for fuel oil has jumped the most since 2019 as longer routes to avoid the Houthi threat around the Red Sea and the surge in shadow fleet numbers have contributed to higher fuel oil use in the shipping industry, …",OilPrice.com,Global,News,2025-10-06T06:32:15.790058Z
1795608d19314398e6d5c73e03e05b46,Stolt-Nielsen Limited Reports Unaudited Results For the Third Quarter and Nine Months of 2025,https://www.globenewswire.com/news-release/2025/10/02/3160089/0/en/Stolt-Nielsen-Limited-Reports-Unaudited-Results-For-the-Third-Quarter-and-Nine-Months-of-2025.html,Stolt-Nielsen M.S. Limited,2025-10-02T06:00:00Z,Red Sea shipping,"Continued resilient performance in an uncertain environment  LONDON, October 02, 2025 – Stolt-Nielsen Limited (Oslo Børs ticker: SNI) today reported......",GlobeNewswire,Norway,Market Report,2025-10-06T06:32:15.790190Z
4cdfb7d093cb1c59c1533410aee139cb,Yemen calls for 'firm international action' to counter global threat posed by Houthis,https://www.globalsecurity.org/military/library/news/2025/09/mil-250925-unnews02.htm,John Pike,2025-09-29T02:00:04Z,Red Sea shipping,"Yemen's President Rashad Mohammed Al-Alimi on Thursday urged the international community to move beyond statements, to ""firm international action"" against Houthi separatists, saying the crisis provoked by the militants' international aggression now threatens …",Globalsecurity.org,Global,News,2025-10-06T06:32:15.790871Z
3f0233d236084ace3e39553ba0d62e70,"By not recognising a Palestinian state, NZ puts its own hard-won reputation on the line",https://theconversation.com/by-not-recognising-a-palestinian-state-nz-puts-its-own-hard-won-reputation-on-the-line-266224,"Robert G. Patman, Professor of International Relations, University of Otago",2025-09-29T00:10:03Z,Red Sea shipping,"By not joining its close allies over the question of Palestinian statehood, NZ risks being ‘on the wrong side of history’.",The Conversation Africa,Unknown,News,2025-10-06T06:32:15.790908Z
175d878c6f04f73ae3a4ec1c901ad38c,The Russia-Ukraine War Belongs to Russia and Ukraine,https://freerepublic.com/focus/f-news/4344368/posts,The American Conservative,2025-10-04T21:07:36Z,shipping sanctions,"fter barely six months in office, President Donald Trump has gone from peacemaker to warmonger. He attacked Iran and is threatening more strikes, bombarded Yemen’s Ansar Allah militants on behalf of Israel and Europe, is encouraging the former to conquer Gaza…",Freerepublic.com,Russia,News,2025-10-06T06:32:16.633605Z
7679ea639e50888e3cdff1c34788755b,Boracay: The Russian drone mothership that is wreaking havoc across European airports as NATO struggles to cope,https://economictimes.indiatimes.com/news/international/us/boracay-the-russian-drone-mothership-that-is-wreaking-havoc-across-european-airports-as-nato-struggles-to-cope/articleshow/124297658.cms,Muskan Singh,2025-10-03T19:11:23Z,shipping sanctions,"A Russian ""shadow fleet"" tanker, the Boracay, has been seized by French authorities after being directly linked to drone attacks near airports and infrastructure across Denmark and Germany. This incident reveals the fleet's shift from sanction evasion to pote…",The Times of India,Russia,News,2025-10-06T06:32:16.633805Z
