article_id,title,link,creator,pubdate,category,description,source,country,article_type,scrape_timestamp
b68fecf58d4ad8ed88647afbbd21fc59,"Iran, US to hold nuclear talks Friday in Oman, says Iranian foreign minister",https://www.thehindubusinessline.com/news/world/iran-us-to-hold-nuclear-talks-friday-in-oman-says-iranian-foreign-minister/article70594295.ece,AP- PTI,2026-02-05T05:35:27Z,Strait of Hormuz,The announcement came after hours of indications that the anticipated talks were faltering over changes in the format and content of the talks,BusinessLine,Unknown,News,2026-02-07T18:38:51.958225Z
ad7d100359dbffe78c582e8e10dfccc2,"Oil falls 2% on easing supply concern after US, Iran agree to talks",https://economictimes.indiatimes.com/markets/commodities/news/oil-falls-2-on-easing-supply-concern-after-us-iran-agree-to-talks/articleshow/127923838.cms,Reuters,2026-02-05T04:45:17Z,Strait of Hormuz,"Oil prices dipped as the U.S. and Iran agreed to hold talks in Oman, easing immediate fears of supply disruptions. Despite this, significant differences remain between the two nations regarding discussion topics, suggesting potential for renewed geopolitical …",The Times of India,Unknown,Market Report,2026-02-07T18:38:51.958307Z
a7f3266e8ea4885cfa10a10e66b9d7ad,"Oil prices fall as US, Iran agree to talks, easing conflict concerns",https://economictimes.indiatimes.com/industry/energy/oil-gas/oil-prices-fall-as-us-iran-agree-to-talks-easing-conflict-concerns/articleshow/127921975.cms,Reuters,2026-02-05T02:27:19Z,Strait of Hormuz,"Oil prices eased as the U.S. and Iran agreed to hold talks in Oman, reducing fears of a military conflict that could disrupt supply from the key Middle East region. Despite the talks, concerns remain about potential U.S. strikes on Iran and the impact on oil …",The Times of India,Unknown,Market Report,2026-02-07T18:38:51.958349Z
37fa15527fe6dab716464afa45bb442e,Oil slides in volatile trading as upcoming U.S.-Iran talks revive de-escalation hopes,https://www.cnbc.com/2026/02/05/oil-prices-upcoming-us-iran-talks-revive-de-escalation-hopes.html,Lee Ying Shan,2026-02-05T02:05:47Z,Strait of Hormuz,"Oil prices fell on Thursday after Washington and Tehran agreed to hold talks in Oman on Friday, even as differences persist over the scope of the discussions.",CNBC,Unknown,Market Report,2026-02-07T18:38:51.958380Z
d6d2428954f481bc36f70eba63187a0f,Iran and US agree to hold nuclear talks Friday in Oman as Trump delivers blunt warning to Khamenei,https://abcnews.go.com/International/wireStory/iran-us-agree-hold-nuclear-talks-friday-oman-129846589,JON GAMBRELL Associated Press,2026-02-05T01:49:20Z,Strait of Hormuz,"Iran’s Foreign Minister Abbas Araghchi has confirmed that Iran and the United States will hold nuclear talks in Oman’s capital, Muscat, on Friday",ABC News,USA,News,2026-02-07T18:38:51.958402Z
e26c04b94c5bb3d55012bf558bab2dea,Trump Says Iran’s Supreme Leader Khamenei ‘Should Be Very Worried’ as Nuclear Talks Loom,https://www.breitbart.com/politics/2026/02/04/trump-says-irans-supreme-leader-khamenei-should-be-very-worried-as-nuclear-talks-loom/,Joshua Klein,2026-02-04T23:36:07Z,Strait of Hormuz,"President Donald Trump warned Wednesday that Iran’s Supreme Leader Ali Khamenei “should be very worried” as U.S.–Iran nuclear talks, earlier reported as collapsing, are now set to proceed Friday in Oman amid sharp disputes over the scope of negotiations and r…",Breitbart News,Unknown,Market Report,2026-02-07T18:38:51.958491Z
c919ee3eaa2368e75b092e2e28980d93,"US positions aircraft carriers, strike platforms across Middle East as Iran talks shift to Oman",https://www.foxnews.com/world/us-positions-aircraft-carriers-strike-platforms-middle-east-iran-nuclear-talks-shift-oman,,2026-02-04T21:54:16Z,Strait of Hormuz,U.S. military buildup escalates across Middle East as nuclear talks with Iran move to Oman,Fox News,Unknown,News,2026-02-07T18:38:51.958523Z
9f0d405b9478242c06b985d46db44f90,U.S. pushes to widen talks with Iran beyond nuclear issue despite Tehran's refusal,https://japantoday.com/category/world/us-pushes-to-widen-talks-with-iran-beyond-nuclear-issue-despite-tehran%27s-refusal1,,2026-02-04T21:32:58Z,Strait of Hormuz,"Meaningful talks between the United States and Iran will have to include Tehran's missile arsenal and other issues, U.S. Secretary of State Marco Rubio said on Wednesday, as Tehran vowed that it would only discuss its nuclear program, not its missiles. Talks …",Japan Today,USA,News,2026-02-07T18:38:51.958550Z
d861c3d367ee52b93f04afec0ed04339,"False Flags, Then and Now",https://freerepublic.com/focus/f-chat/4365459/posts,The News,2026-02-04T21:29:09Z,Strait of Hormuz,"My sister saw Gary Cooper in Mr. Smith Goes to Washington as a teenager, so that she became a political junkie.She watched LBJ's ""Gulf of Tonkin"" speech live on t.v.; she stated that she could tell he was lying because his knuckles were white clutching the po…",Freerepublic.com,Unknown,News,2026-02-07T18:38:51.958593Z
66436158e7a8839030205764806db018,"False Flags, Then and Now",https://freerepublic.com/focus/f-news/4365459/posts,The News,2026-02-04T21:29:09Z,Strait of Hormuz,"My sister saw Gary Cooper in Mr. Smith Goes to Washington as a teenager, so that she became a political junkie.She watched LBJ's ""Gulf of Tonkin"" speech live on t.v.; she stated that she could tell he was lying because his knuckles were white clutching the po…",Freerepublic.com,Unknown,News,2026-02-07T18:38:51.958624Z
7418d1b680717bc72587ae37dedb396b,"Iran-U.S. nuclear talks will take place Friday in Oman, foreign minister says",https://www.pbs.org/newshour/world/iran-u-s-nuclear-talks-will-take-place-friday-in-oman-foreign-minister-says,"Jon Gambrell, Associated Press",2026-02-04T21:15:36Z,Strait of Hormuz,The announcement by Iranian Foreign Minister Abbas Araghchi on Wednesday came after hours of indications that the anticipated talks were faltering over changes in the format and content of the talks.,PBS,Unknown,News,2026-02-07T18:38:51.958661Z
98e644ba42a7e8eca9a824ece9750c0f,Oil Ends Higher Amid Rising Middle East Risks,https://www.rigzone.com/news/wire/oil_ends_higher_amid_rising_middle_east_risks-04-feb-2026-182925-article/,M. Gindis,2026-02-04T20:56:58Z,Strait of Hormuz,Oil settled higher as uncertainty over US-Iran nuclear talks and renewed military rhetoric fueled geopolitical risk premiums despite mixed signals from supply data.,Rigzone,Unknown,News,2026-02-07T18:38:51.958696Z
44b61511a1055371f518022bcb8dd321,"Iranian regime escalates hostilities with US, hardens negotiating position",https://www.longwarjournal.org/archives/2026/02/iranian-regime-escalates-hostilities-with-us-hardens-negotiating-position.php,Janatan Sayeh,2026-02-04T20:18:36Z,Strait of Hormuz,"Iran has ramped up military provocations against US forces as nuclear negotiations loom, with regime officials sending mixed signals on uranium enrichment while refusing to discuss missile programs or terror proxies. Internal regime sources reveal the leaders…",Longwarjournal.org,Unknown,News,2026-02-07T18:38:51.958745Z
b07d3b4f7e617c809ccbf2b353513594,‘OK Then Nothing’: US-Iran Nuke Talks In Jeopardy Over Last-Minute Demands,https://dailycaller.com/2026/02/04/ok-then-nothing-us-iran-nuke-talks-in-jeopardy-over-last-minute-demands/,Melissa O'Rourke,2026-02-04T18:58:35Z,Strait of Hormuz,"The U.S. on Wednesday rejected Iran’s demand to move and reshape diplomatic talks slated for Friday, two American officials told Axios.",The Daily Caller,USA,News,2026-02-07T18:38:51.958769Z
4d772f30e502838c905f791b90495b03,Oil prices jump on report that plans for U.S.-Iran nuclear talks are collapsing,https://www.cnbc.com/2026/02/04/oil-prices-jump-on-report-us-iran-nuclear-talks-are-collapsing.html,Spencer Kimball,2026-02-04T18:18:43Z,Strait of Hormuz,President Trump has threatened to launch military strikes on Iran if the Islamic Republic doesn't agree to a deal on its nuclear program.,CNBC,Unknown,Market Report,2026-02-07T18:38:51.958799Z
30583b9b75b74e45fc15f58e550d705d,Today's news and jokes,https://www.superpunch.net/2026/02/todays-news-and-jokes_01048896591.html,noreply@blogger.com (John),2026-02-04T17:00:00Z,Strait of Hormuz,"Brook Lopez arguing with the official while flat on his back [image or embed]
— CJ Fogler (@cjzero.bsky.social) February 2, 2026 at 8:15 PM














""The U.S. ​military shot ‌down on Tuesday ‌an Iranian drone that approached the Abraham ⁠Lincoln ‌airc…",Superpunch.net,Unknown,News,2026-02-07T18:38:51.958841Z
7a6a7723290ab0f9a1601a614c603335,The D Brief: US downs Iranian UAV; Army to host drone competition; Guardsmen in civvies at ICE jail; Hegseth threatens Scouts; And a bit more.,https://www.defenseone.com/threats/2026/02/the-d-brief-february-04-2026/411185/,Ben Watson and Bradley Peniston,2026-02-04T16:31:01Z,Strait of Hormuz,,Defense One,Unknown,News,2026-02-07T18:38:51.958869Z
b262dd776d7f36b86dfeb2d07f7d2d6a,"Iran, US talks to be held Friday in Oman: Iranian media",https://www.hurriyetdailynews.com/iran-us-talks-to-be-held-friday-in-oman-iranian-media-218593,hurriyetdailynews.com,2026-02-04T16:28:45Z,Strait of Hormuz,"Talks between Iran and the United States will be held Friday in Oman, Iranian media reported as tensions between the countries remain high following Tehran's bloody crackdown on nationwide protests last month.",Hurriyet Daily News,USA,Market Report,2026-02-07T18:38:51.958892Z
932ec19ef28558b70032129bd8d1a11f,Iran and US prepare to meet after skirmishes,https://theweek.com/world-news/iran-us-meet-skirmishes-war,"theweekonlineeditors@futurenet.com (Peter Weber, The Week US) , Peter Weber, The Week US",2026-02-04T16:01:41Z,Strait of Hormuz,The incident comes amid heightened tensions in the Middle East,The Week Magazine,Unknown,News,2026-02-07T18:38:51.958917Z
bb6f4d7ac631e3863afa112a18132fff,"Talks between Iran and US will be held Friday in Oman, Iranian media say",https://www.bostonherald.com/2026/02/04/iran-us-talks-oman/,Associated Press,2026-02-04T15:51:43Z,Strait of Hormuz,"The U.S. has not acknowledge the talks would take place in Oman, though the White House said it anticipated the negotiations would take place.",Boston Herald,Unknown,News,2026-02-07T18:38:51.958949Z
76abfa360ca42c103e151701405f2722,Trump’s Iran threats face ‘Obama red line’ test as White House pivots to diplomacy,https://www.foxnews.com/politics/trump-warns-iran-delays-strikes-red-line-debate-echoes-obamas-syria-moment,,2026-02-04T15:34:24Z,Strait of Hormuz,Trump threatens Iran with military action while pursuing diplomatic talks. Recent drone shootdowns escalate tensions as diplomatic summit approaches.,Fox News,Unknown,News,2026-02-07T18:38:51.958988Z
4e446a8c12fb7ac26ea3c618e6e4d36c,U.S.-Iran talks set for Friday in Oman after drone and tanker incidents,https://www.cbsnews.com/news/us-iran-talks-friday-oman-iranian-drone-shot-aircraft-carrier/,"Margaret  Brennan, Sarah  Lynch Baldwin, Jennifer  Jacobs",2026-02-04T15:27:33Z,Strait of Hormuz,The talks are expected to be held after the U.S. military said it shot down an Iranian drone​ and Iranian forces threatened to seize a U.S.-flagged vessel.,CBS News,Unknown,News,2026-02-07T18:38:51.959028Z
50f50305683cf3c19dc1de795c1adfc5,Mediators propose framework for crucial Iran-US talks this week,https://www.aljazeera.com/news/2026/2/4/mediators-propose-framework-for-crucial-iran-us-talks-this-week,Virginia Pietromarchi,2026-02-04T14:50:31Z,Strait of Hormuz,Proposals include requirement for Iran to halt uranium enrichment for three years and transfer stock to a third country.,Al Jazeera English,Unknown,News,2026-02-07T18:38:51.959060Z
9ce32b71b0c6a1a2708e69ed912b3cfb,Iranian media claims drone shot down by US was conducting surveillance in a 'routine and lawful mission',https://www.foxnews.com/world/iranian-media-claims-drone-shot-down-us-conducting-surveillance-routine-lawful-mission,,2026-02-04T14:26:49Z,Strait of Hormuz,A media report described the alleged activities of an Iranian Shahed-139 drone before it was shot down by the U.S. military in the Arabian Sea on Tuesday.,Fox News,Unknown,Market Report,2026-02-07T18:38:51.959104Z
4e96c7a644b14deeaad98baa0fbcad92,Iranian Gunboats Attempted To Stop U.S. Tanker In Critical Energy Chokepoint,https://www.shtfplan.com/war/iranian-gunboats-attempted-to-stop-u-s-tanker-in-critical-energy-chokepoint,Tyler Durden,2026-02-04T13:30:29Z,Strait of Hormuz,"UK Maritime Trade Operations warned of a ""suspicious activity"" on Tuesday morning at the Strait of Hormuz, the world's most critical energy chokepoint, after numerous small armed boats attempted to stop a U.S. oil tanker.",Shtfplan.com,Unknown,News,2026-02-07T18:38:51.959144Z
094818367efd22856d84cae9f574b7f3,"Gold and silver price today: Gold again crosses $5,000 and silver touches $90 — will gold and silver continue to gain in this cycle to touch $6,300 and $125?",https://economictimes.indiatimes.com/news/international/us/gold-and-silver-price-today-gold-again-crosses-5000-and-silver-touches-90-will-gold-and-silver-continue-to-gain-in-this-cycle-to-touch-6300-and-125/articleshow/127910027.cms,Piyush Shukla,2026-02-04T12:52:57Z,Strait of Hormuz,"Gold and silver price today: Gold prices surged 2.7% to $5,071.79 on February 4, 2026. This move reclaimed the vital $5,000 psychological floor. Silver followed with an 8% jump to $89.92. Fresh U.S.-Iran tensions drove this safe-haven rally. J.P. Morgan now f…",The Times of India,Unknown,Market Report,2026-02-07T18:38:51.959195Z
0afda45f57703385e5932f8a0b8c896e,"US and Iran to seek de-escalation in nuclear talks in Oman, official says",https://nypost.com/2026/02/04/world-news/us-iran-nuclear-talks-to-be-held-in-oman-in-deescalation-effort/,Reuters,2026-02-04T11:52:25Z,Strait of Hormuz,Iran has said it will not make concessions on its formidable ballistic missile program -- one of the biggest in the Middle East -- calling that a red line in negotiations.,New York Post,Unknown,News,2026-02-07T18:38:51.959231Z
493a0eff0ecd5c0426dc6a5ab1c78209,Iran seeks to move US talks to Oman from Istanbul: Report,https://www.hurriyetdailynews.com/iran-seeks-to-move-us-talks-to-oman-from-istanbul-report-218586,hurriyetdailynews.com,2026-02-04T11:35:38Z,Strait of Hormuz,"Iran has asked the U.S. administration to move talks aimed at de-escalating tensions between the two countries this week from Istanbul to Oman, while also seeking a change in the format of the meeting, a report has said.",Hurriyet Daily News,Turkey,Market Report,2026-02-07T18:38:51.959258Z
290b2ad39e3404114479854984e08491,"US and Iran to seek de-escalation in nuclear talks in Oman, regional official says",https://www.internazionale.it/ultime-notizie-reuters/2026/02/04/us-and-iran-to-seek-de-escalation-in-nuclear-talks-in-oman-regional-official-says,Internazionale,2026-02-04T10:40:05Z,Strait of Hormuz,"(Refiles to fix hyperlinks)By Tuvan GumrukcuDUBAI, Feb 4 - The U.S. and Iran are due to hold talks in Oman on Friday after Tehran requested a change of venue to limit ne… Leggi",Internazionale.it,Unknown,News,2026-02-07T18:38:51.959298Z
9f1fe15177962e8fae8a924a68eaaedb,"Market Wrap: Sensex, Nifty end marginally higher, extend gains for 3rd consecutive session. IT index plummets 6%",https://economictimes.indiatimes.com/markets/stocks/news/market-wrap-sensex-nifty-end-marginally-higher-extend-gains-for-3rd-consecutive-session-it-index-plummets-6/articleshow/127906747.cms,Veer Sharma,2026-02-04T10:18:24Z,Strait of Hormuz,"Benchmark indices extended gains for a third straight session on Wednesday, recovering from a weak start as buying picked up through the day. Sensex closed 78 points higher, and Nifty added 48 points, even as IT stocks tumbled sharply. Broader markets outperf…",The Times of India,Unknown,Market Report,2026-02-07T18:38:51.959341Z
787b42d3a99620374446c755ae5b8243,Türkiye Plays Peacemaker But Has Central Role in Iran Encirclement,https://www.nakedcapitalism.com/2026/02/turkiye-plays-peacemaker-but-has-central-role-in-iran-encirclement.html,Conor Gallagher,2026-02-04T10:00:52Z,Strait of Hormuz,"While Trump’s “armada” gets the attention, hostile actors on all Iran’s borders trying to destabilize country are bigger threat.",Nakedcapitalism.com,Unknown,News,2026-02-07T18:38:51.959378Z
780b934ba989138576388448fb7a06fb,"US and Iran to hold nuclear talks in Oman amid heightened tensions, diplomat says",https://www.internazionale.it/ultime-notizie-reuters/2026/02/04/us-and-iran-to-hold-nuclear-talks-in-oman-amid-heightened-tensions-diplomat-says,Internazionale,2026-02-04T08:28:07Z,Strait of Hormuz,"By Humeyra Pamuk and Idrees AliDUBAI, Feb 4 - Nuclear talks between the United States and Iran are expected to take place in Oman on Friday, a regional diplomat said, wit… Leggi",Internazionale.it,USA,News,2026-02-07T18:38:51.959401Z
9a0666a64588d4d4436f7c2630c65dad,Stocks rise as traders ignore AI-fuelled sell-off on Wall St,https://punchng.com/stocks-rise-as-traders-ignore-ai-fuelled-sell-off-on-wall-st/,Punch Newspapers,2026-02-04T08:06:19Z,Strait of Hormuz,"Get the latest stock market news as global stocks rise, brushing off an AI-fueled sell-off on Wall Street. Oil prices and precious metals also gain.

Read More: https://punchng.com/stocks-rise-as-traders-ignore-ai-fuelled-sell-off-on-wall-st/",The Punch,Global,Market Report,2026-02-07T18:38:51.959434Z
6e0ab2ad2e06393213ea4c931d429918,"Asia shares wobble, oil prices climb and gold makes a comeback",https://economictimes.indiatimes.com/markets/us-stocks/news/asia-shares-wobble-oil-prices-climb-and-gold-makes-a-comeback/articleshow/127900229.cms,Reuters,2026-02-04T05:03:23Z,Strait of Hormuz,"Kotak Mutual Fund has launched the Kotak Services Fund, an open-ended equity scheme. This fund provides investors an opportunity to invest in India's services sector, which is a major driver of the nation's economy. The sector contributes significantly to Gro…",The Times of India,India,Market Report,2026-02-07T18:38:51.959487Z
6787307b4d312b33abcabeaac5fe7b51,Crude oil futures rise as US shoots down an Iranian drone,https://www.thehindubusinessline.com/markets/commodities/crude-oil-futures-rise-as-us-shoots-down-an-iranian-drone/article70590261.ece,BL Mangaluru Bureau,2026-02-04T04:55:31Z,Strait of Hormuz,"At 9.57 am on Wednesday, April Brent oil futures were at $67.84, up by 0.76%, and March crude oil futures on WTI (West Texas Intermediate) were at $63.79, up by 0.92%",BusinessLine,Unknown,News,2026-02-07T18:38:51.959520Z
8dc3a559e6c0ad7640de3c6eb18d5923,Oil prices extend gains on fears of escalating tensions in Mideast,https://economictimes.indiatimes.com/markets/commodities/views/oil-prices-extend-gains-on-fears-of-escalating-tensions-in-mideast/articleshow/127898779.cms,Reuters,2026-02-04T03:08:10Z,Strait of Hormuz,GLOBAL-Oil prices extend gains on fears of escalating tensions in Mideast,The Times of India,Global,Market Report,2026-02-07T18:38:51.959547Z
d781cdca32962bd97e3fb7b0c32af362,Trump says U.S. holding talks with Iran at more than one location; Witkoff meets Israeli leaders,https://www.haaretz.com/israel-news/2026-02-04/ty-article-live/trump-says-u-s-talking-with-iran-at-more-than-one-location-witkoff-meets-israeli-leaders/0000019c-2671-db08-abdd-6ffba00a0000,Haaretz,2026-02-04T02:26:45Z,Strait of Hormuz,U.S. Slams South Africa for Expelling Top Israeli Diplomat. Trump Says U.S. Holding Talks With Iran at More Than One Location. IDF: Soldiers Kill Palestinian Who Hurled Rocks at Troops in West Bank,Haaretz,South Africa,News,2026-02-07T18:38:51.959578Z
fca0f759d9e2ffeecb92cc2468d4e3d0,Oil prices extend gains on fears of escalating tensions in Mideast,https://www.channelnewsasia.com/business/oil-prices-extend-gains-fears-escalating-tensions-in-mideast-5905601,,2026-02-04T01:55:25Z,Strait of Hormuz,"TOKYO, Feb 4 : Oil prices rose on Wednesday, extending the previous day's gains, after the U.S. shot down an Iranian drone and armed Iranian boats approached a U.S.-flagged vessel in the Strait of Hormuz, rekindling fears of an escalation in tension between W…",CNA,Japan,Market Report,2026-02-07T18:38:51.959607Z
4d68b12df8d60bfc3711dca9385083ac,Report: Trump nearly pulled out of Iran talks after Gulf aggression,https://www.israelnationalnews.com/news/421924,Elad Benari,2026-02-04T01:16:37Z,Strait of Hormuz,"Wall Street Journal reports that Trump considered abandoning Iran talks after a drone incident and harassment of a US vessel, but negotiations are still expected to proceed later this week.",Israelnationalnews.com,Unknown,Market Report,2026-02-07T18:38:51.959640Z
66daff4fd377957755d3fd014a532e06,Crude Oil Prices Rise After US Strikes Iranian Drone In Arabian Sea,https://www.ndtvprofit.com/markets/crude-oil-prices-rise-after-us-shoots-down-iranian-drone-in-arabian-sea-10942149,Shubhayan Bhattacharya,2026-02-04T01:13:28Z,Strait of Hormuz,"Brent, the global benchmark, rose nearly 1.6% to $67.33 per barrel, while West Texas Intermediate advanced toward $64.",Ndtvprofit.com,Global,Market Report,2026-02-07T18:38:51.959667Z
17701eab31d052fc65e26a1f1dcb5f68,"US shoots down Iranian drone approaching aircraft carrier, official says",https://economictimes.indiatimes.com/news/defence/us-shoots-down-iranian-drone-approaching-aircraft-carrier-official-says/articleshow/127897398.cms,Reuters,2026-02-04T00:41:43Z,Strait of Hormuz,"The U.S. military shot down an Iranian drone that aggressively approached the Abraham Lincoln aircraft carrier in the Arabian Sea. This incident occurred as diplomats sought nuclear talks, and President Trump warned of potential negative outcomes if a deal wa…",The Times of India,Unknown,News,2026-02-07T18:38:51.959713Z
b98e6fec02926f3e3bf4227bb815ac51,"U.S. Shoots Down Iranian Drone That 'Aggressively' Approached An Aircraft Carrier, Military Says",https://www.huffpost.com/entry/united-states-iran-drone_n_69828f27e4b07fd36aea64aa,HuffPost,2026-02-04T00:21:53Z,Strait of Hormuz,The move threatens to ramp up tensions as the Trump administration warns of possible military action to get Iran to the negotiating table.,HuffPost,Unknown,News,2026-02-07T18:38:51.959747Z
a56b743535340ca5bfc49ea5d76bed89,Why Western Oil Majors Are Willing to Take the Libya Risk Again,https://oilprice.com/Energy/Energy-General/Why-Western-Oil-Majors-Are-Willing-to-Take-the-Libya-Risk-Again.html,Simon Watkins,2026-02-04T00:00:00Z,Strait of Hormuz,"With Russia still focused on Ukraine and China on Taiwan, the U.S. and its key Western allies -- most notably, Great Britain, France, and Italy -- are continuing to secure highly strategic geopolitical gains across the Middle East and North Africa (MENA). Fol…",OilPrice.com,China,News,2026-02-07T18:38:51.959767Z
bd4010f2b9cb77450131ec2d6afe8714,Oil Ends Day Higher After Drone Incident,https://www.rigzone.com/news/wire/oil_ends_day_higher_after_drone_incident-03-feb-2026-182917-article/,"Mia Gindis, Alex Longley",2026-02-03T22:04:03Z,Strait of Hormuz,Crude prices rose after a drone incident and renewed Strait of Hormuz concerns.,Rigzone,Unknown,Market Report,2026-02-07T18:38:51.959791Z
e04e87f092b7e0747ec8e16de753e672,U.S. military shoots down Iranian drone that approached aircraft carrier,https://www.nbcnews.com/world/iran/us-military-shoots-iranian-drone-approached-aircraft-carrier-rcna257321,"Gordon Lubold, Babak Dehghanpisheh",2026-02-03T21:40:51Z,Strait of Hormuz,"American forces shot down an Iranian drone Tuesday as it “aggressively” approached the USS Abraham Lincoln aircraft carrier in the Arabian Sea and appeared to have “unclear intent,” according to U.S.",NBC News,USA,News,2026-02-07T18:38:51.959817Z
300e806b156ba4e1f6c11b4ef5ddc392,US shoots down Iranian drone near USS Lincoln as tensions surge,https://www.israelnationalnews.com/news/421918,Elad Benari,2026-02-03T21:38:12Z,Strait of Hormuz,"US jet shoots down an Iranian drone near the USS Lincoln as Iran harasses a US-flagged tanker, escalating tensions while Washington and Tehran prepare for possible negotiations.",Israelnationalnews.com,Unknown,News,2026-02-07T18:38:51.959855Z
efc946f9fc2c7890847f7a3f961bfb40,"Iran demands changes in venue and scope of talks with U.S., source says",https://japantoday.com/category/world/iran-demands-changes-in-venue-and-scope-of-talks-with-us-source-says1,,2026-02-03T21:33:52Z,Strait of Hormuz,"Iran is demanding that talks with the U.S. this week be held in Oman not Turkey, and that the scope be narrowed to two-way negotiations on nuclear issues only, a regional source said on Tuesday, casting doubt on whether the meeting will go ahead as planned. I…",Japan Today,Turkey,News,2026-02-07T18:38:51.959891Z
b294ece66822dd8ddf6827d70e398b68,"Have You Heard About The Crazy Things That Iran, China And Russia Just Did?",http://theeconomiccollapseblog.com/have-you-heard-about-the-crazy-things-that-iran-china-and-russia-just-did/,Michael,2026-02-03T20:59:54Z,Strait of Hormuz,"When global events reach a fever pitch, global leaders should be trying to bring the temperature down.  But instead, we are witnessing almost constant provocations.  In fact, I am extremely alarmed by a number of things that Iran, China and Russia have just d…",Theeconomiccollapseblog.com,China,News,2026-02-07T18:38:51.959910Z
5768b8d3889eee7390b6e68f6e6d7db0,Iran-US nuclear talks expected despite clashes at sea,https://www.rte.ie/news/world/2026/0203/1556618-iran-us/,RTÉ News,2026-02-03T20:58:25Z,Strait of Hormuz,"A US fighter jet shot down an Iranian drone that approached an American aircraft carrier in the Middle East today, Washington said, as renewed tensions on the high seas overshadowed plans for nuclear talks.",RTE,USA,News,2026-02-07T18:38:51.959931Z
