article_id,title,link,creator,pubdate,category,description,source,country,article_type,scrape_timestamp
53be376456942e8fe62ab8ce543f1d77,Mailtrap: The Smarter Way to Test and Ship Emails at Scale,https://martech.zone/mailtrap-the-smarter-way-to-test-and-ship-emails-at-scale/,Douglas Karr,2025-11-25T03:27:52Z,shipping rates,Modern engineering and product teams face relentless pressure to ship features quickly without sacrificing reliability or user trust. Few areas expose that tension more than email. From onboarding flows and password resets to promotional campaigns and transac…,Martech.zone,Unknown,News,2025-12-01T06:36:56.203587Z
07ceb639679e3f915642a4472af437d1,"Xinzuo Kitchen Knives up to 20% Off, from $34 After Code + Delivery @ xinzuo.com.au (Online Only)",https://www.ozbargain.com.au/node/935970,xinzuo,2025-11-24T23:29:04Z,shipping rates,"Hi all, rep for Xinzuo Australia here. I have a Black Friday offer on Xinzuo kitchen knives and an extra OzBargain only code that stacks on top of the sale. Deal summary Up to 20% off selected …",Ozbargain.com.au,Australia,News,2025-12-01T06:36:56.203650Z
f29546ff9518de72c6d5d0da0561b1ee,One of our favorite Black Friday deals is back: Get a $75 Saks Fifth Avenue promo gift card with $150 purchase,https://thepointsguy.com/deals/black-friday-deal-saks-fifth-avenue-75-gift-card-for-150-purchase/,Summer Hull and Jordan Waller,2025-11-24T21:35:19Z,shipping rates,The promotion stacks with cash back as well as the $50 statement credit from the American Express Platinum Card.,The Points Guy,USA,News,2025-12-01T06:36:56.203670Z
6adc1cbe627508b72a73fdecc520b8cc,15 Cheap Payroll Software For Small Businesses (2025),https://elearningindustry.com/cheap-payroll-software-for-small-businesses,Christopher Pappas,2025-11-24T20:00:07Z,shipping rates,"Are you looking for budget-friendly payroll solutions for your small business? We've gathered the 15 cheapest payroll software for your business size, so you can automate your processes without breaking the bank.
This post was first published on eLearning Ind…",Elearningindustry.com,Unknown,News,2025-12-01T06:36:56.203715Z
03f81438f59f431bc5c1416e0548f26d,"Pulsetto Vagus Nerve Stimulator Surpasses 100,000 Users Worldwide as Holiday Stress Season Drives Record Consumer Demand for Drug-Free Wellness Technology",https://www.globenewswire.com/news-release/2025/11/24/3193863/0/en/Pulsetto-Vagus-Nerve-Stimulator-Surpasses-100-000-Users-Worldwide-as-Holiday-Stress-Season-Drives-Record-Consumer-Demand-for-Drug-Free-Wellness-Technology.html,Pulsetto,2025-11-24T20:00:00Z,shipping rates,"Lithuanian-Made Bilateral Cervical Vagus Nerve Stimulator Surpasses 100,000 Global Users as Consumer Demand for Drug-Free Stress Relief, Sleep Support, and Relaxation Technology Reaches Record Levels During Holiday Wellness Season Lithuanian-Made Bilateral Ce…",GlobeNewswire,Global,News,2025-12-01T06:36:56.203770Z
eaef65be997113672f36648f8e1efdf6,HP ZBook Fury G1i 18 workstation review: Great with some flaws,https://www.notebookcheck.net/HP-ZBook-Fury-G1i-18-workstation-review-Great-with-some-flaws.1167715.0.html,Allen Ngo,2025-11-24T19:30:00Z,shipping rates,Missing a key competitive edge. | The latest 18-inch ZBook Fury can be configured with some of the fastest processors from Intel and Nvidia and yet it still loses out to the Dell Pro Max 18 Plus in most benchmarks. Is something causing the HP workstation to u…,Notebookcheck.net,Unknown,Analysis/Opinion,2025-12-01T06:36:56.203807Z
6b1c747b89c26dad495f375a8d3ff5ed,2-Pack ECO-WORTHY 16kWh 51.2V 314AH LiFePO4 Battery Backup + Busbar $3800 + Free Shipping,https://slickdeals.net/f/18863950-2-pack-eco-worthy-16kwh-51-2v-314ah-lifepo4-battery-backup-busbar-3800-free-shipping,Skillful_Pickle,2025-11-24T19:20:19Z,shipping rates,eco-worthy-us via eBay [ebay.com] has *2-Pack ECO-WORTHY 16kWh 51.2V 314AH LiFePO4 Solar Battery Backup w/ 200A BMS + Busbar * on sale for $4299.99 - $500 with coupon code *CYBERWEEK20* at checkout =...,Slickdeals.net,Unknown,News,2025-12-01T06:36:56.203841Z
e04252c361298e7fa100ec62bd872728,ANYCUBIC Kobra 3 Combo AE Version Multi-Color FDM 3D Printer $204.45 + Free Shipping,https://slickdeals.net/f/18793567-anycubic-kobra-3-combo-ae-version-multi-color-fdm-3d-printer-205-free-s-h,gabe23111,2025-11-24T18:38:54Z,shipping rates,"Anycubic via Aliexpress. 
 
Ships from a U.S. Warehouse. 
Pre-coupon price as of this post is $260.43 
Apply coupon *USDEAL44 *at checkout to bring the price to $216.43 
* Product Link [aliexpress.us]",Slickdeals.net,Unknown,News,2025-12-01T06:36:56.203876Z
a037d4e0f16c95a6edd1d58180965a6c,Joyned’s MU16 becomes first Milan USB interface,https://www.soundonsound.com/news/joyneds-mu16-becomes-first-milan-usb-interface,Luke Wood SOS News Editor,2025-11-24T18:00:00Z,shipping rates,"Audio networking specialists Joyned have announced the upcoming launch of the MU16, a new class-compliant USB audio interface that becomes the first unit to offer Milan network connectivity via USB.",Soundonsound.com,Unknown,News,2025-12-01T06:36:56.203918Z
39c177355b4952952bb1e5812224246c,"How to get a business credit card: Eligibility, requirements and the top cards to consider",https://finance.yahoo.com/personal-finance/credit-cards/article/how-to-get-a-business-credit-card-175822588.html,Lee Huffman,2025-11-24T17:58:22Z,shipping rates,"Business credit cards can be an effective tool for companies to finance purchases, earn rewards, build credit, and manage their cash flow. Here's how to...",Yahoo Entertainment,Unknown,News,2025-12-01T06:36:56.203955Z
609c40c4318d58261f172bc7d07fb466,"Best Abercrombie Black Friday deals: Save up to 50% off jeans, sweats, activewear, and more",https://www.businessinsider.com/guides/deals/abercrombie-black-friday-sale-deals-2025-11,taramlarson13@gmail.com (Tara Larson),2025-11-24T17:14:51Z,shipping rates,"This week at Abercrombie, Black Friday has come early. Everything is now 25% to 50% off, and you can earn free shipping with a minimum spend of $99.",Business Insider,Unknown,News,2025-12-01T06:36:56.203988Z
01e8701e908e5bbab31d1e18e1d1b761,What animal can defeat an orca?,https://www.lifesciencesworld.com/what-animal-can-defeat-an-orca/,Maya Collins,2025-11-24T16:35:44Z,shipping rates,"What Animal Can Defeat an Orca? Unveiling Nature’s Apex Predator Matchups The only animal that can regularly and consistently defeat an orca is another orca, typically during territorial disputes or competition for resources. While incredibly powerful, orcas …",Lifesciencesworld.com,Unknown,News,2025-12-01T06:36:56.204035Z
e5e91b59ef2c33365cc6bd491484f595,The Evolution of User Experience Design,https://www.javacodegeeks.com/2025/11/the-evolution-of-user-experience-design.html,Eleftheria Drosopoulou,2025-11-24T16:35:00Z,shipping rates,"User Experience (UX) has transformed from a niche specialty into the cornerstone of digital product success. What began as basic usability testing has evolved into a sophisticated discipline drawing from cognitive science, behavioral psychology, and human-cen…",Javacodegeeks.com,Unknown,News,2025-12-01T06:36:56.204097Z
390385e95a616c788e791c32deb83448,The dark fleet hiding in our own backyard: How the Cook Islands sold its flag to Moscow and Tehran,https://www.nzherald.co.nz/business/companies/freight-logistics/the-dark-fleet-hiding-in-our-own-backyard-how-the-cook-islands-sold-their-flag-to-moscow-and-tehran/premium/APVST6AXKRFINABSFQEOVUQFGE/,Matt Nippert,2025-11-24T16:00:00Z,shipping rates,SPECIAL INVESTIGATION: How shadow fleets made the Cook Islands flag inconvienent.,New Zealand Herald,Unknown,News,2025-12-01T06:36:56.204129Z
16e169d01ddbf65e903c88202fe7f33d,9 best email marketing tools for 2025,https://www.getresponse.com/blog/email-marketing-tools,Nael Chhaytli,2025-11-24T15:00:04Z,shipping rates,"Rented platforms, such as search engines, social media, and even AI tools like ChatGPT, are great for discovery. Unfortunately, those platforms are going out of their way to stop users from abandoning their sites for your website.  OpenAI is partnering with r…",Getresponse.com,Unknown,Market Report,2025-12-01T06:36:56.204171Z
b851d339fcd2c48a81aeb6e1af9bafe1,"Latin America Sustainable Packaging Market Size, Trends and Segments (2025-2035)",https://www.globenewswire.com/news-release/2025/11/24/3193542/0/en/Latin-America-Sustainable-Packaging-Market-Size-Trends-and-Segments-2025-2035.html,Precedence Research,2025-11-24T14:00:00Z,shipping rates,"According to projections from Towards Packaging, the global Latin America sustainable packaging market is set to increase from USD 19.22 billion in 2026 to nearly USD 38.75 billion by 2034, reflecting a CAGR of 8.10% during 2025 to 2034. According to projecti…",GlobeNewswire,USA,Market Report,2025-12-01T06:36:56.204196Z
54cc6efd21ab63b4437c8d265d40f2f7,What Art Market Reporters Are Getting Wrong,http://hyperallergic.com/1058944/art-market-reporters-are-getting-it-all-wrong/,Hyperallergic,2025-11-24T13:15:00Z,shipping rates,"Smaller galleries may be in massive amounts of trouble. “Gallery sales are almost always private, and only a small percentage truthfully reveal their sales and profits. … Average gallery sales are reported to be down 8 or 10%. That would hardly have caused cl…",Hyperallergic,Unknown,Market Report,2025-12-01T06:36:56.204236Z
e10352f8d56ba606bdbb36faf6a2616d,Top 10: Aircraft that were overshadowed,https://www.yahoo.com/news/articles/top-10-aircraft-were-overshadowed-000145389.html,Autocar,2025-11-30T00:01:45Z,freight rates,Top 10: Aircraft that were overshadowed,Yahoo Entertainment,Unknown,News,2025-12-01T06:36:56.586477Z
0deb0c23ee7dad08a5346a9d65c686d4,"Analyst Report: Old Dominion Freight Line, Inc",https://finance.yahoo.com/research/reports/ARGUS_3754_AnalystReport_1764331156000/,,2025-11-28T11:59:16Z,freight rates,"At Yahoo Finance, you get free stock quotes, up-to-date news, portfolio management resources, international market data, social interaction and mortgage rates that help you manage your financial life.",Yahoo Entertainment,Global,Market Report,2025-12-01T06:36:56.586970Z
526cdf9541d5b9be4ed5202dd758f189,"Brazil Cement Industry Report 2025: Portland, Blended, Specialty, and Green Cement Size & Forecast by Value and Volume Across 80+ Market Segments 2020-2029",https://www.globenewswire.com/news-release/2025/11/28/3196163/28124/en/Brazil-Cement-Industry-Report-2025-Portland-Blended-Specialty-and-Green-Cement-Size-Forecast-by-Value-and-Volume-Across-80-Market-Segments-2020-2029.html,Research and Markets,2025-11-28T11:29:00Z,freight rates,"The Brazilian cement market thrives on a post-pandemic rebound led by government-fueled infrastructure and housing investments. Opportunities lie in eco-efficient cement innovations, regional partnerships, and digital operations. Challenges include energy cos…",GlobeNewswire,Brazil,Analysis/Opinion,2025-12-01T06:36:56.586992Z
05fcafc26c68e32911719a1b5be3e64f,LNG carriers: The rally continues unabated,https://www.naftemporiki.gr/english/2039702/lng-carriers-the-rally-continues-unabated/,Μιχάλης Ματσίγκος,2025-11-28T09:33:43Z,freight rates,"The LNG carrier freight market is at the center of global interest, as freight rates continue their rally, reaching the highest levels of the year.
The market entered an upward…
LNG carriers: The rally continues unabated - Η ΝΑΥΤΕΜΠΟΡΙΚΗ",Naftemporiki.gr,Global,Market Report,2025-12-01T06:36:56.587032Z
a5257364115c63f4010177f40728b824,Canadian PM Says Close Trade Relationship With the U.S. ‘Has Ended’ Under Trump,https://www.mediaite.com/politics/canadian-pm-says-close-trade-relationship-with-the-u-s-has-ended-under-trump/,Alex Griffing,2025-11-27T18:01:32Z,freight rates,"""This decades-long process of our ever-closer economic relationship between Canada and the United States has ended, and as a consequence of that, many of our strengths have become our vulnerabilities""
The post Canadian PM Says Close Trade Relationship With th…",Mediaite,USA,News,2025-12-01T06:36:56.587130Z
f11c232ed62cbf9c0d264ee8cdbe9ebd,Why Congress’ refusal to act since 1993 is costing taxpayers over $40 billion a year,https://fortune.com/2025/11/27/taxpayers-40-billion-a-year-hidden-subsidy-gas-diesel-tax-highway-infrastructure/,Michael F. Gorman,2025-11-27T13:30:00Z,freight rates,"There's a hidden subsidy staring all of us in the face, and the only reason it exists is a gas and diesel tax that's been frozen at 22 cents per gallon.",Fortune,Unknown,News,2025-12-01T06:36:56.587172Z
fbf7d8effecfb2ac5a0f3ed9270260c0,"Brookfield, Boiled Down: A Simple Guide to a Very Big (and Very Good) Business",https://thedividendguyblog.com/brookfield-a-simple-guide-to-a-very-big-and-very-good-business/,DivGuy,2025-11-27T10:30:41Z,freight rates,"Curious about Brookfield but overwhelmed by the acronyms and moving parts? Here’s the plain-English version—and where to get the full deep dive. Brookfield has been compounding value for more than a century. It operates in 30+ countries, employs a quarter-mil…",Thedividendguyblog.com,Unknown,Market Report,2025-12-01T06:36:56.587215Z
00d4b286e6b8c2ec0ce08108e1d7b2b5,"The new plan for Urban Planning Authorities, the Eurogroup on K.M.’s agenda with Weber, CVC sells marinas in a €1.5 billion deal, the Church and the auction",https://en.protothema.gr/2025/11/27/the-new-plan-for-urban-planning-authorities-the-eurogroup-on-k-m-s-agenda-with-weber-cvc-sells-marinas-in-a-e1-5-billion-deal-the-church-and-the-auction/,Newsroom,2025-11-27T07:34:07Z,freight rates,"Sunlight also turns to Defense while market trends favor Aegean 
The post The new plan for Urban Planning Authorities, the Eurogroup on K.M.’s agenda with Weber, CVC sells marinas in a €1.5 billion deal, the Church and the auction appeared first on ProtoThema…",Protothema.gr,Unknown,Market Report,2025-12-01T06:36:56.587266Z
c2a2d7896aa82906fb1291c6fbef911d,StealthGas: Strong profitability and zero debt,https://www.naftemporiki.gr/english/2039050/stealthgas-strong-profitability-and-zero-debt/,Γιάννα Βαρδαλαχάκη,2025-11-27T07:28:31Z,freight rates,"StealthGas recorded another profitable quarter while a program of fleet renewal is underway. The company also completed the full repayment of its loan obligations.
“We are always considering opportunities to…
StealthGas: Strong profitability and zero debt - Η…",Naftemporiki.gr,Unknown,News,2025-12-01T06:36:56.587314Z
d82fb7b29d02b55c3056d2a35fb12543,China’s BEV Trucks and the End of Diesel’s Dominance,https://cleantechnica.com/2025/11/26/chinas-bev-trucks-and-the-end-of-diesels-dominance/,Michael Barnard,2025-11-27T04:28:10Z,freight rates,Cheap Chinese battery electric heavy trucks are no longer a rumor. They are real machines with real price tags that are so low that they force a reassessment of what the global freight industry is willing to pay for electrification. Standing in a commercial v…,CleanTechnica,China,Market Report,2025-12-01T06:36:56.587331Z
cbed5fa53b96f3826bfbc46fb7c5e1f1,"Canada announces new support for lumber, steel industries hit by tariffs",https://www.aljazeera.com/economy/2025/11/26/canada-announces-new-support-for-lumber-steel-industries-hit-by-tariffs,Al Jazeera,2025-11-26T23:09:19Z,freight rates,The new plan comes amid stalled trade talks between Ottawa and Washington.,Al Jazeera English,Unknown,News,2025-12-01T06:36:56.587359Z
1f93b6cc872e77bb5c4f08484da1580e,"Canada's prime minister announces supports for lumber, steel sectors hit by U.S. tariffs",https://www.yahoo.com/news/articles/canadas-prime-minister-announces-supports-211118458.html,ROB GILLIES,2025-11-26T21:11:18Z,freight rates,Canadian Prime Minister Mark Carney announced Wednesday new supports for the steel and lumber industries hit hard by U.S. tariffs.  U.S. President Donald...,Yahoo Entertainment,Unknown,News,2025-12-01T06:36:56.587427Z
a1e1c88584e9b917a96eceee7ce794f9,Stay watchful for cargo thieves over Thanksgiving: CargoNet | Big long-term lane closures along I-10 in No. 3 worst state for roads,https://www.overdriveonline.com/life/article/15772816/cargo-theft-risk-surges-around-thanksgiving-holiday,Overdrive Staff,2025-11-26T18:12:32Z,freight rates,"With cargo theft increasing throughout 2025, CargoNet expects that trend to continue through the Thanksgiving holiday and the rest of the year. Plus, I-10 lane closures in Arizona.",Overdriveonline.com,Unknown,News,2025-12-01T06:36:56.587484Z
944b0d2796d75fc7b60ed4d3162bfb1f,"State of Freight takeaways: sagging volume, but capacity tightening a bit",https://finance.yahoo.com/news/state-freight-takeaways-sagging-volume-120000386.html,John Kingston,2025-11-26T12:00:00Z,freight rates,The November State of Freight webinar took place against a continuation of a market that is showing only the slightest signs of a turnaround. The post State ...,Yahoo Entertainment,Unknown,Market Report,2025-12-01T06:36:56.587515Z
b027bb51c50fd11d9bf87184e2de7beb,Maran Tankers reinvests in VLCCs,https://www.naftemporiki.gr/english/2038545/maran-tankers-reinvests-in-vlccs/,Ελίζα Καραγιώργη,2025-11-26T07:27:16Z,freight rates,"Maran Tankers of the Angelicoussis Group is returning to super tanker shipbuilding, which, according to international shipbuilding platforms, appears to have signed a contract with the South Korean shipbuilding group…
Maran Tankers reinvests in VLCCs - Η ΝΑΥΤ…",Naftemporiki.gr,South Korea,News,2025-12-01T06:36:56.587595Z
51ed2d143e5541533c41ddd82d47eb2a,Carney expected to announce support measures for steel industry hit by U.S. tariffs,https://biztoc.com/x/83ee53ee34b9d93f,theglobeandmail.com,2025-11-26T04:31:20Z,freight rates,"The federal government plans to limit foreign steel imports and cut interprovincial rail freight rates in a bid to support Canada’s steel industry threatened by damaging U.S. tariffs.
A government official not authorized to speak about details ahead of the pu…",Biztoc.com,Unknown,Market Report,2025-12-01T06:36:56.587639Z
8f4798f8ef751f7a70b0240aed8edc4c,Highway’s new feature allows brokers to screen carriers with non-domiciled CDL drivers,https://finance.yahoo.com/news/highway-feature-allows-brokers-screen-020942465.html,"Craig Fuller, CEO at FreightWaves",2025-11-26T02:09:42Z,freight rates,"Highway, a leading firm in freight fraud mitigation and carrier identity, has introduced a feature allowing brokers to screen out carriers employing drivers ...",Yahoo Entertainment,Unknown,News,2025-12-01T06:36:56.587680Z
461319500d2bbda86b3727926b4f0c2f,Abercrombie & Fitch Co. Reports Third Quarter Fiscal 2025 Results,https://www.globenewswire.com/news-release/2025/11/25/3194230/0/en/Abercrombie-Fitch-Co-Reports-Third-Quarter-Fiscal-2025-Results.html,Abercrombie & Fitch Management Co.,2025-11-25T12:30:00Z,freight rates,"NEW ALBANY, Ohio, Nov. 25, 2025 (GLOBE NEWSWIRE) -- Abercrombie & Fitch Co. (NYSE: ANF) today announced results for the third quarter ended November 1, 2025. These compare to results for the third quarter ended November 2, 2024. Descriptions of the use of non…",GlobeNewswire,Unknown,Market Report,2025-12-01T06:36:56.587857Z
3bd38e00f37cc5445778c0345f1c5759,"Burlington Stores, Inc. Reports Third Quarter 2025 Earnings",https://www.globenewswire.com/news-release/2025/11/25/3194165/0/en/Burlington-Stores-Inc-Reports-Third-Quarter-2025-Earnings.html,Burlington Coat Factory Warehouse Corporation,2025-11-25T11:45:00Z,freight rates,"BURLINGTON, N.J., Nov. 25, 2025 (GLOBE NEWSWIRE) -- Burlington Stores, Inc. (NYSE: BURL), a nationally recognized off-price retailer of high-quality, branded apparel, footwear, accessories, and merchandise for the home at everyday low prices, today announced …",GlobeNewswire,Unknown,Market Report,2025-12-01T06:36:56.587900Z
f81fd393356dbca173aa2e69d8a8a17c,"Budget 2026-27: Critical minerals, clean energy and MSME revival top Deloitte’s key asks",https://economictimes.indiatimes.com/news/economy/policy/budget-2026-27-critical-minerals-clean-energy-and-msme-revival-top-deloittes-key-asks/articleshow/125560026.cms,,2025-11-25T08:38:36Z,freight rates,India's upcoming Union Budget for FY2026-27 will focus on key reforms. Expect enhanced support for MSMEs and strengthened supply chains for critical minerals and clean energy. The budget aims to build resilience against global trade volatility. This proactive…,The Times of India,India,News,2025-12-01T06:36:56.587929Z
0cdaa0a5f419b3825d3dfdb50a46c629,The push to 12 mpg: How Joel Morrow's doing it with this VNL spec,https://www.overdriveonline.com/equipment/article/15772707/the-push-to-12-mpg-how-one-owneroperators-doing-it,Todd Dills,2025-11-25T08:15:36Z,freight rates,"Fuel mileage improvement once depended in large part on speed. In order to maximize economy, ""you were driving 55 miles an hour,"" notes Joel Morrow in this new video about the ""Purple Haze 2"" VNL860, ""agressively downsped"" to achieve high torque at lower rpms.",Overdriveonline.com,Unknown,News,2025-12-01T06:36:56.587986Z
8255047b2ed7d57affa34c0623619fd3,Is it time to embrace ethically-sourced marketing?,https://businessesgrow.com/2025/11/24/ethically-sourced-marketing/,Mark Schaefer,2025-11-24T13:00:52Z,freight rates,"Marketing is a wonderful career that changes the world in positive ways. But indirectly, it is contributing to some of the world's biggest problems. It's time to start a conversation about ethically-sourced marketing.
The post Is it time to embrace ethically-…",Businessesgrow.com,Unknown,Market Report,2025-12-01T06:36:56.588096Z
09cb990bc86da23867061f95b111a8d0,LNG Shipping Rates Surge to Two-Year High as U.S. Exports Soar,https://oilprice.com/Latest-Energy-News/World-News/LNG-Shipping-Rates-Surge-to-Two-Year-High-as-US-Exports-Soar.html,Tsvetana Paraskova,2025-11-24T13:00:00Z,freight rates,Spot charter rates to hire an LNG tanker on the U.S. to Europe route have jumped to their highest level in nearly two years as soaring American exports tighten the Atlantic LNG vessels market.   The spot charter rate for a tanker to ship LNG from the U.S. to …,OilPrice.com,USA,Market Report,2025-12-01T06:36:56.588120Z
3397ef5093b4363d6b43fae7e1558734,"Union Pacific CEO: America needs coast-to-coast railroad, now",https://finance.yahoo.com/news/union-pacific-ceo-america-needs-130000521.html,Stuart Chirls,2025-11-24T13:00:00Z,freight rates,Shares of Union Pacific and Norfolk Southern rise as the railroads count down the days until filing their formal merger application with federal regulators. ...,Yahoo Entertainment,USA,News,2025-12-01T06:36:56.588139Z
c1b11af0d1f950ef6f4658a1c5a51d49,Tanker Rates Hit New High,https://www.rigzone.com/news/wire/tanker_rates_hit_new_high-24-nov-2025-182376-article/,Weilun Soon,2025-11-24T11:24:29Z,freight rates,The cost of hiring an oil supertanker on a benchmark route spiked to the highest in more than five years.,Rigzone,Unknown,Market Report,2025-12-01T06:36:56.588163Z
cc95f2c03bed983e255cf232e07e2e22,"Dogecoin Bull Run Rests On This One Price Level, Analyst Warns",http://www.newsbtc.com/news/dogecoin/dogecoin-bull-run-one-price-level/,Jake Simmons,2025-11-24T08:30:04Z,freight rates,"The Dogecoin market structure has tightened around a single, highly watched support zone near $0.138, and analyst Kevin (@Kev_Capital_TA) is framing that area as the pivot that decides whether the meme coin’s broader bull case survives its current drawdown. I…",newsBTC,Unknown,Market Report,2025-12-01T06:36:56.588205Z
8e849736358fdf75ab2c7b22f0677578,LNG Freight Rates Extend Rally on Strong North American Exports,https://biztoc.com/x/aa5ea4932734591d,bloomberg.com,2025-11-24T08:10:58Z,freight rates,,Biztoc.com,USA,Market Report,2025-12-01T06:36:56.588217Z
a254c28faa35ef6d05aa6fc6634b4974,World’s biggest oil tankers just got a lot more expensive as buyers shift away from Russian crude,https://economictimes.indiatimes.com/industry/energy/oil-gas/worlds-biggest-oil-tankers-just-got-a-lot-more-expensive-as-buyers-shift-away-from-russian-crude/articleshow/125534969.cms,ET Online,2025-11-24T07:28:32Z,freight rates,"Global oil tanker rates have surged to five-year highs, driven by new US sanctions on Russian oil and increased supply from the Middle East and US.  VLCC charter costs have skyrocketed, prompting refiners to seek alternatives and boosting demand for various v…",The Times of India,Russia,Market Report,2025-12-01T06:36:56.588245Z
bd4b3161f700bb906402f9dd405aa026,Chinese consumer brands flood into Africa as old investment model fades and exports jump 28%,https://www.cnbc.com/2025/11/24/china-africa-expansion-shifts-infrastructure-resource-mining-consumer-goods-investment.html,,2025-11-24T05:20:31Z,freight rates,"Chinese firms are shifting from big infrastructure to consumer goods in Africa, driven by demand, adventurous entrepreneurs and pressure to produce locally.",CNBC,China,News,2025-12-01T06:36:56.588260Z
6c872e6810b3ede73b8c92e0715e5213,"Becoming a Mom at 47 Wasn’t My Plan. But Thanks to Controversial Technology, It’s More Common Than Ever.",https://slate.com/life/2025/11/pregnant-women-baby-fertility-embryo-donation.html,Heather Grossmann,2025-11-24T00:00:00Z,freight rates,The main question shouldn’t be “When am I ready to become a parent?” It’s “When is my child ready to become an orphan?”,Slate Magazine,Unknown,News,2025-12-01T06:36:56.588299Z
e8abb9bbf3be54bce8f5b6c780df9b65,"SHAREHOLDER ALERT: Faruqi & Faruqi, LLP Investigates Claims on Behalf of Investors of Stride",https://www.globenewswire.com/news-release/2025/11/29/3196527/683/en/SHAREHOLDER-ALERT-Faruqi-Faruqi-LLP-Investigates-Claims-on-Behalf-of-Investors-of-Stride.html,Faruqi & Faruqi LLP,2025-11-29T13:23:00Z,charter rates,"Faruqi & Faruqi, LLP Securities Litigation Partner James (Josh) Wilson Encourages Investors Who Suffered Losses In Stride To Contact Him Directly To Discuss Their Options",GlobeNewswire,Unknown,News,2025-12-01T06:36:56.913855Z
