article_id,title,link,creator,pubdate,category,description,source,country,article_type,scrape_timestamp
e6cd9bd63582019cdcb8cc42e758e750,Analyzing Hafnia (NYSE:HAFN) and C3is (NASDAQ:CISS),https://www.etfdailynews.com/2025/10/05/analyzing-hafnia-nysehafn-and-c3is-nasdaqciss/,MarketBeat News,2025-10-05T06:22:58Z,dry bulk shipping,"Hafnia (NYSE:HAFN – Get Free Report) and C3is (NASDAQ:CISS – Get Free Report) are both transportation companies, but which is the superior investment? We will compare the two businesses based on the strength of their analyst recommendations, earnings, profita…",ETF Daily News,Unknown,Market Report,2025-10-06T06:32:00.736946Z
744ae41b88c8ead229296a99ee59ded0,What is Noble Financial’s Estimate for SHIP Q2 Earnings?,https://www.etfdailynews.com/2025/10/05/what-is-noble-financials-estimate-for-ship-q2-earnings/,MarketBeat News,2025-10-05T05:04:58Z,dry bulk shipping,"Seanergy Maritime Holdings Corp (NASDAQ:SHIP – Free Report) – Research analysts at Noble Financial upped their Q2 2026 earnings estimates for Seanergy Maritime in a report released on Thursday, October 2nd. Noble Financial analyst M. Reichman now forecasts th…",ETF Daily News,Unknown,Analysis/Opinion,2025-10-06T06:32:00.737037Z
af50ab05432c88a06d826079ba302710,Star Bulk Announces Addition of New Member to Its Board of Directors,https://www.globenewswire.com/news-release/2025/10/03/3161207/0/en/Star-Bulk-Announces-Addition-of-New-Member-to-Its-Board-of-Directors.html,Star Bulk Carriers Corp.,2025-10-03T20:05:00Z,dry bulk shipping,"ATHENS, Greece, Oct. 03, 2025 (GLOBE NEWSWIRE) -- Star Bulk Carriers Corp. (the “Company” or “Star Bulk”) (Nasdaq: SBLK), a global shipping company focusing on the transportation of dry bulk cargoes, announced today that Mr. Mikkel Storm Weum was appointed to…",GlobeNewswire,Greece,News,2025-10-06T06:32:00.737088Z
f93871afbaa34a7be0d900969f1a9ef6,Shipping: Capesizes drive demand,https://www.naftemporiki.gr/english/2014032/shipping-capesizes-drive-demand/,Αλεξία Σωτηρίου,2025-10-02T05:19:59Z,dry bulk shipping,"The third quarter of 2025 ended unexpectedly positively for the dry bulk market, which rebounded strongly after a slow start at the beginning of the year and a weak performance…
Shipping: Capesizes drive demand - Η ΝΑΥΤΕΜΠΟΡΙΚΗ",Naftemporiki.gr,Unknown,Market Report,2025-10-06T06:32:00.737128Z
68dbc541a834c792cf3848d0436b0d2a,Diana Shipping Inc. Announces Signing and Drawdown of a US$55.0 Million Term Loan Facility with National Bank of Greece S.A.,https://www.globenewswire.com/news-release/2025/10/01/3159617/10065/en/Diana-Shipping-Inc-Announces-Signing-and-Drawdown-of-a-US-55-0-Million-Term-Loan-Facility-with-National-Bank-of-Greece-S-A.html,Diana Shipping Inc. c/o Diana Shipping Services S.A.,2025-10-01T13:05:00Z,dry bulk shipping,"ATHENS, Greece, Oct. 01, 2025 (GLOBE NEWSWIRE) -- Diana Shipping Inc. (NYSE: DSX), (the “Company”), a global shipping company specializing in the ownership and bareboat charter-in of dry bulk vessels, today announced the successful signing of a US$55.0 millio…",GlobeNewswire,Greece,News,2025-10-06T06:32:00.737176Z
2219cee6b57e3ec3b022b2395abd2d01,Genco Shipping & Trading Limited Adopts Limited Duration Shareholder Rights Plan to Protect the Best Interests of Shareholders,https://www.globenewswire.com/news-release/2025/10/01/3159399/37397/en/Genco-Shipping-Trading-Limited-Adopts-Limited-Duration-Shareholder-Rights-Plan-to-Protect-the-Best-Interests-of-Shareholders.html,Genco Shipping & Trading Limited,2025-10-01T11:30:00Z,dry bulk shipping,"NEW YORK, Oct. 01, 2025 (GLOBE NEWSWIRE) -- Genco Shipping & Trading Limited (NYSE:GNK) (“Genco” or the “Company”), the largest U.S. headquartered drybulk shipowner focused on the global transportation of commodities, today announced that its Board of Directo…",GlobeNewswire,Global,Market Report,2025-10-06T06:32:00.737230Z
e8532be484a5fc616d18b7318c327c24,Costamare Bulkers – Cargill collaboration,https://www.naftemporiki.gr/english/2013561/costamare-bulkers-cargill-collaboration/,Μιχάλης Ματσίγκος,2025-10-01T08:20:05Z,dry bulk shipping,"Costamare Bulkers Holdings Limited, owned by Kostis Konstantakopoulos, has announced the signing of a strategic partnership with Cargill International S.A., one of the world’s largest shipping and trading groups.
The…
Costamare Bulkers – Cargill collaboration…",Naftemporiki.gr,Global,Market Report,2025-10-06T06:32:00.737277Z
bb214d467bdab64901829e0507e169f0,United Maritime (NASDAQ:USEA) Trading Down 3.6% – Here’s What Happened,https://www.etfdailynews.com/2025/10/01/united-maritime-nasdaqusea-trading-down-3-6-heres-what-happened/,MarketBeat News,2025-10-01T07:16:47Z,dry bulk shipping,"United Maritime Corporation (NASDAQ:USEA – Get Free Report) shares traded down 3.6% on Tuesday . The stock traded as low as $1.63 and last traded at $1.64. 58,852 shares traded hands during mid-day trading, an increase of 197% from the average session volume …",ETF Daily News,Unknown,Market Report,2025-10-06T06:32:00.737330Z
f0f3e02ef30ecd513a535581f33b3f0b,Greek-owned shipping companies show strong performance on Wall Street,https://www.naftemporiki.gr/english/2013485/greek-owned-shipping-companies-show-strong-performance-on-wall-street/,Αλεξία Σωτηρίου,2025-10-01T05:10:57Z,dry bulk shipping,"The Greek-owned listed shipping companies announced revenues exceeding 4.17 billion dollars in the first half of the year and net profits more than 1.8 billion, confirming the leading position of…
Greek-owned shipping companies show strong performance on Wall…",Naftemporiki.gr,Greece,News,2025-10-06T06:32:00.737377Z
02789eae4c02970c4b6b616165558809,Diana Shipping Inc. Announces Time Charter Contract for m/v DSI Aquila with Bunge,https://www.globenewswire.com/news-release/2025/09/29/3157815/10065/en/Diana-Shipping-Inc-Announces-Time-Charter-Contract-for-m-v-DSI-Aquila-with-Bunge.html,Diana Shipping Inc. c/o Diana Shipping Services S.A.,2025-09-29T13:20:00Z,dry bulk shipping,"ATHENS, Greece, Sept. 29, 2025 (GLOBE NEWSWIRE) -- Diana Shipping Inc. (NYSE: DSX), (the “Company”), a global shipping company specializing in the ownership and bareboat charter-in of dry bulk vessels, today announced that through a separate wholly-owned subs…",GlobeNewswire,Greece,News,2025-10-06T06:32:00.737420Z
8ae709a13379747e6922e501587e048b,Reviewing United Maritime (NASDAQ:USEA) and Global Ship Lease (NYSE:GSL),https://www.etfdailynews.com/2025/09/29/reviewing-united-maritime-nasdaqusea-and-global-ship-lease-nysegsl/,MarketBeat News,2025-09-29T07:00:56Z,dry bulk shipping,"Global Ship Lease (NYSE:GSL – Get Free Report) and United Maritime (NASDAQ:USEA – Get Free Report) are both small-cap transportation companies, but which is the better business? We will contrast the two companies based on the strength of their dividends, anal…",ETF Daily News,Global,Analysis/Opinion,2025-10-06T06:32:00.737459Z
eeb3eeb55e303280a091c04bcdcac477,Writer’s Digest 94th Annual Competition Mainstream/Literary Short Story First Place Winner: “The Memory Eater”,https://www.writersdigest.com/94th-annual-competition-mainstream-literary-winner,Moriah Richard,2025-10-03T22:00:00Z,bulk carrier,"Congratulations to Eric Reitan, first-place winner in the Mainstream/Literary Short Story category of the 94th Annual Writer’s Digest Writing Competition. Here’s his winning story, “The Memory Eater.”
The post Writer’s Digest 94th Annual Competition Mainstrea…",Writersdigest.com,Unknown,News,2025-10-06T06:32:01.709869Z
f592fded8b34801acf295e4500f8b4c5,5 Best AT&T Alternatives: Satellite Coverage & Budget Plans,https://smartphones.gadgethacks.com/news/5-best-att-alternatives-satellite-coverage-budget-plans/,Gadget Hacks,2025-10-02T18:59:42Z,bulk carrier,"Looking to ditch AT&amp;T? You are not alone. While AT&amp;T remains one of the largest wireless carriers with over 70 million customers, many users are seeking better value, coverage, or features elsewhere. The upside, the wireless market is hotly competitiv…",Gadgethacks.com,Unknown,Market Report,2025-10-06T06:32:01.709923Z
05554c4a5706d0d464d63e2c407993d7,Trimac acquires Houston-based chemical hauler,https://biztoc.com/x/6cf9f01710867d30,finance.yahoo.com,2025-10-02T15:32:53Z,bulk carrier,"Canadian bulk hauler Trimac Transportation announced it has acquired Houston-based chemical carrier Service Transport Company (STC). The deal adds scale to Trimac’s growing U.S. chemical transportation network.
Join the leaders shaping freight’s future at
F3:…",Biztoc.com,Unknown,News,2025-10-06T06:32:01.709973Z
27ffe1052191f421645fa65395539e7c,Netherlands Calls on EU to Sanction Yemen’s Houthis After Ship Attack,https://gcaptain.com/netherlands-calls-on-eu-to-sanction-yemens-houthis-after-ship-attack/,Reuters,2025-10-02T05:01:30Z,bulk carrier,"The Netherlands called on the EU on Wednesday to sanction Yemen's Houthis as a terrorist group, after the organisation claimed responsibility for an attack on the Dutch-flagged general cargo ship Minervagracht in the Gulf of Aden.",gcaptain.com,Unknown,News,2025-10-06T06:32:01.710043Z
abc7834b8aa59008c07a0cf0effb4841,Netherlands demands EU sanctions on Houthis after missile strike on Dutch ship,https://www.israelnationalnews.com/news/415701,Israel National News,2025-10-01T21:07:19Z,bulk carrier,"Following a Houthi missile strike on Dutch ship Minervagracht, the Netherlands urges EU to label the Iran-backed group a terrorist entity.",Israelnationalnews.com,Unknown,News,2025-10-06T06:32:01.710083Z
8d49f7dddeab15186980ea0bfe53353f,What is the Medigap open enrollment period (and why is it important)? Experts explain.,https://www.cbsnews.com/news/what-is-the-medigap-open-enrollment-period-and-why-is-it-important-experts-explain/,Tim  Maxwell,2025-10-01T14:08:36Z,bulk carrier,This one-time enrollment period can help you avoid serious coverage risks and may save you money over time.,CBS News,Unknown,News,2025-10-06T06:32:01.710116Z
16b0a8ba1c0da06b7778241a8ac3328f,Long-distance remote epitaxy,https://www.nature.com/articles/s41586-025-09484-z,"Ru Jia, Yan Xin, Mark Potter, Jie Jiang, Zixu Wang, Hanxue Ma, Zhihao Zhang, Zhizhuo Liang, Lifu Zhang, Zonghuan Lu, Ruizhe Yang, Saloni Pendse, Yang Hu, Kai Peng, Yilin Meng, Wei Bao, Jun Liu, Gwo-Ching Wang, Toh-Ming Lu, Yunfeng Shi, Hanwei Gao, Jian Shi",2025-10-01T00:00:00Z,bulk carrier,Experimental evidence demonstrates long-distance remote epitaxial interactions of thin films even through thick amorphous carbon buffer layers and shows that these can be induced through dislocations in the substrate.,Nature.com,Unknown,Market Report,2025-10-06T06:32:01.710195Z
87171ac159cb96ea0fec61a16f4ff457,Houthis claim missile attack on Dutch ship in Gulf of Aden,https://www.israelnationalnews.com/news/415656,Elad Benari,2025-09-30T23:23:28Z,bulk carrier,"Iranian-backed Houthis in Yemen claim missile strike on Dutch cargo ship Minervagracht in Gulf of Aden, which injured two crew members.",Israelnationalnews.com,Unknown,News,2025-10-06T06:32:01.710227Z
0443865ff7a33f5e77383532734a7493,2025 Fantasy Football Rankings: Justin Boone's top running backs for Week 5,https://sports.yahoo.com/fantasy/article/2025-fantasy-football-rankings-week-5-justin-boone-running-backs-bucky-irving-injury-173301622.html,Justin Boone,2025-09-30T17:33:01Z,bulk carrier,Justin Boone shares his fantasy football running back rankings for Week 5 of the 2025 NFL season.,Yahoo Entertainment,Unknown,News,2025-10-06T06:32:01.710259Z
e287765f54d21dc8023a67ab744afa9e,Absence of orbital current torque in Ta/ferromagnet bilayers,https://www.nature.com/articles/s41467-025-63809-0,"Qianbiao Liu, Lijun Zhu",2025-09-30T00:00:00Z,bulk carrier,"Recently there has been interest in using the orbital Hall effect to drive the magnetization of an adjacent ferromagnet. One metal, Tantalum, has been proposed a strong source of orbital current. Here, Liu and Zhu argue that the claimed orbital torques in Tan…",Nature.com,Unknown,News,2025-10-06T06:32:01.710307Z
cad93c9e3b5fc568309161c3ab1d3f17,How ArcBest plans to double earnings by 2028,https://finance.yahoo.com/news/arcbest-plans-double-earnings-2028-215356564.html,Todd Maiden,2025-09-29T21:53:56Z,bulk carrier,ArcBest talks up numbers at its first investor day since 2015. The post How ArcBest plans to double earnings by 2028 appeared first on FreightWaves.,Yahoo Entertainment,Unknown,News,2025-10-06T06:32:01.710340Z
c9241d22f0da22d344129cfda2d8a7a5,Dutch cargo ship adrift and ablaze after attack in Gulf of Aden,https://japantoday.com/category/world/dutch-cargo-ship-adrift-and-ablaze-after-attack-in-gulf-of-aden-eu-maritime-mission-says.,,2025-09-29T21:33:58Z,bulk carrier,"The Dutch-flagged general cargo ship Minervagracht is on fire and drifting in the Gulf of Aden after an attack with an explosive device spurred a rescue mission for its 19 crew, the EU maritime mission Aspides and the vessel's operator said on Monday. It was …",Japan Today,Unknown,News,2025-10-06T06:32:01.710387Z
e6919361ddd7a1d43c680eb1e29ee7ce,airalo-sdk added to PyPI,https://pypi.org/project/airalo-sdk/,partner.integration@airalo.com,2025-09-29T14:32:58Z,bulk carrier,Official Airalo Python SDK for Airalo's REST API,Pypi.org,Unknown,News,2025-10-06T06:32:01.710411Z
66d2b8a46904bf5e678a698e473a7921,"Nordics Existing & Upcoming Data Center Portfolio Database 2025 | Coverage of 125 Existing and 60 Upcoming Data Centers Across Denmark, Finland, Iceland, Norway, and Sweden",https://www.globenewswire.com/news-release/2025/09/29/3157507/28124/en/Nordics-Existing-Upcoming-Data-Center-Portfolio-Database-2025-Coverage-of-125-Existing-and-60-Upcoming-Data-Centers-Across-Denmark-Finland-Iceland-Norway-and-Sweden.html,Research and Markets,2025-09-29T09:06:00Z,bulk carrier,"Explore the comprehensive Nordics Data Center Market Database, an Excel product offering in-depth analysis of 125 existing and 60 upcoming data centers across Denmark, Finland, Iceland, Norway, and Sweden. The database covers white-floor space, IT load capaci…",GlobeNewswire,Norway,Analysis/Opinion,2025-10-06T06:32:01.710450Z
5dfe43a8d1fa81308202f20bfd1d2784,Norway Data Center Portfolio Database 2025 | Green Mountain Dominates Norway's Data Center Market; Polar DC and Stack Infrastructure Follow,https://www.globenewswire.com/news-release/2025/09/29/3157492/28124/en/Norway-Data-Center-Portfolio-Database-2025-Green-Mountain-Dominates-Norway-s-Data-Center-Market-Polar-DC-and-Stack-Infrastructure-Follow.html,Research and Markets,2025-09-29T08:34:00Z,bulk carrier,"Discover the comprehensive Norway data center market portfolio analysis. This resource provides in-depth insights into 30 existing and 14 upcoming data centers across key locations like Oslo, Stavanger, and Trondheim. Key features include current and future w…",GlobeNewswire,Norway,Analysis/Opinion,2025-10-06T06:32:01.710489Z
bc8d47417e9a7f753ef7c97004d6bf86,Spontaneous dissociation of excitons in polymeric photocatalysts for overall water splitting,https://www.nature.com/articles/s41467-025-63590-0,"Kaitao Bai, Xiaohua Yu, Guanzhao Wen, Yongqiang Yang, Yunxiang Lin, Lulu Zhang, Ju Rong, Li-Chang Yin, Wei Qi, Mischa Bonn, Hai I. Wang, Gang Liu",2025-09-29T00:00:00Z,bulk carrier,"Polymeric semiconductors suffer from high exciton binding energy. Here, the authors report a crystal structure engineering strategy for producing poly(triazine imide) with the capability of spontaneous exciton dissociation into free charges, enabling efficien…",Nature.com,Unknown,Market Report,2025-10-06T06:32:01.710536Z
2446cf84bc3c6c422ba593f3723edc09,Genco Shipping & Trading (NYSE:GNK) versus A.P. Moller-Maersk (OTCMKTS:AMKBY) Head to Head Comparison,https://www.etfdailynews.com/2025/09/30/genco-shipping-trading-nysegnk-versus-a-p-moller-maersk-otcmktsamkby-head-to-head-comparison/,MarketBeat News,2025-09-30T05:18:42Z,capesize,"Genco Shipping & Trading (NYSE:GNK – Get Free Report) and A.P. Moller-Maersk (OTCMKTS:AMKBY – Get Free Report) are both transportation companies, but which is the better business? We will contrast the two businesses based on the strength of their analyst reco…",ETF Daily News,Unknown,Market Report,2025-10-06T06:32:02.487909Z
fd3827d4b906b5015edd1aeff55f1f51,Global Ship Lease to Participate in Capital Link’s 17th Annual New York Maritime Forum,https://www.globenewswire.com/news-release/2025/10/02/3160711/0/en/Global-Ship-Lease-to-Participate-in-Capital-Link-s-17th-Annual-New-York-Maritime-Forum.html,Global Ship Lease Inc.,2025-10-02T20:15:00Z,panamax,"ATHENS, Greece, Oct. 02, 2025 (GLOBE NEWSWIRE) -- Global Ship Lease, Inc. (NYSE:GSL) (the “Company”), a containership owner and lessor, today announced that it will participate in Capital Link’s 17th Annual New York Maritime Forum (NYMF), taking place on Tues…",GlobeNewswire,Greece,News,2025-10-06T06:32:02.917578Z
a97a726010346c19c67f050dccb80cdd,A Gonzo Plan To Beat China With Giant Robot Boats,https://www.forbes.com/sites/jeremybogaisky/2025/10/02/a-gonzo-plan-to-beat-china-with-giant-robot-boats/,"Jeremy Bogaisky, Former Staff, 
 Jeremy Bogaisky, Former Staff
 https://www.forbes.com/sites/jeremybogaisky/",2025-10-02T10:30:00Z,panamax,Autonomous speedboat designer Saronic aims to use its fat warchest to build America’s largest shipyard and help the US to dominate commercial and military shipbuilding.,Forbes,China,News,2025-10-06T06:32:02.917599Z
a203678d71cd90ecb6fa429d1193985f,Wealth Enhancement Advisory Services LLC Purchases New Shares in Scorpio Tankers Inc. $STNG,https://www.etfdailynews.com/2025/10/03/wealth-enhancement-advisory-services-llc-purchases-new-shares-in-scorpio-tankers-inc-stng/,MarketBeat News,2025-10-03T07:10:51Z,handymax,"Wealth Enhancement Advisory Services LLC purchased a new stake in shares of Scorpio Tankers Inc. (NYSE:STNG – Free Report) during the second quarter, Holdings Channel.com reports. The fund purchased 21,684 shares of the shipping company’s stock, valued at app…",ETF Daily News,Unknown,Market Report,2025-10-06T06:32:03.552681Z
50edd4fce840afbb9db3a16929dcf3a4,Bank of America Boosts Scorpio Tankers (NYSE:STNG) Price Target to $66.00,https://www.etfdailynews.com/2025/10/02/bank-of-america-boosts-scorpio-tankers-nysestng-price-target-to-66-00/,MarketBeat News,2025-10-02T06:32:02Z,handymax,"Scorpio Tankers (NYSE:STNG – Get Free Report) had its price target boosted by equities researchers at Bank of America from $60.00 to $66.00 in a report released on Tuesday,Benzinga reports. The firm presently has a “buy” rating on the shipping company’s stock…",ETF Daily News,USA,Market Report,2025-10-06T06:32:03.552723Z
76ac0a0cebcbeb8aebd7c60ff7a4ba95,Scorpio Tankers Inc. Announces Agreements to Sell Two LR2 Product Tankers and an Update on its Outstanding Debt,https://www.globenewswire.com/news-release/2025/09/29/3157555/0/en/Scorpio-Tankers-Inc-Announces-Agreements-to-Sell-Two-LR2-Product-Tankers-and-an-Update-on-its-Outstanding-Debt.html,Scorpio Tankers Inc.,2025-09-29T10:45:00Z,handymax,"MONACO, Sept. 29, 2025 (GLOBE NEWSWIRE) -- Scorpio Tankers Inc. (NYSE:STNG) (“Scorpio Tankers,” or the “Company”) announced today that it has entered into agreements to sell two vessels and provided an update on its outstanding debt.",GlobeNewswire,Unknown,News,2025-10-06T06:32:03.552774Z
28291a43c100a49413bea8aeb516f99b,Best Shipping Stocks To Consider – September 27th,https://www.etfdailynews.com/2025/09/29/best-shipping-stocks-to-consider-september-27th/,MarketBeat News,2025-09-29T07:02:49Z,handymax,"Viking, Scorpio Tankers, Pitney Bowes, ZIM Integrated Shipping Services, and Golar LNG are the five Shipping stocks to watch today, according to MarketBeat’s stock screener tool. Shipping stocks are shares of publicly traded companies whose primary business i…",ETF Daily News,Unknown,Market Report,2025-10-06T06:32:03.552818Z
71537bcb9cb59b317fbe285ffe630c8b,"CSX (NASDAQ:CSX) Stock Price Expected to Rise, UBS Group Analyst Says",https://www.etfdailynews.com/2025/10/05/csx-nasdaqcsx-stock-price-expected-to-rise-ubs-group-analyst-says/,MarketBeat News,2025-10-05T06:02:57Z,iron ore,"CSX (NASDAQ:CSX – Get Free Report) had its target price hoisted by stock analysts at UBS Group from $41.00 to $44.00 in a research report issued on Friday, Marketbeat Ratings reports. The firm presently has a “buy” rating on the transportation company’s stock…",ETF Daily News,Unknown,Market Report,2025-10-06T06:32:05.824208Z
fd4095445f6e7f29b445274eda59c6e2,Mining Stocks To Consider – October 3rd,https://www.etfdailynews.com/2025/10/05/mining-stocks-to-consider-october-3rd/,MarketBeat News,2025-10-05T05:08:06Z,iron ore,"IREN, Lithium Americas, and USA Rare Earth are the three Mining stocks to watch today, according to MarketBeat’s stock screener tool. Mining stocks are shares of publicly traded companies whose primary business is the exploration, extraction and processing of…",ETF Daily News,USA,Market Report,2025-10-06T06:32:05.824235Z
8b72fcdb1ebc498f2e547b08d5494ef5,"Articles On: DJI, Europe, Rare Earth, Tech Sector, Iron Ore Cargoes, Soybeans, China’s Factory Activity, Lunch, and Vietnam",https://www.hoover.org/research/articles-dji-europe-rare-earth-tech-sector-iron-ore-cargoes-soybeans-chinas-factory,"October 5, 2025",2025-10-05T00:00:00Z,iron ore,This section highlights articles and reports on the harmful impacts of the commercial and economic policies employed by the Chinese Communist Party.,Hoover.org,China,Market Report,2025-10-06T06:32:05.824253Z
88554503ac90d6aadb17e1600b0d25ef,Vedanta reports flattish output growth in Q2,https://www.thehindubusinessline.com/companies/vedanta-reports-flattish-output-growth-in-q2/article70124831.ece,BL Mumbai Bureau,2025-10-04T12:12:21Z,iron ore,"Vedanta reports production increases in zinc and aluminium, while facing decreases in lead, silver, and iron ore.",BusinessLine,Unknown,Market Report,2025-10-06T06:32:05.824283Z
1bf4d3fa33b854b9ea2d554746bd0477,"Vedanta Q2 Update: Record aluminum, alumina production; Zinc India delivers best-ever mined metal output",https://economictimes.indiatimes.com/markets/stocks/news/vedanta-q2-update-record-aluminum-alumina-production-zinc-india-delivers-best-ever-mined-metal-output/articleshow/124306776.cms,Nishtha Awasthi,2025-10-04T11:14:53Z,iron ore,"Vedanta Ltd achieved record production highs in Q2 FY26, including its highest-ever quarterly aluminum output at 617 kt and alumina production at 653 kt, a 31% YoY jump. Zinc India and Zinc International also reported best-ever mined metal figures. Pig iron o…",The Times of India,India,Market Report,2025-10-06T06:32:05.824308Z
3e79c3fe30fb1ed50db86ed043c36ede,"Vedanta Q2 Updates: Aluminium Production Up 1%, Zinc Down 6%",https://www.ndtvprofit.com/business/vedanta-q1-updates-aluminium-production-up-1-zinc-down-6,Khushi Maheshwari,2025-10-04T11:13:46Z,iron ore,"Vedanta Ltd.'s aluminium production increased 1% on a yearly basis to 617 kilotonnes in the second quarter of FY26, according to provisional business updates released on Thursday. Sequentially, production increased 2% from 605 kilotonnes, according to an exch…",Ndtvprofit.com,Unknown,News,2025-10-06T06:32:05.824354Z
7917918513ffa3e8e4ba8593aac6de4b,Mitsui O.S.K. Lines (OTCMKTS:MSLOY) Stock Price Up 0.1% – What’s Next?,https://www.etfdailynews.com/2025/10/04/mitsui-o-s-k-lines-otcmktsmsloy-stock-price-up-0-1-whats-next/,MarketBeat News,2025-10-04T07:30:57Z,iron ore,"Mitsui O.S.K. Lines, Ltd. (OTCMKTS:MSLOY – Get Free Report) shares shot up 0.1% on Friday . The company traded as high as $14.93 and last traded at $14.88. 45,033 shares traded hands during trading, an increase of 80% from the average session volume of 25,057…",ETF Daily News,Unknown,Market Report,2025-10-06T06:32:05.824398Z
ca5a8f6a7688e79c48d1af9e08199674,CSX (NASDAQ:CSX) Downgraded by Wall Street Zen to “Sell”,https://www.etfdailynews.com/2025/10/04/csx-nasdaqcsx-downgraded-by-wall-street-zen-to-sell/,MarketBeat News,2025-10-04T07:02:52Z,iron ore,Wall Street Zen downgraded shares of CSX (NASDAQ:CSX – Free Report) from a hold rating to a sell rating in a research note published on Friday. CSX has been the subject of several other research reports. Baird R W upgraded shares of CSX to a “strong-buy” rati…,ETF Daily News,Unknown,Market Report,2025-10-06T06:32:05.824447Z
5c6fc5db9e67ead89e4e4a6ba36f6756,Financial Survey: Okeanis Eco Tankers (NYSE:ECO) versus Navios Maritime Partners (NYSE:NMM),https://www.etfdailynews.com/2025/10/04/financial-survey-okeanis-eco-tankers-nyseeco-versus-navios-maritime-partners-nysenmm/,MarketBeat News,2025-10-04T06:40:53Z,iron ore,"Okeanis Eco Tankers (NYSE:ECO – Get Free Report) and Navios Maritime Partners (NYSE:NMM – Get Free Report) are both small-cap transportation companies, but which is the better business? We will contrast the two businesses based on the strength of their earnin…",ETF Daily News,Unknown,Market Report,2025-10-06T06:32:05.824494Z
f8897d67dcf1d9a64b3fce3d9fa8ad88,FY2026 EPS Estimates for Champion Iron Decreased by Analyst,https://www.etfdailynews.com/2025/10/04/fy2026-eps-estimates-for-champion-iron-decreased-by-analyst/,MarketBeat News,2025-10-04T06:18:45Z,iron ore,"Champion Iron Limited (TSE:CIA – Free Report) – Research analysts at Desjardins dropped their FY2026 earnings estimates for shares of Champion Iron in a report issued on Wednesday, October 1st. Desjardins analyst B. Adams now anticipates that the company will…",ETF Daily News,Unknown,Market Report,2025-10-06T06:32:05.824538Z
