article_id,title,link,creator,pubdate,category,description,source,country,article_type,scrape_timestamp
cfa19ca0c6ae94fbe16691ef64c4b326,DAVID BLACKMON: World Needs Alternative To Hormuz Status Quo,https://dailycaller.com/2026/04/09/opinion-world-needs-alternative-to-hormuz-status-quo-david-blackmon/,David Blackmon,2026-04-09T05:10:47Z,Suez Canal,While President Donald Trump and his White House team focus on ways to force the reopening of the Strait of Hormuz to ease the global supply crunch for oil and,The Daily Caller,Global,News,2026-04-16T07:51:30.223299Z
2a655ea8214e8900a847cf8b7bb19289,Aimee Connolly eyes launch of her beauty brand into US market in fourth quarter of this year,https://www.irishtimes.com/business/2026/04/09/aimee-connolly-eyes-launch-of-her-beauty-brand-into-us-market-in-fourth-quarter-of-this-year/,Ciarán Hancock,2026-04-09T04:00:00Z,Suez Canal,"Irish entrepreneur, who still owns 100% of her business, says US regulatory process is ‘progressing well’",The Irish Times,Unknown,Market Report,2026-04-16T07:51:30.223338Z
a4c10f9c724523cf43afd8125511004b,"Politics
U.S. has violated ceasefire agreement, Iran parliamentary speaker says",https://freerepublic.com/focus/f-news/4374177/posts,CNBC,2026-04-09T02:11:18Z,Suez Canal,"Iran’s parliamentary speaker, Mohammad Bagher Ghalibaf, accused the U.S. on Wednesday of violating the two-week ceasefire agreement. “The deep historical distrust we hold toward the United States stems from its repeated violations of all forms of commitments …",Freerepublic.com,USA,News,2026-04-16T07:51:30.223365Z
7cec4ab92b9fdd4babf1652808744b3d,How A Fake Iranian Terror Group Was Invented To Proscribe IRGC in Europe – The story of Ashab al-Yamin,https://www.activistpost.com/how-a-fake-iranian-terror-group-was-invented-to-proscribe-irgc-in-europe-the-story-of-ashab-al-yamin/,Editor,2026-04-09T02:03:00Z,Suez Canal,"Investigative Analysis – A series of arson attacks and alleged incidents targeting alleged Jewish-linked sites across Europe have been attributed to a little-known group called Harakat Ashab al-Yamin al-Islamia (HAYI), or Ashab al-Yamin. The group has been wi…",Activistpost.com,Unknown,Analysis/Opinion,2026-04-16T07:51:30.223410Z
166ef1be908cde11e8a72f81ebfa71f0,Civilization Is Not the Default. Violence Is,https://apropos.substack.com/p/civilization-is-a-public-good,Santi,2026-04-14T22:23:15Z,Panama Canal,"On feudalism, Pax Americana and the changing world order",Substack.com,USA,News,2026-04-16T07:51:30.689828Z
a2eccb2b7d2172a2a44c068f2258a37c,"Hegseth, Indonesian Counterpart Announce Defense Partnership",https://freerepublic.com/focus/f-news/4374881/posts,U.S. Department of War,2026-04-14T17:18:12Z,Panama Canal,"Secretary of War Pete Hegseth welcomed his Indonesian counterpart — Defense Minister Sjafrie Sjamsoeddin — to the Pentagon today, where the two men announced the establishment of the Major Defense Cooperation Partnership between the two countries. ... The par…",Freerepublic.com,Indonesia,News,2026-04-16T07:51:30.690111Z
df18f4ab41c34c2d1e93d405499ff98a,"INGERSOLL: Who’s Actually Facing Dire Straits, Donald Trump Or Xi Jinping?",https://dailycaller.com/2026/04/14/ingersoll-trump-xi-jinping-strait-of-malacca-malay-peninsula-indonesia-partnership-beijing-summit/,Geoffrey Ingersoll,2026-04-14T13:45:03Z,Panama Canal,Now that I’ve cleared the air: The Strait of Malacca is officially the third major shipping chokepoint Washington has gathered under its influence.,The Daily Caller,Unknown,News,2026-04-16T07:51:30.690161Z
376f1d53996c1f8ed9c4851b70a7ee34,"Exclusive — Waterway Wars: Greek Official Reveals How Trump, Guilfoyle Severed China’s ‘Dragon’s Head’ Port Advantage in 'Gateway to Europe’",https://www.breitbart.com/politics/2026/04/13/exclusive-waterway-wars-greek-official-reveals-trump-guilfoyle-chinas-dragons-head-port/,Matthew Boyle,2026-04-14T01:16:34Z,Panama Canal,"The Strait of Hormuz in the Middle East is hardly the only waterway on President Donald Trump’s mind worldwide at the moment.
The post Exclusive — Waterway Wars: Greek Official Reveals How Trump, Guilfoyle Severed China’s ‘Dragon’s Head’ Port Advantage in ‘Ga…",Breitbart News,China,News,2026-04-16T07:51:30.690216Z
bf1e65e3335059a25f03cac25535df9e,US State Department Issues ‘Do Not Travel’ Advisory Against Disney Guests,https://insidethemagic.net/2026/04/us-state-department-issues-do-not-travel-advisory-against-disney-guests-ad1/,Alessia Dunn,2026-04-13T18:39:21Z,Panama Canal,"Disney vacations require a level of logistical planning that most other trips simply do not demand. The parks themselves generate the most attention in that planning process, but the journey to and from a Disney destination carries its own set of variables th…",Inside the Magic,Unknown,News,2026-04-16T07:51:30.690270Z
80b8ef78675e21962e7c5f1dfe139b53,Panama FM Rejects Iran's 'Geopolitical' Closure of the Strait of Hormuz,https://www.breitbart.com/latin-america/2026/04/13/panama-fm-rejects-irans-geopolitical-closure-of-the-strait-of-hormuz/,Christian K. Caruzo,2026-04-13T18:27:39Z,Panama Canal,"Foreign Minister of Panama Javier Martínez-Acha on Sunday rejected Iran's closure of the Strait of Hormuz and criticized the Islamic regime's use of the waterway as a geopolitical tool amid its ongoing conflict with the U.S and Israel.
The post Panama FM Reje…",Breitbart News,Panama,News,2026-04-16T07:51:30.690312Z
6bee4933f112f3a710241e408d03e32d,NEWS: State Department Issues Travel Warning for Disney Destination,https://www.disneyfoodblog.com/2026/04/13/state-department-issues-travel-warning-for-disney-destination/,Samantha Kendall,2026-04-13T17:04:28Z,Panama Canal,The U.S. State Department has issued a new travel advisory.,disneyfoodblog.com,Unknown,News,2026-04-16T07:51:30.690342Z
305537df6cb89b642e3bdcde6067ec36,"With US Making Messes, China Is Making Moves",https://www.globalresearch.ca/us-making-messes-china-making-moves/5921974,John Leake,2026-04-13T12:45:31Z,Panama Canal,"The following strikes me as a very cogent essay about how China is taking the opportunity created by U.S. mess-making in the Middle East to make moves with Taiwan.

To read this article in the following languages, click the Translate …
The post With US Making…",Globalresearch.ca,China,News,2026-04-16T07:51:30.690363Z
0a307ae28fe713ddd1de42fdbabe42d8,Taiwan Navy's goodwill fleet heads to St. Lucia following St. Kitts stop,https://www.globalsecurity.org/wmd/library/news/taiwan/2026/taiwan-260412-cna02.htm,John Pike,2026-04-12T12:00:00Z,Panama Canal,"Taiwan's naval goodwill fleet is heading to Saint Lucia after concluding a three-day port call in Saint Kitts and Nevis on Saturday, where it was welcomed by Prime Minister Terrance Drew, according to Taiwanese embassies in the two Caribbean allies.",Globalsecurity.org,Unknown,News,2026-04-16T07:51:30.690412Z
df937896f4c3e712857ae84b3b73163c,A panicked race for barrels grips the global oil market,https://economictimes.indiatimes.com/industry/energy/oil-gas/a-panicked-race-for-barrels-grips-the-global-oil-market/articleshow/130205268.cms,Bloomberg,2026-04-12T09:18:12Z,Panama Canal,"A desperate scramble for immediately available oil supplies is occurring globally, with traders paying unprecedented prices for prompt cargoes. This physical market frenzy contrasts with futures, highlighting a significant crude shortfall as Middle East suppl…",The Times of India,Global,Market Report,2026-04-16T07:51:30.690453Z
fc0e87b187b1b7390324c00c2336bbeb,"A panicked race for barrels grips global oil market, price up as much as $140",https://economictimes.indiatimes.com/markets/commodities/news/a-panicked-race-for-barrels-grips-global-oil-market-price-up-as-much-as-140/articleshow/130204411.cms,Bloomberg,2026-04-12T07:47:09Z,Panama Canal,"Global oil markets are witnessing a severe physical crude shortage as Middle East disruptions trigger frantic buying and record premiums for immediate supplies. While futures prices ease on ceasefire hopes, physical markets spike, exposing supply gaps and for…",The Times of India,Global,Market Report,2026-04-16T07:51:30.690494Z
3695b81458b3c06612bc4cce57abd6be,The Oil Market Is in the Grip of a Panicked Race for Barrels,https://financialpost.com/pmn/business-pmn/the-oil-market-is-in-the-grip-of-a-panicked-race-for-barrels,Bloomberg News,2026-04-11T15:40:02Z,Panama Canal,"While investors focused on the fragile Iranian ceasefire this week, a desperate scramble for cargoes has been playing out in the oil market, as traders and refiners scour the globe for immediately available supplies.",Financial Post,Unknown,Market Report,2026-04-16T07:51:30.690527Z
41ccab6e94feec30dd19770d2110f28d,'It's a cutthroat business': Where Australia is sourcing oil right now,https://www.abc.net.au/news/2026-04-11/australia-fuel-supply-strait-hormuz-crisis/106533982,"Cason Ho, Julian Fell, Ashley Kyd, Margaret Burin, and Joshua Byrd",2026-04-10T18:46:09Z,Panama Canal,Australia is stitching together a steady supply of fuel through a patchwork of relationships. But how long can that last?,ABC News (AU),Australia,News,2026-04-16T07:51:30.690590Z
a9b7e6a22ee2b0ac22ffb0b538255e42,Trump’s Venezuela Report Card,http://foreignpolicy.com/2026/04/10/venezuela-us-intervention-maduro-trump-oil-rodriguez-machado/,Catherine Osborn,2026-04-10T12:00:41Z,Panama Canal,A look back at the U.S. intervention in Venezuela that the president wants to replicate.,Foreign Policy,Unknown,Market Report,2026-04-16T07:51:30.690619Z
59637815b957b6a330929556d45a906b,"Articles On: Taiwan Tensions & Cross-Strait Relations, Cybersecurity Threats, Energy Disruptions, and Strategic & Economic Coercion",https://www.hoover.org/research/articles-taiwan-tensions-cross-strait-relations-cybersecurity-threats-energy-disruptions,"April 10, 2026",2026-04-10T00:00:00Z,Panama Canal,"The Chinese Communist Party wages a series of foreign interference and coercion campaigns and this section provides articles and reports explaining those actions, as well as the damage they do abroad.",Hoover.org,China,Market Report,2026-04-16T07:51:30.690722Z
0e2fe4cdc5f4c9620c31452036ea94a0,Panama Accuses China of Seizing Its Ships After Getting Kicked Out of Canal,https://www.breitbart.com/national-security/2026/04/09/panama-asks-china-for-respect-amid-arbitrary-ship-detentions-tied-to-canal-ports-ruling/,Christian K. Caruzo,2026-04-09T16:29:40Z,Panama Canal,Foreign Minister of Panama Javier Martínez-Acha on Wednesday called for China to respect Panama's legal sovereignty amid a series of arbitrary detentions of Panama-flagged vessels by Chinese authorities after Hong Kong-based CK Hutchison lost control of two k…,Breitbart News,China,News,2026-04-16T07:51:30.690785Z
50c9f341ff4861f73c0dc88bc0caab1f,CK Hutchison Accuses Maersk of ‘Scheme’ in Panama Port Takeover,http://wwd.com/sourcing-journal/logistics/ck-hutchison-maersk-arbitration-panama-ports-company-ppc-scheme-takeover-balboa-port-terminal-contract-1238894991/,Glenn Taylor,2026-04-09T13:00:00Z,Panama Canal,The company's Panama unit claims Maersk colluded with country officials to replace it as the Balboa port's operator after Panama's Supreme Court voided its contract.,WWD,Panama,News,2026-04-16T07:51:30.690818Z
0ca4db28a20e05dca5fa5e327fa11e7b,Hong Kong firm claims Denmark’s Maersk allied with Panama in a scheme to take over port,https://www.independent.ie/business/world/hong-kong-firm-claims-denmarks-maersk-allied-with-panama-in-a-scheme-to-take-over-port/a168852871.html,Anis Leung,2026-04-09T04:30:00Z,Panama Canal,"A subsidiary of a Hong Kong-based conglomerate started arbitration proceedings against Danish logistics and port group Maersk, accusing the company of aligning with Panama in a scheme to take over its port operations on the Central American country's critical…",Independent.ie,USA,News,2026-04-16T07:51:30.690906Z
a22f5f9cbefbd789cc4fbb8d14cc0709,‘Go Out and Sue a Polluter’,https://www.nybooks.com/online/2026/04/13/go-out-and-sue-a-polluter/,Scott W. Stern,2026-04-13T16:36:58Z,Black Sea shipping,"Shortly before Christmas in 1969 a dense fog rolled in across the bayous of the Texas Gulf Coast. For more than four days it blanketed a vast region, as far west as San Antonio and as far east as Port Arthur. Flights were grounded, cars crashed, and all traff…",The New York Review of Books,Unknown,News,2026-04-16T07:51:31.121605Z
438e289ca590d1a091c6f9792f7e16d4,"In the Gulf, states are 'paying the price' for a war they didn't start",https://www.abc.net.au/news/2026-04-12/gulf-states-paying-the-price-for-a-war-they-didn-t-start/106491586,Lucia Stein and Tim Swanston,2026-04-11T18:54:47Z,Black Sea shipping,"When the Iran war ends, Gulf nations will not only have to repair the economic and physical damage caused by Iran's retaliatory campaign, but will also have to learn to live with a regime that analysts say is ""less predictable and more violent than it was two…",ABC News (AU),Unknown,News,2026-04-16T07:51:31.121698Z
4c5589fe9dae920f9dbd79bc12498812,"UPSC Weekly Current Affairs Quiz (April 05 to 11, 2026) : 15 key questions with detailed answers for Prelims 2026",https://indianexpress.com/article/upsc-current-affairs/upsc-essentials/upsc-weekly-current-affairs-quiz-april-05-to-11-2026-10631532/,"Manas Srivastava, Nitendra Pal Singh",2026-04-11T15:02:12Z,Black Sea shipping,"Test your UPSC Prelims 2026 preparation with this weekly current affairs quiz (April 05 to 11), featuring key topics like El Niño Southern Oscillation, Spacecraft Mission Operations: SMOPS- 2026, working of induction top, with MCQs and detailed explanations.",The Indian Express,Unknown,Market Report,2026-04-16T07:51:31.121743Z
fcdd0aeffd162cf72f136073cbaeac37,US Central Command Says Clearing Mines In Strait Of Hormuz,https://www.globalsecurity.org/military/library/news/2026/04/mil-260411-rferl02.htm,John Pike,2026-04-11T12:00:00Z,Black Sea shipping,"Following earlier reports of US naval vessels in the Strait of Hormuz, the US Central Command (CENTCOM) has now named two ships that it says are clearing mines in the crucial waterway.",Globalsecurity.org,Unknown,Market Report,2026-04-16T07:51:31.121777Z
392ccbe7ee352214f52cb8e60442f4bf,"2026 SWIMSUIT REVIEW: The Best Supportive, Flattering Suits From $35 To $300",https://stylebyemilyhenderson.com/the-best-supportive-swimsuits-2026,Emily,2026-04-11T08:00:00Z,Black Sea shipping,"I have so many winning suits for you today - it's honestly thrilling. I'm always in search of better, more supportive and flattering swimsuits for those of us",Stylebyemilyhenderson.com,Unknown,Analysis/Opinion,2026-04-16T07:51:31.121804Z
018e2684e3e358c579c29302caf554c5,How serious is the Iranian sea mine threat in the Strait of Hormuz?,https://www.abc.net.au/news/2026-04-11/how-serious-is-iranian-sea-mine-threat-strait-of-hormuz/106550020,Annika Burgess,2026-04-10T18:56:16Z,Black Sea shipping,"Iran claims to have littered a central shipping passage in the Strait of Hormuz with sea mines, in a move analysts say could be a ""coercive threat"" to maintain its grip on the crucial waterway.",ABC News (AU),Unknown,News,2026-04-16T07:51:31.121840Z
1626c72f83ac8d1b62494f6c81d31e83,This Nikon Camera Won The CUPOTY Death And Decay Photo Challenge,https://www.thephoblographer.com/2026/04/10/this-nikon-camera-won-the-cupoty-death-and-decay-photo-challenge/,Nilofer Khan,2026-04-10T17:00:00Z,Black Sea shipping,"Wildlife photography is one of the most challenging genres of the medium. It requires one to be patient, but also quick when the moments call. Close-up Photographer of the Year, which has been providing a platform for many emerging wildlife photographers, has…",Thephoblographer.com,Unknown,News,2026-04-16T07:51:31.121905Z
9f02cee0b2501788e31f183a8ded98c3,"The Latest: Ceasefire at risk over Israel’s attacks in Lebanon, possible mines in Strait of Hormuz",https://www.thehindubusinessline.com/news/world/the-latest-ceasefire-at-risk-over-israels-attacks-in-lebanon-possible-mines-in-strait-of-hormuz/article70842202.ece,AP- PTI,2026-04-09T10:22:29Z,Black Sea shipping,"Ceasefire tensions rise as Israel escalates attacks in Lebanon, complicating US-Iran negotiations over uranium enrichment and Strait of Hormuz control.",BusinessLine,Unknown,News,2026-04-16T07:51:31.122033Z
2e220a956828bbc2cfbeecd595bb48c5,"USA Crafted Oxford Shirts, USA Crafted Oxford Shoes, & More – The Thurs. Sales Handful",https://dappered.com/2026/04/usa-crafted-oxford-shirts-usa-crafted-oxford-shoes-more-the-thurs-sales-handful/,Joe,2026-04-09T10:00:33Z,Black Sea shipping,Plus a made in American leather duffel to put it all in.,Dappered.com,USA,News,2026-04-16T07:51:31.122055Z
90c4d2fafd0305c96b91c467fe0aceac,South Korea says secures 273 million barrels of crude via routes outside Strait of Hormuz,https://www.channelnewsasia.com/business/south-korea-says-secures-273-million-barrels-crude-routes-outside-strait-hormuz-6057871,,2026-04-15T06:37:40Z,Red Sea shipping,"SEOUL, April 15 : South Korea has secured 273 million barrels of crude oil from the Middle East and Kazakhstan through the end of the year, with supplies routed outside the Strait of Hormuz, presidential chief of staff Kang Hoon-sik said on Wednesday.Asia's f…",CNA,South Korea,News,2026-04-16T07:51:31.637045Z
0c0a0ee9e0021344f2bc45208d1cec8b,Iran used Chinese spy satellite to target US bases,https://www.irishtimes.com/world/middle-east/2026/04/15/iran-used-chinese-spy-satellite-to-target-us-bases/,"Miles Johnson, Peter Andringa, Alison Killing and Charles Clover in London, and Demetri Sevastopulo in Washington",2026-04-15T06:32:18Z,Red Sea shipping,Leaked documents show IRGC secretly acquired system and used it to guide strikes during war in March,The Irish Times,China,News,2026-04-16T07:51:31.637069Z
58feeda1729c004bcf7dcda3d2d7d9c7,A grand bargain amid a naval blockade: U.S. pursues dual path with Iran,https://www.naturalnews.com/2026-04-15-a-grand-bargain-amid-a-naval-blockade-u-s-pursues-dual-path-with-iran.html,Willow Tohi,2026-04-15T06:00:00Z,Red Sea shipping,"Vice President JD Vance announces the Trump administration is pursuing a “grand bargain” with Iran, offering economic normalization in exchange for denuclearization and an end to state-sponsored terrorism. The proposal follows failed weekend negotiations in P…",Naturalnews.com,Unknown,News,2026-04-16T07:51:31.637121Z
b677bb3e165074a94441bec92811f720,Saudi Arabia urges U.S. to lift Hormuz blockade amid fears of escalation in Bab al-Mandab,https://www.naturalnews.com/2026-04-15-saudi-arabia-urges-us-to-lift-hormuz-blockade.html,Belle Carter,2026-04-15T06:00:00Z,Red Sea shipping,"Saudi officials urge the U.S. to lift its naval blockade of the Strait of Hormuz and resume negotiations with Iran. Riyadh fears Iran could retaliate by closing the Bab al-Mandab Strait (via Houthi allies), disrupting Saudi oil exports through the Red Sea. St…",Naturalnews.com,Unknown,News,2026-04-16T07:51:31.637173Z
38b217d3ef95dc1ba766c0d02c7bb636,Live updates: Iran’s military threatens Red Sea shipping if US blockade continues | CNN,https://www.cnn.com/2026/04/15/world/live-news/iran-war-blockade-us-trump,"Dana Karni, Michael Rios, Mohammed Tawfeeq, Nic Robertson, Morgan Rimmer, Alejandra Jaramillo, Maureen Chowdhury, Haley Britzky, John Towfighi, Avery Schmitz, John Liu, Catherine Nicholls, Christopher Lamb, Charbel Mallo, Tal Shalev, Issy Ronald, Hanna Ziady, James Frater, Sophie Tanno, Eleni Giokos, Nadeen Ebrahim, Billy Stockwell, Eugenia Yosef, Alayna Treene, Aileen Graef, Mostafa Salem, Kaanita Iyer, Olesya Dmitracova, Lex Harvey, Jerome Taylor, Todd Symons, Kit Maher, Jessie Yeung, Sophia Saifi, Helen Regan, Logan Schiciano, Stephanie Yang, Brad Lendon, Gawon Bae, Tori B. Powell, Simone McCarthy, Hira Humayun",2026-04-15T04:03:22Z,Red Sea shipping,"The Trump administration feels “good about prospects of a deal” with Iran, the White House said Wednesday, while noting that Pakistan would be the likely location of a potential second round of talks. Follow for live news updates.",CNN,Unknown,News,2026-04-16T07:51:31.637227Z
ea3a0eb10681118ee4d7e2af439c60b1,Trump vows US will sink any Iran boats that challenge blockade,https://timesofmalta.com/article/trump-vows-us-sink-iran-boats-challenge-blockade.1126880,Sponsored,2026-04-15T00:37:39Z,Red Sea shipping,The blockade applies to all ships leaving or seeking to dock at Iranian harbours,Times of Malta,Unknown,News,2026-04-16T07:51:31.637277Z
e72997d28d3d1b4348ca8fa2e864482e,"Iran: Predictable Breakdown of Negotiations, Grim Consequences",https://www.globalresearch.ca/iran-predictable-breakdown-negotiations-grim-consequences/5922292,Peter Koenig,2026-04-14T19:06:14Z,Red Sea shipping,"Iran has not accepted our conditions. 
That is the justification for the US delegation to break off after only 21 hours the US-Iran negotiations in Islamabad, on 11 April, 2026, while tensions in the region escalated. The talks, mediated by …
The post Iran: P…",Globalresearch.ca,Unknown,News,2026-04-16T07:51:31.637405Z
13039f1e7a242d6332ca0b4ae6c7e15f,"Iran, US Weigh Fresh Talks as Trump Blockade Underway",https://www.rigzone.com/news/wire/iran_us_weigh_fresh_talks_as_trump_blockade_underway-14-apr-2026-183437-article/,Ben Bartenstein & Arsalan Shahla,2026-04-14T07:21:49Z,Red Sea shipping,The U.S. and Iran are weighing further negotiations to extend a two-week ceasefire as President Donald Trump presses ahead with a naval blockade to curb the Islamic Republic's oil exports.,Rigzone,Unknown,News,2026-04-16T07:51:31.637602Z
8df0fd7d34e7b2caa2ccaf9fd25ef648,Saudi Arabia Urges US Back to Iran Talks as Other Oil Routes Face Risk,https://sputnikglobe.com/20260414/saudi-arabia-urges-us-back-to-iran-talks-as-other-oil-routes-face-risk-1123985121.html,Sputnik International,2026-04-14T06:59:50Z,Red Sea shipping,"Saudi Arabian officials are warning the US that its move to impose a blockade on Iranian ports following failed negotiations could backfire, triggering even wider global energy disruption, according to media reports.",Sputnikglobe.com,Global,Market Report,2026-04-16T07:51:31.637639Z
3853f877d7098464148971a7e5ecc341,US says ball in Iran's court as push grows to end war,https://www.rte.ie/news/middle-east/2026/0414/1568091-middle-east/,RTÉ News,2026-04-14T06:35:56Z,Red Sea shipping,"The United States has said that ""the ball is in the Iranian court"" on ending the Middle East war, as diplomats have accelerated efforts towards a new round of peace talks after weekend negotiations failed to produce a deal.",RTE,USA,News,2026-04-16T07:51:31.637658Z
93704682d74697ed76269687e2c97fce,US says ball in Iran's court as push grows to end war,https://www.hurriyetdailynews.com/us-says-ball-in-irans-court-as-push-grows-to-end-war-220999,hurriyetdailynews.com,2026-04-14T06:04:23Z,Red Sea shipping,"The United States said ""the ball is in the Iranian court"" on ending the Mideast war, as diplomats accelerated efforts on Tuesday towards a new round of peace talks after weekend negotiations failed to produce a deal.",Hurriyet Daily News,USA,News,2026-04-16T07:51:31.637700Z
9b256c3630f753bfc4a077269913313a,"‘We can’t let Iran blackmail the world,’ says Trump as US blockade of Hormuz starts",https://www.independent.ie/world-news/middle-east/we-cant-let-iran-blackmail-the-world-says-trump-as-us-blockade-of-hormuz-starts/a2038275155.html,Trevor Hunnicutt and Parisa Hafezi,2026-04-14T04:30:00Z,Red Sea shipping,"The US military began a blockade of ships leaving Iran’s ports yesterday, president Donald Trump said, and Tehran threatened to retaliate against ports of its Gulf neighbours after weekend talks on ending the war broke down.",Independent.ie,Unknown,News,2026-04-16T07:51:31.637747Z
1a2d22238bc49efb3bdbef8873fcf7c9,Will Trump’s Blockade of Hormuz spark Conflict with China?,https://www.juancole.com/2026/04/trumps-blockade-conflict.html,Juan Cole,2026-04-14T04:15:16Z,Red Sea shipping,"Chinese Foreign Minister Wang Yi said, ""blocking the Strait of Hormuz is not in the common interests of the international community.""",Juancole.com,China,News,2026-04-16T07:51:31.637763Z
e5108302d3893dfbb0f7188027b48ab6,"Somaliland Offers U.S. a Base as Anti-Iran, Anti-Houthis Foothold",https://freerepublic.com/focus/f-news/4374817/posts,PJ Media,2026-04-14T02:59:17Z,Red Sea shipping,"The Republic of Somaliland in the Horn of Africa is once again offering the United States a military base in a strategic area with access to critical minerals, this time reminding the USA that this could be the perfect foothold from which to counter terrorist…",Freerepublic.com,USA,News,2026-04-16T07:51:31.637789Z
b94bdffea19616cb487f82d9a8551c30,How the Trump family's business deals could open the door for future presidents to profit from office,https://www.pbs.org/newshour/politics/how-the-trump-familys-business-deals-could-open-the-door-for-future-presidents-to-profit-from-office,"Bernard Condon, Associated Press",2026-04-13T23:26:37Z,Red Sea shipping,"For the Trump family, business is booming. Whereas the Trump Organization didn't do a single deal overseas in Donald Trump's first term as president, it did eight in the past year.",PBS,Unknown,News,2026-04-16T07:51:31.637827Z
65485a0461d25cd940abe752448787a2,Oil Climbs but Truce Hopes Cap Gains,https://www.rigzone.com/news/wire/oil_climbs_but_truce_hopes_cap_gains-13-apr-2026-183436-article/,Staff,2026-04-13T20:09:53Z,Red Sea shipping,Analysts warn current prices understate the severity of supply disruptions and recovery timelines.,Rigzone,Unknown,Market Report,2026-04-16T07:51:31.637955Z
