article_id,title,link,creator,pubdate,category,description,source,country,article_type,scrape_timestamp
573c1bb459d55b4d213a5d226fa21039,Intercargo: Green transition and geopolitical challenges,https://www.naftemporiki.gr/english/2069276/intercargo-green-transition-and-geopolitical-challenges/,Αλεξία Σωτηρίου,2026-02-06T12:08:27Z,dry bulk shipping,"Intercargo president Yannis Xylas sent a clear message about the need to take specific and clear measures ahead of the resumption of the IMO debate on the roadmap for the…
Intercargo: Green transition and geopolitical challenges - Η ΝΑΥΤΕΜΠΟΡΙΚΗ",Naftemporiki.gr,Unknown,News,2026-02-07T18:38:36.009624Z
f1368f3b9f3e761fa3abc1fbb172ee7a,"The Chios drama, Kostas, Dora & the 1st of Athens, De Gress & Karystianou, N.V.’s deal, Vakakis talks about feelings and sex, the Authority for Money Laundering investigates the president of GSEE",https://en.protothema.gr/2026/02/05/the-chios-drama-kostas-dora-the-1st-of-athens-de-gress-karystianou-n-v-s-deal-vakakis-talks-about-feelings-and-sex-the-authority-for-money-laundering-investigates-the-presid/,Newsroom,2026-02-05T12:06:29Z,dry bulk shipping,"Wall Street’s view on the Greeks’ coordinated turn to tankers & the new faces
The post The Chios drama, Kostas, Dora & the 1st of Athens, De Gress & Karystianou, N.V.’s deal, Vakakis talks about feelings and sex, the Authority for Money Laundering investigate…",Protothema.gr,Greece,Analysis/Opinion,2026-02-07T18:38:36.009686Z
084492f9991c16096dff833f350371c7,Greek shipowners: 47 orders for newbuildings,https://www.naftemporiki.gr/english/2068031/greek-shipowners-47-orders-for-newbuildings/,Αλεξία Σωτηρίου,2026-02-04T06:08:53Z,dry bulk shipping,"Greek shipowners proceeded with 47 new ship orders in Asian berths in the first 31 days of the year. It is noted that during the same period in 2025, Greek…
Greek shipowners: 47 orders for newbuildings - Η ΝΑΥΤΕΜΠΟΡΙΚΗ",Naftemporiki.gr,Greece,News,2026-02-07T18:38:36.009728Z
d28ef9054611166eca92fa24d8efb3ef,"Diana Shipping Inc. Announces the Date for the 2025 Fourth Quarter and Year-End Financial Results, Conference Call and Webcast",https://www.globenewswire.com/news-release/2026/02/03/3231204/10065/en/Diana-Shipping-Inc-Announces-the-Date-for-the-2025-Fourth-Quarter-and-Year-End-Financial-Results-Conference-Call-and-Webcast.html,Diana Shipping Inc. c/o Diana Shipping Services S.A.,2026-02-03T14:15:00Z,dry bulk shipping,"ATHENS, Greece, Feb. 03, 2026 (GLOBE NEWSWIRE) -- Diana Shipping Inc. (NYSE: DSX), (the “Company”), a global shipping company specializing in the ownership and bareboat charter-in of dry bulk vessels, today announced that its financial results for the fourth …",GlobeNewswire,Greece,News,2026-02-07T18:38:36.009776Z
1c071756e0dd9369a0026171f425b566,Why is bird food so expensive?,https://www.lifesciencesworld.com/why-is-bird-food-so-expensive/,Noah Whitman,2026-02-03T03:32:24Z,dry bulk shipping,"Why Is Bird Food So Expensive? The Real Cost of Feeding Our Feathered Friends Why is bird food so expensive? The high cost of bird food is primarily due to the rising prices of raw materials, transportation, packaging, and quality control measures ensuring it…",Lifesciencesworld.com,Unknown,Market Report,2026-02-07T18:38:36.009818Z
271757c9ef771fbcb5ef75b09bfbca3f,Diana Shipping Inc. Announces Direct Continuation of Time Charter Contract for m/v Amphitrite,https://www.globenewswire.com/news-release/2026/02/02/3230354/10065/en/Diana-Shipping-Inc-Announces-Direct-Continuation-of-Time-Charter-Contract-for-m-v-Amphitrite.html,Diana Shipping Inc. c/o Diana Shipping Services S.A.,2026-02-02T14:10:00Z,dry bulk shipping,"ATHENS, Greece, Feb. 02, 2026 (GLOBE NEWSWIRE) -- Diana Shipping Inc. (NYSE: DSX), (the “Company”), a global shipping company specializing in the ownership and bareboat charter-in of dry bulk vessels, today announced that, through a separate wholly-owned subs…",GlobeNewswire,Greece,News,2026-02-07T18:38:36.009868Z
df8efaa1fa132cf51ea3c65390d21f65,"K.M.’s Address, Nikos the Dribbler “Rumenige” and the Whip, the Ambassador of President Maria, Alpha Bank’s “Base” Salary €1,600, Ivan and Porto Carras",https://en.protothema.gr/2026/02/02/k-m-s-address-nikos-the-dribbler-rumenige-and-the-whip-the-ambassador-of-president-maria-alpha-banks-base-salary-e1600-ivan-and-porto-carras/,Newsroom,2026-02-02T11:49:46Z,dry bulk shipping,"Greeks remain strong in new ship orders & the sudden storm in precious metals
The post K.M.’s Address, Nikos the Dribbler “Rumenige” and the Whip, the Ambassador of President Maria, Alpha Bank’s “Base” Salary €1,600, Ivan and Porto Carras appeared first on Pr…",Protothema.gr,Greece,News,2026-02-07T18:38:36.009922Z
fc60bb4322d7251625e04ac9b7b52521,"Diana Shipping Details Buybacks, Genco Bid, and Decarbonization Plan at Capital Link Conference",https://www.marketbeat.com/instant-alerts/diana-shipping-details-buybacks-genco-bid-and-decarbonization-plan-at-capital-link-conference-2026-01-31/?utm_source=yahoofinance&amp;utm_medium=yahoofinance,MarketBeat,2026-01-31T23:39:22Z,dry bulk shipping,"Diana Shipping (NYSE:DSX) outlined its fleet profile, capital allocation activity, chartering strategy, and views on market conditions and decarbonization...",MarketBeat,Unknown,Analysis/Opinion,2026-02-07T18:38:36.009961Z
88c8550e849c8c5f9d56325a921c6b16,Remember small phones? This one is back for $99.99,http://www.popsci.com/sponsored-content/remember-small-phones-this-one-is-back-on-sale-sponsored-deal/,Stack Commerce,2026-02-06T12:00:00Z,bulk carrier,"And the NanoPhone Pro can do basically everything today's Android smartphones can do.
The post Remember small phones? This one is back for $99.99 appeared first on Popular Science.",Popular Science,Unknown,News,2026-02-07T18:38:36.714799Z
0f3f3a8c50f1052eb9301c5d8842cff9,2026 Fantasy Football Dynasty Rookie WR Outlook,https://sports.yahoo.com/fantasy/article/2026-fantasy-football-dynasty-rookie-wr-outlook-191303337.html,Justin Boone,2026-02-05T19:13:03Z,bulk carrier,"Yahoo fantasy football analyst Justin Boone continues his series of looking at the top college prospects for dynasty. Today, he dives into the wide receiver class.",Yahoo Entertainment,Unknown,Analysis/Opinion,2026-02-07T18:38:36.714830Z
445ee4863a538d0bca6230fc3bd9254d,2026 Fantasy Football Dynasty Rookie WR Outlook,https://sports.yahoo.com/fantasy/article/2026-fantasy-football-dynasty-rookie-rb-outlook-191303751.html,Justin Boone,2026-02-05T19:13:03Z,bulk carrier,"Yahoo fantasy football analyst Justin Boone continues his series of looking at the top college prospects for dynasty. Today, he dives into the wide receiver class.",Yahoo Entertainment,Unknown,Analysis/Opinion,2026-02-07T18:38:36.714853Z
435be8d7f5bd35fb35d9f1e87d04655e,Advancing ZnO nanostructures through strategic transition metal doping,https://www.nature.com/articles/s41598-026-37977-y,"Rasool Akhtar Alias Osama, Kamran Akhtar Siddiqui, Haoyun Wang, Hao Zhang, Iqra Akhtar Siddiqui, Peter Lomax, Rebecca Cheung",2026-02-05T00:00:00Z,bulk carrier,"The current research paper presents a first-principles study of the effects of doping Zno with transition metals such as Yttrium (Y) and Vanadium (V) on its structural, electronic, thermal stability, and optical characteristics. Replacing these Zn atoms with …",Nature.com,Unknown,News,2026-02-07T18:38:36.714903Z
f207900630a05c726f1b01f2d95d8456,Highly stable all-perovskite tandem solar cells with targeted conversion of tin–lead surfaces,https://www.nature.com/articles/s41566-025-01815-w,"Nannan Sun, Sheng Fu, Yunfei Li, Tianshu Ma, Feng Wang, Wentai Ouyang, Bo Feng, Xiaotian Zhu, Zhengbo Cui, Canglang Yao, Wenxiao Zhang, Xiaodong Li, Changlei Wang, Feng Gao, Junfeng Fang",2026-02-05T00:00:00Z,bulk carrier,"Treating the tin–lead surface in perovskite films with caesium hydroxide forms solid metal oxides that stabilize the surface against photothermal degradation. When used in all-perovskite tandem solar cells, a certified power conversion efficiency of 28.56% is…",Nature.com,Unknown,News,2026-02-07T18:38:36.714955Z
f370fc4ba0716cbb41c4b844f9f585ef,21 Road Trip Necessities You Can’t Forget to Pack,https://ahouseinthehills.com/road-trip-necessities-you-cant-forget-to-pack/,Leo Tanaka,2026-02-04T22:26:05Z,bulk carrier,"Having the right road trip necessities can make the difference between a stressful trip and an amazing experience on the open road. Smart packing means comfort, preparedness, and zero panic when the unexpected hits. These essential road trip necessities cover…",Ahouseinthehills.com,Unknown,News,2026-02-07T18:38:36.715004Z
28e46dec0169ef8bd803f478e8cdbcb8,IntelliTrans Launches API Platform to Scale Shipper-Partner Integrations,https://www.globenewswire.com/news-release/2026/02/04/3232269/0/en/IntelliTrans-Launches-API-Platform-to-Scale-Shipper-Partner-Integrations.html,IntelliTrans,2026-02-04T16:00:00Z,bulk carrier,IntelliTrans debuts API platform to simplify shipper-partner connectivity and support greater automation readiness....,GlobeNewswire,Unknown,News,2026-02-07T18:38:36.715039Z
77fbe499c138152bf960dd9f928c912c,"I, Integrated Circuit",https://hackaday.com/2026/02/04/__trashed-28/,Jenny List,2026-02-04T15:00:45Z,bulk carrier,"In 1958, the American free-market economist Leonard E Read published his famous essay I, Pencil, in which he made his point about the interconnected nature of free market economics by following …read more",Hackaday,USA,Market Report,2026-02-07T18:38:36.715068Z
8755a7f3dd9a2522b85686135633d532,Biodegradation of polyethylene terephthalate microplastics by Paenibacillus naphthalenovorans PETKKU2: Response surface optimization and genomic evidence for an alternative degradation mechanism,https://journals.plos.org/plosone/article?id=10.1371/journal.pone.0341623,"Aophat Choonut, Nantharat Wongfaed, Auraiwan Poolpol, Sophon Boonlue, Kitirote Wantala, Onruthai Pinyakong, Pensri Plangklang, Alissara Reungsang",2026-02-04T14:00:00Z,bulk carrier,"This study establishes Paenibacillus naphthalenovorans PETKKU2, isolated from landfill soil in Thailand, as the first reported member of this species capable of degrading polyethylene terephthalate microplastics (PET-MP). Initial screening identified PETKKU2 …",Plos.org,Unknown,Market Report,2026-02-07T18:38:36.715137Z
1ea0a50b6050cd03843b05fec0e4bf67,Remembering Vistara: Kolkata to Delhi on an A320neo,https://economondo.com/remembering-vistara-kolkata-to-delhi-on-an-a320neo/,Economondo,2026-02-04T11:00:00Z,bulk carrier,Flying on a busy domestic evening flight from Kolkata to Delhi with Vistara,Economondo.com,Unknown,News,2026-02-07T18:38:36.715166Z
806b367773b50c7099299c70254c010d,"Ether and majors rise as bitcoin rebounds to $76,000 but the bounce may not last",https://www.coindesk.com/markets/2026/02/04/ether-and-majors-rise-as-bitcoin-rebounds-to-usd76-000-but-the-bounce-may-not-last,Shaurya Malwa,2026-02-04T05:40:42Z,bulk carrier,"Flows and on-chain data signaled defensive positioning, as crypto investment products logged $1.7 billion in weekly outflows.",CoinDesk,Unknown,Market Report,2026-02-07T18:38:36.715236Z
6f11a6e2af009f2fa3d1c8cc6481bb2c,All You Need To Know Going Into Trade On Wednesday,https://www.ndtvprofit.com/markets/stock-market-today-all-you-need-to-know-going-into-trade-on-feb-4-10941062,NDTV Profit Research,2026-02-04T00:30:01Z,bulk carrier,"Stocks in news, earnings post market hours, bulk and block deals, F&amp;O cues and much more!",Ndtvprofit.com,Unknown,Market Report,2026-02-07T18:38:36.715262Z
5d9ebcbbc2bc6f36532f5ac41e0afc9b,Chemical capture of diazo metabolites reveals biosynthetic hydrazone oxidation,https://www.nature.com/articles/s41586-025-10079-x,"Katarina Pfeifer, Devon Van Cura, Kelvin J. Y. Wu, Emily P. Balskus",2026-02-04T00:00:00Z,bulk carrier,An approach to discover reactive diazo-based metabolites by capture based on their reactivity coupled to mass spectrometry revealed two previously unknown diazo-containing compounds produced by the human lung pathogen Nocardia ninae&nbsp;using novel&nbsp;bios…,Nature.com,Unknown,News,2026-02-07T18:38:36.715309Z
a88e6fa335a0e413150faccd13d921e2,Activated ATF6α is a hepatic tumour driver restricting immunosurveillance,https://www.nature.com/articles/s41586-025-10036-8,"Xin Li, Cynthia Lebeaupin, Aikaterini Kadianaki, Clementine Druelle-Cedano, Niklas Vesper, Charlotte Rennert, Júlia Huguet-Pradell, Borja Gomez Ramos, Chaofan Fan, Robert Stefan Piecyk, Laimdota Zizmare, Pierluigi Ramadori, Luqing Li, Lukas Frick, Menjie Qiu, Cangang Zhang, Luiza Martins Nascentes Melo, Vikas Prakash Ranvir, Peng Shen, Johannes Hanselmann, Jan Kosla, Mirian Fernández-Vaquero, Mihael Vucur, Praveen Baskaran, Xuanwen Bao, Olivia I. Coleman, Yingyue Tang, Miray Cetin, Zhouji Chen, Insook Jang, Stefania Del Prete, Mohammad Rahbari, Peng Zhang, Timothy V. Pham, Yushan Hou, Aihua Sun, Li Gu, Laura C. Kim, Ulrike Rothermel, Danijela Heide, Adnan Ali, Suchira Gallage, Nana Talvard-Balland, Marta Piqué-Gili, Albert Gris-Oliver, Alessio Bevilacqua, Lisa Schlicker, Alec Duffey, Kristian Unger, Marta Szydlowska, Jenny Hetzer, Duncan T. Odom, Tim Machauer, Daniele Bucci, Pooja Sant, Jun-Hoe Lee, Jonas Rösler, Sven W. Meckelmann, Johannes Schreck, Sue Murray, M. Celeste Simon, Sven Nahnsen, Almut Schulze, Ping-Chih Ho, Manfred Jugold, Kai Breuhahn, Jan-Philipp Mallm, Peter Schirmacher, Susanne Roth, Nuh Rahbari, Darjus F. Tschaharganeh, Stephanie Roessler, Benjamin Goeppert, Bertram Bengsch, Geoffroy Andrieux, Melanie Boerries, Nisar P. Malek, Marco Prinz, Achim Weber, Robert Zeiser, Pablo Tamayo, Peter Bronsert, Konrad Kurowski, Robert Thimme, Detian Yuan, Rafael Carretero, Tom Luedde, Roser Pinyol, Felix J. Hartmann, Michael Karin, Alpaslan Tasdogan, Christoph Trautwein, Moritz Mall, Maike Hofmann, Josep M. Llovet, Dirk Haller, Randal J. Kaufman, Mathias Heikenwälder",2026-02-04T00:00:00Z,bulk carrier,"ATF6α activation in human and preclinical models of hepatocellular carcinoma is significantly associated with an aggressive tumour phenotype characterized by reduced survival, glycolytic reprogramming&nbsp;and local immunosuppression.",Nature.com,Unknown,News,2026-02-07T18:38:36.715357Z
ffd994b154bee7c8f54e7ae00e27fba5,Large-scale analogue quantum simulation using atom dot arrays,https://www.nature.com/articles/s41586-025-10053-7,"M. B. Donnelly, Y. Chung, R. Garreis, S. Plugge, D. Pye, M. Kiczynski, J. Támara-Isaza, M. M. Munia, S. Sutherland, B. Voisin, L. Kranz, Y. L. Hsueh, A. M. Saffat-Ee Huq, C. R. Myers, R. Rahman, J. G. Keizer, S. K. Gorman, M. Y. Simmons",2026-02-04T00:00:00Z,bulk carrier,"A new platform comprising large-scale 2D arrays of quantum dots patterned with sub-nanometre precision, with each quantum dot defined by tens of phosphorus atoms doped into silicon, allows for analogue simulation of quantum materials on arbitrary lattices.",Nature.com,Unknown,News,2026-02-07T18:38:36.715397Z
6b8b291f820efcf45e529bb104c8b7f1,Chlorination-controlled aggregation and film-formation kinetics enabling high-efficiency organic solar cells with low-cost linear conjugated polymers,https://www.nature.com/articles/s41467-026-69051-6,"Bingyan Yin, Zhili Chen, Baoqi Wu, Xiyue Yuan, Cong Xiao, Xia Zhou, Jianbin Zhong, Seunglok Lee, Wei Chen, Lifu Zhang, Liming Wang, Guangye Zhang, Wei Zhang, Changduk Yang, Zhitian Liu, Fei Huang, Yong Cao, Chunhui Duan",2026-02-04T00:00:00Z,bulk carrier,"Yin et al. report linear conjugated polymer donors with chlorinated backbone for modulating polymer aggregation and surface tension, and optimised compatibility with norfullerene acceptors. By using binary blends, a 20.42% efficiency is achieved for organic s…",Nature.com,Unknown,Market Report,2026-02-07T18:38:36.715449Z
23f761968dabd546517a5a3e11ea04fb,Rare heterozygous missense variants in VSX2 are associated with retinal detachment,https://journals.plos.org/plosgenetics/article?id=10.1371/journal.pgen.1012027,"Daniel C. Brock, Justin S. Dhindsa, Yifan Chen, Vida Ravanmehr, Jonathan Mitchell, Fengyuan Hu, Xiaoyin Li, Likhita Nandigam, Quanli Wang, Kevin Wu, Jessica C. Butts, Hardeep S. Dhindsa, Benjamin J. Frankfort, Nicholas M. Tran, Slavé Petrovski, Ryan S. Dhindsa",2026-02-03T14:00:00Z,bulk carrier,"Author summary Retinal detachment (RD) is a medical emergency that can lead to permanent blindness if not treated promptly. Although both environmental and genetic factors contribute to RD risk, much of its genetic basis has remained unclear. In this study, w…",Plos.org,Unknown,News,2026-02-07T18:38:36.715499Z
23c542a906e65946137ac28bf4e9b59f,Applicability limits of time-domain impedance spectroscopy for comprehensive thermoelectric characterization under heat leakage conditions,https://www.nature.com/articles/s41598-026-35799-6,"Yasuhiro Hasegawa, Kotoko Kodama",2026-02-02T00:00:00Z,bulk carrier,Scientific Reports - Applicability limits of time-domain impedance spectroscopy for comprehensive thermoelectric characterization under heat leakage conditions,Nature.com,Unknown,Market Report,2026-02-07T18:38:36.715591Z
968e10329e6aedf3769b71a0ecb46e88,How to save money: 14 easy tips,https://finance.yahoo.com/news/save-money-13-easy-tips-194112964.html,Karen Bennett,2026-01-31T11:58:22Z,bulk carrier,Here’s how to boost your savings.,Yahoo Entertainment,Unknown,News,2026-02-07T18:38:36.715616Z
6d93908c52a8bf2d9a30c47feb98d6f6,Nanotwin architecture and ultra-high valley degeneracy lead to high thermoelectric performance in GeTe-based thermoelectric materials,https://www.nature.com/articles/s41467-026-68908-0,"Song Li, Yuxuan Yang, Xiaoyu Fei, Yang Geng, Jiajun Nan, Pubao Peng, Guizhong Li, Yang Zhang, Xiaobing Liu, Yongsheng Zhang, Haijun Wu, Guodong Tang",2026-01-31T00:00:00Z,bulk carrier,Authors propose a pathway to design GeTe based thermoelectric materials with high thermoelectric performance and mechanical properties by nanotwin architecture and inducing high valley degeneracy.,Nature.com,Unknown,News,2026-02-07T18:38:36.715657Z
68fe91a511a7853bbc55dd707b80e679,"The “poison” poll for Karystianou and Tsipras, Thymios at M.M., Frangou in Argentina, and the Romanian billionaires at Praktiker",https://en.protothema.gr/2026/02/04/the-poison-poll-for-karystianou-and-tsipras-thymios-at-m-m-frangou-in-argentina-and-the-romanian-billionaires-at-praktiker/,Newsroom,2026-02-04T10:43:06Z,capesize,"Greek Shipowners Behind the Scenes of Global Energy & the “Hellenic Ammunition”
The post The “poison” poll for Karystianou and Tsipras, Thymios at M.M., Frangou in Argentina, and the Romanian billionaires at Praktiker appeared first on ProtoThema English.",Protothema.gr,Greece,News,2026-02-07T18:38:37.191780Z
26cb02fa89db0bdad68076c273ee9e09,Union Budget 2026: What India’s fertiliser trade needs to remain globally competitive,https://www.thehindubusinessline.com/economy/budget/union-budget-2026-what-indias-fertiliser-trade-needs-to-remain-globally-competitive/article70571575.ece,Abhishek   Wadekar,2026-01-31T03:31:03Z,capesize,"Union Budget 2026 could reshape India’s fertiliser trade through subsidy reforms, better logistics, green ammonia, and global sourcing to boost competitiveness.",BusinessLine,India,News,2026-02-07T18:38:37.191896Z
95c7a8298c796c735e8006994a38b2d8,Army Security Cooperation Group-South: First of Its Kind Stands Up in Georgia,https://soldiersystems.net/2026/02/03/army-security-cooperation-group-south-first-of-its-kind-stands-up-in-georgia/,Eric G,2026-02-03T01:00:00Z,panamax,"FORT BENNING, Ga. – On January 27, 2026, the Army Security Cooperation Group – South (ASCG-S) conducted a small ceremony on Kelley Hill, Fort Benning, Georgia to commemorate its ongoing transformation. ASCG-S, formerly 1st Security Force Assistance Brigade (1…",Soldiersystems.net,Unknown,News,2026-02-07T18:38:37.862332Z
f7c092e10314fc4620a694ea46c08bc4,Pain Relief Bundle: 288x Ibuprofen 200mg + 50x Panamax + 20x Diclofenac 12.5 $19.99 Delivered @PharmacySavings,https://www.ozbargain.com.au/node/946346,jason101,2026-02-01T08:55:32Z,panamax,"Hi Ozbargainers, We're so lucky that suppliers keep reaching out and offering me their excess clearance 2026 stock at near give away prices. With Ozbargain in mind I am scooping up whatever I …",Ozbargain.com.au,Panama,Market Report,2026-02-07T18:38:37.862425Z
a0ac85548144140e32e12cf388729250,"Facing high Trump tariffs, Africa’s leading economy says it’s close to a new trade deal with China",https://www.bostonherald.com/2026/02/06/china-south-africa-trade-deal/,Associated Press,2026-02-06T18:18:31Z,iron ore,Africa’s leading economy is looking for other trade options.,Boston Herald,China,News,2026-02-07T18:38:40.109230Z
2eddafb191f95c5b2d92258fb650729d,"Facing high Trump tariffs, South Africa signs framework agreement for trade deal with China",https://apnews.com/article/china-south-africa-trade-tariffs-trump-26d2b3798716a5c0d7661ad714843382,Gerald Imray,2026-02-06T16:42:03Z,iron ore,China and South Africa have signed a framework agreement for a new trade deal. It shows how Africa’s leading economy is looking for other options following the high U.S. import tariffs imposed on it by the Trump administration. South Africa’s Ministry of Trad…,Associated Press,China,News,2026-02-07T18:38:40.109269Z
20bf398456e6abfea67c18768880b129,"Facing high Trump tariffs, Africa's leading economy says it's close to a new trade deal with China",https://www.pbs.org/newshour/world/facing-high-trump-tariffs-africas-leading-economy-says-its-close-to-a-new-trade-deal-with-china,"Gerald Imray, Associated Press",2026-02-06T16:22:26Z,iron ore,"South Africa's Ministry of Trade and Industry said the agreement would start negotiations over a deal that would give some South African goods, such as fruit, duty-free access to the Chinese market.",PBS,China,Market Report,2026-02-07T18:38:40.109283Z
a7472c41311886bef3b8370532d2efb0,Glencore’s years-long pursuit of Rio ended in just 24 Hours,https://financialpost.com/commodities/mining/glencores-years-rio-ended-24-hours,Bloomberg News,2026-02-06T13:30:05Z,iron ore,"Glencore and Rio Tinto talked right up to the wire, trying to find some common ground on price, before Rio pulled the plug. Read more.",Financial Post,Unknown,News,2026-02-07T18:38:40.109320Z
8b40ad693db274475e3ae74120f77f75,"Facing Trump tariffs, Africa's leading economy says it's close to China trade deal",https://abcnews.go.com/International/wireStory/facing-high-trump-tariffs-africas-leading-economy-close-129912426,GERALD IMRAY Associated Press,2026-02-06T13:24:27Z,iron ore,China and South Africa have signed a framework agreement for a new trade deal,ABC News,China,News,2026-02-07T18:38:40.109333Z
2d01f226fb0023556597b783366d7b4f,Opinion: Green steel is about as realistic as green cheese,https://financialpost.com/opinion/opinion-green-steel-as-realistic-as-green-cheese,Special to Financial Post,2026-02-06T11:00:22Z,iron ore,Steel from blast furnaces is the underpinning of our civilization. Steel from hydrogen-powered electrolysis is far too costly to replace it,Financial Post,Unknown,Analysis/Opinion,2026-02-07T18:38:40.109360Z
2e27383f1c96ecfed504b08e400f8eef,RBA Hike Spotlights Inflation Pressure Central Banks Can’t Fix,https://financialpost.com/pmn/business-pmn/rba-hike-spotlights-inflation-pressure-central-banks-cant-fix,Bloomberg News,2026-02-06T09:53:54Z,iron ore,Australia’s central bank chief Michele Bullock strode into a committee room in Parliament House on Friday morning primed to explain what’s causing the inflation that forced this week’s interest-rate hike — the world’s first of 2026.,Financial Post,Australia,News,2026-02-07T18:38:40.109384Z
9cda42c5eb273607d7d08db782a790d7,Ron Wyden Only Talks Like This When The Spies Do Something *Real* Bad,https://www.forever-wars.com/ron-wyden-only-talks-like-this-when-the-spies-do-something-real-bad/,Lemon-flight,2026-02-06T05:47:01Z,iron ore,"No, I don't know what they did. But I have a lot of experience with the senator",Forever-wars.com,Unknown,News,2026-02-07T18:38:40.109412Z
8278fea7ccc3dc50e499992720e51f20,Tropical Cyclone Mitchell expected to form off WA's Pilbara coast,https://www.abc.net.au/news/2026-02-06/tropical-cyclone-mitchell-forecast-pilbara-kimberley/106310802,Michelle Stanley and Kelsey Reid,2026-02-06T03:08:21Z,iron ore,"The Bureau of Meteorology says Tropical Cyclone Mitchell has a high chance of forming into a category two system, bringing destructive winds and heavy rain to northern WA.",ABC News (AU),Australia,News,2026-02-07T18:38:40.109428Z
48cfbc898facf22b55339844e0795a3d,Vista Gold Strengthens Mt Todd Project Team with Key Appointments in Australia,https://financialpost.com/pmn/business-wire-news-releases-pmn/vista-gold-strengthens-mt-todd-project-team-with-key-appointments-in-australia,Business Wire,2026-02-05T22:06:36Z,iron ore,DENVER — Vista Gold Corp. (NYSE American and TSX: VGZ) (“Vista” or the “Company”) is pleased to announce several key appointments as part of its ongoing program to strengthen the Company’s project development capability and corporate presence in Australia. Th…,Financial Post,Australia,News,2026-02-07T18:38:40.109452Z
e6996a19453a80fe1e3e7f975f8f36fc,Sweden’s Journey to Producing 100% Fossil-Free Steel for Volvo & Beyond,https://cleantechnica.com/2026/02/05/swedens-journey-to-producing-100-fossil-free-steel-for-volvo-beyond/,Kyle Field,2026-02-05T21:57:07Z,iron ore,"Here at CleanTechnica, we talk a lot about building things, but it’s not very often that we dig into the raw materials they’re made of. The reality is that many of the raw materials used in clean tech are responsible for some of the most significant emissions…",CleanTechnica,Unknown,News,2026-02-07T18:38:40.109501Z
