article_id,title,link,creator,pubdate,category,description,source,country,article_type,scrape_timestamp
0875918fce77e45f5004f2515a3d572d,"Already under financial pressure, Midwest soybean farmers are squeezed further by tariffs, Iran war",https://abcnews.com/US/wireStory/financial-pressure-midwest-soybean-farmers-squeezed-tariffs-iran-131983134,"ERIC FERKENHOFF Associated Press, LEE ENTERPRISES Associated Press, JOSH KELETY Associated Press, The Associated Press",2026-04-13T04:30:48Z,grain exports,Midwest soybean farmers are facing an array of compounding issues,Abcnews.com,Unknown,News,2026-04-16T07:51:23.557515Z
dc5f23d193c95419ca2f6bf94b56800c,"Already under financial pressure, Midwest soybean farmers are squeezed further by tariffs, Iran war",https://abcnews.com/Business/wireStory/financial-pressure-midwest-soybean-farmers-squeezed-tariffs-iran-131983138,"ERIC FERKENHOFF Associated Press, LEE ENTERPRISES Associated Press, JOSH KELETY Associated Press, The Associated Press",2026-04-13T04:30:42Z,grain exports,Midwest soybean farmers are facing an array of compounding issues,Abcnews.com,Unknown,News,2026-04-16T07:51:23.557537Z
f21c24f558e76ddc9c56566ee6199d26,Letters: Farmers blocking roads are targeting the very people who support them,https://www.independent.ie/opinion/letters/letters-farmers-blocking-roads-are-targeting-the-very-people-who-support-them/a2025522247.html,Letters to the editor,2026-04-11T04:30:00Z,grain exports,I spent two hours caught up in the farmers protest on the M1 on Friday morning.,Independent.ie,Unknown,News,2026-04-16T07:51:23.557566Z
fbf295a1e0a59ffa4ff39314a04748e7,The Fight Over the Future of Meat,http://foreignpolicy.com/2026/04/10/alternative-meat-future-geopolitics-us-china-race-food-security-agriculture/,Bruce Friedrich,2026-04-10T18:00:04Z,grain exports,The United States lost the EV race to China. Food could be next.,Foreign Policy,China,News,2026-04-16T07:51:23.557577Z
fbc50701e8b34669a27a08cba5d3dc23,The Emirates on the Tightrope,https://www.nybooks.com/online/2026/04/10/the-emirates-on-the-tightrope/,Colin Powers,2026-04-10T15:27:39Z,grain exports,"On Sunday, March 22, the United Arab Emirates’ foreign minister, Abdullah bin Zayed al Nahyan, maternal brother of UAE President Mohamed bin Zayed al Nahyan, put on a brave face. The evening prior, President Donald Trump declared that if the Strait of Hormuz …",The New York Review of Books,Unknown,Market Report,2026-04-16T07:51:23.557618Z
2f7879ba34238e32ef9b444812469278,Corn prices poised to fall on Iran-US ceasefire pact,https://www.thehindubusinessline.com/economy/agri-business/corn-prices-poised-to-fall-on-iran-us-ceasefire-pact/article70847959.ece,Subramani Ra Mancombu,2026-04-10T14:41:13Z,grain exports,"Corn prices are set to decline as the Iran-US ceasefire alleviates nitrogen fertilizer supply concerns, analysts predict.",BusinessLine,Unknown,Market Report,2026-04-16T07:51:23.557646Z
650c044b7df05d7b8bda7fde29f57688,A global food emergency: Why the closed Strait of Hormuz puts half the world’s calories at risk,https://fortune.com/2026/04/09/global-food-emergency-how-bad-strait-hormuz-grocery-prices-shortages/,"Aya S. Chacar, The Conversation",2026-04-09T16:41:39Z,grain exports,"Modern agriculture depends on precise timing of delivering nutrients to plants and corn, wheat and rice are no exception.",Fortune,Global,News,2026-04-16T07:51:23.557687Z
23beb6a155025446e82ed19082129502,Could the UN Secretary-General’s 'Good Offices' Help to End the Iran War?,https://www.commondreams.org/opinion/un-help-end-iran-war,Connie Peck,2026-04-09T10:58:01Z,grain exports,"While the whole world held its breath, hoping for some way the overcome the ultimatum that President Donald Trump had given to Iran, Pakistan
, working feverishly as a third-party mediator (with the help of Türkiye, Egypt, and other regional powers, as well …",Common Dreams,Egypt,News,2026-04-16T07:51:23.557726Z
7321beb3c1746b57f6416050951c2b2d,"[Latest] Global Zinc Agriculture Micronutrients Market Size/Share Worth USD 6.14 Billion by 2035 at a 7.1% CAGR: Custom Market Insights (Analysis, Outlook, Leaders, Report, Trends, Forecast, Segmentation, Growth Rate, Value, SWOT Analysis)",https://www.globenewswire.com/news-release/2026/04/14/3273797/0/en/Latest-Global-Zinc-Agriculture-Micronutrients-Market-Size-Share-Worth-USD-6-14-Billion-by-2035-at-a-7-1-CAGR-Custom-Market-Insights-Analysis-Outlook-Leaders-Report-Trends-Forecast-.html,CMI MARKET RESEARCH PRIVATE LIMITED,2026-04-14T17:30:00Z,soybean exports,"[220+ Pages Latest Report] According to a market research study published by Custom Market Insights, the demand analysis of Global Zinc Agriculture Micronutrients Market size & share revenue was valued at approximately USD 2.84 Billion in 2025 and is expected…",GlobeNewswire,Global,Analysis/Opinion,2026-04-16T07:51:23.954120Z
7694379d9d43f6703e05c77034dcda15,West Asia conflict: India's soybean meal exports fall 63%,https://economictimes.indiatimes.com/news/economy/foreign-trade/west-asia-conflict-indias-soybean-meal-exports-fall-63/articleshow/130264488.cms,PTI,2026-04-14T16:54:17Z,soybean exports,"India’s soybean meal exports dropped nearly 63% to 60,000 tonnes in March, hit by high domestic prices and disruptions from the West Asia conflict, according to Soybean Processors Association of India. Shipments to key markets like Iran and the UAE were affec…",The Times of India,India,Market Report,2026-04-16T07:51:23.954193Z
14023da30643f8324ab02ea6b47ebb54,Port of Los Angeles Posts Strong March as Trade and Energy Risks Build,https://gcaptain.com/port-of-los-angeles-posts-strong-march-as-trade-and-energy-risks-build/,Lori Ann LaRocco,2026-04-13T21:24:23Z,soybean exports,"By Lori Ann LaRocco – The Port of Los Angeles was a beehive of activity in March, but details are emerging on the impact of the U.S./Israel war with Iran...",gcaptain.com,Unknown,News,2026-04-16T07:51:23.954286Z
17fb1fbefe7573028967a31b9bc9977a,"Soybeans Rallying on Friday, Led by Meal Gains",https://www.barchart.com/story/news/1245910/soybeans-rallying-on-friday-led-by-meal-gains,Austin Schroeder,2026-04-10T17:26:42Z,soybean exports,"Soybeans are trading with 7 to 13 cent gains at midday, led by the meal. The cmdtyView national average Cash Bean price is up 13 cents at $11.10 1/4. Soymeal...",Barchart.com,Unknown,Analysis/Opinion,2026-04-16T07:51:23.954493Z
56688dd0c29cfe6691934706489312e6,Economic Digest: Nepal’s Business News in a Snap,https://english.khabarhub.com/2026/15/544167/,Khabarhub,2026-04-15T02:15:38Z,wheat exports,"KATHMANDU: Economic Digest offers a concise yet comprehensive overview of significant business happenings in Nepal, presented in easily digestible summaries. Nepal’s current economic landscape reflects a mix of reform efforts, structural weaknesses, and secto…",Khabarhub.com,Unknown,Analysis/Opinion,2026-04-16T07:51:24.390284Z
2493bc257a71266267f19b93147cf2a0,One Of The Largest Food Producing Nations On The Entire Planet May Soon Be Forced To Ration Fuel,http://theeconomiccollapseblog.com/one-of-the-largest-food-producing-nations-on-the-entire-planet-may-soon-be-forced-to-ration-fuel/,Michael,2026-04-14T21:07:25Z,wheat exports,"The real pain from the closure of the Strait of Hormuz hasn’t even hit us yet. All over the world, countries are running down their strategic energy reserves, and the last tankers that left the Persian Gulf before the war started will be arriving at their des…",Theeconomiccollapseblog.com,Unknown,News,2026-04-16T07:51:24.390346Z
305b23a70fa029fac1f5eef16aaaef25,Today’s News in a Nutshell,https://english.khabarhub.com/2026/14/543475/,Khabarhub,2026-04-14T16:15:39Z,wheat exports,"KATHMANDU: Khabarhub brings you a glimpse of major developments of the day in Nepal, including politics, business/economy, sports, entertainment, and more. Government releases draft of national commitment document The government has made public a draft of the…",Khabarhub.com,Unknown,News,2026-04-16T07:51:24.390446Z
6011ef0e8a889c239f324af7c2710671,World faces food ‘catastrophe’ if Strait of Hormuz disruption persists: FAO,https://www.aljazeera.com/news/2026/4/14/fao-warns-strait-of-hormuz-disruption-risks-triggering-a-global-food-crisis,Al Jazeera,2026-04-14T08:52:52Z,wheat exports,"Global agriculture is highly exposed to the blockage of waterways, risking higher commodity prices and food inflation.",Al Jazeera English,Global,Market Report,2026-04-16T07:51:24.390479Z
906da201ba6dd8493d8f03b90c55458b,Food prices are already high in Canada. Will the Iran war make them worse?,https://theconversation.com/food-prices-are-already-high-in-canada-will-the-iran-war-make-them-worse-279161,"Michael von Massow, Professor, Food Economics, University of Guelph, Alfons Weersink, Professor, Dept of Food, Agricultural and Resource Economics, University of Guelph",2026-04-13T15:22:40Z,wheat exports,"Rising oil and fertilizer costs linked to Middle East tensions could affect food prices, but the effects will vary across products and may take time to fully emerge.",The Conversation Africa,Unknown,Market Report,2026-04-16T07:51:24.390576Z
3a217586eb9a5ae02d5cdcb63b6d911a,"El Niño Threatens Indian Monsoon, Raising Crop Output Risks",https://financialpost.com/pmn/business-pmn/el-nino-threatens-indian-monsoon-raising-crop-output-risks,Bloomberg News,2026-04-13T12:54:21Z,wheat exports,"India is set to witness a below-normal monsoon this year as a likely El Niño weather pattern could reduce rainfall, adding pressure on farmers who are already facing higher input costs following the Middle East conflict.",Financial Post,India,News,2026-04-16T07:51:24.390602Z
37c42e0320ab16478b0a02d9ac897773,Govt mulls sending surplus rice as aid to conflict-hit Iran,https://timesofindia.indiatimes.com/india/govt-mulls-sending-surplus-rice-as-aid-to-conflict-hit-iran/articleshow/130198846.cms,TNN,2026-04-11T19:48:37Z,wheat exports,"India is poised to permit wheat exports to Egypt, Indonesia, and Myanmar due to surplus stocks. Rice shipments, including to war-torn Iran on humanitarian grounds, are also being considered. This move aims to free up storage space for upcoming winter crops an…",The Times of India,India,News,2026-04-16T07:51:24.390745Z
19897d4e0d64cc11aba7d44a3e3c19c0,How sustainable sourcing can unlock value in India’s agri-value chains,https://www.thehindubusinessline.com/economy/agri-business/how-sustainable-sourcing-can-unlock-value-in-indias-agri-value-chains/article70848712.ece,Joydeep   Dutt,2026-04-11T03:38:39Z,wheat exports,"At a time when supply chains are both strategic assets and vulnerabilities, sustainability is central to long-term value creation",BusinessLine,India,News,2026-04-16T07:51:24.390767Z
2558d4df9dc6a54c729b7c247a710a25,How the Iran war energy crisis is echoing across Canada,https://financialpost.com/feature/iran-war-energy-crisis-shaking-up-canada,Reid Southwick,2026-04-09T16:30:49Z,wheat exports,The global energy crisis sparked by the Iran war is shaking up Canada coast to coast and could have a lasting legacy. Read more,Financial Post,Global,News,2026-04-16T07:51:24.390839Z
4751776f2ba9c09937d106d8c21c67df,India export rice prices edge up on demand; global rates rise amid Middle East tensions,https://economictimes.indiatimes.com/industry/cons-products/food/india-export-rice-prices-edge-up-on-demand-global-rates-rise-amid-middle-east-tensions/articleshow/130142658.cms,Reuters,2026-04-09T12:17:47Z,wheat exports,"Indian rice export prices are climbing. A stronger rupee is pushing traders to increase their rates. Demand is also improving. Meanwhile, costs from the Middle East conflict are raising prices for Vietnamese and Thai rice. Vietnam's rice exports saw a signifi…",The Times of India,India,Market Report,2026-04-16T07:51:24.390876Z
6a672d7a1037d4cbe03170df4d901dba,The Coming Collapse You Aren’t Ready For: Why the Blockade Will Shatter Civilization,https://www.naturalnews.com/2026-04-15-the-coming-collapse-you-arent-ready-for.html,Mike Adams,2026-04-15T06:00:00Z,fertilizer exports,"Introduction: The Illusion of Plenty: Welcome to the Buffer’s End We are living in an era of borrowed time, coasting on rapidly depleting global reserves while chanting victory songs of ignorance. The victory chants of the so-called ‘MAGA morons’ are, in my v…",Naturalnews.com,Global,News,2026-04-16T07:51:24.858158Z
1d4866302c03f4a0767ddf0f5fcb6ca2,Trump’s Blockade of the Blockaders,https://www.theatlantic.com/newsletters/2026/04/trump-iran-war-blockade-of-blockade/686813/,Will Gottsegen,2026-04-14T22:28:00Z,fertilizer exports,He wants to use economic pain to weaken Iran—even if that threatens the global economy.,The Atlantic,Global,News,2026-04-16T07:51:24.858201Z
6812e287853cbde005cf40b38e391062,"War intensifies uncertainty for makers of ultimate in bling, luxury watches",https://japantoday.com/category/business/war-in-iran-intensifies-a-time-of-uncertainty-for-makers-of-the-ultimate-in-bling-luxury-watches,,2026-04-14T21:48:56Z,fertilizer exports,"The bling is back, but the Iran war has tarnished the outlook for the luxury watch industry — the ultimate in opulence. Starting Tuesday, Geneva hosts the annual Watches and Wonders fair, a premiere gathering in an industry eager for a rebound after two years…",Japan Today,Unknown,Analysis/Opinion,2026-04-16T07:51:24.858246Z
b4a772ac5b5a6f96e429c2b5ffa6c3eb,Luxury watchmakers brace for more uncertainty with the war in Iran,https://apnews.com/article/watches-luxury-switzerland-rolex-omega-patek-philippe-cartier-4b221c91cabc5e95b8d35fbd97a1506b,Associated Press,2026-04-14T17:30:00Z,fertilizer exports,"The bling is back, but the Iran war has tarnished the outlook for the luxury watch industry — the ultimate in opulence.



Starting Tuesday, Geneva hosts the annual Watches and Wonders fair, a premiere gathering in an industry eager for a rebound after two ye…",Associated Press,Unknown,Analysis/Opinion,2026-04-16T07:51:24.858391Z
f0d1e1d20b7d4d465ba5c65b692c7008,War intensifies uncertainty for makers of luxury watches,https://www.bostonherald.com/2026/04/14/switzerland-luxury-watches/,Associated Press,2026-04-14T17:29:22Z,fertilizer exports,War intensifies uncertainty for makers of luxury watchesbostonherald.com,Boston Herald,Unknown,News,2026-04-16T07:51:24.858419Z
ca1c6492e34078acbb200604c4290c2c,I Don’t Blame NATO for Skipping Out on Our Greedy President’s Strait of Hormuz Blockade,https://www.esquire.com/news-politics/politics/a71014598/strait-of-hormuz-trump-blockade/,Charles P. Pierce,2026-04-14T15:42:40Z,fertilizer exports,"Trump, whose most profound desire is to make money, is essentially running an extortion scheme.",esquire.com,Unknown,News,2026-04-16T07:51:24.858527Z
71635f4aec89d6034f37938197780aa5,IMF: Iran War Is Threatening Global Growth,https://www.newser.com/story/387306/imf-iran-war-is-threatening-global-growth.html,Arden Dier with Newser.AI,2026-04-14T14:43:08Z,fertilizer exports,"After enduring a pandemic and rising inflation, the global economy just hit another wall: war in the Middle East. The International Monetary Fund on Tuesday cut its growth forecast, warning that the war in Iran and blocked oil shipments through the Strait of …",Newser,Global,Analysis/Opinion,2026-04-16T07:51:24.858574Z
475d4aaf1e07db35799e353ec567be74,How China's Sulphuric Acid Ban Will Hit Metals & Fertiliser,https://freerepublic.com/focus/f-news/4374845/posts,Supply Chain Digital,2026-04-14T11:20:13Z,fertilizer exports,"China’s sulphuric acid export ban and Iran war risks are squeezing metals, fertiliser and food supply chains worldwide, testing procurement and logistics China’s ban on sulphuric acid exports from May is set to cascade through global supply chains, tightening…",Freerepublic.com,China,News,2026-04-16T07:51:24.858595Z
472cbbf07bbf7d2db45132a3ed25aafc,"Fertiliser costs surge may hit global coffee production, says ICO",https://www.thehindubusinessline.com/economy/agri-business/fertiliser-costs-surge-may-hit-global-coffee-production-says-ico/article70860863.ece,Vishwanath Kulkarni,2026-04-14T10:50:17Z,fertilizer exports,Coffee prices rebound as West Asia tensions disrupt supply and raise fertiliser costs. ICO warns of risks to future crops; India gains from export opportunities.,BusinessLine,India,Market Report,2026-04-16T07:51:24.858615Z
8a88501c66350976d7e793d00314faf5,Aftermath: Plastics Clogged in the Persian Gulf,http://prospect.org/2026/04/14/aftermath-plastics-clogged-in-persian-gulf/,"David Dayen, Emma Janssen and Whitney Curry Wimbish",2026-04-14T09:30:00Z,fertilizer exports,"In today’s inaugural newsletter: plastic supply chains, sulfuric acid export bans, and the war drags on.
The post Aftermath: Plastics Clogged in the Persian Gulf appeared first on The American Prospect.",The American Prospect,USA,News,2026-04-16T07:51:24.858642Z
cc784170525e691b8a0dabb24b75a244,The US on the naval blockade of Iran: How it could backfire on Trump,https://en.protothema.gr/2026/04/14/the-us-on-the-naval-blockade-of-iran-how-it-could-backfire-on-trump/,admin,2026-04-14T06:10:34Z,fertilizer exports,"Washington targets Chinese dependence on Iranian oil, but backfire could cause new US-Peking tensions, further pressure on the global economy and a price rise of up to $150 a barrel
The post The US on the naval blockade of Iran: How it could backfire on Trump…",Protothema.gr,China,News,2026-04-16T07:51:24.858663Z
d926537a9e902295e3bdc78d5c13cf54,Bangladesh’s Energy Crisis worsens as US-Israeli War on Iran Drags on,https://www.juancole.com/2026/04/bangladeshs-worsens-israeli.html,Global Voices,2026-04-14T04:06:02Z,fertilizer exports,"How a far away war plunged Bangladesh into fuel rationing, factory shutdowns, and a fiscal crisis",Juancole.com,Unknown,News,2026-04-16T07:51:24.858697Z
ddb0ee088aea115849d1e1d232edaf07,"Morgan Stanley Lifts CF Industries (CF) Target, RBC Capital Follows with Increase on Strong Fertilizer Prices",https://finance.yahoo.com/markets/stocks/articles/morgan-stanley-lifts-cf-industries-211630303.html,Vardah Gill,2026-04-13T21:16:30Z,fertilizer exports,"CF Industries Holdings, Inc. (NYSE:CF) is included among the 15 Cash-Rich Dividend Stocks to Invest in Right Now. On April 8, Morgan Stanley analyst Vincent ...",Yahoo Entertainment,Unknown,Market Report,2026-04-16T07:51:24.858770Z
6a4febda3a4cb9c55c2975b79f3efaf1,The Crisis In The Strait Of Hormuz Is The Greatest Threat To The Global Economy In My Entire Lifetime,http://theeconomiccollapseblog.com/the-crisis-in-the-strait-of-hormuz-is-the-greatest-threat-to-the-global-economy-in-my-entire-lifetime/,Michael,2026-04-13T20:23:17Z,fertilizer exports,Nobody was ready for a scenario in which the Strait of Hormuz is blocked for an indefinite period of time. The Iranians think that they will eventually get what they want by holding commercial traffic through the Strait of Hormuz hostage and causing as much p…,Theeconomiccollapseblog.com,Global,News,2026-04-16T07:51:24.858820Z
e422551606af4ea7c75ecff8c0739034,Trump has wanted to humble Iran since 1980. He may be humbling the American empire instead,https://fortune.com/2026/04/13/trump-iran-war-interview-1980-bibi-netanyahu-israel-suez-canal-crisis-hegemony/,"Eva Roytburg, Nick Lichtenberg",2026-04-13T20:19:44Z,fertilizer exports,"Historians call it a ""Suez moment""—when a fading empire goes to war to prove it is still one, and proves the opposite instead.",Fortune,USA,News,2026-04-16T07:51:24.858843Z
440fe35bf9f4c7922dc3e5a5ba3879c1,"UN Warns of Food Risks From Fertilizer, Energy Trade Curbs",https://financialpost.com/pmn/business-pmn/un-warns-of-food-risks-from-fertilizer-energy-trade-curbs,Bloomberg News,2026-04-13T18:52:52Z,fertilizer exports,"The United Nations urged countries not to limit shipments of energy and fertilizers as the conflict in the Middle East deepens, warning that such restrictions in the past have exacerbated spikes in global food prices.",Financial Post,Global,Market Report,2026-04-16T07:51:24.858892Z
cab0683dbb243ee1b4cb07b3494e702e,Trump Blockade Threatens Iran’s Military-Industrial Complex,https://www.breitbart.com/national-security/2026/04/13/trump-blockade-threatens-irans-military-industrial-complex/,John Hayward,2026-04-13T17:08:57Z,fertilizer exports,"President Donald Trump’s blockade of Iran could be poised to deliver a staggering blow to the Iranian economy, including the cash flows needed by the regime to pay the host of soldiers and thugs it requires to stay in power.
The post Trump Blockade Threatens …",Breitbart News,Unknown,News,2026-04-16T07:51:24.858957Z
0b3c4ab7fa11d4a8ba722d1d988e9de3,Widespread Rationing And Global Energy Shortages Are Baked In No Matter When The War Ends Now,https://www.activistpost.com/widespread-rationing-and-global-energy-shortages-are-baked-in-no-matter-when-the-war-ends-now/,Editor,2026-04-13T16:00:00Z,fertilizer exports,It is difficult to believe the pace at which global events are now moving. Apocalyptic threats are being thrown around recklessly and severe damage is being done to the global economic system every single day. A lot of people still seem to think that economic…,Activistpost.com,Global,News,2026-04-16T07:51:24.859007Z
a3bb6a19919ac3356531cfc63b7b400f,What the world needs to know about the real stakes of the energy crisis,https://www.politico.eu/article/what-the-world-needs-to-know-about-the-real-stakes-of-the-energy-crisis/,Charlie Cooper,2026-04-13T15:36:46Z,fertilizer exports,A continent still recovering from one affordability crisis has just been dumped in another — and it could be even worse this time.,POLITICO.eu,Unknown,News,2026-04-16T07:51:24.859048Z
f52d62c5e259c69d35038e5c5a206124,FTAs to aid India’s export growth despite global turmoil: Piyush Goyal,https://www.thehindubusinessline.com/economy/ftas-to-aid-indias-export-growth-despite-global-turmoil-piyush-goyal/article70857626.ece,BL Chennai Bureau,2026-04-13T15:05:49Z,fertilizer exports,"Piyush Goyal highlights India's export growth potential through FTAs despite global challenges, emphasizing a forthcoming US trade deal.",BusinessLine,India,News,2026-04-16T07:51:24.859128Z
050b7a02fd570a8df2d13106757c07fe,FTAs to aid India’s export growth despite global turmoil: Piyush Goyal,https://www.thehindubusinessline.com/news/ftas-to-aid-indias-export-growth-despite-global-turmoil-piyush-goyal/article70857626.ece,BL Chennai Bureau,2026-04-13T14:31:01Z,fertilizer exports,"Piyush Goyal highlights India's export growth potential through FTAs despite global challenges, emphasizing a forthcoming US trade deal.",BusinessLine,India,News,2026-04-16T07:51:24.859143Z
501725470fca88fea3eeacf5dde85dd4,The Strait of Hormuz Crisis Exposes a Fatal Flaw in Economic Thinking,https://oilprice.com/Energy/Energy-General/The-Strait-of-Hormuz-Crisis-Exposes-a-Fatal-Flaw-in-Economic-Thinking.html,Kurt Cobb,2026-04-13T14:00:00Z,fertilizer exports,"A priest, an engineer, and an economist are stranded on a desert island. The first order of business is to get some food. The priest suggests that they all pray. The practical-minded engineer suggests that the three men make a net to catch some fish. But wher…",OilPrice.com,Unknown,News,2026-04-16T07:51:24.859193Z
1b069904acb350fb1f59d7ec6d6ca2e0,"U.S. stocks set to sink, oil prices rise amid Trump's blockade plan",https://www.cbsnews.com/news/oil-prices-stock-market-trump-blockade-strait-of-hormuz-iran/,Aimee  Picchi,2026-04-13T12:44:36Z,fertilizer exports,Global oil prices jumped over $100 a barrel as investors fret over Trump's threat to launch a partial naval blockade of the vital trade route.,CBS News,Global,Market Report,2026-04-16T07:51:24.859221Z
0857f32869c2ab3e456a08702f69b522,'Clock is ticking': Hormuz disruption raises fears of global food crisis,https://www.globalsecurity.org/wmd/library/news/iran/2026/04/iran-260413-unnews02.htm,John Pike,2026-04-13T12:00:00Z,fertilizer exports,The clock is ticking for global food systems as disruptions in the Strait of Hormuz threaten to choke off the flow of fuel and crucial fertilizers needed for the next planting season - also raising the risk of higher food prices and a new wave of inflation.,Globalsecurity.org,Global,Market Report,2026-04-16T07:51:24.859304Z
d7231f3dbc9a1f124451b2e645890a56,Monthly Cotton Economic Newsletter: April 2026,http://wwd.com/sourcing-journal/industry-news/global-cotton-market-update-april-2026-1238907860/,Sarah Jones,2026-04-13T12:00:00Z,fertilizer exports,"Cotton benchmarks moved higher over the past month, but the rate of increase slowed in China.",WWD,China,Market Report,2026-04-16T07:51:24.859316Z
b3308395474a22a26ea05c6f7bbf504e,FAO: Protracted Strait of Hormuz crisis could turn into global agrifood catastrophe,https://www.globalsecurity.org/military/library/news/2026/04/mil-260413-fao01.htm,John Pike,2026-04-13T12:00:00Z,fertilizer exports,Ships carrying critical agricultural inputs must start moving through the Strait of Hormuz as soon as possible to ward off the risks of a dangerous spike in food price inflation later this year that could trigger a cascade of effects similar to the aftermath …,Globalsecurity.org,Global,News,2026-04-16T07:51:24.859364Z
fe531875ee50d9eb3d2dbd882978eab5,Monthly Cotton Economic Newsletter: April 2026,https://wwd.com/sourcing-journal/industry-news/global-cotton-market-update-april-2026-1238907860/,SJ Guest Editorial,2026-04-13T12:00:00Z,fertilizer exports,"Cotton benchmarks moved higher over the past month, but the rate of increase slowed in China.",WWD,China,Market Report,2026-04-16T07:51:24.859374Z
