article_id,title,link,creator,pubdate,category,description,source,country,article_type,scrape_timestamp
a13a7e4fc2c47f0c9f0b8c9c13435247,"Bokaro CCL Coal Siding Violence: Man Killed in Clash, Locals Demand Compensation",https://timesofindia.indiatimes.com/city/ranchi/bokaro-ccl-coal-siding-violence-man-killed-in-clash-locals-demand-compensation/articleshow/130865507.cms,Divy Khare,2026-05-06T17:39:57Z,coal demand,"Tension erupted at a CCL coal siding in Giridih after a 42-year-old man, Dilip Das, died following an alleged clash between CCL employees and coal thieves. Locals protested, demanding compensation and a murder case registration, leading to stone pelting and a…",The Times of India,Unknown,News,2026-05-09T13:22:38.447119Z
9a82bd3b6561f184fb2537c64c8be515,Republicans Want Billion Taxpayer Bucks For Bunker Baby's Ballroom Boondoggle,https://www.wonkette.com/p/republicans-want-billion-taxpayer,Marcie Jones,2026-05-06T16:48:11Z,coal demand,"Please, bunker baby, a billion to quit busting our balls!",Wonkette.com,Unknown,News,2026-05-09T13:22:38.447149Z
06a2560e85f3f3ffbac0a940b7104370,A hard-right Trump ally seeks liftoff in forgotten Britain,https://www.nbcnews.com/world/united-kingdom/hard-right-trump-ally-seeks-liftoff-forgotten-britain-rcna342450,Alexander Smith,2026-05-06T16:44:05Z,coal demand,"TK Trump ally Farage on cusp of smashing Labour in deprived Welsh towns with hard-right, anti-immigration message",NBC News,UK,News,2026-05-09T13:22:38.447177Z
872d4ebd9210861cfe74a4cf06b80b13,Ecora Resources Pivots From Coal to Copper-Led Critical Minerals Royalties at Investor Conference,https://www.marketbeat.com/instant-alerts/ecora-resources-pivots-from-coal-to-copper-led-critical-minerals-royalties-at-investor-conference-2026-05-06/?utm_source=yahoofinance&amp;utm_medium=yahoofinance,MarketBeat,2026-05-06T14:55:17Z,coal demand,Ecora Resources (LON:ECOR) used a presentation at Virtual Investor Conferences’ Precious Metals and Critical Minerals Conference to highlight what it...,MarketBeat,Unknown,News,2026-05-09T13:22:38.447219Z
f63e4aef5af5c2920e8f8182fda53417,Why we need to treat Earth like a spaceship,https://theconversation.com/why-we-need-to-treat-earth-like-a-spaceship-281606,"Chris Rapley, Professor of Climate Science, UCL",2026-05-06T10:36:24Z,coal demand,Climate science is the anti-myth. Researchers have long noted that the human brain struggles with psychologically distant threats.,The Conversation Africa,Unknown,News,2026-05-09T13:22:38.447343Z
bb30a8b012008acb38d2e9fe4a0a6639,Stella-Jones Announces First Quarter Results,https://www.globenewswire.com/news-release/2026/05/06/3288587/0/en/Stella-Jones-Announces-First-Quarter-Results.html,Stella-Jones Inc,2026-05-06T10:00:00Z,coal demand,Strong Utility Products Performance Strong Utility Products Performance,GlobeNewswire,Unknown,News,2026-05-09T13:22:38.447369Z
f7a8e66d4a5ba7958694ca9efbbe5001,Fortis Inc. Releases First Quarter 2026 Results,https://www.globenewswire.com/news-release/2026/05/06/3288595/0/en/Fortis-Inc-Releases-First-Quarter-2026-Results.html,Fortis Inc.,2026-05-06T10:00:00Z,coal demand,"This news release constitutes a ""Designated News Release"" incorporated by reference in the prospectus supplement dated December 9, 2024 to Fortis' short form base shelf prospectus dated December 9, 2024.",GlobeNewswire,Unknown,News,2026-05-09T13:22:38.447411Z
3d54a615ec49e9e1cfccfa92b0052772,How LNG interests are seeking to disrupt global talks on decarbonizing shipping,https://www.nationalobserver.com/2026/05/06/news/lng-lobbying-shipping-decarbonization,Fiona Harvey,2026-05-06T08:51:25Z,coal demand,Observers say that the pressure being placed upon International Maritime Organization negotiations appears to be linked to countries that have invested heavily in gas.,National Observer,Global,News,2026-05-09T13:22:38.447484Z
995a6410cbc5d6071cf8d311b8197713,H3 Energy fires twin-shot at WA gas giant and SA energy elephant,https://www.smh.com.au/business/companies/h3-energy-fires-twin-shot-at-wa-gas-giant-and-sa-energy-elephant-20260506-p5zudu.html,Penny Taylor,2026-05-06T06:06:13Z,coal demand,H3 Energy has raised $3.5M to fast-track its Warro gas redevelopment in WA and prepare the drill for its basin-scale Alinya multi-commodity play in South Australia.,The Sydney Morning Herald,Australia,News,2026-05-09T13:22:38.447502Z
abb1a3723f7f461d721a0c4eb933c9e8,Is Coal India stock headed towards ₹600?,https://www.livemint.com/companies/coal-india-share-price-coal-india-stock-price-coal-india-coal-india-stock-price-target-11777988803337.html,Equitymaster,2026-05-06T02:30:56Z,coal demand,Coal India has always been known for its strong dividend yield. We analyse the prospects of the company in the next few years.,Livemint,India,News,2026-05-09T13:22:38.447523Z
cfe85e3ca35347f1990f7bf4776d1641,From abundance to constraint: How energy policy made us poorer – Richard Prebble,https://www.nzherald.co.nz/business/companies/energy/from-abundance-to-constraint-how-energy-policy-made-us-poorer-richard-prebble/premium/SBJJQLBQGVFL5EUFEEQ5C7M5OA/,Richard Prebble,2026-05-06T02:00:00Z,coal demand,OPINION: Rising demand and dwindling supply leave voters facing an energy choice.,New Zealand Herald,Unknown,Analysis/Opinion,2026-05-09T13:22:38.447557Z
7ea2e6c64c8a055d1a23547acaf744c1,Ferroglobe Reports First Quarter 2026 Financial Results,https://www.globenewswire.com/news-release/2026/05/05/3288352/11914/en/Ferroglobe-Reports-First-Quarter-2026-Financial-Results.html,Ferroglobe PLC,2026-05-05T21:00:00Z,coal demand,Ferroglobe Reports First Quarter 2026 Financial Results...,GlobeNewswire,Unknown,Market Report,2026-05-09T13:22:38.447583Z
7756699fdafe4bdcb29d67632cda75df,Kadant Reports First Quarter 2026 Results,https://www.globenewswire.com/news-release/2026/05/05/3288329/0/en/Kadant-Reports-First-Quarter-2026-Results.html,Kadant Inc,2026-05-05T20:37:00Z,coal demand,"WESTFORD, Mass., May  05, 2026  (GLOBE NEWSWIRE) -- Kadant Inc. (NYSE: KAI) reported its financial results for the first quarter ended April 4, 2026. ...",GlobeNewswire,Unknown,Market Report,2026-05-09T13:22:38.447612Z
1ff2a4a821914ece8b41eadf457e7717,Centrus Reports First Quarter 2026 Results,https://www.prnewswire.com/news-releases/centrus-reports-first-quarter-2026-results-302763250.html,,2026-05-05T20:35:00Z,coal demand,"Revenue of $76.7 million, compared to revenue of $73.1 million in Q1 2025 GAAP net income of $10.0 million compared to GAAP net income of $27.2 million in Q1 2025 Non-GAAP adjusted net income (1) of $23.5 million, compared to non-GAAP adjusted net income(1) o…",PRNewswire,Unknown,Market Report,2026-05-09T13:22:38.447656Z
b5b34e1e0473f4d2bbeb79627ba98a38,Ameren Announces First Quarter 2026 Results,https://www.prnewswire.com/news-releases/ameren-announces-first-quarter-2026-results-302763238.html,,2026-05-05T20:30:00Z,coal demand,"First Quarter Diluted Earnings Per Share (EPS) were $1.28 in 2026 vs. $1.07 in 2025 Reaffirmed 2026 Earnings Guidance Range of $5.25 to $5.45 per Diluted Share ST. LOUIS, May 5, 2026 /PRNewswire/ -- Ameren Corporation (NYSE: AEE) today announced first quarter…",PRNewswire,Unknown,News,2026-05-09T13:22:38.447699Z
98ea51cb82dd032007d1799e3cd3f6a6,NACCO INDUSTRIES ANNOUNCES FIRST QUARTER 2026 RESULTS,https://www.prnewswire.com/news-releases/nacco-industries-announces-first-quarter-2026-results-302763240.html,,2026-05-05T20:29:00Z,coal demand,"CLEVELAND, May 5, 2026 /PRNewswire/ -- Consolidated Q1 2026 Highlights: Gross profit of $14.3 million improved 48% over Q1 2025 on 4% revenue decrease Operating profit of $11.0 million up 43% over Q1 2025 and 45% sequentially Net income of $8.8 million increa…",PRNewswire,Unknown,News,2026-05-09T13:22:38.447742Z
e204ae01f4d0840fefaf40c5921cd24c,Middle East Crisis Shows Oil and Gas Remain Irreplaceable,https://www.globalresearch.ca/middle-east-crisis-oil-gas-remain-irreplaceable/5925115,Ahmed Adel,2026-05-05T20:03:54Z,coal demand,"The crisis in the Middle East has clearly shown that fossil fuels remain irreplaceable energy sources on which global economic growth depends, and will certainly remain so for a long time to come. Despite efforts to replace them with renewable …
The post Midd…",Globalresearch.ca,Global,News,2026-05-09T13:22:38.447789Z
ff2d8ae22e6ae487a7fb75172c157ce4,Forget Expensive Carbon Capture—Renewables Are the Cheaper Climate Fix,https://gizmodo.com/forget-expensive-carbon-capture-renewables-are-the-cheaper-climate-fix-2000754604,Ellyn Lapointe,2026-05-05T19:35:42Z,coal demand,"When it comes to reducing atmospheric carbon, new research shows that renewable energy is a more cost-effective investment than direct air capture.",Gizmodo.com,Unknown,News,2026-05-09T13:22:38.447827Z
cad1b7ea67d6ca3bb66dbed1047f7b2a,Dario Amodei spent last year warning of an AI white-collar bloodbath. Now he’s changing the narrative,https://fortune.com/2026/05/05/dario-amodei-jevons-paradox-will-ai-wipe-out-white-collar-jobs/,Nick Lichtenberg,2026-05-05T18:55:40Z,coal demand,The Anthropic CEO is sounding more open to the idea that Jevons Paradox—new technology creating more demand and more jobs—is possible with AI.,Fortune,Unknown,News,2026-05-09T13:22:38.447869Z
801bbfb724ea68bd3469983fcd9420d5,polar-high added to PyPI,https://pypi.org/project/polar-high/,juha.kiviluoma@nodal-tools.fi,2026-05-05T17:44:00Z,coal demand,"Python library for building indexed linear and mixed-integer programs in polars; assembles into HiGHS, exportable as MPS.",Pypi.org,Unknown,Market Report,2026-05-09T13:22:38.447894Z
078a060014c50b09a5b4f1d719199471,Philip R. Lane: Climate change and monetary policy,https://www.ecb.europa.eu//press/key/date/2026/html/ecb.sp260505_1~2e47b4c747.en.html,European Central Bank,2026-05-05T15:40:00Z,coal demand,The European Central Bank (ECB) is the central bank of the European Union countries which have adopted the euro. Our main task is to maintain price stability in the euro area and so preserve the purchasing power of the single currency.,Europa.eu,Unknown,News,2026-05-09T13:22:38.447951Z
4698134c5c4a6217297f6ca9a7ab4cce,Old School RuneScape coal has outperformed one of the world's most popular cryptocurrencies,https://www.eurogamer.net/old-school-runescape-coal-ethereum,Connor Makar,2026-05-05T15:12:34Z,coal demand,"Ethereum, one of the world's most popular cryptocurrencies, has been outperformed in terms of yearly growth by OldSchool RuneScape coal. Read more",Eurogamer.net,Unknown,News,2026-05-09T13:22:38.448014Z
aaee19123ec572d8b569683b5bfbe152,Here's why some cities are banning fossil fuel and meat ads,https://www.dw.com/en/heres-why-some-cities-are-banning-fossil-fuel-and-meat-ads/a-77054187,Josh Axelrod,2026-05-05T15:09:00Z,coal demand,"Cities from Amsterdam to Sydney are banning fossil fuel advertisements, drawing from tactics once used to curb smoking. They're targeting the messaging that has normalized carbon-intensive lifestyles for decades.",DW (English),Unknown,News,2026-05-09T13:22:38.448050Z
14123967ebd715f7f5e3a6c8d6c129bb,Here's why Amsterdam banned fossil fuel and meat advertising,https://www.dw.com/en/heres-why-amsterdam-banned-fossil-fuel-and-meat-advertising/a-77054187,Josh Axelrod,2026-05-05T15:09:00Z,coal demand,"Cities from Amsterdam to Sydney are banning fossil fuel advertisements, drawing from tactics once used to curb smoking. They're targeting the messaging that has normalized carbon-intensive lifestyles for decades. Each day, Reint Jan Renes commutes from Amster…",DW (English),Unknown,News,2026-05-09T13:22:38.448098Z
b973b843ad4a704ac199f87c506f7a50,Why is Amsterdam banning ads for meat?,https://www.dw.com/en/why-is-amsterdam-banning-ads-for-meat/a-77054187,Josh Axelrod,2026-05-05T15:09:00Z,coal demand,"Cities from Amsterdam to Sydney are banning fossil fuel and meat advertisements, drawing from tactics once used to curb smoking. They're targeting the messaging that has normalized high-carbon lifestyles for decades. Each day, Reint Jan Renes commutes from th…",DW (English),Unknown,News,2026-05-09T13:22:38.448143Z
8697184a7d06122dfacb171d2004d4ba,Enverus and Xpansiv broaden partnership to deliver a unified price discovery platform across energy and environmental markets through MarketView®,https://www.prnewswire.com/news-releases/enverus-and-xpansiv-broaden-partnership-to-deliver-a-unified-price-discovery-platform-across-energy-and-environmental-markets-through-marketview-302762484.html,,2026-05-05T14:35:00Z,coal demand,"MarketView integrates verified spot exchange and OTC broker pricing with full-spectrum energy markets, giving trading and risk teams a single, authoritative view of price formation across environmental and energy commodities NEW YORK and AUSTIN, Texas, May 5,…",PRNewswire,Unknown,Analysis/Opinion,2026-05-09T13:22:38.448191Z
9b1f7eeb782f7d6b6150f5093a4fe1fc,"Sustained reforms will help India maintain growth momentum, says ADB’s Albert Park",https://economictimes.indiatimes.com/news/economy/indicators/sustained-reforms-will-help-india-maintain-growth-momentum-says-adbs-albert-park/articleshow/130830752.cms,Deepshikha Sikarwar,2026-05-05T13:41:37Z,coal demand,"India's economy shows strong growth prospects despite global challenges. The Asian Development Bank highlights the need for continued reforms to enhance business and trade. Inflation remains a key concern, potentially impacting interest rate decisions. Strate…",The Times of India,India,News,2026-05-09T13:22:38.448218Z
0251c28dd59d836dd0ed5e428cfcac41,"Coal India, CESC and other power stocks: JM Financial analyst explains impact of Bengal elections",https://economictimes.indiatimes.com/markets/stocks/news/coal-india-cesc-and-other-power-stocks-jm-financial-analyst-explains-impact-of-bengal-elections/articleshow/130821424.cms,Nikhil Agarwal,2026-05-05T08:10:54Z,coal demand,"JM Financial views the West Bengal election outcome as a potential boost for power sector governance, driven by expectations of reform under a BJP-led government. While this could create headwinds for CESC, it may benefit Coal India and other central utilities",The Times of India,India,Analysis/Opinion,2026-05-09T13:22:38.448255Z
4e62121d203005c1964b9b0540471327,"Pentachlorophenol Market to Cross $133 Million by 2031 Driven by Rising Infrastructure Investments in Asia-Pacific, Reports Mordor Intelligence",https://www.globenewswire.com/news-release/2026/05/05/3287378/0/en/Pentachlorophenol-Market-to-Cross-133-Million-by-2031-Driven-by-Rising-Infrastructure-Investments-in-Asia-Pacific-Reports-Mordor-Intelligence.html,Mordor Intelligence Private Limited,2026-05-05T07:29:00Z,coal demand,"The pentachlorophenol market is being shaped by rising infrastructure development in emerging economies, continued demand from industrial chemical applications, and the gradual shift from traditional preservatives. Its use remains relevant in engineered wood …",GlobeNewswire,Unknown,Market Report,2026-05-09T13:22:38.448305Z
33257d4259c6f1a0fd12906eabca8f48,The Rise and Fall of OPEC,https://everything-everywhere.com/the-rise-and-fall-of-opec/,Gary Arndt,2026-05-05T05:53:43Z,coal demand,"Podcast Transcript In 1960, a handful of oil-producing nations made a decision that would reshape the global economy.  They formed a cartel to control the world’s most vital resource, challenging powerful corporations and altering the balance of global power.…",Everything-everywhere.com,Global,News,2026-05-09T13:22:38.448350Z
c81af3f299e24fbceb31fd963a5f8e84,NTPC peer IPO coming soon? BJP win in Bengal raises hopes of Damodar Valley listing,https://economictimes.indiatimes.com/markets/ipos/fpos/ntpc-peer-ipo-coming-soon-bjp-win-in-bengal-raises-hopes-of-damodar-valley-listing/articleshow/130816727.cms,Nikhil Agarwal,2026-05-05T05:04:38Z,coal demand,Damodar Valley Corporation's stock market debut is now more likely. The Bharatiya Janata Party's win in West Bengal has removed a key political obstacle. This development is expected to speed up the initial public offering process. DVC operates in power gener…,The Times of India,Unknown,Market Report,2026-05-09T13:22:38.448393Z
86a189b024c2af7703ccf9d1dd20d3d0,"UAE’s OPEC Exit: Pragmatic Oil Policy, Not ‘Stranded Assets’ Panic",https://wattsupwiththat.com/2026/05/04/uaes-opec-exit-pragmatic-oil-policy-not-stranded-assets-panic/,Guest Blogger,2026-05-05T05:00:00Z,coal demand,"The UAE’s departure, the largest and most consequential since the cartel’s founding, weakens OPEC+ materially and reputationally, but it does so because of internal rifts, US supply abundance and regional conflict — not because Abu Dhabi’s planners have swall…",Wattsupwiththat.com,Unknown,News,2026-05-09T13:22:38.448446Z
6291dbc9dff106e35a3eb25a3532e2aa,"L&T bags 'large' BCGCL order for coal-to-chemicals plant in Odisha, 2,000 TPD capacity",https://economictimes.indiatimes.com/industry/indl-goods/svs/metals-mining/lt-bags-large-bcgcl-order-for-coal-to-chemicals-plant-in-odisha-2000-tpd-capacity/articleshow/130816313.cms,ET Online,2026-05-05T04:43:08Z,coal demand,"Larsen & Toubro has secured a landmark deal to develop a state-of-the-art coal-to-ammonium nitrate facility in Odisha, poised to deliver 2,000 tonnes of ammonium nitrate daily. This venture not only bolsters India's aspirations for enhanced coal gasification …",The Times of India,India,Market Report,2026-05-09T13:22:38.448470Z
e91ce9898e562f71e17be258bb2753f5,Petronet LNG sees no clarity on Qatar supply for June,https://www.bloomberg.com/news/articles/2026-05-04/india-s-petronet-lng-sees-no-clarity-on-qatar-supply-for-june,Bloomberg,2026-05-05T04:16:04Z,coal demand,"India’s largest LNG buyer hasn’t received shipments from Qatar since the Iran war disrupted flows through the Strait of Hormuz, which handled about 60% of India’s LNG flows",Bloomberg,India,News,2026-05-09T13:22:38.448491Z
385ca2e95b19c3dca5be6392931b4317,Iran Shock Boosts South Korea’s Push to Cut Fossil Fuel Imports,https://financialpost.com/pmn/business-pmn/iran-shock-boosts-south-koreas-push-to-cut-fossil-fuel-imports,Bloomberg News,2026-05-04T21:10:06Z,coal demand,"The Iran-driven energy shock is adding urgency to South Korea’s push to cut its reliance on imported fossil fuels, giving President Lee Jae Myung momentum to push his clean-energy agenda.",Financial Post,South Korea,News,2026-05-09T13:22:38.448522Z
1683d48e558dba843f42b56f4a2abec2,Coder Displaced By A.I. Told He Should Just 'Learn To Mine Coal',https://babylonbee.com/news/coder-displaced-by-ai-told-he-should-just-learn-to-mine-coal,Babylon Bee,2026-05-04T20:24:53Z,coal demand,"PORTLAND, OR — After losing his coding job to artificial intelligence, local man Roger Garrison was told by political pundits that he should instead learn to mine coal.",Babylonbee.com,Unknown,News,2026-05-09T13:22:38.448561Z
2338641eee21d5ff877ca774b34a3b73,BofA throws cold water on AI apocalypse panic: 60% of today’s jobs didn’t exist in 1940,https://fortune.com/2026/05/04/ai-job-apocalypse-bank-of-america-60-percent-jobs-didnt-exist-1940/,Nick Lichtenberg,2026-05-04T17:09:16Z,coal demand,"AI will reshape 840 million jobs, BofA says. That's not the same as destroying them.",Fortune,Unknown,News,2026-05-09T13:22:38.448621Z
2bf51b439d40efb7d062ac956d81a8e5,Direct air capture has substantial health and climate opportunity costs,https://www.nature.com/articles/s44458-026-00068-0,Yannai Kashtan,2026-05-04T16:08:03Z,coal demand,"Renewable energy remains more cost effective for climate and health outcomes than direct air capture except under highly optimistic technology improvements, according to cost equivalent modeling across twenty two United States grid regions",Nature.com,Brazil,News,2026-05-09T13:22:38.448640Z
ea2ca45032a3a21c75e8845b253be2b9,"To save Xbox, Asha Sharma doesn't have to defeat PlayStation or Steam — she has to defeat Microsoft itself.",https://www.windowscentral.com/gaming/xbox/to-save-xbox-asha-sharma-doesnt-have-to-defeat-playstation-or-steam-she-has-to-defeat-microsoft-itself,"jez@windowscentral.com (Jez Corden) , Jez Corden",2026-05-04T15:34:54Z,coal demand,"Xbox’s future hinges on Asha Sharma, whose biggest challenge isn’t PlayStation or Steam, but transforming Microsoft’s own culture to save the brand.",Windows Central,Unknown,News,2026-05-09T13:22:38.448686Z
197b00d5f44a04db9681d4987497f9e8,Coal distributions for non-electric power use decline in the South,https://www.eia.gov/todayinenergy/detail.php?id=67644,,2026-05-04T13:07:57Z,coal demand,"The volume of coal delivered in the United States for uses other than power generation—primarily, for manufacturing—decreased by about half in the last 15 years. Coal delivered for these purposes in the South decreased the most in percentage terms between 201…",Eia.gov,USA,News,2026-05-09T13:22:38.448712Z
77ef232250e883972f8857af45745eac,"Sensex today | Stock Market Highlights: Benchmark indices close firmer; Sensex settles 355 points higher at 77,269, Nifty up 121 points at 24,119",https://www.thehindubusinessline.com/markets/sensex-nifty50-today-stock-market-highlights-4th-may-2026/article70934863.ece,"Team BL, KS Badri Narayanan",2026-05-04T10:47:21Z,coal demand,"Sensex, Nifty, Share Prices Updates: Sensex settles 355.90 points or 0.46 per cent positive at 77,269.40, and Nifty 50 rises by 121.75 points or 0.51 per cent to 24,119.30",BusinessLine,Unknown,Market Report,2026-05-09T13:22:38.448744Z
8f107db41d1d7de2864e719c753d24a5,Opec's loss may be India’s gain: How the UAE's exit from the cartel could ease our oil import bills,https://www.livemint.com/opinion/online-views/opec-india-uae-exit-cartel-oil-import-bills-organization-of-the-petroleum-exporting-countries-hormuz-fujairah-11777812120072.html,Narayan Ramachandran,2026-05-04T10:30:22Z,coal demand,The United Arab Emirates' exit from Organization of the Petroleum Exporting Countries could mean it gets to raise oil production and pump more of it through its Fujairah pipeline that bypasses Hormuz. Both could serve India’s energy interests.,Livemint,India,Market Report,2026-05-09T13:22:38.448769Z
df464a6e3cc7f80958b06c1c5f361927,Select Select Weekly Climate and Energy News Roundup #689,https://wattsupwiththat.com/2026/05/04/select-select-weekly-climate-and-energy-news-roundup-689/,Guest Blogger,2026-05-04T09:00:00Z,coal demand,"Quote of the Week: “If everyone is thinking alike, then no one is thinking.” — Benjamin Franklin
The post Select Select Weekly Climate and Energy News Roundup #689 appeared first on Watts Up With That?.",Wattsupwiththat.com,Unknown,Market Report,2026-05-09T13:22:38.448827Z
6b1021901d968260afe986472a09e2d5,India is burning more coal as extreme heat and the Iran war squeeze energy supplies,https://www.cnbc.com/2026/05/04/india-coal-power-heatwave-lng-supply-demand-prices-generation.html,Priyanka Salve,2026-05-04T06:26:02Z,coal demand,"India, the world's third-largest emitter of carbon dioxide, is burning more coal as demand for power rises, most of which is coal-fired.",CNBC,India,News,2026-05-09T13:22:38.448845Z
aef68a4cb898df9d61dd4c5a01b6d96d,Big Tech Funds Space Solar and Fusion but Relies on Natural Gas for AI Data Centers,https://www.naturalnews.com/2026-05-04-big-tech-funds-space-solar-and-fusion.html,Edison Reed,2026-05-04T06:00:00Z,coal demand,"Meta signed a deal with startup Overview Energy to develop up to 1 gigawatt of space-based solar power, according to a report by Haley Zaremba on OilPrice.com. A pilot satellite is not expected to launch before 2028, and commercial viability remains years awa…",Naturalnews.com,Unknown,Analysis/Opinion,2026-05-09T13:22:38.448885Z
7ca8448f5a87c5126ba45838dea0086e,Indonesia's March trade surplus expands to $3.32 billion,https://www.channelnewsasia.com/business/indonesias-march-trade-surplus-expands-332-billion-6098021,,2026-05-04T05:26:23Z,coal demand,"JAKARTA, May 4 : Indonesia's trade surplus expanded in March to $3.32 billion, the largest since September, official data showed on Monday, even as exports fell in annual terms.The March surplus was larger than both the median forecast of a $2.41 billion surp…",CNA,Indonesia,Analysis/Opinion,2026-05-09T13:22:38.448914Z
4ddac1cc98785810910e782567a4a69b,Germany’s second Stalingrad,https://www.americanthinker.com/blog/2026/05/germany_s_second_stalingrad.html,,2026-05-04T04:00:00Z,coal demand,"The question remaining is whether Germany will allow itself to be encircled and destroyed as it was at Stalingrad, or will it break out of its current mindset and forge a new path forward?",Americanthinker.com,Germany,News,2026-05-09T13:22:38.448949Z
d6f6dbd6637b4d52c6bf8a2ab33b4fe0,Economic Digest: Nepal’s Business News in a Snap,https://english.khabarhub.com/2026/04/547031/,Khabarhub,2026-05-04T02:15:54Z,coal demand,"KATHMANDU: Economic Digest offers a concise yet comprehensive overview of significant business happenings in Nepal, presented in easily digestible summaries. Recent developments across Nepal’s economy and governance landscape reflect a period of assertive pol…",Khabarhub.com,Unknown,Analysis/Opinion,2026-05-09T13:22:38.448989Z
059ece0e2b1d29ef8659b8b5bfd39331,"Husk targeting 1GW renewable rollout in Nigeria, says CEO",https://punchng.com/husk-targeting-1gw-renewable-rollout-in-nigeria-says-ceo/,Punch Newspapers,2026-05-04T00:56:28Z,coal demand,"Husk Power CEO Manoj Sinha discusses a 1GW renewable rollout in Nigeria, using mini-grids to cut energy costs and boost rural economic activity.

Read More: https://punchng.com/husk-targeting-1gw-renewable-rollout-in-nigeria-says-ceo/",The Punch,Unknown,News,2026-05-09T13:22:38.449026Z
