article_id,title,link,creator,pubdate,category,description,source,country,article_type,scrape_timestamp
745471c2701d47d4111b69d7a7acbb26,Take This Data Center and Shove It,http://prospect.org/2026/06/02/jun-2026-take-this-data-center-and-shove-it/,Gabrielle Gurley,2026-06-02T09:15:00Z,coal demand,"Americans ain’t puttin’ up with these things no more. Welcome to Virginia, ground zero for data center defiance.
The post Take This Data Center and Shove It appeared first on The American Prospect.",The American Prospect,USA,News,2026-06-07T13:57:43.447965Z
aa28a62e4fd4da12d01b9d63b184dd6c,INEOS Expands LNG Business Into Asia With Marubeni Supply Deal,https://finance.yahoo.com/sectors/energy/articles/ineos-expands-lng-business-asia-084223544.html,Charles Kennedy,2026-06-02T08:42:23Z,coal demand,"INEOS Energy has signed its first LNG supply agreement targeting Asian markets, expanding its global gas trading footprint.",Yahoo Entertainment,Global,Market Report,2026-06-07T13:57:43.447995Z
a54881a366970c546e8d689b4e123310,China’s LNG Imports Recover Ahead of Peak Cooling Season,https://oilprice.com/Latest-Energy-News/World-News/Chinas-LNG-Imports-Recover-Ahead-of-Peak-Cooling-Season.html,Irina Slav,2026-06-02T08:30:00Z,coal demand,"China imported 4.9 million tons of liquefied natural gas last month, a slight increase on an annual basis, Bloomberg reported today, citing shipping data. The rebound comes ahead of a likely jump in electricity demand over the summer as air-conditioning deman…",OilPrice.com,China,Market Report,2026-06-07T13:57:43.448013Z
7fa0e617a9c55a34201da7e7dea168fd,"Nifty at 25,900 by March 2027? Nomura cites key catalysts to watch out for",https://economictimes.indiatimes.com/markets/stocks/news/nifty-at-25900-by-march-2027-nomura-cites-key-catalysts-to-watch-out-for/articleshow/131458472.cms,Debaroti Adhikary,2026-06-02T07:39:43Z,coal demand,"Indian stocks have seen a sharp fall. Nomura predicts the Nifty will climb almost 11% to reach 25,900 by March 2027. This optimism stems from hopes of a West Asia conflict resolution and a strong AI theme. Despite recent selling by foreign investors, Indian e…",The Times of India,India,News,2026-06-07T13:57:43.448040Z
86d75867450b2a8ceb875478a7938e68,TMK strengthens commercial muscle as Mongolian gas play matures,https://www.smh.com.au/business/companies/tmk-strengthens-commercial-muscle-as-mongolian-gas-play-matures-20260602-p60383.html,Penny Taylor,2026-06-02T05:52:49Z,coal demand,TMK Energy has appointed Origin and Santos gas veteran Danny Chong as production manager as its Mongolian gas play matures.,The Sydney Morning Herald,Unknown,News,2026-06-07T13:57:43.448074Z
776ed2d92e5773d523d3c2aaba6ff666,LNG Deliveries to China Rebound in May,https://www.rigzone.com/news/wire/lng_deliveries_to_china_rebound_in_may-02-jun-2026-183825-article/,Sing Yee Ong & Stephen Stapczynski,2026-06-02T05:01:58Z,coal demand,"The world's largest LNG buyer stepped up purchases ahead of peak summer demand, reversing a months-long decline following disruptions to Middle East supplies.",Rigzone,China,News,2026-06-07T13:57:43.448089Z
e877e0598c4c103e6ed39ecef23031ef,New hydrogen breakthrough turns waste heat into clean fuel,https://www.sciencedaily.com/releases/2026/06/260601025345.htm,,2026-06-02T04:47:07Z,coal demand,A breakthrough hydrogen-production method could make clean fuel far cheaper and easier to generate. Researchers at the University of Birmingham developed a perovskite-based catalyst that splits water into hydrogen at much lower temperatures than existing tech…,Science Daily,Unknown,News,2026-06-07T13:57:43.448139Z
3f7f2f4704383c1c09574fac0043fc2f,From Zanzibar to St. Petersburg: The 130-year history of Russia-Tanzania ties,https://www.rt.com/africa/640922-history-of-russia-tanzania-relations/,RT,2026-06-04T12:27:52Z,grain exports,Relations between the two states date back far beyond Soviet times Read Full Article at RT.com,RT,Russia,News,2026-06-07T13:57:43.826611Z
e3a0e51145443e9f25e6cfe580b2c19e,Russia Tightens Hold on African Wheat Market as Ukraine Opens Rival Agrohub in Ghana,https://www.shtfplan.com/headline-news/russia-tightens-hold-on-african-wheat-market-as-ukraine-opens-rival-agrohub-in-ghana,Willow Tohi,2026-06-03T17:30:46Z,grain exports,"Russian wheat exports to Kenya rose 10% year-on-year, reaching 1.4 million tons by late May 2026",Shtfplan.com,Russia,Market Report,2026-06-07T13:57:43.826644Z
2f931eb76fd67ce78cb0eb98d0175880,America Enabled the Gulf’s African Adventurism,http://foreignpolicy.com/2026/06/03/america-africa-adventurism-emirates-qatar/,Zuri Linetsky and Michael Woldemariam,2026-06-03T14:57:11Z,grain exports,Why Washington let its Middle Eastern partners wreak havoc in Africa,Foreign Policy,USA,News,2026-06-07T13:57:43.826672Z
ec13d1e6b771c474ed84e4dbea245a93,Wall Street is beginning to think that Trump can’t reopen the Strait of Hormuz,https://fortune.com/2026/06/03/wall-street-is-beginning-to-think-that-trump-cant-reopen-the-strait-of-hormuz/,Jim Edwards,2026-06-03T10:53:20Z,grain exports,Everything you need to know before you reach the office this morning.,Fortune,Unknown,News,2026-06-07T13:57:43.826709Z
65c7b3cbfc17e37a2dfa5b9b57ecd2eb,Russia tightens hold on African wheat market as Ukraine opens rival agrohub in Ghana,https://www.naturalnews.com/2026-06-03-russia-tightens-hold-on-african-wheat-market.html,Willow Tohi,2026-06-03T06:00:00Z,grain exports,"Russian wheat exports to Kenya rose 10% year-on-year, reaching 1.4 million tons by late May 2026 Russia now controls 40% of Africa’s wheat import market, with exports to Sudan surging 143% Ukraine opened its first agricultural processing hub in Ghana on April…",Naturalnews.com,Russia,Market Report,2026-06-07T13:57:43.826936Z
d066eecaecab2255bb5be6fea10c08d5,"Gold, Silver Rate Today Live Updates: International gold prices edge down on renewed US-Iran tensions",https://timesofindia.indiatimes.com/business/india-business/gold-silver-rate-today-live-updates-18k-22-carat-24k-gold-price-10g-silver-cost-per-kg-mcx-comex-etf-stock-precious-metal-gold-prediction-city-wise-cost-latest-gold-news/liveblog/131474346.cms,The Times Of India,2026-06-03T02:30:57Z,grain exports,"Gold, Silver Rate Today Live Updates: International and domestic gold prices are seeing a volatile period as global geopolitical tensions and elevate",The Times of India,Global,Market Report,2026-06-07T13:57:43.826974Z
b6938964d1b59c43f2ddd7187571253a,Gold eases on stronger oil as fresh Mideast hostilities erupt,https://economictimes.indiatimes.com/markets/commodities/news/gold-eases-on-stronger-oil-as-fresh-mideast-hostilities-erupt/articleshow/131473989.cms,Reuters,2026-06-03T01:52:03Z,grain exports,"Gold prices dipped on Wednesday as escalating Middle East tensions fueled crude oil gains, intensifying inflation and interest rate hike concerns. Renewed Gulf hostilities and stalled diplomacy between Washington and Tehran contributed to the market's unease.…",The Times of India,Unknown,Market Report,2026-06-07T13:57:43.827022Z
b9f46a6e0c631b47a0b9fe3fe4c1f2a7,"Corn Starting Tuesday with Modest Weakness, Despite Lower Crop Ratings",https://www.barchart.com/story/news/2256887/corn-starting-tuesday-with-modest-weakness-despite-lower-crop-ratings,Austin Schroeder,2026-06-02T12:22:25Z,grain exports,"Corn price action is fractionally to 2 cents lower so far on Tuesday morning. Futures posted losses of 2 to 3 cents in the front months, with a few deferred ...",Barchart.com,Unknown,News,2026-06-07T13:57:43.827060Z
c804e4dfd333998027cd51b673315fdf,Farm profits to dive by 70 per cent as drought and costs bite,https://www.abc.net.au/news/2026-06-02/crop-production-down-as-farm-profits-take-a-big-hit/106745960,"David Claughton, Michael Condon, and Mark Bennett",2026-06-02T01:55:58Z,grain exports,"The ABARES report for the June quarter predicts national crop production will fall by more than 20 per cent, with profits down 70 per cent for broadacre farms.",ABC News (AU),Unknown,Market Report,2026-06-07T13:57:43.827094Z
a0752fbd228dfd3b71a3824a7af2364d,"Corn Pulls off Lows into the Monday Close, with Ratings Below Estimates",https://www.barchart.com/story/news/2245360/corn-pulls-off-lows-into-the-monday-close-with-ratings-below-estimates,Austin Schroeder,2026-06-01T22:24:02Z,grain exports,"Corn futures posted losses of 2 to 3 cents in the front months, with a few deferred contracts fractionally to 1 ½ cents higher. The CmdtyView national...",Barchart.com,Unknown,Analysis/Opinion,2026-06-07T13:57:43.827125Z
06a575292c5596f3a24817a94b073d1c,"How a 97-year-old letter found in a London, Ont., home reached its author's family",https://www.cbc.ca/news/canada/london/how-a-97-year-old-letter-found-in-a-london-ont-home-reached-its-author-s-family-9.7216039,,2026-05-31T09:00:00Z,grain exports,"A London, Ont., woman shares the journey of returning an old letter she found in her house through the help of social media and a local genealogist. CBC News spoke to her and the author's descendants to learn how this mystery was solved.",CBC News,UK,News,2026-06-07T13:57:43.827167Z
056cb03f0da2071df51c54cbab623722,South America to ramp up India outreach despite geography,https://economictimes.indiatimes.com/news/economy/foreign-trade/south-america-to-ramp-up-india-outreach-despite-geography/articleshow/131546582.cms,Dipanjan Roy Chaudhury,2026-06-06T07:23:02Z,soybean exports,"In an era of growing diplomatic relations, South American countries are increasingly turning to India, with Argentina leading the charge by acknowledging the strategic and economic partnerships at play. As India's sixth largest trading ally, Argentina plays a…",The Times of India,India,Market Report,2026-06-07T13:57:44.032725Z
1634bc8142f47807f1340b712fd14577,Livestock industry demands 1.5 million tonnes soymeal imports amid price surge,https://economictimes.indiatimes.com/news/economy/foreign-trade/livestock-industry-demands-1-5-million-tonnes-soymeal-imports-amid-price-surge/articleshow/131515791.cms,Jayashree Bhosale,2026-06-04T18:59:50Z,soybean exports,India's livestock sector faces rising feed costs. Farmers are urging the government to permit soybean meal imports. Domestic prices have surged significantly. This increase impacts poultry farmers and squeezes profit margins. The soybean processing industry o…,The Times of India,India,Market Report,2026-06-07T13:57:44.032784Z
304392d44d896ab1c813dd4fea334364,"Soybeans Falling on Thursday, with Products Adding Some Weight",https://www.barchart.com/story/news/2309552/soybeans-falling-on-thursday-with-products-adding-some-weight,Austin Schroeder,2026-06-04T17:25:13Z,soybean exports,Soybeans are trading with 29 to 31 cents losses so far on Thursday. The cmdtyView national average Cash Bean price is down 30 1/4 cents at $10.64 1/4...,Barchart.com,Unknown,Analysis/Opinion,2026-06-07T13:57:44.032816Z
a14478e0a202d85b6285cac74e721ad6,Services PMI® at 54.5%; May 2026 ISM® Services PMI® Report,https://www.prnewswire.com/news-releases/services-pmi-at-54-5-may-2026-ism-services-pmi-report-302789082.html,,2026-06-03T14:00:00Z,soybean exports,"Business Activity Index at 57.7%; New Orders Index at 57.3%; Employment Index at 47.9%; Supplier Deliveries Index at 55.2% TEMPE, Ariz., June 3, 2026 /PRNewswire/ -- Economic activity in the services sector continued to expand in May, say the nation's purchas…",PRNewswire,Unknown,Market Report,2026-06-07T13:57:44.032864Z
186a7d0f4ec5e069b036c5d97e556895,‘Radical and destructive policy agenda’: Iowa’s primary picks point ways to US midterms,https://www.irishtimes.com/world/us/2026/06/03/radical-and-destructive-policy-agenda-iowas-primary-picks-point-ways-to-us-midterms/,Keith Duggan,2026-06-03T06:44:38Z,soybean exports,"On a night when six states held primary elections, Iowa set the stage for a fascinating campaign ahead",The Irish Times,Unknown,News,2026-06-07T13:57:44.032905Z
5058b90a2c3b829bc81af8e03235a55e,Manufacturing PMI® at 54%; May 2026 ISM® Manufacturing PMI® Report,https://www.prnewswire.com/news-releases/manufacturing-pmi-at-54-may-2026-ism-manufacturing-pmi-report-302786165.html,,2026-06-01T14:00:00Z,soybean exports,"New Orders Growing; Production Growing; Employment Contracting; Supplier Deliveries Slowing; Raw Materials Inventories Contracting; Customers' Inventories Too Low; Prices Increasing; Imports Growing; Exports Growing TEMPE, Ariz., June 1, 2026 /PRNewswire/ -- …",PRNewswire,Unknown,Market Report,2026-06-07T13:57:44.032954Z
4fdfb94fb747c64ec02fe1ad89c16872,Farmer Frustrations With Trump Spell Trouble for Iowa Republicans,https://finance.yahoo.com/economy/policy/articles/farmer-frustrations-trump-spell-trouble-104504876.html,Catherine Lucey and Skylar Woodhouse,2026-06-01T10:45:04Z,soybean exports,"(Bloomberg) -- After years in the political wilderness, Iowa Democrats are feeling a new sensation — hope.Most Read from BloombergUS Says Deals With Iran for...",Yahoo Entertainment,Unknown,News,2026-06-07T13:57:44.032995Z
7491a50ffba8c01c5fc855cd65ab473a,India-US trade negotiators to begin four-day talks on June 1,https://economictimes.indiatimes.com/news/economy/foreign-trade/india-us-trade-negotiators-to-begin-four-day-talks-on-june-1/articleshow/131421376.cms,ET Online,2026-05-31T09:56:27Z,soybean exports,India and the US are holding crucial trade talks in New Delhi. Chief negotiators will finalize details of an interim trade agreement. This pact aims to boost market access and facilitate trade. Both nations are committed to strengthening economic ties. The di…,The Times of India,India,Market Report,2026-06-07T13:57:44.033017Z
29de3a6fe7526f095850b13eed445da6,Should you move to Argentina? (from my email),https://marginalrevolution.com/marginalrevolution/2026/06/should-you-move-to-argentina-from-my-email.html,Tyler Cowen,2026-06-06T04:45:01Z,wheat exports,"My name is Josh Neuman, and I’m writing from Buenos Aires, Argentina where Peter Thiel’s move is all over the news here. He lives in [redacted], only a xx minute drive from my own apartment in Recoleta. I want to pitch a piece…arguing that Thiel is right to b…",Marginalrevolution.com,Unknown,News,2026-06-07T13:57:44.244886Z
ba76e589dfe92bbda80c4f3e4e334e35,Economic Digest: A Snapshot of Nepal’s Business News,https://english.khabarhub.com/2026/06/552560/,Khabarhub,2026-06-06T02:15:33Z,wheat exports,"KATHMANDU: Economic Digest presents a brief yet comprehensive roundup of major business developments in Nepal, delivered in clear and accessible summaries. KATHMANDU: The day’s economic developments reflect mixed signals across financial markets, trade, and m…",Khabarhub.com,Unknown,Market Report,2026-06-07T13:57:44.244956Z
c644c75f3b1127b31fd40eb8953556db,An Anarchist Defense of the Cuban Revolution,https://www.counterpunch.org/2026/06/05/an-anarchist-defense-of-the-cuban-revolution/,Nicky Reid,2026-06-05T05:22:45Z,wheat exports,"” a libertarian foreign policy program for America must be to call upon the United States to abandon its policy of global interventionism: to withdraw immediately and completely, militarily and politically, from Asia, Europe, Latin America, the Middle East, f…",CounterPunch,USA,News,2026-06-07T13:57:44.244988Z
99f463a5939e8f443ad39b58a61ec772,Pakistan Inflation Accelerates to 11.7% on Oil and Gas Import Shock,https://oilprice.com/Latest-Energy-News/World-News/Pakistan-Inflation-Accelerates-to-117-on-Oil-and-Gas-Import-Shock.html,Charles Kennedy,2026-06-01T16:30:00Z,wheat exports,"The surge in international oil and gas prices amid the Iran war hiked Pakistan's inflation to the highest level in two years as energy import costs ballooned. Pakistan's general inflation jumped to 11.7% in May from a year earlier, accelerating from 10.9% ann…",OilPrice.com,Global,Market Report,2026-06-07T13:57:44.245188Z
b8fae220a7f5e45941b0cbfed0178731,Wheat Holding higher on Monday AM Trade,https://www.barchart.com/story/news/2233682/wheat-holding-higher-on-monday-am-trade,Austin Schroeder,2026-06-01T12:31:59Z,wheat exports,Wheat is trading with Monday morning gains of 2 to 4 cents across most contracts. The wheat complex fell double digits across most contracts on Friday...,Barchart.com,Unknown,Market Report,2026-06-07T13:57:44.245227Z
294b318d2f22e3493f16977a0c38c740,How the War in Iran Is Transforming the Global Economy,https://www.newyorker.com/news/q-and-a/how-the-war-in-iran-is-transforming-the-global-economy,Isaac Chotiner,2026-06-06T10:00:00Z,fertilizer exports,"Isaac Chotiner interviews Peter Harrell about the economic effects of the war in Iran if a deal is not reached, about rising gas prices and stunted energy flows.",The New Yorker,Global,Analysis/Opinion,2026-06-07T13:57:44.481460Z
be4e6ad3425dfe67761d439434be4923,Trump takes victory lap on hiring surge and stock rally— vows gas will drop in 90 days when we ‘come out of Iran’,https://nypost.com/2026/06/05/us-news/trump-takes-victory-lap-on-hiring-surge-vows-gas-will-drop-in-90-days-when-we-come-out-of-iran/,Steven Nelson,2026-06-05T22:36:13Z,fertilizer exports,"Trump touted the positive economic numbers during a farmer roundtable in Chippewa Falls, Wis., and said that good news would come within 90 days for fuel and fertilizer costs following the end of the Iran war.",New York Post,Unknown,News,2026-06-07T13:57:44.481603Z
91ab6084faf94f55188d3541138b502a,"When global trade becomes a weapon, how can African economies protect themselves?",https://theconversation.com/when-global-trade-becomes-a-weapon-how-can-african-economies-protect-themselves-284321,"Jonathan Munemo, Professor of Economics, Salisbury University",2026-06-05T12:17:56Z,fertilizer exports,"Africa needs to navigate the tension between interdependence, economic security, and economic diversification.",The Conversation Africa,Global,News,2026-06-07T13:57:44.481643Z
659d3b9ff0110cf4c32b08184a6c7d86,Indonesia secures Swiss funding boost for OECD membership push,https://en.antaranews.com/news/418084/indonesia-secures-swiss-funding-boost-for-oecd-membership-push,"Bayu Saputra, Tegar Nurfitra",2026-06-05T06:46:07Z,fertilizer exports,Coordinating Minister for Economic Affairs Airlangga Hartarto revealed that Switzerland had agreed to provide 3 million euros to support Indonesia&rsquo;s ...,Antaranews.com,Indonesia,News,2026-06-07T13:57:44.481672Z
2618e42e2883fd25b32e656961900c0d,Israelâs War on Peace: How the World Pays for Netanyahuâs Vicious Agenda,https://www.naturalnews.com/2026-06-04-israels-war-on-peace-netanyahus-vicious-agenda.html,Mike Adams,2026-06-04T06:00:00Z,fertilizer exports,"A Global Crisis Engineered by One Regime There is a deliberate strategy unfolding before our eyes, and it is being orchestrated by a single regime determined to plunge the entire planet into chaos. I have watched for years as Israeli Prime Minister Benjamin N…",Naturalnews.com,Global,News,2026-06-07T13:57:44.481751Z
e7403e704bb6a8bcadf6e8226720a0eb,Faultlines in a New Epoch of Crisis,https://www.counterpunch.org/2026/06/04/faultlines-in-a-new-epoch-of-crisis/,Ashley Smith,2026-06-04T05:50:15Z,fertilizer exports,"We have entered a new epoch of global capitalism. It is characterized by crisis, imperial rivalry, authoritarian nationalism, and episodic, explosive resistance from below. The Trump administration’s brief year of misrule has brought all these to a head, part…",CounterPunch,Global,News,2026-06-07T13:57:44.481803Z
d05d33173b3c652de430e4e4610b5ee9,Strong farm cash flows drive tractor demand; registrations rise 11.6% in May,https://www.thehindubusinessline.com/economy/logistics/strong-farm-cash-flows-drive-tractor-demand-registrations-rise-116-in-may/article71058424.ece,Amit Vijay  Mohile,2026-06-04T04:46:27Z,fertilizer exports,"Strong rural cash flows, replacement demand and dealer restocking pushed India’s tractor registrations up 11.6% year-on-year to 81,776 units in May 2026, signalling continued resilience in the farm economy despite looming monsoon risks.",BusinessLine,India,News,2026-06-07T13:57:44.481832Z
0b8d440d410704897c5c2ab0799a7847,Japan's Rare Earths Island,https://newsonjapan.com/article/149509.php,News On Japan,2026-06-03T23:23:07Z,fertilizer exports,"The video explains how a tiny, remote Japanese island called Minami Torishima (Marcus Island) could become one of the most strategically important locations in the world due to enormous deposits of rare earth elements buried in deep-sea mud beneath the Pacifi…",Newsonjapan.com,Japan,News,2026-06-07T13:57:44.481867Z
82f14472c9c2d3ceca159f8da2913209,Iran Launches Deadly Attack on Kuwait’s Main Airport,http://foreignpolicy.com/2026/06/03/iran-attack-kuwait-airport-us-war-cease-fire-talks-oecd/,Alexandra Sharp,2026-06-03T20:38:14Z,fertilizer exports,Experts warn that continued strikes could jeopardize peace talks.,Foreign Policy,Unknown,News,2026-06-07T13:57:44.481900Z
55e9669247f823ac422a7ff3a88b1730,"Iran war threatens major food shortages in Africa, S&P warns",https://www.semafor.com/article/06/03/2026/iran-war-threatens-major-food-shortages-in-africa-sp-warns,Tiisetso Motsoeneng,2026-06-03T13:30:42Z,fertilizer exports,Key fuel and fertilizer exports have been all but blocked by disruption in the Strait of Hormuz.,Semafor.com,Unknown,News,2026-06-07T13:57:44.481930Z
f7def21a1c462c931be9dac699f98b8f,Ghana Raises Growth Forecast as Reform Gains Weather Iran Impact,https://financialpost.com/pmn/business-pmn/ghana-raises-growth-forecast-as-reform-gains-weather-iran-impact,Bloomberg News,2026-06-03T09:47:55Z,fertilizer exports,"Ghana’s economy is growing faster than expected as companies benefit from lower inflation and interest rates, with budget and foreign-exchange reforms helping offset the impact from the war in Iran, Finance Minister Cassiel Ato Forson said.",Financial Post,Unknown,Analysis/Opinion,2026-06-07T13:57:44.481974Z
22ae13e7f5372cb8c4dd474d212567d9,Aftermath: Something Is Going to Snap,http://prospect.org/2026/06/03/aftermath-something-is-going-to-snap-iran-strait-of-hormuz/,Ryan Cooper,2026-06-03T09:00:00Z,fertilizer exports,"So far, the closure of the Strait of Hormuz has not led to a major economic disaster. That won’t last forever.
The post Aftermath: Something Is Going to Snap appeared first on The American Prospect.",The American Prospect,USA,News,2026-06-07T13:57:44.482001Z
859159ad897f85a03d8cdec0ac6a2d4a,Ceasefire Uncertainty Remains the Biggest Driver for Oil Markets,https://oilprice.com/Energy/Energy-General/Ceasefire-Uncertainty-Remains-the-Biggest-Driver-for-Oil-Markets.html,Tom Kool,2026-06-02T15:30:00Z,fertilizer exports,"Iran is reviewing the latest U.S. ceasefire proposal, raising hopes of a truce extension and tempering oil prices as traders weigh the risk of renewed Middle East disruptions. Ukraine’s Refinery War Gives Russian Crude an Export Passport - Ukraine is inadvert…",OilPrice.com,Russia,Analysis/Opinion,2026-06-07T13:57:44.482024Z
709ca8c01b47388b395db71215cd850b,Why India Cannot Let the Rupee Float,https://thediplomat.com/2026/06/why-india-cannot-let-the-rupee-float/,Deepanshu Mohan,2026-06-02T12:48:00Z,fertilizer exports,"Imported inflation, fragile manufacturing, and unequal burdens complicate textbook arguments supporting unrestricted currency depreciation across India.",The Diplomat,India,News,2026-06-07T13:57:44.482043Z
f6e4fbae468b31c38e89a75791696629,"Can US and India Forge a ‘Big, Beautiful’ Energy Deal?",https://wattsupwiththat.com/2026/06/01/can-us-and-india-forge-a-big-beautiful-energy-deal/,Guest Blogger,2026-06-02T01:00:00Z,fertilizer exports,"A U.S.-India alliance would strike at the heart of the corrupt climate lobby. By trading massive quantities of fossil fuels, it would break a stranglehold on energy policy that climate alarmists have long sought to make permanent.
The post Can US and India Fo…",Wattsupwiththat.com,India,Market Report,2026-06-07T13:57:44.482068Z
8799358e0970c5b6319587b7ab364f2f,Trump's Cotton Bailout Is Another Sign His Tariffs Aren't Working,https://reason.com/2026/06/01/trumps-cotton-bailout-is-another-sign-his-tariffs-arent-working/,Tosin Akintola,2026-06-01T18:24:31Z,fertilizer exports,"The Great American Cotton Plan will shell out millions in taxpayer funds, continuing the Trump administration’s pattern of paying off industries harmed by the president’s economic policies.",Reason,USA,News,2026-06-07T13:57:44.482096Z
2a3f3167a01f7749080e7c4421f84fdf,Top 5 Commodities Impacted By The Iran War,https://oilprice.com/Energy/Energy-General/Top-5-Commodities-Impacted-By-The-Iran-War.html,Alex Kimani,2026-06-01T17:00:00Z,fertilizer exports,"The Middle East conflict has triggered sweeping, multi-commodity supply shocks, profoundly impacting global energy, petrochemicals, agriculture and shipping industries, among others. The disruption of shipping through the Strait of Hormuz--which handles nearl…",OilPrice.com,Global,News,2026-06-07T13:57:44.482146Z
5dee19f334be903beea0326c7bb97c51,Iran Says the Strait of Hormuz Will Stay Closed. What Happens to the US Economy Next?,https://www.investopedia.com/iran-war-strait-of-hormuz-whats-next-for-us-economy-11987790,Diccon Hyatt,2026-06-01T15:32:11Z,fertilizer exports,Is the U.S. economy facing major disruption or a minor challenge from oil supply shocks? Economists differ on how fuel shortages may impact growth and...,Investopedia,Unknown,News,2026-06-07T13:57:44.482181Z
2f26223c3b69b06492e8210287a604a7,The Energy Crisis Will Long Outlast the Iran War,http://foreignpolicy.com/2026/06/01/iran-war-hormuz-energy-crisis-how-long-last/,Keith Johnson,2026-06-01T09:30:00Z,fertilizer exports,The baked-in damage to oil and gas production will take months to undo.,Foreign Policy,Unknown,News,2026-06-07T13:57:44.482251Z
