article_id,title,link,creator,pubdate,category,description,source,country,article_type,scrape_timestamp
44ff05ca9613877ae26af01d26896ae3,"6 Best East Coast Weekend Getaways, According to Mental Floss Editors",https://www.mentalfloss.com/geography/wanderlust/best-east-coast-weekend-getaways-mental-floss-editors,"Logan DeLoye, Eden Gordon & Nitya Rao",2026-03-20T22:00:00Z,maritime transport,Explore the East Coast escapes our editors say are perfect for a quick weekend trip.,Mental Floss,Unknown,News,2026-03-22T06:55:49.757619Z
7935b8eb0e2f7814f8a8e4118cab8288,Tzitzikostas: All actions to close the Strait of Hormuz must stop,https://en.protothema.gr/2026/03/20/tzitzikostas-all-actions-to-close-the-strait-of-hormuz-must-stop/,admin,2026-03-20T20:39:00Z,maritime transport,"In a statement on the escalation in the Middle East, the Transport Commissioner emphasizes that the exercise of navigation rights and freedoms by commercial vessels must be respected
The post Tzitzikostas: All actions to close the Strait of Hormuz must stop a…",Protothema.gr,Unknown,News,2026-03-22T06:55:49.757670Z
0350bd208b87d02cf6f3f7dcc323a625,Shippers council suspends tarrif hike by shipping companies,https://punchng.com/?p=2095156,Punch Newspapers,2026-03-20T19:50:43Z,maritime transport,"The Nigerian Shippers Council has ordered an immediate suspension of the recent shipping tariff hike, citing stakeholder concerns and ongoing review.

Read More: https://punchng.com/shippers-council-suspends-tarrif-hike-by-shipping-companies/",The Punch,Unknown,Analysis/Opinion,2026-03-22T06:55:49.757705Z
b5e02adaeefa512719bb8c297fe2ffd8,3 Quebec maritime trainees return home after being stranded aboard ship in the Persian Gulf,https://www.cbc.ca/news/canada/montreal/quebec-maritime-trainees-9.7136552,,2026-03-20T18:39:42Z,maritime transport,A Quebec-based shipping company says three Canadians have returned home after being stuck aboard their vessels in the Persian Gulf.,CBC News,Unknown,News,2026-03-22T06:55:49.757771Z
d5700522bea305367d6c115d4a601454,"Water Taxi Market Size to Reach USD 315.31 Billion by 2032, Reveals New Maximize Market Research Analysis",https://www.prnewswire.co.uk/news-releases/water-taxi-market-size-to-reach-usd-315-31-billion-by-2032--reveals-new-maximize-market-research-analysis-302719864.html,,2026-03-20T14:31:00Z,maritime transport,"PUNE, India, March 20, 2026 /PRNewswire/ -- Maximize Market Research's Water Taxi Market Global Outlook (2025–2032) highlights the transformative growth in urban water mobility, fueled by rising demand for sustainable, efficient, and tourism-integrated mariti…",PR Newswire UK,India,Analysis/Opinion,2026-03-22T06:55:49.757791Z
c26f83f4ee8dc93ccafdcafe124ebdb8,Ship crews ration food in Iran blockade: seafarers,https://www.digitaljournal.com/world/ship-crews-ration-food-in-iran-blockade-seafarers/article,AFP,2026-03-20T12:42:32Z,maritime transport,"Seafarers stuck in the Gulf say they are rationing food and water and anxiously hoping supplies will get through Iran’s blockade in the war that has stranded them for three weeks. “We don’t have enough water on board right now. We got food a few days back,” s…",Digital Journal,Unknown,News,2026-03-22T06:55:49.757838Z
654c48597de92e9c281231dbc7d4c58d,"Work from home, drive slower and don't use gas cookers: IEA advice on weathering the global energy crisis",https://www.cnbc.com/2026/03/20/iea-oil-fuel-prices-energy-advice-consumers-crisis.html,Elsa Ohlen,2026-03-20T12:00:50Z,maritime transport,"The IEA warns of ""the largest supply disruption in the history of the global oil market"" due to the conflict in the Middle East.",CNBC,Global,Market Report,2026-03-22T06:55:49.757868Z
430a5ad68770007171c084fbe0e6a209,"Troubled Waters: Seaports, China, and the United States",https://blogs.lse.ac.uk/internationaldevelopment/2026/03/20/troubled-waters-seaports-china-and-the-united-states/,Dipa Patel,2026-03-20T10:02:23Z,maritime transport,"Guest blogger and Strategic Advisor at Global Foresight Strategies LLC and Senior Foresight Advisor emeritus at USAID, Steve Gale argues that China has gained a major strategic and economic advantage over the United States by expanding its global control of s…",Lse.ac.uk,China,News,2026-03-22T06:55:49.757887Z
a719f52736e0244ecc0862aea4c87115,"Meet the Jones Act, the law that has made gas more expensive for Americans for decades",https://fortune.com/2026/03/19/what-is-the-jones-act-impact-gas-prices-oil/,"Christopher Niezrecki, The Conversation",2026-03-19T16:19:41Z,maritime transport,Trump's 60-day suspension of the Jones Act isn't seen as much help for gas prices that have gone up by a third in just three weeks.,Fortune,USA,Market Report,2026-03-22T06:55:49.758041Z
7702de4197451b21322916b55dcb3371,Why Electrification Is Europe’s Only Real Hedge Against Oil Shocks,https://oilprice.com/Energy/Energy-General/Why-Electrification-Is-Europes-Only-Real-Hedge-Against-Oil-Shocks.html,Leon Stille,2026-03-19T15:00:00Z,maritime transport,"Tensions in the Strait of Hormuz are still rising, and Europe is still falling back on the same instinct: worry about supply, brace for higher prices, and revive talk of more domestic oil and gas production. It is an understandable reflex. It is also the wron…",OilPrice.com,Unknown,Market Report,2026-03-22T06:55:49.758087Z
15035efbdc9c9bb1bcd86667c0b08f88,Temporary exemption granted to cabotage law,https://www.wjournalpr.com/business/temporary-exemption-granted-to-cabotage-law/article_3564f64f-d5b5-5341-a76a-bb21db12cc74.html,Istra Pacheco,2026-03-19T13:21:17Z,maritime transport,"For the next 60 days, cabotage laws will be suspended as a measure to address the rising cost of transporting fuel following the outbreak of war in Iran, and local leaders believe this will benefit Puerto Rico.",Wjournalpr.com,Unknown,News,2026-03-22T06:55:49.758123Z
fcc453b799d9628a8e71885e8b7fa22a,Ottoman-era village square found at Sillyon,https://www.hurriyetdailynews.com/ottoman-era-village-square-found-at-sillyon-220143,hurriyetdailynews.com,2026-03-19T13:01:00Z,maritime transport,"An area used as a village center during the Ottoman period, including a small mosque and fountain, has been identified at Sillyon Ancient City in southern Türkiye.",Hurriyet Daily News,Unknown,News,2026-03-22T06:55:49.758160Z
c286ee2532369aa98c9b70c0a7feaa76,What caused the Alaska tugboat confined space deaths? #world,https://alltoc.com/world/what-caused-the-alaska-tugboat-confined-space-deaths,AllToc,2026-03-19T12:03:52Z,maritime transport,Coast Guard says “confined space incident” killed two tugboat crew members in Alaska The U.S. Coast Guard is investigating the deaths of two tugboat crew members and injuries to two others after what it described as a “confined space incident” aboard a barge …,Alltoc.com,Unknown,News,2026-03-22T06:55:49.758205Z
1e7363f6ba73ba8b906b6dadb54ac7c6,A brief overview of the main incidents in industrial cybersecurity. Q4 2025,https://ics-cert.kaspersky.com/publications/reports/2026/03/19/a-brief-overview-of-the-main-incidents-in-industrial-cybersecurity-q4-2025/,tsvetkovvladimir,2026-03-19T09:00:00Z,maritime transport,"More than 160 companies publicly reported cyberattacks. This quarter, a disproportionately large number of incidents occurred in organizations from Japan and Taiwan.",Kaspersky.com,Japan,Analysis/Opinion,2026-03-22T06:55:49.758225Z
948c80833e5427e85ecb128fe73785f1,Double Iranian strike on the world’s largest LNG facility in Qatar – Trump warns of destruction of the “South Pars” field if Iran continues its attacks (Update),https://en.protothema.gr/2026/03/19/iran-attacked-the-us-embassy-in-iraq-with-drones-and-rockets-israel-pounds-lebanon-and-sends-new-ground-forces-update/,Newsroom,2026-03-19T06:36:28Z,maritime transport,"Two Iranian strikes on the largest LNG facility in Qatar, with the state company QatarEnergy speaking of extensive damage
The post Double Iranian strike on the world’s largest LNG facility in Qatar – Trump warns of destruction of the “South Pars” field if Ira…",Protothema.gr,Unknown,News,2026-03-22T06:55:49.758318Z
239ea6933aeac0236ed218791f477f3b,Nuclear propulsion under three conditions,https://www.naftemporiki.gr/english/2087487/nuclear-propulsion-under-three-conditions/,Αλεξία Σωτηρίου,2026-03-19T06:26:54Z,maritime transport,"A new debate on the use of nuclear energy—including in shipping—is opening up, under certain conditions, according to a study by the Deon Policy Institute.
The study recommends incorporating nuclear…
Nuclear propulsion under three conditions - Η ΝΑΥΤΕΜΠΟΡΙΚΗ",Naftemporiki.gr,Unknown,News,2026-03-22T06:55:49.758364Z
98a98a462fbb86ec3f409f5df9bb745c,Strait of Hormuz blockage drives food costs higher across Gulf,https://economictimes.indiatimes.com/news/international/world-news/strait-of-hormuz-blockage-drives-food-costs-higher-across-gulf/articleshow/129670856.cms,AFP,2026-03-19T04:51:00Z,maritime transport,"Gulf nations are experiencing higher food prices. A war has disrupted vital shipping lanes, impacting imports. Supermarkets in Bahrain and Kuwait show price hikes, especially for meat. While some countries have reserves, others are feeling the pinch. Efforts …",The Times of India,Unknown,Market Report,2026-03-22T06:55:49.758452Z
ed3be4f91aa5710645d1f4f4d3158e84,Strait of Hormuz blockage drives up Gulf food bills,https://www.digitaljournal.com/world/strait-of-hormuz-blockage-drives-up-gulf-food-bills/article,AFP,2026-03-19T04:47:20Z,maritime transport,"In a supermarket in Bahrain, Mahmoud Ali fills his cart as usual. The shelves remain stocked despite the war in the Middle East, but the blockade of the main shipping routes into the Gulf is now being felt at checkout. “There’s no shortage”, but over the past…",Digital Journal,Unknown,Market Report,2026-03-22T06:55:49.758491Z
0654a1dff66aca29a640d2f40355db00,Middle East conflict: Strait of Hormuz blockage drives up Gulf food bills,https://punchng.com/middle-east-conflict-strait-of-hormuz-blockage-drives-up-gulf-food-bills/,Punch Newspapers,2026-03-19T04:39:06Z,maritime transport,"A conflict-driven Strait of Hormuz blockage is disrupting key shipping routes, leading to a sharp increase in Gulf food bills, particularly in Bahrain and

Read More: https://punchng.com/middle-east-conflict-strait-of-hormuz-blockage-drives-up-gulf-food-bills/",The Punch,Unknown,News,2026-03-22T06:55:49.758531Z
1ca0a25b9453074e7dc52f681ed15b9a,Trump’s call for Hormuz Taskforce falling on Deaf Ears Globally,https://www.juancole.com/2026/03/taskforce-falling-globally.html,Neil Thompson,2026-03-19T04:15:52Z,maritime transport,Nations outside the US signal their scepticism about White House plans for an international naval operation to re-open the Strait of Hormuz,Juancole.com,Global,News,2026-03-22T06:55:49.758586Z
60bae2201a01b4461bb15dfae1919732,Soaring gas prices prompt Trump to ease oil tanker rules – how waiving the Jones Act affects what you pay at the pump,https://theconversation.com/soaring-gas-prices-prompt-trump-to-ease-oil-tanker-rules-how-waiving-the-jones-act-affects-what-you-pay-at-the-pump-278387,"Christopher Niezrecki, Director of the Center for Energy Innovation, UMass Lowell",2026-03-19T01:16:28Z,maritime transport,"Suspending the Jones Act will increase the supply of fuel by allowing foreign-flagged ships to transport oil between US ports, which should eventually educe gas prices.",The Conversation Africa,Unknown,Market Report,2026-03-22T06:55:49.758626Z
39b58922c85fae21b96fb0372b4aae1a,$200 Oil No Longer Crazy Idea as Middle East Supply Collapses,https://oilprice.com/Energy/Oil-Prices/200-Oil-No-Longer-Crazy-Idea-as-Middle-East-Supply-Collapses.html,Irina Slav,2026-03-19T00:00:00Z,maritime transport,"A month ago, any analyst suggesting international oil prices could soar all the way to $200 per barrel would have been laughed out of the studio. Now, some are beginning to acknowledge that this is a real possibility, and with good reason. Oil and fuel export…",OilPrice.com,Global,Market Report,2026-03-22T06:55:49.758669Z
ec68957c6029fb30073ceaa51d63c26c,Daily Press Briefing by the Office of the Spokesperson for the Secretary-General,https://press.un.org/en/2026/db260318.doc.htm,United Nations,2026-03-18T22:08:54Z,maritime transport,"In Somalia, fuel prices doubled in recent days, from $0.60 to $1.50 per litre — a more than 100 per cent jump — due mainly to the impact of the escalation in the Middle East, authorities and UN partners report. These rising costs are driving up prices of food…",UN News,Unknown,Market Report,2026-03-22T06:55:49.758712Z
1f81120eb8a6969cbd5ea82ebc3e8210,How Trump's Hormuz push tests Japan's pacifist limits,https://japantoday.com/category/politics/explainer-how-trump%27s-hormuz-push-tests-japan%27s-pacifist-limits,,2026-03-18T21:42:04Z,maritime transport,U.S. President Donald Trump's call for allies to send warships to escort oil tankers through the Strait of Hormuz has revived questions about how far pacifist Japan can go to support its ‌closest ally in a conflict. Here are the narrow legal options available…,Japan Today,Japan,News,2026-03-22T06:55:49.758744Z
218bb507ee2c5027942a46c6945db2ad,White House suspends the Jones Act for 60 days. Analysts see a gas price impact of 3 cents,https://fortune.com/2026/03/18/white-house-suspends-jones-act-60-days-gas-oil/,"Wyatte Grantham-Philips, The Associated Press",2026-03-18T20:32:52Z,maritime transport,"White House press secretary Karoline Leavitt said it would help “mitigate the short-term disruptions to the oil market.""",Fortune,Unknown,Market Report,2026-03-22T06:55:49.758777Z
52fc02360921b7ab1d6add2bf58c0298,Was Keel-Hauling Actually a Thing?,http://www.todayifoundout.com/index.php/2026/03/was-keel-hauling-actually-a-thing/,Gilles Messier,2026-03-18T20:30:10Z,maritime transport,"Running the gauntlet. Starting. Flogging with the cat ‘o 9 nine tails. Gagging. Clapping in irons. Hanging from the yardarm. While this all might sound like a super fun Saturday night with the misses when the grandparents are watching your kiddos for you, it …",Todayifoundout.com,Unknown,News,2026-03-22T06:55:49.758822Z
5ea9b131cda9cd92e414765be27c9c9d,"Trump Waives USA Shipping Law For Oil, Gas",https://www.rigzone.com/news/wire/trump_waives_usa_shipping_law_for_oil_gas-18-mar-2026-183240-article/,Jennifer A. Dlouhy,2026-03-18T20:00:00Z,maritime transport,"President Donald Trump temporarily waived a century-old shipping mandate to lower the cost of transporting oil, gas and other commodities around the United States.",Rigzone,USA,News,2026-03-22T06:55:49.758841Z
c0ce5f4f3d7f9828b2763669aa5d87e8,The view of the Iran war from abroad,https://www.wbur.org/onpoint/2026/03/18/international-military-view-of-the-iran-war,,2026-03-18T20:00:00Z,maritime transport,"U.S. allies say they won't commit military aid to the war in Iran, and some foreign analysts say the U.S. lacks strategy. The view of the war from the international community.

***
Thank you for listening. Help power On Point by making a donation here: wbur.o…",WBUR,Global,Analysis/Opinion,2026-03-22T06:55:49.758878Z
e3136ab24e76c4a507f30e06e0c0a752,What to know about the Jones Act as the Trump administration unveils a 60-day waiver,https://www.pbs.org/newshour/politics/what-to-know-about-the-jones-act-as-the-trump-administration-unveils-a-60-day-waiver,"Wyatte Grantham-Philips, Associated Press",2026-03-18T19:15:46Z,maritime transport,"Passed in 1920, this law aims to protect the American shipping sector — but it's also faced criticism over the years for slowing the delivery of goods, including critical aid during time of crisis.",PBS,USA,News,2026-03-22T06:55:49.758904Z
77edb5137d7e53d5c9a05e425b8b334f,What is the Jones Act waiver doing? #world,https://alltoc.com/world/what-is-the-jones-act-waiver-doing,AllToc,2026-03-18T18:04:07Z,maritime transport,The administration is loosening shipping rules to ease fuel prices The White House has issued a temporary waiver of the Jones Act as a measure aimed at lowering rising fuel and gas prices. The policy change temporarily relaxes key restrictions on maritime tra…,Alltoc.com,Unknown,Market Report,2026-03-22T06:55:49.758949Z
8ca629b3aa21a59549af7c5148051d7b,Japanese Firms Begin Output Cuts as Hormuz Tensions Deepen,https://newsonjapan.com/article/148672.php,,2026-03-18T17:56:55Z,maritime transport,"The situation surrounding the Strait of Hormuz, a critical chokepoint for global energy transport, is growing increasingly complex, with U.S. President Donald Trump urging Japan to assist in securing the waterway while Iran signals it may allow passage depend…",Newsonjapan.com,Japan,News,2026-03-22T06:55:49.758982Z
f385aa1b9d0e06b41a1916f5026f24c3,Trump temporarily waives century-old shipping law amid rising fuel costs,https://www.aljazeera.com/economy/2026/3/18/trump-temporarily-waives-century-old-shipping-law-amid-rising-fuel-costs,Al Jazeera Staff,2026-03-18T17:56:26Z,maritime transport,"Lifting the Jones Act temporarily allows foreign ships to transport cargo across the US, but critics question efficacy.",Al Jazeera English,Unknown,News,2026-03-22T06:55:49.759013Z
25ae76f583f77396429329d8dd8d41de,Health care cyberattacks expose a critical national security failure,https://kevinmd.com/2026/03/health-care-cyberattacks-expose-a-critical-national-security-failure.html,"Kristen Cline, BSN, RN",2026-03-18T17:00:10Z,maritime transport,"Everything we know about keeping people alive under pressure we learned from war. Triage was invented on a Napoleonic battlefield. Tourniquets, hemostatic dressings, damage control resuscitation, the golden hour itself. Military surgeons figured out how to st…",Kevinmd.com,Unknown,News,2026-03-22T06:55:49.759062Z
aac621e9da33097001fe38053dfa29f7,Hormuz Choke Point Displays ‘Green’ Vulnerabilities and US Power,https://wattsupwiththat.com/2026/03/18/hormuz-choke-point-displays-green-vulnerabilities-and-us-power/,Guest Blogger,2026-03-18T17:00:00Z,maritime transport,"The crisis also showcases America’s capacity to support allies and the poor. Long‑term LNG contracts with Asian and European partners, coupled with support for reasonable financing of oil and gas projects in developing countries, can reduce dependence on chok…",Wattsupwiththat.com,USA,News,2026-03-22T06:55:49.759091Z
7e0922ba1837971fb04df1cd257204e8,Panama Canal Sees LNG Surge as Hormuz Disruption Reshapes Global Trade,https://gcaptain.com/panama-canal-sees-lng-surge-as-hormuz-disruption-reshapes-global-trade/,Lori Ann LaRocco,2026-03-18T16:44:28Z,maritime transport,LNG bookings average one per day as Canal positions itself as key alternative for disrupted Middle East energy flows By Lori Ann LaRocco – LNG transits through the Panama Canal...,gcaptain.com,Panama,News,2026-03-22T06:55:49.759127Z
e73adfe664b7580b07c8f13454488ffe,A dumping ground at the deepest point of the Mediterranean off Pylos,https://en.protothema.gr/2026/03/18/a-dumping-ground-at-the-deepest-point-of-the-mediterranean-off-pylos/,Newsroom,2026-03-18T16:05:00Z,maritime transport,"A report by Stuttgarter Zeitung on underwater pollution at the deepest point of the Mediterranean, known as Calypso, reveals the scale of the problem and the difficulties in addressing it
The post A dumping ground at the deepest point of the Mediterranean off…",Protothema.gr,Unknown,Market Report,2026-03-22T06:55:49.759172Z
c32d7582c10b0f252f9c7cd129d3a9f4,Trump temporarily waives maritime shipping law to ease energy costs,https://economictimes.indiatimes.com/news/international/global-trends/trump-temporarily-waives-maritime-shipping-law-to-ease-energy-costs/articleshow/129659469.cms,AFP,2026-03-18T14:44:42Z,maritime transport,President Donald Trump has temporarily waived a century-old shipping law. This move aims to ease surging energy costs following US-Israeli strikes on Iran. The waiver allows foreign ships to transport cargo between US ports for sixty days. This action is expe…,The Times of India,Unknown,News,2026-03-22T06:55:49.759221Z
9e1e70888f5f42044efb2ff3a9a0095a,Iran continues exporting millions of barrels of oil as around 90 ships cross the Strait of Hormuz despite the war,https://www.pbs.org/newshour/world/iran-continues-exporting-millions-of-barrels-of-oil-as-around-90-ships-cross-the-strait-of-hormuz-despite-the-war,"Chan Ho-him, Associated Press, Sheikh Saaliq, Associated Press",2026-03-18T13:56:58Z,maritime transport,"Many of the vessels that have passed through the Strait are so-called ""dark"" transits evading Western sanctions that likely have ties with Iran.",PBS,Unknown,News,2026-03-22T06:55:49.759258Z
a4d55f23c3177f70b37548b02c86333c,"K.M. and the measures from Brussels, the “other universe” and PASOK’s new groom, how Euroxx went to Optima, the Varvitsiotis Bros in real estate",https://en.protothema.gr/2026/03/18/k-m-and-the-measures-from-brussels-the-other-universe-and-pasoks-new-groom-how-euroxx-went-to-optima-the-varvitsiotis-bros-in-real-estate/,Electra Delavogia,2026-03-18T11:57:41Z,maritime transport,"///
The post K.M. and the measures from Brussels, the “other universe” and PASOK’s new groom, how Euroxx went to Optima, the Varvitsiotis Bros in real estate appeared first on ProtoThema English.",Protothema.gr,Unknown,News,2026-03-22T06:55:49.759308Z
c92cd16646ab709f5e85aac08d15a6d1,About 90 ships cross the Strait of Hormuz as Iran exports millions of barrels of oil despite the war,https://abcnews.com/Business/wireStory/90-ships-cross-strait-hormuz-iran-exports-millions-131173425,"CHAN HO-HIM Associated Press, SHEIKH SAALIQ Associated Press",2026-03-18T11:49:40Z,maritime transport,About 90 ships including oil tankers have crossed the Strait of Hormuz since the beginning of the war with Iran,Abcnews.com,Unknown,News,2026-03-22T06:55:49.759340Z
9d89c880cce5c51f565899d49121a163,Technip Energies invests in Verso Energy’s DEZiR eSAF project in Rouen,https://www.globenewswire.com/news-release/2026/03/18/3257894/0/en/Technip-Energies-invests-in-Verso-Energy-s-DEZiR-eSAF-project-in-Rouen.html,TECHNIP ENERGIES N.V.,2026-03-18T06:30:00Z,maritime transport,"Technip Energies (PARIS: TE) has signed an agreement with Verso Energy to acquire a minority equity stake in the DEZiR project, a synthetic aviation fuel (“eSAF”) plant located in Rouen, France. This investment demonstrates Technip Energies’ support for this …",GlobeNewswire,Unknown,Market Report,2026-03-22T06:55:49.759385Z
486b450fd1c3aa2cd34eca9c7408c518,About 90 ships cross Strait of Hormuz as Iran exports millions of barrels of oil despite war,https://economictimes.indiatimes.com/news/international/business/about-90-ships-cross-strait-of-hormuz-as-iran-exports-millions-of-barrels-of-oil-despite-war/articleshow/129649009.cms,AP,2026-03-18T06:26:09Z,maritime transport,"Despite the Strait of Hormuz being effectively closed, around 90 ships have passed through. Many of these vessels are linked to Iran, evading Western sanctions. Ships from India and Pakistan have also successfully crossed. This transit occurs as crude oil pri…",The Times of India,India,News,2026-03-22T06:55:49.759416Z
e80377953d6b2729b5d1552da3ef4628,"Qatar can keep goods flowing amid tensions, customs chief says",https://www.aljazeera.com/economy/2026/3/18/qatar-can-keep-goods-flowing-amid-tensions-customs-chief-says,Al Jazeera,2026-03-18T06:19:46Z,maritime transport,Qatar has no reason to worry about goods shortages or disruptions to supply chains despite heightened regional tensions.,Al Jazeera English,Unknown,News,2026-03-22T06:55:49.759445Z
423334c835d207328114e91b2c3088a2,About 90 ships cross Strait of Hormuz as Iran exports millions of barrels of oil despite the war,https://japantoday.com/category/world/about-90-ships-cross-the-strait-of-hormuz-as-iran-exports-millions-of-barrels-of-oil-despite-the-war,,2026-03-18T05:43:49Z,maritime transport,"About 90 ships including oil tankers have crossed the Strait of Hormuz since the outset of the war with Iran and it is still exporting millions of barrels of oil at a time when the waterway has been effectively closed, according to maritime and trade data pla…",Japan Today,Unknown,News,2026-03-22T06:55:49.759495Z
f787a6862d07324a38fae0f7891109a0,About 90 ships cross Strait of Hormuz as Iran exports millions of barrels of oil despite war,https://www.thehindubusinessline.com/news/world/about-90-ships-cross-strait-of-hormuz-as-iran-exports-millions-of-barrels-of-oil-despite-war/article70756816.ece,AP- PTI,2026-03-18T05:38:08Z,maritime transport,"About 90 ships including oil tankers have crossed the Strait of Hormuz since the outset of the war with Iran and it is still exporting millions of barrels of oil at a time when the waterway has been effectively closed, according to maritime and trade data pla…",BusinessLine,Unknown,News,2026-03-22T06:55:49.759540Z
29acbc2578fe0242f66bed4552f258f4,Dozens of ships slip through the Strait of Hormuz as Iran's oil exports get through,https://apnews.com/article/ships-iran-oil-china-us-trump-hormuz-82a9acb473837f1bf7a821d0c3f95205,Chan Ho-him,2026-03-18T05:08:05Z,maritime transport,About 90 ships including oil tankers have crossed the Strait of Hormuz since the beginning of the war with Iran. Maritime and trade data platforms report it is still exporting millions of barrels of oil at a time when it said it closed the key waterway for ve…,Associated Press,Unknown,Market Report,2026-03-22T06:55:49.759596Z
