article_id,title,link,creator,pubdate,category,description,source,country,article_type,scrape_timestamp
7b712e7edb4b1b070ecbef9aadf52202,"The ancient aliens theory claims extraterrestrials built the pyramids, but archaeologists have found the workers’ villages, bakeries, healed bones, graffiti, and crew names — and all the evidence points back to ordinary Egyptians",https://spacedaily.com/d-the-ancient-aliens-theory-claims-extraterrestrials-built-the-pyramids-but-archaeologists-have-found-the-workers-villages-bakeries-healed-bones-graffiti-and-crew-names-and-all-t/,Space Daily Editorial Team,2026-07-16T14:15:07Z,Red Sea shipping,"The claim is familiar enough to have its own television franchise: the pyramids of Giza were too large, too precise, and too old to have been built by human hands, so someone from elsewhere must have helped. The idea was popularised by Erich von Däniken’s 196…",Space Daily,Egypt,News,2026-07-21T08:31:59.723760Z
689eea72c33c07c321f9f6488fdbadca,"Why Trump’s Hormuz toll wasn’t only unpopular, it was likely to be unenforceable - NBC News",https://slashdot.org/firehose.pl?op=view&amp;id=184479002,feedfeeder,2026-07-16T14:12:59Z,Red Sea shipping,"Why Trump’s Hormuz toll wasn’t only unpopular, it was likely to be unenforceableNBC News Controlling Hormuz Would Take More U.S. Troops—and Even More RiskWSJ Sources: Iran orders Houthis to close Red Sea gateway if US hits its power networkThe Times of Israel…",Slashdot.org,Unknown,News,2026-07-21T08:31:59.723809Z
54095698b3b3640def4a2f2b04c9a28e,Analysis-Pakistan worries about being drawn into US-Iran conflict after Houthis attack Saudi Arabia,https://www.yahoo.com/news/world/articles/analysis-pakistan-worries-being-drawn-140958867.html,"By Rick Noack, Mubasher Bukhari and Asif Shahzad",2026-07-16T14:09:58Z,Red Sea shipping,"By Rick Noack, Mubasher Bukhari and Asif Shahzad ISLAMABAD, July 16 (Reuters) - Attacks on Saudi Arabia by Yemen's Iran-aligned Houthis this week have frustr...",Yahoo Entertainment,Unknown,Analysis/Opinion,2026-07-21T08:31:59.723839Z
bc892978f709df7a2273b2eb6cf93701,Strait of Hormuz: US fires at tanker as new Iran blockade begins - BBC,https://slashdot.org/firehose.pl?op=view&amp;id=184478006,feedfeeder,2026-07-16T13:13:40Z,Red Sea shipping,"Strait of Hormuz: US fires at tanker as new Iran blockade beginsBBC EXCLUSIVE: Iran tells Houthis to close Red Sea gateway if US hits power network, sources sayReuters Inside the 24-hour sprint to convince Trump to drop his plans to toll Strait of HormuzCNN U…",Slashdot.org,Unknown,News,2026-07-21T08:31:59.723919Z
5346e5bf3d5e90e329a4413452e3aa3e,Indonesia projects July crude price at US$67-US$71 per barrel,https://en.antaranews.com/news/423293/indonesia-projects-july-crude-price-at-us67-us71-per-barrel,"Putu Indah, Raka Adji",2026-07-20T08:31:54Z,Strait of Hormuz,The Ministry of Energy and Mineral Resources projects the Indonesian Crude Price (ICP) in July 2026 to average between US$67 and US$71 per ...,Antaranews.com,Indonesia,News,2026-07-21T08:32:00.446503Z
0812095bfe59f8b0958c450ec8a0a7a1,New Mideast fighting keeps eurozone rate-setters on edge,https://www.hurriyetdailynews.com/new-mideast-fighting-keeps-eurozone-rate-setters-on-edge-224573,hurriyetdailynews.com,2026-07-20T08:27:19Z,Strait of Hormuz,Fresh fighting in the Middle East and renewed energy price rises have thrown a curveball at the European Central Bank as policymakers mull whether to hike interest rates again this week.,Hurriyet Daily News,Unknown,Market Report,2026-07-21T08:32:00.446695Z
8ae45166d0c137b6cf7f63f827ce38e8,US Bombs Iran for Ninth Day as Standoff Over Hormuz Deepens,https://financialpost.com/pmn/business-pmn/us-bombs-iran-for-ninth-day-as-standoff-over-hormuz-deepens,Bloomberg News,2026-07-20T08:21:02Z,Strait of Hormuz,"The US conducted a ninth straight day of airstrikes on Iran, trying to force the Islamic Republic to stop shipping attacks and reopen the Strait of Hormuz.",Financial Post,Unknown,News,2026-07-21T08:32:00.446729Z
251e3dd8d5f17063e15430958ef17ff7,China’s Fuel Oil Exports Hit 2026 High as Shipping Demand Rebounds,https://oilprice.com/Latest-Energy-News/World-News/Chinas-Fuel-Oil-Exports-Hit-2026-High-as-Shipping-Demand-Rebounds.html,Irina Slav,2026-07-20T08:20:00Z,Strait of Hormuz,"China exported 577,000 barrels daily of fuel oil last month, which was the most since the start of the year and an 18% increase from June 2025, Reuters reported today, citing official customs data. At the same time, overall refined products exports declined, …",OilPrice.com,China,Market Report,2026-07-21T08:32:00.446750Z
1fefc3fabc5b202fadb5eb3aca1ae2ac,U.S. Bombing Of Iran Expands As American Troops Killed And Tehran Retaliates Against Gulf States,https://www.huffpost.com/entry/us-iran-tensions-rise_n_6a5dd6cae4b063a1f5f1fb7c,HuffPost,2026-07-20T08:14:13Z,Strait of Hormuz,"Both sides have targeted civilian infrastructure relied on by millions of people, while benchmark Brent crude rose Monday above $90 a barrel.",HuffPost,USA,News,2026-07-21T08:32:00.446771Z
9caccf14330cad6f8254d03e69e12513,Iran hits out at Gulf neighbors as US presses on with strikes,https://www.vanguardngr.com/2026/07/iran-hits-out-at-gulf-neighbors-as-us-presses-on-with-strikes/,Ayobami,2026-07-20T08:13:02Z,Strait of Hormuz,"Washington and Tehran traded strikes on Monday as US deaths in the renewed fighting climbed to three and more ships came under attack in the strategic Strait of Hormuz.
The post Iran hits out at Gulf neighbors as US presses on with strikes appeared first on V…",Vanguard,Unknown,News,2026-07-21T08:32:00.446820Z
1f2d93ad2eb8d884bb70575e7c715c52,"US Military Death Toll Rises With Fatality In Iraq, Discovery Of Remains In Jordan",https://www.globalsecurity.org/military/library/news/2026/07/mil-260720-rferl01.htm,John Pike,2026-07-20T08:10:47Z,Strait of Hormuz,"US Central Command (CENTCOM) said a service member was killed following an Iranian drone attack in Iraq, adding to the two deaths disclosed earlier in Jordan, where the discovery of unidentified remains raised the possibility of a fourth fatality in the past …",Globalsecurity.org,Unknown,News,2026-07-21T08:32:00.446874Z
b8cc57a8e20e0dc7b56a1ce57a5e6140,U.S. Average Gas Price Returns to $4 a Gallon as Iran Crisis Escalates,https://biztoc.com/x/e655122dd2e9b6eb,nytimes.com,2026-07-20T08:10:32Z,Strait of Hormuz,"A month ago, drivers were enjoying some relief at the pump after the U.S. and Iran signed a deal intended to reopen the Strait of Hormuz. Now, prices are rising again.",Biztoc.com,Unknown,Market Report,2026-07-21T08:32:00.446906Z
86f069a70cb96fbbeea2257ae6e5d9d1,Brent crude jumps 14% amid US-Iran tensions disrupting oil supply routes,https://cryptobriefing.com/brent-crude-jumps-14-amid-us-iran-tensions-disrupting-oil-supply-routes/,Estefano Gomez,2026-07-20T08:02:25Z,Strait of Hormuz,"Brent crude oil prices surged 14% due to US-Iran tensions disrupting supply routes. Oil reaching a new all-time high by December 31 at 11.5% YES.
The post Brent crude jumps 14% amid US-Iran tensions disrupting oil supply routes appeared first on Crypto Briefi…",Crypto Briefing,Unknown,Market Report,2026-07-21T08:32:00.446948Z
a6d592c28c4462b90f48aa5c6ad0c03f,"Iran suspends commitments under US memorandum of understanding, and crypto markets are already feeling it",https://cryptobriefing.com/iran-halts-us-mou-crypto-impact/,Editorial Team,2026-07-20T07:58:58Z,Strait of Hormuz,"Iran suspends its commitments under the US memorandum of understanding as Bitcoin drops from $82K to below $62K and $1B in Iranian crypto assets are seized.
The post Iran suspends commitments under US memorandum of understanding, and crypto markets are alread…",Crypto Briefing,Unknown,Market Report,2026-07-21T08:32:00.447017Z
b13b824dcc936efc5d051beb63789b79,Global Market: German bond yields hit two-year high as oil surge fuels ECB rate hike bets,https://economictimes.indiatimes.com/markets/us-stocks/news/global-market-german-bond-yields-hit-two-year-high-as-oil-surge-fuels-ecb-rate-hike-bets/articleshow/132509565.cms,Anupam Nagar,2026-07-20T07:57:15Z,Strait of Hormuz,German bond yields rose as oil prices increased amid U.S.-Iran tensions. This surge strengthened expectations for the European Central Bank to tighten monetary policy. Money markets now anticipate higher deposit rates by early 2027. Traders have fully priced …,The Times of India,Germany,Market Report,2026-07-21T08:32:00.447059Z
fc3d7f063278b8dce0b14bd9a69e99e7,Iran’s interior minister visits Pakistan amid US-Iran tensions,https://cryptobriefing.com/irans-interior-minister-visits-pakistan-amid-us-iran-tensions/,Estefano Gomez,2026-07-20T07:49:51Z,Strait of Hormuz,"Iran's Interior Minister visits Pakistan amid U.S.-Iran tensions. Diplomatic meeting by August 31, 2026 at 45.5% YES.
The post Iran’s interior minister visits Pakistan amid US-Iran tensions appeared first on Crypto Briefing.",Crypto Briefing,Unknown,News,2026-07-21T08:32:00.447112Z
f683f9c0a68a7b0252dc20165feed413,US gasoline prices hit $4 per gallon amid renewed Middle East conflict,https://cryptobriefing.com/us-gasoline-prices-hit-4-per-gallon-amid-renewed-middle-east-conflict/,Estefano Gomez,2026-07-20T07:46:14Z,Strait of Hormuz,"US gasoline prices hit $4 per gallon due to Middle East conflict. Crude oil reaching a new all-time high by December 31 at 12% YES.
The post US gasoline prices hit $4 per gallon amid renewed Middle East conflict appeared first on Crypto Briefing.",Crypto Briefing,Unknown,Market Report,2026-07-21T08:32:00.447188Z
ca5c3a554a365310e2309607b5855b04,"Iran Receives Proposals From Mediators to De-Escalate Tensions With US, Cease Fire",https://sputnikglobe.com/20260720/iran-receives-proposals-from-mediators-to-de-escalate-tensions-with-us-cease-fire-1124467486.html,Sputnik International,2026-07-20T07:45:40Z,Strait of Hormuz,"MOSCOW (Sputnik) - Tehran has received proposals from mediators to de-escalate tensions with the United States and cease fire, Iranian Foreign Ministry spokesman Esmail Baghaei said on Monday.",Sputnikglobe.com,USA,News,2026-07-21T08:32:00.447209Z
476fe7c534fbabe7073ec4f975c010bb,US deploys 100 refueling tankers to Israel amid Iran conflict escalation,https://cryptobriefing.com/us-deploys-100-refueling-tankers-to-israel-amid-iran-conflict-escalation/,Estefano Gomez,2026-07-20T07:43:13Z,Strait of Hormuz,"US deploys 100 refueling tankers to Israel amid Iran conflict escalation. Iran reconstruction funding in a US-Iran deal by 2026 at 26.5% YES.
The post US deploys 100 refueling tankers to Israel amid Iran conflict escalation appeared first on Crypto Briefing.",Crypto Briefing,Unknown,News,2026-07-21T08:32:00.447250Z
6fd6bd6f322711e06757af8edc491e61,Iran war live: Trump ‘planning for wider war’ with Tehran,https://biztoc.com/x/81b28f6a525ac4b7,independent.co.uk,2026-07-20T07:40:40Z,Strait of Hormuz,"The United States is said to be preparing for greater escalation with Iran following days of strikes as both sides wrestle for control of the Strait of Hormuz.
An American official familiar with internal discussions told the Washington Post that the US is sti…",Biztoc.com,USA,News,2026-07-21T08:32:00.447278Z
c5dd8f88601bfede1fde49e1b45f2c35,"Banking rout deepens: Sensex tumbles 718 points, Nifty below 24,200 as HDFC Bank, Axis bleed",https://www.thehindubusinessline.com/markets/banking-rout-deepens-sensex-tumbles-718-points-nifty-below-24200-as-hdfc-bank-axis-bleed/article71244236.ece,BL Mumbai Bureau,2026-07-20T07:36:14Z,Strait of Hormuz,"Axis Bank was the worst performer on the Nifty50, crashing ₹75.60 or 5.69% to ₹1,252.90 on heavy volume of over 1.81 crore shares worth ₹2,29,489.21 lakh",BusinessLine,Unknown,News,2026-07-21T08:32:00.447360Z
65e4ad6bbbc287a66a65f3c0154a6551,"Iran live updates: Kuwait attacked, Bahrain sounds sirens after night of US strikes",https://abcnews.com/International/live-updates/iran-live-updates-kuwait-attacked-bahrain-sounds-sirens/?id=134907987,David Brennan,2026-07-20T07:30:53Z,Strait of Hormuz,"President Donald Trump announced ""major combat operations"" against Iran on Feb. 28, with massive joint U.S.-Israeli strikes.",Abcnews.com,Unknown,News,2026-07-21T08:32:00.447393Z
91ce3fbd33c08ca4085cdf5b431ef441,Ryanair profits drop as Iran war puts off passengers and lifts fuel costs,https://www.bbc.co.uk/news/articles/cn8nldwj12jo,https://www.facebook.com/bbcnews,2026-07-20T07:26:56Z,Strait of Hormuz,The Irish airline said oil prices had increased costs meanwhile Brent crude surpassed $90.,BBC News,Unknown,Market Report,2026-07-21T08:32:00.447419Z
4c4980f08839c753446ebe07dba47a0a,US strikes Iran for ninth day; Iran says two oil tankers in Strait of Hormuz exploded and immobilised - Reuters,https://slashdot.org/firehose.pl?op=view&amp;id=184518362,feedfeeder,2026-07-20T07:12:34Z,Strait of Hormuz,US strikes Iran for ninth day; Iran says two oil tankers in Strait of Hormuz exploded and immobilisedReuters Iran vows not a ‘single drop’ of oil or gas will pass strait of Hormuz as US carries out ninth night of strikes – Middle East crisis liveThe Guardian …,Slashdot.org,Unknown,News,2026-07-21T08:32:00.447468Z
c768d0f4e0c713336e0ac5fdf49f204f,LNG Shipments Through Strait of Hormuz Grind to a Halt as Conflict Escalates,https://oilprice.com/Latest-Energy-News/World-News/LNG-Shipments-Through-Strait-of-Hormuz-Grind-to-a-Halt-as-Conflict-Escalates.html,Irina Slav,2026-07-20T07:10:00Z,Strait of Hormuz,"Exports of liquefied natural gas via the Strait of Hormuz appear to have ground to a halt over the past three days, data from tanker-tracking firms have suggested, while oil tanker traffic has shrunk considerably, Reuters reported today. ING analysts, meanwhi…",OilPrice.com,Unknown,Market Report,2026-07-21T08:32:00.447513Z
b3713ed087c8b39f39c2f1c887d90d4a,Trump says US strikes hit Iran in 'honour' of American soldiers killed,https://www.bbc.com/news/articles/cly52xzjd3qo,Lana Lam,2026-07-20T06:34:47Z,Strait of Hormuz,"Iran responded with attacks in Syria and Jordan, as two ships reportedly exploded in the Strait of Hormuz.",BBC News,USA,Market Report,2026-07-21T08:32:00.447575Z
8009fdaf1d444d41fe5da6f16e638210,Relieved that crude has finally fallen? The real warning signs just began flashing elsewhere,https://economictimes.indiatimes.com/industry/energy/oil-gas/relieved-that-crude-has-finally-fallen-the-real-warning-signs-just-began-flashing-elsewhere/articleshow/132507570.cms,Reuters,2026-07-20T06:32:21Z,Strait of Hormuz,"As the Iran crisis enters ​its fifth month, traders have become increasingly convinced that Trump will do almost anything to avoid a politically damaging spike in U.S. fuel prices. But the bright flashing warning signs coming out of the refining system sugges…",The Times of India,Unknown,Market Report,2026-07-21T08:32:00.447636Z
d5cdb4330fb6f43e825219154a41851b,Trump says US strikes hit Iran in 'honour' of American soldiers killed,https://www.bbc.co.uk/news/articles/cly52xzjd3qo,https://www.facebook.com/bbcnews,2026-07-20T06:31:55Z,Strait of Hormuz,"Iran responded with attacks in Syria and Jordan, as two ships reportedly exploded in the Strait of Hormuz.",BBC News,USA,Market Report,2026-07-21T08:32:00.447651Z
1d1f41c4d9ae8e1eab4402a3e71637fc,"Oil jumps 3% as US, Iran expand strikes in Middle East",https://www.rte.ie/news/business/2026/0720/1584139-world-oil-prices/,RTÉ News,2026-07-20T06:26:30Z,Strait of Hormuz,"Oil prices jumped about 3% today, with Brent oil prices surpassing $90 per barrel, as escalating US-Iran hostilities in the Middle East restricted oil shipments through the Strait of Hormuz.",RTE,Unknown,Market Report,2026-07-21T08:32:00.447705Z
a043acdf9af4fd24bb77cbfe04a1c9c3,Plenty of volatility affecting NZ sharemarket – Market close,https://www.nzherald.co.nz/business/markets/shares/plenty-of-volatility-affecting-nz-sharemarket-market-close/premium/BBUCSGTG2JEZDMNKAQSU36CZ44/,Graham Skellern,2026-07-20T06:26:17Z,Strait of Hormuz,"The S&P/NZX50 Index closed at 13,696.03 – up 1.35 points or 0.01%.",New Zealand Herald,Unknown,Market Report,2026-07-21T08:32:00.447733Z
9c8f84f4d9b487202bb9e8740c38e7d7,"Global Markets: Stocks unsettled as oil climbs, earnings loom for AI",https://www.thehindubusinessline.com/markets/global-markets-stocks-unsettled-as-oil-climbs-earnings-loom-for-ai/article71243989.ece,Reuters,2026-07-20T06:25:30Z,Strait of Hormuz,"Brent crude climbed above $90 a barrel ⁠for the first time in more than a month as the U.S. military started a ninth straight day of attacks against Iran, which in turn struck targets across the region",BusinessLine,Global,Market Report,2026-07-21T08:32:00.447774Z
73b74f71a2648757a1ceb0b8e6535123,Bahrain intercepts Iranian attacks amid ongoing US-Iran conflict,https://cryptobriefing.com/bahrain-intercepts-iranian-attacks-amid-ongoing-us-iran-conflict/,Estefano Gomez,2026-07-20T06:18:39Z,Strait of Hormuz,"Bahrain intercepts Iranian attacks amid US-Iran conflict. Iranian military action against a Gulf state on July 22 at 63.5% YES.
The post Bahrain intercepts Iranian attacks amid ongoing US-Iran conflict appeared first on Crypto Briefing.",Crypto Briefing,Unknown,News,2026-07-21T08:32:00.447815Z
342bb4d0ee1c4de69b3a53710a52b48c,"Iran launches missiles, drones targeting Gulf nations amid escalating tensions",https://cryptobriefing.com/iran-launches-missiles-drones-targeting-gulf-nations-amid-escalating-tensions/,Estefano Gomez,2026-07-20T06:18:28Z,Strait of Hormuz,"Iran launches missiles and drones targeting Gulf nations. Military action against a Gulf state by July 22 at 63.5% YES.
The post Iran launches missiles, drones targeting Gulf nations amid escalating tensions appeared first on Crypto Briefing.",Crypto Briefing,Unknown,News,2026-07-21T08:32:00.447857Z
100521708cfd1e28925c5b083ac791bb,"US military attack in Tabriz kills one, injures several: Iran International",https://cryptobriefing.com/us-military-attack-in-tabriz-kills-one-injures-several-iran-international/,Estefano Gomez,2026-07-20T06:17:32Z,Strait of Hormuz,"US military attack in Tabriz kills one and injures several. US invasion of Iran before 2027 at 30.5% YES.
The post US military attack in Tabriz kills one, injures several: Iran International appeared first on Crypto Briefing.",Crypto Briefing,Global,News,2026-07-21T08:32:00.447896Z
bb6648cc811f0ee0572a87e5e9560465,US strikes on Iran expand as Tehran lashes out,https://www.hurriyetdailynews.com/us-strikes-on-iran-expand-as-tehran-lashes-out-224563,hurriyetdailynews.com,2026-07-20T06:08:37Z,Strait of Hormuz,"The United States carried out a ninth consecutive night of airstrikes on Iran early on July 20 after announcing the death of another American service member, while Tehran retaliated against Bahrain and Kuwait and claimed an attack in Syria.",Hurriyet Daily News,USA,News,2026-07-21T08:32:00.447917Z
9cb8354ff6eff0a5e780ef21233b1e52,U.S. Strikes Civilian Infrastructure in Iran; Tehran Retaliates Against Gulf Bases,https://www.naturalnews.com/2026-07-20-us-strikes-civilian-infrastructure-iran-tehran-retaliates.html,Garrison Vance,2026-07-20T06:00:00Z,Strait of Hormuz,"U.S. President Donald Trump ordered airstrikes against civilian infrastructure in Iran overnight Thursday, July 16, according to Iranian officials. The strikes targeted multiple bridges, a railway, a maritime watchtower, and energy sites, the Iranian governme…",Naturalnews.com,Unknown,News,2026-07-21T08:32:00.448012Z
05f395976ecaef8f597bdb5be3ba0bde,Global Nuclear Fusion Investments Reach Record $4.48 Billion in 2025,https://www.naturalnews.com/2026-07-20-global-nuclear-fusion-investments-reach-record-high-2025.html,Edison Reed,2026-07-20T06:00:00Z,Strait of Hormuz,"Global Nuclear Fusion Investments Surge to Record High in 2025 Private investment in nuclear fusion reached a record level in 2025, according to the Fusion Industry Association (FIA). The surge is driven by rising electricity demand from AI data centers and g…",Naturalnews.com,Global,News,2026-07-21T08:32:00.448059Z
f1c3c4c40fb01603bdf111aa423b1b5d,Saronic Technologies Plans $3.2 Billion Shipyard in Texas to Mass-Produce Autonomous Vessels,https://www.naturalnews.com/2026-07-20-saronic-technologies-shipyard-texas-mass-produce-autonomous-vessels.html,Garrison Vance,2026-07-20T06:00:00Z,Strait of Hormuz,"Saronic Technologies, an Austin-based company specializing in maritime drones, is building a $3.2 billion shipyard at the Port of Brownsville, Texas, to manufacture medium- and large-class autonomous surface vessels for the U.S. military. According to a Bloom…",Naturalnews.com,Unknown,News,2026-07-21T08:32:00.448108Z
b41d1d7573f39694f5ea279d5919091a,CNBC Survey: Majority Pessimistic on Economy; Trump Approval Remains Low,https://www.naturalnews.com/2026-07-20-cnbc-pessimistic-on-economy-trump-approval-low.html,Sterling Ashworth,2026-07-20T06:00:00Z,Strait of Hormuz,"A majority of registered voters are pessimistic about the economy, with the highest level of gloom seen since the end of 2023, according to the latest CNBC All-America Economic Survey released July 17. The survey of 1,000 registered voters nationwide, with a …",Naturalnews.com,USA,News,2026-07-21T08:32:00.448164Z
cfa04933339bcccaed81cf1462674f94,Oil hits $90 as US-Iran tensions threaten Strait of Hormuz shipments,https://cryptobriefing.com/oil-hits-90-as-us-iran-tensions-threaten-strait-of-hormuz-shipments/,Estefano Gomez,2026-07-20T05:56:03Z,Strait of Hormuz,"Oil prices rise to $90 amid US-Iran tensions. Crude oil reaching a new all-time high by December 31 at 14.5% YES.
The post Oil hits $90 as US-Iran tensions threaten Strait of Hormuz shipments appeared first on Crypto Briefing.",Crypto Briefing,Unknown,Market Report,2026-07-21T08:32:00.448264Z
21b341dde59c28d0d00ce513426c36c4,US carries out ninth day of airstrikes on Iran after death of soldier,https://www.thejournal.ie/us-iran-strikes-soldier-killed-7107719-Jul2026/,Press Association,2026-07-20T05:51:46Z,Strait of Hormuz,US military officials said the service member was killed in Iraq on Saturday during the “controlled detonation” of a downed Iranian drone.,TheJournal.ie,Unknown,News,2026-07-21T08:32:00.448302Z
54632fd1da80c7a2e8bf007a9bcd1f52,Explosions in Manama amid Iran-US tensions escalate in Gulf,https://cryptobriefing.com/explosions-in-manama-amid-iran-us-tensions-escalate-in-gulf/,Estefano Gomez,2026-07-20T05:50:15Z,Strait of Hormuz,"Explosions reported in Manama amid rising Iran-US tensions. Military action by Iran against a Gulf state on July 22 at 63.5% YES.
The post Explosions in Manama amid Iran-US tensions escalate in Gulf appeared first on Crypto Briefing.",Crypto Briefing,Unknown,Market Report,2026-07-21T08:32:00.448340Z
c5d742004b098e769ce75ccc8f7bec7a,Gulf Oil Exports Briefly Recovered to Pre-War Levels Before Latest Escalation,https://oilprice.com/Latest-Energy-News/World-News/Gulf-Oil-Exports-Briefly-Recovered-to-Pre-War-Levels-Before-Latest-Escalation.html,Irina Slav,2026-07-20T05:47:37Z,Strait of Hormuz,"Crude oil and condensate exports from the Persian Gulf rose to pre-war levels in the first half of July, data from Kpler and Vortexa shows, as cited by Reuters, reaching between 12 and 13.6 million barrels daily. The recovery is unlikely to last, however, as …",OilPrice.com,Unknown,Market Report,2026-07-21T08:32:00.448383Z
8ee8b972327c7ce0d641113f26039fde,Oil Surges Past $90 a Barrel,https://www.newser.com/story/393121/oil-surges-past-90-a-barrel.html,Evann Gastaldo with Newser.AI,2026-07-20T05:30:00Z,Strait of Hormuz,"Oil just jumped back into uncomfortable territory, Axios reports. Brent crude surged past $90 a barrel on Sunday for the first time since mid-June as violence in the Middle East intensified and tanker traffic through the Strait of Hormuz thinned again. The mo…",Newser,Unknown,Market Report,2026-07-21T08:32:00.448424Z
3d42c5f99c95305d529103387423f640,US carries out another round of air strikes on Iran after death of soldier,https://www.irishtimes.com/world/middle-east/2026/07/20/us-carries-out-another-round-of-air-strikes-on-iran-after-death-of-soldier/,,2026-07-20T05:23:57Z,Strait of Hormuz,"Tehran responds by launching an attack targeting Bahrain, home of the US navy’s fifth fleet",The Irish Times,Unknown,News,2026-07-21T08:32:00.448458Z
dc888ed4c3aba1a6c5a2e50f973c1256,Fidan urges return to US-Iran memorandum,https://www.hurriyetdailynews.com/fidan-urges-return-to-us-iran-memorandum-224555,hurriyetdailynews.com,2026-07-20T05:22:56Z,Strait of Hormuz,"Foreign Minister Hakan Fidan has called for a return to the memorandum of understanding between the United States and Iran, saying Türkiye and Qatar are coordinating closely to revive diplomatic efforts and contain regional instability.",Hurriyet Daily News,USA,News,2026-07-21T08:32:00.448482Z
b790992c299f9c1ce2e326be8f6e2d58,"US-Iran tensions push Brent crude to $90, dollar strengthens",https://cryptobriefing.com/us-iran-tensions-push-brent-crude-to-90-dollar-strengthens/,Estefano Gomez,2026-07-20T05:03:28Z,Strait of Hormuz,"Brent crude prices surge to $90 amid US-Iran tensions. WTI reaching $110 by July 2026 at 4.8% YES.
The post US-Iran tensions push Brent crude to $90, dollar strengthens appeared first on Crypto Briefing.",Crypto Briefing,Unknown,Market Report,2026-07-21T08:32:00.448513Z
35d585afdea6cb515124d3ac971514df,US strikes Iran for ninth day; Iran says two oil tankers in Strait of Hormuz exploded and immobilised,https://biztoc.com/x/0a926c903d4a98c5,yahoo.com,2026-07-20T04:53:04Z,Strait of Hormuz,"By Nayera Abdallah, Eman Abouhassira and Enas Alashray
DUBAI/CAIRO, July 20 (Reuters) - U.S. forces hit Iran for a ninth consecutive day on Monday as concerns grew over shipping through the Strait of Hormuz after Iran said two oil tankers had exploded and bee…",Biztoc.com,Unknown,News,2026-07-21T08:32:00.448561Z
