article_id,title,link,creator,pubdate,category,description,source,country,article_type,scrape_timestamp
d43f3d4c4ee3d9fde61f61675941d329,"Military Electro-Optical and Infrared Systems Market Size to Reach USD 13.51 Billion by 2035, Driven by Defense Modernization and Rising ISR Demand – SNS Insider",https://www.globenewswire.com/news-release/2026/01/29/3228222/0/en/Military-Electro-Optical-and-Infrared-Systems-Market-Size-to-Reach-USD-13-51-Billion-by-2035-Driven-by-Defense-Modernization-and-Rising-ISR-Demand-SNS-Insider.html,SNS Insider pvt ltd,2026-01-29T08:00:00Z,maritime transport,"Global Military EO/IR Systems Market to Expand at 4.52% CAGR as Armed Forces Invest in Advanced Surveillance, Targeting, and Night-Vision Capabilities Global Military EO/IR Systems Market to Expand at 4.52% CAGR as Armed Forces Invest in Advanced Surveillance…",GlobeNewswire,Global,Market Report,2026-02-04T06:56:15.074639Z
39014ad0e4cfda273f6f8a02e962f0b1,"Steady growth in Brunei's conventional cargo, cruise passenger numbers",https://www.thestar.com.my/aseanplus/aseanplus-news/2026/01/29/steady-growth-in-brunei039s-conventional-cargo-cruise-passenger-numbers,The Star Online,2026-01-29T04:17:00Z,maritime transport,"BANDAR SERI BEGAWAN: ""We are beginning to see a steady growth in conventional cargo and cruise passenger numbers,"" Minister of Transport and Infocommunications Datuk Seri Setia Shamhary Datuk Paduka Mustapha said. Read full story",The Star Online,Unknown,News,2026-02-04T06:56:15.074682Z
2390c0a42d799a6d39db09e2feccae79,India-EU FTA not a zero sum deal but a win-win deal: Piyush Goyal tells Jairam Ramesh,https://economictimes.indiatimes.com/news/politics-and-nation/india-eu-fta-not-a-zero-sum-deal-but-a-win-win-deal-piyush-goyal-tells-jairam-ramesh/articleshow/127730835.cms,ET Bureau,2026-01-28T19:40:19Z,maritime transport,India and the European Union have concluded Free Trade Agreement negotiations. Commerce Minister Piyush Goyal addressed concerns regarding the Carbon Border Adjustment Mechanism and the automotive sector. The agreement aims to boost 'Make in India' initiative…,The Times of India,India,News,2026-02-04T06:56:15.074723Z
dc03d9e19c5eaf07a6a997cf03d4b697,"Defense Logistics Market Forecast and Company Analysis 2025-2033 Featuring FedEx, Maritime Logistics, Aero Cargo, Scan Global, CargoTrans, CEVA, Kuehne+Nagel, Deutsche Post, A.P. Moller-Maersk, SEKO",https://www.globenewswire.com/news-release/2026/01/28/3227887/28124/en/Defense-Logistics-Market-Forecast-and-Company-Analysis-2025-2033-Featuring-FedEx-Maritime-Logistics-Aero-Cargo-Scan-Global-CargoTrans-CEVA-Kuehne-Nagel-Deutsche-Post-A-P-Moller-Mae.html,Research and Markets,2026-01-28T16:18:00Z,maritime transport,"The Defense Logistics Market is set to reach USD 286.33 billion by 2033, rising from USD 174.05 billion in 2025, with a 6.42% CAGR. Key growth drivers include geopolitical tensions, military modernization, and rapid technological advancement. Incorporating AI…",GlobeNewswire,Global,Analysis/Opinion,2026-02-04T06:56:15.074773Z
ff19ae5acfa639b46772945d3ff4a0c4,Biomimetic marine life research centre among projects from Ajman University,https://www.dezeen.com/2026/01/28/biomimetic-marine-life-research-centre-among-projects-from-ajman-university/,Dezeen staff,2026-01-28T16:00:11Z,maritime transport,"Dezeen School Shows: a marine life research centre featuring algae-infused skylights is among the projects from Ajman University. Also featured is an art museum inspired by the ""fluid forms of nature"" and a hotel designed with mashrabiyas, a characteristic of…",Dezeen,Unknown,News,2026-02-04T06:56:15.074827Z
409f95b19f68f8ef28e92600d81a0dcd,"Defense Logistics Market to Surge from $455.22 Billion in 2026 to $648.4 Billion by 2030 - Analysis by Type of Logistics, Technology Used, Mode of Transportation, Application, End-user and Region",https://www.globenewswire.com/news-release/2026/01/28/3227824/28124/en/Defense-Logistics-Market-to-Surge-from-455-22-Billion-in-2026-to-648-4-Billion-by-2030-Analysis-by-Type-of-Logistics-Technology-Used-Mode-of-Transportation-Application-End-user-and.html,Research and Markets,2026-01-28T15:32:00Z,maritime transport,"Dublin, Jan. 28, 2026 (GLOBE NEWSWIRE) -- The ""Defense Logistics Market Report 2026"" has been added to ResearchAndMarkets.com's offering.The defense logistics market is on a robust growth trajectory, reflecting increasing global demand for sophisticated milit…",GlobeNewswire,Global,Analysis/Opinion,2026-02-04T06:56:15.074876Z
75b15817b0b9c4a7f5b608fdef388ce9,"Train strikes have been called for the London Overground next month: dates, impacted lines and what you need to know",https://www.timeout.com/london/news/train-strikes-have-been-called-for-the-london-overground-next-month-dates-impacted-lines-and-what-you-need-to-know-012826,Primary Author: Amy Houghton,2026-01-28T11:33:45Z,maritime transport,Signallers and telecom staff on the Overground will walk out on three days over the next three months,Time Out,UK,News,2026-02-04T06:56:15.074911Z
d0e58c0196554cc2b43d746797123e3d,Towards 2030: A Joint European Union-India Comprehensive Strategic Agenda,https://www.globalsecurity.org/wmd/library/news/india/2026/india-260127-european-commission04.htm,John Pike,2026-01-28T10:29:53Z,maritime transport,"This Joint EU-India Comprehensive Strategic Agenda, endorsed at the 16th EU-India Summit held on 27 January 2026 in New Delhi, aims to further reinforce the strategic partnership by broadening, deepening and better coordinating EU-India cooperation to deliver…",Globalsecurity.org,India,News,2026-02-04T06:56:15.074939Z
d05314c50d6777d09605ebebe9014f97,"GAIL, K LINE & J M Baxi collaborate to own equity in shipping firm",https://www.thehindubusinessline.com/economy/logistics/gail-k-line-j-m-baxi-collaborate-to-own-equity-in-shipping-firm/article70560258.ece,BL New Delhi Bureau,2026-01-28T09:07:43Z,maritime transport,GAIL has signed a long-term charter with the ship-owning company starting from 2027. The LNG vessel is currently under construction in a Korean Shipyard,BusinessLine,South Korea,News,2026-02-04T06:56:15.074967Z
b8274385d9dc2855429ee21a637a100f,"Budget 2026: A time for higher growth, quality jobs and global competitiveness",https://economictimes.indiatimes.com/news/economy/policy/budget-2026-a-time-for-higher-growth-quality-jobs-and-global-competitiveness/articleshow/127688305.cms,Sumita Dawra,2026-01-28T08:01:57Z,maritime transport,"Union Budget 2026: The upcoming budget holds immense potential for boosting economic growth.  The India-EU Free Trade Agreement and ongoing reforms offer a strong foundation.  Focus areas include transforming rural economies, strengthening manufacturing, enab…",The Times of India,India,News,2026-02-04T06:56:15.074995Z
b12a035e72dea4f5b0352da23b27c090,ONGC shares jump 6% after JV signs shipbuilding deal with Samsung Heavy Industries,https://economictimes.indiatimes.com/markets/stocks/news/ongc-shares-jump-6-after-jv-signs-shipbuilding-deal-with-samsung-heavy-industries/articleshow/127680771.cms,Ritesh Presswala,2026-01-28T05:51:24Z,maritime transport,"ONGC shares rose nearly 6% after its joint venture with Mitsui O.S.K. Lines signed shipbuilding contracts with Samsung Heavy Industries for two ethane carriers, strengthening energy logistics for OPaL and reinforcing bullish valuation and technical indicators.",The Times of India,Unknown,News,2026-02-04T06:56:15.075042Z
53ca8c11517c61e542d3a695d229c97e,Ports: National planning enters the final phase,https://www.naftemporiki.gr/english/2064803/ports-national-planning-enters-the-final-phase/,Γιάννα Βαρδαλαχάκη,2026-01-28T05:15:55Z,maritime transport,"The strategic planning for Greek ports and marinas is entering a crucial phase, with the Growthfund preparing to announce the contractor for the holistic study for the entire port portfolio…
Ports: National planning enters the final phase - Η ΝΑΥΤΕΜΠΟΡΙΚΗ",Naftemporiki.gr,Greece,News,2026-02-04T06:56:15.075088Z
fbb9de342765e150635a21eab81014fb,ONGC shares surge over 6% after signing shipbuilding contracts with Samsung,https://www.thehindubusinessline.com/markets/stock-markets/ongc-shares-surge-over-6-after-signing-shipbuilding-contracts-with-samsung/article70559431.ece,BL Mumbai Bureau,2026-01-28T05:02:34Z,maritime transport,"Through joint ventures with Japan’s Mitsui O.S.K. Lines, ONGC will own and operate the vessels, each with a cargo capacity of 100,000 cubic meters, to transport 600 KTPA of ethane for subsidiary OPaL from the US to India.",BusinessLine,India,News,2026-02-04T06:56:15.075114Z
4ce98ac287e585321372c58be5b55a34,"Top Business & Market Headlines Today — BL Morning Report, January 28, 2026",https://www.thehindubusinessline.com/multimedia/audio/top-business-amp-market-headlines-today-bl-morning-report-january-28-2026/article70557682.ece,Renil  S Varghese,2026-01-28T01:00:00Z,maritime transport,"Welcome to The morning report brought to you by Renil S Varghese — your quick dive into the top stories shaping the business world today. Fast, insightful, and to the point. Check out the top news for the day.",BusinessLine,Unknown,Analysis/Opinion,2026-02-04T06:56:15.075156Z
23c3031e86e6a8073edb6d20e2432957,"Indo-EU joint statement: Underlining a green, clean drive to decarbonisation",https://economictimes.indiatimes.com/news/india/indo-eu-joint-statement-underlining-a-green-clean-drive-to-decarbonisation/articleshow/127664984.cms,Anubhuti Vishnoi,2026-01-28T00:44:19Z,maritime transport,"India-EU FTA: India and the European Union are strengthening ties through a comprehensive strategic agenda. This partnership prioritises sustainable development, clean technology and green initiatives. Key areas include renewable energy, green hydrogen and cl…",The Times of India,India,News,2026-02-04T06:56:15.075186Z
c17c8fa5830c3e98640723c7df0d043a,"Facing US turmoil, Europe and India have clinched a blockbuster trade deal",https://syndication.washingtonpost.com/nss/stories/CYNL2JC4VNCPNA5VZJRO5KORR4,"Ellen Francis, Karishma Mehrotra",2026-01-28T00:16:58Z,maritime transport,The pact was years in the making but has importance now amid economic and political change,The Washington Post,India,News,2026-02-04T06:56:15.075203Z
7847b122a226d9b25453d252c007789e,"Q3 Results Today Live: Bajaj Finance, Adani Ports, Adani Enterprises, Solar Ind, Pidilite Ind, Aether Ind, AWL Agri, Bharat Coking Coal to announce Q3 results, Hyundai Motor, Sundaram Finance, PB Fintech, Bajaj Housing Finance, RailTel, Thermax shares in focus",https://www.thehindubusinessline.com/markets/stock-markets/q3-results-today-live-updates-bajaj-finance-adani-ports-adani-enterprises-solar-ind-pidilite-awl-agri-nmdc-bharat-coking-dr-agarwals-hyundai-results-03-feb-2026/article70582678.ece,"Team BL, KS Badri Narayanan",2026-02-03T03:59:49Z,cargo shipping,"Q3 Results Today, 03rd Feb 2026 Live Updates: Find all the latest Q3 results 2026 updates of Bajaj Finance, Adani Ports and Special Economic Zone, Adani Enterprises, Varun Beverages, Pidilite Industries, Solar Industries India, Aditya Birla Capital, Mankind P…",BusinessLine,India,News,2026-02-04T06:56:15.446247Z
dd8252ffa244e1ebc4cc6127845a4030,DARPA taps Raytheon for new maritime defense system,https://www.spacewar.com/reports/DARPA_taps_Raytheon_for_new_maritime_defense_system_999.html,,2026-02-03T03:54:45Z,cargo shipping,"Los Angeles CA (SPX) Feb 03, 2026


Raytheon, an RTX business, has been selected by the US Defense Advanced Research Projects Agency to develop an advanced sensing and targeting system to protect commercial shipping and naval logistics vessels from emerging m…",Spacewar.com,Unknown,News,2026-02-04T06:56:15.446312Z
b65340ea0330d606b10aafc849c07441,U.S. Applauds Ruling Against China Contracts at Panama Canal,https://www.breitbart.com/latin-america/2026/02/02/u-s-applauds-ruling-against-china-contracts-at-panama-canal/,Christian K. Caruzo,2026-02-02T23:14:05Z,cargo shipping,"U.S. Ambassador to Panama Kevin Cabrera over the weekend emphasized in an official statement that the recent ruling from Panama's Supreme Court nullifying two Canal port contracts awarded to a China-linked company strongly affirms the rule of law.
The post U.…",Breitbart News,China,News,2026-02-04T06:56:15.446336Z
1bab2e8baed0f03303e9b46389cb5712,"""They're lining up six hours before the show. They just scream when you go out on stage as if it's Beatlemania."" Nine Inch Nails and Korn love them and they might have invented metal's sleaziest subgenre. This is the story of Health",https://www.loudersound.com/bands-artists/theyre-lining-up-six-hours-before-the-show-they-just-scream-when-you-go-out-on-stage-as-if-its-beatlemania-nine-inch-nails-and-korn-love-them-and-they-might-have-invented-metals-sleaziest-subgenre-this-is-the-story-of-health,Steve Appleford,2026-02-02T18:17:18Z,cargo shipping,"""They're lining up six hours before the show. They just scream when you go out on stage as if it's Beatlemania."" Nine Inch Nails and Korn love them and they might have invented metal's sleaziest subgenre. This is the story of Health",Louder,Unknown,News,2026-02-04T06:56:15.446392Z
14677c3c390a877c2072fab8e44a46f7,"Union Budget 2026: Building confidence, capacity and the next growth chapter",https://economictimes.indiatimes.com/markets/stocks/news/union-budget-2026-building-confidence-capacity-and-the-next-growth-chapter/articleshow/127858857.cms,ET CONTRIBUTORS,2026-02-02T09:56:51Z,cargo shipping,"Union Budget 2026 outlines a confident and fiscally disciplined growth roadmap, with emphasis on sunrise sectors, infrastructure, digital capacity and inclusive development. The Budget aims to deepen capital markets, strengthen manufacturing, empower women en…",The Times of India,Unknown,Market Report,2026-02-04T06:56:15.446523Z
20daa913f73b2fe81158091c9b6bccde,"Union Budget 2026: Water, road connectivity get on cleaner, faster lane",https://timesofindia.indiatimes.com/business/india-business/union-budget-2026-water-road-connectivity-gets-on-cleaner-faster-lane/articleshow/127853791.cms,Team TOI,2026-02-02T06:05:23Z,cargo shipping,"India Business News: Govt on Sunday unveiled a series of announcements to boost inland waterways and increase the share of cargo transport by coastal shipping, aiming to r.",The Times of India,India,News,2026-02-04T06:56:15.446545Z
11d9b2922b4ccc02813b5a9436b74c42,Lee Men's Extreme Motion Carolina Cargo Short (Various Colors/Sizes) $14.90 + Free Shipping w/ Prime or on $35+ (1 replies),https://slickdeals.net/f/19162981-lee-men-s-extreme-motion-carolina-cargo-short-various-colors-sizes-14-90-free-shipping-w-prime-or-on-35,Rokket | Staff,2026-02-01T19:43:52Z,cargo shipping,"Amazon [amazon.com] has Lee Men's Extreme Motion Carolina Cargo Short (Various Colors/Sizes) on sale for $14.90. Shipping is free w/ Prime or on $35+.

Available Colors:Gray Ripstop
Bourbon
Nativ",Slickdeals.net,Unknown,News,2026-02-04T06:56:15.446587Z
f3a94d601d931817e1280c4c6788ad91,"Budget 2026 puts India on a new course with Rs 10,000 crore for containers & waterways",https://economictimes.indiatimes.com/industry/transportation/shipping-/-transport/budget-2026-puts-india-on-a-new-course-with-rs-10000-crore-for-containers-waterways/articleshow/127846445.cms,ET TEAM,2026-02-01T18:06:19Z,cargo shipping,India plans to launch 20 inland waterways and boost local container manufacturing. A new scheme will support coastal cargo movement. This aims to reduce empty container imports and promote domestic production. Initiatives will also incentivize shifting cargo …,The Times of India,India,News,2026-02-04T06:56:15.446618Z
9b020e8c43f91a040e859f8b727dc6f5,"Budget FY27 gives boost to high-speed, multimodal infra creation",https://www.thehindubusinessline.com/economy/budget/budget-fy27-gives-boost-to-high-speed-multimodal-infra-creation/article70579391.ece,Rohit  Vaid,2026-02-01T14:59:10Z,cargo shipping,"The FY27 budget allocates ₹12.2 lakh crore to enhance high-speed, multimodal infrastructure across roads, railways, and waterways.",BusinessLine,Unknown,News,2026-02-04T06:56:15.446703Z
4b7748a471bce130e439ffccb54c30a0,Small modular nuclear reactors could cut commercial shipping emissions,https://newatlas.com/marine/heavy-duty-ships-nuclear-cut-emissions/,David Szondy,2026-02-01T14:03:00Z,cargo shipping,Nuclear power isn't just for naval ships anymore as demonstrated by the Nuclear Propulsion in merchant Shipping (NuProShip II) project led by the Norwegian University of Science and Technology which is looking at fitting nuclear reactors to heavy-duty commerc…,New Atlas,Norway,News,2026-02-04T06:56:15.446751Z
13458b4b5b12675e0bd3bd9f416caceb,Twenty new national waterways to boost sustainable cargo movement,https://www.thehindubusinessline.com/economy/budget/twenty-new-national-waterways-to-boost-sustainable-cargo-movement/article70578299.ece,Rohit  Vaid,2026-02-01T13:14:08Z,cargo shipping,Government focuses on NW-5 in Odisha to link mineral hubs with major ports; initiates skill development and ship repair ecosystems,BusinessLine,Unknown,News,2026-02-04T06:56:15.446820Z
b6158706faca85f7a259b6be1100b7cd,Reliance to gain as Trump signals resumption of India–Venezuela oil trade,https://economictimes.indiatimes.com/industry/energy/oil-gas/reliance-to-gain-as-trump-signals-resumption-of-indiavenezuela-oil-trade/articleshow/127840899.cms,Sanjeev Choudhary,2026-02-01T12:00:05Z,cargo shipping,India may soon resume buying Venezuelan oil. US President Donald Trump has indicated a deal is in concept. This move could significantly benefit Reliance Industries and state-run refiners like Indian Oil. Venezuelan crude offers attractive pricing and refinin…,The Times of India,India,News,2026-02-04T06:56:15.446853Z
93c6522415cc9f7c2d4b037618a9aa9c,"Budget 2026: Who gains or loses in India infrastructure push, derivatives tax?",https://economictimes.indiatimes.com/news/economy/policy/who-gains-or-loses-in-india-infrastructure-push-derivatives-tax/articleshow/127838523.cms,ET Online,2026-02-01T09:47:06Z,cargo shipping,India's federal budget unveils a massive $133 billion investment for infrastructure and manufacturing. The plan aims to boost sectors from textiles to electronics. Taxes on equity futures are increased to curb speculation. The budget focuses on economic resil…,The Times of India,India,News,2026-02-04T06:56:15.446882Z
71b6d7cef02d80d95ad8b860cd3a2ce3,"Budget 2026: FM Announces Rs 10,000 Crore Container Manufacturing Scheme",https://www.ndtvprofit.com/economy/budget-2026-fm-announces-rs-10-000-crore-container-manufacturing-scheme-10924660,Press Trust of India,2026-02-01T08:54:18Z,cargo shipping,"To enhance last-mile and remote connectivity, and promote tourism, the minister proposes to give incentives to indigenise manufacturing of seaplanes.",Ndtvprofit.com,Unknown,News,2026-02-04T06:56:15.446916Z
cb98842a35b4afdd2d78ee3f1032753e,Budget 2026: 10 key announcements for India Inc,https://economictimes.indiatimes.com/news/company/corporate-trends/budget-2026-key-announcements-freight-corridor-biopharm-shakti-electronics-components-manufacturing-scheme/articleshow/127836645.cms,ET Online,2026-02-01T08:28:29Z,cargo shipping,"Budget 2026 Key Announcements: The Union Budget 2026-27 reshapes Corporate India with ten key moves. Infrastructure spending rises significantly. Manufacturing receives ecosystem capital, not just incentives. MSMEs get a substantial push for scale. Corporate …",The Times of India,India,News,2026-02-04T06:56:15.446943Z
d0cea7ae205e92ed84d4676b18f2febe,Union Budget 2026-27 highlights,https://www.thehindubusinessline.com/economy/budget/union-budget-2026-27-highlights/article70577456.ece,BL Internet Desk,2026-02-01T08:27:18Z,cargo shipping,"Explore the key highlights and initiatives of India's Union Budget 2026-27, focusing on economic growth, inclusion, and reform.",BusinessLine,India,News,2026-02-04T06:56:15.446960Z
b1b3bbe0991be70f8c46ab3d957f70b9,Major US shipping platform left customer data wide open to hackers,https://www.foxnews.com/tech/major-us-shipping-platform-left-customer-data-wide-open-hackers,,2026-01-31T19:30:19Z,cargo shipping,Hackers are targeting global shipping technology to steal cargo worth millions. New cybersecurity threats expose supply chain vulnerabilities worldwide.,Fox News,Global,News,2026-02-04T06:56:15.446995Z
dd08f530d268242ad62a05974558580d,Dickies Men's Flex Regular Fit Cargo Pants (Dark Navy) $19.99 + Free Shipping w/ Prime or on $35+,https://slickdeals.net/f/19158712-dickies-men-s-flex-regular-fit-cargo-pants-dark-navy-19-99-free-shipping-w-prime-or-on-35,jk6812,2026-01-31T09:19:50Z,cargo shipping,Amazon [amazon.com] has *Dickies Men's Flex Regular Fit Cargo Pants* (Dark Navy) on sale for *$19.99*. Shipping is free with Prime or on $35+ orders.,Slickdeals.net,Unknown,News,2026-02-04T06:56:15.447030Z
729feb697d06f37bb5895dfabbbe92fb,[K-Movie Night] The Beauty Inside,https://dramabeans.com/2026/01/k-movie-night-the-beauty-inside/,Dramaddictally,2026-01-31T02:00:33Z,cargo shipping,"Welcome to K-Movie Night — a once-a-month feature where we microwave some popcorn, put on a face mask, and get cozy with a Korean movie from yesteryear. With so many films finally streaming (with subs!), now is the time to get caught up on all those movies we…",Dramabeans.com,South Korea,News,2026-02-04T06:56:15.447065Z
f9ce34a093467bf2580d1402398dcd5e,Sheinbaum Warns of Deeper Cuban Crisis After US Threat,https://financialpost.com/pmn/business-pmn/sheinbaum-warns-of-deeper-cuban-crisis-after-us-threat,Bloomberg News,2026-01-30T18:37:37Z,cargo shipping,Mexican President Claudia Sheinbaum warned that the latest US tariffs threatened by Donald Trump on goods from countries that support Cuba with critical energy supplies could lead to a humanitarian disaster there.,Financial Post,Unknown,News,2026-02-04T06:56:15.447134Z
e218472d75c6d09d2ee27bc5ca6f3a96,“Global Sea War”: Trump’s New Strategy for Regime Change,https://www.globalresearch.ca/trump-global-sea-war-new-strategy-regime-change/5914249,John Helmer,2026-01-30T14:51:07Z,cargo shipping,"They will escalate their war against Russia at sea, deploying their navies to enforce trade blockades, ship sabotage and seizures.
The post “Global Sea War”: Trump’s New Strategy for Regime Change appeared first on Global Research.",Globalresearch.ca,Russia,News,2026-02-04T06:56:15.447167Z
d529393f4aa3036f01bb8df796c957cd,Iran Signals Defiance as Trump Escalates Rhetoric,https://oilprice.com/Energy/Energy-General/Iran-Signals-Defiance-as-Trump-Escalates-Rhetoric.html,Editorial Dept,2026-01-30T14:30:00Z,cargo shipping,"Politics, Geopolitics & Conflict On the US-Iran front, this week was full of bluster with Trump’s trademark tactic of ambiguous escalation, roiling markets and sending gold and crude soaring on apocalyptic hedging. Trump publicly said the U.S. is ready to str…",OilPrice.com,Unknown,Market Report,2026-02-04T06:56:15.447209Z
ef6a7c8b3df374045d9d47edd2f07e2a,"Chinese fishing boats have been making some unusual moves lately in the East China Sea, satellite images and shipping data show",https://www.businessinsider.com/chinese-fishing-boats-making-strange-moves-in-east-china-sea-2026-1,"Robert Leslie,Chris Panella",2026-01-30T13:30:14Z,cargo shipping,"Shipping data showed the vessels gathering in distinct, coordinated lines in the East China Sea twice in recent weeks.",Business Insider,China,News,2026-02-04T06:56:15.447225Z
0c580ba63505f501715ab341f03ed201,ICE Deportation Flights Are Getting Longer and Crueler,https://www.motherjones.com/politics/2026/01/omni-ice-deportations-charter-flight-stonepeak-private-equity/,Gillian Brockell,2026-01-30T12:30:00Z,cargo shipping,"Just before being put on board her deportation flight, Melissa Tran’s wrists and ankles were shackled to a chain around her waist. It had been more than 10 hours since she’d been given any food or water; for the last seven she had been sitting on a bus on the…",Mother Jones,Unknown,News,2026-02-04T06:56:15.447274Z
ff0750501a9f79b188fd685da0b4c6ef,Dickies Men's Flex Regular Fit Cargo Pants (Dark Navy) $19.99 + Free Shipping w/ Prime or on $35+,https://slickdeals.net/f/19154983-dickies-men-s-flex-regular-fit-cargo-pants-dark-navy-19-99-free-shipping-w-prime-or-on-35,jk6812,2026-01-30T10:31:29Z,cargo shipping,"Amazon [amazon.com] has *Dickies Men's Flex Regular Fit Cargo Pants *(Dark Navy, Limited Sizes) on sale for *$19.99*. Shipping is free with Prime or on $35+ orders.",Slickdeals.net,Unknown,News,2026-02-04T06:56:15.447353Z
89e5aac7c9c335ef3662dc6c46f81b7c,LOOGU Men's Water Resistant Ripstop Cargo / Tactical Pants (various colors) $13,https://slickdeals.net/f/19151881-loogu-men-s-water-resistant-ripstop-cargo-tactical-pants-various-colors-13,iconian,2026-01-29T22:51:26Z,cargo shipping,LOOGU OUTDOORS via Amazon has LOOGU Men's Water Resistant 8-Pocket Ripstop Cargo / Tactical Pants (various colors) on sale for $26 - 50% off when you apply promo code T8J3VLKA at checkout = $13.,Slickdeals.net,Unknown,News,2026-02-04T06:56:15.447553Z
ac9c61a9be27a7aa5fd43a9c79b8cff9,"Economic Survey flags strong growth ahead for India’s aviation, ports and shipping sectors by FY31",https://economictimes.indiatimes.com/news/economy/infrastructure/economic-survey-flags-strong-growth-ahead-for-indias-aviation-ports-and-shipping-sectors-by-fy31/articleshow/127785289.cms,ET Bureau,2026-01-29T19:39:28Z,cargo shipping,"India's civil aviation and ports sectors are poised for substantial growth by FY31, fueled by increasing demand and infrastructure investments. The Economic Survey highlights India's low airport density compared to global benchmarks, indicating significant ex…",The Times of India,India,News,2026-02-04T06:56:15.447686Z
