article_id,title,link,creator,pubdate,category,description,source,country,article_type,scrape_timestamp
9d79d38f8f7afc4f40667c4a11e9d5fe,Denmark Sold Little Saint James to America in1917 – Now It's Known as Epstein's Island,https://www.ibtimes.com/denmark-sold-little-saint-james-america-in1917-now-its-known-epsteins-island-3795856,Rohit David,2026-01-20T22:48:56Z,Panama Canal,Uncover the link between Denmark's 1917 sale of the Virgin Islands and Little Saint James becoming Epstein's Island—from colonial transfer for £18.6 million ($25 million) to modern controversies and resort plans,International Business Times,USA,News,2026-01-26T18:39:47.386310Z
a6e9ecd15e1c4b2ce1aed1f9455a69b7,Lyse Doucet: Trump is shaking the world order more than any president since WW2,https://www.bbc.com/news/articles/cx2lej7d52po,,2026-01-20T20:18:43Z,Panama Canal,Trump's demands over Greenland are a rude awakening in a moment fraught with risk.,BBC News,Unknown,News,2026-01-26T18:39:47.386340Z
426920881a1a42822f76d2bad420bc4a,Missed Connection – La Colombe / Panama,https://www.popville.com/2026/01/missed-connection-la-colombe-panama/,Prince Of Petworth,2026-01-20T20:15:52Z,Panama Canal,"Ed. Note: If this was you and you are interested, please email princeofpetworth@gmail.com so I can put you in touch with OP. “Dear PoPville, I’m hoping to connect with someone I met at La Colombe on Florida Ave at around 1 p.m. on Saturday the 17th. A French …",PoPville,Panama,News,2026-01-26T18:39:47.386390Z
61245a015a0436dfcf6e8b19865be7bf,Who Gained the Most During Trump’s First Year? Billionaires and Corporations.,https://truthout.org/articles/who-gained-the-most-during-trumps-first-year-billionaires-and-corporations/,Derek Seidman,2026-01-20T19:21:06Z,Panama Canal,Big banks saw their stocks skyrocket by 29 percent during Trump’s first year. Here’s who else cashed in.,Truthout,Unknown,News,2026-01-26T18:39:47.386428Z
f4dbae33cea1f4f767dfab8bb2eae29a,19th-century plan for a slaving empire based in US deep south and Caribbean resonates with Trump’s foreign policy today,https://theconversation.com/19th-century-plan-for-a-slaving-empire-based-in-us-deep-south-and-caribbean-resonates-with-trumps-foreign-policy-today-272871,"Dafydd Townley, Teaching Fellow in US politics and international security, University of Portsmouth",2026-01-20T18:09:57Z,Panama Canal,"The so-called ‘Golden Circle’ was to be an empire of slave-owning states stretching from the Deep South of the US, across Mexico, Central America and the Caribbean.",The Conversation Africa,USA,News,2026-01-26T18:39:47.386455Z
9129be88634abc735b57740f588d9ad3,A Year of Trump 2.0: Strategy Report Card,https://dailyreckoning.com/a-year-of-trump-2-0-strategy-report-card/,Byron King,2026-01-20T17:23:34Z,Panama Canal,"This post A Year of Trump 2.0: Strategy Report Card appeared first on Daily Reckoning.
It’s been exactly a year since January 20, 2025, when Donald Trump was sworn in for Term 2.0 as President. Today we’ll look both back and ahead. We’ll consider key events f…",Dailyreckoning.com,Unknown,Market Report,2026-01-26T18:39:47.386527Z
08288da8ab26e55eaddf01c50a4d328f,Tottenham vs Borussia Dortmund Free Streams: How to watch Champions League 2025/26 online from anywhere,https://www.techradar.com/how-to-watch/football/tottenham-vs-borussia-dortmund-champions-league-2025-26-free,Aatif Sulleyman,2026-01-20T17:15:00Z,Panama Canal,"All the ways to watch Tottenham vs Borussia Dortmund live streams from anywhere, with both Thomas Frank and Niko Kovac under pressure ahead of this UCL tie.",TechRadar,Russia,News,2026-01-26T18:39:47.386564Z
7c68f416ad9b07ac193454e3a0998a43,Inter Milan vs Arsenal Free Streams: How to watch Champions League 2025/26 online from anywhere,https://www.techradar.com/how-to-watch/football/inter-milan-vs-arsenal-champions-league-2025-26-free,Sam May,2026-01-20T16:00:00Z,Panama Canal,"All the ways to watch Inter Milan vs Arsenal live streams from anywhere, with both side's seeking to reach the knockout stages.",TechRadar,Unknown,News,2026-01-26T18:39:47.386599Z
acd0ee992f4382e713ea2b76d036cb89,"With threats to Greenland, Trump sets America on the road to conquest",https://economictimes.indiatimes.com/news/international/global-trends/with-threats-to-greenland-trump-sets-america-on-the-road-to-conquest/articleshow/126815602.cms,Peter Baker,2026-01-20T14:28:50Z,Panama Canal,President Donald Trump's ambition to acquire Greenland from Denmark is causing international concern. This move challenges decades of U.S. policy that supported territorial integrity. Trump's actions are seen by some as a return to imperialistic tendencies. A…,The Times of India,USA,News,2026-01-26T18:39:47.386631Z
460c23a3499919559c247e28009bdeb5,Europe has five options for responding to Trump’s Greenland threats. None of them look good,https://theconversation.com/europe-has-five-options-for-responding-to-trumps-greenland-threats-none-of-them-look-good-273885,"Jun Du, Professor of Economics, Centre Director of Centre for Business Prosperity (CBP), Aston University, Oleksandr Shepotylo, Senior Lecturer in Economics, Aston University",2026-01-20T14:22:17Z,Panama Canal,The UK and Europe need a new strategy.,The Conversation Africa,Unknown,News,2026-01-26T18:39:47.386664Z
5ca937645a9057e05d7affa5ca5f735a,Greenland and the Munich Agreement: Is Europe Bowing to the Aggressor Again?,https://www.globalresearch.ca/greenland-munich-agreement-europe-bowing-aggressor-again/5912893,Marc Vandepitte,2026-01-20T13:41:54Z,Panama Canal,"Trump’s hunt for the Arctic Circle presents Europe with a historic ultimatum. Will it meet economic intimidation with a clenched fist, or will it once again make a cowardly bow to the aggressor?

To read this article in the following …
The post Greenland and …",Globalresearch.ca,Unknown,News,2026-01-26T18:39:47.386716Z
87748b496b0a95c16d0ec86004c4aac6,"Tariffs, Greenland, and the GOP’s NATO Betrayal: Trump’s Unconstitutional Power Grab Exposed",https://www.naturalnews.com/2026-01-20-tariffs-greenland-and-the-gops-nato-betrayal.html,Mike Adams,2026-01-20T06:00:00Z,Panama Canal,"Introduction: The Dangerous Crossroads of Tyranny and Alliance The geopolitical stage is set for a showdown not seen in generations. US President Donald Trump has imposed a blanket 10% tariff on imports from eight European NATO allies—Denmark, Norway, Sweden,…",Naturalnews.com,Norway,News,2026-01-26T18:39:47.386764Z
f5c7f80fe4e6079220ea5a06656fab97,The Magic 33 ICE Psyop to Usher In the Zionist Police State… and Nobel Peace Prize $1.5 Trillion Tyranny,https://www.activistpost.com/the-magic-33-ice-psyop-to-usher-in-the-zionist-police-state-and-nobel-peace-prize-1-5-trillion-tyranny/,Editor,2026-01-19T21:00:00Z,Panama Canal,"Donald Trump, squinting at a globe upside-down, has allegedly decided the time is right to finally dust off the Club of Rome’s 100-year-old master plan: one elegant, uninterrupted super-state stretching from Greenland, through Canada, bulldozing politely acro…",Activistpost.com,Unknown,News,2026-01-26T18:39:47.386817Z
515b7c18d8426822c552885ad9257a0e,The ‘Donroe Doctrine’ Is a Roosevelt Redux,http://foreignpolicy.com/2026/01/19/us-venezuela-maduro-raid-history-trump-roosevelt-monroe/,Tom Long and Carsten-Andreas Schulz,2026-01-19T11:00:46Z,Panama Canal,"Then as now, big stick diplomacy will lead to costly cycles of intervention and retrenchment.",Foreign Policy,Unknown,News,2026-01-26T18:39:47.386872Z
acf2264fa9f559b53820bcc1e14f55d3,Treasury Escalates Pressure on Iranian Regime for Killing Peaceful Protestors,https://www.globalsecurity.org/wmd/library/news/iran/2026/01/iran-260123-treasury01.htm,John Pike,2026-01-24T10:16:25Z,Black Sea shipping,"Today, amidst the Iranian regime's brutal crackdown on peaceful protestors and its complete shutdown of internet access to conceal its abuses against the Iranian people, the U.S. Department of the Treasury's Office of Foreign Assets Control (OFAC) is increasi…",Globalsecurity.org,Unknown,News,2026-01-26T18:39:47.662031Z
f0acc096b4a5da87c632428ba9691298,“Annus Horribilis”: First Year Balance Sheet of the Second Trump Era,https://www.globalresearch.ca/first-year-balance-sheet-second-trump-era/5912994,Ret Admiral Cem Gürdeniz,2026-01-21T15:35:47Z,Black Sea shipping,"When Donald Trump marched to power for the second time, he made a clear promise to the nationalist MAGA base. America would turn inward, revive production, get rid of the globalist neocon and Zionist understanding that has put the country …
The post “Annus Ho…",Globalresearch.ca,USA,News,2026-01-26T18:39:47.662165Z
569c606d15036ec69b2b4fb7336e2387,Oil Settles Higher on Black Sea Supply Risks,https://www.rigzone.com/news/wire/oil_settles_higher_on_black_sea_supply_risks-20-jan-2026-182810-article/,"Will Kubzansky, Jack Wittels",2026-01-20T20:43:28Z,Black Sea shipping,Crude markets balanced Black Sea disruptions against fears of a US-EU trade conflict.,Rigzone,Unknown,Market Report,2026-01-26T18:39:47.662217Z
ff6ddc0717b6668a00cbb8088de55075,Today in Germany: A roundup of the latest news on Tuesday,https://www.thelocal.de/20260120/today-in-germany-a-roundup-of-the-latest-news-on-tuesday-107,Tom Pugh,2026-01-20T07:32:42Z,Black Sea shipping,"Merz says Europe keen to 'avoid escalation' on Trump tariff threat, Germany brings back electric car subsidies, polar lights illuminate the German skies and more news on Tuesday, January 20th.",The Local Germany,Germany,News,2026-01-26T18:39:47.662249Z
1c64c97427d642a0799cb0bc9b785934,How much does a big isopod cost?,https://www.lifesciencesworld.com/how-much-does-a-big-isopod-cost/,Noah Whitman,2026-01-20T04:11:57Z,Black Sea shipping,"How Much Does a Big Isopod Cost? A Deep Dive into the World of Giant Crustaceans The price of a big isopod varies greatly depending on the species, size, origin, and availability, ranging from $5 to upwards of $500 or even more for rare and exceptionally larg…",Lifesciencesworld.com,Unknown,News,2026-01-26T18:39:47.662295Z
3dc11930745e20e5b2739157b6bc72fa,"EXCLUSIVE: US General Plotted With CCP-Tied Mogul To Seize Strategic Islands For China, Tell-All Claims",https://dailycaller.com/2026/01/19/exclusive-us-general-plotte-ccp-tied-mogul-strategic-islands-china-tell-all-claims/,Philip Lenczycki,2026-01-19T14:00:32Z,Black Sea shipping,A CCP intel official's autobiography details influence operations including an alleged plot with Lt. Gen. Russel Honoré to annex Japanese islands for China.,The Daily Caller,China,News,2026-01-26T18:39:47.662342Z
2aacfa8e05c47d7ff7d351c7e6078f56,Seiko's stealthy Prospex SRPL15 automatic watch is now discounted by 25%,https://www.notebookcheck.net/Seiko-s-stealthy-Prospex-SRPL15-automatic-watch-is-now-discounted-by-25.1207361.0.html,Anubhav Sharma,2026-01-19T08:17:00Z,Black Sea shipping,"Deal | The Seiko Prospex SRPL15 is currently available for $431 at Watch Warehouse, a 25% price cut from its MSRP. Pricing analysis confirms this is a neat entry point, sitting just $31 above the all-time market low. The SRPL15 features the Caliber 4R35 movem…",Notebookcheck.net,Unknown,Analysis/Opinion,2026-01-26T18:39:47.662395Z
9deb067a1ae3c3ecb55eceedbcce5ee6,Saudi defense deals could change Middle East security,https://www.dw.com/en/saudi-defense-deals-could-change-middle-east-security/a-75628843,Jennifer Holleis,2026-01-25T14:09:00Z,Red Sea shipping,"Riyadh is in talks with Somalia, Egypt and Turkey about two new defense pacts. What impact will they have if they go ahead? The political wheels across the Middle East keep turning.

Earlier this week, Saudi Foreign Minister Prince Faisal bin Farhan met his E…",DW (English),Turkey,News,2026-01-26T18:39:48.139515Z
6daf1fbd813a1da1c0a239b5448e9b58,Israel’s recognition of Somaliland: the strategic calculations at play,https://theconversation.com/israels-recognition-of-somaliland-the-strategic-calculations-at-play-273817,"Federico Donelli, Associate Professor of International Relations, University of Trieste",2026-01-25T05:03:36Z,Red Sea shipping,Somaliland’s growing strategic relevance masks its unresolved internal divisions.,The Conversation Africa,Unknown,News,2026-01-26T18:39:48.139605Z
6e9e362addc08fae3384d4e58284ca5a,Trump CANCELS planned tariffs on NATO allies after progress on Greenland deal,https://www.naturalnews.com/2026-01-24-trump-cancels-tariffs-after-progress-on-greenland.html,Ramon Tomey,2026-01-24T06:00:00Z,Red Sea shipping,"President Trump abruptly withdrew planned tariffs against eight European nations following progress on a Greenland-Arctic security framework. The tariffs (initially 10%, rising to 25%) were leverage to pressure Denmark into ceding control of Greenland. Greenl…",Naturalnews.com,Unknown,News,2026-01-26T18:39:48.139657Z
d1a473165a776b329926fefafdb276a9,Somaliland president pitches business opportunities to Trump's son,https://www.bbc.com/news/articles/cje11eg7lp5o,,2026-01-23T16:59:41Z,Red Sea shipping,He also met his counterpart from Israel which has recognised the independence of the breakaway region.,BBC News,Unknown,News,2026-01-26T18:39:48.139730Z
ac92b0f814c326aa9d0b9ed4c1bc4d70,Speedboat driver who hit teen kayaker first to be sentenced under new safety law,https://www.gov.uk/government/news/speedboat-driver-who-hit-teen-kayaker-first-to-be-sentenced-under-new-safety-law,Maritime and Coastguard Agency,2026-01-22T16:50:07Z,Red Sea shipping,"A man who crashed his speedboat into a 15-year-old kayaker near Milford Haven was sentenced to 12 months in jail, suspended for two years, in the first prosecution by the Maritime and Coastguard Agency (MCA) under new watercraft safety legislation.",Www.gov.uk,Unknown,News,2026-01-26T18:39:48.139804Z
6b99dcc622e8fcacff02f3544af0b2ae,"Trump’s Greenland ‘framework’ deal: What we know about it, what we don’t",https://www.aljazeera.com/news/2026/1/22/trumps-greenland-framework-deal-what-we-know-about-it-what-we-dont,Al Jazeera,2026-01-22T13:50:52Z,Red Sea shipping,Trump says he reached a 'framework of a future deal' on Greenland during a meeting with NATO's Mark Rutte in Davos.,Al Jazeera English,Unknown,News,2026-01-26T18:39:48.139839Z
d37cc9c16c83455e776ac6f6c0d1974f,"Nigeria Freight & Logistics Market Analysis and Growth Forecast 2026-2031 - Poor Roads and Insecurity Lift Costs, Propel Rail and Waterways in Nigeria",https://www.globenewswire.com/news-release/2026/01/22/3223443/28124/en/Nigeria-Freight-Logistics-Market-Analysis-and-Growth-Forecast-2026-2031-Poor-Roads-and-Insecurity-Lift-Costs-Propel-Rail-and-Waterways-in-Nigeria.html,Research and Markets,2026-01-22T09:08:00Z,Red Sea shipping,"Dublin, Jan. 22, 2026 (GLOBE NEWSWIRE) -- The ""Nigeria Freight and Logistics - Market Share Analysis, Industry Trends & Statistics, Growth Forecasts (2026-2031)"" has been added to ResearchAndMarkets.com's offering.",GlobeNewswire,Unknown,Analysis/Opinion,2026-01-26T18:39:48.139876Z
d35fb1783b0dc51fed54959bdf7e5974,"As Trump moves toward Greenland deal, Mass. Congressman says his bill will beef up U.S. presence",https://www.bostonherald.com/2026/01/21/as-trump-moves-toward-greenland-deal-mass-congressman-says-his-bill-will-beef-up-u-s-presence/,Tim Dunn,2026-01-21T23:03:27Z,Red Sea shipping,"As President Trump announces a “framework for a future deal” with NATO amid his push for U.S. control of Greenland, Congressman Bill Keating says his bill increases U.S. presence in the Arctic, including in Greenland.",Boston Herald,Unknown,News,2026-01-26T18:39:48.139922Z
69ce7f34d7084a4a92151fc990c55357,Why the Gulf states Are Wary of a Strike on Iran,https://www.dw.com/en/why-the-gulf-states-are-wary-of-a-strike-on-iran/a-75593784,Kersten Knipp,2026-01-21T18:20:00Z,Red Sea shipping,"Geopolitical concerns of the Gulf states have most likely prevented a US attack on Iran despite Donald Trump's promise to help the protesters. ""Iranian Patriots, KEEP ‍PROTESTING - TAKE OVER YOUR INSTITUTIONS!!!... HELP IS ON ITS WAY,"" Trump posted on Tuesday…",DW (English),Unknown,News,2026-01-26T18:39:48.139977Z
50d1159ef22492fb0e2e6d25c483d786,Bitcoin is now your only lifeboat as Canada says the current world order is merely a “pleasant fiction”,https://cryptoslate.com/bitcoin-is-now-your-only-lifeboat-as-canada-says-the-current-world-order-is-merely-a-pleasant-fiction/,Liam 'Akiba' Wright,2026-01-21T17:05:47Z,Red Sea shipping,"Canada's Prime Minister, Mark Carney, walked onto the World Economic Forum's Davos stage yesterday and said the quiet part out loud. The rules-based order, the thing leaders love to invoke when they want the world to behave, is fading. Carney called it a “ple…",CryptoSlate,Unknown,News,2026-01-26T18:39:48.140031Z
d2cac803feb0ac14755292679918734f,"[S&S, AC] $3.62 | 4-Pack 8.4-Oz Red Bull Energy Drink (The Sea Blue Edition / Juneberry) at Amazon (90.5￠ each)",https://slickdeals.net/f/19123054-s-s-ac-3-62-4-pack-8-4-oz-red-bull-energy-drink-the-sea-blue-edition-juneberry-at-amazon-90-5-each,phoinix,2026-01-21T08:58:22Z,Red Sea shipping,Amazon [amazon.com] has *4-Pack 8.4-Oz Red Bull Energy Drink *(The Sea Blue Edition / Juneberry) for $7.49 - $1.50 - $2 when you 'clip' coupons on product page - 5% when you check out via Subscribe &...,Slickdeals.net,Unknown,News,2026-01-26T18:39:48.140109Z
bd14702ba09b449e2ac6bf0ca35ecffe,Houthi court upholds death sentences for nine accused of espionage,https://www.israelnationalnews.com/news/421172,Elad Benari,2026-01-20T04:58:50Z,Red Sea shipping,A Houthi court in Sanaa upholds death sentences for nine Yemenis accused of espionage.,Israelnationalnews.com,Unknown,News,2026-01-26T18:39:48.140317Z
58d1539c767af52a776a4a8564816a1b,Israeli agricultural exports face looming ‘collapse’ as world rejects products over Gaza genocide,https://mondoweiss.net/2026/01/israeli-agricultural-exports-face-looming-collapse-as-world-rejects-products-over-gaza-genocide/,Jonathan Ofir,2026-01-19T19:51:03Z,Red Sea shipping,"Israeli farmers warn the country's agricultural export industry is facing a looming “collapse” due to international opposition to the Gaza genocide. Recent reports show the impact of boycotting Israel, and why the Israeli 'brand' may never recover.",Mondoweiss,Global,Market Report,2026-01-26T18:39:48.140405Z
a0b20f90e4b74b7bba4d549ed2dc4a08,I visited Japan’s underrated ‘Mediterranean’ region. It’s a tranquil treat,https://www.nzherald.co.nz/world/i-visited-japans-underrated-mediterranean-region-its-a-tranquil-treat/WRXZBHBK2RHFTE5WHFQVR3XGYM/,James March,2026-01-19T18:00:00Z,Red Sea shipping,The Hiroshima A-Bomb Dome stands alone as the city’s preserved blast ruin.,New Zealand Herald,Japan,News,2026-01-26T18:39:48.140437Z
97240a60ff93207dcd312695b0a51fee,Decoding the Naval Buildup: A Dangerous Neo-Imperial Gamble in the Middle East,https://www.naturalnews.com/2026-01-25-dangerous-neo-imperial-gamble-in-middle-east.html,Garrison Vance,2026-01-25T06:00:00Z,Strait of Hormuz,"Introduction: A Flotilla of Folly As the world watches with bated breath, the U.S. military machine shifts into high gear, directing a colossal naval force towards the Persian Gulf. In January 2026, President Donald Trump confirmed the deployment, stating, “W…",Naturalnews.com,Unknown,News,2026-01-26T18:39:48.391883Z
bc22dc343ee2d3f8f01839db975bf082,"Iran is not a major oil producer, but it still moves prices. Here's why",https://www.cnbc.com/2026/01/23/iran-protests-why-oil-markets-care-so-much-about-the-country.html,"Macklin Fishman, Pippa Stevens",2026-01-23T17:34:12Z,Strait of Hormuz,"Iran is not a major producer of oil, but the recent civil unrest there still moved markets. Here's why.",CNBC,Unknown,Market Report,2026-01-26T18:39:48.391956Z
67049a52f99ebec4c10c9321ef3f2583,Nigeria Continues Path towards BRICS Membership and Independent Foreign Policy,https://www.globalresearch.ca/nigeria-brics-membership-independent-foreign-policy/5913268,Ahmed Adel,2026-01-23T14:43:36Z,Strait of Hormuz,"In a recent statement, Nigeria’s Foreign Minister, Yusuf Tuggar, announced the country’s intention to join BRICS as a full member in the coming years. With over 230 million people and the largest GDP on the continent, the African nation has …
The post Nigeria…",Globalresearch.ca,Unknown,News,2026-01-26T18:39:48.392008Z
3875277064f1ccd2116f7a7d4cbac41d,Military Buildup In Middle East Continues...,http://www.twz.com/news-features/military-buildup-in-the-middle-east-continues-including-what-trump-describes-as-a-big-flotilla,the war zone,2026-01-23T13:00:12Z,Strait of Hormuz,The aircraft carrier USS Abraham Lincoln is on its way to the Middle East while additional air defenses are flowing into the region as well.,Twz.com,Unknown,News,2026-01-26T18:39:48.392041Z
a9780f476d9fad31f3388dc626061b81,"Wealth Quote of the Day by Charlie Munger, “Most people get interested in stocks when everyone else is. The time to get interested is when no one else is” The Munger–Buffett partnership and the power of patience",https://economictimes.indiatimes.com/news/international/us/wealth-quote-of-the-day-by-charlie-munger-most-people-get-interested-in-stocks-when-everyone-else-is-the-time-to-get-interested-is-when-no-one-else-is-the-mungerbuffett-partnership-and-the-power-of-patience/articleshow/127166602.cms,Piyush Shukla,2026-01-22T17:56:25Z,Strait of Hormuz,"Wealth Quote of the Day by Charlie Munger, “Most people get interested in stocks when everyone else is. The time to get interested is when no one else is” Charlie Munger, legendary investor, built Berkshire Hathaway into a trillion-dollar empire. He favors qu…",The Times of India,Unknown,News,2026-01-26T18:39:48.392145Z
9f75502aa1374eda7b8a79f03636cf75,"View: India, don't drift from Chabahar",https://economictimes.indiatimes.com/opinion/et-commentary/view-india-dont-drift-from-chabahar/articleshow/127181621.cms,"Harsh V Pant, Vivek Mishra",2026-01-22T17:43:25Z,Strait of Hormuz,"Trump's new 25% tariff on countries trading with Iran complicates India's engagement, particularly at Chabahar Port. This move undermines a previous waiver, injecting uncertainty into regional stability and India-US ties. India faces a strategic setback if it…",The Times of India,India,Analysis/Opinion,2026-01-26T18:39:48.392165Z
fd502ade185d4706b219f2dc7384a52a,Security Advisory SA-26-01 GPS Attacks,https://shostack.org/blog/security-advisory-26-01-gps-attacks/,Adam,2026-01-22T00:00:00Z,Strait of Hormuz,GPS attacks trigger revisiting threat models,Shostack.org,Unknown,News,2026-01-26T18:39:48.392189Z
2e910c73292c5ee523a3a5c3de75961b,How Venezuela Went from U.S. Ally to National Security Threat,https://oilprice.com/Energy/Crude-Oil/How-Venezuela-Went-from-US-Ally-to-National-Security-Threat.html,Matthew Smith,2026-01-21T22:00:00Z,Strait of Hormuz,"President Donald Trump’s crusade to topple Venezuela’s illegitimate President Nicolas Maduro, which culminated with his capture in a daring night raid by U.S. troops, started with a massive August 2025 naval buildup in the Caribbean. That escalated to airstri…",OilPrice.com,Unknown,News,2026-01-26T18:39:48.392237Z
9eaa9d8c6f981e998faaf89ec198a7bb,Trump Says Ayatollah’s Dictatorship Must Go – What About Iranian Oil?,https://www.forbes.com/sites/arielcohen/2026/01/21/trump-says-ayatollahs-dictatorship-must-go--what-about-iranian-oil/,"Ariel Cohen, Contributor, 
 Ariel Cohen, Contributor
 https://www.forbes.com/sites/arielcohen/",2026-01-21T15:31:35Z,Strait of Hormuz,"Protests in Iran are triggering speculation on the impacts of global energy markets. While these are legitimate fears, the wildest fears of price surges aren't sustained.",Forbes,Global,Market Report,2026-01-26T18:39:48.392322Z
6ab6191e0e44fdb07dde58f5bf9ca65e,Cracks Are Emerging in Iran’s Once-Resilient Oil Sector,https://oilprice.com/Energy/Energy-General/Cracks-Are-Emerging-in-Irans-Once-Resilient-Oil-Sector.html,RFE/RL staff,2026-01-20T17:00:00Z,Strait of Hormuz,"Nationwide protests in Iran are threatening to disrupt the country’s upstream sector and underscoring a deeper economic crisis that has fueled domestic turmoil. Iran has restored output and exports despite sanctions, but at a rising cost: deeper discounts to …",OilPrice.com,Unknown,News,2026-01-26T18:39:48.392386Z
34de89324e8acac8af7293145159eccb,Dow Jones crashes 700 points today: Why US stock market is down today? 5 Key reasons behind Dow crash,https://economictimes.indiatimes.com/news/international/us/dow-jones-crashes-700-points-today-why-us-stock-market-is-down-today-5-key-reasons-behind-dow-crash/articleshow/126819472.cms,Piyush Shukla,2026-01-20T15:22:45Z,Strait of Hormuz,"Dow Jones Crash today: U.S. stocks plunged as Trump threatened tariffs over Greenland acquisition. Dow fell 725 points, S&P 500 dropped 1.3%, Nasdaq slid 1.5%. Treasury yields surged, dollar weakened. European leaders warned of countermeasures. Nvidia, AMD, A…",The Times of India,Unknown,Market Report,2026-01-26T18:39:48.392433Z
a80a80c4214f02e7e7b3e50eb664a96a,"Gold, Silver Hit Record Highs as Trump Tariff Threats Over Greenland Rattle Mark",https://oilprice.com/Latest-Energy-News/World-News/Gold-Silver-Hit-Record-Highs-as-Trump-Tariff-Threats-Over-Greenland-Rattle-Mark.html,Charles Kennedy,2026-01-19T18:30:00Z,Strait of Hormuz,"Gold and silver surged to all-time highs as markets reacted to U.S. President Donald Trump’s threat to impose tariffs on European countries in a bid to force a deal allowing the United States to buy Greenland, accelerating a broad move into safe-haven assets.…",OilPrice.com,USA,Market Report,2026-01-26T18:39:48.392457Z
