article_id,title,link,creator,pubdate,category,description,source,country,article_type,scrape_timestamp
de30dc5b2dd1ef72fe7108ab4955467c,"Russian LNG tanker sinks in Mediterranean, Moscow blames Ukrainian drones",https://www.thestar.com.my/news/world/2026/03/05/russian-lng-tanker-sinks-in-mediterranean-moscow-blames-ukrainian-drones,The Star Online,2026-03-04T17:14:00Z,maritime transport,"MOSCOW, March 4 (Reuters) - A Russian ⁠tanker carrying liquefied natural gas (LNG) sank in the Mediterranean on ⁠Wednesday after what Moscow described as an attack by Ukrainian drones ‌launched from Libya.       Read full story",The Star Online,Russia,News,2026-03-07T18:37:41.752881Z
b2f5342d72619039bb06e1a596b77021,Iran war fallout: risks for the Red Sea and the Horn of Africa,https://theconversation.com/iran-war-fallout-risks-for-the-red-sea-and-the-horn-of-africa-277512,"Federico Donelli, Associate Professor of International Relations, University of Trieste",2026-03-04T15:26:07Z,maritime transport,Tehran’s presence in the Horn of Africa and the Red Sea is selective and opportunistic.,The Conversation Africa,Unknown,News,2026-03-07T18:37:41.752999Z
686b62fb50d5d2392dc23ab2ef55f385,Iran war fallout for the Red Sea and the Horn of Africa: political analyst weighs up the risks,https://theconversation.com/iran-war-fallout-for-the-red-sea-and-the-horn-of-africa-political-analyst-weighs-up-the-risks-277512,"Federico Donelli, Associate Professor of International Relations, University of Trieste",2026-03-04T15:26:07Z,maritime transport,Tehran’s presence in the Horn of Africa and the Red Sea is selective and opportunistic.,The Conversation Africa,Unknown,News,2026-03-07T18:37:41.753034Z
06b9269180b1cd3b3411fa96cca85a10,"Institutional Nikos A. with coffee and a chocolate, Bakoyannis chose the municipality instead of the First Athens district, AVAX acquires Ionios School, Peristeris and EYDAP, Ktima Spyropoulos",https://en.protothema.gr/2026/03/04/institutional-nikos-a-with-coffee-and-a-chocolate-bakoyannis-chose-the-municipality-instead-of-the-first-athens-district-avax-acquires-ionios-school-peristeris-and-eydap-ktima-spyropoulos/,Newsroom,2026-03-04T13:52:00Z,maritime transport,"The meetings and preparations over rising prices & eight trillion dollars in Athens
The post Institutional Nikos A. with coffee and a chocolate, Bakoyannis chose the municipality instead of the First Athens district, AVAX acquires Ionios School, Peristeris an…",Protothema.gr,Unknown,Market Report,2026-03-07T18:37:41.753086Z
5ddb89132ce0d19a9e954fca62866148,"Qatar shuts LNG output; supplies to India hit, city gas sector flags crisis",https://economictimes.indiatimes.com/markets/commodities/news/qatar-shuts-lng-output-supplies-to-india-hit-city-gas-sector-flags-crisis/articleshow/129030405.cms,PTI,2026-03-04T13:45:32Z,maritime transport,"Qatar has halted liquefied natural gas (LNG) production after its facilities came under attack amid the ongoing West Asia conflict, disrupting supplies to India and squeezing feedstock availability for key domestic sectors.",The Times of India,India,News,2026-03-07T18:37:41.753108Z
7f86fffa6677eec37766d01a3a4dfe8b,Ukrainian drone attacked Russian LNG tanker in Mediterranean Sea – Moscow (PHOTOS),https://www.rt.com/russia/633775-ukraine-drone-attacked-russian-lng/,RT,2026-03-04T13:39:24Z,maritime transport,"A Ukrainian naval drone attack damaged Arctic Metagaz LNG tanker off the coast of Malta, Moscow has said Read Full Article at RT.com",RT,Russia,News,2026-03-07T18:37:41.753132Z
701c9d9ba74b31b69e27856a2739fc56,Myanmar to Curb Private Vehicle Use as Fuel Shortages Emerge,https://financialpost.com/pmn/business-pmn/myanmar-to-curb-private-vehicle-use-as-fuel-shortages-emerge,Bloomberg News,2026-03-04T11:16:00Z,maritime transport,Myanmar’s military government will impose limits on private vehicles starting Saturday to conserve fuel as disruptions to Middle East shipping routes threaten the country’s energy supplies.,Financial Post,Unknown,News,2026-03-07T18:37:41.753173Z
b1a70d5177e408126e3ee82c1446c9d4,Russia blames Ukraine after gas tanker sinks off Libya,https://www.rte.ie/news/world/2026/0304/1561564-russia-ukraine/,RTÉ News,2026-03-04T10:43:24Z,maritime transport,"Russia has accused Ukraine of using naval drones to attack a liquified natural gas carrier off the Libyan coast, which led to its sinking.",RTE,Russia,News,2026-03-07T18:37:41.753194Z
bcd681f709cced98610f7979397a2f77,Tamil Nadu unveils Shipbuilding Policy 2026 to attract VLCC and mega vessel projects,https://www.thehindubusinessline.com/economy/logistics/tamil-nadu-unveils-shipbuilding-policy-2026-to-attract-vlcc-and-mega-vessel-projects/article70703043.ece,BL Chennai Bureau,2026-03-04T10:42:21Z,maritime transport,"Under the policy, shipyards engaged in manufacturing, repair and maintenance of maritime structures with a minimum committed investment of ₹1,000 crore and creation of at least 1,000 jobs will qualify for a Structured Package of Assistance.",BusinessLine,Unknown,News,2026-03-07T18:37:41.753241Z
e1791f5b020f315c0e3f7f978cefef0e,Russia Blames Ukraine for First Attack on LNG Shadow Fleet,https://financialpost.com/pmn/business-pmn/russia-blames-ukraine-for-first-attack-on-lng-shadow-fleet,Bloomberg News,2026-03-04T10:14:38Z,maritime transport,"A liquefied natural gas tanker, sanctioned by the US for carrying blacklisted Russian fuel, was attacked in the Mediterranean Sea, according to Russia’s Transport Ministry.",Financial Post,Russia,News,2026-03-07T18:37:41.753271Z
8f31df78115a4dd68ae9522eb1ef0c63,"Qatar shuts LNG output; supplies to India hit, city gas sector flags crisis",https://www.thehindubusinessline.com/news/world/qatar-shuts-lng-output-supplies-to-india-hit-city-gas-sector-flags-crisis/article70702870.ece,PTI,2026-03-04T09:48:43Z,maritime transport,"India’s gas supplies have been hit after LNG cargoes from Qatar were temporarily suspended, forcing supply cuts of up to 40 per cent for several industrial users and city gas distribution (CGD) companies",BusinessLine,India,News,2026-03-07T18:37:41.753295Z
a0e6e7f3f071f41bbb10cd8249e6bec0,"Qatar halts LNG output after attacks; disruptions to hit Indian supplies, city gas firms flag concerns",https://economictimes.indiatimes.com/industry/energy/oil-gas/qatar-halts-lng-output-after-attacks-disruptions-to-hit-indian-supplies-city-gas-firms-flag-concerns/articleshow/129018735.cms,PTI,2026-03-04T09:44:51Z,maritime transport,"Qatar has stopped liquefied natural gas production following attacks. This halts supplies to India, affecting industrial consumers and city gas companies. Petronet LNG cannot send ships through the Strait of Hormuz. This disruption impacts India's energy need…",The Times of India,India,News,2026-03-07T18:37:41.753324Z
375ac40d9d45356cff8d8bf7759be76a,Thick fog paralyzes transportation across Istanbul,https://www.hurriyetdailynews.com/thick-fog-paralyzes-transportation-across-istanbul-219586,hurriyetdailynews.com,2026-03-04T09:21:32Z,maritime transport,"A blanket of dense fog in Istanbul has severely disrupted air and sea transportation in one of the world’s busiest metropolitan hubs, stranding thousands of passengers during the morning rush hour.",Hurriyet Daily News,Turkey,News,2026-03-07T18:37:41.753359Z
982fa2d92d6d37e257ba84ccb8487499,WFP ready to scale up operations across the Middle East as displacement grows and supply routes come under strain,https://www.globalsecurity.org/military/library/news/2026/03/mil-260303-wfp01.htm,John Pike,2026-03-04T07:55:55Z,maritime transport,"The humanitarian situation across the Middle East is changing quickly driven by ongoing security developments. The United Nations World Food Programme is operational, positioned, and ready to scale as needs grow. We have activated emergency preparedness measu…",Globalsecurity.org,Unknown,News,2026-03-07T18:37:41.753411Z
093245c18f1f33860667c4f558f8c79f,"Iran crisis: Schoolgirls killed, thousands displaced and aid compromised",https://www.globalsecurity.org/wmd/library/news/iran/2026/03/iran-260303-unnews01.htm,John Pike,2026-03-04T07:55:33Z,maritime transport,"On the fourth day of Israeli and United States airstrikes against Iran and amid growing violence and instability in the Middle East, the UN urgently called for protection of civilians and warned of growing displacement and humanitarian needs.",Globalsecurity.org,USA,News,2026-03-07T18:37:41.753434Z
11fd4df2909d753dadde6833a7abf60e,Gateway or Gamble? Myanmar’s Uncertain Role in China’s Indian Ocean Ambitions,https://english.shannews.org/archives/29392,SHAN,2026-03-04T04:32:55Z,maritime transport,"During the 2026 Chinese New Year celebrations, Vice Senior General Soe Win, deputy chair of Myanmar’s State Administration Council, reaffirmed a long-standing geopolitical vision: positioning Myanmar as China’s strategic outlet to the Indian Ocean. His remark…",Shannews.org,China,News,2026-03-07T18:37:41.753489Z
df2927ec0c0b89188650f64a8d9733f8,HII’s Ingalls Shipbuilding Authenticates Keel of Philadelphia (LPD 32),https://www.globenewswire.com/news-release/2026/03/04/3249015/14858/en/HII-s-Ingalls-Shipbuilding-Authenticates-Keel-of-Philadelphia-LPD-32.html,HII,2026-03-04T01:30:00Z,maritime transport,"PASCAGOULA, Miss., March 03, 2026 (GLOBE NEWSWIRE) -- HII’s (NYSE: HII) Ingalls Shipbuilding division authenticated the keel today for the future USS Philadelphia (LPD 32), a Flight II San Antonio-class amphibious transport dock ship.",GlobeNewswire,Unknown,News,2026-03-07T18:37:41.753536Z
e4abfabfdafa4a44647f1e5f171abfb8,Trump Announces U.S. Navy Will Secure Key Oil Route Amid Economic Fallout From Iran Attack,https://www.mediaite.com/media/news/trump-announces-u-s-navy-will-secure-key-oil-route-amid-economic-fallout-from-iran-attack/,Zachary Leeman,2026-03-03T20:36:07Z,maritime transport,"Donald Trump announced new steps to ensure trade through the Gulf as markets have taken a hit following U.S. and Israeli strikes on Iran.
The post Trump Announces U.S. Navy Will Secure Key Oil Route Amid Economic Fallout From Iran Attack first appeared on Med…",Mediaite,Unknown,Market Report,2026-03-07T18:37:41.753593Z
e50437347d4a2f7e0db4b49fcbf1e6ef,Insurers Are Keeping Ships Away From the Strait of Hormuz,http://foreignpolicy.com/2026/03/03/iran-strikes-hormuz-shipping-oil-2/,Elisabeth Braw,2026-03-03T20:34:06Z,maritime transport,"As chaos spreads from Iran, global shipping is buckling under the strain.",Foreign Policy,Global,News,2026-03-07T18:37:41.753621Z
6c063a3da947d12829deb78fbcef9f4e,A War of Stockpiles,https://www.theatlantic.com/national-security/2026/03/war-stockpiles/686212/,"Missy Ryan, Nancy A. Youssef",2026-03-03T20:26:09Z,maritime transport,The U.S. and Israel are racing to destroy Iran’s missile supplies before their own air defenses are exhausted.,The Atlantic,Unknown,News,2026-03-07T18:37:41.753660Z
59f6390b67c70e3ffdf4bcf49219bbe8,Is Russia the key to ending the Iran war?,https://www.rt.com/news/633658-russia-key-iran-war/,RT,2026-03-03T18:05:17Z,maritime transport,"As the conflict expands, threatening to engulf the entire Middle East, the region needs someone with working connections to all parties Read Full Article at RT.com",RT,Russia,News,2026-03-07T18:37:41.753681Z
5c25eaa8a25c3e3eba921e08ae8afc13,Aramco explores oil exports via Red Sea to avoid Hormuz,https://financialpost.com/commodities/energy/oil-gas/aramco-explores-oil-exports-avoid-hormuz,Bloomberg News,2026-03-03T15:30:09Z,maritime transport,"Saudi Aramco is exploring the option of delivering oil to Yanbu, a port on the Red Sea that’s situated outside the Persian Gulf. Read on",Financial Post,Unknown,News,2026-03-07T18:37:41.753717Z
831a694c256462990bd29147e24343ae,Bitcoin gets liquidity lifeline as US injects $3 billion into banking system amid oil price spike,https://cryptoslate.com/bitcoin-watches-as-us-injects-3-billion-into-banks/,Oluwapelumi Adejumo,2026-03-03T15:00:44Z,maritime transport,"Brent crude oil is trading like a geopolitical asset again, and that is forcing Bitcoin back into a macro test it has not fully resolved. For a third straight session, oil climbed as the widening US-Israel conflict with Iran revived fears of disruption in the…",CryptoSlate,Unknown,Market Report,2026-03-07T18:37:41.753762Z
4bfd48b8ddf863e8ef88e9a6dc2c5e74,Oil infrastructure hit in Gulf as Iran keeps up attacks,https://www.channelnewsasia.com/world/oil-infrastructure-targeted-gulf-nations-iran-israel-united-states-5967556,,2026-03-03T14:23:00Z,maritime transport,"Falling debris from an intercepted drone caused a fire at an oil storage and trading zone in Fujairah, United Arab Emirates.",CNA,Unknown,Market Report,2026-03-07T18:37:41.753790Z
fe223b213cba2a0ccb65aa78fed6748d,Spring Forecast 2026 speech,https://www.gov.uk/government/speeches/spring-forecast-2026-speech,HM Treasury,2026-03-03T14:03:29Z,maritime transport,Spring Forecast 2026 speech as delivered by Chancellor Rachel Reeves.,Www.gov.uk,Unknown,Analysis/Opinion,2026-03-07T18:37:41.753812Z
7b66beeab83ea5513aff93e26947256c,Ferry scandal fall-out sees harbour buy-up and new contracts for beleaguered shipyard,https://news.sky.com/story/ferry-scandal-fall-out-sees-ardrossan-harbour-buy-up-and-new-contracts-for-beleaguered-shipyard-13514661,,2026-03-03T13:55:00Z,maritime transport,"The after-effects of a debacle that has seen taxpayers pay hundreds of millions for a pair of ferries at nearly four times the original budget, are continuing with the harbour that was too small to fit the ships set to be taken into public ownership.",Sky.com,Unknown,News,2026-03-07T18:37:41.753852Z
5df0277e6d495bb06ee7934d1d00768c,No excuse for Ukraine not to restart Druzhba pipeline supplies – Orban,https://www.rt.com/news/633615-orban-druzhba-operational-ukraine/,RT,2026-03-03T13:52:58Z,maritime transport,"Kiev is blocking Russian crude supplies despite the Druzhba pipeline being fully functional, Hungarian Prime Minister Viktor Orban has said Read Full Article at RT.com",RT,Russia,News,2026-03-07T18:37:41.753878Z
1a49aa988d0fa5e8644259f132b89c8a,Why is SpaceX going public?,https://www.theverge.com/tech/887899/spacex-ipo-risks-ai,Elizabeth Lopatto,2026-03-03T12:51:16Z,maritime transport,"I am excited about the SpaceX IPO for all the reasons investors shouldn't be. Maybe it'll be a real marquee moment for Silicon Valley, but I see the potential for a shitshow. After all, more than a decade ago, Musk said that SpaceX going public before going t…",The Verge,Unknown,News,2026-03-07T18:37:41.753971Z
1f6ec21433f0e0dd4c861b886ed91d8e,£271 million to clean up shipping and power coastal communities,https://www.gov.uk/government/news/271-million-to-clean-up-shipping-and-power-coastal-communities,Department for Transport,2026-03-03T11:06:08Z,maritime transport,"This funding will boost skilled jobs and coastal economies, and forms part of a £448 million commitment to clean maritime funding.",Www.gov.uk,Unknown,News,2026-03-07T18:37:41.754006Z
37f4e773062819e16d47ab4a5db6724f,"In Cuba, relentless US pressure tells in human suffering",https://www.thenewhumanitarian.org/news-feature/2026/03/03/cuba-relentless-us-pressure-human-suffering,sofia,2026-03-03T09:05:37Z,maritime transport,Trump’s oil blockade has driven the island’s long-standing humanitarian crisis to a new level. Cubans are running short of coping strategies.,The New Humanitarian,Unknown,News,2026-03-07T18:37:41.754047Z
8586838ce3d34fa66d21fec9d0e73d14,The narrow strait of water putting oil prices and freight costs on the brink,https://www.abc.net.au/news/2026-03-03/iran-threatens-ships-strait-of-hormuz-oil-gas-freight/106410242,Jasper Wells and Ahmed Yussuf,2026-03-03T06:17:21Z,maritime transport,"Iran's threats to attack vessels in one of the most important shipping passages will strain global supply of oil and gas, experts say — and Australia will not be immune from the fallout.",ABC News (AU),Australia,Market Report,2026-03-07T18:37:41.754110Z
e836bd6b25baac86deecfa4ec5681408,Does international law still matter? The strike on the girls’ school in Iran shows why we need it,https://www.thehindubusinessline.com/news/world/does-international-law-still-matter-the-strike-on-the-girls-school-in-iran-shows-why-we-need-it/article70697868.ece,PTI,2026-03-03T03:46:59Z,maritime transport,"Videos verified by international media show rescue workers digging through collapsed concrete, school bags being pulled from the debris, and scorch marks along the remaining walls",BusinessLine,Global,News,2026-03-07T18:37:41.754154Z
ba563630e73d20182f9b6b0e549eada1,Unprepared EU tries to stay out of Middle East war — but can that last?,https://www.politico.eu/article/eu-middle-east-iran-war-security-defense-energy/,"Zoya Sheftalovich, Jacopo Barigazzi, Nicholas Vinocur",2026-03-03T03:01:00Z,maritime transport,"Lacking influence with the White House and with Israel, Brussels has been relegated to the role of spectator.",POLITICO.eu,Unknown,News,2026-03-07T18:37:41.754190Z
56d27a0d836c99202330fc6090cd2410,"Iran starts ‘indiscriminate’ strikes across Gulf of Oman, hits shadow tanker tied to regime",https://www.foxnews.com/world/iran-starts-indiscriminate-strikes-gulf-oman-hits-shadow-tanker-tied-regime,,2026-03-02T23:54:52Z,maritime transport,"Gulf of Oman tanker attacks escalate as Iran retaliates against Operation Epic Fury with missiles targeting U.S. allies, disrupting commercial traffic through chokepoint.",Fox News,Unknown,News,2026-03-07T18:37:41.754233Z
28bdfeee131a796997dd1059c166fd84,Surging Oil Prices Could Derail Pakistan’s Fragile Economic Recovery,https://oilprice.com/Energy/Crude-Oil/Surging-Oil-Prices-Could-Derail-Pakistans-Fragile-Economic-Recovery.html,Alex Kimani,2026-03-02T23:00:00Z,maritime transport,Oil prices jumped nearly 10% in Monday's early session after Iran launched a barrage of retaliatory missiles and drone strikes targeting Israel and U.S. bases in the Persian Gulf following the killing of Iran’s Supreme Leader Ayatollah Ali Khamenei on Saturda…,OilPrice.com,Unknown,Market Report,2026-03-07T18:37:41.754280Z
e74091c3d8088cd2e042e864d66e1fff,Surging Oil Prices Could Derail Pakistan’s Fragile Economic Recovery,https://finance.yahoo.com/news/surging-oil-prices-could-derail-230000320.html,Alex Kimani,2026-03-02T23:00:00Z,maritime transport,"As a heavy fuel importer, Pakistan could see its current account deficit widen by $1.5–$2 billion for every $10 oil increase.",Yahoo Entertainment,Unknown,Market Report,2026-03-07T18:37:41.754312Z
68494b59276f26174fae37659347bd9a,"Prolonged Strait of Hormuz closure would cause oil prices to surge, experts warn",https://www.cbsnews.com/news/strait-of-hormuz-iran-oil-prices-us/,Megan  Cerullo,2026-03-02T21:50:32Z,maritime transport,"The Iran war is renewing concerns about the strategically vital Strait of Hormuz. A prolonged closure could sharply drive up oil prices, experts said.",CBS News,Unknown,Market Report,2026-03-07T18:37:41.754342Z
3b30f26f7d3258fdb9b882774925793a,What China stands to lose – and gain – from the Iran war,https://www.rt.com/news/633533-iran-china-lose-gain/,RT,2026-03-02T19:31:58Z,maritime transport,"The US-Israeli strikes on Iran test China’s energy security, diplomacy, and global ambitions all at once Read Full Article at RT.com",RT,China,News,2026-03-07T18:37:41.754359Z
2bb593bd62a90dd586bd252a0044d753,PHOTO -- Italy: Police Discover Ancient Roman Shipwreck with Cargo of Jugs for Fish Sauce,https://www.breitbart.com/europe/2026/03/02/photo-italy-police-discover-ancient-roman-shipwreck-cargo-jars-sauce/,Amy Furr,2026-03-02T19:06:43Z,maritime transport,"Italian authorities uncovered an ancient treasure off the coast of Apulia in the Ionian Sea in June, but kept the discovery a secret until now.
The post PHOTO — Italy: Police Discover Ancient Roman Shipwreck with Cargo of Jugs for Fish Sauce appeared first on…",Breitbart News,Unknown,News,2026-03-07T18:37:41.754407Z
83a7ad0bbf0d7ad18cd4f3a5fd87e760,Singapore eyes barge-based hydrogen power for datacenters,https://www.theregister.com/2026/03/02/singapore_bargebased_hydrogen_power_datacenters/,Dan Robinson,2026-03-02T17:47:07Z,maritime transport,"Saves real estate by putting the power on the water Datacenters increasingly want dedicated power, and Singapore has a unique solution. Bridge Data Centres (BDC) and Concord New Energy (CNE) are working to put hydrogen power generators on barges, saying that …",Theregister.com,Singapore,News,2026-03-07T18:37:41.754443Z
31ed213881fb7b68bcc168e7d83488b1,From missiles to minerals: The strategic meaning behind the Iran strike,https://www.foxnews.com/opinion/from-missiles-minerals-strategic-meaning-behind-iran-strike,,2026-03-02T16:53:50Z,maritime transport,"How coordinated strikes on Iran reflect America's new strategy integrating technological dominance, energy routes, and critical mineral supply chains.",Fox News,USA,News,2026-03-07T18:37:41.754465Z
f77e8b026f2d09470138bec6b1068558,The oil price surge is just one symptom of a supply chain network that is not fit for this age of global tensions,https://theconversation.com/the-oil-price-surge-is-just-one-symptom-of-a-supply-chain-network-that-is-not-fit-for-this-age-of-global-tensions-277277,"Maryam Lotfi, Senior Lecturer in Sustainable Supply Chain Management, Cardiff University",2026-03-02T16:50:08Z,maritime transport,Oil prices are responding to risk – not just supply shortages.,The Conversation Africa,Global,Market Report,2026-03-07T18:37:41.754495Z
515ff61d605a2d734de2721574df9053,Trump's Unprovoked War on Iran Triggers 10% Spike in Global Oil Prices,https://www.commondreams.org/news/trump-iran-war-oil,Brad Reed,2026-03-02T15:42:39Z,maritime transport,"President Donald Trump's unprovoked, unconstitutional, and politically unpopular war against Iran is about to cause pains for Americans at the gas pump.CNBC reported on Monday that Brent crude oil prices surged by 9.3% to a 52-week high of $79.40 per barrel, …",Common Dreams,USA,Market Report,2026-03-07T18:37:41.754518Z
f1660a75efe27460805ccde6d3d0099a,War in the Middle East: What implications for the EU and the world?,https://www.iss.europa.eu/publications/commentary/war-middle-east-what-implications-eu-and-world,fanny.pollet@iss.europa.eu,2026-03-02T15:28:04Z,maritime transport,"War in the Middle East: What implications for the EU and the world?
fanny.pollet@i…
Mon, 03/02/2026 - 16:28


 24 minutes
 
 On the morning of 28 February 2026, US and Israeli forces launched a large-scale attack across Iran. The initial strikes killed Ayatol…",Europa.eu,Unknown,News,2026-03-07T18:37:41.754581Z
86876f975facedf003e43530425e7d96,What has been hit so far in Iran war - and how US has targeted Tehran's navy,https://news.sky.com/story/iran-war-what-has-been-hit-so-far-and-the-military-assets-in-play-13514248,Sky News Data and Forensics team,2026-03-02T13:07:00Z,maritime transport,The US and Israel have carried out strikes on Iran for a fourth day after launching an operation which killed its supreme leader.,Sky.com,Unknown,News,2026-03-07T18:37:41.754664Z
5d1bea93e2e9898bace530a83259db9c,Mapped: How the Iran war has unfolded - and the military assets at play,https://news.sky.com/story/iran-war-mapping-how-the-conflict-has-unfolded-and-the-military-assets-at-play-13514248,Sky News Data and Forensics team,2026-03-02T13:07:00Z,maritime transport,Sky News delves into where the strikes and counter-strikes have struck - and the military assets available to both sides.,Sky.com,Unknown,News,2026-03-07T18:37:41.754697Z
43e588d9d5115f251d8fad9f962d82ed,Fast fashion garments pile up in South Asia as Middle East conflict grounds planes,https://www.channelnewsasia.com/business/fast-fashion-garments-pile-up-in-south-asia-middle-east-conflict-grounds-planes-5977576,,2026-03-06T17:44:02Z,cargo shipping,"DHAKA, March 6 : Shipments of garments for Zara owner Inditex and other major clothing retailers are stranded at airports in Bangladesh and India, according to three manufacturers, as the conflict in the Middle East forces airlines such as Emirates and Qatar …",CNA,India,Market Report,2026-03-07T18:37:42.342144Z
b55609d130db1ae42ced40b8a481bad8,Danny Bell: Dance Power Players Executive of the Year Interview,http://www.billboard.com/pro/danny-bell-dance-power-players-executive-of-the-year/,Katie Bain,2026-03-06T17:03:23Z,cargo shipping,"Goldenvoice's Danny Bell, Billboard's 2025 Dance Power Players executive of the year, on the beginnings — and upkeep — for dance festival Portola.",Billboard,Unknown,Analysis/Opinion,2026-03-07T18:37:42.342180Z
b3a4a1e193dd474b2e84b4e5721b484b,Lee Men's Extreme Motion Carolina Cargo Short (Various Colors) $14.52 + F/S w/ Prime or on Orders $35+ (1 replies),https://slickdeals.net/f/19278132-lee-men-s-extreme-motion-carolina-cargo-short-various-colors-14-52-f-s-w-prime-or-on-orders-35,ppxyz1 | Staff,2026-03-06T16:51:19Z,cargo shipping,"Amazon [amazon.com] has Lee Men's Extreme Motion Carolina Cargo Short (Various Colors & Sizes) for $14.52. Shipping is free with Prime or on $35+ orders.

Note: Available sizes may vary by co",Slickdeals.net,Unknown,News,2026-03-07T18:37:42.342221Z
5b2c3853c11b33f7a5561e99359a0776,Pineapples feel the pinch,https://www.thestar.com.my/news/nation/2026/03/07/pineapples-feel-the-pinch,MOHD FARHAAN SHAH,2026-03-06T16:00:00Z,cargo shipping,JOHOR BARU: The ongoing conflict in Iran has begun affecting the export of Malaysian pineapples to the Middle East as shipping routes get disrupted while logistics costs rise. Read full story,The Star Online,Unknown,News,2026-03-07T18:37:42.342297Z
