article_id,title,link,creator,pubdate,category,description,source,country,article_type,scrape_timestamp
f5ca812bdf3d380caa04f5929dee4dd9,"120 early Cyber Monday deals, vetted by expert deal trackers",https://www.businessinsider.com/guides/deals/best-cyber-monday-deals-2025,"insider@insider.com (Brendan Griffiths,Sarah Saril,Steven Cohen)",2025-11-29T17:14:01Z,dry bulk shipping,"Early Cyber Monday deals are already available, and our product experts are keeping track of all the top tech, style, home, and kitchen discounts.",Business Insider,Unknown,News,2025-12-01T06:36:50.287200Z
85f928a8293f95054c681f87fd3dbd4f,"Globus Maritime Limited Reports Financial Results for the Third Quarter and Nine-Month Period Ended September 30, 2025",https://www.globenewswire.com/news-release/2025/11/28/3196455/0/en/Globus-Maritime-Limited-Reports-Financial-Results-for-the-Third-Quarter-and-Nine-Month-Period-Ended-September-30-2025.html,Globus Maritime Limited,2025-11-28T19:00:00Z,dry bulk shipping,"GLYFADA, Greece, Nov. 28, 2025 (GLOBE NEWSWIRE) -- Globus Maritime Limited (“Globus”, the “Company”, “we”, or “our”) (NASDAQ: GLBS), a dry bulk shipping company, today reported its unaudited consolidated financial results for the third quarter and nine-month …",GlobeNewswire,Greece,Market Report,2025-12-01T06:36:50.287470Z
92803d752499baf631b05e607d0880af,Cell Therapy Packaging Market Trends and Companies Data 2025-35,https://www.globenewswire.com/news-release/2025/11/28/3196296/0/en/Cell-Therapy-Packaging-Market-Trends-and-Companies-Data-2025-35.html,Precedence Research,2025-11-28T14:00:00Z,dry bulk shipping,"Based on insights from Towards Packaging, the global cell therapy packaging market will likely grow from USD 419.57 million in 2025 to around USD 1274.31 million by 2034, expanding at a CAGR of 11.75% over the 2025-2034 period. Based on insights from Towards …",GlobeNewswire,Global,Analysis/Opinion,2025-12-01T06:36:50.287514Z
c907b54896f492a269faa9961965c437,Safe Bulkers: Intensive fleet upgrade,https://www.naftemporiki.gr/english/2039643/safe-bulkers-intensive-fleet-upgrade/,Αλεξία Σωτηρίου,2025-11-28T07:56:15Z,dry bulk shipping,"In a period of increased uncertainty for the international dry bulk market, Safe Bulkers manages to maintain a steady pace and operational consistency.
The US-listed shipping company announced its financial…
Safe Bulkers: Intensive fleet upgrade - Η ΝΑΥΤΕΜΠΟΡ…",Naftemporiki.gr,Global,Market Report,2025-12-01T06:36:50.287559Z
e201f52562cce4b8db23cd36daaa615f,"Rice Paper Packaging Market Size, Trends, Value Chain & Trade Analysis 2025-2035",https://www.globenewswire.com/news-release/2025/11/27/3195765/0/en/Rice-Paper-Packaging-Market-Size-Trends-Value-Chain-Trade-Analysis-2025-2035.html,Precedence Research,2025-11-27T15:00:00Z,dry bulk shipping,"As detailed in the latest report by Towards Packaging, the global rice paper packaging market is forecast to grow from USD 177.29 billion in 2026 to about USD 324.58 billion by 2034, at a CAGR of 6.95% between 2025 and 2034. As detailed in the latest report b…",GlobeNewswire,Global,Analysis/Opinion,2025-12-01T06:36:50.287600Z
9958c49b21f81432781a1e08f544d7c9,Globus Maritime Sets Date for the Release of Third Quarter and Nine Months 2025 Results,https://www.globenewswire.com/news-release/2025/11/26/3195158/0/en/Globus-Maritime-Sets-Date-for-the-Release-of-Third-Quarter-and-Nine-Months-2025-Results.html,Globus Maritime Limited,2025-11-26T14:00:00Z,dry bulk shipping,"GLYFADA, Greece, Nov. 26, 2025 (GLOBE NEWSWIRE) -- Globus Maritime Limited (“Globus” or the “Company”) (NASDAQ: GLBS), a dry bulk shipping company, announced today that it will release financial results for the three-month and nine-month periods ended Septemb…",GlobeNewswire,Greece,News,2025-12-01T06:36:50.287651Z
8616ffceddf13fa0f94a3157e59c69c9,64 excellent Black Friday deals for mountain bikers,https://www.singletracks.com/?p=707452,Jeff Barber,2025-11-26T11:00:00Z,dry bulk shipping,"These Black Friday mountain bike deals offer serious savings on bikes, gear, and components for winter riding and early holiday shopping.
The article 64 excellent Black Friday deals for mountain bikers appeared first on Singletracks Mountain Bike News.",Singletracks.com,Unknown,News,2025-12-01T06:36:50.287693Z
210ceef01c42a156f644f1973e4fc4a9,"Androulakis’ silence on Tsipras’ book (a mystery, isn’t it?), the sales and the views, Vardis’ universal “in memoriam,” the latest about Pierr and the Eurogroup",https://en.protothema.gr/2025/11/26/androulakis-silence-on-tsipras-book-a-mystery-isnt-it-the-sales-and-the-views-vardis-universal-in-memoriam-the-latest-about-pierr-and-the-e/,Newsroom,2025-11-26T07:39:44Z,dry bulk shipping,"Shipping under pressure from green billions & the Turkish shipping companies in Greece
The post Androulakis’ silence on Tsipras’ book (a mystery, isn’t it?), the sales and the views, Vardis’ universal “in memoriam,” the latest about Pierr and the Eurogroup ap…",Protothema.gr,Turkey,Analysis/Opinion,2025-12-01T06:36:50.287740Z
2a7364e9e47f101ecd0f0c3ead5f9677,The best Black Friday deals on underwear and bras: Save up to 50% on some of the most comfortable styles in our top drawer,https://www.businessinsider.com/guides/deals/underwear-bras-black-friday-sales-deals-2025-11,insider@insider.com (Talia Ergas),2025-11-25T21:57:39Z,dry bulk shipping,"You don't have to wait for Black Friday to stock up on new underwear and bras. Find deals on comfortable thongs, wireless bras, and no-show hipsters.",Business Insider,Unknown,News,2025-12-01T06:36:50.287779Z
96e2b503a50823e28da3405cef81d20d,"Safe Bulkers, Inc. Reports Third Quarter 2025 Results and Declares Dividend on Common Stock",https://www.globenewswire.com/news-release/2025/11/25/3194716/0/en/Safe-Bulkers-Inc-Reports-Third-Quarter-2025-Results-and-Declares-Dividend-on-Common-Stock.html,"Safe Bulkers, Inc.",2025-11-25T21:05:00Z,dry bulk shipping,"MONACO, Nov. 25, 2025 (GLOBE NEWSWIRE) -- Safe Bulkers, Inc. (the ""Company"") (NYSE: SB), an international provider of marine drybulk transportation services, announced today its unaudited financial results for the three and nine-month periods ended September …",GlobeNewswire,Global,Market Report,2025-12-01T06:36:50.287829Z
f480baa78a3a3094682d93722b2b6666,Diana Shipping: 762-million-dollar offer for 85% of Genco shares,https://www.naftemporiki.gr/english/2038194/diana-shipping-762-million-dollar-offer-for-85-of-genco-shares/,Μιχάλης Ματσίγκος,2025-11-25T10:31:18Z,dry bulk shipping,"Diana Shipping aims to gain full control of Genco Shipping & Trading Limited, through a takeover of the company’s shares.
The Greek-owned company listed on the New York Stock Exchange…
Diana Shipping: 762-million-dollar offer for 85% of Genco shares - Η ΝΑΥΤΕ…",Naftemporiki.gr,Greece,Market Report,2025-12-01T06:36:50.287868Z
f7385af718f12801c74ba93ed4e31e31,Genco Shipping & Trading Confirms Receipt of a Non-Binding Indicative Proposal from Diana Shipping Inc.,https://www.globenewswire.com/news-release/2025/11/24/3193941/37397/en/Genco-Shipping-Trading-Confirms-Receipt-of-a-Non-Binding-Indicative-Proposal-from-Diana-Shipping-Inc.html,Genco Shipping & Trading Limited,2025-11-24T21:15:00Z,dry bulk shipping,No Shareholder Action Required at This Time No Shareholder Action Required at This Time,GlobeNewswire,Unknown,Market Report,2025-12-01T06:36:50.287899Z
0f2378a4c2018a4b2b443d99334c9da3,"Senior Executives in Dry Bulk, Container, Crude Tanker, Product Tanker, LNG, LPG Shipping to Present in Capital Link Webinar Series",https://www.globenewswire.com/news-release/2025/11/24/3193791/20326/en/Senior-Executives-in-Dry-Bulk-Container-Crude-Tanker-Product-Tanker-LNG-LPG-Shipping-to-Present-in-Capital-Link-Webinar-Series.html,Capital Link,2025-11-24T17:10:00Z,dry bulk shipping,"Join the Live Discussions on December 2nd, 10th, 11th, & 16th, 2025 Join the Live Discussions on December 2nd, 10th, 11th, & 16th, 2025",GlobeNewswire,Unknown,News,2025-12-01T06:36:50.287934Z
3a33f0c11f063cfe159d3b611cebd9b1,"Confectionery Packaging Market Trends, Trade and Regional Data (2025-2035)",https://www.globenewswire.com/news-release/2025/11/24/3193631/0/en/Confectionery-Packaging-Market-Trends-Trade-and-Regional-Data-2025-2035.html,Precedence Research,2025-11-24T15:00:00Z,dry bulk shipping,"Based on insights from Towards Packaging, the global confectionery packaging market will likely grow from USD 11.44 billion in 2025 to around USD 15.73 billion by 2034, expanding at a CAGR of 3.6% over the 2025-2034 period. Based on insights from Towards Pack…",GlobeNewswire,Global,Analysis/Opinion,2025-12-01T06:36:50.287975Z
388bfdd7b530a7d305cf8a78e9533de5,Icon Energy Corp. Announces Updates in Connection with the SEPA,https://www.globenewswire.com/news-release/2025/11/24/3193598/0/en/Icon-Energy-Corp-Announces-Updates-in-Connection-with-the-SEPA.html,Icon Energy Corp.,2025-11-24T14:28:00Z,dry bulk shipping,"ATHENS, Greece, Nov. 24, 2025 (GLOBE NEWSWIRE) -- Icon Energy Corp. (“Icon” or the “Company”) (Nasdaq: ICON), an international shipping company providing worldwide seaborne transportation services for dry bulk cargoes via its fleet of oceangoing vessels, anno…",GlobeNewswire,Greece,News,2025-12-01T06:36:50.288020Z
65c1a67b0f1360188e1313122eb4db76,Diana Shipping Inc. Announces Proposal to Acquire Remaining Shares of Genco Shipping & Trading Limited,https://www.globenewswire.com/news-release/2025/11/24/3193585/10065/en/Diana-Shipping-Inc-Announces-Proposal-to-Acquire-Remaining-Shares-of-Genco-Shipping-Trading-Limited.html,Diana Shipping Inc. c/o Diana Shipping Services S.A.,2025-11-24T14:15:00Z,dry bulk shipping,"ATHENS, Greece, Nov. 24, 2025 (GLOBE NEWSWIRE) -- Diana Shipping Inc. (NYSE: DSX) (“Diana” or the “Company”) announced that today it has submitted a letter to the Board of Directors of Genco Shipping & Trading Limited (NYSE: GNK) (“Genco”) setting forth a pro…",GlobeNewswire,Greece,Market Report,2025-12-01T06:36:50.288080Z
1b2df4d50f90008a37d862216bfc777a,Protesters arrested for blocking world's largest coal port,https://www.abc.net.au/news/2025-11-30/protesters-arrested-attempting-block-worlds-largest-coal-port/106083224,Courtney Yeandle and Nakita Jager,2025-11-30T05:41:56Z,bulk carrier,Police arrest more than 30 people in Newcastle Harbour for alleged marine-related offences during an anti-fossil fuel protest.,ABC News (AU),Australia,News,2025-12-01T06:36:50.631417Z
91ec62b0ab74b6786b9b4bb83b039624,Guinea’s giant iron ore project finally comes to life,https://www.sundaytimes.timeslive.co.za/business/news/2025-11-29-guineas-giant-iron-ore-project-finally-comes-to-life/,Caiphus Kgosana,2025-11-29T04:31:35Z,bulk carrier,Ambitious R341bn Simandou project set to transform West African nation’s economy,TimesLIVE,Unknown,News,2025-12-01T06:36:50.631474Z
06d63037d80cb9f0df1861f51c9fb41b,Las Vegas Grand Prix Delivers Result No One Could Have Predicted,https://www.forbes.com/sites/robreed/2025/11/28/las-vegas-grand-prix-delivers-result-no-one-could-have-predicted/,"Rob Reed, Contributor, 
 Rob Reed, Contributor
 https://www.forbes.com/sites/robreed/",2025-11-28T17:34:10Z,bulk carrier,"The Las Vegas Grand Prix is a party from start to finish: watch parties, clubs, after parties and private suite parties. But you don't actually need to attend the race",Forbes,Unknown,News,2025-12-01T06:36:50.631512Z
64c3030322180abbfa8e66963987c38f,Habs Seek to Extend Winning Streak vs. Vegas Golden Knights,https://sportsnaut.com/nhl/montreal-canadiens/montreal-canadiens-preview-vegas-texier-habs-debut/,Marc Dumont,2025-11-28T17:11:33Z,bulk carrier,"The Montreal Canadiens (12-7-3) will take on the Vegas Golden Knights (10-5-8), with the puck drop scheduled for 4:00 pm",Sportsnaut,Unknown,News,2025-12-01T06:36:50.631749Z
371deeb152b8dc2fc8c8f948d968f4ab,The $5 bill challenge: A low-effort way to grow your savings,https://finance.yahoo.com/personal-finance/banking/article/5-bill-challenge-140018194.html,Ivana Pino,2025-11-28T14:00:18Z,bulk carrier,"Learn how the $5 bill challenge helps you save money effortlessly. See how it works, how much you can save, and tips to make this simple savings hack...",Yahoo Entertainment,Unknown,News,2025-12-01T06:36:50.631782Z
ecbba3b3a2ee27a82020b540e73ca854,Diapers and discounts! The 60+ best Black Friday baby deals are here,https://nypost.com/shopping/best-black-friday-baby-deals-sales-2025/,Miska Salemann,2025-11-28T12:30:00Z,bulk carrier,Chase these deals like it's your toddler running down the snack isle.,New York Post,Unknown,News,2025-12-01T06:36:50.631809Z
0240453b7c59e8291f2a02230d97616d,India plans more incentives for aircraft leasing in GIFT City,https://economictimes.indiatimes.com/industry/transportation/airlines-/-aviation/india-plans-more-incentives-for-aircraft-leasing-in-gift-city/articleshow/125631361.cms,Bloomberg,2025-11-28T06:46:47Z,bulk carrier,"India plans to extend the tax holiday for aircraft leasing firms in GIFT City to 15 years, aiming to capture a larger share of the global market. This move seeks to make the financial hub more attractive to lessors, boosting India's presence in the $187 billi…",The Times of India,India,Market Report,2025-12-01T06:36:50.631833Z
79d91292446007eb7f888e65512a3134,Why the Samsung Galaxy S25 Ultra at its Black Friday price is basically unbeatable,https://www.zdnet.com/article/why-the-samsung-galaxy-s25-ultra-at-its-black-friday-price-is-basically-unbeatable/,Kerry Wan,2025-11-28T02:58:00Z,bulk carrier,"The slim design, enhanced processor, and Galaxy AI features make this year's Ultra flagship the best one yet. Right now, it's $400 off for Black Friday.",ZDNet,Unknown,News,2025-12-01T06:36:50.631868Z
85e14599c3c5ecae3e0dfea478646852,Samsung's S25 Ultra is $400 off - the Android phone I recommend most for Black Friday,https://www.zdnet.com/article/samsungs-s25-ultra-is-400-off-the-android-phone-i-recommend-most-for-black-friday/,Kerry Wan,2025-11-26T22:22:00Z,bulk carrier,"The slim design, enhanced processor, and Galaxy AI features make this year's Ultra flagship better than ever. Right now, it's $899 for Black Friday.",ZDNet,Unknown,News,2025-12-01T06:36:50.631905Z
59d4ecb12b5195b89871b1317c490567,Technological investments in the Thenamaris fleet,https://www.naftemporiki.gr/english/2038733/technological-investments-in-the-thenamaris-fleet/,Ελίζα Καραγιώργη,2025-11-26T12:03:16Z,bulk carrier,"Another important milestone for Thenamaris, owned by Nicolas Martinos, as the LNG carrier “Cool Ranger” completed the tanking and subcooler installation works (increasing the efficiency and safety of the cargo)…
Technological investments in the Thenamaris fle…",Naftemporiki.gr,Unknown,News,2025-12-01T06:36:50.631957Z
ea9baeb17f5d3d5594f5cc1a0418b20a,Development and optimization of Moxifloxacin solid lipid nanoparticles via double emulsion organic solvent free technique applying Box–Behnken experimental design,https://www.nature.com/articles/s41598-025-26860-x,"Esraa M. Elshazly, Mona G. Arafa, Samia A. Nour",2025-11-26T00:00:00Z,bulk carrier,Scientific Reports - Development and optimization of Moxifloxacin solid lipid nanoparticles via double emulsion organic solvent free technique applying Box–Behnken experimental design,Nature.com,Unknown,Market Report,2025-12-01T06:36:50.632006Z
c999d670f06556c3cac792b2e5372150,Seafarer: The Ship Sim Receives LNG & Bulk Update,https://bleedingcool.com/games/seafarer-the-ship-sim-receives-lng-bulk-update/,Gavin Sheehan,2025-11-25T21:12:03Z,bulk carrier,"Indie game developer Independent Arts Software and publisher Astragon Entertainment have a new udpate arriving this week for Seafarer: The Ship Sim. Since the game is in Early access, all of the updates they have on the way are essentially content that should…",Bleeding Cool News,Unknown,News,2025-12-01T06:36:50.632054Z
586dddea7d67d86248c8436a37575902,The Feel-Good Transportation Story of the Year Comes From the Last Place You Might Expect,https://slate.com/business/2025/11/pittsburgh-international-airport-us-airways-american-airlines.html,Alex Kirshner,2025-11-24T16:45:28Z,bulk carrier,"After US Airways left Pittsburgh high and dry, yinzers finally built an airport on their own terms—and it’s incredible.",Slate Magazine,Unknown,News,2025-12-01T06:36:50.632106Z
9de515f7c416c2a46397b6f474143165,"Vulnerability Summary for the Week of November 17, 2025",https://www.cisa.gov/news-events/bulletins/sb25-328,CISA,2025-11-24T14:22:14Z,bulk carrier,"<!--?xml version=""1.0"" standalone=""yes""??-->
High Vulnerabilities

<table>

<tr>
<th>PrimaryVendor -- Product</th>
<th>Description</th>
<th>Published</th>
<th>CVSS Score</th>
<th>Source Info</th>
<th>Patch Info</th>
</tr>



<tr>
<td>ABB--ABB Ability Edgeni…",Cisa.gov,Unknown,News,2025-12-01T06:36:50.632148Z
ec8452dd6e21d0bd6773bcb412be60d5,"Stocks in news: IndiGo, TCS, Tata Power, Kotak Bank, Adani Green",https://economictimes.indiatimes.com/markets/stocks/news/stocks-in-news-indigo-tcs-tata-power-kotak-bank-adani-green/articleshow/125528813.cms,Akash Podishetti,2025-11-24T01:13:41Z,bulk carrier,"Markets closed lower on Friday, with analysts suggesting a sustained move above 26,250 for the index. IndiGo will join the Sensex on December 22, while Karnataka Bank saw a bulk deal. Marico's digital brands crossed Rs 1,000 crore ARR, and Tata Power is acqui…",The Times of India,Unknown,Market Report,2025-12-01T06:36:50.632191Z
274f93629e5b8451a0403724233d6861,Electric container ships won’t work – but a fleet of auxiliary battery ships could clean up shipping,https://theconversation.com/electric-container-ships-wont-work-but-a-fleet-of-auxiliary-battery-ships-could-clean-up-shipping-266596,"Anthony Wiskich, Visiting Fellow in Economics, Australian National University; CSIRO",2025-11-27T19:08:23Z,panamax,Could container ships ever go electric? The best option might be a fleet of attendant battery vessels to power these giants directly.,The Conversation Africa,Unknown,News,2025-12-01T06:36:51.415654Z
826d92b792a8271aac15a59363a2e96a,Russian Tanker Reaches Venezuela After Evading U.S. Warship,https://oilprice.com/Latest-Energy-News/World-News/Russian-Tanker-Reaches-Venezuela-After-Evading-US-Warship.html,Alex Kimani,2025-11-24T18:05:39Z,panamax,"A sanctioned Russian shadow fleet tanker has reached Venezuela’s waters after evading a U.S. destroyer. Previously, Bloomberg reported the  sanctioned panamax carrier Seahorse unsuccessfully attempted to approach Venezuela three times, with the U.S. destroyer…",OilPrice.com,Russia,Market Report,2025-12-01T06:36:51.415736Z
10ed688e6cedb43250c0219ef2bfc722,"Australia climate change protest disrupts shipping at coal port, 21 arrested",https://www.thestar.com.my/news/world/2025/11/30/australia-climate-change-protest-disrupts-shipping-at-coal-port-21-arrested,The Star Online,2025-11-30T04:56:00Z,iron ore,"Nov 30 (Reuters) - A climate-change protest off Australia's east coast on Sunday disrupted operations at one of the country's biggest coal export ports, prompting 21 arrests, the second protest in two days to disrupt shipping at the Port of Newcastle. Read fu…",The Star Online,Australia,News,2025-12-01T06:36:52.516700Z
bf9c5284a26f64d38a57ab43fa286801,Almost $100 Billion Worth of Rare Earth Elements May Be Buried in The US,https://www.sciencealert.com/almost-100-billion-worth-of-rare-earth-elements-may-be-buried-in-the-us,Michelle Starr,2025-11-29T14:00:14Z,iron ore,The waste left over from spent fossil fuel may contain a treasure trove of rare-earth elements worth billions of dollars.,ScienceAlert,Unknown,News,2025-12-01T06:36:52.516746Z
6b1ae740eeb5b309ea1e82ddd1932137,"AfDB, EIB sign $275m deal to boost Mauritania’s mining rail infrastructure",https://www.ghanaweb.com/GhanaHomePage/business/AfDB-EIB-sign-275m-deal-to-boost-Mauritania-s-mining-rail-infrastructure-2011453,,2025-11-29T07:41:44Z,iron ore,"The African Development Bank (AfDB) and the European Investment Bank (EIB) have signed a landmark financing package of US$275 million to modernise and expand Mauritania’s strategic mining railway corridor, a move expected to significantly boost the...",GhanaWeb,Unknown,News,2025-12-01T06:36:52.516803Z
6d186c9a8a3c210173552b3ec24d2eed,“HULKS OF BLACK TURBINES…”,https://www.hilobrow.com/2025/11/29/hulks/,Lola Ridge,2025-11-29T05:03:26Z,iron ore,"""Mighty converters torn from their axes…""",Hilobrow.com,Unknown,News,2025-12-01T06:36:52.516833Z
8230e0b14fdb2d50d351e546be25ac4f,"PyroGenesis Announces Closing of Third Tranche of the Non-Brokered Private Placement for $904,083",https://www.globenewswire.com/news-release/2025/11/28/3196201/0/en/PyroGenesis-Announces-Closing-of-Third-Tranche-of-the-Non-Brokered-Private-Placement-for-904-083.html,PyroGenesis Inc.,2025-11-28T12:00:00Z,iron ore,"The private placement sold 14,185,969 units for gross proceeds of $5,226,083 and is now closed The private placement sold 14,185,969 units for gross proceeds of $5,226,083 and is now closed",GlobeNewswire,Unknown,News,2025-12-01T06:36:52.516949Z
adc06923bf279b2a81b4a4e78bb1487e,"Mineral security pivot: Steel ministry orders SAIL, NDMC to acquire critical assets abroad",https://www.livemint.com/industry/india-mineral-security-critical-minerals-india-11764312098187.html,"Dipali Banka, Abhishek Law",2025-11-28T09:14:06Z,iron ore,"The move highlights the Indian government’s strategic shift towards ensuring mineral security through direct ownership of mines and assets, and reducing reliance on foreign imports.",Livemint,India,News,2025-12-01T06:36:52.516976Z
4fc39b9086cddff0f2cd86884b8640ad,Iron ore royalties set to drop by billions but confidence remains,https://www.abc.net.au/news/2025-11-28/wa-iron-ore-royalties-forecast-down/106077818,Kelsey Reid,2025-11-28T09:02:51Z,iron ore,"Western Australia has long prospered off its hefty irone ore mining royalties, but new figures reveal that revenue may drop by billions.",ABC News (AU),Australia,News,2025-12-01T06:36:52.516992Z
cb16a3a667cf5f585166da52d597d566,‘Time to act now’: The push to develop Europe’s blockbuster rare earths discoveries,https://www.cnbc.com/2025/11/28/rare-earths-the-push-to-develop-europes-critical-mineral-discoveries.html,,2025-11-28T06:11:33Z,iron ore,"From an ‘invisible mine’ to a radical relocation, two mining companies at the heart of Europe's resource security push are taking very different approaches.",CNBC,Unknown,News,2025-12-01T06:36:52.517035Z
54e2c84981b5ba166cf376e2efc70ae0,"Vale Boosts Investor Payouts on Strong Output, Iron Ore Prices",https://biztoc.com/x/b878e14d9a51f52f,bloomberg.com,2025-11-28T00:15:04Z,iron ore,,Biztoc.com,Brazil,Market Report,2025-12-01T06:36:52.517047Z
96ee51aa1d46a9c16bc0e81827574189,Ancient storage of anomalous mercury isotope signatures in the Earth’s transition zone,https://www.nature.com/articles/s41467-025-66917-z,"Rong Xu, Runsheng Yin, William M. White, Michael Bizimis, Yue Cai, Junbo Zhang, Chunfei Chen, Zhendong Tian, Ting Ruan, Yibing Li, Ganglan Zhang, Liang Liu, Zhongjie Bai, Meifu Zhou, Yongsheng Liu",2025-11-28T00:00:00Z,iron ore,"Mercury isotopes in Northeast Asia intraplate basalts indicate that the EM1 mantle source contains recycled ancient terrigenous sediments stored in the mantle transition zone for over a billion years, recording long-term deep-Earth volatile cycling.",Nature.com,Unknown,News,2025-12-01T06:36:52.517111Z
70fa5e54a66081538aab7bb061503576,Modified porous ceramic catalysts derived from titanium-bearing blast furnace slag for efficient toluene oxidation,https://www.nature.com/articles/s41598-025-30080-8,"He Tao, Fanshu Kong, Jiahua Li, Shuaibo Huang, Zehua Wang, Shucheng Tian, Xueqing Li, Haiping Liu",2025-11-28T00:00:00Z,iron ore,Scientific Reports - Modified porous ceramic catalysts derived from titanium-bearing blast furnace slag for efficient toluene oxidation,Nature.com,Unknown,Market Report,2025-12-01T06:36:52.517150Z
914c84c4052f16f94171046efe5533fa,"Landmark Australia Environment Bill Passes Senate, Set to Be Law",https://financialpost.com/pmn/business-pmn/landmark-australia-environment-bill-passes-senate-set-to-be-law,Bloomberg News,2025-11-27T22:59:03Z,iron ore,Australia’s upper house of parliament has passed a landmark bill to overhaul the nation’s environmental laws after Prime Minister Anthony Albanese’s government struck a deal with the left-wing minority Greens party.,Financial Post,Australia,News,2025-12-01T06:36:52.517172Z
e08ab5c05d9f1e5695479cd31026e82d,Live: ASX to open lower as Wall St is closed,https://www.abc.net.au/news/2025-11-28/asx-markets-business-news-live-updates-28-november/106074700,Adelaide Miller,2025-11-27T20:37:56Z,iron ore,"The ASX 200 futures is pointing down ahead of the market's opening, with Wall Street closed for Thanksgiving. Follow the day's events and insights from our business reporters on the ABC News live markets blog.",ABC News (AU),Unknown,Analysis/Opinion,2025-12-01T06:36:52.517203Z
7a31bc4c877027dfa0f1a664e1d37919,China reportedly wants to do more deals in its own currency. Australia’s banks aren’t ready,https://theconversation.com/china-reportedly-wants-to-do-more-deals-in-its-own-currency-australias-banks-arent-ready-270671,"Wei Li, Lecturer, Business School, University of Sydney, Kathleen Walsh, Professor of Finance, University of Technology Sydney, Luke Deer, Casual Lecturer in Finance, University of Sydney",2025-11-27T19:08:12Z,iron ore,The US dollar still dominates trade for now. But new research suggests Australia’s banks are unprepared for a world where China’s currency plays a much larger role.,The Conversation Africa,China,Market Report,2025-12-01T06:36:52.517221Z
