article_id,title,link,creator,pubdate,category,description,source,country,article_type,scrape_timestamp
733641aa07e08b9902ee84abe3711787,'I don't care if negotiations with Iran are over': Trump dismisses Hormuz oil concerns,https://economictimes.indiatimes.com/news/defence/trump-shrugs-off-oil-concerns-amid-rising-tensions-with-iran-over-strait-of-hormuz/articleshow/131447145.cms,ET Online,2026-06-01T17:20:36Z,Red Sea shipping,US President Donald Trump stated he is unconcerned if talks with Iran end. He also shrugged off worries about oil prices even if Tehran blocks the Strait of Hormuz. Diplomatic efforts between Washington and Tehran appear to be faltering. Iran has halted messa…,The Times of India,Unknown,Market Report,2026-06-07T13:57:48.972128Z
c4763a5d72a639667a7fbb648e7e3cdb,MISSILES FLY,https://www.yahoo.com/news/politics/articles/iran-says-it-does-not-trust-us-as-trump-toughens-terms-123058406.html,"AFP teams in Tehran, Washington, Beirut, Jerusalem",2026-06-01T17:04:36Z,Red Sea shipping,"MISSILES FLY

 
 
 
 (Main headline, 5th story, link)

 

 

 
 Related stories:SUMMER OF WAR
IRAN THREATENS NEW STRIKES ON ISRAEL
CEASEFIRE COLLAPSES
OIL SURGES",Yahoo Entertainment,Unknown,News,2026-06-07T13:57:48.972160Z
b0bbc43c16531fb01ea7ca485370781e,Oil Soars After Report Says Iran Is Set to Halt Messages With US,https://financialpost.com/pmn/business-pmn/oil-soars-after-report-says-iran-is-set-to-halt-messages-with-us-2,Bloomberg News,2026-06-01T16:38:14Z,Red Sea shipping,"Oil climbed, erasing nearly all of last week’s losses, as signs that talks between Tehran and Washington have hit several stumbling blocks restored risk premium to prices.",Financial Post,Unknown,Market Report,2026-06-07T13:57:48.972253Z
a5aa2032e3ea6174f4d039163a06d099,Oil Soars After Report Says Iran Is Set to Halt Messages With US,https://financialpost.com/pmn/business-pmn/oil-soars-after-report-says-iran-is-set-to-halt-messages-with-us,Bloomberg News,2026-06-01T15:11:19Z,Red Sea shipping,"Oil surged, erasing nearly all of last week’s losses, after an Iranian report implied talks between Tehran and Washington to end the months-long war are unraveling.",Financial Post,Unknown,Market Report,2026-06-07T13:57:48.972365Z
e6a7e7805ce9a62f2ac8a651af97fbfa,"Iran halts indirect talks with US, threatens wider regional escalation",https://economictimes.indiatimes.com/news/international/world-news/iran-halts-indirect-talks-with-us-threatens-wider-regional-escalation/articleshow/131444434.cms,ET Online,2026-06-01T14:03:21Z,Red Sea shipping,"Iran has halted communication with the US through mediators. This action follows attacks on Lebanon. Iran and its allies plan to block the Strait of Hormuz. They also intend to activate other fronts, including the Bab El Mandeb Strait. This is a response to p…",The Times of India,Unknown,News,2026-06-07T13:57:48.972492Z
7d18d8c14cffd52d386325caddc9c927,Select Accounts: 4-Pack 8.4 Fl Oz Red Bull Sea Blue Edition Energy Drink (Juneberry) $4.81 w/ S&S + Free Shipping w/ Prime or on $35+ (0 replies),https://slickdeals.net/f/19580952-select-accounts-4-pack-8-4-fl-oz-red-bull-sea-blue-edition-energy-drink-juneberry-4-81-w-s-s-free-shipping-w-prime-or-on-35,Rokket | Staff,2026-06-01T03:18:58Z,Red Sea shipping,Amazon [amazon.com] has 4-Pack 8.4 Fl Oz Red Bull Sea Blue Edition Energy Drink (Juneberry) on sale for $6.64 - $1.50 off when you 'clip' the coupon on product page [amazon.com] - 5% off whe,Slickdeals.net,Unknown,News,2026-06-07T13:57:48.972532Z
b4d0b3ddc4fea526b9cf73ed998138ee,The Iran War’s First 90 Days Upended Energy Markets,https://oilprice.com/Energy/Energy-General/The-Iran-Wars-First-90-Days-Upended-Energy-Markets.html,Tsvetana Paraskova,2026-05-31T21:00:00Z,Red Sea shipping,"The Iran war suddenly turned what had started as a year of oversupply in global oil and LNG markets into the worst oil and gas supply disruption in history. Three months after the U.S.-Israeli strikes on Iran began on February 28, the world has already lost 1…",OilPrice.com,Global,Market Report,2026-06-07T13:57:48.972633Z
0c4e5bc67de798a000b84caa00b84be5,Trump yet to make 'final determination' on Iran deal after Situation Room meeting,https://www.foxnews.com/live-news/trump-iran-war-peace-talks-hormuz-may-31,Anders Hagstrom,2026-05-31T10:32:34Z,Red Sea shipping,"President Donald Trump does not appear to have made a ""final determination"" on the Iran peace agreement as of early Sunday morning.",Fox News,Unknown,News,2026-06-07T13:57:48.972714Z
f80069727de7d5a348b09d5113a266f5,"Shivraj Chouhan to launch 'Khet Bachao Abhiyan' on June 1 as Govt reviews fertiliser, fuel stocks amid West Asia crisis",https://economictimes.indiatimes.com/industry/indl-goods/svs/chem-/-fertilisers/shivraj-chouhan-to-launch-khet-bachao-abhiyan-on-june-1-as-govt-reviews-fertiliser-fuel-stocks-amid-west-asia-crisis/articleshow/131420631.cms,ANI,2026-05-31T08:31:57Z,Red Sea shipping,"Union Agriculture Minister Shivraj Singh Chouhan launches Khet Bachao Abhiyan nationwide from June 1. The campaign aims to reduce excessive fertiliser use and promote balanced application. It will run until June 30, starting from Raisen, Madhya Pradesh. The m…",The Times of India,Unknown,Analysis/Opinion,2026-06-07T13:57:48.972761Z
8b6d9e70619a601288df6b2834e19fc6,Iran Fires Off Missiles In ‘Serious Escalation’ Toward Gulf Neighbors Amid Fragile Ceasefire,https://www.mediaite.com/media/news/iran-fires-off-missiles-in-serious-escalation-toward-gulf-neighbors-amid-fragile-ceasefire/,Zachary Leeman,2026-06-06T13:37:58Z,Strait of Hormuz,"Iran fired off multiple ballistic missiles and drones against its Gulf neighbors amid a fragile ceasefire deal and ongoing negotiations with the United States.
The post Iran Fires Off Missiles In ‘Serious Escalation’ Toward Gulf Neighbors Amid Fragile Ceasefi…",Mediaite,USA,News,2026-06-07T13:57:49.317084Z
d95e89a0fd8654b41743dd4932002883,Rising fuel prices to strain household budgets as West Asia crisis pushes crude above USD 100: Chief Economist Manoranjan Sharma,https://economictimes.indiatimes.com/news/economy/indicators/rising-fuel-prices-to-strain-household-budgets-as-west-asia-crisis-pushes-crude-above-usd-100-chief-economist-manoranjan-sharma/articleshow/131552661.cms,ANI,2026-06-06T13:34:00Z,Strait of Hormuz,"Fuel prices are climbing globally, impacting Indian households. The West Asia conflict is driving up crude oil costs, making higher fuel prices unavoidable. India, reliant on oil imports through the Strait of Hormuz, faces significant challenges. While the go…",The Times of India,India,Market Report,2026-06-07T13:57:49.317126Z
03e8c8273e13aad2187b6614f6a17eeb,Air raid sirens sound in Bahrain as Iranian missiles and drones head for Gulf neighbours,https://www.cbc.ca/news/world/bahrain-iran-drones-gulf-9.7226112,,2026-06-06T13:32:21Z,Strait of Hormuz,"Bahrain's government said on Saturday that Iran fired ballistic missiles and drones toward it and Kuwait, as the Iran war escalates.",CBC News,Unknown,News,2026-06-07T13:57:49.317166Z
19fe40e2e8a07fa19b79bcb03eaa58c0,"Middle East live: US military says Iran launched seven ballistic missiles at Kuwait, Bahrain - France 24",https://slashdot.org/firehose.pl?op=view&amp;id=183619604,feedfeeder,2026-06-06T12:52:29Z,Strait of Hormuz,"Middle East live: US military says Iran launched seven ballistic missiles at Kuwait, BahrainFrance 24 Live updates: Tehran targets Gulf neighbors after US attack on Iranian military sitesCNN Iran Fired Drones Toward Strait of Hormuz With U.S. Shooting Down at…",Slashdot.org,Unknown,News,2026-06-07T13:57:49.317221Z
45e29d58e4fefddb307aa28c3ba5de47,Iran Demands Billions in Deal Talks — U.S. Intercepts Missiles as Trump Envoys Meet Nuclear Experts,https://www.breitbart.com/politics/2026/06/06/iran-demands-billions-in-deal-talks-u-s-intercepts-missiles-as-trump-envoys-meet-nuclear-experts/,Joshua Klein,2026-06-06T12:38:57Z,Strait of Hormuz,"Iran is demanding the release of $24 billion in frozen assets as a condition for advancing a potential agreement with Washington, while U.S. forces intercepted Iranian missiles and drones targeting Kuwait, Bahrain, and maritime traffic near the Strait of Horm…",Breitbart News,Unknown,News,2026-06-07T13:57:49.317333Z
54290b5b34b97d4324e3fdae70ee6283,"US and Iran exchange strikes, threatening fragile ceasefire",https://www.politico.eu/article/us-iran-war-missile-strikes-undermining-fragile-ceasefire/,Clea Caulcutt,2026-06-06T12:26:43Z,Strait of Hormuz,"Navigation in the Strait of Hormuz, a vital waterway for global oil and gas deliveries, remains sharply reduced.",POLITICO.eu,Global,News,2026-06-07T13:57:49.317366Z
2c1442cb369bb041bf708b8092d7caff,FO Talks: Can Canada Learn from the Iran War and Develop a Self-Reliant Military Industry?,https://www.fairobserver.com/united-states/fo-talks-can-canada-learn-from-the-iran-war-and-develop-a-self-reliant-military-industry/,Christopher Coates,2026-06-06T12:21:57Z,Strait of Hormuz,"Fair Observer’s Video Producer Rohan Khattar Singh speaks with retired Lieutenant General Christopher Coates, former deputy commander of the North American Aerospace Defense Command (NORAD), about modern air power, defense industry and the limits of military …",Fair Observer,USA,News,2026-06-07T13:57:49.317399Z
9d2aedbfa856d35966ff33df7531d6ab,What caused US drone strikes near Hormuz? #world,https://alltoc.com/world/what-caused-us-drone-strikes-near-hormuz,AllToc,2026-06-06T12:03:25Z,Strait of Hormuz,What happened The U.S. announced it shot down Iranian drones and struck Iranian radar sites after intercepting attack drones launched toward the Strait of Hormuz and Gulf allies. Multiple reports in the set describe a sequence in which Iranian projectiles wer…,Alltoc.com,Unknown,Market Report,2026-06-07T13:57:49.317492Z
cd811a151c1de078a9894800af4ba651,CENTCOM: Iran Did Not Damage US 5th Fleet Headquarters In Bahrain,https://www.globalsecurity.org/military/library/news/2026/06/mil-260606-rferl04.htm,John Pike,2026-06-06T12:00:00Z,Strait of Hormuz,"CENTCOM, the US Central Command, has said that ""Iranian claims of damaging US 5th Fleet headquarters in Bahrain are false.""",Globalsecurity.org,Unknown,News,2026-06-07T13:57:49.317527Z
7f2d450b8ac0862dd37d19f1d15ef37b,US led over 100 vessels via Strait of Hormuz in May — NYT,https://www.globalsecurity.org/military/library/news/2026/06/mil-260606-azertac01.htm,John Pike,2026-06-06T12:00:00Z,Strait of Hormuz,"Last month, the US military helped coordinate the passage of more than 100 commercial vessels through the Strait of Hormuz, TASS reported citing The New York Times (NYT).",Globalsecurity.org,Unknown,Market Report,2026-06-07T13:57:49.317566Z
f06715dd1d52bea479b26ff4e70f3642,Putin says he saw 'no provocation' from Iran before US-Israeli war,https://www.globalsecurity.org/wmd/library/news/iran/2026/06/iran-260606-presstv09.htm,John Pike,2026-06-06T12:00:00Z,Strait of Hormuz,"Russian President Vladimir Putin has blasted the United States over the war of aggression against Iran, saying he saw no provocation from the Islamic Republic before the war began.",Globalsecurity.org,USA,News,2026-06-07T13:57:49.317586Z
0cd230b85046b82960ce84da3bae8ae7,Foreign Secretary completes landmark trip to China and India to bolster UK security,https://www.globalsecurity.org/wmd/library/news/uk/2026/uk-260606-ukfcdo01.htm,John Pike,2026-06-06T12:00:00Z,Strait of Hormuz,"The Foreign Secretary Yvette Cooper has concluded her visit to two key world powers, China and India.",Globalsecurity.org,China,News,2026-06-07T13:57:49.317601Z
0e4bce77df0a0f238321009c13770270,Lebanese Army Chief To Meet Pakistani Counterpart Amid Ongoing Negotiations Between US And Iran,https://www.globalsecurity.org/military/library/news/2026/06/mil-260606-rferl03.htm,John Pike,2026-06-06T12:00:00Z,Strait of Hormuz,"Lebanese army chief Rodolphe Haykal has departed for Pakistan, where he is set to meet his counterpart, Asim Munir, the country's military said. Citing a source familiar with the matter, AFP reported that the visit is linked to negotiations between the United…",Globalsecurity.org,Unknown,Market Report,2026-06-07T13:57:49.317651Z
5a9f922afb499b04cdee2a3727f74f23,Iran Strikes US Bases in Response to Attack on Qeshm and Sirik — Reports,https://www.globalsecurity.org/wmd/library/news/iran/2026/06/iran-260606-sputnik02.htm,John Pike,2026-06-06T12:00:00Z,Strait of Hormuz,"The IRGC said it targeted US air bases in Kuwait and key remaining facilities of the US Fifth Fleet in Bahrain in response to US military aggression, IRNA reported.",Globalsecurity.org,Unknown,Market Report,2026-06-07T13:57:49.317692Z
0106503f4285af8e09280e0c2d913cea,US Forces Intercept Six Iranian Ballistic Missiles — CENTCOM,https://www.globalsecurity.org/military/library/news/2026/06/mil-260606-sputnik02.htm,John Pike,2026-06-06T12:00:00Z,Strait of Hormuz,US Central Command claimed US forces intercepted multiple Iranian ballistic missiles and drones launched toward the Strait of Hormuz and neighboring Gulf states on June 5.,Globalsecurity.org,Unknown,News,2026-06-07T13:57:49.317733Z
bc2018ba08e3bd7b6c035037bd9315b0,Iranian Official Signals $24 Billion In Frozen Assets Key To Peace Talks,https://www.globalsecurity.org/wmd/library/news/iran/2026/06/iran-260606-rferl03.htm,John Pike,2026-06-06T12:00:00Z,Strait of Hormuz,A top adviser to Iran's supreme leader signaled that Tehran regaining access to $24 billion in assets frozen by Washington was a key demand in peace negotiations.,Globalsecurity.org,Unknown,News,2026-06-07T13:57:49.317771Z
c62afb92674653f5fde03aa0a27f87ea,Iran urges UN to stop repeated US violations of ceasefire after attack on radar facilities,https://www.globalsecurity.org/wmd/library/news/iran/2026/06/iran-260606-presstv04.htm,John Pike,2026-06-06T12:00:00Z,Strait of Hormuz,"Iran has strongly condemned a pre-dawn US drone strike on its radar facilities as a ""flagrant breach"" of the April ceasefire, reaffirming its ""legitimate and inherent"" right to self-defense while urging the United Nations to take action against repeated US vi…",Globalsecurity.org,Unknown,News,2026-06-07T13:57:49.317827Z
d375d62baedc6da766c9360839039cce,US approves $2bn sale of counter-drone systems to Kuwait,https://www.globalsecurity.org/military/library/news/2026/06/mil-260606-presstv07.htm,John Pike,2026-06-06T12:00:00Z,Strait of Hormuz,The US has authorized a potential $2 billion sale of counter-drone defense systems and associated military equipment to Kuwait in an agreement valued at approximately $2 billion.,Globalsecurity.org,Unknown,News,2026-06-07T13:57:49.317863Z
dd0a38613a7acde040122a6184e63eca,Leader's advisor warns against sacrificing Resistance for hollow promises,https://www.globalsecurity.org/wmd/library/news/iran/2026/06/iran-260606-presstv08.htm,John Pike,2026-06-06T12:00:00Z,Strait of Hormuz,"Ali Akbar Velayati, a senior advisor to the Leader of the Islamic Revolution, has warned against sacrificing the Resistance for hollow promises, saying sustainable peace grows from a balance of power rather than appeasing the enemy.",Globalsecurity.org,Unknown,News,2026-06-07T13:57:49.317911Z
b0c4ee1bd091aed3cb9fec58c22ee15f,U.S. strikes Iran's radar sites,https://www.globalsecurity.org/military/library/news/2026/06/mil-260606-pdo01.htm,John Pike,2026-06-06T11:37:16Z,Strait of Hormuz,"U.S. forces struck some of Iran's radar sites on Friday, the U.S. military said, in a fresh escalation that threatens the fragile ceasefire in the Middle East.",Globalsecurity.org,Unknown,News,2026-06-07T13:57:49.317946Z
7dd03c37a061d2ca08bb4146ec5013c5,"Trump must break negotiation deadlock, says adviser to Iranian supreme leader",https://www.globalsecurity.org/wmd/library/news/iran/2026/06/iran-260606-pdo01.htm,John Pike,2026-06-06T11:37:16Z,Strait of Hormuz,"A senior adviser to Iran's supreme leader has called on U.S. President Donald Trump to make decisions independently of Israel, stop the blockade in the Strait of Hormuz, and release Iran's frozen assets.",Globalsecurity.org,Unknown,News,2026-06-07T13:57:49.317987Z
e93228d936296518207c4d23cc7953b1,"IRGC pounds US bases in Kuwait, Bahrain after drone attacks on Iranian territory",https://www.globalsecurity.org/wmd/library/news/iran/2026/06/iran-260606-presstv01.htm,John Pike,2026-06-06T11:37:16Z,Strait of Hormuz,The Islamic Revolution Guards Corps (IRGC) says it has targeted two US air bases in Kuwait and the remaining facilities of the US Fifth Fleet in Bahrain in response to the latest US aggression.,Globalsecurity.org,Unknown,News,2026-06-07T13:57:49.318025Z
34786af26ec57546ac7d7c1a9e1f9f63,"US, Iran Exchange Military Strikes, Further Imperiling Shaky Cease-Fire",https://www.globalsecurity.org/military/library/news/2026/06/mil-260606-rferl02.htm,John Pike,2026-06-06T11:37:16Z,Strait of Hormuz,"The US military and Iranian forces exchanged tit-for-tat strikes early on June 6, further endangering the shaky cease-fire as peace negotiations appear to be at an impasse.",Globalsecurity.org,Unknown,News,2026-06-07T13:57:49.318063Z
6e3b6a7f44a9723132ee63c587c70dd7,Michael Hudson: Geopathology and the Econopathology Behind it,https://www.nakedcapitalism.com/2026/06/michael-hudson-geopathology-and-the-econopathology-behind-it.html,Yves Smith,2026-06-06T10:34:37Z,Strait of Hormuz,How pervasive behavioral disorders among what passes for elites are destructive not just to the social order but ultimately to them too.,Nakedcapitalism.com,Unknown,News,2026-06-07T13:57:49.318096Z
cb6ffbdb59fde0335eb560dc7e6fe0e7,U.S. military says it shot down Iranian drones launched toward Gulf allies - NPR,https://slashdot.org/firehose.pl?op=view&amp;id=183618840,feedfeeder,2026-06-06T10:32:45Z,Strait of Hormuz,"U.S. military says it shot down Iranian drones launched toward Gulf alliesNPR June 5, 2026 — Ceasefire in Lebanon frays, Iran warns of wider warCNN Air raid sirens blare in Bahrain as Iranian missiles and drones head for Gulf neighborsKCRA Iran Fired Drones T…",Slashdot.org,Unknown,News,2026-06-07T13:57:49.318149Z
176e68a662ff4b126b2e86e50b879cac,Arctic Takes on Special Significance Amid Hormuz Crisis - Rosneft CEO,https://sputnikglobe.com/20260606/arctic-takes-on-special-significance-amid-hormuz-crisis---rosneft-ceo-1124274816.html,Sputnik International,2026-06-06T10:29:51Z,Strait of Hormuz,"The Arctic plays a special role as a reliable logistics route amid the Strait of Hormuz crisis, Russian oil giant Rosneft CEO Igor Sechin said on Saturday.",Sputnikglobe.com,Russia,News,2026-06-07T13:57:49.318172Z
9ac1a11626ca030db0d58bf80d7cfd42,Foreign Secretary completes landmark trip to China and India to bolster UK security,https://www.gov.uk/government/news/foreign-secretary-completes-landmark-trip-to-china-and-india-to-bolster-uk-security,"Foreign, Commonwealth & Development Office",2026-06-06T09:58:16Z,Strait of Hormuz,"The Foreign Secretary Yvette Cooper has concluded her visit to two key world powers, China and India.",Www.gov.uk,China,News,2026-06-07T13:57:49.318209Z
d23d0b8aa47474a1553283047117db45,Iran targets Bahrain and Kuwait after renewed US strikes,https://economictimes.indiatimes.com/news/defence/iran-targets-bahrain-and-kuwait-after-renewed-us-strikes/articleshow/131548737.cms,AFP,2026-06-06T09:52:34Z,Strait of Hormuz,Iran launched missile attacks on Bahrain and Kuwait after renewed US strikes. This action has intensified regional conflict and threatened a fragile truce. Weeks of negotiations have failed to secure a peace deal. The Strait of Hormuz remains a critical globa…,The Times of India,Unknown,News,2026-06-07T13:57:49.318262Z
13b308cd3d8296b077e6d96cb1069bb3,Iran targets Bahrain and Kuwait after renewed US strikes,https://www.hurriyetdailynews.com/iran-targets-bahrain-and-kuwait-after-renewed-us-strikes-222966,hurriyetdailynews.com,2026-06-06T09:49:42Z,Strait of Hormuz,"Iran fired missiles at U.S. allies Bahrain and Kuwait on June 6, after renewed American strikes against it, drawing a furious response from the Gulf monarchies and further undermining a fragile truce.",Hurriyet Daily News,USA,News,2026-06-07T13:57:49.318302Z
39aa76972b7b1bba713e9e1691f78c8d,Air raid sirens in Bahrain as Iranian missiles and drones head for Gulf neighbors,https://abcnews.com/US/wireStory/air-raid-sirens-bahrain-iranian-missiles-drones-head-133642934,"SAMY MAGDY Associated Press, MICHELLE L. PRICE Associated Press",2026-06-06T09:36:30Z,Strait of Hormuz,Bahrain’s government says Iran fired ballistic missiles and drones towards it and Kuwait,Abcnews.com,Unknown,News,2026-06-07T13:57:49.318338Z
4a31b498e5b57de5744a460cbc149b79,Nobody can dictate terms to us: Putin defiant against US pressure over 'brotherly' India-Russia ties,https://economictimes.indiatimes.com/news/india/nobody-can-dictate-terms-to-us-putin-defiant-against-us-pressure-over-brotherly-india-russia-ties/articleshow/131547606.cms,ANI,2026-06-06T08:28:34Z,Strait of Hormuz,"Russian President Vladimir Putin lauded India's strong ties with Moscow. He described the relationship as ""brotherly"" and ""trust-based."" Putin praised India's talented workforce, especially in coding and software. He emphasized that Russia will always fulfill…",The Times of India,India,News,2026-06-07T13:57:49.318368Z
09db26b1b9ba3b9ba5ee03440d2c9def,Christians call for action against global hunger crisis,https://www.christiantoday.com/news/christians-call-for-action-against-global-hunger-crisis,Staff writer,2026-06-06T08:13:00Z,Strait of Hormuz,The Strait of Hormuz was also a passage for large quantities of agricultural fertiliser.,Christiantoday.com,Global,News,2026-06-07T13:57:49.318398Z
7beb8f564e4b0a6b0c703e9f566793f8,Air raid sirens in Bahrain as Iranian missiles and drones head for Gulf neighbors,https://www.yahoo.com/news/world/articles/air-raid-sirens-bahrain-iranian-081026174.html,SAMY MAGDY and MICHELLE L. PRICE,2026-06-06T08:10:26Z,Strait of Hormuz,Bahrain's government said Saturday that Iran fired ballistic missiles and drones towards it and Kuwait.  The foreign ministry said they had been intercepted...,Yahoo Entertainment,Unknown,News,2026-06-07T13:57:49.318439Z
928dc18db2202257444e98b6d04ada8d,US intercepts Iranian attacks as Israel continues to bomb Lebanon,https://www.aljazeera.com/news/2026/6/6/us-intercepts-iranian-attacks-as-israel-continues-to-bomb-lebanon,Al Jazeera Staff,2026-06-06T07:51:28Z,Strait of Hormuz,US Central Command said seven ballistic missiles were fired towards Kuwait and Bahrain.,Al Jazeera English,Unknown,News,2026-06-07T13:57:49.318470Z
49a6a88d5aae30d24836b7140647a1dc,China’s crude imports plunge to decade low in May as refiners drain stockpiles,https://cryptobriefing.com/china-crude-imports-decade-low-may/,Editorial Team,2026-06-06T07:39:17Z,Strait of Hormuz,"China's reduced crude imports may stabilize global oil prices despite Middle East tensions, altering competitive dynamics among exporters.
The post China’s crude imports plunge to decade low in May as refiners drain stockpiles appeared first on Crypto Briefin…",Crypto Briefing,China,Market Report,2026-06-07T13:57:49.318489Z
6d6ceac15caaa221e8207e52e90089f8,"Gulf countries targeted by Iran after exchange of fire with US, in latest threat to fragile ceasefire",https://www.irishtimes.com/world/middle-east/2026/06/06/gulf-countries-targeted-by-iran-after-exchange-of-fire-with-us-in-latest-threat-to-fragile-ceasefire/,,2026-06-06T07:32:17Z,Strait of Hormuz,Iran says it targeted ‘enemy bases’ in Gulf following US strikes on Sirik and Qeshm Island,The Irish Times,Unknown,News,2026-06-07T13:57:49.318528Z
4393dae5a92be0fca2b55fe1486aeec8,Kuwait and Bahrain targeted by Iran after exchange of fire with US,https://www.irishtimes.com/world/middle-east/2026/06/06/kuwait-and-bahrain-targeted-by-iran-after-exchange-of-fire-with-us/,,2026-06-06T07:32:17Z,Strait of Hormuz,Iran says it targeted ‘enemy bases’ in Gulf following US strikes on Sirik and Qeshm Island,The Irish Times,Unknown,News,2026-06-07T13:57:49.318561Z
35dd235c937a3c583a45ef067f99c6a6,Diet enacts ¥3 tril extra budget to ease energy cost impact,https://japantoday.com/category/politics/japan-parliament-enacts-3-tril.-yen-extra-budget-to-ease-energy-cost-impact,,2026-06-06T07:23:34Z,Strait of Hormuz,"The Diet on Friday enacted a 3.11 trillion yen supplementary budget for this fiscal year to ease the impact of rising energy costs, with the bill for extra spending clearing both of its chambers in just two days after submission. The extra budget, usually com…",Japan Today,Unknown,News,2026-06-07T13:57:49.318662Z
c5a8503e5d76900037eb3eba9f13fd38,"US, Iran trade strikes despite visas for World Cup footballers",https://www.channelnewsasia.com/world/us-iran-trade-strikes-despite-visas-world-cup-footballers-6166176,,2026-06-06T07:09:00Z,Strait of Hormuz,"The US said it struck radar sites in Iran after downing drones headed towards the Strait of Hormuz, while Iran said it had targeted ""enemy bases in the area"" with missiles.",CNA,Unknown,News,2026-06-07T13:57:49.318700Z
cbfbe7abc5274d0a3450d536e9cf9986,US and Iran trade strikes in latest Gulf flare-up,https://www.channelnewsasia.com/world/us-iran-trade-strikes-bahrain-kuwait-6166176,,2026-06-06T07:09:00Z,Strait of Hormuz,Iran’s Revolutionary Guard Corps says it targeted American bases in Kuwait and Bahrain in retaliation for US strikes,CNA,USA,News,2026-06-07T13:57:49.318721Z
e772e9daaef782d936cedfe7aed9c107,"US, Iran trade strikes despite visas for World Cup footballers",https://www.hurriyetdailynews.com/us-iran-trade-strikes-despite-visas-for-world-cup-footballers-222950,hurriyetdailynews.com,2026-06-06T06:42:33Z,Strait of Hormuz,"New attacks in the Middle East on Friday threatened to unravel an already fragile U.S.-Iran ceasefire, even as American officials confirmed that Tehran's football players had received visas for the World Cup.",Hurriyet Daily News,USA,News,2026-06-07T13:57:49.318791Z
