article_id,title,link,creator,pubdate,category,description,source,country,article_type,scrape_timestamp
8630324116d54feec921b1d985641dce,"Ukraine, Russia, and U.S. Meet For Peace Talks in Abu Dhabi",https://www.breitbart.com/europe/2026/01/23/ukraine-russia-and-u-s-meet-for-peace-talks-in-abu-dhabi/,Oliver JJ Lane,2026-01-23T13:58:53Z,coal demand,"Ukraine, Russia, and the United States are meeting for the first time under a new trilateral format to discuss possibilities for peace.
The post Ukraine, Russia, and U.S. Meet For Peace Talks in Abu Dhabi appeared first on Breitbart.",Breitbart News,USA,News,2026-01-26T18:39:42.036492Z
0f5c53539e4c028529661d45af19046f,Russian knowledge of Soviet-era energy systems has helped it to target Ukraine’s heating and homes,https://theconversation.com/russian-knowledge-of-soviet-era-energy-systems-has-helped-it-to-target-ukraines-heating-and-homes-274052,"Pauline Sophie Heinrichs, Lecturer in War Studies, Climate and Energy Security, King's College London",2026-01-23T13:44:58Z,coal demand,"Ukraine and Russia’s power grids used to be linked, leaving Russia with a deep understanding of how Kyiv’s energy systems work.",The Conversation Africa,Russia,News,2026-01-26T18:39:42.036519Z
20d16c2da7641b0d4c5dd56065bb0dec,Four AI Risk Trends To Watch For in 2026 | Opinion,https://www.newsweek.com/four-ai-risk-trends-to-watch-for-in-2026-opinion-11396628,Maha Hosain Aziz,2026-01-23T11:15:23Z,coal demand,Four AI Risk Trends To Watch For in 2026 | Opinionnewsweek.com,Newsweek,Unknown,Analysis/Opinion,2026-01-26T18:39:42.036542Z
0958f64d3934401669514c0b31ca21a2,Europe gets ‘green energy.’ These Southern towns get dirty air.,https://grist.org/health/europe-green-energy-wood-pellets-mississippi-louisiana/,Tristan Baurick,2026-01-23T09:45:00Z,coal demand,"In Louisiana and Mississippi, people living near mills producing wood pellets say that they’re getting sick.",Grist,Unknown,News,2026-01-26T18:39:42.036608Z
7b0ca5eb86ca668afad7d5dc28767150,Europe gets ‘green energy’. These Southern towns get dirty air.,https://grist.org/energy/europe-green-energy-wood-pellets-mississippi-louisiana/,Tristan Baurick,2026-01-23T09:45:00Z,coal demand,"In Louisiana and Mississippi, people living near mills producing wood pellets say that they’re getting sick.",Grist,Unknown,News,2026-01-26T18:39:42.036636Z
595e82f5d82a2df616402a2bfedb6864,Offshore wind project suspensions pose challenges for CIOs,https://www.techtarget.com/sustainability/feature/Offshore-wind-project-suspensions-pose-challenges-for-CIOs,Julie Hanson,2026-01-23T08:10:00Z,coal demand,"Trump administration offshore wind suspensions disrupt data center clean energy supply, raise power costs, threaten grid reliability, delay climate goals and affect CIO planning.",Techtarget.com,Unknown,News,2026-01-26T18:39:42.036670Z
b9fe807b485c5e2d91ef417262b2de7c,The Great AI Heist: How Artificial Intelligence Is Cannibalizing Consumer Tech and Creating a Controlled Digital Future,https://www.naturalnews.com/2026-01-23-how-artificial-intelligence-is-cannibalizing-consumer-tech.html,Mike Adams,2026-01-23T06:00:00Z,coal demand,"Pixels and Power: The GDDR7 Shortage as a Canary in the Coal Mine The global technology market is experiencing a seismic tremor, disguised as a mere supply chain hiccup. Across the board, consumers are facing empty shelves and skyrocketing prices for critical…",Naturalnews.com,Global,Market Report,2026-01-26T18:39:42.036715Z
f7623fd884af74b225cb91e481d50b3d,US Calls on Data Centers to Prepare Backup Power Ahead of Storm,https://financialpost.com/pmn/business-pmn/us-calls-on-data-centers-to-prepare-backup-power-ahead-of-storm,Bloomberg News,2026-01-23T01:33:45Z,coal demand,The US government asked the nation’s grid operators to make backup power available from facilities including data centers as a record-breaking winter storm threatens blackouts across the country.,Financial Post,Unknown,News,2026-01-26T18:39:42.036791Z
2bcb2e35bef2a9f837369db1ef437d54,Investments in Madhya Pradesh go beyond paperwork: CM Mohan Yadav in Davos,https://economictimes.indiatimes.com/news/india/investments-in-madhya-pradesh-go-beyond-paperwork-cm-mohan-yadav-in-davos/articleshow/127217618.cms,,2026-01-23T01:25:41Z,coal demand,"Davos: Madhya Pradesh wants to play the most important role in INDIA'S progress; the state govt already prepared its plan and is committed to it, said Chief Minister Mohan Yadav at the WEF summit.",The Times of India,India,News,2026-01-26T18:39:42.036812Z
cd58b85bbb45f15af768f8e24fdb0f73,First look: CSX Q4 earnings,https://finance.yahoo.com/news/first-look-csx-q4-earnings-212949279.html,Stuart Chirls,2026-01-22T21:29:49Z,coal demand,"CSX said severance expenses, lower merchandise freight and coal offset higher freight rates as earnings fell short of estimates for the fourth quarter. The...",Yahoo Entertainment,Unknown,Market Report,2026-01-26T18:39:42.036911Z
0b45e93dde5439b2dc661888f735e0a0,Which ASX 200 coal share is this fundie buying more of?,https://www.fool.com.au/2026/01/23/which-asx-200-coal-share-is-this-fundie-buying-more-of/,Bronwyn Allen,2026-01-22T19:30:00Z,coal demand,"And should you buy it, too? 
The post Which ASX 200 coal share is this fundie buying more of? appeared first on The Motley Fool Australia.",Motley Fool Australia,Australia,News,2026-01-26T18:39:42.036926Z
e9b79aad8549f50f621701bf890cfbd2,China birth slump hits a2 Milk shares as investors eye 2027 impact – Stock Takes,https://www.nzherald.co.nz/business/china-birth-slump-hits-a2-milk-shares-as-investors-eye-2027-impact-stock-takes/premium/4KCAYO3QUFA7HIMXU5GO3UJWL4/,Jamie Gray,2026-01-22T19:00:00Z,coal demand,"China's 2025 births fell to 7.92 million, the lowest level recorded since 1949.",New Zealand Herald,China,News,2026-01-26T18:39:42.036942Z
1957a500676e895ff96e114e5eda9c00,Kellblog Predictions for 2026,https://kellblog.com/2026/01/22/kellblog-predictions-for-2026/,Dave Kellogg,2026-01-22T16:01:18Z,coal demand,"Today, we continue my annual tradition of making ten predictions for the coming year while reviewing my ten predictions for the prior one. As always, I’ll remind you of some disclaimers:  (a) don’t view this as investment advice or anything … Continue reading…",Kellblog.com,Unknown,Analysis/Opinion,2026-01-26T18:39:42.036979Z
1b672c312347136e65a83ea4eb0d6211,Here’s what Mikie Sherrill’s state of emergency on utility costs will do for New Jersey,https://nypost.com/2026/01/22/us-news/heres-what-mikie-sherrills-state-of-emergency-on-utility-costs-will-do-for-new-jersey/,Ryan King,2026-01-22T15:23:40Z,coal demand,"Shortly after New Jersey Gov.-elect Mikie Sherrill (D) is sworn into office, she plans to declare a state of emergency to freeze utility costs and rapidly ramp up power generation.",New York Post,Unknown,News,2026-01-26T18:39:42.037023Z
22f5ed67cdafb43f3006f58ec703c663,The UK’s Electricity Crisis is Not Caused by “Poor Market and System Design”. It’s Caused By Net Zero,https://wattsupwiththat.com/2026/01/22/the-uks-electricity-crisis-is-not-caused-by-poor-market-and-system-design-its-caused-by-net-zero/,Guest Blogger,2026-01-22T14:00:00Z,coal demand,To blame “system design” while defending Net Zero is to rearrange the analytical furniture in a sinking ship. The UK’s electricity crisis is not a bug in an otherwise sound energy transition. It is the bill coming due for two decades of policy that elevated c…,Wattsupwiththat.com,Unknown,Market Report,2026-01-26T18:39:42.037069Z
34be5c401be57abd0b9bed55298aec7d,"In Europe, Wind and Solar Overtake Fossil Fuels",https://e360.yale.edu/digest/europe-wind-solar-fossil-fuels,,2026-01-22T13:50:00Z,coal demand,"Last year, for the first time, wind and solar supplied more power than fossil fuels to the E.U., according to a new analysis.Read more on E360 →",Yale.edu,Unknown,Analysis/Opinion,2026-01-26T18:39:42.037099Z
ded5b70a1495e42946640b7a993201cc,"Can China rely on domestic oil after Iran, Venezuela shocks?",https://www.dw.com/en/can-china-rely-on-domestic-oil-after-iran-venezuela-shocks/a-75516569,Nik Martin,2026-01-22T13:11:00Z,coal demand,"Donald Trump's moves against two key suppliers have revived debate over China’s fragile oil balance. With domestic output flat and oil fields aging, how much capacity — if any — exists to raise production?",DW (English),China,News,2026-01-26T18:39:42.037118Z
fd57bf9d17a41ecd165fbe77adc4c4a4,"Lest We Forget the Horrors: An Unending Catalog of Trump’s Cruelties, Collusions, Corruptions, and Crimes: December 2025: Atrocities 581- 637",https://www.mcsweeneys.net/articles/december-2025-atrocities-581-637,Emily Greenberg and Cliff Mayotte,2026-01-22T13:00:00Z,coal demand,"Early in President Trump’s first term, McSweeney’s editors began to catalog the head-spinning number of misdeeds coming from his administration. We called this list a collection of Trump’s cruelties, collusions, corruptions, and crimes, and it felt urgent to …",Mcsweeneys.net,Unknown,News,2026-01-26T18:39:42.037173Z
3dffc9a0e3fe7c80e3597e52db6782ec,Hydrogen Generation Market Trends and Expansion Forecast 2026-2031 - EU RFNBO Rules Drive Certified Green Hydrogen Demand; U.S. Section 45V Tax Credit Boosts Electrolyzer Production,https://www.globenewswire.com/news-release/2026/01/22/3223636/28124/en/Hydrogen-Generation-Market-Trends-and-Expansion-Forecast-2026-2031-EU-RFNBO-Rules-Drive-Certified-Green-Hydrogen-Demand-U-S-Section-45V-Tax-Credit-Boosts-Electrolyzer-Production.html,Research and Markets,2026-01-22T12:28:00Z,coal demand,"Dublin, Jan. 22, 2026 (GLOBE NEWSWIRE) -- The ""Hydrogen Generation - Market Share Analysis, Industry Trends & Statistics, Growth Forecasts (2026-2031)"" has been added to ResearchAndMarkets.com's offering.",GlobeNewswire,Unknown,Analysis/Opinion,2026-01-26T18:39:42.037209Z
e2c5ec439640b17e47aadb1c37bc7831,"Philippines Renewable Energy Market Intelligence Report 2026-2031: Trends, Investments, 34.3 Gigawatt Growth Forecast",https://www.globenewswire.com/news-release/2026/01/22/3223565/28124/en/Philippines-Renewable-Energy-Market-Intelligence-Report-2026-2031-Trends-Investments-34-3-Gigawatt-Growth-Forecast.html,Research and Markets,2026-01-22T11:34:00Z,coal demand,"The market offers key opportunities in solar and wind due to favorable policy shifts, decreasing equipment costs, and high demand from corporate PPAs The market offers key opportunities in solar and wind due to favorable policy shifts, decreasing equipment co…",GlobeNewswire,Unknown,Analysis/Opinion,2026-01-26T18:39:42.037253Z
8b247f1c2152082a1ba164195893459a,Stassis in Davos: Energy and technological transformation,https://www.naftemporiki.gr/english/2062233/stassis-in-davos-energy-and-technological-transformation/,Πέτρος Στεφανής,2026-01-22T11:16:41Z,coal demand,"The PPC Group’s strategy for the energy transition and the transformation of the company’s business model was presented by the Group’s President and CEO, George Stassis, at the “World Economic…
Stassis in Davos: Energy and technological transformation - Η ΝΑΥ…",Naftemporiki.gr,Unknown,News,2026-01-26T18:39:42.037301Z
283aec6839708f9211b669b10c235cec,India bets on small nuclear reactors to cut energy imports,https://www.thehindubusinessline.com/economy/india-bets-on-small-nuclear-reactors-to-cut-energy-imports/article70537096.ece,ANI,2026-01-22T10:06:02Z,coal demand,Shamika Ravi said small nuclear reactors would play a critical role in reducing India’s energy import bill while supporting sustainable growth under the 2047 vision,BusinessLine,India,News,2026-01-26T18:39:42.037324Z
463a870e222e5b969515829982767654,CIL dispatches record 375 mt coal via rail till Dec FY26,https://economictimes.indiatimes.com/industry/indl-goods/svs/metals-mining/cil-dispatches-record-375-mt-coal-via-rail-till-dec-fy26/articleshow/127129263.cms,PTI,2026-01-22T08:46:31Z,coal demand,"Coal India Limited has achieved a significant milestone, dispatching 375 million tonnes of coal via rail. All these dispatches underwent sampling by third-party agencies. This initiative enhances quality assurance and supply chain reliability. The company aim…",The Times of India,India,News,2026-01-26T18:39:42.037387Z
eaceedcd1a42a902153c214d243a183e,"Renewables muscle fossil fuels out of EU electricity market, says research",https://www.aljazeera.com/news/2026/1/22/renewables-muscle-fossil-fuels-out-of-eu-electricity-market-says-research,John T Psaropoulos,2026-01-22T07:46:50Z,coal demand,"Solar and wind power provided more electricity than coal and gas last year, leading a global trend, says Ember.",Al Jazeera English,Global,Market Report,2026-01-26T18:39:42.037416Z
e8d54fba05e78684b9a287e35eb90152,China’s bumper silver exports belie market fears of curbs,https://www.bloomberg.com/news/articles/2026-01-22/china-s-bumper-silver-exports-bely-market-fear-of-restrictions,Bloomberg,2026-01-22T07:40:21Z,coal demand,"China transitioned to license-only management from a quota system seven years ago, leading to silver exports rising in all but one year, primarily due to increased non-ferrous refining capacity where silver is a by-product",Bloomberg,China,Market Report,2026-01-26T18:39:42.037429Z
9f8542b48dde3a49292afc91142a16ba,Rising coal demand overshadows Southeast Asia's transition to renewable energy,https://abcnews.go.com/Business/wireStory/rising-coal-demand-overshadows-southeast-asias-transition-renewable-129444204,"ANIRUDDHA GHOSAL Associated Press, ANTON L. DELGADO Associated Press",2026-01-22T06:29:35Z,coal demand,"Southeast Asia’s need for coal is growing faster than anywhere else in the world, undermining progress on cutting carbon emissions that contribute to global warming",ABC News,Global,News,2026-01-26T18:39:42.037470Z
8216c5696ca0313f4e05355780721353,Rising coal demand overshadows Southeast Asia's transition to renewable energy,https://abcnews.go.com/International/wireStory/rising-coal-demand-overshadows-southeast-asias-transition-renewable-129444203,"ANIRUDDHA GHOSAL Associated Press, ANTON L. DELGADO Associated Press",2026-01-22T06:29:34Z,coal demand,"Southeast Asia’s need for coal is growing faster than anywhere else in the world, undermining progress on cutting carbon emissions that contribute to global warming",ABC News,Global,News,2026-01-26T18:39:42.037500Z
b1d5be0c795d2e349cf96d798ecf97b5,The Invisible Assault: Why HHS’s Long-Overdue Scrutiny of Wireless Radiation Can’t Come Soon Enough,https://www.naturalnews.com/2026-01-22-hhss-long-overdue-scrutiny-of-wireless-radiation.html,Mike Adams,2026-01-22T06:00:00Z,coal demand,"Introduction For decades, a silent plague has been woven into the fabric of modern life, emanating from the cellphones in our pockets, the Wi-Fi in our homes, and the cell towers that dot our horizons. The government and its captured regulatory bodies have lo…",Naturalnews.com,Unknown,News,2026-01-26T18:39:42.037551Z
22b6e98027fb654a310f0edf8e3c3897,Why India’s coal revival looks impossible to achieve,https://economictimes.indiatimes.com/industry/energy/power/why-indias-coal-revival-looks-impossible-to-achieve/articleshow/127078963.cms,Bloomberg,2026-01-22T01:16:15Z,coal demand,"India coal sector: Coal power is declining globally. China's coal use is falling. India faces challenges in building new coal plants. Renewables are set to meet India's future energy needs. This shift marks a significant change in global energy trends, with t…",The Times of India,China,News,2026-01-26T18:39:42.037619Z
8bf64b49bb873cbce7e5ba09cd410b15,Wind and solar overtook fossil fuels across Europe in 2025,http://electrek.co/2026/01/21/wind-and-solar-overtook-fossil-fuels-across-europe-in-2025/,Michelle Lewis,2026-01-21T23:01:00Z,coal demand,"Europe’s power mix hit a tipping point in 2025. Wind and solar generated more electricity across the European Union than fossil fuels for the first time last year, according to Ember’s newly released European Electricity Review. Wind and solar supplied a reco…",Electrek,Unknown,Analysis/Opinion,2026-01-26T18:39:42.037659Z
cedf1e5821037377abb84d0be26d11f1,Victoria's coal country set to become home of $10 billion data centre,https://www.abc.net.au/news/2026-01-22/keppel-data-centre-latrobe-valley/106123748,Danielle Pope,2026-01-21T21:45:17Z,coal demand,Victoria's east is set to become home to a $10 billion data centre that will support the technology necessary for artificial intelligence systems.,ABC News (AU),Unknown,News,2026-01-26T18:39:42.037693Z
a5f630cd9a44a0b8a742330f5ad60110,Natural Gas Prices Soar as Dangerous Freeze Takes Hold Across Massive Swath of the US,https://finance.yahoo.com/news/natural-gas-prices-soar-dangerous-211514211.html,"Julian Hast, Priscila Azevedo Rocha and Joe Wertz",2026-01-21T21:15:14Z,coal demand,"A storm will descend on the US starting Friday, plunging Texas into a deep freeze before threatening to dump snow on New York City and Boston.  The...",Yahoo Entertainment,Unknown,Market Report,2026-01-26T18:39:42.037723Z
ba398e1c933f4fa783e5f5e41c3486b8,"Govt unveils draft National Electricity Policy 2026 with focus on tariffs, discom health",https://economictimes.indiatimes.com/industry/energy/power/govt-unveils-draft-national-electricity-policy-2026-with-focus-on-tariffs-discom-health/articleshow/127033746.cms,ET Bureau,2026-01-21T18:32:14Z,coal demand,"The government has unveiled the draft National Electricity Policy, 2026, proposing strict tariff norms and structural reforms to improve discom finances. Aiming for Viksit Bharat, it targets significantly increased per capita electricity consumption by 2030 a…",The Times of India,Unknown,News,2026-01-26T18:39:42.037775Z
d5a9e97b2a6bf9690b065f6e073fb4db,Trump says Mark Zuckerberg showed him a ‘Manhattan-sized’ AI data center,https://fortune.com/2026/01/21/trump-says-mark-zuckerberg-showed-him-a-manhattan-sized-ai-data-center/,Eva Roytburg,2026-01-21T16:51:57Z,coal demand,Trump told Davos elites that Meta’s AI infrastructure shows why the U.S. must clear the way for tech giants to generate their own power.,Fortune,Unknown,News,2026-01-26T18:39:42.037813Z
0a4e599d7087f10e6509b9291653c2de,The EU is addicted to American economic punishment,https://www.rt.com/news/631269-eu-addict-economic-punishment/,RT,2026-01-21T16:46:02Z,coal demand,The bloc’s dependence on US natural gas is reportedly on its way to 80% Read Full Article at RT.com,RT,USA,Market Report,2026-01-26T18:39:42.037831Z
d316ee1a573f85bd33075e592ba13b31,"Vietnam Bituminous Coal Import Guide Report 2025: With Limited Domestic Production, Vietnam is a Major Importer, Presenting Opportunities for Global Suppliers",https://www.globenewswire.com/news-release/2026/01/21/3223059/28124/en/Vietnam-Bituminous-Coal-Import-Guide-Report-2025-With-Limited-Domestic-Production-Vietnam-is-a-Major-Importer-Presenting-Opportunities-for-Global-Suppliers.html,Research and Markets,2026-01-21T16:16:00Z,coal demand,"The rapid growth of Vietnam's thermal power sector and industrialization is driving increased demand for bituminous coal imports. With limited domestic production, Vietnam is a major importer, presenting opportunities for global suppliers. Political stability…",GlobeNewswire,Global,Market Report,2026-01-26T18:39:42.037881Z
afe357788a4e16ca06eb87730c496e13,"Vietnam Anthracite Import Guide 2025: Rising Demand from Power, Metallurgy, and Chemical Industries Due to Limited Domestic Production and High Import Dependence",https://www.globenewswire.com/news-release/2026/01/21/3223045/28124/en/Vietnam-Anthracite-Import-Guide-2025-Rising-Demand-from-Power-Metallurgy-and-Chemical-Industries-Due-to-Limited-Domestic-Production-and-High-Import-Dependence.html,Research and Markets,2026-01-21T16:07:00Z,coal demand,"Key opportunities in the Vietnamese anthracite market include meeting rising demand from power, metallurgy, and chemical industries due to limited domestic production and high import dependence. The ""Vietnam Anthracite Import Guide 2023-2025"" aids exporters w…",GlobeNewswire,Unknown,Market Report,2026-01-26T18:39:42.037930Z
217241db244f0cf1c0aac62e7ec23d40,US natural gas prices surge nearly 60% in just three days – what triggered the sudden gas price spike and will the US economy face high inflation again?,https://economictimes.indiatimes.com/news/international/us/us-natural-gas-prices-surge-nearly-60-in-just-three-days-what-triggered-the-sudden-gas-price-spike-and-will-the-us-economy-face-high-inflation-again/articleshow/127004712.cms,Piyush Shukla,2026-01-21T15:04:17Z,coal demand,"US natural gas futures have skyrocketed 60% in three days, hitting nearly $5.00/MMBtu. An intense Arctic blast is driving record heating demand across the Midwest and Northeast. Supply is tightening as extreme cold causes wellhead ""freeze-offs"" in Texas. This…",The Times of India,Unknown,Market Report,2026-01-26T18:39:42.037981Z
6acec22db435d3fee40a7ec351294d9f,Germany’s Coal Plants Return to Profit,https://oilprice.com/Latest-Energy-News/World-News/Germanys-Coal-Plants-Return-to-Profit.html,Tsvetana Paraskova,2026-01-21T14:00:00Z,coal demand,"The coal-fired power plants in Germany are profitable to run again amid surging electricity demand in a cold snap and a plunge in European carbon prices this week.  Coal plants running on lignite, the dirtiest coal, returned to profit after carbon prices slum…",OilPrice.com,Germany,Market Report,2026-01-26T18:39:42.038021Z
f618a1fe69460729f785b0250fce6cbb,Japan’s TEPCO Restarts Nuclear Reactor for First Time Since Fukushima Disaster in 2011,https://www.insurancejournal.com/news/international/2026/01/21/854998.htm,Admin,2026-01-21T13:44:06Z,coal demand,"Tokyo Electric Power Co. (TEPCO) Wednesday restarted a reactor at the Kashiwazaki-Kariwa nuclear power plant after inspections were completed, its first such move since the Fukushima disaster in 2011. TEPCO put online the 1.36 gigawatt (GW) reactor No. 6, one…",Insurance Journal,Japan,News,2026-01-26T18:39:42.038064Z
7ee99168e7b54313b9140ecad8bf16b8,"15 Years After Fukushima, a Big Nuclear Plant Is Back Online",https://www.newser.com/story/382312/15-years-after-fukushima-a-big-nuclear-plant-is-back-online.html,Jenn Gidman with Newser.AI,2026-01-21T12:51:00Z,coal demand,"Japan has flipped the switch on the world's biggest nuclear power plant again, and the move is stirring up old fears, along with new energy ambitions. The Tokyo Electric Power Company this week restarted Reactor No. 6 at the Kashiwazaki-Kariwa complex in Niig…",Newser,Japan,News,2026-01-26T18:39:42.038097Z
093a1cb06ec43e2a7e41cac6c183e2f6,Skeptical Science New Research for Week #4 2026,https://skepticalscience.com/new_research_2026_04.html,,2026-01-21T11:37:37Z,coal demand,"Open access notables

Mapping Europe’s rooftop photovoltaic potential with a building-level database, Kakoulaki et al., Nature Energy

Individual building-level approaches are needed to understand the full potential of rooftop photovoltaics (PV) at national a…",Skepticalscience.com,Unknown,News,2026-01-26T18:39:42.038143Z
74c32439c49eb2df64094215cc1b45c5,"Indonesia Automation and Control Systems Market Worth USD 194.57 Billion by 2031: Market Share Analysis, Industry Trends & Statistics, Segment Forecasts",https://www.globenewswire.com/news-release/2026/01/21/3222528/28124/en/Indonesia-Automation-and-Control-Systems-Market-Worth-USD-194-57-Billion-by-2031-Market-Share-Analysis-Industry-Trends-Statistics-Segment-Forecasts.html,Research and Markets,2026-01-21T10:32:00Z,coal demand,"Opportunities arise from government initiatives like Making Indonesia 4.0, increased power sector investments, and relaxed local-content rules, driving demand for predictive maintenance software and cloud-enabled platforms Opportunities arise from government …",GlobeNewswire,Indonesia,Analysis/Opinion,2026-01-26T18:39:42.038174Z
3d15875d0f7f44139d84676b5ec4ee22,The consequences of Trump’s war on climate in 7 charts,https://grist.org/politics/the-consequences-of-trumps-war-on-climate-in-7-charts/,Grist staff,2026-01-21T09:45:00Z,coal demand,"Seven snapshots reveal how climate rollbacks altered the trajectory of U.S. energy, environmental protection, and economic security.",Grist,Unknown,News,2026-01-26T18:39:42.038209Z
8202351092287e273d14828bd0497efe,Can you build data centers in a desert without draining the water supply? Utah is finding out.,https://grist.org/technology/utah-data-center-water-supply-meta-novva/,"Leia Larsen, Addy Baird",2026-01-21T09:30:00Z,coal demand,Governor Spencer Cox and other politicians are pushing for one of the driest states to become a haven for data centers.,Grist,Unknown,News,2026-01-26T18:39:42.038241Z
d951b96b8381eac2ede97091e9d0b0a6,"Railways told to rethink growth plan, get private capital and prepare for post-coal future",https://economictimes.indiatimes.com/industry/transportation/railways/railways-told-to-rethink-growth-plan-get-private-capital-and-prepare-for-post-coal-future/articleshow/126960076.cms,ET Online,2026-01-21T09:03:28Z,coal demand,"Indian Railways: The inter-ministerial panel's recommendations signaled a push for the Railways to rethink both how it builds and how it earns. Private capital, flexible contracting models and a sharper assessment of future freight demand are now being positi…",The Times of India,India,Market Report,2026-01-26T18:39:42.038265Z
d0ead394cc282d40f2676fe6f771513c,Germany’s Dirtiest Coal-Fired Power Plants Are Back in Profit,https://financialpost.com/pmn/business-pmn/germanys-dirtiest-coal-fired-power-plants-are-back-in-profit,Bloomberg News,2026-01-21T08:43:36Z,coal demand,Some of Germany’s most polluting power plants are back in profit — and ramping up output.,Financial Post,Germany,News,2026-01-26T18:39:42.038296Z
