article_id,title,link,creator,pubdate,category,description,source,country,article_type,scrape_timestamp
26059ecd9024071836ae695e6f6c2954,"Metal stocks drag Sensex lower despite budget optimism; Hindalco, Tata Steel lead declines",https://www.thehindubusinessline.com/markets/stock-markets/metal-stocks-drag-sensex-lower-despite-budget-optimism-hindalco-tata-steel-lead-declines/article70568865.ece,Anupama Ghosh,2026-01-30T04:56:39Z,coal demand,"Metal stocks bear the brunt of selling pressure, with Hindalco tumbling 5.25 per cent to ₹970.30, Tata Steel declining 4.11 per cent to ₹194.00, JSW Steel falling 1.98 per cent to ₹1,213.00, and Coal India dropping 2.53 per cent to ₹444.20",BusinessLine,India,News,2026-02-04T06:56:10.620980Z
b7ca69a38ae7248cbe920f5683dbbc68,"Understanding The New Energy Era: Global Trends, Risks And Certainties",https://www.forbes.com/sites/scottmontgomery/2026/01/29/understanding-the-new-energy-era-global-trends-risks-and-certainties/,"Scott Montgomery, Contributor, 
 Scott Montgomery, Contributor
 https://www.forbes.com/sites/scottmontgomery/",2026-01-30T03:25:09Z,coal demand,"A new energy era has begun, linked to the new multipolar geopolitics. Understand the new era is greatly aided by seven abiding""certainties,"" plus one about technology.",Forbes,Global,News,2026-02-04T06:56:10.621018Z
5f8d7ff43b0945e0239ff2501b777b8d,India sees green ammonia exports starting as early as 2028,https://www.bloomberg.com/news/articles/2026-01-29/india-sees-green-ammonia-exports-starting-as-early-as-2028,Bloomberg,2026-01-30T03:21:28Z,coal demand,"India pivoted to the export market to reach its green hydrogen goals, after major domestic users, such as oil refineries and fertilizer producers, showed reluctance to switch to the cleaner but costlier raw material",Bloomberg,India,Market Report,2026-02-04T06:56:10.621034Z
0835695d943f47262fa6b0d895273cf4,NZ in talks with US on Trump minerals deal,http://newsroom.co.nz/2026/01/30/nz-in-talks-with-us-on-trump-minerals-deal/,Fox Meyer,2026-01-30T03:15:41Z,coal demand,"The Government is negotiating with the US to provide access to our critical minerals, while a memo before the Waitangi Tribunal says a backdoor deal violates obligations to Māori",Newsroom,Unknown,News,2026-02-04T06:56:10.621073Z
61182565d5f16ca3e372956fac9b3396,Bitcoin Is The Money Of The AI-Powered Economy: CryptoQuant CEO,http://www.newsbtc.com/bitcoin-news/bitcoin-money-of-ai-economy-cryptoquant-ceo/,Jake Simmons,2026-01-30T03:00:08Z,coal demand,"CryptoQuant CEO Ki Young Ju revived the “Bitcoin equals energy” thesis on Wednesday, arguing that proof-of-work is becoming the settlement layer for an AI-driven economy where power, not narratives, is the binding constraint. In a post on X, Ju framed Bitcoin…",newsBTC,Unknown,News,2026-02-04T06:56:10.621122Z
5efd1c0e8f4b2e7699089cb3cf2ed301,CNX Resources Q4 Earnings Call Highlights,https://www.marketbeat.com/instant-alerts/cnx-resources-q4-earnings-call-highlights-2026-01-29/?utm_source=yahoofinance&amp;utm_medium=yahoofinance,MarketBeat,2026-01-30T02:39:17Z,coal demand,"CNX Resources (NYSE:CNX) executives used the company’s fourth-quarter 2025 Q&A call to discuss 2026 capital pacing, production expectations, early takeaways ...",MarketBeat,Unknown,News,2026-02-04T06:56:10.621160Z
d30ba7f75591f5cb567eaedf38894335,Colombia Turns to LNG as Domestic Gas Runs Out,https://oilprice.com/Energy/Energy-General/Colombia-Turns-to-LNG-as-Domestic-Gas-Runs-Out.html,Natalia Katona,2026-01-30T00:00:00Z,coal demand,"Colombia’s natural gas market is entering a period of sustained pressure as domestic production declines, new supply remains years away, and dependence on imported LNG deepens. The depletion of mature onshore fields, the freeze on new exploration licences, an…",OilPrice.com,Unknown,Market Report,2026-02-04T06:56:10.621203Z
c621f73d3a52e6159b7e309406aa481c,Scientific Breakthrough Could Double Rare Earth Elements Extraction,https://www.sciencealert.com/scientific-breakthrough-could-double-rare-earth-elements-extraction,David Nield,2026-01-29T22:58:18Z,coal demand,"Rare earth elements are used in a wide variety of modern technologies, from wind turbines to phones.",ScienceAlert,Unknown,News,2026-02-04T06:56:10.621234Z
7fc06f95ae9c93c307aee56209d39ccf,It’s a new heyday for gas thanks to data centers,https://www.theverge.com/news/870422/data-center-ai-gas-power-surge,Justine Calma,2026-01-29T22:14:51Z,coal demand,The US is now leading a global surge in new gas power plants being built in large part to satisfy growing energy demand for data centers. And more gas means more planet-heating pollution. Gas-fired power generation in development globally rose by 31 percent i…,The Verge,Global,News,2026-02-04T06:56:10.621285Z
de51af89b32af5c662b8f2b876beab59,Canada shipped a record share of oil to non-U.S. countries in November,https://www.theglobeandmail.com/business/economy/article-decoder-shipped-record-crude-oil-to-us-trade/,Jason Kirby,2026-01-29T21:36:09Z,coal demand,Canada shipped a record share of oil to non-U.S. countries in Novembertheglobeandmail.com,The Globe And Mail,Unknown,News,2026-02-04T06:56:10.621316Z
d41ae47d89120df760809de026cea456,A Nebraska utility says that its coal plant poses no ‘significant’ health threat,https://grist.org/climate-energy/a-nebraska-utility-says-that-its-coal-plant-poses-no-significant-health-threat/,Anila Yoganathan,2026-01-29T20:07:05Z,coal demand,"North Omaha residents, health experts, and two of the utility’s board members aren’t buying it.",Grist,Unknown,News,2026-02-04T06:56:10.621352Z
c73f0c9941b25f266aec2e27cbf56932,"Infant formula recall sends a chill, rain brings bumper profits for power companies – Stock Takes",https://www.nzherald.co.nz/business/infant-formula-recall-sends-a-chill-rain-brings-bumper-profits-for-power-companies-stock-takes/premium/DBG3HTGDA5BYZPUHVQDUHXWMUM/,Jamie Gray,2026-01-29T18:00:00Z,coal demand,Synlait Milk says none of its ingredients are linked to the overseas recall.,New Zealand Herald,Unknown,News,2026-02-04T06:56:10.621388Z
64a52b9092063bb91540efe67ada8017,Department of Energy Blocks Arizona Investment That Would Lower Electricity Bills,https://www.edf.org/media/department-energy-blocks-arizona-investment-would-lower-electricity-bills,cgreen,2026-01-29T17:49:25Z,coal demand,"The Department of Energy announced that it’s cancelling a planned $1.8 billion loan to support clean energy, battery and transmission projects for APS.",Environmental Defense Fund,Unknown,News,2026-02-04T06:56:10.621430Z
456e128362ea66bb5e3d0b114fbf096d,"Energy Edits Newsletter for January 29, 2026",https://www.thehindubusinessline.com/newsletter/bl-energy/energy-edits-newsletter-for-january-29-2026/article70567337.ece,Richa Mishra,2026-01-29T17:23:30Z,coal demand,"Stay updated with the latest insights on energy trends, events, and opportunities in the Energy Edits Newsletter.",BusinessLine,Unknown,Analysis/Opinion,2026-02-04T06:56:10.621459Z
81279808233fcfaaaaf9a3723370edb9,What Would It Take to Eliminate Storm-Related Power Outages?,https://newrepublic.com/post/205870/winter-storm-power-outages-weather,Heather Souvaine Horn,2026-01-29T16:31:40Z,coal demand,"Hundreds of thousands of households, mostly in the Southeast United States, were without power when a dangerous cold snap hit this week, just days after the previous weekend’s winter storm buffeted large swathes of the country. Officials in several of the aff…",The New Republic,USA,News,2026-02-04T06:56:10.621487Z
c182c97e4c5feb3b8f92930a4b67c363,Hydraulic Fracturing Market Set for Robust Growth with 7.04% CAGR to 2031,https://www.globenewswire.com/news-release/2026/01/29/3228845/28124/en/Hydraulic-Fracturing-Market-Set-for-Robust-Growth-with-7-04-CAGR-to-2031.html,Research and Markets,2026-01-29T15:40:00Z,coal demand,"The hydraulic fracturing market offers growth opportunities through continued technology advancements, electrification, and automation, enhancing efficiency and reducing costs. Shale gas demand in North America, policy support in China and Argentina, and Asia…",GlobeNewswire,China,Market Report,2026-02-04T06:56:10.621501Z
a97801d5db5397c02778f93f58dc5c83,Economic Survey 2026 Highlights: GDP growth rate for FY2026-27 estimated at 6.8% - 7.2%,https://www.thehindubusinessline.com/economy/economic-survey-2026-highlights-budget-session-2026-27/article70562376.ece,Team BL,2026-01-29T15:09:23Z,coal demand,"Union Budget Session 2026, Economic Survey 2026 highlights: Find here all the live updates of the Economic Survey 2025-26 which will be tabled in the Parliament on January 29, 2026.",BusinessLine,Unknown,News,2026-02-04T06:56:10.621537Z
3aac3824ca4aabb8153d863410d9964a,Snowstorm could've sparked grid catastrophe if Biden climate policies weren't reversed: Energy dept,https://www.foxnews.com/politics/snowstorm-couldve-sparked-grid-catastrophe-biden-climate-policies-werent-reversed-energy-dept,,2026-01-29T14:55:19Z,coal demand,"The Trump administration averted power grid failure during weekend snowstorm by keeping coal plants online that Biden planned to close, the Energy Department says.",Fox News,Unknown,News,2026-02-04T06:56:10.621574Z
02550ce5bc1f14aed15620157ef19cea,Imagine There’s No NATO: Germany as a New Middle-Sized Military Power in an Anarchic International Order,https://www.fairobserver.com/region/europe/imagine-theres-no-nato-germany-as-a-new-middle-sized-military-power-in-an-anarchic-international-order/,Elliot Neaman,2026-01-29T14:14:05Z,coal demand,US President Donald Trump has done something no adversary of the United States ever managed: he has pitted the Atlantic alliance against itself. What was once assumed — a permanent American commitment to Europe’s security and to a liberal order it largely des…,Fair Observer,USA,News,2026-02-04T06:56:10.621606Z
1726b89cbb454c6dd724d10b550a6228,Kadant to Acquire voestalpine BÖHLER Profil,https://www.globenewswire.com/news-release/2026/01/29/3228558/0/en/Kadant-to-Acquire-voestalpine-B%C3%96HLER-Profil.html,Kadant Inc,2026-01-29T13:14:00Z,coal demand,"WESTFORD, Mass., Jan. 29, 2026 (GLOBE NEWSWIRE) -- Kadant Inc. (NYSE: KAI) has entered into a definitive agreement to acquire voestalpine BÖHLER Profil GmbH & Co KG (“voestalpine BÖHLER Profil”). The acquisition is expected to close in the first quarter of 20…",GlobeNewswire,Unknown,News,2026-02-04T06:56:10.621669Z
9304c311534b3c2fdbe59be55396d05b,Global Gas Engine Market Forecast to Surge to USD 9.47 Billion by 2031: Key Insights on Investment Opportunities and Growth Drivers,https://www.globenewswire.com/news-release/2026/01/29/3228449/28124/en/Global-Gas-Engine-Market-Forecast-to-Surge-to-USD-9-47-Billion-by-2031-Key-Insights-on-Investment-Opportunities-and-Growth-Drivers.html,Research and Markets,2026-01-29T12:17:00Z,coal demand,"The Global Gas Engine Market offers growth opportunities driven by the shift from coal to gas due to strict environmental policies. Demand is rising for decentralized, flexible energy networks and grid stabilization, with innovations in hydrogen-compatible en…",GlobeNewswire,Global,Analysis/Opinion,2026-02-04T06:56:10.621739Z
dcd7120d8e333a3e0c6f38e4bd76f039,Global Gas Engine Market Forecast to Surge to USD 9.47 Billion by 2031: Key Insights on Investment Opportunities and Growth Drivers,https://www.globenewswire.com/news-release/2026/01/29/3228448/28124/en/Global-Gas-Engine-Market-Forecast-to-Surge-to-USD-9-47-Billion-by-2031-Key-Insights-on-Investment-Opportunities-and-Growth-Drivers.html,Research and Markets,2026-01-29T12:17:00Z,coal demand,"The Global Gas Engine Market offers growth opportunities driven by the shift from coal to gas due to strict environmental policies. Demand is rising for decentralized, flexible energy networks and grid stabilization, with innovations in hydrogen-compatible en…",GlobeNewswire,Global,Analysis/Opinion,2026-02-04T06:56:10.621769Z
8541ac20cbc05793af659561bf56d882,Australia Hits New Renewable Milestone of Over 50%,https://www.insurancejournal.com/news/international/2026/01/29/856081.htm,Admin,2026-01-29T10:33:39Z,coal demand,"Australia hit a new clean energy milestone during the December quarter, even as power demand rose over 2.2% from a year earlier, the Australian Energy Market Operator (AEMO) said on Thursday. Gas-fired generation fell to its lowest level since 2000, …",Insurance Journal,Australia,Market Report,2026-02-04T06:56:10.621785Z
1db0fd0de36285aa57faea3b8e5a6f6c,Adani Power Q3 net profit declines 19% even as power sales edge up,https://www.thehindubusinessline.com/companies/adani-power-q3-net-profit-declines-19-even-as-power-sales-edge-up/article70564973.ece,BL Ahmedabad Bureau,2026-01-29T09:47:19Z,coal demand,"The net profit attributable to equity holders of the parent stood at ₹2,484 crore, compared with ₹3,057 crore in the corresponding quarter of FY25, the company said in a regulatory filing",BusinessLine,Unknown,News,2026-02-04T06:56:10.621830Z
f63648108da758bce4bd075e3da69035,Heating with air conditioning saves on cost and cuts CO2,https://www.dw.com/en/heating-air-conditioners-heat-pumps-energy-efficiency-climate/a-75623290,Gero Rueter,2026-01-29T09:19:00Z,coal demand,"From Japan to China and the US to Scandinavia, heating with air conditioning has long been standard practice. But now warming homes with AC is catching on in other parts of the world. It's a sweltering summer afternoon. You step indoors, switch on the air con…",DW (English),China,News,2026-02-04T06:56:10.621851Z
ba269c5b235dff61e528d885ac37e2f4,Skeptical Science New Research for Week #5 2026,https://skepticalscience.com/new_research_2026_05.html,,2026-01-29T08:10:15Z,coal demand,"Open access notables
Are Hibernators Toast? Global Climate Change and Prolonged Seasonal Hibernation, Dausmann & Cooper, Global Change Biology

This review examines the multifaceted implications of global climate change on mammalian hibernators, emphasizing p…",Skepticalscience.com,Global,Analysis/Opinion,2026-02-04T06:56:10.621892Z
7aa72f4ecde1403dac380a120190bc5b,Fossil Fuels are Doomed — and Trump can’t Save them,https://www.juancole.com/2026/01/fossil-fuels-doomed.html,The Conversation,2026-01-29T05:04:49Z,coal demand,"Replace fossil fuels with clean energy technologies such as solar, wind, electric vehicles and batteries. We are well on our way",Juancole.com,Unknown,News,2026-02-04T06:56:10.621956Z
9a0bb1283f5ff40bb9cf15d328f0bee2,NEWT GINGRICH: Picking Energy Winners And Losers Is How America Falls Behind,https://dailycaller.com/2026/01/28/opinion-picking-energy-winners-and-losers-is-how-america-falls-behind-newt-gingrich/,Newt Gingrich,2026-01-29T04:44:14Z,coal demand,President Donald Trump’s Tuesday speech in Iowa made one thing abundantly clear: it is urgent that we get American energy policy right.,The Daily Caller,USA,News,2026-02-04T06:56:10.621981Z
6e2f7ffc43ff4ebb2cea35ed4ae14ffd,U.S. Out of Paris Climate Agreement,https://wattsupwiththat.com/2026/01/28/u-s-out-of-paris-climate-agreement/,Guest Blogger,2026-01-29T02:00:00Z,coal demand,"Thanks to President Trump, the U.S. has officially escaped from the Paris Climate Agreement which undermined American values and priorities, wasted hard-earned taxpayer dollars, and stifled economic growth. This is another commonsense America First victory fo…",Wattsupwiththat.com,USA,News,2026-02-04T06:56:10.622010Z
48c8f369a62bdaf587afecabfb0885e4,Profile Theatre’s Tiger Style Delivers Great Comedy and Sharp Bite,https://www.portlandmercury.com/Theater/2026/01/28/48281572/profile-theatres-tiger-style-delivers-great-comedy-and-sharp-bite,John Rudoff,2026-01-29T02:00:00Z,coal demand,"Profile Theatre's Tiger Style is the best bargain in Portland theater.
 
 by John Rudoff
 
 
 
 Profile Theatre's Tiger Style is the best bargain to be found right now in Portland theater. You buy a ticket to a comedy and get—as a free bonus—a dazzling array …",The Portland Mercury,Unknown,News,2026-02-04T06:56:10.622061Z
ada3a115edcb5be161c7a4b59e798adb,Data Centers Are Driving a US Gas Boom,https://www.wired.com/story/data-centers-are-driving-a-us-gas-boom/,Molly Taft,2026-01-29T00:00:00Z,coal demand,"Gas projects in the US pipeline explicitly linked to data centers increased by almost 25 times over the past two years, according to new research from Global Energy Monitor.",Wired,Global,News,2026-02-04T06:56:10.622095Z
e52d2b7eb12622897e78b9ac77404b9c,Speciation and Partitioning: A Survey Study of Rare Earth Elements (REEs) in Coal Fly Ash,https://pubs.rsc.org/en/content/articlelanding/2026/em/d5em00857c,"Estefania Garcia, Yinghao Wen, Pan Liu, Yuanzhi Tang",2026-01-29T00:00:00Z,coal demand,"Environ. Sci.: Processes Impacts, 2026, Accepted ManuscriptDOI: 10.1039/D5EM00857C, PaperEstefania Garcia, Yinghao Wen, Pan Liu, Yuanzhi TangRare earth elements (REEs) are crucial for technological advancement in semiconductors, artificial intelligence develo…",Royal Society of Chemistry,Unknown,News,2026-02-04T06:56:10.622148Z
c813af698f52ad3bdb899301a8d61bc4,"Europe’s Wind Bet Meets a Cold, Hard Energy Lesson",https://oilprice.com/Alternative-Energy/Wind-Power/Europes-Wind-Bet-Meets-a-Cold-Hard-Energy-Lesson.html,Irina Slav,2026-01-28T22:00:00Z,coal demand,"Europe has been trying to reduce its reliance on imported energy for four years now. It has had partial success, notably through demand destruction resulting from excessive prices. This month, part of Europe doubled down on that plan just as the United States…",OilPrice.com,USA,Market Report,2026-02-04T06:56:10.622173Z
77162949d98d08ac6e9340c4ce3c0158,Michael Hudson and Vijay Prashad: How Hyper-Imperialism Shapes Global Conflict,https://www.nakedcapitalism.com/2026/02/michael-hudson-and-vijay-prashad-how-hyper-imperialism-shapes-global-conflict.html,Yves Smith,2026-02-02T14:55:21Z,grain exports,A rich discussion of how industrial capitalism evolved into imperialism and how its impulses and contradictions are creating more fractures.,Nakedcapitalism.com,Global,News,2026-02-04T06:56:11.132977Z
4d21eda668f340c8ae836659926eb31f,Russia-Sri Lanka Bilateral Ties. Participation in the Vladivostok-Chennai Maritime Corridor (VCMC)?,https://www.globalresearch.ca/sri-lanka-russia-bilateral-ties/5914400,Andrew Korybko,2026-02-02T14:12:42Z,grain exports,"Sri Lanka appears to be following neighboring India’s lead in wanting to scale real-sector trade across the Vladivostok-Chennai Maritime Corridor, expand energy cooperation, and host more military drills.

To read this article in the following languages, clic…",Globalresearch.ca,India,News,2026-02-04T06:56:11.133036Z
992be7a1a4891107265ee2178dfda610,Farmers consider leaving staple crops to rot following unexpected crisis: 'What am I supposed to do with 2.2 million pounds of [this]?',https://finance.yahoo.com/news/farmers-consider-leaving-staple-crops-233000127.html,Noah Jampol,2026-02-01T23:30:00Z,grain exports,"The financial prospects for farming remain bleak, and the appeal for newcomers to come in is waning.",Yahoo Entertainment,Unknown,News,2026-02-04T06:56:11.133074Z
768e9efe857bb10e59773aab47a38d8a,"Energy, exergy, and environmental performance of a solar dryer for orange slices across tray levels and thicknesses",https://www.nature.com/articles/s41598-025-23535-5,"Abdallah Elshawadfy Elwakeel, Awad Ali Tayoush Oraiath, Wajdi Aissa Mohammed Abdurraziq, András Székács, Omar Saeed, Mohamed Hamdy Eid, Mohammad S. AL-Harbi, Atef Fathy Ahmed, Aml Abubakr Tantawy",2026-01-31T00:00:00Z,grain exports,"This research introduces the development of an automated forced and natural solar dryer (AFNSD) equipped with a photovoltaic-powered IoT technology, temperature-responsive control system that seamlessly alternates between natural and forced convection to impr…",Nature.com,Unknown,News,2026-02-04T06:56:11.133133Z
a201e2a958459b0f1be52a179845605f,CSG and HDS Sign Key Documents for the Establishment of the Hellenic Ammunition Joint Venture in Lavrio,https://www.globenewswire.com/news-release/2026/01/30/3229670/0/en/CSG-and-HDS-Sign-Key-Documents-for-the-Establishment-of-the-Hellenic-Ammunition-Joint-Venture-in-Lavrio.html,Czechoslovak Group A.S.,2026-01-30T16:53:00Z,grain exports,CSG and the Greek state-owned company Hellenic Defence Systems S.A. (HDS/EAS) have today signed the key founding documents for the establishment of a joint venture focused on the production of large-calibre ammunition in Greece. The newly created joint ventur…,GlobeNewswire,Greece,News,2026-02-04T06:56:11.133186Z
2d17cec0307ecc6e7ff4ff25aa641f7e,"Tortilla Market Size to Worth USD 80.03 Billion by 2035, Driven by Growing Demand for Convenient and Flavorful Meal Solutions",https://www.globenewswire.com/news-release/2026/01/30/3229360/0/en/Tortilla-Market-Size-to-Worth-USD-80-03-Billion-by-2035-Driven-by-Growing-Demand-for-Convenient-and-Flavorful-Meal-Solutions.html,Precedence Research,2026-01-30T10:36:00Z,grain exports,"According to Towards FnB, the global tortilla market size is calculated at USD 50.28 billion in 2026 and is expected to reach USD 80.03 billion by 2035, expanding at a CAGR of 5.3% during the 2026 to 2035 forecast period. This growth reflects the increasing p…",GlobeNewswire,Global,Analysis/Opinion,2026-02-04T06:56:11.133234Z
04b21bd0cef83288e1f8cf12ba0aa377,Darwin Port deal 'true test' for Albanese as farmers fear more tariff pain,https://www.abc.net.au/news/2026-01-30/farmers-urge-careful-diplomacy-in-darwin-port-row-with-china/106288346,Jane Bardon,2026-01-30T07:17:07Z,grain exports,Industry groups that suffered three years of damaging Chinese trade tariffs on products including barley are appealing to the federal government to exercise careful diplomacy to defuse tensions with China over the ownership of Darwin Port.,ABC News (AU),China,News,2026-02-04T06:56:11.133254Z
428b2cc92852acdbacff1575c88e08e0,Budget 2026: A make-or-break moment awaits India’s farm policy,https://economictimes.indiatimes.com/news/economy/agriculture/budget-2026-india-agriculture-policy-india-us-trade-talks-farm-reforms-impact-a-make-or-break-moment-awaits-indias-farm-policy/articleshow/127792523.cms,ET Online,2026-01-30T06:56:34Z,grain exports,"Budget 2026 could mark a turning point for India’s agriculture policy as the sector sits at the centre of unresolved India–US trade tensions. With Prime Minister Narendra Modi underlining that farmer interests are non-negotiable, attention is on whether the b…",The Times of India,India,News,2026-02-04T06:56:11.133286Z
9fd4e6c5a4fd605183b680d41a912ebf,Russia and Central African Republic reaffirm close partnership,https://www.rt.com/africa/631701-russia-car-reaffirm-close-partnership/,RT,2026-01-29T11:00:24Z,grain exports,Russia and the Central African Republic have agreed to strengthen cooperation following President Touadera’s reelection Read Full Article at RT.com,RT,Russia,News,2026-02-04T06:56:11.133313Z
4f54c445de2648d9cb8843bb07cdcde8,Black Powder Market Report 2026-2030: Set to Reach $1.31 Billion by 2030 with a 5.4% CAGR,https://www.globenewswire.com/news-release/2026/01/29/3228341/28124/en/Black-Powder-Market-Report-2026-2030-Set-to-Reach-1-31-Billion-by-2030-with-a-5-4-CAGR.html,Research and Markets,2026-01-29T11:00:00Z,grain exports,"The black powder market is ripe with opportunities driven by growth in recreational shooting, historical reenactments, and pyrotechnics. Trends favor specialty powders and regional manufacturing advancements. The black powder market is ripe with opportunities…",GlobeNewswire,Unknown,Market Report,2026-02-04T06:56:11.133360Z
ff5e4881f657ada396817d0523205a7c,A trade deal between Canada and China infuriates America,https://blogs.lse.ac.uk/businessreview/2026/01/29/a-trade-deal-between-canada-and-china-infuriates-america/,Caroline Carter,2026-01-29T10:23:25Z,grain exports,"America is Canada’s largest trading partner; China is its second. Alexander Ayertey Odonkor explains how Canada is working on its economic relationship with China to protect against Donald Trump’s volatile tariff policies. And how America is responding, with …",Lse.ac.uk,China,Market Report,2026-02-04T06:56:11.133389Z
bfccc8539f50ff4a3fd24d0acfd4812e,Trump aide claims deal would pump American farm goods in India,https://economictimes.indiatimes.com/news/economy/foreign-trade/trump-aide-claims-deal-would-pump-american-farm-goods-in-india/articleshow/127875750.cms,ANI,2026-02-03T04:18:44Z,soybean exports,A new trade deal between the United States and India is set to boost American farm exports. US Secretary of Agriculture Brooke Rollins stated the agreement will open India's large market to US agricultural products. This move is expected to increase prices an…,The Times of India,India,Market Report,2026-02-04T06:56:11.573895Z
9a1037ddd4ca2d11592249d7741c3ba2,‘The Chinese have invaded us in terms of merchandise’: Mexico and Argentina lead Latin America’s struggles with flood of imports,https://fortune.com/2026/02/02/chinese-imports-latin-america-mexico-argentina/,"Chan Ho-Him, Isabel Debre, Nayara Batschke, Fabiola Sánchez, The Associated Press",2026-02-02T14:38:40Z,soybean exports,"Temu averaged 114 million monthly active users in Latin America in the first half of 2025, a 165% increase year-on-year from 2024, Sensor Tower estimates.",Fortune,China,Market Report,2026-02-04T06:56:11.573932Z
4ad7eec042fd1cb5d53589d47bffb7ec,Latin American countries push back against a flood of cheap Chinese goods,https://apnews.com/article/china-latin-america-trump-trade-e78ccd51a7f66099d84fda885d2907a3,Chan Ho-him,2026-02-02T06:03:30Z,soybean exports,"China is flooding Latin American markets with low-priced exports, especially autos and e-commerce goods. The surge in imports is a significant challenge for local manufacturers and some countries are fighting back to protect their own industries. Chinese e-co…",Associated Press,China,Market Report,2026-02-04T06:56:11.573950Z
