article_id,title,link,creator,pubdate,category,description,source,country,article_type,scrape_timestamp
d066eecaecab2255bb5be6fea10c08d5,"Gold, Silver Rate Today Live Updates: International gold prices edge down on renewed US-Iran tensions",https://timesofindia.indiatimes.com/business/india-business/gold-silver-rate-today-live-updates-18k-22-carat-24k-gold-price-10g-silver-cost-per-kg-mcx-comex-etf-stock-precious-metal-gold-prediction-city-wise-cost-latest-gold-news/liveblog/131474346.cms,The Times Of India,2026-06-03T02:30:57Z,grain exports,"Gold, Silver Rate Today Live Updates: International and domestic gold prices are seeing a volatile period as global geopolitical tensions and elevate",The Times of India,Global,Market Report,2026-06-06T08:35:37.815951Z
b6938964d1b59c43f2ddd7187571253a,Gold eases on stronger oil as fresh Mideast hostilities erupt,https://economictimes.indiatimes.com/markets/commodities/news/gold-eases-on-stronger-oil-as-fresh-mideast-hostilities-erupt/articleshow/131473989.cms,Reuters,2026-06-03T01:52:03Z,grain exports,"Gold prices dipped on Wednesday as escalating Middle East tensions fueled crude oil gains, intensifying inflation and interest rate hike concerns. Renewed Gulf hostilities and stalled diplomacy between Washington and Tehran contributed to the market's unease.…",The Times of India,Unknown,Market Report,2026-06-06T08:35:37.816034Z
b9f46a6e0c631b47a0b9fe3fe4c1f2a7,"Corn Starting Tuesday with Modest Weakness, Despite Lower Crop Ratings",https://www.barchart.com/story/news/2256887/corn-starting-tuesday-with-modest-weakness-despite-lower-crop-ratings,Austin Schroeder,2026-06-02T12:22:25Z,grain exports,"Corn price action is fractionally to 2 cents lower so far on Tuesday morning. Futures posted losses of 2 to 3 cents in the front months, with a few deferred ...",Barchart.com,Unknown,News,2026-06-06T08:35:37.816075Z
c804e4dfd333998027cd51b673315fdf,Farm profits to dive by 70 per cent as drought and costs bite,https://www.abc.net.au/news/2026-06-02/crop-production-down-as-farm-profits-take-a-big-hit/106745960,"David Claughton, Michael Condon, and Mark Bennett",2026-06-02T01:55:58Z,grain exports,"The ABARES report for the June quarter predicts national crop production will fall by more than 20 per cent, with profits down 70 per cent for broadacre farms.",ABC News (AU),Unknown,Market Report,2026-06-06T08:35:37.816111Z
a0752fbd228dfd3b71a3824a7af2364d,"Corn Pulls off Lows into the Monday Close, with Ratings Below Estimates",https://www.barchart.com/story/news/2245360/corn-pulls-off-lows-into-the-monday-close-with-ratings-below-estimates,Austin Schroeder,2026-06-01T22:24:02Z,grain exports,"Corn futures posted losses of 2 to 3 cents in the front months, with a few deferred contracts fractionally to 1 ½ cents higher. The CmdtyView national...",Barchart.com,Unknown,Analysis/Opinion,2026-06-06T08:35:37.816145Z
06a575292c5596f3a24817a94b073d1c,"How a 97-year-old letter found in a London, Ont., home reached its author's family",https://www.cbc.ca/news/canada/london/how-a-97-year-old-letter-found-in-a-london-ont-home-reached-its-author-s-family-9.7216039,,2026-05-31T09:00:00Z,grain exports,"A London, Ont., woman shares the journey of returning an old letter she found in her house through the help of social media and a local genealogist. CBC News spoke to her and the author's descendants to learn how this mystery was solved.",CBC News,UK,News,2026-06-06T08:35:37.816189Z
1634bc8142f47807f1340b712fd14577,Livestock industry demands 1.5 million tonnes soymeal imports amid price surge,https://economictimes.indiatimes.com/news/economy/foreign-trade/livestock-industry-demands-1-5-million-tonnes-soymeal-imports-amid-price-surge/articleshow/131515791.cms,Jayashree Bhosale,2026-06-04T18:59:50Z,soybean exports,India's livestock sector faces rising feed costs. Farmers are urging the government to permit soybean meal imports. Domestic prices have surged significantly. This increase impacts poultry farmers and squeezes profit margins. The soybean processing industry o…,The Times of India,India,Market Report,2026-06-06T08:35:38.077591Z
304392d44d896ab1c813dd4fea334364,"Soybeans Falling on Thursday, with Products Adding Some Weight",https://www.barchart.com/story/news/2309552/soybeans-falling-on-thursday-with-products-adding-some-weight,Austin Schroeder,2026-06-04T17:25:13Z,soybean exports,Soybeans are trading with 29 to 31 cents losses so far on Thursday. The cmdtyView national average Cash Bean price is down 30 1/4 cents at $10.64 1/4...,Barchart.com,Unknown,Analysis/Opinion,2026-06-06T08:35:38.077646Z
186a7d0f4ec5e069b036c5d97e556895,‘Radical and destructive policy agenda’: Iowa’s primary picks point ways to US midterms,https://www.irishtimes.com/world/us/2026/06/03/radical-and-destructive-policy-agenda-iowas-primary-picks-point-ways-to-us-midterms/,Keith Duggan,2026-06-03T06:44:38Z,soybean exports,"On a night when six states held primary elections, Iowa set the stage for a fascinating campaign ahead",The Irish Times,Unknown,News,2026-06-06T08:35:38.077762Z
4fdfb94fb747c64ec02fe1ad89c16872,Farmer Frustrations With Trump Spell Trouble for Iowa Republicans,https://finance.yahoo.com/economy/policy/articles/farmer-frustrations-trump-spell-trouble-104504876.html,Catherine Lucey and Skylar Woodhouse,2026-06-01T10:45:04Z,soybean exports,"(Bloomberg) -- After years in the political wilderness, Iowa Democrats are feeling a new sensation — hope.Most Read from BloombergUS Says Deals With Iran for...",Yahoo Entertainment,Unknown,News,2026-06-06T08:35:38.077875Z
7491a50ffba8c01c5fc855cd65ab473a,India-US trade negotiators to begin four-day talks on June 1,https://economictimes.indiatimes.com/news/economy/foreign-trade/india-us-trade-negotiators-to-begin-four-day-talks-on-june-1/articleshow/131421376.cms,ET Online,2026-05-31T09:56:27Z,soybean exports,India and the US are holding crucial trade talks in New Delhi. Chief negotiators will finalize details of an interim trade agreement. This pact aims to boost market access and facilitate trade. Both nations are committed to strengthening economic ties. The di…,The Times of India,India,Market Report,2026-06-06T08:35:38.077904Z
9af56044a825034d096c4fbcc6840ad0,Economic Digest: Nepal’s Business News in a Snap,https://english.khabarhub.com/2026/30/551489/,Khabarhub,2026-05-30T02:15:08Z,soybean exports,"KATHMANDU: Economic Digest presents a brief yet comprehensive roundup of major business developments in Nepal, delivered in clear and accessible summaries. The budget for fiscal year 2026/27 reflects the government’s attempt to balance fiscal discipline with …",Khabarhub.com,Unknown,News,2026-06-06T08:35:38.077982Z
c644c75f3b1127b31fd40eb8953556db,An Anarchist Defense of the Cuban Revolution,https://www.counterpunch.org/2026/06/05/an-anarchist-defense-of-the-cuban-revolution/,Nicky Reid,2026-06-05T05:22:45Z,wheat exports,"” a libertarian foreign policy program for America must be to call upon the United States to abandon its policy of global interventionism: to withdraw immediately and completely, militarily and politically, from Asia, Europe, Latin America, the Middle East, f…",CounterPunch,USA,News,2026-06-06T08:35:38.319578Z
99f463a5939e8f443ad39b58a61ec772,Pakistan Inflation Accelerates to 11.7% on Oil and Gas Import Shock,https://oilprice.com/Latest-Energy-News/World-News/Pakistan-Inflation-Accelerates-to-117-on-Oil-and-Gas-Import-Shock.html,Charles Kennedy,2026-06-01T16:30:00Z,wheat exports,"The surge in international oil and gas prices amid the Iran war hiked Pakistan's inflation to the highest level in two years as energy import costs ballooned. Pakistan's general inflation jumped to 11.7% in May from a year earlier, accelerating from 10.9% ann…",OilPrice.com,Global,Market Report,2026-06-06T08:35:38.319836Z
b8fae220a7f5e45941b0cbfed0178731,Wheat Holding higher on Monday AM Trade,https://www.barchart.com/story/news/2233682/wheat-holding-higher-on-monday-am-trade,Austin Schroeder,2026-06-01T12:31:59Z,wheat exports,Wheat is trading with Monday morning gains of 2 to 4 cents across most contracts. The wheat complex fell double digits across most contracts on Friday...,Barchart.com,Unknown,Market Report,2026-06-06T08:35:38.319876Z
4f188824e79e36a4c423838de7c05268,The US Ally That Figured Out China’s Gameplan Long Before Washington,https://dailycaller.com/2026/05/30/opinion-japan-china-strategy-james-carter-jacob-choe/,James Carter And Jacob Choe,2026-05-30T23:41:38Z,wheat exports,Washington has spent decades talking about the U.S.-Japan alliance in military terms.,The Daily Caller,China,News,2026-06-06T08:35:38.319953Z
659d3b9ff0110cf4c32b08184a6c7d86,Indonesia secures Swiss funding boost for OECD membership push,https://en.antaranews.com/news/418084/indonesia-secures-swiss-funding-boost-for-oecd-membership-push,"Bayu Saputra, Tegar Nurfitra",2026-06-05T06:46:07Z,fertilizer exports,Coordinating Minister for Economic Affairs Airlangga Hartarto revealed that Switzerland had agreed to provide 3 million euros to support Indonesia&rsquo;s ...,Antaranews.com,Indonesia,News,2026-06-06T08:35:38.560723Z
2618e42e2883fd25b32e656961900c0d,Israelâs War on Peace: How the World Pays for Netanyahuâs Vicious Agenda,https://www.naturalnews.com/2026-06-04-israels-war-on-peace-netanyahus-vicious-agenda.html,Mike Adams,2026-06-04T06:00:00Z,fertilizer exports,"A Global Crisis Engineered by One Regime There is a deliberate strategy unfolding before our eyes, and it is being orchestrated by a single regime determined to plunge the entire planet into chaos. I have watched for years as Israeli Prime Minister Benjamin N…",Naturalnews.com,Global,News,2026-06-06T08:35:38.561084Z
e7403e704bb6a8bcadf6e8226720a0eb,Faultlines in a New Epoch of Crisis,https://www.counterpunch.org/2026/06/04/faultlines-in-a-new-epoch-of-crisis/,Ashley Smith,2026-06-04T05:50:15Z,fertilizer exports,"We have entered a new epoch of global capitalism. It is characterized by crisis, imperial rivalry, authoritarian nationalism, and episodic, explosive resistance from below. The Trump administration’s brief year of misrule has brought all these to a head, part…",CounterPunch,Global,News,2026-06-06T08:35:38.561150Z
d05d33173b3c652de430e4e4610b5ee9,Strong farm cash flows drive tractor demand; registrations rise 11.6% in May,https://www.thehindubusinessline.com/economy/logistics/strong-farm-cash-flows-drive-tractor-demand-registrations-rise-116-in-may/article71058424.ece,Amit Vijay  Mohile,2026-06-04T04:46:27Z,fertilizer exports,"Strong rural cash flows, replacement demand and dealer restocking pushed India’s tractor registrations up 11.6% year-on-year to 81,776 units in May 2026, signalling continued resilience in the farm economy despite looming monsoon risks.",BusinessLine,India,News,2026-06-06T08:35:38.561186Z
0b8d440d410704897c5c2ab0799a7847,Japan's Rare Earths Island,https://newsonjapan.com/article/149509.php,News On Japan,2026-06-03T23:23:07Z,fertilizer exports,"The video explains how a tiny, remote Japanese island called Minami Torishima (Marcus Island) could become one of the most strategically important locations in the world due to enormous deposits of rare earth elements buried in deep-sea mud beneath the Pacifi…",Newsonjapan.com,Japan,News,2026-06-06T08:35:38.561229Z
82f14472c9c2d3ceca159f8da2913209,Iran Launches Deadly Attack on Kuwait’s Main Airport,http://foreignpolicy.com/2026/06/03/iran-attack-kuwait-airport-us-war-cease-fire-talks-oecd/,Alexandra Sharp,2026-06-03T20:38:14Z,fertilizer exports,Experts warn that continued strikes could jeopardize peace talks.,Foreign Policy,Unknown,News,2026-06-06T08:35:38.561270Z
55e9669247f823ac422a7ff3a88b1730,"Iran war threatens major food shortages in Africa, S&P warns",https://www.semafor.com/article/06/03/2026/iran-war-threatens-major-food-shortages-in-africa-sp-warns,Tiisetso Motsoeneng,2026-06-03T13:30:42Z,fertilizer exports,Key fuel and fertilizer exports have been all but blocked by disruption in the Strait of Hormuz.,Semafor.com,Unknown,News,2026-06-06T08:35:38.561308Z
f7def21a1c462c931be9dac699f98b8f,Ghana Raises Growth Forecast as Reform Gains Weather Iran Impact,https://financialpost.com/pmn/business-pmn/ghana-raises-growth-forecast-as-reform-gains-weather-iran-impact,Bloomberg News,2026-06-03T09:47:55Z,fertilizer exports,"Ghana’s economy is growing faster than expected as companies benefit from lower inflation and interest rates, with budget and foreign-exchange reforms helping offset the impact from the war in Iran, Finance Minister Cassiel Ato Forson said.",Financial Post,Unknown,Analysis/Opinion,2026-06-06T08:35:38.561363Z
22ae13e7f5372cb8c4dd474d212567d9,Aftermath: Something Is Going to Snap,http://prospect.org/2026/06/03/aftermath-something-is-going-to-snap-iran-strait-of-hormuz/,Ryan Cooper,2026-06-03T09:00:00Z,fertilizer exports,"So far, the closure of the Strait of Hormuz has not led to a major economic disaster. That won’t last forever.
The post Aftermath: Something Is Going to Snap appeared first on The American Prospect.",The American Prospect,USA,News,2026-06-06T08:35:38.561400Z
859159ad897f85a03d8cdec0ac6a2d4a,Ceasefire Uncertainty Remains the Biggest Driver for Oil Markets,https://oilprice.com/Energy/Energy-General/Ceasefire-Uncertainty-Remains-the-Biggest-Driver-for-Oil-Markets.html,Tom Kool,2026-06-02T15:30:00Z,fertilizer exports,"Iran is reviewing the latest U.S. ceasefire proposal, raising hopes of a truce extension and tempering oil prices as traders weigh the risk of renewed Middle East disruptions. Ukraine’s Refinery War Gives Russian Crude an Export Passport - Ukraine is inadvert…",OilPrice.com,Russia,Analysis/Opinion,2026-06-06T08:35:38.561429Z
709ca8c01b47388b395db71215cd850b,Why India Cannot Let the Rupee Float,https://thediplomat.com/2026/06/why-india-cannot-let-the-rupee-float/,Deepanshu Mohan,2026-06-02T12:48:00Z,fertilizer exports,"Imported inflation, fragile manufacturing, and unequal burdens complicate textbook arguments supporting unrestricted currency depreciation across India.",The Diplomat,India,News,2026-06-06T08:35:38.561452Z
8799358e0970c5b6319587b7ab364f2f,Trump's Cotton Bailout Is Another Sign His Tariffs Aren't Working,https://reason.com/2026/06/01/trumps-cotton-bailout-is-another-sign-his-tariffs-arent-working/,Tosin Akintola,2026-06-01T18:24:31Z,fertilizer exports,"The Great American Cotton Plan will shell out millions in taxpayer funds, continuing the Trump administration’s pattern of paying off industries harmed by the president’s economic policies.",Reason,USA,News,2026-06-06T08:35:38.561514Z
2a3f3167a01f7749080e7c4421f84fdf,Top 5 Commodities Impacted By The Iran War,https://oilprice.com/Energy/Energy-General/Top-5-Commodities-Impacted-By-The-Iran-War.html,Alex Kimani,2026-06-01T17:00:00Z,fertilizer exports,"The Middle East conflict has triggered sweeping, multi-commodity supply shocks, profoundly impacting global energy, petrochemicals, agriculture and shipping industries, among others. The disruption of shipping through the Strait of Hormuz--which handles nearl…",OilPrice.com,Global,News,2026-06-06T08:35:38.561571Z
5dee19f334be903beea0326c7bb97c51,Iran Says the Strait of Hormuz Will Stay Closed. What Happens to the US Economy Next?,https://www.investopedia.com/iran-war-strait-of-hormuz-whats-next-for-us-economy-11987790,Diccon Hyatt,2026-06-01T15:32:11Z,fertilizer exports,Is the U.S. economy facing major disruption or a minor challenge from oil supply shocks? Economists differ on how fuel shortages may impact growth and...,Investopedia,Unknown,News,2026-06-06T08:35:38.561612Z
2f26223c3b69b06492e8210287a604a7,The Energy Crisis Will Long Outlast the Iran War,http://foreignpolicy.com/2026/06/01/iran-war-hormuz-energy-crisis-how-long-last/,Keith Johnson,2026-06-01T09:30:00Z,fertilizer exports,The baked-in damage to oil and gas production will take months to undo.,Foreign Policy,Unknown,News,2026-06-06T08:35:38.561692Z
7f055a2af1896521ae140d30c8544446,"Hormuz Crisis hits Asia and Africa Hard, Spurs EV Buying",https://www.juancole.com/2026/06/hormuz-crisis-africa.html,Juan Cole,2026-06-01T04:15:55Z,fertilizer exports,The major city of Pune in Maharashtra (pop. 7 million) has seen angry rallies and demonstrations over high fuel prices,Juancole.com,Unknown,Market Report,2026-06-06T08:35:38.561726Z
18eeac913ad3951675ebbe02478c04f0,How to make green hydrogen viable in industry,https://www.thehindubusinessline.com/opinion/how-to-make-green-hydrogen-viable-in-industry/article71045472.ece,Amarendu Nandy & Goutam  Dalapati,2026-05-31T15:52:20Z,fertilizer exports,"In a situation of fuel crisis, policies that create long-term demand for green hydrogen and lower its delivered cost are vital",BusinessLine,Unknown,News,2026-06-06T08:35:38.561764Z
d276354fd0578f6b3803d1760b4cad5c,Oil exports through the Strait of Hormuz might not return to levels seen before the Iran war,https://www.cnbc.com/2026/05/30/oil-exports-through-hormuz-might-not-return-to-levels-before-iran-war.html,Spencer Kimball,2026-05-30T13:00:00Z,fertilizer exports,"Iran's blockade of the Strait of Hormuz has seriously challenged freedom of navigation in the sea lane, raising questions about the future.",CNBC,Unknown,News,2026-06-06T08:35:38.561808Z
35c198d9efe684f0f3a9454493f818aa,Trump defrosts relations with Europe’s last dictator Alexander Lukashenko,https://www.nbcnews.com/world/europe/trump-defrosts-relations-europes-last-dictator-alexander-lukashenko-rcna347500,Yuliya Talmazan,2026-05-30T09:57:54Z,fertilizer exports,"The man known as Europe’s last dictator may soon be coming in from the cold, as President Donald Trump helps him emerge from years of isolation",NBC News,Unknown,News,2026-06-06T08:35:38.561860Z
04acb0490f57adfc7148d369ed314e85,Not a minor issue! Andhra CM N Chandrababu Naidu raises Major Laterite Matter with Centre,https://economictimes.indiatimes.com/news/politics-and-nation/not-a-minor-issue-andhra-cm-n-chandrababu-naidu-raises-major-laterite-matter-with-centre/articleshow/131491000.cms,Nidhi Sharma,2026-06-03T18:37:54Z,bauxite,"Andhra Pradesh Chief Minister N Chandrababu Naidu has raised concerns over a recent Union government policy change. This change reclassifies laterite with over 20% aluminium as a major mineral, shifting it from state control to central auction rules. This hal…",The Times of India,Unknown,News,2026-06-06T08:35:38.836394Z
8b890b6207c15ef9b52af1143d89a652,"Little Country, Big Oil",http://prospect.org/2026/06/03/jun-2026-guyana-little-country-big-oil/,Naomi Bethune,2026-06-03T09:15:00Z,bauxite,"Guyana has emerged as an oil and gas powerhouse in recent years. How do U.S. and corporate interests complicate the country’s changing conditions?
The post Little Country, Big Oil appeared first on The American Prospect.",The American Prospect,USA,News,2026-06-06T08:35:38.836431Z
6c4f9bcdbabd014c808bde3591d33a01,Ukraine embassy flags 'serious concern' on Irish alumina exports,https://www.rte.ie/news/primetime/2026/0603/1576473-ukraine-embassy-flags-serious-concern-on-irish-alumina-exports/,Prime Time Team,2026-06-03T05:30:59Z,bauxite,"The Ukrainian Embassy in Ireland has issued a statement expressing ""serious concern"" regarding the continued export of alumina from Ireland to Russia, despite the Irish government saying it has launched an investigation related to such exports.",RTE,Russia,News,2026-06-06T08:35:38.836467Z
b24e5ff67f2dcdd310da214aa57a0780,Ukraine embassy flags 'serious concern' on Irish alumina exports,https://www.rte.ie/news/primetime/2026/0603/1576473-ukraine-embassy-irish-alumina-exports/,Prime Time Team,2026-06-03T05:30:59Z,bauxite,"The Ukrainian Embassy in Ireland has issued a statement expressing ""serious concern"" regarding the continued export of alumina from Ireland to Russia, despite the Irish Government saying it has launched an investigation related to such exports.",RTE,Russia,News,2026-06-06T08:35:38.836493Z
1bacc239ee6d69763a52f195b20f8b27,Why do male chimpanzees throw rocks at the same trees for more than a decade? We travelled to remote Guinea-Bissau to find out,https://theconversation.com/why-do-male-chimpanzees-throw-rocks-at-the-same-trees-for-more-than-a-decade-we-travelled-to-remote-guinea-bissau-to-find-out-279187,"Robyn Nakano, PhD candidate, Great Ape Behaviour (GAB) Lab, University of Victoria, Ammie Kalan, Assistant Professor, Department of Anthropology, University of Victoria",2026-06-02T16:50:13Z,bauxite,"To study accumulative stone throwing among wild chimpanzees, researchers hike deep into the savanna-woodland of Boé — a habitat increasingly threatened by industrial mining.",The Conversation Africa,Unknown,News,2026-06-06T08:35:38.836596Z
14c78e5e72829c5723785e00d2539077,Tribal Affairs Minister should be concerned: Congress flags protests in Odisha against bauxite mining project,https://economictimes.indiatimes.com/news/politics-and-nation/tribal-affairs-minister-should-be-concerned-congress-flags-protests-in-odisha-against-bauxite-mining-project/articleshow/131458971.cms,PTI,2026-06-02T08:05:56Z,bauxite,Villagers in Odisha's Koraput district are protesting bauxite mining by Kalinga Alumina Ltd. Congress alleges illegal diversion of forest land and fraudulent gram sabha approvals. Tribal Affairs Minister Jual Oram is urged to address these agitations occurrin…,The Times of India,Unknown,News,2026-06-06T08:35:38.836703Z
4d8d63a8026a0d6f19a1378f5f10cec4,Why Indonesia is Rebuilding Commodity Oversight,https://thediplomat.com/2026/06/why-indonesia-is-rebuilding-commodity-oversight/,Larry Luckey,2026-06-01T05:31:00Z,bauxite,"President Prabowo’s new initiative reflects a broader effort to address fragmented oversight, reduce commodity leakage, and strengthen his country's role in global supply chains.",The Diplomat,Indonesia,News,2026-06-06T08:35:38.836780Z
28e54d8e85e51568c405c2f2073e1fd0,Collateral damage: Aughinish Alumina and EU sanctions,https://www.rte.ie/news/2026/0530/1575983-aughinish-alumina-analysis/,Tony Connelly,2026-05-30T06:00:01Z,bauxite,"Given the spotlight on Aughinish Alumina, there were strong expectations that either the European Commission or member states would raise the prospect of some kind of sanctions, writes Tony Connelly.",RTE,Unknown,News,2026-06-06T08:35:38.836896Z
207a5ccd68b176497819a869180d5688,Collateral damage: Aughinish Alumina and EU sanctions,https://www.rte.ie/news/analysis-and-comment/2026/0530/1575983-aughinish-alumina-analysis/,Tony Connelly,2026-05-30T06:00:01Z,bauxite,"Given the spotlight on Aughinish Alumina, there were strong expectations that either the European Commission or member states would raise the prospect of some kind of sanctions, writes Tony Connelly.",RTE,Unknown,News,2026-06-06T08:35:38.836925Z
015db877a1664eaf19f81ec0542f8f66,"Silver's Deficit Decade Has Investors Hunting Grade — and One Cobalt Camp Junior Just Pulled 61,389 g/t Over 0.30 Metres",https://www.globenewswire.com/news-release/2026/06/04/3306854/0/en/Silver-s-Deficit-Decade-Has-Investors-Hunting-Grade-and-One-Cobalt-Camp-Junior-Just-Pulled-61-389-g-t-Over-0-30-Metres.html,Canada News Group,2026-06-04T13:15:00Z,nickel ore,Issued on behalf of Nord Precious Metals Mining Inc.  A direct extension of the Robinson high-grade silver vein system — plus a brand-new native silver...,GlobeNewswire,Unknown,News,2026-06-06T08:35:39.363002Z
e3166a71579c727fcc2fd96ddc9fcd16,HM Exploration Drills Massive Sulphide at Lewis Pilley’s Project,https://financialpost.com/globe-newswire/hm-exploration-drills-massive-sulphide-at-lewis-pilleys-project,GlobeNewswire,2026-06-04T12:34:03Z,nickel ore,"VANCOUVER, British Columbia, June 04, 2026 (GLOBE NEWSWIRE) — HM Exploration Corp. (“HM Exploration”, “HM” or the “Company”) (CSE:HM) (FSE:X5H) is pleased to provide an update on the first five holes of the phase one drilling program (the “Program”) at the Co…",Financial Post,UK,News,2026-06-06T08:35:39.363051Z
3cb7e11d823262be73245ea5eca0bdf2,"Mink Ventures Closes $881,920 in First Tranche of Non-Brokered Private Placement",https://financialpost.com/globe-newswire/mink-ventures-closes-881920-in-first-tranche-of-non-brokered-private-placement,GlobeNewswire,2026-06-02T19:56:23Z,nickel ore,"TORONTO, June 02, 2026 (GLOBE NEWSWIRE) — Mink Ventures Corporation (TSXV:MINK) (“Mink” or the “Company“) announces it has closed the first tranche of its non-brokered private placement (the “Offering’) announced on May 12, 2026. The Company has raised gross …",Financial Post,Unknown,News,2026-06-06T08:35:39.363148Z
2e302a69023600122c1dda7bae9ed035,Jaguar Uranium Finds Surface Uranium-Copper-Vanadium at Huemul; Assays Pending,https://www.prnewswire.com/news-releases/jaguar-uranium-finds-surface-uranium-copper-vanadium-at-huemul-assays-pending-302788337.html,,2026-06-02T11:45:00Z,nickel ore,"Visible Uranium-Copper-Vanadium mineralization observed at surface, consistent with historical head grades of 0.21% Uranium, 2.0% Copper and 0.11% Vanadium1 Potential 4-kilometre copper trend identified; historic mine dumps sampled for first time 200 rock sam…",PRNewswire,Unknown,News,2026-06-06T08:35:39.363197Z
a436d063eab4e5d3d916f3cc998a91a3,The World’s Mineral Powers Seize Their Moment,http://foreignpolicy.com/2026/06/02/critical-mineral-trade-trump-china-supply-chain-africa-latin-america/,Christina Lu,2026-06-02T10:00:39Z,nickel ore,Resource-rich countries haven’t always benefited from extraction. Can this time be different?,Foreign Policy,Unknown,News,2026-06-06T08:35:39.363274Z
